controversiality,parent_id,edited,author,score,retrieved_on,body,distinguished,downs,archived,author_flair_text,subreddit,id,removal_reason,gilded,ups,subreddit_id,link_id,name,score_hidden,author_flair_css_class,created_utc
0,t1_cquwsbd,False,Methalos,1,1432711439,"According to this [Article from the royal academy](http://www.rae.es/sites/default/files/Lexico_ingles_DRAE._Dario_Villanueva._ABC._Abril_2014.pdf&amp;sa=U&amp;ei=d3BDVffsIYPxmAXg8IDoBA&amp;ved=0CA0QFjAB&amp;sig2=FT_Dl6Y5OLM2vmk9OCXA2w&amp;usg=AFQjCNFqUTbGkfhv8qNiUEa4SHYqqzUI0g) the 2001 DRAE (the official Spanish dictionary) had only 71 but another dictionary listed 407. These numbers are likely both small due to institutional pressures to avoid recognising loanwords officially. These numbers however may be a good guide to the number of loanwords that have gained significant standing in the language (as opposed to bring used as a fad). From my experience in Spain I found that Anglicisms were rare, much rarer than I had been lead to believe. I wonder if they might be more common in latinoamérica. 

This article may be of use but I don't have access: Gerding, Constanza (2012). ""El préstamo en seis variedades de español: Un estudio en prensa escrita"". Revista signos (0035-0451), 45 (80), p. 5.

Likewise: De la Cruz Cabanillas, Isabel (2012). ""EMAIL OR CORREO ELECTRONICO? ANGLICISMS IN SPANISH"". Revista española de lingüística aplicada

And: Luis Oncins-Martinez, Jose (2012). ""Newly-coined Anglicisms in contemporary Spanish A corpus-based approach"" in ANGLICIZATION OF EUROPEAN LEXIS",,0,False,,asklinguistics,cquxp0e,,0,1,t5_2u7nj,t3_34g490,t1_cquxp0e,False,,1430484180
0,t3_34hrvq,False,Orgoth77,1,1432711448,"The points above are very valid. Europe had a very small land mass for the amount of nations there. Because of this groups had to band together into nations for security. Africa has an abundant land mass with quite favorable conditions in many countries this led to a more spread out tribal living situation. Once Europe divided up Africa  these new countries became formed of many different groups with different languages, customs, and had bitter rivalries in the past. Colonial rule dominated them by largely exporting their resources and in some cases such as the Belgian Congo had a very repressive rule. When WWII was over most European countries were pressured to give up their colonies. They did so but did not prepare the African countries for governing themselves. The British colonies did a bit better than the rest but most of the others just left taking all of the leadership with them. This led to many of the new governments collapse some even within weeks. Power struggles, corruption, and outside influence ravaged the countries for decades to come. Billions of aid was dumped into the nations but it was either misspent or stolen by the corrupt governments. In some ways they have suffered from a ""resource curse"" which led more developed nations to exploit them. Some nations are on the rise these days however. Botswana has the highest GDP largely because of their massive diamond mines and Ghana is second due to the gasoline. However, it is hard to develop or produce exports there because there is very little infrastructure. Roads and utilities are essential to growing but it's hard to progress in countries where the government can't afford to do anything. ",,0,False,,explainlikeimfive,cquxplr,,0,1,t5_2sokd,t3_34hrvq,t1_cquxplr,False,,1430484222
0,t1_cquxjjs,False,Worknewsacct,6,1432711458,Just picked up Skadoodle bro.  Incoming top NA team and challenger of top EU teams.,,0,False,,AskReddit,cquxqgr,,0,6,t5_2qh1i,t3_34fvry,t1_cquxqgr,False,,1430484283
0,t1_cquxnrf,False,Wizzad,0,1432711525,"I would hope they don't. Currently it doesn't seem relevant anyway as the ICC as no plans of trying George Bush or Barrack Obama.

However we would also assume that the US didn't have torture facilities in the European Union. This has recently been proven false as the CIA had torture facilities in Lithuania with the consent and support of the Lithuanian government.

Citizens of the EU have been kidnapped by the CIA and they have suffered horrendous crimes.

The US has shown it is not afraid to invade countries even if the majority of the world is opposed to it. On top of that we have top US officials saying ""Fuck the EU!"" when it comes to European concerns.",,0,False,,pics,cquxvkf,,0,0,t5_2qh0u,t3_34fldj,t1_cquxvkf,False,,1430484638
0,t1_cquxr7j,1430484874,J__rad,8,1432711526,"Yes, the Aztecs used them for toys and novelties. They weren't useful for shipping due to the harsh terrain of their empire. The Aztec empire was concentrated around a city build IN a man made lake on top of a mountain. They used boats to ship food and supply because they were more efficient.

Also remember that industrial technology is not the only measure of development. An equal comparison would be calling the Europeans undeveloped because they wallowed in feudalism while North American bands operated with a form of representative democracy. Some Mesoamerican civilizations also had far more advanced architecture and planning than anyone else.

In reality neither is a full measure of development. They are different forms of advancement that happen for different reasons.",,0,False,,explainlikeimfive,cquxvnh,,0,8,t5_2sokd,t3_34hrvq,t1_cquxvnh,False,,1430484645
1,t1_cquxt0l,False,neenerpants,-2,1432711553,"So is Europe, though. 

12% of current US citizens were born outside the US. 

11% of current UK citizens were born outside the UK. 

Just as an example. 

Both regions are 'melting pots', it's never been something that's unique to America.",,0,False,,leagueoflegends,cquxxqf,,0,-2,t5_2rfxx,t3_34i455,t1_cquxxqf,False,jinx,1430484794
0,t1_cqure7x,False,kuubi,1,1432711586,"Well, I can only speak from the EU-perspective as the 11. placed challenger atm and here Singed is just a bad pick^^",,0,False,,LoLTwistedTreeline,cquy0bd,,0,1,t5_2y1f3,t3_346odo,t1_cquy0bd,False,,1430484980
0,t1_cquvizp,False,TSM_Faker,34,1432711593,"Nah mate you're a little confused, that's the UoL list. Here's the CLG one: 

* WCG 2010
* Newegg Winter
* IEM VI Cologne
* ESL Premier League I
* ESL Premier League II
* ESL Pro Series IV
* MLG Raleigh 2011
* Corsair Vengeance Cup (CLG.EU)
* Dreamhack Summer 2012 (CLG.EU)
* Lone Star Clash 2 (CLG.EU)
",,0,False,,leagueoflegends,cquy0sv,,0,34,t5_2rfxx,t3_34i4gf,t1_cquy0sv,False,sona,1430485014
0,t1_cquy1y3,1430485925,shapshapboetie,0,1432711612,"I am going to leave this comment here to add other links which might interest you.

* [Africa is big](http://static02.mediaite.com/geekosystem/uploads/2010/10/true-size-of-africa.jpg). Map.

* [The Scramble for Africa](http://en.wikipedia.org/wiki/Scramble_for_Africa), about Euro colonization.

* [The Berlin Conference of 1884](http://en.wikipedia.org/wiki/Berlin_Conference#Consequences). With map. Through which Europeans agreed to split up the continent and its people, formed ""Westphalian-style"" nation-states. This system was imposed on the people of Africa. Europeans did the same thing elsewhere, such as the [Mideast and Levant in 1915](http://en.wikipedia.org/wiki/Sykes%E2%80%93Picot_Agreement).

* [Mineral resources in Africa](http://www.economist.com/node/21547285). With map. And issue of taxes/ nationalization.",,0,False,,explainlikeimfive,cquy28e,,0,0,t5_2sokd,t3_34hrvq,t1_cquy28e,False,,1430485115
0,t3_34ig4w,False,neurogloop,26,1432711626,"Some of my American family and friends having no clue where certain European cities are/that they exist. No Glasgow is not in Dublin, No Turin is not the same thing as Toronto, No they do not speak Spanish in Portugal.

",,0,False,,AskReddit,cquy3ax,,0,26,t5_2qh1i,t3_34ig4w,t1_cquy3ax,False,,1430485189
0,t3_34c5tz,False,Radcliffelookalike,7,1432711628,Not even T2 EU teams get smashed like this against Fnatic.,,0,False,,csgobetting,cquy3hi,,0,7,t5_2zume,t3_34c5tz,t1_cquy3hi,False,property,1430485201
0,t1_cquxka3,False,DerProfessor,1,1432711638,"&gt; You dont see the rest of the world still enslaving its own people and committing genocide on a daily basis like you do in Africa.

uhh... you *do* know where the term ""genocide"" originally came from, right?  (a term invented to describe the Holocaust in Europe... the one that happened only about 75 years ago...)

And if you want to talk about tribal violence, let's talk about British soccer fans or American gun-nuts/anti-government maniacs.

Culture *is* important--but it's a lot more complicated and subtle than what you are saying.  It's about developing institutions to put social pressure on people, then drilling them in those social pressures (""get to work exactly on time""; ""don't take a bribe--someone might find out""; ""you would rather consume a new iPod than have free time to spend with your friends and family"") until these pressures are internalized, and don't need to be policed by external forces anymore. 

In short, it's about breaking down individual will.   Powerful (in terms of organizing society)?  Yes.  Better?   Who's to say... ?

I lived in Southern Africa for a few years, and while I've never seen such poverty, I've also never in my life seen such freedom.   (and such happiness.  Depression, most researchers agree, is a first-world phenomenon.) 

Culture is complicated, and cannot be ranked from ""advanced"" to ""undeveloped.""  There are tradeoffs in everything.  ",,0,False,,explainlikeimfive,cquy47f,,0,1,t5_2sokd,t3_34hrvq,t1_cquy47f,False,,1430485249
0,t3_34i455,False,infinite__recursion,14,1432711647,"This thread feels like a bait for EU fans to discredit any accomplishments of NA teams by saying ""..but..but...but...IMPORTS!""",,0,False,,leagueoflegends,cquy4y5,,0,14,t5_2rfxx,t3_34i455,t1_cquy4y5,False,zed,1430485301
0,t1_cquvv1l,False,areyouscaredoffacts,0,1432711648,Game over for the people who want Europe to fail.,,0,False,,europe,cquy503,,0,0,t5_2qh4j,t3_34i1wj,t1_cquy503,False,,1430485305
0,t1_cquxqgj,False,delahunt,2,1432711651,"To be fair, internationally EU looks about as weak right now. A team of 4 rookies plus Yellowstar won the LCS. I really hope they do well at MSI, but I'm not willing to bet money on it.

I don't say this for NA &gt; EU, but all the western teams still need to step up. UoL, H2K, and Fnatic are looking like they should be good come Worlds if they keep their current team and work on their teamplay. In NA TSM is the front runner, I worry about C9 with changing out Hai and it being their first big change in players, and behind them Liquid is looking the next strongest. So NA may be just about to slump again as a region :-/",,0,False,,leagueoflegends,cquy580,,0,2,t5_2rfxx,t3_34i4gf,t1_cquy580,False,00 team,1430485321
0,t1_cquy3hi,False,grandeconfusione,2,1432711675,because T2 EU teams are actually using strats (well tbh F3 didn't look much better in their BO5 against fnatic),,0,False,,csgobetting,cquy71s,,0,2,t5_2zume,t3_34c5tz,t1_cquy71s,False,NaVi,1430485450
1,t1_cquumgc,False,SorryButThis,0,1432711677,"And all the typical bullshit comments are here. ""Nazis totally got their ideas from America."" As if eugenics wasn't a huge thing in European nations.",,0,False,3,todayilearned,cquy78a,,0,0,t5_2qqjc,t3_34hfze,t1_cquy78a,False,points ,1430485463
0,t1_cqutg7d,False,Snowy1234,2,1432711725,"Okay good. I love the Harissa!

I went from cheffing in Europe to Israel back in the eighties. Mostly Tel Aviv and Netanya. I have lots of good memories of Israel.

I remember a dip/sauce made from baked eggplant/aubergine, pickles and chillies. Can you remind me the name of it?",,0,False,,food,cquyatq,,0,2,t5_2qh55,t3_34ft47,t1_cquyatq,False,,1430485708
0,t1_cquv6c5,False,ICameHereToRead,2,1432711753,But we are in Europe.,,0,False,Croatia,europe,cquyczy,,0,2,t5_2qh4j,t3_34hq47,t1_cquyczy,False,CROA,1430485855
0,t3_34ihyj,False,Farts_Mcsharty,9,1432711804,"Ugh, so frustrating to support NA teams who are not learning as EU teams continue to perfect their teamplay.


It's not even fun to watch really.",,0,False,Cloud9 G2A Fan,GlobalOffensive,cquygvn,,0,9,t5_2sqho,t3_34ihyj,t1_cquygvn,False,fan cloud9,1430486111
0,t3_34i9fe,False,MuzzyIsMe,2,1432711813,"I think it helps to have some perspective-  There was an intense hatred between the Germans and Soviets that was not like the rest of the combatants. 

When Germany attacked western Europe, the damage and death was comparatively minimal.  For the main combatants on the Western front, the Americans and British, their homelands had not been invaded and conquered.  Americans never even saw a single bomb drop on their land.

On the other hand, the Germans drove deep into the heart of the Soviet homeland and burned and destroyed everything.  The Germans also considered the Soviets a lesser being, not really fully human, so they could justify their acts.  Soviets, whether they were combatants, civilians or POWs were not treated with the same level of respect by the Germans as their Western counterparts.

So, when the Americans came into Germany of course they didn't have the same burning desire for revenge.  Their wives and children were not killed, their hometowns were not burned to the ground. 

While it doesn't excuse the behavior of the Soviets, it helps put some perspective on it and why they were more prone to acts of revenge.",,0,False,Krasnodar Krai,russia,cquyhj9,,0,2,t5_2qh75,t3_34i9fe,t1_cquyhj9,False,krasnodar-krai,1430486154
0,t1_cqu4zgq,False,HammletHST,1,1432711824,France is not all of Europe ,,0,False,,AskReddit,cquyiff,,0,1,t5_2qh1i,t3_34f9rh,t1_cquyiff,False,,1430486211
0,t1_cqux0xs,False,ReadyGonzales,2,1432711833,"Nope it's also UK/Ireland from my knowledge, and I'm sure other Europeans have equivalent versions they use.",,0,False,,AskReddit,cquyj3j,,0,2,t5_2qh1i,t3_34f9rh,t1_cquyj3j,False,,1430486253
0,t1_cquy917,False,Oliver_Thambo,8,1432711855,"It’s almost like ethnic suicide. Like being proud of your heritage is shameful if you’re white. Europeans ended slavery, they’re the only ones blamed for it. They’re becoming minorities in their own countries, but if they say anything they’re white supremacists. Black South Africans demonise and attack a disenfranchised white minority? That’s just a proud native people protecting their culture. LMFAO. ",,0,False,kaffir,CoonTown,cquyks5,,0,8,t5_351zk,t3_34i6xf,t1_cquyks5,False,white,1430486358
0,t1_cquygz2,False,ZaltPS2,2,1432711857,"lol

&gt;The America I know and love is not one in which my parents or my baby with Down Syndrome will have to stand in front of Obama’s “death panel” so his bureaucrats can decide, based on a subjective judgment of their “level of productivity in society,” whether they are worthy of health care. Such a system is downright evil.

It like she thinks each European country with nationalised health care has some kind of Sparta birth practice where they leave the weak to die or some shit. ",,0,False,,ShitAmericansSay,cquykyk,,0,2,t5_2w57u,t3_34gqjn,t1_cquykyk,False,,1430486369
1,t1_cquyi1v,False,neenerpants,3,1432711863,"That's the same thing, surely? People emigrated to the US, just as they emigrate to Europe now. To use the UK as an example again, has always been a mix of native, Scandinavian, Germanic and French ethnic groups, with significant influxes of Asian, Indian and Carribbean ethnicities at key points of history (usually related to colonialism). And that's just the UK, who are arguably less affected by changes in demographic than many European countries, due to being an island that was so rarely invaded.",,0,False,,leagueoflegends,cquylgi,,0,3,t5_2rfxx,t3_34i455,t1_cquylgi,False,jinx,1430486399
0,t1_cquykij,False,Raiwar,4,1432711880,"Alright, thanks.

I'm surprised they won't move to Europe instead. They could live in Portugal if language is an issue. I feel like they would improve a lot more there by competing against  EU teams frequently.",,0,False,HellRaisers Fan,GlobalOffensive,cquymrc,,0,4,t5_2sqho,t3_34ihyj,t1_cquymrc,False,fan hr,1430486484
0,t3_34i84b,False,nassij,5,1432711886,"America: EG  
SEA: Rave  
China: VG, IG, LGD, eHome  
Europe: Secret, Cloud 9, Empire, NiP  ",,0,False,Level 26,DotA2,cquyn80,,0,5,t5_2s580,t3_34i84b,t1_cquyn80,False,alleria,1430486512
0,t3_34hrvq,False,ringerhat,4,1432711935,"A Western idea of ""development"" and colonization. Asking why Africa isn't developed first implies there is a linear path all societies must take, ending in the glory that is Western Europe and North America. That comes from Western theory and is not the way many places view the world. Some societies, for instance, believe in more of a cyclical process. Related, Africa is huge, so generalizing for all of Africa is impossible. There are tons of places in the continent of Africa that would meet the ideals of linear development. Second, colonialism and slavery. Many African societies were far more ""developed"" than the rest of the world before colonialism and slavery. They had advanced mathematics, agriculture techniques, books, religion, etc. But can enlightened Europe enslave an enlightened people? I have come to understand our view of Africa came about in part as justification for the slave trade. We (Americans) painted Africa as dumb and backwards to justify the subjugation of its peoples. Beyond the view, colonial efforts in Africa underdeveloped the continent. As others have said, many extracted resources from Africa to the West, drawing financial benefits away. (read the dependency theorists Wallerstein and Gunder Frank)  add to the extraction of resources the arbitrary carving up of the continent by Europe into states that had no basis in the people living there and you have a recipe for the current unstable situation in many places. As others mentioned, you can't arbitrarily put dozens of minority groups under the rule of one and expect it to all be hunky dory. Colonial powers try to maintain control long after the heyday, often with disastrous consequences. Take, for instance, Congo's first democratically elected president Patrice Lumumba. He tried to unify Africans under a banner of peace and self-determination, but was deposed and assassinated with CIA backing. Which brings the other point of control of resources. Congo is very rich in natural resources. If they had a strong government, so many other countries and companies would suffer from having to leave or pay fair price for taking the resources. There is little attention to the current atrocities in DRC because a stable government there would be costly to business interests. TL;DR the West wants to think Africa is backwards because it benefits us economically. In truth it is a huge continent with varied ideas of ""development"", and Western (and increasingly Eastern) interventions actively underdevelop many areas.",,0,False,,explainlikeimfive,cquyqxm,,0,4,t5_2sokd,t3_34hrvq,t1_cquyqxm,False,,1430486737
0,t1_cquu0xt,False,archon88,2,1432711961,"Well so what? There *is* a law. The fact that a law isn't always complied with isn't a reason for getting rid of it. Without the EU there would be no such law, and no reason for European countries to allow free movement.",,0,False,Glasgow,unitedkingdom,cquysvx,,0,2,t5_2qhqb,t3_34edl1,t1_cquysvx,False,cnty-scotland,1430486853
1,t1_cqutqje,False,TheOne_CSGO,-12,1432711966,"This is what scares me, hard core socialism or communism being ""the cool thing"" again all around the world just 25 years after the wall fell just because we do not talk about the horrors of communism as much as the horrors of Fascism and people truly do not know how bad it was during their own lifetime in Easter Europe. 


Sorry for bad English, not a native speaker. ",,0,False,,videos,cquytbr,,0,-12,t5_2qh1e,t3_34hw3b,t1_cquytbr,False,,1430486879
0,t3_34ihf8,False,Leadback,7,1432711980,"&gt;“They are planning to fight back against Europe,” one member said. “They want to take revenge for Baghdadi.”

Fucking called it. You watch, the next few terrorist attacks in Europe are going to push the Schengen Zone and immigration policy to the brink. ",,0,False,Australia,syriancivilwar,cquyued,,0,7,t5_2x5s1,t3_34ihf8,t1_cquyued,False,au,1430486945
1,t3_34i9rn,False,DeeKan,-2,1432711986,"EU should get it's head out it's ass and join the pact, since in the coming years all those ""evil terrorists"" from Africa (funded by the US), will try and move to Europe.

The Italian coastguard won't be able to stop all of them, whilst a weak/scared Europe only benefits the US, so even if there was some crisis in the Mediterranean, the Donald cocks or w/e the US have stationed there, will only protect US cargo and maybe run in to tomahawk a couple of sand-people for your monthly ""War on Terrism"" headline.",,0,False,"They see me postin', They hatin', Reporting hard and ololololo",russia,cquyut7,,0,-2,t5_2qh75,t3_34i9rn,t1_cquyut7,False,austria,1430486970
0,t1_cquyuml,False,NIPLZ,321,1432712006,"Pff, Obama? As a European kid, I had no idea what those Miniclip Bush vs Kerry games were about but I sure got a kick out of them.",,0,False,,AskReddit,cquywcg,,0,321,t5_2qh1i,t3_34i6ff,t1_cquywcg,False,,1430487062
0,t1_cqtty82,False,Trucidator,1,1432712016,"&gt; I've seen him on /r/europe before, he does nothing but talk rubbish. Pretty sure he's consistently anti-British too.

Any news on my rubbish post or a post in which I have been anti-British? Many thanks.",,0,False,,ukpolitics,cquyx2y,,0,1,t5_2qhcv,t3_34e7j5,t1_cquyx2y,False,,1430487105
0,t3_34f5j2,False,HeroOfNothing,1,1432712054,"Muito bom. Este Jarr é muito, muito bom, desconhecia este mix, quanto á senhora, se eu tivesse uma voz daquelas, nunca me calava.",,0,False,,portugal,cquz009,,0,1,t5_2qmie,t3_34f5j2,t1_cquz009,False,,1430487282
0,t3_34ijzf,False,Jebbu,2,1432712115,"Bit off topic,  but when does the draft start today? 
Edit: I was a bit too quick. It's a 7pm, which is 1am my time. Bah - accommodate the European crowd,   Goodell! ",,0,False,,CHIBears,cquz4lr,,0,2,t5_2s0u3,t3_34ijzf,t1_cquz4lr,False,9,1430487555
0,t3_34e691,False,klasu-m,2,1432712125,"[Laaninen Ylelle: ""Timo Soinin kanssa oli sovittu täysin toisenlaisista EU- ja maahanmuuttokirjauksista"" ](http://yle.fi/uutiset/vedattiko_soini_sipilaa/7966792)",,0,False,(paikallisidentiteetti hakusessa),Suomi,cquz5ez,,0,2,t5_2qlq3,t3_34e691,t1_cquz5ez,False,flair-helsinki,1430487598
0,t1_cquy1ao,False,vaperageous1,1,1432712162,"I have been to several cities in Germany. Beautiful country 
great beer rough around the edge people. I used to racks rucksack around Europe in the late 80,s. I spent a lot of time with German's I prefer the women. ",,0,False,,electronic_cigarette,cquz890,,0,1,t5_2qmlu,t3_34icje,t1_cquz890,False,,1430487756
0,t1_cqub0jm,False,HammletHST,1,1432712199,Who the fuck skips? Question from a curious European,,0,False,,AskReddit,cquzb59,,0,1,t5_2qh1i,t3_34f9rh,t1_cquzb59,False,,1430487921
0,t3_34icng,False,The_Tolman,1,1432712213,"I'm about 200,000 of those views, but seriously, Persona is a huge franchise in Japan and has a large cult following in the EU and NA. Like Bloodborne, it's a niche game that by itself may not sell 5 million consoles, but when coupled with 5 other niche games that target specific audiences, it gives Sony the sales they want. ",,0,False,,PS4,cquzc4m,,0,1,t5_2rrlp,t3_34icng,t1_cquzc4m,False,,1430487974
0,t1_cquyw2x,False,Jamaicaman90,2,1432712240,"That's true too - I'd suggest that the massive downfall of Rangers and even the European diminishing of Celtic can (in part) be attributed to a similar situation in Scotland that was never resolved.

I very rarely believe earning money should be unregulated, and this doesn't change in football. So many of the bad aspects of the sport are caused either by teams chasing money unsustainably or by them being unable to bridge the gap of teams that can outspend them (which occasionally leads them in a loop between the two, like Leeds). ",,0,False,Swansea City,soccer,cquze6j,,0,2,t5_2qi58,t3_34gu5g,t1_cquze6j,False,39,1430488086
