author_flair_text,author,ups,created_utc,subreddit_id,author_flair_css_class,edited,subreddit,score,link_id,id,distinguished,retrieved_on,controversiality,parent_id,gilded,body
Mata,JGQuintel,1,1438387283,t5_2rxse,8,False,reddevils,1,t3_3fckbk,ctnf7zo,,1440210835,0,t1_ctnem5n,0,Premier League decides and it has to be the same for every team. In Europe we always have different fonts. 
,Canadaisfullgohome,4,1438387322,t5_2qzb6,,False,IAmA,4,t3_3faghx,ctnf8qd,,1440210845,1,t1_ctn0i94,0,"Do you think 450,000 refugees is sustainable for Germany? How do you think children can assimilate on their own? Is it better or worse? 

Is hiring more staff really an efficient way to solve a problem that faces every migrant, ie having no education to compare on German standards, no contacts, a language barrier ect. What stops these hundreds of thousands of migrants from getting frustrated and resorting to gang life, rampant crime, and a seriously skewed view of European law? 

What's the end game here? "
,calvinironfist,-4,1438387332,t5_2qzb6,,False,IAmA,-4,t3_3faghx,ctnf8xn,,1440210847,0,t1_ctn4rer,0,Why doesn't Europe just keep the Syrians and leave out the ill-mannered Afghanis and Pakistanis? Syrians seem to display more societal worth for the West.
,JamesNicholson007,1,1438387357,t5_2yesa,,False,arumba07,1,t3_3fbdw5,ctnf9ej,,1440210853,0,t1_ctnbpx4,0,I believe that's how Arumba did it when he created a play through on the Aztecs when attacking Europe. I was thinking he could do the convert CK2 trick to EU 4 and then go for exploration ideas on the tech tree
Emperor 正德 (Zhengde) of the Great Ming,Sovietstorm,1,1438388018,t5_351m9,default,False,empirepowers,1,t3_3f9xkj,ctnflod,,1440211014,0,t1_ctn0b98,0,"&gt; It just seems just because I am european i can't do shit in India, because is unrealistic... I can't put traps, I can't drive away civilians, I can't do nothing... He his destroying my defense chances before I even try xD 


How about you do what actual Euros did? Hole yourself up in a city and slowly evacuate.

"
,yamfase,2,1438388031,t5_2rfxx,07 team,False,leagueoflegends,2,t3_3fc0uv,ctnflwv,,1440211017,0,t1_ctndrwp,0,"too bad :(

eu aristocrat = na burger flipper"
Gold Nova Master,EmynArnen,1,1438388205,t5_2sqho,rank gold-nova-master,False,GlobalOffensive,1,t3_3f9wbu,ctnfp57,,1440211059,0,t1_ctn1k52,0,"I actually recognize quite a good amount of countries by their accents, plus I usually ask at some point of the game where are they from. Anyways, most of the toxic players I've met were from eastern europe. That's a fact. I'm not calling every single russian a mad flaming troll. I'm just saying that so far, based on my experience, players from those countries are more likely to act that way. "
,vanillaprincess,3,1438388213,t5_2qh9i,,False,brasil,3,t3_3f9cjp,ctnfp9z,,1440211062,0,t1_ctmr2ku,0,"Depende da faculdade, mas o processo seletivo é,99% das vezes, separado.


Tem uma prova que eu prestei em junho, o 日本留学試験, vestibular para estrangeiros no japao.
algumas faculdades aceitam essa prova, enquanto outras tem suas proprias provas.
Geralmente consiste em uma prova separada+redacao+entrevista ou vestibular p/ estrsngeiros (que tem redacao tb)+ entrevista 

E a entrevista é em jp"
,BigDew,1,1438388575,t5_2rfxx,,False,leagueoflegends,1,t3_3faua3,ctnfw0b,,1440211149,0,t3_3faua3,0,I'm very glad they're improving ping in Europe when most players have &lt;50 ping while 70% of NA has over 80 ping 
,phyrexio,1,1438388673,t5_2qh9i,,False,brasil,1,t3_3fbbrg,ctnfxv8,,1440211173,0,t1_ctnff67,0,"Olha, eu e meu irmão estávamos com muito problema pra conseguir instalar também; só conseguimos com aquela MediaTool da Microsoft."
,SuperCuteRoar,2,1438388877,t5_2qh9i,,False,brasil,2,t3_3fcd74,ctng1ob,,1440211224,0,t1_ctnfukg,0,"Brigado por todas essas dicas! São coisas super importantes que tenho que ter em conta na hora de procurar onde morar. Eu achava que Curitiba tinha uma boa rede de transporte público. Ao menos tinha ouvido isso.

Em quanto as companhias pra celular, qual você acha a melhor? Você acha que seria mais econômico pra mim comprar um celular aqui (um compatível com a rede brasileira) e levar pro Brasil ou comprar um lá? Tenho um iPhone mas acho que não é compatível com a rede brasileira e mesmo assim não tenho muita confiança de utilizar ele na rua. 

Encore une fois, brigado pelos conselhos! "
,Roflcopter_Rego,7,1438388944,t5_2tk95,,False,dataisbeautiful,7,t3_3fbqg5,ctng2xr,,1440211240,0,t1_ctneveo,0,"International incomes are converging. China will close on the US and Europe in the next 2 or 3 decades, India will be a couple decades behind that, and Africa a few decades behind that. A map with each country's GDP/capita will look far more homogenous in 2050. That said, within all countries there is a trend towards increasing wealth inequality. So good if you're in poverty, good if you're rich, and pretty meh otherwise."
2015 YZF-R3,LeetShade,1,1438389001,t5_2qi6d,nl,1438389367,motorcycles,1,t3_3f9kev,ctng40a,,1440211254,0,t1_ctmkhp6,0,"Depending on how much money you'd have, I can say one thing that the R3 is a great starter bike, with quite a punch still. I do not know how much power a Ninja 250 gives, but with my R3 i can easily do 160km/h (100mp/h) on the freeway. Though it's power is quite in the top end, for commuting and just riding casualy it still gives great power.

Other than that, the seating on it (unlike you'd expect from a R-series bike) is quite comfortable. I'm 1.95m tall (6""6') weight about 90 kilos (200lbs) and I fit quite good on the bike. You don't also lean over forward much.

Also it's very light. It's about 165 kilos (360 lbs). This makes it quite nimble and makes for great cornering. Also makes the bike easy to handle around your home/driveway.

Besides that, it's great for commuting in the form of lane splitting, because you can easily fold in the mirrors and the bike is as wide as your handlebars. I've done this numerous times when I got ""stuck"" in traffic.

The mileage is quite good also. When I'm just driving around I get about 25km/L (58.8mp/g). The tank size is quite small though, at 14L (3,7g). With that milage though you can easily do 180 miles + on a tank.

The dashboard also is quite complete. You've got the gear indicator which might help you out a lot in the beginning, also there are 2 meters for day trips, and an oil ODO meter, which helps you memorize when you'd last put oil in or lubed your chain.

There are some minor cosmetic things I do not like though of the R3, but that's personal preference. The turn signals are quite bulky and they had to make the fender insanely huge because of regulations (I think).

All in all a very complete and forgiving starter bike, though it's downside is there aren't much (if any at all) second hand, and you might have to buy a brand new one at 4,990$, and that's without the ABS. I have the EU version which has the ABS, but comes at a bigger cost.

Pic attached #1: [My bike](http://i.imgur.com/5T2amS7.jpg) My R3 in my front yard after I installed my fender eliminator. Also my mirrors are still folded in, I don't have a nicer picture yet.

Pic attached #2: [YZF-R3 at the shop](http://i.imgur.com/sKPeZ7A.jpg) How the bike looked when I had my test ride.

EDIT: Formatting and if you have any questions still, I'd be glad to try and answer them for you."
,kastenbrust,2,1438389038,t5_2sgp1,,False,pcmasterrace,2,t3_3fae4q,ctng4qg,,1440211263,0,t1_ctmw7qs,0,"Yeah I laughed at that point, most Polish 10 year olds aren't fluent in Polish, it's probably one of the most difficult European languages."
,the_brown_stockton,6,1438389109,t5_2tycb,,False,OldSchoolCool,6,t3_3fbmxi,ctng5zp,,1440211280,0,t1_ctnfclx,0,"r/whiterights, r/worldnews, r/europe, r/videos, need I go on?"
,higherbrow,1,1438389235,t5_2rfxx,07 team,False,leagueoflegends,1,t3_3fba52,ctng8ag,,1440211310,0,t1_ctnbqle,0,"Actually a lot of the legends about absinthe were due to the fact that it was a favored liquor to be paired with opiates in Europe. ""Green Haze"" and ""Chasing the Dragon"" were once synonymous. "
,erix84,2,1438389518,t5_2s9n5,,False,gaymers,2,t3_3fccre,ctngdbw,,1440211377,0,t1_ctnd3n6,0,"You only have to drive on the left in the UK, the rest of Europe drives on the right. It is pretty tough when you get a job that sends you to the UK and you're driving a LHD truck, turning out of parking lots can be a pain."
,jarviscoca,2,1438389524,t5_2qmie,,False,portugal,2,t3_3f9gff,ctngdg6,,1440211377,0,t1_ctneht8,0,"Portanto: não te interessam as origens deles, mas só até à parte em que, por não gostares da pessoa em questão, decides usar da ironia e puxar pelo ""sangue azul"" do Markl. 

Lá porque o OP decide fazer um exercício em que junta todos na mesma casca de ovo, eu não sou obrigado a fazê-lo. E não o faço, pronto. Eu não tenho que fazer o mesmo exercício que toda a gente faz numa thread do reddit. Posso ter um bocadinho de espírito crítico.

Se vamos comparar humoristas, eu não insiro o Markl na discussão (não se vê como humorista, logo não faz sentido). Se vamos comparar profissionais de comunicação, eu insiro o Markl e digo que o mesmo bate aos pontos o Nilton. 

Mas hey, fica com a tua bicicleta, que eu fico com a minha ;) Um abraço!"
Wales,Rhy_T,29,1438389670,t5_2qh4j,WALE,False,europe,29,t3_3fbp1f,ctngg1e,,1440211412,0,t3_3fbp1f,0,"The Guardian is going full at it today but judging by the comments even their readers won't swallow this level of tripe.

&gt;[We can't stop the flow of migrants to Europe. Rehousing them is our only option](http://www.theguardian.com/commentisfree/2015/jul/31/migrants-calais-resettlement-europe)

&gt;[Britain’s island mentality is making the Calais migrant crisis all the more difficult](http://www.theguardian.com/commentisfree/2015/jul/31/britain-island-mentality-making-calais-migrant-crisis-more-difficult)  

&gt;[Europe could solve the migrant crisis – if it wanted](http://www.theguardian.com/commentisfree/2015/jul/31/europe-migrant-crisis-political-choice-toxic-waste-sanctuary) "
,cyssou,1,1438389788,t5_2sokd,,False,explainlikeimfive,1,t3_3fcmwg,ctngi62,,1440211439,0,t1_ctng5a5,0,"In a sense, I know all that, I just don't understand *how* it happened. Your basically saying: ""these are two ways to do the same thing, however one is significantly better than the other in every aspect"" but it's literally too good to be true: someone, in the end, must be paying for all that, because no value was created out of thin air right there: it's just a payment. And if credit is so superior, I don't understand why it's not as widespread in Europe... Maybe just the European aversion for debt (don't tell the Greeks)?"
,FrankyZZZ,1,1438389845,t5_2w31t,,False,hearthstone,1,t3_30yqgc,ctngj8y,,1440211453,0,t3_30yqgc,0,"Great thread - let's keep it going! Add me too to watch/being watched by for the daily quest :)
EU - Kal#2567
(Lower case L at the end.)"
,TheOffice99,1,1438389868,t5_2rfqu,,False,fakeid,1,t3_3f4ot9,ctngjp6,,1440211459,0,t1_ctn9ebj,0,Not right now sorry. Check the forgeries section on agora. I believe he ships from Europe. 
,Alesque,1,1438389927,t5_2w31t,sen,False,hearthstone,1,t3_3fcwa1,ctngkr5,,1440211473,0,t3_3fcwa1,0,At midnight. In Eu it's already reset.
,SkeetWad86,1,1438390220,t5_2rdsb,,False,REDDITORSINRECOVERY,1,t3_3f6b2k,ctngq61,,1440211544,0,t1_ctncdh2,0,"I had a feeling you were a lady! I hope you don't take offense to my use of 'dude' : ) 

That group sounds pretty rough. It's pretty incredible you've been able to stay clean a year though, especially given those circumstances, so congratulations! Your comments make a lot more sense to me given that context. I think people develop addictions for all kinds of reasons but I think at the end of the day it's because we feel isolated, or separate from our communities to some extent. That's always been my biggest challenge too - feeling isolated, resisting the *urge* to isolate and all that. That does complicate things and I can't offer you any practical advice (beyond the exercising) because I've only been to Europe twice and can barely speak spanish. Do you plan on staying there for the forseeable future? 

Best wishes. Feel free to PM me I'd be happy to hear more."
,Roll9ers,-1,1438391441,t5_2qh6e,,False,television,-1,t3_3f8yh6,ctnhcn5,,1440211838,1,t1_ctmv7b1,0,"I think John Oliver is very preachy, just maybe not in a ""european in america"" way. Very funny, very watchable, but still preachy in the way reddit can be."
,p_gascoigne,2,1438391582,t5_2ryq7,,1438391789,coys,2,t3_3fbyku,ctnhf5x,,1440211871,0,t1_ctngvhz,0,"&gt;at his peak a couple of years ago he was one of the best DM's in all of europe

He is a good player. But one of the best DM's in Europe? If he is so good, why has he never played a competitive game for Germany? Why is he being used as a squad player? The last four years he has started less than half of their league games every season.

EDIT: If signed, he might be a new Freund. Certainly a capable player. But not necessarily the talent that will allow us to challenge for CL-spots."
,autowikiabot,1,1438391699,t5_2tk95,,False,dataisbeautiful,1,t3_3fbqg5,ctnhhac,,1440211899,0,t1_ctnhgu4,0,"#####&amp;#009;

######&amp;#009;

####&amp;#009;
 [**Resource Wars**](https://fallout.wikia.com/wiki/Resource%20Wars) (from Fallout wikia): [](#sfw) 

---
&gt;
&gt;The __Resource Wars__ were a series of conflicts that began in April 2052 with the start of the war between the European Commonwealth and the Middle East, and ended with the Great War on October 23, 2077. Some of the conflicts included the annexation of Canada by the United States and the Chinese invasion of Anchorage, Alaska.
&gt;[**Image**](https://i.imgur.com/B7riLrV.png) [^(i)](http://vignette1.wikia.nocookie.net/fallout/images/5/5d/FoT_Gas_Prices.png)
&gt;[**Image**](https://i.imgur.com/B3rfAwq.jpg) [^(i)](http://vignette2.wikia.nocookie.net/fallout/images/6/69/Unclesam.jpg)
&gt;^Interesting: [^Fallout: ^Resource ^Wars](https://fallout.wikia.com/wiki/Fallout: Resource Wars) ^| [^European ^Civil ^War](https://fallout.wikia.com/wiki/European Civil War) ^| [^European ^Commonwealth-Middle ^East ^War](https://fallout.wikia.com/wiki/European Commonwealth-Middle East War) ^| [^Nuclear ^bombing ^of ^Tel ^Aviv](https://fallout.wikia.com/wiki/Nuclear bombing of Tel Aviv) 

^Parent ^commenter ^can [^toggle ^NSFW](http://www.reddit.com/message/compose?to=autowikiabot&amp;subject=AutoWikibot NSFW toggle&amp;message=%2Btoggle-nsfw+ctnhhac) ^or[](#or) [^delete](http://www.reddit.com/message/compose?to=autowikiabot&amp;subject=AutoWikibot Deletion&amp;message=%2Bdelete+ctnhhac)^. ^Will ^also ^delete ^on ^comment ^score ^of ^-1 ^or ^less. ^| [^(FAQs)](http://www.reddit.com/r/autowikiabot/wiki/index) ^|  [^Source](https://github.com/Timidger/autowikiabot-py)
 ^(Please note this bot is in testing. Any help would be greatly appreciated, even if it is just a bug report! Please checkout the) [^source ^code](https://github.com/Timidger/autowikiabot-py) ^(to submit bugs)"
,7-sidedDice,9,1438391889,t5_2qzb6,,False,IAmA,9,t3_3faghx,ctnhkve,,1440211946,0,t1_ctng7wa,0,"That is fucking revolting. I am center-left on most issues but the more I read about EU immigration (including OP's responses here which are not encouraging) the more I want European nations to crack down on immigrants.

I hope, for their sake, I am wrong. But as I said, the more I read, the more it feels like we should just shut our borders to anyone seeking refuge and/or asylum."
,ZeroAnarchy,2,1438391935,t5_2rfxx,team 03,False,leagueoflegends,2,t3_3fcq4w,ctnhlqb,,1440211957,0,t3_3fcq4w,0,SKT (S3) &gt; SSW &gt; SSB &gt; M5 &gt; CLG.eu
,somerandomguy03,3,1438392144,t5_2qh3l,,False,news,3,t3_3farfu,ctnhpkn,,1440212008,0,t1_ctnhits,0,"I've never had an issue with customer service in Europe.  Overall, I just haven't seen any meaningful difference."
,MrPapillon,11,1438392209,t5_2s3qj,,False,Bitcoin,11,t3_3fbjap,ctnhqti,,1440212024,0,t1_ctnait4,0,Not statistically though. Statistically we win more than any other european country. You could also probably include the US in the package.
Grabbed 4,mysterioussir,3,1438392383,t5_2tb4r,grabbed,False,GiftofGames,3,t3_3fctdw,ctnhu1h,,1440212066,0,t3_3fctdw,0,"I gotta go for a movie, so the effort's there but not all the time. [Here](http://gyazo.com/4f81cefae71e2a7f03764f854068617e)'s my Garen, the first character I played in League. Based Largely on [this](http://ddragon.leagueoflegends.com/cdn/img/champion/splash/Garen_5.jpg), but with a more traditional outfit and style.

From my Request: My game of choice would be Rocket League. I know a lot of people want this right now, but I’ll try to make a strong case for why I really, really want it.

Let’s start with my history. I played soccer as a kid. I live in the American South, where of course American football reigns, but half of my heritage is European. My dad was born in Florida (I live in Georgia) to German and Hungarian immigrants-- and of course, hence comes soccer. My grandfather was a coaching assistant for the Hungarian team in the Atlanta 96 Olympics, and my dad was my coach throughout my years of playing soccer as a kid. However, in all that time, I mostly played goalie. Why? Asthma. I’ve always had exercise-induced asthma, and with some incidents where I’ve stopped breathing entirely (one of which occurred several months ago and resulted in several days in the hospital and me missing the weeks leading up to my high school graduation), playing a sport with constant running like soccer doesn’t work out for me. I don’t play it at all anymore, for such reasons, and my athletic pursuits are rather casual.

I love soccer video games. My first smartphone was a Windows phone, and the game I played the most on it was probably PES. I’ve never owned a soccer game on PC- up until last year, my PC couldn’t really run ANYTHING with 3D graphics, but I eventually upgraded to a decent gaming laptop that can. I still play soccer-related stuff. Half my time in Battleblock Theater has been messing around with that basketball/soccer game in the arena, which is easily my favorite mode.

And of course the cars. The game of my childhood was Mario Kart DS, and I still play it, along with the Wii U version today. I love any kind of racing or car game-- Forza Horizon is by far my favorite 360 exclusive, and I still enjoy Motorsport 2. But what I really love is silly car stuff, as exemplified by my Mario Kart history. The first time a friend brought Burnout Revenge over to my house I fell in love with it, and the same goes for Burnout Paradise. Obviously, all of this is obviously combined with the soccer in Rocket League.

I first saw gifs of it and became obsessed. Yesterday I was over at a friend’s house and got to play it for the first time on PS4. It was exactly what I hoped for. The perfect blend of stupid fun and challenge, the ideal game to play with friends, the aforementioned who I could play with due to PSN and PC sharing the same servers, and another best friend is getting it on PC tomorrow. I would get such countless fun out of this game.

And of course, what of specifics of the game itself? It's beautiful. The graphics are clean, colorful, well-designed, and modern. The game is a joy to watch and play. It's functional. It controls simply and nicely, the gameplay is fast-paced and fun. The UI is efficient. It's developed well without game-breaking bugs or cutting corners. Everything about the games execution was done perfectly, and even a pathetic attempt at it's concept would have still given me great joy.

Picking up a controller and setting to work on it, it's more or less exhilarating. I wasn't good at all when I played, but it didn't matter. For every five times you boost and just barely miss the ball, the one time you jump and make contact is glorious. It's a game that lends itself to those accidental beautiful moments, when you somehow flip backward off a wall and catapult the ball into the goal, to declare ""That was intentional"" when everyone knows it wasn't. It's immediately accessible and enjoyable, but offer skills and practice that only time can give. A game to be played and mastered, with only fun and no grind along the way.

This has been on my wishlist since release. I honestly can't think of any game I'd enjoy more right now, even a 60 dollar AAA. If the devs were looking for a perfect target to enjoy their game, that person is pretty much me.

What of my finances? I can't say I'm poor or underprivileged. But I'm starting college in two weeks, my only job is an unpaid internship for work experience, and thanks to horrible healthcare based on preexisting medical conditions, my family had to spend thousands and thousands on my hospital bills from the incident I mentioned earlier. As much as I would love Rocket League, with everything else going on I just can't put 20 dollars toward it right now.

My Steam ID: http://steamcommunity.com/id/mysterioussir"
,zbyshekh,1,1438392866,t5_2r4oc,,False,tipofmytongue,1,t3_3fd06q,ctni2x0,,1440212182,0,t1_ctni1ex,0,"I know it's broad, but here in Europe I hear that one song in radio over and over again.

Not your song, but thanks."
,MuffinPuff,-4,1438393414,t5_2to41,,False,tifu,-4,t3_3fahe7,ctnid39,,1440212316,0,t1_ctnhmsh,0,"It's not anecdotal. It's been speculated and tested whether men and women have different writing styles and word choices. People have even created sites to guess the author's gender based on their writing, with many of them having high accuracy. Let's also not forget the countless books written on this very subject.

I ran OP's post through one of these sites, and the results came back 54% chance of being a male writer, 42% chance of it being a female. However, the site also mentioned significant differences between US English language tendencies and European English language tendencies, based on gender.



"
,eean,0,1438393585,t5_31zn5,,1438393765,austriahungary,0,t3_3enesw,ctnig92,,1440212357,0,t1_ctmzku8,0,"EU isn't alone here, you see it all the time. US, Brazil, Bolivia, every US state I can think of, all have split or unimportant cities as their capital. It's easy to understand why."
,JoPelligrino,4,1438393698,t5_386qw,,False,playark,4,t3_3fcgrg,ctnii9z,,1440212383,0,t1_ctnh1x7,0,"I keep seeing the region lock thing thrown about quite a bit. Something like that would affect more than just the chinese. I play on an EU server and have made quite a few friends, i'd hate to be locked out and constrained to the super populated U.S servers and lose out on interacting with folks I've grown to like.  I know you weren't making an absolute statement about it, I've just decided to reply here"
,MatchaJelly,1,1438393869,t5_2rbn0,,False,HongKong,1,t3_3f9v3y,ctnile2,,1440212424,0,t3_3f9v3y,0,"Prices won't be that different. For example, my bro wanted some Fred Perry polos. I quickly compared prices online when I was at the store, it was actually cheaper online or back in Canada. Same thing with perfumes in HK, it is overly priced compared to the gift sets I can get back home. Same thing with the Coach outlets too.

Like HungryGoerge mentionned, HK has many tailors and it's much better to get a custom fitted suit. A lot of them have fast turnarounds I hear.

My suggestion is to keep a list of items you want to compare on hand on your phone or written, that way you can quickly calculate price differences ( I do this for Hot Toys figures )

Also, some of these brands might not have the same stock as the european branches."
,disorderlee,2,1438393940,t5_2qh61,,False,WTF,2,t3_3ezcb3,ctnimrb,,1440212442,0,t1_ctn49rn,0,"Actually, I only encountered it in Europe 16 years ago. We were perplexed as to how to clean a filter that apparently didn't exist. Also, it didn't wash or dry the clothes worth a damn! I may have also been sticking, so no worries. "
