author_flair_text,author,ups,created_utc,subreddit_id,author_flair_css_class,edited,subreddit,score,link_id,id,distinguished,retrieved_on,controversiality,parent_id,gilded,body
,Phammy1234567890,1,1438468355,t5_2qh1e,,False,videos,1,t3_3fg7k2,ctoaxvk,,1440225987,0,t3_3fg7k2,0,"Quero Fazer Muitas Amiga, mais e tabém quero fazer muitas amizades e falar pelo Bate-Papo, eu gosto muito de entra no Habbo Hotel e é muito legal e é legal o habbobiz/.com que legal eu quero ter esse tambem eu acho que deve ser legal e a Música Ser Ou Parecer é Massa e muito legal essas musicas eu amo o Rbd y soy Rebelde a Musica Ser ou Parecer Hd em Português é massa e é muito mais diferente doque o de Espanhól e tambem é legal a tá cheio de música legal do rbd tem tanta mú sic a legal a Slá a música que todo mundo gota é a música Fique em Silêncio  e também tem outras músicas legal.... eu amoo essa música sou super fã deles  uhuuu a Anahi e Todos Os Rebeldes Arasaram nessa música "
,User_Simulator,1,1438468703,t5_3964e,,False,User_Simulator,1,t3_3fdbam,ctob3m5,,1440226060,0,t1_ctob25x,0,"Nope, although I did before I soldered the switches on... so I'll have to get you started, kid http://www.bbc.com/news/world-europe-26337693 http://rt.com/politics/russia-police-protesters-bolotnaya-534/ http://uk.reuters.com/article/2014/02/24/uk-russia-trial-idUKBREA1N07Y20140224 Well, it's easy to love a leader when all you want, that was an asshole for co-opting Pride in an attempt to freak people out. You should put out a decoy toothbrush that has been kept ignorant to the mall, which was a hormone-infused teenager. There was a diode issue for all the customizations that people would want to make my own. And all that different, you and I. So hey, when you don't leave a note in Gale's notebook.

 ~ mrtatulas

-----

[^^Info](https://github.com/trambelus/UserSim) ^^| [^^Subreddit](/r/User_Simulator)"
Apple Maps &gt; COD:AW Maps,Momskirbyok,2,1438468754,t5_31g7o,X1,False,CodAW,2,t3_3feuhs,ctob4il,,1440226072,0,t1_ctob3c4,0,"You can fix it by implementing region-based servers instead of having this clusterfuck of people on the east coast connecting to people on the west coast, or people on the east coast connecting to Europeans or others outside the country.."
,jcopta,3,1438468892,t5_2qmie,,False,portugal,3,t3_3fg9md,ctob6tj,,1440226102,0,t1_ctob5g3,0,"Legais no sentido do português-europeu, dentro da lei."
Silver I,BTRANNN,1,1438469002,t5_2sqho,rank silver-1,False,GlobalOffensive,1,t3_3fga2z,ctob8oi,,1440226126,0,t3_3fga2z,0,"There isnt really any hackers overrall right now , atleast for me and im smfc. If you're from NA and you want to use a league service , use esea and if you're from Eu , use face it. I tried Esea when i was LE, i expected to really improve but for me it was worse than mm. Litterly 3/4 of the time i would end up carrying and still lose but thats just my experience. Im sure many people have had different and better experiences."
TheFantasticFinn,TheFantasticFinn,1,1438469010,t5_2s6yw,psn,False,EASHL,1,t3_3felmw,ctob8tz,,1440226129,0,t3_3felmw,0,"If you're **European**, you like **playing like a team** and you're comfortable talking English in a party chat, look no further.

We already have a bunch of people, but activity has been an issue so we need more people on every position to frequently play 6s. 

PM here on reddit and send a join request to **Banana Rangers**."
I7 4790K @4.7 - Maximus VII Formula - GTX 780 ,malfurionpre,4,1438469033,t5_2sgp1,text-pcmr color-pcmr,False,pcmasterrace,4,t3_3feolt,ctob982,,1440226133,0,t1_cto9ff2,0,"So how about Switzerland ? We're forced to pay in Euro, despite us not being part of the EU ??"
29,aidanvu1992,1,1438469085,t5_3525u,,False,amiiboSwap,1,t3_3ffwss,ctoba26,,1440226144,0,t3_3ffwss,0,NA NIB Little Mac and EU NIB Rosalina/EU NIB Meta Knight/NA NIB Jigglypuff/JP NIB Jigglypuff for both?
,Sangomah,-1,1438469131,t5_2ymb9,,False,Skyforge,-1,t3_3fg2zk,ctobav1,,1440226154,0,t3_3fg2zk,0,"Do remember that Blizzard did this with WoW as well and it took 3-4 months of WoW being in the EU for everything to be implemented. (Mauradon as an example)

With patches working in RU, I think its just  matter of time before we catch up."
,Yds,1,1438469282,t5_2qh0u,,False,pics,1,t3_3fet62,ctobdfg,,1440226188,0,t1_cto4kwx,0,"I don't know if they're the same type of formations, but it also looks like [Pamukkale](http://www.telegraph.co.uk/travel/destinations/europe/turkey/11767475/Pamukkale-everything-you-need-to-know-about-visiting-Turkeys-most-popular-attraction.html) in Turkey. "
Benfica,ultra_22,1,1438469396,t5_2qi58,26,False,soccer,1,t3_3fdz3k,ctobfg9,,1440226215,0,t3_3fdz3k,0,"I agree with the sentiment in this thread... if there was a way to stream football legally I'd really consider it. But for me, that service would really need to offer matches from all over Europe.. I watch a lot of Spanish and Portuguese football as well, so that would need to be available too.

I can just imagine a service like Steam, you'd go on a ""Today's Matches"" section, see a huge list of games being played all around the world, and pay a small fee (I'm talking £2-5) to watch whatever you want.

But it's so easy to go online and find an AceStream link to all the big matches around Europe that I'd probably just rather put a mini-PC under my TV and make it my football streaming machine."
,mad-n-fla,1,1438469936,t5_2qh13,,False,worldnews,1,t3_3ffxof,ctoboo8,,1440226335,0,t3_3ffxof,0,As did Europe.....
,dansk-,1,1438469960,t5_324pd,,False,summonerswar,1,t3_3ffhx4,ctobp40,,1440226341,0,t3_3ffhx4,0,"Im more than happy with mine. Im using him with 2 setups in arena.

Tyron (L), bernard, luer, amir (against more speedy teams)

Bernard (L),shannon,luer,amir (against slow, non fire teams)

he farms aiden hell around 45 sec.

fatal/blade with atk/cd/atk

http://imgur.com/qWVub5t

I could climb up to g1 on global, but was falling down because of bad def and not being able to be a part of rush hour.

On the europe server i can be a part of rush hour and therefor im able to hold c3 easy and have a shot on g1"
Chelsea,Nightbynight,2,1438470020,t5_2qi58,4,False,soccer,2,t3_3fg65t,ctobq3v,,1440226354,0,t3_3fg65t,0,"&gt;The thing is, why is it ""only a matter of time"" until the U.S. excels at football, when their South American neighbors have known football just as long as them, and are known globally as football giants?

The answer to this is so obvious.

When kids are little in Europe or in South America, what sport do they play? They almost always, always, play soccer. In the streets, in the backyard, at school. When fathers want to play with their sons and daughters what do they do? They go and kick a ball around.

In the US, they don't do that. Some do, but kids in the US play many sports, and by the time their out of grade school they're done with soccer. In the streets, they used to almost exclusively play baseball. Now it's mostly basketball or american football. When dads play with their kids they  go and ""play catch"" with a baseball or football. 

The reason countries in europe and south america are so much better is a combination of things, but a big reason is because the pool of players they have to choose from is much, much larger. The larger the pool of players, the better the athletes, the better the players, the more competition, the more teams, etc. The best team sport athletes in America usually play football or basketball. In Brazil, they play soccer.

It's that simple. But as soccer becomes more popular in the US, more kids will play and continue playing, and the quality of players will go up."
,sidgolan,6,1438470036,t5_2qhqt,7,False,Gunners,6,t3_3fgbhj,ctobqdp,,1440226357,0,t3_3fgbhj,0,"Of course we would want him. So would a raft of other european teams. But that's not the point, is it. AS is basically Barca's mouthpiece and will post any bullshit to slag off madrid or anything related. 

Not reliable at all, and even if they were, it adds nothing to any development with respect to the actual transfer being plausible or whether it will happen or not. "
Verified Vendor,umbreonDNMteam,3,1438470061,t5_30h51,vendor,False,AgMarketplace,3,t3_3f8kd2,ctobqt5,,1440226363,0,t1_cto1zkq,0,"Oh, there are.  It's just that they need to be very careful.  You will see a lot of formerly rare chemicals appearing in this country synthesized domestically within the next 12 months.  Most are illegal.  MXE is already illegal in a few states and I'm sure a federal ban is not far down the line if it doesn't go down nice and quiet-like after the blows in Europe and Asia. "
,Waddupp,1,1438470110,t5_2rfxx,nidalee,False,leagueoflegends,1,t3_3fg3zj,ctobrp4,,1440226375,0,t1_ctoaex8,0,"1580rp (1400 + 180 bonus) for €10, which is ~$11.01

Prices might be different across the EU. This is for Ireland"
pm me pics from your nude accordion-playing sessions,ThrillerBOB,1,1438470274,t5_2sih3,rs,False,polandball,1,t3_3f6bdv,ctobuh4,,1440226411,0,t3_3f6bdv,0,"But, but .. central belgique of all europe :("
,drunkdingo,1,1438470321,t5_2wqui,,False,Sense8,1,t3_3e07oa,ctobv9v,,1440226422,0,t3_3e07oa,0,Being predisposed to having a major thing for Blonde (eastern) European Violent Men.. I have to say Wolfgang is amazing. 
,Hyamez88,2,1438470402,t5_2xb0e,team-as,False,MLTP,2,t3_3fgcqq,ctobwn3,,1440226439,0,t3_3fgcqq,0,"&gt;kept trying for a minors spot

you were like in europe for a season and a half and missed a shit ton of ur games any way

/s"
,HowdyDoodlyDoo,1,1438470524,t5_2sjnz,,False,wiiu,1,t3_3fe76g,ctobyqp,,1440226468,0,t1_cto625v,0,"Well, at least the Europe one seems to be two things easily compared. Marshmallows and Hot Dogs seems like strange choice. Why not burgers and hot dogs?"
libertarian,ViktorV,1,1438470536,t5_2qh63,,False,Libertarian,1,t3_3ffheu,ctobyyd,,1440226469,0,t1_ctobs8v,0,"Nice, i was hoping you'd take the anti-gun washtingon post article and only read what you wanted instead of looking up the original source:

http://www.pewresearch.org/fact-tank/2015/04/17/despite-lower-crime-rates-support-for-gun-rights-increases/

Neat. It's been this way since 2005.

&gt;Pro gun-control crowds don't have to pay anyone anything.

https://www.opensecrets.org/industries/lobbying.php?cycle=2014&amp;ind=Q12

Liar. Granted gun manufacturers have a vested interest in this, but so do many Americans, so naturally they'll pay to protect their freedom/rights.

&gt;The rest of us, will just have to keep on keeping on the good old way: time and pressure

Yes, that's typically how tyrants take powers by enforcing their will on everyone else through attrition.


Boy, you can sure do a lot if no one could violently oppose you, huh? Maybe you should move to europe for your sweet socialist paradise of non-gun ownership.

Please do. When you come back with your tail between your legs about how over here is way better than there, I'll not say I told you so."
,heliotach712,1,1438470594,t5_2qh0u,,False,pics,1,t3_3fee5o,ctoc00o,,1440226484,0,t1_ctobu5h,0,"I'm from Europe, big cities have ghettos in the inner city areas – are you understanding 'ghetto' to mean just a poor neighbourhood? I mean places like Neukölln in Berlin."
European Federation,jtalin,1,1438470677,t5_2qh4j,EURO,False,europe,1,t3_3fbp1f,ctoc1fp,,1440226503,0,t1_ctobx3p,0,"&gt; They don't belong here because they aren't european and the reason they aren't is because they are illegals which means them being here is in itself a crime.

That is incorrect. They are asylum seekers, and seeking asylum in Europe is not a crime.

&gt; I am so fucking tired of people immediately being called racist as soon as they bring the issues about our current immigration problems, that is no way to have a proper debate

We were having a proper debate *right now*, and nobody has mentioned the term racism before you showed up.

Could it be that you're using the racism card to shut down the debate because the arguments aren't going your way?"
"6'5"" | 195 cm",MartinH,1,1438470931,t5_2qv8g,blue,False,tall,1,t3_3f8n3t,ctoc5wu,,1440226566,0,t1_ctn3ufh,0,"A word in support of Oddballs.  Oddballs was the first on-line shoe store that I found reliable and helpful.  I discovered them about ten years ago- perhaps more – after a couple of disastrous experiences with other firms. They started off by asking me to send them the outline of my foot (you know you’ve got big feet when you realise the outline won’t fit on an A4 sheet of paper), and they recommended sizes and models.  They told me that the ball of my foot is set further back than usual, and what models to look for. There was one mix-up over these ten years, not really their fault either, and they put a couple of complementary socks in the next order to make up.  

It’s a pity that postage has made it really uneconomical to ship to Europe, but in the USA, I wouldn’t hestitate."
MtF,LinaKatharina,2,1438470997,t5_2ub9j,trans,False,MtF,2,t3_3fg6jq,ctoc732,,1440226577,0,t1_ctobzvl,0,"With the european Healt insurance thing they should. But only in theory. 
I also always thought, that Dr. Schaff only uses this. But I recently heard it is very similar. But haven't that much either. If you want to risk some research, it's Dr. Schrögendorfer at the ""Wiener AKH"" 

The other one would be Dr. Angel at the Rudolfstiftung. He seems to be the better one and most Austrian girls are choosing him. "
,glacialthinker,1,1438471455,t5_2qh60,,False,ocaml,1,t3_3farxv,ctocf6i,,1440226689,0,t1_ctnw0go,0,"I was about to reply about being on the other side of the world, but then thought I'd check...

Vancouver! Well, that's relatively close. Still too far for my cheap and lazy arse ($500 round trip over the mountains). But I just assume these are always in Europe, or maybe the distant side of the US.

Anyway, that's a wake-up call that I should actually check the locations for these workshops and meetings.
"
140,casinodave,1,1438471525,t5_3525u,,False,amiiboSwap,1,t3_3ffwr0,ctocgh2,,1440226706,0,t3_3ffwr0,0,Eu nib falcon for inkling girl?
,Andele4028,0,1438471666,t5_2r9po,,False,Guildwars2,0,t3_3ffck5,ctocivx,,1440226738,0,t3_3ffck5,0,"All (ok most till they get proper server localization and synch and make EU/NA only player database/interaction based instead of where the calculations are made like most international corporations use) of the skill lag would be fixed if they let GW2 multithread most of the work, for then they wouldnt overload on 2 or 3 blobs crashing."
,[deleted],1,1438471667,t5_2qh9i,,False,brasil,1,t3_3ffetc,ctociwh,,1440226738,0,t1_ctob22v,0,"Pelo que eu li, a história tem duas versões, o lado paraguaio e o nosso. "
,_dnms,1,1438471872,t5_30h51,,False,AgMarketplace,1,t3_3fewp5,ctocmjf,,1440226785,0,t3_3fewp5,0,Next weekend? Any EU vendor will probably be fine to Poland in under a week if you order Sunday/Monday. 
Commandant,KnotPtelling,2,1438472055,t5_2uqat,,False,eu4,2,t3_3febll,ctocppl,,1440226830,0,t1_ctoave2,0,"The native tribes traded with the Europeans and got lots of guns from them and many converted to Christianity, I'm pretty sure that's enough. "
,TheTT,1,1438472400,t5_2udw5,,False,Cloud9,1,t3_3fge2k,ctocvqj,,1440226905,0,t1_ctock5c,0,"Yeah, but the CS scene is much stronger in Europe, so I would expect them to sell reasonable amounts of C9 swag over here."
,SnowGN,2,1438472451,t5_2qhvo,,1438472691,Israel,2,t3_3f93gc,ctocwlo,,1440226917,0,t1_ctoc3a6,0,"The British had very clear pro-Arab sympathies. They were implicitly co-operating in the Holocaust by sending Jewish refugees from Europe during WWII....back to Europe of all places! They did nothing to prevent illegal Arab immigration into the Mandate territories while doing a vast amount to prevent Jewish immigration. They prevented the Jewish Agency from obtaining weaponry, while allowing the Arabs to do so. Most of the prime British fortresses and legacy weaponry were left to Arab hands. Numerous Britons even worked with, fought with, the Arab armies. The Irgun were entirely justified in attacking King David, and if I lived in Israel at the time, I would have had few compunctions about assisting in the attack. I freely admit that I'm a very right wing Zionist, I likely would have gone militant if I lived in Israel at the time, and the British were legitimate targets that were all but collaborating with the Arabs to destroy the nascent Israel. Screw them. I only regret that more of them weren't killed on the way out. I will never ever forgive Britain for assisting in the Holocaust as it did. Maybe I'd have a lot more family alive today if they hadn't decided to curry favor with the Arabs. I lost a lot of family in Eastern Europe....

As for ethnic cleansing. Meh. At least some was needed for Israel to become a Jewish majority democracy and a functional state without a malevolent internal fifth column. Israel would be a lot more secure today if Ben-Gurion hadn't wavered at the end and gone through with finishing the ethnic cleansings.

Think of me however you will. I make no apologies."
,Asyx,0,1438472530,t5_2qhwp,,False,Games,0,t3_3fe6kz,ctocxyi,,1440226988,0,t1_ctnyzp2,0,None of that matters because the EU is already treated like one region for most services.
,lobwege,1,1438472581,t5_2s9oz,,False,keurig,1,t3_3fga3o,ctocytz,,1440227000,0,t1_ctocbas,0,"WATCH HERE&gt;&gt;&gt;&gt;&gt;&gt; http://dmmp2p.eu/tv1.html

WATCH HERE&gt;&gt;&gt;&gt;&gt;&gt; http://dmmp2p.eu/tv1.html

WATCH HERE&gt;&gt;&gt;&gt;&gt;&gt; http://dmmp2p.eu/tv1.html

WATCH HERE&gt;&gt;&gt;&gt;&gt;&gt; http://dmmp2p.eu/tv1.html

WATCH HERE&gt;&gt;&gt;&gt;&gt;&gt; http://dmmp2p.eu/tv1.html

WATCH HERE&gt;&gt;&gt;&gt;&gt;&gt; http://dmmp2p.eu/tv1.html

WATCH HERE&gt;&gt;&gt;&gt;&gt;&gt; http://dmmp2p.eu/tv1.html

WATCH HERE&gt;&gt;&gt;&gt;&gt;&gt; http://dmmp2p.eu/tv1.html

WATCH HERE&gt;&gt;&gt;&gt;&gt;&gt; http://dmmp2p.eu/tv1.html

WATCH HERE&gt;&gt;&gt;&gt;&gt;&gt; http://dmmp2p.eu/tv1.html

WATCH HERE&gt;&gt;&gt;&gt;&gt;&gt; http://dmmp2p.eu/tv1.html

WATCH HERE&gt;&gt;&gt;&gt;&gt;&gt; http://dmmp2p.eu/tv1.html

WATCH HERE&gt;&gt;&gt;&gt;&gt;&gt; http://dmmp2p.eu/tv1.html

WATCH HERE&gt;&gt;&gt;&gt;&gt;&gt; http://dmmp2p.eu/tv1.html

WATCH HERE&gt;&gt;&gt;&gt;&gt;&gt; http://dmmp2p.eu/tv1.html

WATCH HERE&gt;&gt;&gt;&gt;&gt;&gt; http://dmmp2p.eu/tv1.html

WATCH HERE&gt;&gt;&gt;&gt;&gt;&gt; http://dmmp2p.eu/tv1.html

WATCH HERE&gt;&gt;&gt;&gt;&gt;&gt; http://dmmp2p.eu/tv1.html

WATCH HERE&gt;&gt;&gt;&gt;&gt;&gt; http://dmmp2p.eu/tv1.html

WATCH HERE&gt;&gt;&gt;&gt;&gt;&gt; http://dmmp2p.eu/tv1.html

WATCH HERE&gt;&gt;&gt;&gt;&gt;&gt; http://dmmp2p.eu/tv1.html

WATCH HERE&gt;&gt;&gt;&gt;&gt;&gt; http://dmmp2p.eu/tv1.html
"
,KirbyMew,6,1438472733,t5_33726,,1438517143,KotakuInAction,6,t3_3fg802,ctod1ga,,1440227069,0,t3_3fg802,0,"sjw is not dehumanizing it is pointing out their hypocrisy and logical fallacies

the problem are the overly politically correct, sex negative (all sex is rape / kill all men), extreme gender feminists always saying everyone else are not feminists 
(equity feminists, elder generations of feminists, secularists and humanists.)

They behave like cultists, apologists. Hypocritical bigots.
Professional victims, conmen / scammers.
And protected by a following of similar witchhunting hate mobs and gullible white knights

So easily offended / triggered and believing that one have to silence, censor ""bad"" thoughts and words.

Not to mention they are the same in behaviour as the Atheism+ cultists / SJWs https://archive.is/i8cCH 

(to me SJWs are people pretending to be for social justice, just use it to bully or pretending to be superiour and or authoritarian censorship by moral panic or ostracizing shame tactics) = neo puritans



___

Personally I find the american democrat republican left right is way different than the european multi party system. One can agree with a lot of things with some parties and a bit less with some.

Me personally have voted for CDA, PVDA, D66, Groen Links en partij voor de dieren, before. And only these partys


___

To me all this is the same as criticizing the torah, bible, koran, asian mixture of religions and lesser deity worship, magic, voodoo, extremists of any kind of ideology, anti vaccers / vaxxers / vaccination, anti science, creationism, scientology, bullshit, hypocrisy, scammers, 419, misinformation, PETA, extreme diets of only certain foods, holistic healing etc. All exhibit similar behaviours and tactics. (especially banning, blocking, silencing of valid criticism )

___
[Edit]
There is also a big difference with criticism and
slander of people that they are anti women, misogynist, racist, harassing women out of the industry and gaming ( evidence pls ), worse than ISis / terrorists ( evidence like there is evidence of ISis pls )
All I have seen are the pretending for equality people scaremongering women and potential competitors from it all. And enabling scammers, conmen.

"
,fenian1798,1,1438472839,t5_2qh1i,,False,AskReddit,1,t3_3fel84,ctod3e0,,1440227093,0,t1_ctobkl2,0,"All these sarcastic replies...

I'm European (Irish) and the situation with Muslims isn't too bad here, but in Sweden (for example) it has gotten out of control."
Vancouver Whitecaps,stinstmaster42,3,1438472893,t5_2rbnb,vancouver-whitecaps,False,MLS,3,t3_3ff848,ctod4b3,,1440227105,0,t1_ctobv9i,0,"I like our FO. It's owned by former players and local hero Steve Nash. They're more than willing to let Robbo, the coach, do his thing, and one of the biggest points is to produce Canadian talent, which I think is awesome. There's also a lot of South American players who could in 5 years play for Canada if they don't leave for Europe and make us huge $$$. That being said, the FO is pretty reluctant to spend money. We aren't going to jump on a player with TAM this year, nor will we likely sign anyone this window. We spent 3 million on Rivero, the most we've ever spent (before that was Kenny Miller for 105,000). To compare, Portland signed a new player for 5 million last week. Dempsey and Martin's both make more than our team I believe. But I like having the Diamond in the rough kind of players, so I really like the FO.


I hope you enjoy the West Coast, it's awesome here and hopefully you'll never see the cup because it's where it belongs"
,TimezoneSimplifier,0,1438472970,t5_2qpp6,,False,starcraft,0,t3_3fg9j4,ctod5n7,,1440227123,0,t1_ctod3pz,0,"#####&amp;#009;

####&amp;#009;

######&amp;#009;
09:30:00 (America/Chicago) converted to other timezones:

[In your timezone / auto detect](http://www.simplify-time.info/event-reddit-comment-ctod3pz)

Timezone | Common Abbrev. | Time | DST active
:---------:|:---------:|:---------:|:---------:|:---------:
UTC|UTC / GMT|14:30:00|NO
Europe/London|GMT / BST / WET / WEST|15:30:00|YES
Europe/Berlin|CET / CEST|16:30:00|YES
Africa/Dar_es_Salaam|EAT|17:30:00|NO
Europe/Moscow|MSK|17:30:00|NO
Asia/Kolkata|IST|20:00:00|NO
Asia/Jakarta|WIB|21:30:00|NO
Asia/Shanghai|ULAT / KRAT / SGT|22:30:00|NO
Asia/Seoul|KST / JST|23:30:00|NO
Australia/Sydney|AEDT / AEST|00:30:00|NO
Pacific/Auckland|NZST / NZDT|02:30:00|NO
Pacific/Honolulu|HST / HAST|04:30:00|NO
America/Anchorage|AKST / AKDT|06:30:00|YES
America/Los_Angeles|PST / PDT|07:30:00|YES
America/Phoenix|MST|07:30:00|NO
America/Denver|MDT|08:30:00|YES
America/Chicago|CDT|09:30:00|YES
America/New_York|EST / EDT|10:30:00|YES
America/Sao_Paulo|BRT / BRST|11:30:00|NO
America/St_Johns|NST / NDT|12:00:00|YES


---

Info: This message was submitted by a bot.

Feedback, Problems and Questions: /r/TimezoneSimplifier

Comment unhelpful? Downvote it! Comments with less than 0 points will be deleted and won't block space in this thread."
,Empty1388,2,1438473229,t5_2qqjc,,False,todayilearned,2,t3_3feypn,ctoda8k,,1440227182,0,t1_ctoac3a,0,"That is exactly what Stalin said on June 21st, 1941 (one day before the largest land invasion of its kind up to that point in history by Hitler and axis Europe, against the USSR)"
,DaveyGee16,2,1438473310,t5_2ssp3,,False,AskHistorians,2,t3_3ff2vh,ctodbnj,,1440227202,0,t1_ctoczxq,0,"There is something strange about the calories theory, it's mostly used when talking about South-East Asia. I'm not **sure** why (I've never read a reason), but it's far more linked to Asia than with Europe.



"
28/M/NYC,jason64128,2,1438473538,t5_2rct2,,False,OkCupid,2,t3_3ffnld,ctodflt,,1440227253,0,t1_cto62j0,0,"They used to send it to you when you reached a certain question threshold. For some reason you couldn't access it ad hoc, just at that one time. Also included world map and Europe in the email. Maybe they still do it - OP says he reset all of his questions and then got it as he was answering. "
,atiradorAAA,2,1438473589,t5_2rfxx,,False,leagueoflegends,2,t3_3ffv09,ctodgig,,1440227268,0,t1_cto9jgp,0,"there is a point behind all of those insults lol, its true in europe they would develop more"
,Frogad,1,1438473682,t5_2rfxx,32 team,False,leagueoflegends,1,t3_3fgj1j,ctodi54,,1440227286,0,t3_3fgj1j,0,"As someone who supports Fnatic it's probably because the fans believe things like ""fnatic being the third best"", come on dude? LGD, EDG, Qiao Gu, SKT damn even AHQ are probably better than Fnatic. I want Fnatic to win I really do, right now in EU they are my favourite players (except from Froggen) but damn can't the fans show a bit of humility.

Fnatic fans became the very thing they swore to destroy, they were meant to bring balance to the EU v NA circle jerk not turn it around."
,Liverpoolclippers,2,1438473733,t5_2s84e,,False,NBA2k,2,t3_3ffa06,ctodj1c,,1440227300,0,t1_ctodfc4,0,"US-East (Virginia)	138 ms

US-West (California)	218 ms

US-West (Oregon)	200 ms

Europe (Ireland)	47 ms

Europe (Frankfurt)	63 ms

Asia Pacific (Singapore)	257 ms

Asia Pacific (Sydney)	345 ms

Asia Pacific (Japan)	303 ms

South America (Brazil)	289 ms"
