body,distinguished,created_utc,score,gilded,ups,controversiality,subreddit,id,link_id,author_flair_text,author,author_flair_css_class,parent_id,subreddit_id,edited,retrieved_on,stickied
"Try this one.
http://www.aliexpress.com/item/Casual-Design-Men-Credit-Card-Holder-Genuine-Leather-ID-Card-Holder-European-Famous-Brand-Card-Wallet/32458034396.html

 I haven't bought this one, but it looks like a good one. Their store is highly reputated &amp; the product is indeed LV (Louis Vuitton). I'm not 100% sure that it comes with the LV packaging, just send them a message if it does.

If the product is really bad, then you could just open a dispute on Ali and 90% of the time you get your money back.
Anyways, good luck buying. Hope I helped!",,1448962982,1,0,1,0,FashionReps,cxiyzg1,t3_3uykr8,,reppinmeh,,t3_3uykr8,t5_31hcv,False,1451365944,False
"because corporations are partly to blame. Indonesia is burning down it's forests for palm oil in the name of money, which will ultimately serve American and European companies as an example, but the Indonesian farmers will still be poor as hell. 

It's the exploitation of resources and destroying what you cannot profit from is helping to destroy the planet along side, huge carbon emissions and turning the land into concrete.",,1448963241,2,0,2,0,worldnews,cxiz1lm,t3_3uwpne,,CMDRAescwulf,,t1_cxiwnmh,t5_2qh13,False,1451365973,False
"I had never visited America until recently, and you guys really are different to EU. It wasn't a massive culture shock, but I was surprised.

It's basically little differences, but in EVERYTHING. Guys I thought seemed super down to earth would suddenly come out with stuff that was really shocking (to me) e.g. a guy who owned a load of assault rifles. Your serving sizes are on another level. The car culture is very different. Also, your cars are louder. It's kinda weird. I'm sure even the same models are just louder over there, someone told me it was to do with EU regulations so Americans don't have to use as much sound insulation but I reckon its an American preference.

And some really out there encounters, e.g. a lady from new York who was genuinely shocked police in the UK aren't armed and asked ""aren't you worried about ISIS?"".

It's just a collection of little things that gradually make you realise you really do have a different culture. I personally quite liked how over the top everything was, how overly friendly the service was etc. Also stuff seemed a lot cheaper, again especially your cars.

Oh and your TV is mad and is like a perfect representation of how we view America - like a parody come to life.

Love you crazy bastards.

Edit: also people on the phones in the car, even my taxi driver was at it. I was tempted to ask him to stop. And smoking in bars! But these are recent changes to the UK I suppose.",,1448963326,134,0,134,0,worldnews,cxiz2bd,t3_3uy8cf,,dalonelybaptist,,t1_cxiyrc9,t5_2qh13,1448965171,1451365982,False
"You're saying ""prohibited from diversification of economics"" as if it's something that can be done with a click of your fingers, and only personal preference of the leaders stops it from becoming true.

Russian tech base for consumer goods was in the shitter and cost a ton. Just look at AvtoVAZ, it took 20 years of government subsidies and foreign investments (and licenses) for them to start making cars that at least look decent - there's no way in hell our car industry are competitive with German, Japanese or even Korean industry. And the same is true with other industrial bases.

In an open economy, you have to keep the competitive edge, and it takes time, huge investments, and lack of opportunities in other fields. Service was almost non-existent in USSR, so that was a place for a huge margin of profit; it's way easier, cheaper, more profitable  and faster to open a dozen of restaurants or barbers' shops than a small plant. Same is true on the country level - why pour billions of cash in the failed industrial sector when you can funnel it into other areas that will give more bang for its buck?

Corruption didn't help, of course. But it's not like eliminating corruption is a requirement for the prosperous economy. While Europe does it to a certain degree, both USA and China (top 2 economies in the world) are corrupt as fk - USA has the corruption on the high level, while China has it on all levels, so even different styles of corruption don't prohibit from having a huge economy. Is Poland free of corruption? Is India? Brazil? And those are the countries with really high economy growth rates.",,1448963401,0,0,0,0,russia,cxiz2wo,t3_3uvili,Moscow,Sarkat11,moscow,t1_cxixann,t5_2qh75,False,1451365989,False
"Dave’s daily dilemmas: Given the number of times he and George have laid pratfall traps for the Labour party. Can he be sure that their assurances of support for bombing aren’t part of a payback plan? Somehow ignoring the historical lesson, that taking on the enemy of an enemy frees that regime to concentrate on extermination of their own troublesome population. Jeremy’s well concealed joy, at blue Labour MPs setting themselves up for disenfranchised constituencies to de-select them. By virtue of what transpires next, following their unbridled allegiance to Tory war hawks with a lack of original ideas.  Presumably getting the Syrian government to make a democracy deal with rebels as a condition of taking on ISIS, is out of the question? Blanking any realisation concerning the incongruence of a claim that blowing up a small section of a foreign state will halt terrorist plots. When anyone can see that, just like unchallenged conservative ideology,  ill-conceived back-of-fag-packet plans can be hatched anywhere. Placating corporate caliphate pals concerning a tax on sugar, and proper labelling of comestibles. Thus curbing their ability to covertly-kill and quietly-maim more of the population than radicals could ever hope to. Cries of “Nanny State”, seeming to gloss-over the reality that fluoride is already added to drinking water for reasons of health. Resolving irresolvable paradoxes, such as: Labour is always wrong, by default. Yet Labour wants Britain to remain in the EU…",,1448963574,0,0,0,1,unitedkingdom,cxiz4bg,t3_3uz8rx,,kindlyenlightenme,,t3_3uz8rx,t5_2qhqb,False,1451366008,False
"To reply to all of you ;

The chain is there so the monkey (ape?) can be walked by visitors (see other users comments). That is only for the amusement of the visitors, but for the health or benefit of the animal. An non domesticated animal like this kept in captivity should have more than enough room in its accommodation to not need the chain. Literally all zoos in Europe I've been to have this. Keeping a monkey on a chain is immoral and SICK. ",,1448963603,3,0,3,1,AnimalsBeingGeniuses,cxiz4kg,t3_3uwl2t,,DutchGargravarr,,t1_cxix1bc,t5_2z6fi,False,1451366011,False
I agree with you. But Europe is no more poorer if languages such as Breton or Occitan are lost either.  ,,1448963808,5,0,5,0,europe,cxiz69k,t3_3ux2ye,Éire,gamberro,IREL,t1_cxiyxgt,t5_2qh4j,False,1451366033,False
He [is indeed a neo-Nazi](https://np.reddit.com/r/european/comments/3utmtv/bnp_carlos_cortiglia_london_mayor_candidate/cxhpooo).,,1448964051,5,0,5,0,news,cxiz89h,t3_3uxvk1,,breecher,,t1_cxiy8pe,t5_2qh3l,False,1451366060,False
None of the western countries would want that. It would mean they actually would have to take in their fair share of people. No more pawning everyone off to southern or eastern european countries.,,1448964270,-15,0,-15,0,europe,cxiza15,t3_3uyqco,,Mundlifari,,t1_cxiyy23,t5_2qh4j,False,1451366083,False
YellowStar is currently in game right now.. He's still in EU..,,1448964310,1,0,1,0,leagueoflegends,cxizacn,t3_3uyv2j,,YoAnusCespedes,team 00,t1_cxiza24,t5_2rfxx,False,1451366087,False
"At the time the majority of people in Europe would have known major members of the Austro-Hungarian empire's monarchy, the wider world perhaps included. Don't think Serbia is that insignificant either, Nikola Tesla was born there and he is responsible for electricity. Don't underestimate small countries, they are currently the most successful.",,1448964316,8,0,8,0,history,cxizaec,t3_3uxmdp,,PordanOfPerth,,t1_cxiz26z,t5_2qh53,1448972820,1451366088,False
"&gt; If it was, you'd be as bad as Netherlands.

This is possible (I expected the percentages across Europe to be much higher too), but why do you think Israel would fall in line with the Netherlands and not one of the other countries (Germany, Portugal, ...)?",,1448964416,1,0,1,0,europe,cxizb61,t3_3uz0qs,Void,HighDagger,ANAR,t1_cxiyuzw,t5_2qh4j,False,1451366098,False
"For EU


Roster Changes
Importance of Match
Potential of winning / qualifying out of group stages
Previous results
Stand in


NA 

Twitter 
Social media basically
Players recent matches
History of throwing / upsets


CIS / Asia

Roster changes 
Odd shift of match 
Recent results 
LAN/ online


There might by other factors which I do consider but probably don't remember as I'm writing this",,1448964428,1,0,1,0,csgobetting,cxizb9z,t3_3uyz5t,knowcsgo.com,rohansamal,reliable,t3_3uyz5t,t5_2zume,False,1451366099,False
"&gt; All european countries have had a hand in creating the problem. 

How has Estonia had a hand in creating this problem?",,1448964801,19,0,19,0,europe,cxizea3,t3_3uyqco,Bestonia,StrukkStar,ESTO,t1_cxiz69y,t5_2qh4j,False,1451366139,False
"&gt; UK is part of the EU.

wouldn't say that just yet. ",,1448964858,1,0,1,0,leagueoflegends,cxizeqb,t3_3uyv2j,,Doctorwinalot16,,t1_cxizbrl,t5_2rfxx,False,1451366144,False
"&gt;Μπορείς να τους περισυλλέγεις, να ξεχωρίσεις τους πρόσφυγες από τους οικονομικούς μετανάστες, και να στέλνεις τους δεύτερους πίσω στην Τουρκία.

[Nομίζω δεν έχεις καταλάβει τι κάνει ακριβώς ο Ερντογαν με τους πρόσφυγες - και γιατί δεν γίνεται αυτό που λες.](https://www.quora.com/After-years-of-Syrian-refugees-moving-to-Lebanon-Turkey-and-Jordan-what-was-the-catalyst-to-create-this-massive-migration-to-Europe). Ακολούθα και τα λινκς στο κείμενο, δεν είναι κακή ανάλυση.",,1448965176,2,0,2,0,greece,cxizh6a,t3_3ur8wu,,TourettesPoetry,,t1_cxidjxn,t5_2qh8i,False,1451366176,False
I love this! Yet another way to contribute from Europe. Online gaming is probably one of the few places where I regularly encounter Americans in my daily life. Thanks for sharing the idea. ,,1448965227,1,0,1,0,SandersForPresident,cxizhiy,t3_3uyv86,Denmark,Nosyeye,,t3_3uyv86,t5_2zbq7,False,1451366181,False
"Why the fuck would we need US approval for sanctions? We dont.

What we should do is a carrot and stick method. If they accept illegal migrant repatriations, then we pay them billions of euros and also give them other perks (no visas?). If they dont, then we use sanctions against them, sue them in international courts etc. Europe is the biggest trading partner of Turkey, any sanctions against them would be devastating, so it probably wouldnt take long for them to change their tune. In theory, we would be justified even in responding by force, dumping migrants on another sovereign country could be considered an act of war, but lets not go there..",,1448965272,1,0,1,0,europe,cxizhvj,t3_3uurqw,Slovakia,Maslo59,SVAK,t1_cxizdrq,t5_2qh4j,False,1451366185,False
"Again money and greed destroy something that was once fun and interesting.
EU, as a region that cannot generate as much money from sponsoring as NA does, is falling apart. Not because they don't have skill, but because others have the bigger bags. That sucks.",,1448965534,0,0,0,1,leagueoflegends,cxizjv5,t3_3uwadl,,marpeline,11 team,t3_3uwadl,t5_2rfxx,False,1451366212,False
"Medlion#2567 on EU. Usually end around rank 10 (best is rank 8), looking for people that can help me improve",,1448965619,1,0,1,0,hearthstone,cxizkin,t3_3t36aw,,Medlion1122,gnomes9,t3_3t36aw,t5_2w31t,False,1451366220,False
"Eu lembro de ter lido, já faz um tempo isso, que o sorteio da megasena era feito com dois globos. Um contendo as bolinhas de dezenas e outro com as bolinhas de unidade. A cada número sorteado as bolinhas retornavam para os seus respectivos globos. Isso dificultaria e muito que as bolinhas fossem viciadas. Mas lendo o documento disponibilizado no site da Caixa agora só é utilizado apenas um globo com números de 01 a 60.

[REGULAMENTO
LOTERIAS](http://www.caixa.gov.br/downloads/caixa-loterias/Regras_dos_sorteios.pdf) página 6 diz:

&gt; MEGA-SENA

&gt; 1. É utilizado 1 globo, carregado conforme quadro abaixo:
Ordem dos
Globos Bolas numeradas
Globo único 01 a 60
2. O sorteio consiste na extração de 6 números diferentes, no universo de 01 a 60.

De fato o sorteio pode estar sendo manipulado.",,1448965653,1,0,1,0,brasil,cxizkss,t3_3uvcow,,pdrummondf77,,t1_cximebb,t5_2qh9i,False,1451366223,False
"Je suis pas certain que y'ait vraiment eu une cassure précise.

En tant que très jeune adulte je pouvais dire ce que je voulais sur le fait de ""s'installer et faire sa vie"", mais n'empêche qu'inconsciemment j'avais déjà organisé ma vie de façon à bouger régulièrement, de rarement rester au même endroit très longtemps et de pas m'engager sur un plan de carrière ferme. 

J'ai quand même fait une tentative honnête de m'installer en ré-emménageant dans ma ville d'origine depuis quelques années, mais ça n'a fait que m'apporter la confirmation que c'était encore prématuré et que j'ai pas encore épuisé mon quota d'aventure. J'ai tourné en rond bien plus vite que je ne pensais.

Je crois que y'avait juste un décalage entre mes préférences réelles et celles que je voulais bien afficher. 

Pour le volet sentimental c'est tout con. J'ai compris que j'étais pas prêt à m'engager le jour où ma première relation sérieuse m'a posé un genre d'ultimatum, j'y avais jamais réfléchi avant mais j'ai quasi paniqué à la seconde où j'ai compris que je manquais trop d'expérience pour pouvoir envisager sérieusement d'épouser la ""première venue"". Depuis je me dis que tant que j'ai pas atteint un certain seuil d'expérience tout engagement sérieux n'est pas encore bon à prendre.",,1448965769,3,0,3,0,france,cxizlpl,t3_3uz525,U-E,jeanralph,ZBSVUE,t1_cxiz8si,t5_2qhjz,1448965960,1451366235,False
"Presupun ca atunci cand vorbesc de Holocaust vorbesc de cel creat de  suedezi prin cele mai interesante ""registre"" si discriminari impotriva tiganilor chiar pana in anul 1996. [\[1\]](https://www.opendemocracy.net/can-europe-make-it/mattias-gardell/swedens-dirty-little-secret)",,1448965777,2,0,2,0,Romania,cxizlrt,t3_3uw5dc,,ax8l,,t3_3uw5dc,t5_2qm35,False,1451366236,False
"Yep. My account was linked to my HK number, and when I posted stuff to moments, none of my mainland contacts could see it (regardless what it was), although HK and other contacts could see everything fine. 

So I linked my account to my eu number and sure enough all my moments were viewable to my mainland contacts again. ",,1448965955,1,0,1,0,China,cxizn37,t3_3uycgf,European Union,exceptionalaverage,europeanunion,t1_cxiv823,t5_2qh2v,False,1451366253,False
"A cooperation with Russia? Only if we create a European army.

Putin is neither trustworthy nor an all in all good guy. He wants consensus in his country (through minor wars), influence in the world (even though he's a regional power) and convince westerners to stop sanctions.
If we cooperate with him, we have to make sure to deter further Russian expansion by creating a unified European Army, firmly stationed at the border.

",,1448966112,2,0,2,0,PoliticalDiscussion,cxizobk,t3_3uyu3v,,von_Hytecket,,t3_3uyu3v,t5_2sfmf,False,1451366270,False
"completely unknown players? probably a small minded bandwagoner who only watches the NA and EU lcs. If you weren't smallminded you wouldve known what their backgrounds were and that they were not completely unknown, fnatic didnt just hope that random solo queue challengers would work in fnatic, they actually knew what they were doing all along unlike you. 


Life in e-sports as a player is short so you have to make the most out of it, so having whiny little fanboys like you who do not understand careers and only wish for loyalty are completely ignored by these players. You cannot compare yellowstar to huni/reignover because they have not made as big of a name for themselves yet and need to make the most out of their limited time as pro-players in some other fashion. you cannot assume that people who are talented and successful would stay with team that pays them lower than they are actually worth.",,1448966185,0,0,0,0,leagueoflegends,cxizowi,t3_3uz9o6,(⌐▀͡ ̯ʖ▀),xadiyo,jayce,t3_3uz9o6,t5_2rfxx,False,1451366277,False
"No, their goal is that the borders stay open. That's why there was an attack in Paris during this refugee situation, to make sure Europeans will accept even more Muslims. /s",,1448966534,2,0,2,0,europe,cxizrmd,t3_3uuv84,Germany,versooo,GERM,t1_cxifacv,t5_2qh4j,False,1451366313,False
"They have it over here in Europe, but it's only the sugar free version, though. ",,1448966536,1,0,1,0,AskReddit,cxizrmx,t3_3usgaq,,Painkiller90,,t1_cxhh5cj,t5_2qh1i,False,1451366313,False
There's much more money in American eSports though. That's why EU struggles to pay as much.,,1448966557,1,0,1,0,leagueoflegends,cxizrsb,t3_3uwadl,,Waveh,,t1_cxibn5x,t5_2rfxx,False,1451366315,False
"I'm with you bro, same shit different land (Czech republic, Europe) but we'll make it through this valley of the shit and live to fight (but not to fap!) another day. ",,1448966558,1,0,1,0,NoFap,cxizrsl,t3_3uw3dy,30 days,Darrowww,month1,t1_cxiezkn,t5_2skrn,False,1451366315,False
"&gt;What official/unofficial capacity would Trudeau's wife be fulfilling in Europe?

Do we really need to run down all the overseas trips Mrs. Harper accompanied her husband on? Has it come to that?",,1448966783,4,0,4,0,CanadaPolitics,cxiztjt,t3_3uy89t,Girondin,ScotiaTide,bloc,t1_cxiua4f,t5_2s4gt,False,1451366338,False
"One idea presented by a Polish MP was that they would be trained and equipped with old soviet era equipment in eastern Europe and sent back via Turkey.  

",,1448966986,2,0,2,0,australia,cxizv4w,t3_3uy709,,Ayrr,,t1_cxiwlfg,t5_2qh8e,False,1451366359,False
"same here. aliás foi a primeira sala nacional a ter digital. de tal modo que logo após a inauguração, se bem me lembra, o saraband do bergaman, só deu nessa sala por escolha do próprio.
em relação ao starwars é fazeres como eu: acalmar o pito, e deixar correr algum tempo sobre a esteia do filme e ires para ""IMAX ;)",,1448966989,1,0,1,0,portugal,cxizv5q,t3_3qjzz0,,pedrodoprior,,t1_cwftx4q,t5_2qmie,False,1451366359,False
"You sound awfully confident about not breaking through $300.  We were below $200 three months ago, so that says a lot...just three short months ago and no major change in Bitcoin ecosystem fundamentals since then...  

And I don't see it breaking through $300 either in the next month in the absence of bad news.  But block size controversy could do it and also strict regulation by the EU or any number of other things.

Don't get over confident about staying over $300..could be a very costly mistake.  I usually make my worst trades and lose the most money when I'm overly ""sure"" about something.  Market loves to hit you hardest at that point.",,1448967022,-2,0,-2,1,BitcoinMarkets,cxizvg3,t3_3uybvq,Bearish,thecosmic1,bearish,t1_cxizpfc,t5_2wwh3,False,1451366363,False
"&gt; 'Hey niggerfaggot, whoops, called you a niggerfaggot, oh well, you can't fire me for some alleged shit-talking in this country, ahahahaha!""

Work place law covers just that, the work place. If you were to say this in the workplace you absolutely can get repercussed, which in this case would most likely be documented through formal warning. To fire someone legitimately the reasons need to be provable if contested. For instance, lets say I fire an employee for poor performance, I'd need to back this up. These are usually done though annual/monthly/sometimes spontaneous performance reviews. Or if we use your case and someone was using racial slurs, this also needs to be legally proven (this is why formal warnings are adopted in a lot of places). Lets take it one step further and I claim a receptionist position is redundant just to get rid of them, as a company I cannot employ another receptionist until a certain time period has passed as the company has claimed the position was redundant.

Now, if I was to act generally stupid outside of work this has no legal ground for termination because it has nothing to do with the work place or company (aside from some extreme circumstances, like being a fugitive or something).

There is one exception to this here and that is casual contracts. Here you don't get the law designated sick leave and annual leave (full time employees in general are entitled to 8 paid sick days a year and 4 weeks paid annual leave a year), but you earn a higher hourly rate than full/part time to make up for it (An example of this, a call centre employee may make 24/25ish an hour, where as the casual equivalent could be somewhere around the 28/29 an hour) The downside (goodside to some?) to this that both the employee or employer can end the work contract whenever they want. There is also no set hours for casual work, usually.

This is at least how it works in my country, and I'm pretty sure it's similar in parts of Europe.",,1448967120,1,0,1,0,news,cxizw9b,t3_3uxvk1,,[deleted],,t1_cxizqk8,t5_2qh3l,1448967897,1451366373,False
"+1 to this. Here's a tiny list of stuffs that we hold close to our heart (positively or negatively) :

* The city of Liverpool and its history 
* Bill Shankly
* Bob Paisley
* Anfield 
* Liverpool history and its relationship with Everton &amp; Man Utd
* Hillsborough &amp; dont buy the s*n
* Kenny Dalglish 
* Steven Gerrard 
* Helsey
* 5 european cups, 18 leagues
* Rafa Benitez
* Gerrard Houllier
* 100 players who shook the Kop
* Liverpool chants
* The take over from FSG 
* Recent seasons where we were utterly dominating: 04-05, 06-07, 08-09, 13-14

I think that's enough bread on your plate to start of with. Afterwards you'll know enough to dig on your own and actually enjoy reading trivial stuffs with regards to the club &amp; football in general, such as who are on the starting line up of the under 18s, who's the first team's head of medical science, the changing of tactics throughout the years, legendary players etc. 

Do it at your own pace though and don't mind the negativity of certain people. 

Liverpool loves hard working &amp; down to earth lads, keep that in mind.",,1448967129,1,0,1,0,LiverpoolFC,cxizwc5,t3_3uyhko,,raseksa,lfcflame,t1_cxiu64x,t5_2qn0o,False,1451366375,False
"&gt;PTR FROM EU IS LIKE DIALLING BACK THE INTERNET 15 YEARS.

I AGREE!!!1",,1448967314,2,0,2,0,Diablo,cxizxuq,t3_3uuwwe,,pfzt,,t1_cxhzgfm,t5_2qore,False,1451366395,False
"Poti sa dai charge back foarte usor. Si paypal tine cu cumparatorul.

De exemplu eu iti cumpar o chitara; trimit banii si tu trimiti chitara. Eu ii zic la paypal ca nu e ceea ce am cumparat. Paypal imi da banii inapoi, tie ti ia sau te trece pe minus. Si eu nu trebuie sa returnez [chitara](http://www.huffingtonpost.co.uk/2012/01/04/paypal-forced-ebay-buyer-violin-counterfeit-_n_1183687.html).

La vanzari online, unde itemul nu poate fi distrus, paypal doar returneaza banii si itemul ramane la tine. Poti da charge-back usor. Se intampla intr-o perioada foarte usor in jocuri ca WoW, TF2, CS:GO, etc...

Mai sunt [o](https://www.reddit.com/r/Entrepreneur/comments/mkdnz/paypal_is_holding_my_money_its_about_to_sink_my/) gramada de cazuri diferite in care iti retine banii random... poate au nevoie de bani pentru o luna sa scoata mai multa dobanda.",,1448967577,5,0,5,0,Romania,cxj002m,t3_3uyz02,CJ,nusmesa,cluj-napoca,t1_cxiy8ox,t5_2qm35,False,1451366423,False
"The country you're so righteously talking about took in 2 million refugees, spent 6 billion dollars on of its own money to build camps to house and feed them while the Europeans are freaking out over a few thousand. It's obvious who doesn't believe in human rights.",,1448968214,2,0,2,0,europe,cxj05cq,t3_3uurqw,Turkiye,Atopha,TURK,t1_cxi6hgj,t5_2qh4j,False,1451366493,False
Iceland is a European nation..? ,,1448968278,1,0,1,0,todayilearned,cxj05w1,t3_3uylvu,,alritealritealrite,,t1_cxiv1b1,t5_2qqjc,False,1451366500,False
"European liberal here with democratic socialist leanings. I know my younger brother agrees with my views on this subject too and he is more of a democratic socialist with communist leanings. There's people here from all sorts of political backgrounds, that's what I like about reading this sub, that's why conservative articles being posted doesn't bother me one bit.

I am able to decide for myself which parts of their articles I do agree with and which parts of their artices I do not agree with.

Also upvoted your post for dissident ideas. I always enjoy hearing those, especially when contemplating the validity of arguments against us.",,1448968411,2,0,2,0,KotakuInAction,cxj070f,t3_3uz6fi,,Lakedaimoniois,,t3_3uz6fi,t5_33726,1448970365,1451366514,False
"The best way that this could have been avoided was for europe to have dealt with the trouble in the european neighborhood on their own!

",,1448968560,1,0,1,0,europe,cxj08bs,t3_3uurqw,Belgium,stolt,BELG,t3_3uurqw,t5_2qh4j,False,1451366531,False
"Why employees are then paid for mileage instead of hourly? O_o

Doesn't make sense to my european mind.",,1448968661,0,0,0,0,pics,cxj096l,t3_3ush3c,,DavidRoyman,,t1_cxj05z3,t5_2qh0u,False,1451366542,False
