body,distinguished,created_utc,score,gilded,ups,controversiality,subreddit,id,link_id,author_flair_text,author,author_flair_css_class,parent_id,subreddit_id,edited,retrieved_on,stickied
"Thanks for the advice! Yeah, I plan on keeping my mo eu to myself, just when I'm at the point I have money to blow and will almost never go into debt I will greatly help my family. My grandfather does this which inspired me, and he lives next to not one, but TWO millionaires here in Virginia that might offer me large amounts of advice soon. I never plan on ""borrowing"" money, I think that's stupid. I want to save until I have enough money to invest into something completely solid.",,1449002236,1,0,1,0,personalfinance,cxjix6h,t3_3v1kki,,[deleted],,t1_cxjim3b,t5_2qstm,False,1451375478,False
"As a FNC fan this hurt way harder than a truck.

But... on the other hand ( I hope people won't misunderstand this ) a part of me was thinking that Fnatic was too bounded from Yellowstar and that Yellowstar was getting behind Mithy as a support ( YS was the better roamer but Mithy far surpass YS is lane ). So in the end I wished for him some sort of Origen level refresh and if NA LCS can provide that, also with a large salary to someone who deserve it I'll accept this, but I'll believe that if he will not retire by the end of the year he will return to EU as a stronger player.",,1449002247,3,0,3,0,leagueoflegends,cxjixh8,t3_3v1hic,,_legna_,,t3_3v1hic,t5_2rfxx,False,1451375483,False
Most of you EU fans make that hard to believe.  Kek.,,1449002263,-1,0,-1,0,leagueoflegends,cxjixwq,t3_3v1hic,,Viktavious,team 01,t1_cxjirwy,t5_2rfxx,False,1451375488,False
"&gt;Perguntaram-me se eu quereria ser operada por um cirurgião que em vez de testado na escola tenha sido feliz na escola. **Não tenho nenhuma dúvida; quero que tenha sido feliz, porque se aprende melhor quando se é feliz a aprender**. E quero que não se esqueça do que aprendeu no ensino básico, por muito bom que tenha sido, e espero que o seja, na sua especialização. Espero que no ensino básico não se tenha limitado a treinar para fazer exames; **que tenha aprendido as bases de que se faz o conhecimento todo e saiba usá-lo nas situações mais inesperadas e que nenhum exame pode prever.** Que saiba a Física necessária para gostar do Universe is expanding dos Monty Phyton, a História para perceber a explicação sobre a origem da guerra do Blackadder, a Filosofia para querer ouvir várias vezes o folclore do Ricardo Araújo Pereira. Troquemos o facilitismo de Nuno Crato pela exigência da 
gargalhada.


Em nenhum lado C.Martins diz ""Preferia ser operada por um cirurgião que invés de ter sido testado tenha sido feliz na escola"".

Viva o sensacionalismo.",,1449002294,9,0,9,0,portugal,cxjiyro,t3_3v1jrc,,4thDimensi0n,,t3_3v1jrc,t5_2qmie,False,1451375500,False
"No, why do you people keep saying this. This shit has been said every time we got imports. Just wait and fucking see before you say shit like this.


NA has always disappointed and before they prove me otherwise I won't get excited. S4 being the exception but even then they sucked ass, EU just sucked a bit more.",,1449002305,0,0,0,0,leagueoflegends,cxjiz2w,t3_3v1hic,,DonPepperoni,00 team,t1_cxji1q4,t5_2rfxx,False,1451375504,False
"EU winning the season, NA winning offseason. I guess EU=NA?",,1449002306,1,0,1,0,leagueoflegends,cxjiz36,t3_3v1hic,,Constantinch,,t3_3v1hic,t5_2rfxx,False,1451375504,False
"yes all 40k member of the imperium show up for every single timer

stratop fleets in EU/US prime max out at 250 but PH can't possibly field anything to match that. /s

keep spinning.",,1449002360,-12,0,-12,0,Eve,cxjj0jt,t3_3v131y,Ocularis Inferno,dragonshardz,OI,t1_cxjgfit,t5_2qil9,False,1451375523,False
"Yes, but the me living in EU and most of them being based in NA makes it quite difficult to work on projects together. ",,1449002395,12,0,12,0,heroesofthestorm,cxjj1hr,t3_3v1j9t,TGN Squadron,Khaldor,TGNSquadron,t1_cxji35p,t5_2ym13,False,1451375535,False
"... the fuck?

EDIT: he's doing it? https://www.np.reddit.com/r/european/comments/3v1syc/hey_guys_lets_contact_dclauzel_damien_clauzel_at/",,1449002405,4,0,4,0,european,cxjj1rz,t3_3v1ogh,Belgium,Ownie_,BELG,t3_3v1ogh,t5_2u7i2,1449004855,1451375539,False
"Just stop watching EU LCS boys, stop supporting greedy orgs like Fnatic. And NA LCS is going to be more interesting anyway.",,1449002422,0,0,0,1,leagueoflegends,cxjj28v,t3_3v1hic,,FnaticisKill,team 00,t3_3v1hic,t5_2rfxx,False,1451375545,False
I planned to do both. I don't think I  will have enough to separate eu and us. But we will see.,,1449002576,1,0,1,0,tf2,cxjj6in,t3_3v1in6,,godslefthandfuck,red tflogo,t1_cxjina0,t5_2qka0,False,1451375601,False
but they dont want to spent much money and use eu talent ? ,,1449002580,1,0,1,0,leagueoflegends,cxjj6n6,t3_3v1mm7,,JoBIRIO,,t3_3v1mm7,t5_2rfxx,False,1451375602,False
"Aerie is my favorite, but when I was living in Europe I bought panties exclusively from H&amp;M. They're cute and cheap, but the quality isn't great. ",,1449002593,4,0,4,0,AskWomen,cxjj6zm,t3_3v1mwh,♀,mangos_papayas,female,t3_3v1mwh,t5_2rxrw,False,1451375608,False
"Hello, I've been playing from EU beta, well at least I've had an account from there. Last summer I started playing more and now I've had a good 4month break. I bought Naxxramas expansion today and the game feels pretty fun now that I have some new cards.

I've discarded everything from any other class than Paladin and Warlock and only recently I stopped discarding neutral cards just for the reason that I don't need them right now. It has big downsides as I need to grind with same class and same deck for such a long time. I had cards to start building paladin only 5days ago.

I'm asking what cards I should be going towards to. If playing only Warlock and Paladin for now, is there some more must have cards in the other adventures for these classes.

Here are my current deck lists for both classes. (Naxx cards added just now, but only to Paladin (+ Voidcaller) : http://i.imgur.com/brQ81FW.png


Big craftable cards missing from:
 
**Paladin** (class):  
&gt;Competitive Spirit, Equality, Eye for an eye, Aldor Peacekeeper, Quartermaster, Tirion Fordring.
&gt;+ All the rest not seen on the decklist besides 2 commons and Divine Favor.

**Warlock** (class): 
&gt;Darkbomb, Demonfire, Shadowflame, Dreadsteed, Twisting Neather, Lord Jaraxxus, Mal'Ganis 
&gt;(+ Img Gang Boss)

I don't own any other minions from adventures than what you get from Naxxramas. 
*My only legendary is: Dr. Boom

Big **neutrals** would probably be: 
&gt;Sylvanas, Big Game Hunter, Harrison Jones.
&gt;(+ adventure ones, like Emperor Thaurissan etc.)


I would like to hear peoples opinions on:

* what their strategies with these decks would be

* maybe little about mulligans

* what card/adventure should go for next (guess BGH) 

* if they would change something (play Tirion Kappa)

* is it bad that I never play arena but I need cards ?
+ not only that, would you guys hit me if I would tell you that I discard every class quest not for Paladin/Warlock...

And overall when you were starting out, had your foot already between the door so that you understood something and realized that you are missing vanilla + 3 expansions worth of cards.

For me what interests me is eventually creating my own decks and brainstorm, even though my decks are quite obviously just copied I do that to have a working deck and maybe one day in the future I have enough cards to innovate something my own with these classes.

tl;dr Thanks for the help..


",,1449002616,2,0,2,0,hearthstone,cxjj7mb,t3_3uxc9m,,Topdeckareno,,t3_3uxc9m,t5_2w31t,1449003367,1451375616,False
"&gt; Europeans

Pretty massive generalization. Can I say Asians are a bunch of bloodthirsty conquerors because of the various Asiatic step peoples that committed some of the most awe-inspiring atrocities known to man, brutally killing and raping and utterly wiping out some cultures? Is this not just as much a product of ""Asian culture"", as Imperialism was ""European culture"" (not that these are specific enough to make any sort of reasonable point)? Do you realize you're stereotyping all Europeans this way? ",,1449002635,2,0,2,0,todayilearned,cxjj86z,t3_3v06yg,,sudo_rm_onering,,t1_cxjh4kw,t5_2qqjc,False,1451375623,False
for the EU fans it is,,1449002650,59,0,59,0,leagueoflegends,cxjj8ly,t3_3v1hic,,i_i_i_i_T_i_i_i_i,team 86,t1_cxjhtfn,t5_2rfxx,False,1451375629,False
"well usually when you play in NA no matter if you are european , korean or whatever you get a cancer and start playing like shit ",,1449002688,1,0,1,0,leagueoflegends,cxjj9o5,t3_3v1hic,,Moon_Lady,team 77,t1_cxji4nc,t5_2rfxx,False,1451375642,False
"You can buy the non-steam version through g2a for example and I remember buying it from there 100%, so I'm not quite sure how it ended up as a standard(steam) version to begin with

maybe the fact that it kind of got ""transfered"" from NA to EU datacenter defaulted it to steam?",,1449002706,1,0,1,0,ffxiv,cxjja51,t3_3v1njv,,dietrich666,,t1_cxjiz04,t5_2rgs7,False,1451375648,False
"I live in EU and the closest APP certified shop is 700 miles away from me. Yeah idk how they offer the gun at all, the shop itself looks professional but now i will try to find another one.",,1449002857,1,0,1,0,piercing,cxjje8c,t3_3v109z,,Roulin,,t1_cxjd3zk,t5_2qolb,False,1451375702,False
"Read his book. It will enlighten you as to what is going on and he doesnt really go into it in this talk. Ive posted it in separate post in this thread.

Basically what happened was completely normal if you understand that the EU and world Economy is in fact NOT a free market system. It isnt even democratic.

What happened in Greece was just a blip. Varoufakis was just a slight thorn in the long term plan for the EU. No way is Greece going bankrupt or leaving the EU and nor will any other EU state.

They forced Greece, Spain, Portugal and all the other states that were suffering economically to take on more debt in order to force them to reform.

The EU train is unstoppable!",,1449002917,4,0,4,0,lectures,cxjjfvg,t3_3uzm7z,,excaping,,t1_cxjfhbv,t5_2qidy,False,1451375724,False
"Before the European Civilizations colonized the world, in the early 1400's, China actually had the strongest naval force in the world. They were aggressively building ships, and preparing for outward expansion and exploration. In China, there is what is known as the ""mandate of heaven"", which basically signifies the endorsement of the emperor by heavenly spirits. During this period of expansion, a lightning bolt struck the forbidden city, burning it to the ground. China took this as a sign that heaven did not agree with their expansionary policies, and began a period of extended isolationism. If that lightning bolt had struck a few meters elsewhere, we could all be speaking Chinese.",,1449002999,7,0,7,0,history,cxjji2k,t3_3uxmdp,,jusarascal,,t3_3uxmdp,t5_2qh53,False,1451375752,False
"yes definitely, they will tell you to not come back to america, say they will eat shit if you do badly (then again that's not much of an insult), and act like xenophobes because they feel like the imported eu/kr players  are not representing north america. 

you are very right xD",,1449003039,2,0,2,0,leagueoflegends,cxjjj60,t3_3v1hic,,Angelomaniac,team 00,t1_cxjja9x,t5_2rfxx,False,1451375766,False
"I've been playing League and following the professional scene since Beta. I'm not revising anything.

I said: Yellowstar's supports stats were insane. That's true.

I said: Before the Huni/Reignover season his stats were incredible. That's true, and you can look them up yourself.

I said: Yellowstar has been a legend for years. This is also true. He has been one of the most popular players in EU for 3+ years.

I said: He was a beast. Statistically speaking, this is true.

TL;DR - Fck you m8 1v1 me",,1449003048,9,0,9,0,leagueoflegends,cxjjjf8,t3_3v1hic,,TotallyTugBoat,teemo,t1_cxjje8n,t5_2rfxx,False,1451375770,False
"Wisła had a spell of dominance. The other teams had like 2 years when they were the best, which is not my definition of ""dominance"". Lech ONCE in history won two titles in the row, and that's it, and they didn't have big advantage, and because of corruption affairs it's hard to say if we should treat the titles seriously, and they were 6th season before that ""spell of dominance"", and they were 9th the season after. Widzew's ""consistency"" can only be understood that they were consistent... in the 80s... not even the whole 80s... It's not really a club ""too big to fall"" which is what I was talking about, and in many countries there are several clubs like that that will never be relegated or even get close.

Legia is consistent, they are always in top 3, rarely lower, but still, as I say - 4 titles in last 20 years, 6 titles in last 35 years. Compare it to some others countries in Europe and it's not that much really. 

In the time Legia won 4 titles, Bayern won 12, BATE 12 (including 10 in last 10), Sparta in Czech 9 titles (and almost always second place in other years), and Donetsk won 10... and the other 10, Dynamo Kiyv won, and Donetsk was second. (Fun fact: the only other winner in whole history of Ukraine, Simferopol, is currently applying for Russian league).",,1449003064,1,0,1,0,soccer,cxjjjv7,t3_3v02tq,Śląsk Wrocław,ogqozo,50 s2,t1_cxjinfg,t5_2qi58,1449003954,1451375775,False
"It contains a critique of capital, but not the same critique that either Marxism or non-Marxist socialism advances. 

More or less, as Western philosophy chugged along through the 18th and 19th centuries, philosophers began to struggle with the question of ""political economy,"" or how the way we structure societies and economies impact other areas of life (politics being the most obvious one). You had thinkers like Adam Smith and David Ricardo, describing things like capital accumulation, wage-based labor, private property ownership, etc., and asking how that shaped society and vice-versa.

As these philosophies matured, so did criticism of them. ""Capitalism isn't very nice"" is a good way of breaking down some of the basic critiques people had. ""It leads to a sort of dysfunction in society.""

Socialism and Marxism had one way of responding to this critique, which was ""we can restructure society to obviate or eliminate some of the problems with the capitalist mode of production!""

Fascism came later, after the First World War and after seeing how political philosophies like socialism and Marxism were influencing the direction of political economy in Europe at the time. It arose out of precursor *nationalist* ideas (largely in Italy, Spain, and France). One of the defining features of nationalism and fascism is the insistence on loyalty and respect to a nation or people, as opposed to socialism (which tended to be international and utopian) and Marxism (which is explicitly international, Stalinism be damned). 

So while fascism says, ""capitalism is bad, you guys, we can restructure society!"" socialism/Marxism generally say that ""we should structure society to be fair and open and return power to collectives!"" whereas nationalism/fascism say ""we should structure society to respect the family unit, traditional values, loyalty to the nation and its leaders, and change the structure of society to benefit our country over everything else!""

In that way, fascism *is* revolutionary, and so shouldn't be placed along the traditional right/left axis, because it is critical of the status quo... it's just that fascism usually wants to replace the status quo with something more authoritarian than capitalism and holds as virtues conformity, subservience, and loyalty, whereas we would say socialism/Marxism values democracy, concerted effort, and collective expression of political will.",,1449003102,7,0,7,0,badpolitics,cxjjkvr,t3_3uufhl,,ccmulligan,,t1_cxhz2gw,t5_2sifg,False,1451375790,False
Not only do I hate TSM now. I also fucking hate European greedy organisations and investors.,,1449003121,-1,0,-1,1,leagueoflegends,cxjjlft,t3_3v0zfk,,lasaczech,vayne,t3_3v0zfk,t5_2rfxx,False,1451375797,False
"&gt;EU/US prime max out at 250

lol",,1449003202,8,0,8,0,Eve,cxjjnl4,t3_3v131y,Black Legion.,Saint_Patrik,MEN,t1_cxjj0jt,t5_2qil9,False,1451375825,False
"In Hungary Jobbik is the far right, and Jobbik and Fidesz don't agree on Jobbik's approach to ""let's reverse the borders back to pre-WW1"" fairy tale.

In fact what makes Jobbik far right is propably the only big difference between the view of the 2 right wing party voters.

If you want to talk about far right terrorism in Europe, look at Germany where they've already clocked 300+ attacks against migrants/migrant centers this year.",,1449003219,3,0,3,0,europe,cxjjo2b,t3_3uzy77,,dakmak,,t1_cxjfc07,t5_2qh4j,False,1451375831,False
Salty eu kids are the best,,1449003225,1,0,1,0,leagueoflegends,cxjjo8v,t3_3v1qsb,,Dudeshigh,,t3_3v1qsb,t5_2rfxx,False,1451375833,False
"Det diskuteras inte just eftersom att man inte får ta ifrån någons mänsklig rättighet, det är det som är hela poängen med MR, ingen kan ta dem ifrån dig oavsett hur hemsk du är. Sverige/EU kommer förhoppningsvis aldrig gå under den ribban, för då förlorar vi själv vår mänsklighet. 

Ja, kanske det skulle vara avskräckande men man kan och ska avskräcka på andra sätt utan att ta ifrån individers rättigheter. De bör inte vara något offerlamm.",,1449003233,0,0,0,1,sweden,cxjjogj,t3_3uzdmq,Södermanland,mygrapefruit,flag landskap-sodermanland,t1_cxjjile,t5_2qofe,False,1451375836,False
"Relativamente recente em termos de poucos séculos (quando eu falei de ""universidades"" eu quis dizer a universidade Carnegie Mellon por exemplo, fundada em 1900). A humanidade tem seus abastados a muito mais tempo.",,1449003275,2,0,2,0,brasil,cxjjpkk,t3_3uzli7,"Natal, RN",protestor,RN,t1_cxjjijz,t5_2qh9i,False,1451375850,False
"&gt; So called refugees. Like theres literally not a single legitimate refugee at all.

The only refugees that I, and the German Constitution, acknowledge are those coming either via plane or via boat and landing DIRECTLY in Germany without crossing a dozen safe countries on their way.

Being a refugee is not some kind of all you can eat buffet where you should be able to pick an choose where you wanna stay.  

Concerning the rather samey content here:

It makes sense that this gets posted here. The ""refugee"" crisis is the worst thing that has happened to Germany and Europe since WW2. I think this warrants the amount of coverage.  




",,1449003296,3,0,3,0,european,cxjjq50,t3_3uzkum,,Cold-Hotman,,t1_cxjjea3,t5_2u7i2,False,1451375858,False
"[Russia was getting food and raw materials from the US](http://whatreallyhappened.com/WRHARTICLES/pearl/www.geocities.com/Pentagon/6315/lend.html).

For example, the trucks -- while we think of World War II German infantry as being motorized, [most of Germany's military was still hauling supplies and soldiers via horse when the USSR was invaded](https://en.wikipedia.org/wiki/Horses_in_World_War_II#Logistics) and had serious logistics problems.  The Soviets, on the other hand enjoyed a substantial flow of trucks:

&gt; In total, the US deliveries [to the USSR] through Lend-Lease amounted to $11 billion in materials: over 400,000 jeeps and trucks; 12,000 armored vehicles (including 7,000 tanks, about 1,386[31] of which were M3 Lees and 4,102 M4 Shermans);[32] 11,400 aircraft (4,719 of which were Bell P-39 Airacobras)[33] and 1.75 million tons of food.[34]
&gt;
&gt; Roughly 17.5 million tons of military equipment, vehicles, industrial supplies, and food were shipped from the Western Hemisphere to the USSR, 94% coming from the US. For comparison, a total of 22 million tons landed in Europe to supply American forces from January 1942 to May 1945. It has been estimated that American deliveries to the USSR through the Persian Corridor alone were sufficient, by US Army standards, to maintain sixty combat divisions in the line.[35][36]
&gt;
&gt; The United States gave to the Soviet Union from October 1, 1941 to May 31, 1945 the following: 427,284 trucks, 13,303 combat vehicles, 35,170 motorcycles, 2,328 ordnance service vehicles, 2,670,371 tons of petroleum products (gasoline and oil), 4,478,116 tons of foodstuffs (canned meats, sugar, flour, salt, etc.), 1,900 steam locomotives, 66 Diesel locomotives, 9,920 flat cars, 1,000 dump cars, 120 tank cars, and 35 heavy machinery cars. One item typical of many was a tire plant that was lifted bodily from the Ford Company's River Rouge Plant and transferred to the USSR. The 1947 money value of the supplies and services amounted to about eleven billion dollars.[37]

The Soviets did most of the bleeding on the Western Front -- the US primarily kept them from occupying Western Europe -- but there was substantial material aid as well.",,1449003315,1,0,1,0,worldnews,cxjjqop,t3_3uwta9,,nounhud,,t1_cxj9mvt,t5_2qh13,False,1451375865,False
He probably means tonight for people from the EU.,,1449003331,2,0,2,0,GlobalOffensive,cxjjr4q,t3_3v17sm,Fnatic Fanatic,chaky5343,fan fnatic,t1_cxjerni,t5_2sqho,False,1451375871,False
"If you're ever up for playing, I'm fresh. (If you still do play) I'm located in Europe though, so don't know about connection etc, but I'd say I'm on your level in regards to skill and K/D.",,1449003406,1,0,1,0,CodAW,cxjjt52,t3_3urnvp,,snowflakelord,,t3_3urnvp,t5_31g7o,False,1451375898,False
"Eu, leigo, acredito q algumas cameras ligadas a um software de analise em tempo real como este q analisa os self-driving cars seria mais barato que: 22 microtransmissores para jogadores + 8 para as bolas do jogo + 3 receptores para juiz e bandeiras + 2 sensores de traves. 

Não consigo pensar em nada q precise ser mais detalhado e milimétrico do q um carro no trânsito a 90km/h. Se conseguem fazer pra veículo, pra bola, quatro linhas e 2 linhas dinamicas de impedimento deve fazer fácil..

Ao árbitro fica somente as faltas, que não tem como fazer por chip ou software. ",,1449003431,1,0,1,0,futebol,cxjjtub,t3_3uaqn8,Atlético Mineiro | '14 Copa do Brasil,DrHelminto,CAM,t1_cxjalua,t5_2tfgu,False,1451375907,False
"are you on NA or Eu servers? Also, /r/smiteLFM and /r/smitetraining are other useful subs for finding players. ",,1449003454,1,0,1,0,Smite,cxjjugu,t3_3v1px2,DON'T FUNKLE WITH THE MUNKLE,haredrier,sun-wukong,t3_3v1px2,t5_2stl8,False,1451375915,False
"was loads of problems with gambit though, first leviathan who stopped caring after fans started to like him, did not get a gaminghouse and internet until late etc, but at one point they where a top 3/4 team in eu. 

if all the structure bs was not a problem they would have been fighting for worlds, of course origin is better so they would have gone. But at least not relegation.",,1449003455,1,0,1,0,leagueoflegends,cxjjuho,t3_3uzade,,ashinator,khazix,t1_cxjjlmo,t5_2rfxx,False,1451375915,False
Eastern European or Asian CS GO traders who send ANY links to you.,,1449003624,1,0,1,0,AskReddit,cxjjz2c,t3_3uz0zj,,EliteNub,,t3_3uz0zj,t5_2qh1i,False,1451375974,False
We have 1/3rd the player base of Europe/Korea and they wonder why it's harder to find home grown talent.,,1449003828,1,0,1,0,leagueoflegends,cxjk4kc,t3_3v1pux,,itsReeby,team 07,t1_cxjju79,t5_2rfxx,False,1451376047,False
"As ultimas Adidas que tive tinhas as riscas laterais mas eram de uma cor só, neste caso preto. O que difere desses Reebok para os meus é onde esse tem preto o meu tem um vermelho escuro.
Deves encontrar em preto, eu é que tenho preferência por brancos.",,1449003888,1,0,1,0,portugal,cxjk65r,t3_3uww6f,,Warzitec,,t1_cxjjxfg,t5_2qmie,1449004794,1451376067,False
"EU is like Arsenal. Develop talent, sell it off, but still remain extremely competitive with new talent - just not enough to win any silverware sadly.",,1449003915,3,0,3,0,leagueoflegends,cxjk6wp,t3_3v0zfk,,pkb369,jax,t1_cxjj0lg,t5_2rfxx,False,1451376077,False
That's the problem with you leftist idiots in Europe. You think that's a lot of money when people in professional sports are making 10+ millions of dollars a year. Why do you wanna hold eSports back? So Europe can be better? Rofl.,,1449004003,-6,0,-6,0,leagueoflegends,cxjk96l,t3_3v1pux,,itsReeby,team 07,t1_cxjk7pg,t5_2rfxx,False,1451376108,False
"The fuck would someone be ashamed of their heritage, I mean unless your related to Hitler or a prick like that the most that any of our ancestors would've done was be an oppressed surf. Ohh yeah man, so sorry my great grandparents worked a fucking farm dieing of famine while some British cunt  that wasn't a peasant stole your land. It's just fucking retarded.

But I just ask this out of curiosity what is with using Caucasian in America, here in New Zealand the census is like:

Maori

NZ European/Pakeha

Asian

European (Them first generations)

Caucasian just sounds a bit weird to me, I think of some Georgian dude or some of those crazy Caucasian mountain russians",,1449004066,6,0,6,0,todayilearned,cxjkaw1,t3_3v06yg,,beastoicseriously,,t1_cxjjx52,t5_2qqjc,False,1451376130,False
Triple...when EU has a history of notoriously lower pay than other regions.,,1449004067,2,0,2,0,leagueoflegends,cxjkax5,t3_3v1hic,Scorn of the Food,NeoVenezia,diana,t1_cxjhi3e,t5_2rfxx,False,1451376130,False
Huni and Reignover for EU? Lol stay salty EU fanbois.,,1449004105,-14,0,-14,0,leagueoflegends,cxjkbxy,t3_3v1o6h,,880cloud088,team 07,t3_3v1o6h,t5_2rfxx,False,1451376143,False
Fuck TSM and everything about them. Hope OG smashes their heads in for EU.,,1449004204,-3,0,-3,1,leagueoflegends,cxjkelg,t3_3v1hic,,Pobeltme,zed,t3_3v1hic,t5_2rfxx,False,1451376179,False
