downs,score,author,subreddit_id,body,name,link_id,controversiality,author_flair_css_class,author_flair_text,distinguished,ups,score_hidden,removal_reason,retrieved_on,subreddit,archived,edited,gilded,created_utc,parent_id,id
0,1,FarkMcBark,t5_2qmlu,"I can only shake my head at things like 30 day warranties. In Europe there is a mandatory 2 year warranty for any defect related to manufacturing. It's the same for all sellers and manufacturers and you can't duck out of it. Of course it's a reason why prices are slightly higher across the board.

But even without regulations eleaf / joyetech is making a grave mistake here. ",t1_csp6ahb,t3_3bpyt2,0,favorite,DNA40 + Cthulhu,,1,False,,1437503727,electronic_cigarette,False,False,0,1435786715,t3_3bpyt2,csp6ahb
0,3,BurtonShaw,t5_2qhb9,"All EU/EEA citizens have freedom of movement and can remain up to ninety days in another member state. After those 90 days they must be exercising a treaty right to remain. 

To be fully covered by the European right of free movement, the EEA citizen needs to exercise one of the four treaty rights:

■working as an employee (this includes looking for work for a reasonable amount of time),

■working as a self-employed person,

■studying,

■being self-sufficient or retired.

As the vast majority of Roma beggars would not qualify under any of the above, then they should be repatriated. 

",t1_csp6b7r,t3_3bs11z,0,,,,3,False,,1437503754,ireland,False,False,0,1435786751,t3_3bs11z,csp6b7r
0,19,chialeux,t5_2qhh9,"Son 'cancer' est 100% auto-diagnostiqué et il a toujours refusé même par écrit qu'un médecin confirme son auto-diagnostic. Le certificat de décès a été signé par un autre médecin ami personnel qui n'a pas vu le corps et les médias ont été avertis par sa femme qui est sur un autre continent. Je ne serais pas surpris qu'on nous annonce qu'il y a eu crémation précipitée avant autopsie ou identification judiciaire.

*ajout: et en plus ça tombe le 1er juillet, jour où les ambassades et le gouvernement Canadien sont fermés donc difficile d'agir avant que le fameux corps soit incinéré.

N'oublions pas que Porter était le président du comité de supervision des services secrets canadiens (où siégeait aussi Philippe Couillard) donc il a la connaissance et les contacts pour savoir comment faker une mort pour disparaître. Et qu'il a de quoi blackmailer beaucoup de monde haut placés grâce  aux dossiers de renseignements top secret qu'il avait en main.

Y'a juste trop d'éléments douteux dans cette histoire, je ne dis pas ça pour rire ou troller, je pense qu'il y a réellement une probabilité que ce soit un complot pour le faire disparaître.",t1_csp6bes,t3_3brc0z,0,autre,Hystérique d'extrême-gauche,,19,False,,1437503761,Quebec,False,1435787575,0,1435786760,t1_csp31d6,csp6bes
0,10,RedditFuntimeAccount,t5_3225u,"MFW when am European, and my people never saw a black person until WW II when they came to save us...",t1_csp6c9j,t3_3bsfwf,0,,,,10,False,,1437503779,SocialJusticeInAction,False,False,0,1435786797,t3_3bsfwf,csp6c9j
0,1,ih16,t5_2qh33,"As an European, I wish we did it the American way.. ",t1_csp6cm8,t3_3brj3s,1,,,,1,False,,1437503783,funny,False,False,0,1435786812,t1_csp1xbi,csp6cm8
0,1,GoatOfTheBlackForres,t5_2sra6,"Head: http://eu.battle.net/wow/en/item/124157

Shoulders: http://eu.battle.net/wow/en/item/124174/raid-heroic

Chest: http://eu.battle.net/wow/en/item/127299

Staff: http://eu.battle.net/wow/en/item/113857

Hands: http://eu.battle.net/wow/en/item/124156/raid-normal

Waist: http://eu.battle.net/wow/en/item/113941/raid-mythic
",t1_csp6gba,t3_3bsv24,0,,,,1,False,,1437503864,Transmogrification,False,False,0,1435786976,t3_3bsv24,csp6gba
0,10,ZZ9ZA,t5_2qrjj,And even that is  debateable. Many European orchestras are still using a=443 or so.,t1_csp6h2o,t3_3brxvr,0,,,,10,False,,1440505980,musictheory,False,False,0,1435787010,t1_csp69tx,csp6h2o
0,5,trafalgarian,t5_2u7i2,"Good. The children are there for schooling, not to dress provocatively and dance at the strip club. The clothes these girls wear today would have had German headmasters beating them with a cane 70 years ago. I certainly wouldn't want a female familymember of mine dressing in miniskirts and stomach revealing shirts **in the 7th grade**.  
&amp;nbsp;  

Also, this ""Syrian Muslims"" thing is nonsense. These aren't religious people or they'd join the IS. The *niqab*, which is the ninja ghost looking suit, is banned in Syrian public establishments like universities. In fact, women in Syria don't even have to wear the hijab (the silk veil over the hair). [Not even the First Lady of Syria wears any head covering](http://i.imgur.com/fnbhgBZ.jpg).  
&amp;nbsp;  

These Syrian asylum seekers aren't coming from Saudi Arabia, they're from a modern secular state where there is no Sharia law except in places where people can't get out, like IS controlled areas.  
&amp;nbsp;  

Anti-Muslim (rather than anti-immigration) = extremely pro-jewish. I've yet to see a single example to the contrary. Don't mix their misleading garbage up with white politics. The issue here is that Arabs and blacks correctly gauge that white men are weak and pathetic, and that they can fuck our women because we're submissive liberal pussies, not any fucking Sharia law bullshit. Pudgy middle aged conservatives coming out at PEGIDA demonstrations demanding their middle school aged daughters be allowed to wear mini-skirts in class because of ""Sharia law"" only cements this perception they have of us.  
&amp;nbsp;  

Not only because it's the wrong angle to take, but especially because it's loaded with glaring errors like pretending most muslims in Europe want to have their cheap vodka, porn movies, nigger clothes, and marijuana taken away by re-establishing medieval Islamic law.  
&amp;nbsp;  

These Syrians aren't thinking about their religion, if they were they would stay home and fight for it. What want to see is these women dressed like sluts, and they want to use the stipend provided by the German taxpayer to see if they can get blonde pussy at the local night club. They really are that simple.  
&amp;nbsp;  

But of course, the Zionist neo-con anti-muslim movement has an army of paid/jew subsidized pundits, writers, speakers, etc, and most whites are too lazy to write their own take on things. ",t1_csp6hvd,t3_3brpwz,0,HOLY,"with jews, you lose",,5,False,,1437503906,european,False,False,0,1435787047,t3_3brpwz,csp6hvd
0,2,digdog303,t5_2qh4r,"Fight back instead of running away. If/when america goes down, the rest of the world is going with it one way or another. 

If you just try to go somewhere without having a serious plan, resources and safety net already in place you could very well get fucked by the anti-american backlash when it really starts to go down. The time to do what you're talking about was a few years ago imo. Or marry someone from northern europe or central/south america with a big family(and hopefully some land), fast.",t1_csp6j6r,t3_3bsrgu,0,,,,2,False,,1437503936,conspiracy,False,False,0,1435787106,t3_3bsrgu,csp6j6r
0,1,FiveLine,t5_2qo4s,Who's this Kaput fellow? Is he European?,t1_csp6jao,t3_3bsvta,0,Raptors4,[TOR] Hakeem Olajuwon,,1,False,,1437503938,nba,False,False,0,1435787111,t3_3bsvta,csp6jao
0,-3,IceZG,t5_2qh13,"That was was 70 YEARS AGO, Germany payed the price lost one third of total territory. Was divided for 45 years. Hundereds of factories were moved to west or east, with experts. And Germany is still paying the price.

When will fking Russia pay the price for invading Finland, Poland, Baltic republics, when will Russia pay price for 45 years od communism in central and eastern Europe, when will Russia pay for creating hunger in Ukraine long before WW2. 

Answer me that you genious. 

PLUS GERMANY OCCUPIED GREECE IN 1940's RUSSIA IS OCCUPYING MOLDOVA, GEORGIA AND UKRAINE RIGHT NOW.

THAT IS THE DIFFERENCE.",t1_csp6jtf,t3_3bqhxi,1,,,,-3,False,,1437503948,worldnews,False,False,0,1435787134,t1_csp6829,csp6jtf
0,4,Accademiccanada,t5_2rq9c,You havent lived until youve sold European land to friendly American savages,t1_csp6p9z,t3_3bqrhg,0,,,,4,False,,1440505958,totalwar,False,False,0,1435787384,t1_csop567,csp6p9z
0,7,GsoSmooth,t5_2qiel,Biggs will be lucky to get to Europe or scranton,t1_csp6smm,t3_3bryro,0,,,,7,False,,1437504179,hockey,False,False,0,1435787534,t1_csoxwr6,csp6smm
0,1,mosera,t5_2r65t,I went one EU size down from what I normally take in Converse.,t1_csp6tkt,t3_3brjrd,0,,,,1,False,,1437504203,malefashionadvice,False,False,0,1435787577,t1_csp3n9x,csp6tkt
0,4,Korsbaek,t5_2sqho,"Apparently EU East is all of EU then. I'm from Denmark and I get Russians all the time, even when I choose French servers.",t1_csp6w79,t3_3brexb,0,rank supreme,Supreme Master First Class,,4,False,,1437504272,GlobalOffensive,False,False,0,1435787696,t1_csp5o3v,csp6w79
0,1,telle46,t5_2qh16,"Numerous countries around the world have our hand-me-down F-16s because they will be obsolete soon. Russia, China, and European countries all have fighters that can outperform F-16s any day of the week. If our military did what you are saying, we would still be trying to fly turboprops. ",t1_csp6wnv,t3_3bpefg,0,,,,1,False,,1437504286,technology,False,False,0,1435787716,t1_csp1utc,csp6wnv
0,-9,Gornarok,t5_2rfxx,"The more I think about it the more I think Reginald is lying... What smart person would try to poach Bjergsen from TSM? Bjergsen is like 60% of TSM success, I dont see ANYONE in NA/EU being able to offer anything to Bjergsen. TSM is rich enough to pay the same as anyone else, they have quranteed spot in LCS, Bjergsen is probably team captain. What could Badawi offer to Bjergsen or anyone in TSM? Only unceirnaty...  ",t1_csp6y41,t3_3bqldx,0,,,,-9,False,,1437504310,leagueoflegends,False,False,0,1435787782,t1_csoy0wb,csp6y41
0,2,helipiotr,t5_2qkmn,"Great in terms of theoretical knowledge, not so great when it comes to student satisfaction. The Uni will be tough and won't support you unless you actually ask for help / attend office hours. Administration is a mess, however it works for some reason. This however is compensated by education delivered free of charge for EU-students and excellent lecturers who are dedicated to their disciplines. You will end up as a well-rounded engineer who can perform well in the discipline. Apart from that, student societies are superb.",t1_csp6y4b,t3_3bol61,0,,,,2,False,,1437504310,poland,False,False,0,1435787782,t3_3bol61,csp6y4b
0,1,selbstbeteiligung,t5_2qh16,"I fly a lot for work and in my experience it's not even comparable. Yes, I cannot provide any source but I really doubt overbooking is so widely spread in European airlines",t1_csp6z4r,t3_3bq0vc,0,,,,1,False,,1437504332,technology,False,False,0,1435787831,t1_csoq4rn,csp6z4r
0,-10,Anwnymia,t5_2qh4j,There is real danger from Turkey invading parts of Greece if it remains completely isolated from the EU with these shenanigans.This is not just a guess. We know there are daily violations of air-space and the main reason they are harmless for now is that we have great protection from our international place.,t1_csp716u,t3_3bslau,0,,,,-10,False,,1437504356,europe,False,False,0,1435787924,t1_csp6mrj,csp716u
0,2,SamucaDuca,t5_2qh9i,ah se tivesse ROM de windows phone pra botar no Zenfone... eu catava um já.,t1_csp719c,t3_3brsxc,0,,,,2,False,,1437504356,brasil,False,False,0,1435787927,t1_csovwei,csp719c
0,1,tipo19,t5_37kbk,"/u/trollabot tipo19

Edit: wtf I'm not from europe
Edit 2: Hence the ""?""",t1_csp74t9,t3_3bs76a,0,,,,1,False,,1437504403,trollabot,False,1435788419,0,1435788093,t3_3bs76a,csp74t9
0,2,niceloner10463484,t5_2s3yz,"Yeah, I hate traveling. I was a pretty whiny bitch during last winter break going to Vegas with parents. Partially it was due to hidden depression and anxiety along with some other things, but i could've hidden it better at age 21. In hindsight, no excuse for that shit, some parents would have slapped me and told me to shut it. BUT they did basically drag me along and made plans w/o notifying me. I don't hate on places like Europe, Mexico, Egypt, or other tourism hotspots but I have no intention to infuse myself with foreign culture. China is fine though as i can speak basic Mandarin and have a welcoming family there.


Tell me, what are your opinions on the specific things I mentioned in my post? I am not sure if you are as much of an amateur philosopher like me but we have a good conversation going here.",t1_csp77y0,t3_3bsjoc,0,,,,2,False,,1437504478,ForeverAlone,False,False,0,1435788240,t1_csp6yl7,csp77y0
0,1,TerranByte19,t5_2qpp6,"Mvp had a monstrous consistency through the whole of Wings of Liberty, he was the king in 2 out of 3 years. Zest got relevant in the first half of 2014. Mvp revolutionised Terran, ask anyone that has watched Starcraft since WoL, and they will tell you just how much Mvp showed the way of Terran, Zest is comparable to Rain in playstyle (If I remember it correctly). When Zest can be relevant for a year and a half, and make every Protoss base their play off him, then I will accept Zest as a worthy opponent to Mvps throne.

Now, I started watching Starcraft in 2014, I have burnt myself a lot in my stupidity, but I know a king when I see one.

EDIT: Oh and I will not forget his two second places in the GSL Code S (One in Code A, but we never count that one) and his willpower. This guy played a whole year with some awful RSI. He won one Code S off the back of pure mind games and genius strats. He also reached the final of another one. He then went on to Heart of The Swarm, dominated the EU, and thereafter went to Korea and placed 3/4th of the Season finals. The only reason why he did not reach the final was because he faced INnoVation, and he famously almost(?) made INnoVation look mortal in a god phase of INnoVations career.",t1_csp788y,t3_3bo5wg,0,SBENU,SBENU,,1,False,,1437504483,starcraft,False,1435788736,0,1435788254,t1_cso2k1y,csp788y
0,2,Falonefal,t5_2s580,"Nice nickname :D

Hey man, I think it'd be nice to play with someone else besides my regular friends, but you should post what region you are playing from so that people know if they CAN even play with you.

Cause if you're in the Philippines it'll be hard for a European to play with you, obviously.",t1_csp7axy,t3_3bsyhb,0,strygwyr,I love you,,2,False,,1437504541,DotA2,False,False,0,1435788376,t3_3bsyhb,csp7axy
0,1,Siekus,t5_2v9u2,"Geez 50k is pretty steep, I assume you're on EU? 

I know on US servers the [Medallion of the Legion](http://www.wowhead.com/item=128315/medallion-of-the-legion) sells for 20k-25k each, might be more in EU. You only have a chance at loot once a ~~week~~ day per rare, but if you have alts theres the potential to pull in a lot of gold each week. 

The secret to farming the rares fast is to sit at each spawn point and spam search the group finder until you find a spawn for it on another server. 

Another method is the weekly Kazzak world boss as he drops Felblights, these sell for about 500g each on US and you get roughly 5 or more per kill. 

Anyway, hope you get the gold to keep playing! ",t1_csp7dzg,t3_3bsvj9,0,,,,1,False,,1437504600,woweconomy,False,1435789022,0,1435788516,t3_3bsvj9,csp7dzg
0,-6,Anwnymia,t5_2qh4j,"First, if you only want to hear your opinion stop posting. Start Blogging. OK? 

Second, your whole argument is absolutely absurd. **SYRIZA HAD THE CHOICE TO DO THE REFERENDUM AT LEAST ONE WEEK EARLIER.** They could swing it by saying ""In January or February it would be early"" but for a week or two, that argument would be void. Why did they wait for the **VERY LAST MOMENT** that would produce closed banks for sure?  Obviously because that was their plan all along. I will not describe again why, read it again above.

Third, your vile attacks on a personal level point towards that you don't even  deserve an answer. Consider this a gift. I could have ignored you.

PS. Also the fact their plan was to instil negativity is strengthened by their propaganda policy to always blame ""the foreigners"" the last few days. You also ignored to answer on the **loaded question** issue. How convenient for you. Even the KKE party, the most anti-EU party in the country exposed that hypocrisy.",t1_csp7gcl,t3_3bskwh,0,,,,-6,False,,1440505908,europe,False,1435788992,0,1435788626,t1_csp6zb1,csp7gcl
0,1,GD7HnbBw,t5_2qh3l,"The idea of moving 'south of the border' to live inexpensively is naive. I lived in Central America for a decade. If you're goal is to be drunk at the bar on the beach every night, it might be ok. Don't take anything with you. Don't buy a property. Have a fat bank account outside the country you are moving to. Don't let anyone know you have it. Be ready for all the mind games and legal twists you will encounter. Grocery, convenience and other stores have armed guards for a reason. Be prepared to pay someone to guard your car if you go out to dinner. They don't discuss racism down there like we do up here ... and you probably aren't the right color. But it'll work as long as your money holds out. The head of my security team at my house was a retired Marine force-recon guy that did a pretty good job. Police won't be too much of a problem as long as you pay them a little bit, at least until your girlfriend files false abuse charges, and the court has you thrown out of your house (that's why you don't buy or take anything with you). Maybe she was just your maid, but not by the time the legal system is done with you.  At least it won't be dull.
   Before I was in Central America, I had a office in St. Thomas. If you're into hefty black ladies or skin diving every day, that's what there is to do. It's at least 75% black, most everyone on welfare. If you've been to St. Thomas on a Caribbean cruise, the shops you saw are shuttered until a cruise ship arrives. They are open for a few hours, then close again when you leave.
   I think the 35% that want to expatriate are either rich and are headed to Europe, or naive and have never left town. 

",t1_csp7gna,t3_3brb6l,0,,,,1,False,,1437504659,news,False,1435790240,0,1435788639,t3_3brb6l,csp7gna
0,3,ThatChickita,t5_2qh1i,"To be fair, that still happens today but in different countries rather than different states. It's pretty common to have multiple families outside of the US and Europe as well; rich men in Africa, South America, and (I'm assuming, I don't really know the continent well) Asia have no problem with it.",t1_csp7gtm,t3_3bspak,0,,,,3,False,,1437504660,AskReddit,False,False,0,1435788647,t1_csp6enw,csp7gtm
0,20,Coontowncop123,t5_351zk,"I've tried to tell my friends that the rise of right wing parties in Europe is a political reality and answer to the unsustainable policies practiced by EU and it's member states, but they will just dismiss me most of the time. It's a slow process but if you look at it more closely you will see the immense growth of the right wing parties, some of them are even in the governments of their countries right now. 

They can't keep letting the Muslims and Africans in and not expect any kind of resistance from the native populations. It just doesn't work that way and they will see it sooner or later. I think Ramzpaul said it the best ""You can't have the White culture without the White people.""",t1_csp7io2,t3_3brwv4,0,lights,,,20,False,,1437504710,CoonTown,False,1435793762,0,1435788732,t3_3brwv4,csp7io2
0,2,TimezoneSimplifier,t5_2rfxx,"#####&amp;#009;

####&amp;#009;

######&amp;#009;
16:00:00 (America/Los_Angeles) converted to other timezones:

[In your timezone / auto detect](http://www.simplify-time.info/event-reddit-comment-csp7gs6)

Timezone | Common Abbrev. | Time | DST active
:---------:|:---------:|:---------:|:---------:|:---------:
UTC|UTC / GMT|23:00:00|NO
Europe/London|GMT / BST / WET / WEST|00:00:00|YES
Europe/Berlin|CET / CEST|01:00:00|YES
Africa/Dar_es_Salaam|EAT|02:00:00|NO
Europe/Moscow|MSK|02:00:00|NO
Asia/Kolkata|IST|04:30:00|NO
Asia/Jakarta|WIB|06:00:00|NO
Asia/Shanghai|ULAT / KRAT / SGT|07:00:00|NO
Asia/Seoul|KST / JST|08:00:00|NO
Australia/Sydney|AEDT / AEST|09:00:00|NO
Pacific/Auckland|NZST / NZDT|11:00:00|NO
Pacific/Honolulu|HST / HAST|13:00:00|NO
America/Anchorage|AKST / AKDT|15:00:00|YES
America/Los_Angeles|PST / PDT|16:00:00|YES
America/Phoenix|MST|16:00:00|NO
America/Denver|MDT|17:00:00|YES
America/Chicago|CDT|18:00:00|YES
America/New_York|EST / EDT|19:00:00|YES
America/Sao_Paulo|BRT / BRST|20:00:00|NO
America/St_Johns|NST / NDT|20:30:00|YES


---

Info: This message was submitted by a bot.

Feedback, Problems and Questions: /r/TimezoneSimplifier

Comment unhelpful? Downvote it! Comments with less than 0 points will be deleted and won't block space in this thread.",t1_csp7jkr,t3_3bsxry,0,zilean,,,2,False,,1437504732,leagueoflegends,False,False,0,1435788774,t1_csp7gs6,csp7jkr
0,1,Blahallon,t5_2qh1s,"I think they can (and should) stay in the EU, but maybe not in the Eurozone. It can has its own currency within the EU.",t1_csp7k28,t3_3bqqkj,0,,,,1,False,,1437504753,Economics,False,False,0,1435788797,t1_csoyzgp,csp7k28
0,0,ATGATT_CircleJerk,t5_2qi6d,"Dude needs to partner up with a Michael Czysz, or just someone with more money than sense, because that's basically what it takes to create a new company competing in either the bike or car markets.  If your game isn't electric right now, it's almost impossible to even try to compete with Japan and Europe.",t1_csp7k7l,t3_3bstgg,0,us,YZF-R1,,0,False,,1437504748,motorcycles,False,False,0,1435788803,t1_csp71e2,csp7k7l
0,-3,IceZG,t5_2qh13,"You use the term westerner, that tells a lot about you. No I'm from central Europe and no I don't work for any corporation. And what does it mean working for corporation. Somebody who works in McDonald's, is he a dirty western imperialist in your  mind.

And no situation in Ukraine is not complicated at all. 
Russia was pissed off because Ukraine wasn't dumb enough to join their little Euroasian soviet union project. So they decided to destroy Ukraine.

Russia saw an opportunity to grab some land and exploited the situation.

Russia needed a warm water port for their warmongering army so they just took Crimea.

Russians always negated the existance of Ukraine as a nation. And always behaved like Ukraine is a part of Russia. So this invasion is nothing new. Russia was attacking Ukraine long before this war.

Russia said it will respect Ukrainian sovereignty when Ukraine gave up nuclear weapons. But to Russians documents mean nothing, they simply stabbed Ukraine in the back. But no problem Ukraine has enough nuclears waste to create more than enough dirty bombs.

See simple, you just need to use that grey thing between your ears.",t1_csp7me2,t3_3bqhxi,0,,,,-3,False,,1437504794,worldnews,False,False,0,1435788909,t1_csp74x0,csp7me2
0,2,MakingPlayss,t5_2tvg8,"1) Clutching a round 11 1 v 2 against Tommey and Watson to knock them out of an snd only gfin. Josh was so angry he called us scream watchers for hours :) 

2) Beating infused 3-0 in uplink scrims- it counts ;)
3) Dropping 56 on Faze France's aids host

I know these are average but Europe's europe...",t1_csp7miu,t3_3bseed,0,infused,Team Infused,,2,False,,1437504798,CoDCompetitive,False,False,0,1435788916,t3_3bseed,csp7miu
0,1,christian1542,t5_2qh1i,"Finland: The way people just stick with people they already know and avoid getting to know strangers. ""Yeah, that guy is a bit different/weird/new here/whatever, let's not invite him anywhere or have anything to do with him"". And don't get me started on the deniers. ""No no no, it's not true, we are not like that at all. I know a few people that have many friends, like five or ten of them. We are exactly the same as other people, like those friendly and social Swedes/Europeans."" Bull-fucking-shit.",t1_csp7qg4,t3_3bsp1o,0,,,,1,False,,1440505887,AskReddit,False,1435789595,0,1435789104,t3_3bsp1o,csp7qg4
0,0,theforbiddenshadow,t5_2r5hw,"All of Germany, Most of Belgium(where I am) , Norway(I think), and Sweden(I think). I think it was 15 EU countries that offer almost free education to all. bachelorsportal.eu",t1_csp7r9y,t3_3bs4k0,0,,USA&gt;Belgium,,0,False,,1437504897,IWantOut,False,False,0,1435789144,t1_csp76qi,csp7r9y
0,1,[deleted],t5_2y2sm,"&gt;What benefit do I get from maintaining a relationship with this woman that could possibly outweigh the risks?

How much time, on the average, do you spend maintaining those plates, including getting them, maintaining game, and so on? Because unless you are overflowing with money and have a chiseled body with a tan and a European accent, you still have to put in effort in to getting plates - going out, text game, arranging meetups and so on. 

Now consider that some guys, between all the self improvement shit that they are doing, simply don't have the time or energy to do this. Try working in a demanding career with 60 hour weeks (which is usually the high paying ones), but still wanting to do personal hobbies, as well as gym, and you will find that your free time to go out and work on plates is limited. 

In this case, having an LTR is often the preferred option, as you don't have to go out of your way to keep getting sex. 

Also, LTRs do not imply a track to marriage. Nobody is saying you have to sign papers or move in with the girl and split rent, or share finances in an LTR in preparation. LTRS are simply a transnational exchange of you not going for other girls in return of you getting sex and other benefits without putting in much effort. And if the girl breaks this transaction and stops giving you the sex you need, you don't have to do anything special, you just break it off and move on, since you did everything correctly. 

Also, some guys want kids and in this case you absolutely have to start working on an LTR and eventually get married. 

",t1_csp7rcs,t3_3bqsvk,0,,,,1,False,,1437504909,asktrp,False,False,0,1435789147,t1_csp55lb,csp7rcs
