downs,score,author,subreddit_id,body,name,link_id,controversiality,author_flair_css_class,author_flair_text,distinguished,ups,score_hidden,removal_reason,retrieved_on,subreddit,archived,edited,gilded,created_utc,parent_id,id
0,6,atenirp,t5_2qhmg,"I just enrolled in a 2-year Master's of Marketing program at a school in Europe, starting in September. I was debating for over a year if it was a good idea or not since most of the people in this sub from previous similar threads seem to think that it's unnecessary. I've lurked on this topic on /r/marketing for a while here's what i've gathered. 

Everyone will tell you experience is the most important thing in the field of marketing. Some people go as far as saying that if you have a master's you'll appear overqualified and it will actually hurt your chances of getting a job. Some people say that you don't even need a degree at all to get good marketing jobs. 

Many people say that pursuing a masters is only a good if you do it at a top school for networking purposes. I see where they're coming from, but I find it hard to believe that the benefits gained from networking would really pay off in the long run considering the tuition costs. Others say it's only good if you want to work at a big corporation as a manager of some sort, and if you're wanting to work at a small agency it's useless. I don't really want to work at a corporation but I could see myself doing it if the brand stood for something I believe in, so i guess it's good to have the degree.

Most people will tell you that it's best to get 2-3 years of work experience before going to MBA or Msc Marketing. I think they're absolutely right. I got my bachelors in psychology in 2010, I've been working in marketing for a couple years now. I would definitely not want to go into the master's program without the working experience that I have now. I plan to continue working at least part-time online for this company while I'm doing the masters so I can try to apply anything I'm learning in school to the business i'm working for. 

With all that said, my school is tuition free so it made it a lot easier for me to decide on going for the master's since it wont cost me a ton of money in the end and it's a good life experience. If I had to take out a fuck-ton of student loans I'd probably skip it altogether and wouldn't go back to school unless the employer paid for it. 

If you're not going to grad school you can still also just get various marketing qualifications online that will add a bit to your resume.

I'm 28 years old now and the way I look at it, If I don't go back to school by the time I'm 30, I never will. I'd hate to look back when I'm 40 and wish I would've just gotten the degree while I had the opportunity. 
 
I hope that helps. 
",t1_cso5pk2,t3_3bo2kz,0,,,,6,False,,1437477388,marketing,False,False,0,1435708956,t3_3bo2kz,cso5pk2
0,1,SenpaiSamaChan,t5_2rau9,"Not really, but it'd be cool to let him fight Owens for the title mano a mano. Every whip rebound could be a European Uppercut or a Pop-up Powerbomb. Schweet.",t1_cso5qyj,t3_3bnev3,0,,Head of Creative,,1,False,,1437477394,WWE,False,False,0,1435709029,t3_3bnev3,cso5qyj
0,1,v3spira,t5_36ayx,"(EU) (dominion)

[WTB] Adroitness necklace.
[WTT/s] epic/leg reagents wood and blacksmith, or trade 1/1 for cloth regs

psn v3spyraa",t1_cso5t2z,t3_3blkrg,0,,,,1,False,,1437477407,ESOPS4,False,False,0,1435709135,t3_3blkrg,cso5t2z
0,1,ChiefakaJames,t5_2s4mv,"Have the British broadcast on here: http://streamhd.eu/lsh2.html, but it's also on regular FOX.",t1_cso5ve8,t3_3bootm,0,MIN6,,,1,False,,1437477432,minnesotatwins,False,False,0,1435709251,t1_cso5sti,cso5ve8
0,1,pinata_penis_pump2,t5_2qi58,"Yes, it is.  I've seen hundreds of threads much worse than this, mostly with top European teams.  ",t1_cso5w2m,t3_3bom31,0,34,New York Red Bulls,,1,False,,1437477442,soccer,False,False,0,1435709286,t1_cso5uuz,cso5w2m
0,1,DestroyerOfWombs,t5_2s7tt,"Try millions of natives. The Americas we're highly populated during this time. It was a completely different environment then when European settler's came later. A plague whiped out 90% of the native population in the century before their arrival, and so they were met with far less resistance. ",t1_cso5wf1,t3_3bn85l,0,,,,1,False,,1437477452,AdviceAnimals,False,False,0,1435709301,t1_csnzjff,cso5wf1
0,2,q-1,t5_2qm35,"[ecotic.ro](http://ecotic.ro/) are câteva puncte pe hartă, eu le-am predat la un punct de colectare din sectorul 2. 

tipa de acolo mi-a zis că dacă suni la dispeceratul Supercom-ului cu o săptămână-două înainte de ultima sâmbătă din lună, te înscriu pe o listă și te sună ei când trece o mașină de colectare de-a lor pe la adresa ta.  
(mi-au rămas de dus mai multe UPS-uri grele rău și n-am cum să le duc altfel)

edit: [extra balls](http://i.imgur.com/rklzHqB.jpg). ăștia au scăpat, i-am găsit acum în dulap.",t1_cso5wxc,t3_3bouoh,0,bucuresti,B,,2,False,,1437477451,Romania,False,1435712727,0,1435709326,t1_cso5ck2,cso5wxc
0,3,wwoodi,t5_2sgp1,Lol stop talking shit. Pointing out the negatives like the UK does will only improve Europe. Clearly nobody outside Germany and France likes how europe runs because it revolves around Germany and France. ,t1_cso65yw,t3_3bmmhz,0,i-gpcm,willy bum bum,,3,False,,1437477644,pcmasterrace,False,False,0,1435709777,t1_csnzl3u,cso65yw
0,1,gayinhellkid,t5_2rfxx,"incredible that when a team relies on doublelift to carry and pours resources on him he also has high stats

he is also on a top team which really helps on bloating statistics

meanwhile Forgiven used to play on CW and he was the BEST ad carry in all stats possible whilst his team was garbage, in EU.

",t1_cso68rc,t3_3bojfz,0,12 team,,,1,False,,1437477711,leagueoflegends,False,False,0,1435709912,t1_cso4rpq,cso68rc
0,3,urethral_lobotomy,t5_2zq88,"VS is also getting decimated on the Lithcorp EU server, atleast last I played.

Could use some more soldiers there.",t1_cso6cl5,t3_3bohl9,0,,,,3,False,,1437477803,PS4Planetside2,False,False,0,1435710087,t3_3bohl9,cso6cl5
0,2,Hellowz,t5_2rfxx,"Lmao still delusional about EU players.

Cabochard didn't shit on Shy, he picked lane bully J4, got 3 or 4 ganks from TF +Diamond and ended up not carrying anything.

Also I don't even see how beating Shy should make anyone top 5 when Shy is worse than Ssumday,Marin,Duke,Smeb just in Korea and there's still other toplaners in China that are better than him.",t1_cso6crw,t3_3boav7,0,xerath,,,2,False,,1437477810,leagueoflegends,False,False,0,1435710097,t1_cso269a,cso6crw
0,1,curty4000,t5_2s7tt,Yep and when they tried to hold a referendum recently to leave Spain the government cock-blocked them. If Spain (or the EU) support Kurdish attempts to set up their own state they lose any argument against separatists at home,t1_cso6dvm,t3_3bn78p,0,,,,1,False,,1437477833,AdviceAnimals,False,False,0,1435710151,t1_cso5v17,cso6dvm
0,1,JazzFan418,t5_2s3kh,"I've looked everywhere and can't find any war medal matching England,Russia,Germany,Latvia,Poland or Italy(which was my first guess because of the MARINO).

Is the Marino ""stamped"" into the metal or engraved? It may be a custom Italian family coat of arms medal made for decoration.

EDIT:Wait, don't they ahve police badges like this in Europe??",t1_cso6i6k,t3_3bnrsz,0,,,,1,False,,1437477915,whatisthisthing,False,1435715865,0,1435710450,t3_3bnrsz,cso6i6k
0,5,cayal3,t5_2rrlp,"&gt; And how come ""cool shit that is rolling out"" in the EU is always rolling out after it's been in US

More users in the US and a bigger market. Plus it is one country versus many countries in Europe so they have to go through a whole bunch of QA/approvals/whatever for each country.",t1_cso6krw,t3_3bmes4,0,ps-plus,gunny5,,5,False,,1437477963,PS4,False,False,0,1435710676,t1_csnoyvs,cso6krw
0,2,YouAreSalty,t5_2rrlp,"I agree. MS royally f'ed up the release in EU.

With a new person in charge, I hope you guys will be treated better.",t1_cso6p8r,t3_3bmes4,0,,,,2,False,,1437478056,PS4,False,False,0,1435711100,t1_csnkf7l,cso6p8r
0,3,drfritz2,t5_2qh9i,"Essas iniciativas precisam ser melhor descritas e também devem passar por uma avaliação mais ampla.  Obviamente o tudo-nada não resolve e embora eu não seja simpatizantes de militares certamente iria preferir que meu filho estivesse estudando nessa escola hoje em relação ao momento anterior. 

É preciso considerar que: se foram expulsos alunos e professores foram substituídos, que isso também ocorre no sistema ""normal"" das escolas. Precisa haver comparação entre antes e depois. 

Também, acho que a PM vai preferir estar trabalhando nas escolas ao invés de estar trabalhando na coleta de adolescentes em conflito com a lei.

Um outro fator a ser considerado (que não apareceu na matéria) é em relação a custos e financiamento dessa escola. Se a implementação do militarismo incluiu aumento de investimento, então os resultados podem ser devidos ao investimento e não ao regime militar.

",t1_cso6qxd,t3_3bn74g,0,,,,3,False,,1440507643,brasil,False,False,0,1435711260,t3_3bn74g,cso6qxd
0,1,faithfuljohn,t5_2qh1i,"late reply. Yes I do know. Jamaica though, if you are from there, means that you are most certainly descended from Africans. There are also Indigenous Asian &amp; European ancestry too, but most of the Island was largely descended from the African slaves that the British brought over.    

He was was as black as the night. So there was no way he wasn't partly african.",t1_cso6xn4,t3_36cw3g,0,,,,1,False,,1437478187,AskReddit,False,False,0,1435711904,t1_crdx77x,cso6xn4
0,0,BlueSquadron,t5_2s496,"&gt;In the other countries surveyed in the Middle East-North Africa region, fewer than half take this view.

&gt; In Central Asia as well as Southern and Eastern Europe, only in Tajikistan (22%) do more than a fifth of Muslims who want sharia as the official law of the land also condone the execution of apostates. Support for killing converts to other faiths falls below one-in-ten in Albania (8%) and Kazakhstan (4%).

What's my point?  That you're being disingenuous and arguing poorly.  And that interpretation is literally 100% of any holy text.  To hand-wave it away is to reduce yourself to the understanding capacity of a loaf of bread.  Your personal journey may call for that level of ignorance, but don't be shocked when people just laugh in your face for your obtuse nature.

&gt;You have to show that you can change what has been in those nooks for centuries.

Just from the top of my head: Council of Trent.  Unless you really mean nooks, in which case I don't know that Barnes and Noble has been around that long.

&gt;More hollow statements that mean nothing

I was sad too when I found out that Sam is a shitty guy on some topics.

&gt;Books that condone slavery are only useful to teach us that those books were barbaric, immoral, written by man and of their time.

Oh, poor baby.  The books are still magnificent pieces of art, even if they upset you.  So is 'The Aristocrats', for that matter.

&gt;The **savages** that killed the charlie hebdo cartoonists did so because they want to.

There you go.  All you had to do was leave off that last part and suddenly, you're actually thinking.  But your word choice tells me you probably aren't thinking, you're probably just going on raw emotion.  Fair enough.  Just don't pretend it's rationality.",t1_cso6yvr,t3_3bijcz,0,,,,0,False,,1437478200,billmaher,False,False,0,1435712024,t1_cso6k8c,cso6yvr
0,0,Iamadinocopter,t5_2qofe,"European Football is aptly named though, there is only one ball on the field during a game.",t1_cso6z2r,t3_3boi3d,0,,,,0,False,,1437478199,sweden,False,False,0,1435712042,t1_cso3y28,cso6z2r
0,2,libcuck,t5_2qh4j,"Every time I read about the rape epidemic in Europe I just want to pull my hair out. Wake up! These people are a scourge. They will not assimilate, only segregate, attack, and attempt to conquer. The Finns, and all Scandinavians for that matter, are beautiful, intelligent, strong, noble peoples and in the past they fought like lions. Now they welcome this filth in and bend over backwards for them. I don't understand why Europe seems hell-bent on committing suicide. 

https://www.youtube.com/watch?v=I_To-cV94Bo",t1_cso72ja,t3_3b2tfm,0,,,,2,False,,1437478242,europe,False,False,0,1435712372,t3_3b2tfm,cso72ja
0,2,AN_OUTRAGE,t5_2qrz8,"Looking at the numbers they actually increased soy acres and corn acres were down. Soy stocks were bullish but not +57 bullish.

Would imagine funds are a large player here- long weekend and uncertainty in Europe means big fund money is back in commodities for the time being ",t1_cso74sf,t3_3bnbii,0,,Nebraska ,,2,False,,1437478266,farming,False,False,0,1435712581,t3_3bnbii,cso74sf
0,2,rayciss_math_phd2,t5_351zk,"**Part One**

First, thank you to both you and Hermann and others for the praise. Not sure it's deserved - like at least 80% of the time I'm just a rote shitposter. That Hermann fellow, however, knows an inordinate amount more rayciss history than I; pressuring him into writing an ebook is my pet project on this sub. Admittedly, we're not gaining a lot of traction...

Anyhow,

&gt;I've just skimmed over the article and the responses down bellow, there was quite a bit of criticism that seemed perfectly valid to me, taking that into account and following the general rule that one ""groundbreaking"" work doesn't necessarily imply that the postulations there exposed must be right, no matter how well argumented, I think that saying it blows the HBD-sphere is going a bit overboard. Granted, I don't even know what this sphere is about, but whatever.

I immediately wish I had written *blown up in* in lieu of *blown up*, because I did not mean to imply that the whole of HBD has been invalidated by Chisala's study. You're quite right that there are valid arguments to call into question his findings, not the least of which is the state-created selective pressure put on Igbo immigrants trying to escape to Europe and America. [Anatoly Karlin, another Unz.com columnist, wrote his own response to the kerfuffle](http://www.unz.com/akarlin/africa-and-cognitive-colonialism/); admittedly, its less than intuitive, but presents a fascinating attempt to try and calm the waters while explaining the ramifications of Chisala's study. I'm not sure Karlin is correct either; his assertion that environmental depression of IQs in Africa accounts for a full standard deviation or more between the macro-races is particularly questionable, to my mind. Still, informative.

Whether or not Chisala is ultimately correct about the death of the white-black IQ gap, however, the Igbo people have historically been high achievers, and, yes, they are definitely Africans (more on that in a moment). My point is not to throw my hands in the air and proclaim ""Academic racial realism is kaput!"" so much as it is to demonstrate that blanket-labeling all black-skins as low IQ wastrels is - while understandable given the odds - not intellectually honest, which goes to the OP's point that raycissm is about more than race, paradoxically. 

Finally, human biodiversity is (paraphrasing), according to hbd chick (basically our capitalization-challenged female messiah), a multi-disciplined approach to studying the differences and similarities in genetic and phenotypic output inherent in every person, family, clan, tribe, population, and, importantly, race. [I'd encourage you to read her introduction here](https://hbdchick.wordpress.com/2014/08/21/what-is-human-biodiversity-hbd/), as she is wantonly more eloquent than I, and probably has a much better handle on the geneticist-specific aspects of the field (I'm just a guy who likes numbers and silly racist internet memes, after all). It truly is a fascinating little niche of non-PC science, sadly maligned as rayciss more often than not. If you want to dive into the studies that comprise the whole of the rayciss kernel of HBD, the sidebar has a pretty swell link (""Human Biological Diversity Resources"").
",t1_cso77cu,t3_3bmd3l,0,sanders,"pearson coefficients be racist yo... no, really",,2,False,,1437478363,CoonTown,False,False,0,1435712764,t1_csno7c0,cso77cu
0,9,PotvinSux,t5_2r2ad,"Even as a gay person, some of the parade stuff upsets me as well. Mostly, I've found that this is cultural - parades in general are not traditional to Eastern European culture outside of religious processions in Tsarist times and then the military parades of the USSR. On the contrary, parading in Western and Southern Europe is historically linked with the flamboyance of *carnival*, which was all about celebrating deviation (per Bakhtin, it originated and served as the safety valve for all the pressures of an otherwise regimented and conservative medieval society). This has been embraced by broader Western culture because, hey, parades are fun. Consequently, parades of all sorts are common. [Here is a list](https://en.wikipedia.org/wiki/Category:Parades_in_New_York_City) of all the parades commonly held annually in New York. So, I think you're kind of misunderstanding the idea that gays consider themselves particularly special to have a parade - many minorities do in the West, and half of these parades have people in skimpy clothing. Gay pride parades in the West are about as sexual as the typical carnival parade. The difference is instead of half-naked women, you have half-naked men. It's weird to me, but I don't think it actually hurts anyone so I've just accepted that it's my problem not theirs. There is none of this background in the East, and, as a consequence, when activists try to import the ""gay pride parade"" idea into Orthodox Europe as a protest for gay rights, it doesn't quite fit and just ends up upsetting people. On your other point, I would hope you support gay adoption. The sociological literature is essentially unanimous that, all other things being equal, children fare as well with gay parents as with straight parents. 

Finally, the rainbow thing... I mean c'mon. What a silly thing to resent. The main reason not to wear ""rainbowy clothes"" is that the colors will clash and it'll look bad. You can still love rainbows. That doesn't make you gay, and anyone who says it does is an idiot. Bigots are your problem, not gay people. ",t1_cso77fn,t3_3bnxxp,0,,,,9,False,,1437478364,belarus,False,False,0,1435712772,t1_csnxka0,cso77fn
0,3,Tannerleaf,t5_2rg2o,"So ""intra-company transferee"" is off the table then.

Look at it from the other way around, (except for Japanese and EU citizens) what would someone from another country need to do, to pull off what you're trying to do, if they wanted to do this in your own country? ",t1_cso7a1r,t3_3bnlly,0,,,,3,False,,1437478407,japanlife,False,False,0,1435712968,t1_cso71r4,cso7a1r
0,16,[deleted],t5_2qh13,"If some random US corporations can get your country into the Eurozone, both the EU and Greece have bigger problems.",t1_cso7amq,t3_3bomts,0,,,,16,False,,1437478419,worldnews,False,False,0,1435713009,t1_cso5af6,cso7amq
0,1,kabyle1993,t5_333oz,"I just assumed that if Taider was a target than they'd make some room for him. Also Melo is generating some interest for a move out. And with their ages being 31,32 and 32 respectively, they need new players in that starting XI. For me though, the Greek league is too weak for Taider. I think it's too weak for a lot of our players now. At least the Turkish league has a decent top half where they'll play teams that are traditionally strong in European competitions. But Agreed, Fenerbache would be just as good. 


As for Belfodil, apparently Nantes are interested. I think I'd be fine with most teams.. as long as he just doesn't go to any of the Gulf countries. Same with Soudani who I've seen some interest in him. 
",t1_cso7hno,t3_3bir8p,0,crestwords,FAF Crest,,1,False,,1437478584,AlgerianFootball,False,False,0,1435713501,t1_csnun41,cso7hno
0,1,r0botdevil,t5_2qh5b,"&gt; our European-ized history leads us to believe that bread and meat is the proper food for a civilized people

*sigh*... you're probably right about that.",t1_cso7kjw,t3_3bn4r6,0,,,,1,False,,1437478667,philosophy,False,False,0,1435713726,t1_cso53lg,cso7kjw
0,2,silverlitecoin,t5_2t1b5,"Unless im mistaken, all PMs companies had lower revenues over the past few yrs and his company is no different. He's just been the only outspoken CEO to stand up and say something. As long as powerful entities have control over silver and gold via the paper markets then the price of PMs will always be suppressed one way or the other. It doesn't matter anyway. I truly believe that he'll go local and ask other mexican based silver mining companies to join along with him and hold back their mined silver from the markets. I think that he'll be able to convince others to join together with him as this situation with Greece/EU crumbles as well as the Chinese stock markets crashing. Once that happens, it'll fuck up the silver paper shortys and allow silver to finally sky rocket. Im also expecting for china to announce(once their markets crash hard) that their gov has stockpiled 10,000 tons of gold minimum(i believe its actually closer to about 20,000 - 30,000 tons). Once they come out with their #, then gold too will double overnight(or within a few weeks at the latest).",t1_cso7mws,t3_3bkig0,0,,,,2,False,,1437478724,Silverbugs,False,False,0,1435713916,t1_csntn6p,cso7mws
0,1,muchdogeisenseinyou,t5_2qh1i,"They're *prepared* to protect the country. Important difference. 

You can't just have no military and then spin one up if an actual war does happen or you'll be years behind where you need to be. Many European countries get away with small militaries only because they are protected by NATO (primarily US and UK). ",t1_cso7q9d,t3_3bnjve,0,,,,1,False,,1440507623,AskReddit,False,False,0,1435714154,t1_csnxnxu,cso7q9d
0,1,omarh14,t5_2qi4s,"Worst: Lucas's handling of the franchise post return of the Jedi. Until the EU explosion.

Best: tie between The EU explosion (started 1991), the Disney Buyout.",t1_cso7qp1,t3_3bp84n,1,,,,1,False,,1437478811,StarWars,False,False,0,1435714181,t3_3bp84n,cso7qp1
0,1,Psh_thisguy,t5_2qhj4,In Europe they call uniforms kits in sports like rugby and football/soccer.,t1_cso7r0t,t3_3bp8tm,0,,,,1,False,,1437478818,MMA,False,False,0,1435714202,t3_3bp8tm,cso7r0t
0,2,mh512rtyog7d,t5_2qi86,"For europe/UK use coverage up to 520MHz combined with a cheap single chip software radio is bad.

470-790MHz is digital TV.

In some area's there are multiple 100,000watt TV transmitters in 470-520MHz.
Radio's built around Chinese IC's with software receiver filtering have poor to terrible handling of in band strong signals.
Better if the filtering cuts off above 470MHz.",t1_cso7r92,t3_3bnlc2,0,,,,2,False,,1437478823,amateurradio,False,1435714519,0,1435714216,t3_3bnlc2,cso7r92
0,1,GodzillaFlamewolf,t5_2qh16,"[Like this.](http://arstechnica.com/tech-policy/2015/06/eu-plans-to-destroy-net-neutrality-by-allowing-internet-fast-lanes/)  The phone lines may work a bit better under limited circumstances, but the EU basically gutted Net Neutrality in reality.  Fast lanes for all those that pay enough!",t1_cso7v41,t3_3blzxk,0,,,,1,False,,1437478914,technology,False,False,0,1435714433,t1_csngdtr,cso7v41
0,5,myne,t5_2qkhb,"Net present value.

If the Romans had today's accountants, they'd probably not have built the roads and bridges that still serve Europe today.",t1_cso7z0b,t3_3blnqc,0,,,,5,False,,1437479012,melbourne,False,False,0,1435714639,t1_cso7uyt,cso7z0b
0,3,ForgedIronMadeIt,t5_31a9n,"Stop with the non sequiturs.  The subject at hand is whether or not Hitler was a bad guy and whether or not the Holocaust happened.  Stop trying to use red herring arguments as distractions.  (Yes, I know about the firebombing of Dresden, it was awful.  The Russian Communists were awful -- though it is ludicrous to believe that they were Jewish.  None of those points matter in the discussion at hand)  You're a disgrace to the mere notion of critical thinking.

There is an absolute mountain of evidence showing that the Holocaust indeed happened.  Hitler's writings show that he propagated bilious hatred towards the Jews of Europe.  (Unless you wish to deny that he wrote *Mein Kampf*.)  There were thousands of soldiers who could (and did) testify to the existence of the extermination camps.  It is mind boggling to think that **all** of them were shills, paid off, or whatever.

And rather than continue on disproving your disgusting views myself, plenty of other people have done it:

* https://www.reddit.com/r/AskHistorians/wiki/wwii#wiki_holocaust_denial
* https://www.reddit.com/r/AskHistorians/comments/1n3vwo/do_holocaust_deniers_have_any_valid_points/
* https://www.reddit.com/r/AskHistorians/comments/1i20a9/wondering_about_the_holocaust_and_revisionist/
* http://rationalwiki.org/wiki/Holocaust_denial

But it doesn't matter -- you're a downright awful person (or an unfunny troll) who will never change their beliefs even if the entire world of evidence is given to you on a silver fucking platter.

Go fuck yourself, you Nazi worshipping prick.",t1_cso80qx,t3_3b6r0o,0,,,,3,False,,1437479058,isrconspiracyracist,False,1435717513,0,1435714730,t1_cso7j45,cso80qx
0,1,elsimer,t5_2qh1s,"&gt;It is even more sad that people believe a default is avoidable. It is just a matter of time. The longer it takes the harder it will hit the economy.

I don't think many people think that, you'd have to be very unfamiliar with the situation. The main debate right now is that Greece would recover better from it on it's own than under the EU's austerity measures.",t1_cso81oa,t3_3bjkj8,0,,,,1,False,,1437479082,Economics,False,False,0,1435714776,t1_csnjbj9,cso81oa
