controversiality,parent_id,edited,author,score,retrieved_on,body,distinguished,downs,archived,author_flair_text,subreddit,id,removal_reason,gilded,ups,subreddit_id,link_id,name,score_hidden,author_flair_css_class,created_utc
0,t3_34l1xp,1430551585,marianodan,1,1432727354,"SA: Messi, Neymar, Suarez, James, Sánchez (one from each country, democratic yet honest pick).  
   
Euro: Neuer, Ramos, Modric, ~~Robben~~, Hazard, CR7  
  
Africa: Bony, Aubameyang, Ayew (the one in OM), Brahimi, Salah  
  
Asia: Heung Min Son, Honda, Okazaki, Ryan, that UAE midfielder that was great at Asian Cup, can't recall his name help please.  
   
N &amp; C America: Vela, Herrera... and I give up, sorry. I could list the other mexicans in European leagues like Chicharito or Dos Santos, but they don't really impressed. I wish I'd know more about Liga MX.  
    

EDIT: Oh fuck I forgot Ronaldo, I swear it was not intentional lol",,0,False,Argentina,soccer,cqvuzzs,,0,1,t5_2qi58,t3_34l1xp,t1_cqvuzzs,False,60,1430551084
0,t3_34llbk,False,elise81,2,1432727356,"It totally depends on where you travel. It's obviously more populated than NZ, and quite a bit larger. However, have you ever been to Sydney? (I feel like a lot of people in NZ have been to Sydney. I was just in Sydney in Feb. and felt no culture shock. It was so similar to major US cities like Seattle, San Fran, LA, etc. that I was actually surprised at the similarities. 

Know that driving will take some time, trains are often more expensive than planes, and U.S. hostels (from what I've been told my by European traveling friends) are usually a bit different than NZ hostels. ",,0,False,,solotravel,cqvv05n,,0,2,t5_2rxxm,t3_34llbk,t1_cqvv05n,False,,1430551103
0,t1_cquxf3j,1430551443,gazwel,24,1432727373,"Yes, I regularly see Europeans make jokes about black people and chicken and make fun of the way Asians talk on reddit!

Oh wait, I don't because that is not actually a thing in Europe....

Also, in America black people are called ""African Americans"" or Black Americans"". In my country they are just British like the rest of us.",,0,False,,circlebroke,cqvv1h0,,0,24,t5_2tnz9,t3_34ftgi,t1_cqvv1h0,False,,1430551261
0,t1_cqvqqra,False,Willaemann,1,1432727449,"I'm a European with friends from Valparaiso, IN and Chicago. They asked if I wanted to go see Michael Jackson's house and where Jerry Springer gets his guests at the same time; nope.  

Gary's reputation is known on this side of the Atlantic too. If you like we can show you equally diverse and friendly areas in London, Paris, Berlin, Moscow and more. Just because it's in Europe doesn't mean it's fancy ;-)",,0,False,,AskReddit,cqvv7au,,0,1,t5_2qh1i,t3_34k5gr,t1_cqvv7au,False,,1430551952
0,t3_34iv50,False,avapoet,2,1432727533,"Lived there for a lot of my childhood; my mother and my sisters still live in the area. Not lived there in 15+ years, but if you're looking for some of the 'better' things about it:

* Avenham Park and the accompanying Ribble path is nice. Just be sure to head upstream, not downstream, or you'll end up in the old docklands.
* The Harris Library and Museum has the longest Foucault pendulum on the world, which is cool. You feel like you're watching the world turn beneath you.
* I gather that the National Football Museum is there (in the shadow of Preston North End football stadium); I've never been, but if you're interested in football it might be worth a look.
* Good transport links, whether its from Europe's largest bus station (assuming they haven't demolished it yet: they keep threatening to) or from what's actually quite a large hub railway station. And nothing will make you glad that you're only in Preston like a day trip out to Blackpool!

A part from all that, though, it's a pretty mediocre large Northern town. Dreary weather, sprawling suburbia, high street full of Greggs', pound shops, bookies' and offies'... the usual stuff.",,0,False,,AskUK,cqvv89k,,0,2,t5_2t4s3,t3_34iv50,t1_cqvv89k,False,,1430552071
0,t1_cqvuy9h,False,titich,7,1432727533,"Lol e questo chi te l'ha detto, Salvini? Fox News? /r/european?",,0,False,,italy,cqvv8a5,,0,7,t5_2qkhk,t3_34jxmt,t1_cqvv8a5,False,campania,1430552072
0,t3_34kunr,False,sjugge,1,1432727543,"Hope you'll find some trusty EU retailers, haven't had much luck so far with the first batches. Daim they go quick. ",,0,False,,electronic_cigarette,cqvv924,,0,1,t5_2qmlu,t3_34kunr,t1_cqvv924,False,,1430552169
0,t1_cqvfhzu,False,Bobby_log,1,1432727568,Or European? Get it? He's in the shower! Also they don't have any damn water,,0,False,,AskReddit,cqvvaze,,0,1,t5_2qh1i,t3_34ir1q,t1_cqvvaze,False,,1430552409
0,t1_cqvitb3,False,bontasan,1,1432727587,"They operate outside of germany too, like nearly every european train company. The normal way is to go to their website enter in the form your starting train station and the destination. But you should compare the prices with foreign trains they can be cheaper.",,0,False,Nordrhein-Westfalen,germany,cqvvcff,,0,1,t5_2qi4z,t3_344hs6,t1_cqvvcff,False,NRW,1430552587
0,t1_cqvi2l9,False,rider450,1,1432727590,"yes
qwerty or qwertz are the most popular keyboard
azerty is in some parts europe and french speaking countries",,0,False,Guest71928,roblox,cqvvcnx,,0,1,t5_2rnsh,t3_34gpji,t1_cqvvcnx,False,bchat,1430552615
0,t3_34l8vo,False,b_rite,1,1432727601,Hmm I have the concentree and love it. Since you say it's different though I may try to get my hands on the original when I go through duty free since I am currently in Europe.,,0,False,________,Wet_Shavers,cqvvdhe,,0,1,t5_32kax,t3_34l8vo,t1_cqvvdhe,False,,1430552716
1,t1_cqvgof7,False,migrantproblems,0,1432727617,"&gt;And finally the AfD. Capitalizing on the same anti-EU sentiments as many other parties in Europe, as if the EU was to blame for any of their problems. Also right-wing enough to capitalize on the typical fear-mongering and populist agendas that drive right-wing parties without being radical, and thus still electable. But frankly, should they ever be elected, they will prove to be absolutely impotent. So they are nothing to fear.

Why do you think the AfD is just ""fear-mongering"" and ""populist"" implying they wouldn't actually tackle any important issues?

What about

-Demographics
-Illegal immigrants

Both very important themes in Germany which particularly affect the younger generation.",,0,False,,germany,cqvven6,,0,0,t5_2qi4z,t3_34k46n,t1_cqvven6,False,,1430552857
0,t1_cqvnbca,False,weefred,1,1432727622,"Yup I was expecting some ""correlation != causation"" replies. I agree, but arguments like these are made so the time in politics because it's the best we've got. How many times have we heard that the EU is the cause of European peace.",,0,False,,ukpolitics,cqvvf32,,0,1,t5_2qhcv,t3_34eyr7,t1_cqvvf32,False,,1430552915
1,t1_cqvv8a5,False,MordorsFinest,1,1432727694,"http://en.m.wikipedia.org/wiki/List_of_Islamist_terrorist_attacks

https://www.foreignaffairs.com/articles/europe/2005-07-01/europes-angry-muslims

http://www.patheos.com/blogs/progressivesecularhumanist/2015/03/1-in-4-uk-muslims-say-violence-over-muhammad-cartoons-justified/

http://www.bbc.com/news/world-europe-32447603

Ti conviene leggere piu' giornali. 
",,0,False,,italy,cqvvknc,,0,1,t5_2qkhk,t3_34jxmt,t1_cqvvknc,False,,1430553643
0,t1_cqvs3rb,False,EpicRussia,3,1432727695,do you know why hes playing on na when he coaches in eu,,0,False,,leagueoflegends,cqvvkpa,,0,3,t5_2rfxx,t3_34lbyd,t1_cqvvkpa,False,76 team,1430553650
0,t3_34lsac,False,49hz,31,1432727725,"Blizzard really did borrow Riot's EU servers, huh?",,0,False,,hearthstone,cqvvmxy,,0,31,t5_2w31t,t3_34lsac,t1_cqvvmxy,False,echooingooze,1430553938
0,t1_cqvvdgo,False,Madam-Temacia,5,1432727752,"Funny

2 eu (tsm) won iem

but 5 eu players (gambit) (sk)  lost at iem

Almost like less eu the better  stay mad europoor maybe you wont be so retarded later ",,0,False,,leagueoflegends,cqvvoxp,,0,5,t5_2rfxx,t3_34lqy8,t1_cqvvoxp,False,03 team,1430554177
0,t3_34k5xe,False,Hhhaamuus,0,1432727771,"Imagine if someone told you a story based on Earth - they would mention things like cars, computers, Europeans, Asians etc. Unless you are from Earth you would have no idea what these things are and would need to figure them out via context. 

That's basically Malazan. A fully formed world, with a full history and set of stories never actually told in the series. One of the most richly padded out fantasy worlds around. But you don't know the history, and need to learn it as you go... So your confusion is normal! ",,0,False,,Malazan,cqvvqgc,,0,0,t5_2t1dv,t3_34k5xe,t1_cqvvqgc,False,,1430554365
0,t3_34lkaf,False,Filffy,1,1432727815,"The production values and introduction for GE vs SKT blows the NA and EU finals out of the water... feels way more hyped , exciting and planned out. NA is decent, but the EU seems to always be lacking. Why can't they do something like this?",,0,False,[Filffy] (NA),leagueoflegends,cqvvtt2,,0,1,t5_2rfxx,t3_34lkaf,t1_cqvvtt2,False,00 team,1430554790
0,t1_cqvvlnc,False,existentialadvisor,5,1432727855,"It is a very good article. 

I happened upon it the other day when researching male genital mutilation. As a survivor of MGM (oh the theatrics) I never noticed anything in particular with my sex life except that I could go for a very long time. When I was younger it was a neat skill but older now it has become burdensome. 

I do not have any sexual issues to my knowledge, I just don't feel sensitive down there. Even if I don't masteurbate for weeks. Receiving head is pointless, I barely feel anything unless the girl knows what she is doing, and most don't. 

Talking to my unmutilated European friends there is a different opinion. They say that finishing quickly is not an issue and that they can go multiple times. I'm lucky to continue after two orgasms as my sensitivity is completely diminished. I have been reading that MGM is not always accurate, that some may lose sensitivity more than others and that it can come down to the doctors method at removing the foreskin. 

Anytime I bring this up to supporters they justify the barbaric practice for ""hygenic"" reasons. My European friends are horrified that it is a normal practice in America and they had stated that none of them ever had any issues in terms of infections or complications with their foreskin. 

This practice needs to go in my opinion. ",,0,False,,MensRights,cqvvwuv,,0,5,t5_2qhk3,t3_34loa9,t1_cqvvwuv,False,,1430555196
0,t3_34j9oi,False,setilsn4,1,1432727938,I wonder if it updated to the fouled up build...have you tried the fixed updated build? [HERE!](https://s3-eu-west-1.amazonaws.com/waterfox-download/test-builds/waterfox-37.0.2.en-US.win64.zip),,0,False,,waterfox,cqvw38g,,0,1,t5_2vnvl,t3_34j9oi,t1_cqvw38g,False,,1430556074
0,t1_cqvivuw,False,Stefan_Zhirkov,1,1432727961,"Do you at least agree that Kurds have in the past routinely murdered their children or forced them to kill themselves for disobeying them, and still do to a greater extent than other Turks or Europeans?",,0,False,,syriancivilwar,cqvw50o,,0,1,t5_2x5s1,t3_34ibf8,t1_cqvw50o,False,,1430556327
0,t1_cqvjyqx,1430556532,Alphyn_dp,1,1432727963,"Once you know what the buttons do you'll still have to develop your own decision making algorithm. It’s very old, but [This Guide]( https://forum.paradoxplaza.com/forum/index.php?threads/guide-in-depth-guide-to-ckii.589469/#post-13516630) once helped me a lot with that. The decision-making consists of setting a strategic goal for yourself and doing stuff to achieve it. 

The examples of the goals are: get more land for yourself and build a solid personal demesne and a good army, become independent, take the place of your liege, change a succession law when you don't meet the requirements to do it, win a crusade, conquer the 3 neighboring kingdoms to create an empire, pacify your vassals so they won't revolt etc. The game doesn't hold your hand at all, you'll have to think of your own ""victory conditions"" and then other ones, once you've achieved those. 

And you take actions to achieve your goals: building wine cellars, starving out castles, burning churches, fabricating claims, committing suicide, seducing your sister, kicking the Jews out of your realm, cutting that blind Muslim dude’s balls off, assassinating your arbitrary dwarf 9 year old son who has the Down syndrome etc. You’ll have to find out what tools are at your disposal and how to use them. That will take time, and don’t be afraid to make mistakes. 

I can’t really recommend any videos, just find a guy whose voice you like and who played a lot of CK2. And definitely start playing yourself. You could jump in and start playing as a leader of a huge empire, but the odds are that everything won’t be making a lot of sense to you and will just be too confusing to handle. Also, don’t play the suggested historical campaigns, they are also very confusing and that’s not where the fun is. I’d suggest starting as a duke or count, probably independent, with little or no vassals, close to people of a different religion to kill them later, and start building your empire from scratch, the complexity of your game will raise as your realm gets bigger. For me Aragon was a lot of fun as I fought the Muslims to take back Spain. I think it’s what the tutorial suggests you should play first. North-eastern Europe is always aa lot of fun as well.

If you fail terribly and your realm is taken from you, but it’s still not game over, never restart, it’s a huge part of fun. Stand up from your knees, retaliate, take your revenge. 

I wish you good luck and be sure to have fun! 
",,0,False,The white bear eludes me,CrusaderKings,cqvw54n,,0,1,t5_2tgic,t3_34k7qb,t1_cqvw54n,False,rus,1430556343
0,t3_34kh35,False,berthoogveer,1,1432727979,"About 1.5 - 2 hrs ago I managed to get into the game (EU), did some deck building but didn't play. Now I want to play but can't even get into the game.",,0,False,,hearthstone,cqvw6e7,,0,1,t5_2w31t,t3_34kh35,t1_cqvw6e7,False,,1430556520
0,t3_34ihkp,False,Shwily,2,1432728136,Is this book canon or EU?,,0,False,,StarWars,cqvwicp,,0,2,t5_2qi4s,t3_34ihkp,t1_cqvwicp,False,15,1430558288
0,t3_34l9aj,False,MetaThPr4h,2,1432728172,"what the fuck OP Bulbasaur

Anyways, I'm happy that the #1 in Europe is not actually that far from that, he/she has 71401 points
",,0,False,,PokemonShuffle,cqvwl5g,,0,2,t5_36xfp,t3_34l9aj,t1_cqvwl5g,False,,1430558694
0,t1_cqvwlju,False,BluePapaBoy,2,1432728196,There are probably more Europeans than Americans on reddit but anyways.,,0,False,,worldnews,cqvwmyy,,0,2,t5_2qh13,t3_34jfi4,t1_cqvwmyy,False,,1430558970
0,t3_34lvjm,1430559575,Gnome_Chimpsky,3,1432728210,"[Perhaps something like this](http://upload.wikimedia.org/wikipedia/commons/4/45/Man_In_The_High_Castle_map.PNG). That's how Philip K. Dick imagined it in The Man in the High Castle anyway. It isn't really clear how far Hitler was willing to take his expansion and if they managed to defeat the western allies it's possible they would only turn them into allied states and not annex them permanently. Russia would likely be divided between Germany and Japan though and most of asia would likely become part of Japan or a client state. Most of Africa would probably turn into a German/Italian playground and Jews, black people and homosexuals pretty much everywhere would be fucked. 

I'm pretty sure English would still be a widespread language but German would probably be enforced throughout Europe and western Asia.

Another interesting thing is that Speer and Hitler had pretty detailed plans on what to do with Berlin [after the victory](http://en.wikipedia.org/wiki/Welthauptstadt_Germania).

As for the long term stability of that ""empire"" nobody really knows how long it would have lasted. I'd like to think that with the rises in standard of living they would probably run into the same social and cultural upheaval we had in the 60's, and with the diversity of the conquered nations I don't see how they would be able to hold it together. Perhaps on top of that some kind of cold war would eventually develop between the Western/Eastern axis powers that could potentially lead to war.    ",,0,False,,NoStupidQuestions,cqvwnxl,,0,3,t5_2w844,t3_34lvjm,t1_cqvwnxl,False,,1430559107
0,t1_cqvoy1q,False,blorg,4,1432728215,I think Europe also has more passengers flying on low fares airlines which all operate point to point flights only. ,,0,False,Thailand / Ireland,travel,cqvwoe4,,0,4,t5_2qh41,t3_34kc9d,t1_cqvwoe4,False,eur,1430559174
0,t1_cqvpjxr,False,UpvotesFreely,3,1432728271,I'm in Europe and don't know anyone with a dash cam. Never seen one either.,,0,False,,videos,cqvwsnv,,0,3,t5_2qh1e,t3_34kfrc,t1_cqvwsnv,False,,1430559799
0,t1_cqvvg2l,False,Shillen,2,1432728288,The servers aren't online for the whole day. I don't know where you live but in EU I can only play from 5PM - 6AM.,,0,False,Twixzz,PS4,cqvwtze,,0,2,t5_2rrlp,t3_34l9ta,t1_cqvwtze,False,ps-plus,1430559990
0,t1_cqvvz81,False,hornsohn,97,1432728378,"Compensation for shit EU-Servers, I think I heard that one before...

",,0,False,,hearthstone,cqvx0tn,,0,97,t5_2w31t,t3_34li5u,t1_cqvx0tn,False,,1430560978
0,t1_cqvvspn,False,chinzz,7,1432728423,"I think it's worth noting that slashdiablo servers are located in the US, so it's probably not an option for majority of readers. I remember getting quite excited after hearing about active community server, just to find out they don't have EU servers.

If OP is interested in D2 mods, Median XL Ultimative is  still being updated and they also have their own realm (servers in EU, US and Asia) that has ~100 players online daily during peak hours: http://tsw.vn.cz/",,0,False,,Diablo,cqvx49m,,0,7,t5_2qore,t3_34lsi3,t1_cqvx49m,False,,1430561497
0,t3_34lusu,False,neutronstarneko,3,1432728489,"Talk about damned if he does, damned if he doesnt. There is no answer Miliband could have given you that would have satisfied. 

If an overwhelming majority of Britons are concerned with immigration above all else then they should vote UKIP and Yes to leaving the EU.",,0,False,"Social Libertarian -4.0, -4.15 ",ukpolitics,cqvx9ax,,0,3,t5_2qhcv,t3_34lusu,t1_cqvx9ax,False,,1430562249
0,t1_cqvx2zh,False,SinisterDexter83,11,1432728494,"It's the same with the rigid obsession with the twenty odd years of European colonialism in the middle east, and complete ignorance of the 600 years of Ottoman colonialism. European colonialism in Africa was a uniquely devastating event - if you don't know anything about Chaka Zulu and his empire. 

Everything has to be about white people. Look at any event, cultural facet or economic issue - then look for any way to tangentially involve white people and put the blame exclusively on them, that is, all of them. White people hold collective guilt for all the bad things any individual white person has done. 

It's racial narcissism more than anything else. The mirror image of the fusty old retired Colonel who thinks everything positive in the world sprang from the British Empire. ",,0,False,,TumblrInAction,cqvx9p8,,0,11,t5_2vizz,t3_34lwig,t1_cqvx9p8,False,,1430562304
0,t1_cqvwztg,False,pyrespirit,2,1432728508,"That's part of what lead me to characterize it as such!

When I first read that quote for him, my immediate thought was that his story is just largely fanfiction of European history.",,0,False,Science Fiction,books,cqvxapt,,0,2,t5_2qh4i,t3_34jcyf,t1_cqvxapt,False,science-fiction,1430562454
0,t3_34kcot,False,jakibaki,1,1432728528,"Lorem ipsum dolor sit amet, consetetur sadipscing elitr, sed diam nonumy eirmod tempor invidunt ut labore et dolore magna aliquyam erat, sed diam voluptua. At vero eos et accusam et justo duo dolores et ea rebum. Stet clita kasd gubergren, no sea takimata sanctus est Lorem ipsum dolor sit amet. Lorem ipsum dolor sit amet, consetetur sadipscing elitr, sed diam nonumy eirmod tempor invidunt ut labore et dolore magna aliquyam erat, sed diam voluptua. At vero eos et accusam et justo duo dolores et ea rebum. Stet clita kasd gubergren, no sea takimata sanctus est Lorem ipsum dolor sit amet. Lorem ipsum dolor sit amet, consetetur sadipscing elitr, sed diam nonumy eirmod tempor invidunt ut labore et dolore magna aliquyam erat, sed diam voluptua. At vero eos et accusam et justo duo dolores et ea rebum. Stet clita kasd gubergren, no sea takimata sanctus est Lorem ipsum dolor sit amet.   

Duis autem vel eum iriure dolor in hendrerit in vulputate velit esse molestie consequat, vel illum dolore eu feugiat nulla facilisis at vero eros et accumsan et iusto odio dignissim qui blandit praesent luptatum zzril delenit augue duis dolore te feugait nulla facilisi. Lorem ipsum dolor sit amet, consectetuer adipiscing elit, sed diam nonummy nibh euismod tincidunt ut laoreet dolore magna aliquam erat volutpat.   

Ut wisi enim ad minim veniam, quis nostrud exerci tation ullamcorper suscipit lobortis nisl ut aliquip ex ea commodo consequat. Duis autem vel eum iriure dolor in hendrerit in vulputate velit esse molestie consequat, vel illum dolore eu feugiat nulla facilisis at vero eros et accumsan et iusto odio dignissim qui blandit praesent luptatum zzril delenit augue duis dolore te feugait nulla facilisi.   

Nam liber tempor cum soluta nobis eleifend option congue nihil imperdiet doming id quod mazim placerat facer possim assum. Lorem ipsum dolor sit amet, consectetuer adipiscing elit, sed diam nonummy nibh euismod tincidunt ut laoreet dolore magna aliquam erat volutpat. Ut wisi enim ad minim veniam, quis nostrud exerci tation ullamcorper suscipit lobortis nisl ut aliquip ex ea commodo consequat.   

Duis autem vel eum iriure dolor in hendrerit in vulputate velit esse molestie consequat, vel illum dolore eu feugiat nulla facilisis.   

At vero eos et accusam et justo duo dolores et ea rebum. Stet clita kasd gubergren, no sea takimata sanctus est Lorem ipsum dolor sit amet. Lorem ipsum dolor sit amet, consetetur",,0,False,,casualiama,cqvxcam,,0,1,t5_2sxwp,t3_34kcot,t1_cqvxcam,False,,1430562679
0,t3_34inp0,False,myhv,1,1432728531,"Ok, I'm a bit confused. [Official store](https://store.eu.square-enix.com/emea_europe/games/pc-windows-download/FINAL-FANTASY-XIV-A-Realm-Reborn.php) has game priced at 10 euro, but if I go in to upgrade account option in account management, it asks for 20 euro. Also the 10 euro one has no mention of 30 days game time, while the other one does. So what's the difference and why are there 2 versions with different prices?

Oh, and one more question, if I upgrade to full version, do I keep my current trial time that's left (WoW style) or does it discard it and go straight to counting down the first month?",,0,False,,ffxiv,cqvxcji,,0,1,t5_2rgs7,t3_34inp0,t1_cqvxcji,False,,1430562711
0,t3_34lxs4,False,lonleystar,-20,1432728533,EU crying again ff,,0,False,,hearthstone,cqvxcmn,,0,-20,t5_2w31t,t3_34lxs4,t1_cqvxcmn,False,uther,1430562723
0,t1_cqvozdc,False,dragon-storyteller,3,1432728557,"&gt; (like when someone knocks as they open a door)

Not really a fair comparison, since in a lot of places this is normal and expected (mostly in Europe). Touching pregnant people's belly is just dickish.",,0,False,,AskReddit,cqvxehq,,0,3,t5_2qh1i,t3_34kkcs,t1_cqvxehq,False,,1430562969
0,t1_cqvxfwc,False,autowikibot,1,1432728576,"#####&amp;#009;

######&amp;#009;

####&amp;#009;
 [**Gross world product**](https://en.wikipedia.org/wiki/Gross%20world%20product): [](#sfw) 

---

&gt;The __gross world product__ (__GWP__) is the combined [gross national product](https://en.wikipedia.org/wiki/Gross_national_product) of all the [countries](https://en.wikipedia.org/wiki/List_of_countries) in the world. Because imports and exports balance exactly when considering the whole world, this also equals the total global [gross domestic product](https://en.wikipedia.org/wiki/Gross_domestic_product) (GDP).  In 2013, according to the [CIA](https://en.wikipedia.org/wiki/CIA)'s *[World Factbook](https://en.wikipedia.org/wiki/CIA_World_Factbook)*, the GWP totalled approximately US$87.25 trillion in terms of [purchasing power parity](https://en.wikipedia.org/wiki/Purchasing_power_parity) (PPP), and around US$74.31 trillion in nominal terms.  According to a separate estimate by the [World Bank](https://en.wikipedia.org/wiki/World_Bank), the 2013 nominal GWP was approximately US$75.59 trillion.  The [per capita](https://en.wikipedia.org/wiki/Per_capita) PPP GWP in 2013 was approximately US$13,100, according to the *World Factbook*. 


&gt;====

&gt;[**Image**](https://i.imgur.com/ehEWFFf.png) [^(i)](https://commons.wikimedia.org/wiki/File:Annual_Gross_World_Product_Growth_1,000,000-2011_DeLong.png)

---

^Interesting: [^World](https://en.wikipedia.org/wiki/World) ^| [^Outline ^of ^the ^European ^Union](https://en.wikipedia.org/wiki/Outline_of_the_European_Union) ^| [^Commonwealth ^of ^Nations](https://en.wikipedia.org/wiki/Commonwealth_of_Nations) ^| [^BRICS](https://en.wikipedia.org/wiki/BRICS) 

^Parent ^commenter ^can [^toggle ^NSFW](/message/compose?to=autowikibot&amp;subject=AutoWikibot NSFW toggle&amp;message=%2Btoggle-nsfw+cqvxfyl) ^or[](#or) [^delete](/message/compose?to=autowikibot&amp;subject=AutoWikibot Deletion&amp;message=%2Bdelete+cqvxfyl)^. ^Will ^also ^delete ^on ^comment ^score ^of ^-1 ^or ^less. ^| [^(FAQs)](http://www.np.reddit.com/r/autowikibot/wiki/index) ^| [^Mods](http://www.np.reddit.com/r/autowikibot/comments/1x013o/for_moderators_switches_commands_and_css/) ^| [^Magic ^Words](http://www.np.reddit.com/r/autowikibot/comments/1ux484/ask_wikibot/)",,0,False,,SocialDemocracy,cqvxfyl,,0,1,t5_2sjw0,t3_34kj73,t1_cqvxfyl,False,,1430563163
