body,distinguished,created_utc,score,gilded,ups,controversiality,subreddit,id,link_id,author_flair_text,author,author_flair_css_class,parent_id,subreddit_id,edited,retrieved_on,stickied
Within the US I would like to visit the Pacific NW. In Europe I would love to take like a month and visit Ireland and Scotland...,,1448987396,2,0,2,0,AskWomen,cxj8aw7,t3_3v08fs,,JessicaDThongs,,t3_3v08fs,t5_2rxrw,False,1451370405,False
"&gt; Low diamond players are ones who hit diamond and give up because they can't get higher and are happy to sit there for their end of season rewards

Or have jobs or just don't feel like playing ranked. Idk man

I've been diamond for the past 2 seasons, in season 4 I went from gold to diamond within a few months, in the previous season I took it chill because I had real life obligations and a job I wanted to take seriously and just wanted a little break from the game.

For perspective, I played about 1000 games each in season 3 and 4, and about 120 in season 5. Each season I've had a solid 55-60% win rate at the end of season. I peaked at D1 promotional series this season, but fell back down due to ranked decay (50lp per week after a month of not playing ranked stings like a bitch)

It's not a case of being lazy, just having other things to do. I definitely could be Diamond 1 or Masters if I worked harder at it, but why do I want to be? There are a few options:

- Chicks dig elo (the biggest lie ever told unless you're NA)
- Want to be a streamer (Was fun for a while but I don't want people watching me just because I'm high skill because then it puts you under pressure to perform well)
- Bragging rights (meh I earn more than most people I don't need anything else to brag about)
- Want to go pro (I don't have the skill or time to go pro, plus UK pros are rare (Kasing and Snoopeh being the only ones I know outside of the NUEL), and the money is poor in EU).
- The sweet sweet masters border (this is pretty much the only motivation, but I value my time more than to grind for that border)

In between this and the juggernaut rework mid way through the season + the fact many meta mid laners (I'm a mid lane) just aren't for me/I'm not good at (Azir) atm means I don't have much drive to play ranked.

FWIW, currently d4 (not 0lp d5)",,1448987421,3,0,3,0,leagueoflegends,cxj8bhk,t3_3uz2vh,,narrativesarefun,,t1_cxj24yw,t5_2rfxx,False,1451370413,False
"My 100lb German Shepherd is my registered Emotional Support Animal (I have diagnosed anxiety that I receive treatment for) and he can accompany me on flights in the cabin at no additional cost.

To be honest, though, I think that flying underneath is more comfortable for them. Unless you have a dog that is very used to large crowds then the stress of being in the cabin would be far greater than underneath.

I have a friend who has an ESA Belgian Malinois and they travel around the globe to Southeast Asia, Europe, Australia, and so many other places. She puts the dog underneath on occasion because it is warm, darkened (about the same lights as on a dimmed night flight), and quieter down there.

My dog is flying underneath on KLM from Amsterdam to NY soon and while I'm slightly worried about it, I know he'll be far more comfortable down in his crate taking a nap with his blankie than he would be with me and a few hundred other strangers with people constantly moving and lots of strange smells.",,1448987446,5,0,5,0,childfree,cxj8c3k,t3_3uyhio,,flirtyfarts,,t1_cxj3ygv,t5_2qtwb,False,1451370422,False
"been playing ranked as well. yeah, issue is NA playerbase is so small times are really really long sadly. not sure how wargaming should fix the issue. regret making an Na account, want to move to EU but.. so much money and time i just cant lose. &gt;.&lt;",,1448987475,1,0,1,0,WorldOfWarships,cxj8crd,t3_3uzsui,,ToaHP,,t3_3uzsui,t5_2t8uj,False,1451370429,False
"Would it be possible for me to play as Songhai? It seems all the ""good"" european minors are taken.

Otherwise, I'd like to try Lübeck if it's not a possibility",,1448987718,1,0,1,0,eu4,cxj8ic8,t3_3v09fh,Commandant,Randombrony99,,t3_3v09fh,t5_2uqat,False,1451370503,False
"&gt;Import fees are an income for the state.

They are increased prices for the consumer, you are incorrect.

If Toyota has to pay 10% to import their cars into Europe they aren't going to not import their cars, they are just going to be 10% more expensive to buy.  

&gt;And smaller countries should be more protectionist, it's the only way for them to survive in the long run.

Completely false, how do you explain Vietnam, Thailand, Cambodia etc etc etc?

&gt;And keeping cheaper products can be beneficial in the long run

How are products cheaper if you don't import?  Protectionism results in INCREASED prices.  

&gt;And you need protectionism to combat other countries' protectionism. If you're the only one playing fair you're being unfair to yourself.

Hence the point of free trade agreements.  

&gt;Having a free market to their products is a bad idea. Letting countries with vastly different economies join your market (even the labor market) is a shitty idea that ends up with German products replacing Polish ones in Poland and Polish workers replacing the Turkish ones in Germany.

So how else do you suggest these countries develop?  If the US never stopped making shirts domestically then they would cost 10x as much and China etc would never get a chance to develop, they would be stuck with what they have which is asinine.  

You really need to realize that there isn't a single economist out there that agrees with you.

Stop being so selfish, we live in a global society.  

",,1448987718,4,0,4,0,europe,cxj8ict,t3_3uz9ny,United States of America,-landtank,UNSA,t1_cxj1iv6,t5_2qh4j,False,1451370503,False
I am on EU and after unpacking I can't find my gold reward.,,1448987791,0,0,0,0,hearthstone,cxj8k34,t3_3v0j9k,,remainenthroned,wisp,t3_3v0j9k,t5_2w31t,False,1451370525,False
"Not just Europe.

Drake isn't as popular outside the US as Americans might think.",,1448987833,7,0,7,0,hiphopheads,cxj8l2b,t3_3uzq2z,,Analog265,flatbush,t1_cxj55o2,t5_2rh4c,False,1451370538,False
"I translate the tool it's an orrible translation but I hope it's barely readable! xD

[WFRP simulator english version](http://www.danielebaschieri.eu/warshammer/simulator-en.html)",,1448987844,1,0,1,0,warhammerfantasyrpg,cxj8lc6,t3_3td8h5,,DangerBlack,,t1_cx6vrvy,t5_2uga9,False,1451370541,False
"https://www.g2a.com/playstation-plus-2-years-psn-card-de.html

No longer in stock.  German region only.  But the point still stands.  EU PS+ goes on sale occasionally.",,1448987965,0,0,0,0,PS4,cxj8o6k,t3_3uyq67,,AR-47,,t1_cxj8cu8,t5_2rrlp,False,1451370579,False
"&gt; because the world is not static. Jut because you were granted a license to pump and sell groundwater for 1 $ / million gallons in the 1980's does not mean you should be able to continue doing so 35 years later; during a drought.

Which is why treaties like TTIP explicitly have provisions for cases like this. The US *and* the EU have enacted significant increases in environmental protection in the last decades without anybody challenging them through ISDS. 

&gt; someone sues. Someones agrees to stop the lawsuit in exchange for X. The suing party has by all accounts won.

Country A enacts discriminatory measure. Company B sues for compensation. A and B settle for cancelling the measure. No compensation is granted, discriminatory measure is cancelled. Nobody loses (asides from unrightful profiteurs). ",,1448988046,1,0,1,0,europe,cxj8q4m,t3_3uz9ny,Germany,MarktpLatz,GERM,t1_cxj8khb,t5_2qh4j,False,1451370604,False
"Let’s look at the economy of the region of the Uzege, in Gard in the South of France in about the 13th century. 

This region had about 30 villages, each supporting a castle and a knight (*Seigneur*), with an average population of about 400 people. 
At the center of the region was the small city of Uzes. The city has 8,000 people today. Perhaps 5,000 in Medieval times? (6,150 in 1793).  So, the total population of the Uzege was about 17,000.

The country people were mostly farmers.  The agriculture of the area, then as now, was vines, olives, fruit, vegetables, grain, sheep and goats.  The villages produced both primary products, but also secondary products, such as wine, olive oil, cheese, charcoal, spun yarn, woven cloth.

The village economy might have supported a baker and a blacksmith, a few carpenters and masons, perhaps a potter (making Roman tiles for roofs, as well as pots), if there was good clay nearby, and a priest.

Not all villages had a mill, but many did.  The village might also have a wine press and olive press.

If there was a mill, the Seigneur generally owned it, and a Miller ran it.  The miller took a percentage of the flour as his fee, and paid a share to the owner as ‘rent’.  The Seigneur might also own the wine and olive press, and charge a portion of the production for the use.  (The villagers could press their own grapes by foot, but it was advantageous to use a basket press and pay, because the basket press will produce 15-20% more juice than foot pressing.)


https://en.wikipedia.org/wiki/History_of_the_wine_press


The Seigneur, probably received a labor levy from the villagers (40 days was a traditional Medieval levy – but no record if this was the levy in the Uzege), and some portion of the villagers produce (the church traditionally got some portion as well).


In some places in Medieval Europe, feudal landowners had the right to run a court (and collect a percentage of court decreed fines).  Don’t know if Seigneurs in the Uzege had village courts.  There was a court in the city of Uzes.

There would have been a market in the city of Uzes, and villagers would have come in to the market to buy and sell and trade once a week. The market was probably run from booths or stalls or carts or wagons in the Place aux Herbes, much like it still is.

We know that the bishops of Uzes had the right to coin money, so there was probably some form of money economy, not just feudal barter, even as early as the 12th century.

The city was surrounded by a defensive wall (now gone and replaced by a road). Inside the city were three great defensive towers (still there), The Tour Bermonde (the keep of the Seigneurs de Uzes - first recorded in 1080 AD, who later became Lords, titled ""Viscounts"", ""Counts"" and then ""Dukes""), The Tour du Roi (built by the town guilds as a counter power to the Lords and the Bishop - later taken over by the Kings of France), and the Tour de l'Eveche (The tower of the bishop's palace).

There was a bishop of Uzes since at least 442 AD. There was a cathedral there in the 12th century. There are also several other churches.

In the center of town is the ""Place aux Herbes"" which is where the market was (and still is) held.

Buildings in the villages and the city were of stone, with Roman tiled roofs. 

The stone, lumber, and clay to build houses, barns, castles and churches was all to be found on the lands of most villages.

Domestic buildings in the villages were generally two stories.  In the city, most were typically three or four stories high. They frequently had a vaulted ground floor, used for workshops or storage or shops, with living quarters on the two or three upper floors. There were a mixture of apartment buildings, single family homes, and the city mansions of rich merchants or feudal knights from the surrounding countryside.

The main industry in the city, probably since the 12th century, was the manufacture of cloth. (People in the villages might weave rough homespun cloth, but finer cloth was produced by dedicated weavers in Uzes).  The city of Uzes was also a center of government, church, law courts and commerce for the surrounding area. The bishops had the right to mint coins in the 12th century, so there was a mint.

On the outskirts of the town were several large monasteries. The town was surrounded by the hunting preserve of the Lords of Uzes, and by farmlands and small villages, each with its own small castle.

Textiles was the largest industry, so many of the vaulted ground floors would have housed hand looms, or warehoused yarn or cloth. There were undoubtedly other workshops in the city as well. (Carpenters, Masons, Blacksmiths, Coopers, Dyers, Fullers, Tailors, Tanners, Leatherworkers, Cobblers, Cabinetmakers, etc.) There were also wine and produce merchants (Wine, flour, olive oil, were produced in the country villages - or the grain mills on suitable rivers. Lumber, quarried stone and clay tiles would also have been produced in the countryside but consumed in the city. One of the local villages, San Quentin de la Poterie, specialized in making pottery ware, which also would have been sold in Uzes), butchers and bakers.

These sorts of establishments would be run by a master craftsman, perhaps with some journeymen and apprentices, plus, of course, a large contingent of unskilled laborers, who moved things and carried things and worked for the merchants and skilled craftsmen.  

As an administrative center, there would have been clerks (who could read and write) and some lawyers. The Seigneurs of Uzes would have had a small group of men at arms. There would be a number of monks and nuns in the monasteries on the outskirts of the city. Also, the richer inhabitants would have supported a fair number of domestic servants. The very rich, such as the Lords of Uzes, or the Bishop, would have had some specialist retainers, huntsmen, falconers, grooms, chefs, perhaps some landless knights who served the lord.

There were metal workers, both working in the mint, but also casting or forging metal implements and weapons.

In short, in the 1200s in the Uzege, one would find an economy based on the countryside producing primary products and some secondary products, and the city producing finer secondary products and services. 
",,1448988046,42,1,42,0,AskHistorians,cxj8q57,t3_3uzs4d,Quality Contributor,mormengil,qualitycontributor,t3_3uzs4d,t5_2ssp3,1449003335,1451370605,False
"They often cover slightly different things. Additionally, companies knows that most people aren't aware of their rights. While technically you might be entitled to a certain thing, they are not going to go out of their way to advertise that if it is not in their interest.

First of all, what is covered by consumer law - In the EU, consumers are entitled to two years of consumer protection at minimum. Each country is then allowed to adjust that period, if it is in benefit to the customer. In practise, this means a country can extend the period of consumer protection, but not shorten it. In Belgium, for example, you are only granted the minimum term as set by the EU. In the Netherlands, on the other hand, the term is not limited by a certain number of years (but naturally, the chance you are going to be able to make a successful claim four years on is minimal)

Additionally, for the first six month period, all you need to do to claim consumer law, is prove to the seller that your device is not functioning properly. After six months, however, you must not only prove that it is no longer functioning properly, but also that this defect already existed upon receipt of the goods. (which often involves proving the materials used were not adequate)

Now warranties offered can also include additional services not covered the consumer law. For example, the company I worked for included additional software support in the warranty (software is never covered by consumer law, only hardware), as well additional pick-up services / swap services for people who purchased extended warranties. With warranties, depending on the seller, you often don't have to prove that the device was not working properly when received. ",,1448988260,1,0,1,0,explainlikeimfive,cxj8vd3,t3_3v0gsp,,palcatraz,,t3_3v0gsp,t5_2sokd,False,1451370672,False
"The viking ones on my dad's side. We supposedly got into a lot of mischief. If you are European, chances are my ancestors pillaged your ancestors.",,1448988530,2,0,2,0,AskReddit,cxj920h,t3_3v0jmb,,figyros,,t3_3v0jmb,t5_2qh1i,False,1451370759,False
"ISIS is more comparable to the aftermath of when the red army won the eastern front, which lead to what is called ""the rape of Europe"". It was basically the read army's revenge for what the nazi forces had done to the civilians in Eastern Europe (but from what I heard they were more brutal in the way they did it).

TLDR; ISIS are barbaric and disorganized murderers and rapists.",,1448988536,0,0,0,0,worldnews,cxj925u,t3_3uzdz4,,need_cake,,t1_cxj34jq,t5_2qh13,False,1451370761,False
"KR will always be strong as a region because below the big names they have a lot of good players, and when i mean good i mean LCS level.

What LoL scenes needs isnt KR to implode, but NA and EU to explode and become a challenge for KR.

I hope this happens soon, because that would make LoL much better as an sSport.",,1448988542,1,0,1,0,leagueoflegends,cxj92bo,t3_3v0j4x,,CrashdummyMH,,t3_3v0j4x,t5_2rfxx,False,1451370764,False
"[M]  
/u/WPGameMaster  
As an Addendum, on standard of living increasing, the West Bengali people will not easily forget the following:  

+ [rebuilt electrical infrastructure](https://www.reddit.com/r/worldpowers/comments/3o19y5/event_the_french_zone_eclairage/)  
+ [water](https://www.reddit.com/r/worldpowers/comments/3o1cbf/event_the_french_zone_leau/) , [food and clothing](https://www.reddit.com/r/worldpowers/comments/3o270p/event_the_french_zone_besoins_vitaux/)  

+ [rebuilt housing](https://www.reddit.com/r/worldpowers/comments/3o25ip/event_the_french_zone_maisons/)  

+ [rebuilt schools](https://www.reddit.com/r/worldpowers/comments/3o1hdt/event_the_french_zone_ecoles/)  

+ [improved sanitation](https://www.reddit.com/r/worldpowers/comments/3oaxwl/event_the_french_zone_installations_sanitaires/)  

+ [medicine and doctors](https://www.reddit.com/r/worldpowers/comments/3o1nty/event_the_french_zone_m%C3%A9decins_sans_fronti%C3%A8res/)  

+ [the prevention of looting](https://www.reddit.com/r/worldpowers/comments/3o1f29/event_the_french_zone_droits_de_propri%C3%A9t%C3%A9/)  

+ [rebuilt roads](https://www.reddit.com/r/worldpowers/comments/3o2gkv/event_the_french_zone_routes/)  

+ [government representation as an overseas territory](https://www.reddit.com/r/worldpowers/comments/3oivd4/event_official_status_of_the_french_zone/)  

+ [women's rights](https://www.reddit.com/r/worldpowers/comments/3osrl1/event_the_french_zone_lh%C3%A9ritage/)  

+ [public works](https://www.reddit.com/r/worldpowers/comments/3osuqe/event_the_french_zone_travaux_publics/)  

+ [improved transportation designed to streamline economic growth](https://www.reddit.com/r/worldpowers/comments/3qrhk2/event_the_french_zone_v%C3%A9los/)  

+ [asking permission for deployment of their soldiers](https://www.reddit.com/r/worldpowers/comments/3tcppm/event_king_louis_xix_addresses_the_french_zone/)  

+ [nuclear cleanup](https://www.reddit.com/r/worldpowers/comments/3tod2r/event_the_french_zone_les_h%C3%A9lianthes/)  

+ [defence](https://www.reddit.com/r/worldpowers/comments/3u9e37/event_the_french_zone_larm%C3%A9e_de_lair/)  

+ [swiss-backed referendums](https://www.reddit.com/r/worldpowers/comments/3udnh8/event_the_french_zone_sondage_dopinion/)  

The West Bengali will not forget these things this soon, as the French have done more for quality of life in the French Zone than any other European occupier.  
FYI /u/UnitedStatesof_Asia",,1448988601,1,0,1,0,worldpowers,cxj93r2,t3_3v0iam,Prime Minister Albert Sartre,King_of_Anything,FRAN,t3_3v0iam,t5_30yfr,False,1451370785,False
"I live in the Netherlands. And don't understand me wrong, a lot of people here have an iPhone. But as a student, most of the times people that I know, have A. an Android phone or B. have an old 3-pin charger lying around from their old iPod Touch or iPhone 4(s). Also, whenever I read articles about Android phones or iPhone I always get the impression that in the US, iPhones have a way bigger marketshare than here in Europe. Also: Chinese manufacturers (for example Huawei) have become a real competitor to Samsung, HTC etc. The biggest reason is the price point really.

But maybe it's just a thing inside the group of people I hang around with. ;)",,1448988674,1,0,1,0,apple,cxj95ju,t3_3uwjd3,,thetrustyservant,,t1_cxj7nqb,t5_2qh1f,False,1451370806,False
"I moved back from the US to Sweden a while back, before I realized FIRE was a thing. Luckily my savings rate has remained the same or even increased a bit (~55%). I'm in tech, so could potentially (probably) have achieved FIRE faster in the US. On the flip side there are some negatives too. A measly 3 weeks vacation (spent flying back home every year), no parental leave, insane childcare, healthcare and education costs. A bigger factor was of course to be closer to family, and also that I just like Europe as a continent.

We also have a form of investments account that has a 0.5% yearly fee, but no taxes on gains, so that makes the taxes a bit easier to deal with. That fee is subject to change in the future though.",,1448988715,3,0,3,0,financialindependence,cxj96lx,t3_3uzokv,,fiswede,,t1_cxj5pjg,t5_2t34z,False,1451370820,False
"I have noticed that people who (rightfully, don't get me wrong) criticize european imperialism tend to look at other empires with rose-colored glasses. Sure, european imperialism may have made the most impact, but they were still fairly bad.",,1448988879,17,0,17,0,SubredditDrama,cxj9ape,t3_3uzsqh,,professorwarhorse,,t1_cxj8g06,t5_2ss5b,False,1451370873,False
"We don't have runs on banks any more [because we have the FDIC](https://en.wikipedia.org/wiki/Diamond%E2%80%93Dybvig_model).  Also, not all financial institutions are backed by the FDIC, which is arguably part of the problem for investment banks.  FDIC only really covers commercial banking.  

Greece doesn't have the FDIC, so they've been putting money in the banks from the European Central Bank or the Greek Government, which, yes, have helped prevent bank runs, but they were (at least for a time) limiting how much people could take out of the bank, to prevent their collapse.",,1448988891,1,0,1,0,explainlikeimfive,cxj9b17,t3_3uzv93,,Atomicnumber26,,t1_cxj8986,t5_2sokd,False,1451370878,False
"Oh really, The list goes on? Who's the next name, Americo-Europeanly speaking? (Don't look it up)",,1448988935,-1,0,-1,0,AskReddit,cxj9c5b,t3_3v0iz2,,sqraaa,,t1_cxj91lr,t5_2qh1i,False,1451370893,False
"To be fair, the SNP said they wanted Scotland to control it's own affairs then said they wanted to be part of the EU and for rUK to essentially control their currency.

The SNP were basically endorsing Devo Max last year.",,1448988966,2,0,2,0,ukpolitics,cxj9cwd,t3_3uzjii,The Lib Dems didn't die for this.,SolaVirtus,,t1_cxj69zq,t5_2qhcv,False,1451370903,False
"###&amp;#009;
######&amp;#009;
####&amp;#009;

Acronyms I've seen in this thread since I first looked:

|Acronym|Expansion|
|-------|---------|
|ESA|European Space Agency|
|NdGT|Neil deGrasse Tyson|

----------------
^(I'm a bot; I first read this thread at 16:57 UTC on 1st Dec 2015. www.decronym.xyz for a list of subs where I'm active; if I'm acting up, message )^[OrangeredStilton](https://www.reddit.com/message/compose?to=OrangeredStilton&amp;subject=Hey,+your+acronym+bot+sucks).",,1448989023,5,0,5,0,space,cxj9eap,t3_3uzvhn,,Decronym,,t3_3uzvhn,t5_2qh87,1449273123,1451370921,False
"Heh, does it kinda look like [this set?](http://i-cdn.phonearena.com/images/phones/46372-xlarge/Nokia-Lumia-930-2a.jpg). The name varies by continent, but you might have the 929/Icon or the 930 as its called in Europe.

I use Readit and a Lumia 950XL, but I've heard the new Baconit app is good. Might have to try it!",,1448989297,1,0,1,0,furry,cxj9l1t,t3_3uydtp,Feral Wolf,Wahots,Wahots,t1_cxj94ra,t5_2qi2h,False,1451371009,False
"My friend is a bartender, and according to him it depends on a lot of things, such as if Europeans are there, if an Asian group sits down at a table, if girls are flirty with him, etc.

If it's a really good, busy night, he can make $150 in tips at least. A really bad night will be significantly less.",,1448989301,2,0,2,0,canada,cxj9l63,t3_3uylmv,Lest We Forget,cheeseburgz,poppy,t1_cxj7byp,t5_2qh68,False,1451371011,False
3-4k the na teams and top teams in eu.,,1448989304,1,0,1,0,GlobalOffensive,cxj9l95,t3_3v0n3u,The Global Elite,Levimeister,rank global-elite,t1_cxj9ikv,t5_2sqho,False,1451371016,False
"Pqp, um dos piores livros de ""historia"" que eu ja tive o desprazer de ler, e vao dar mais publicidade pra essa merda. Pelo amor de deus",,1448989315,7,0,7,1,brasil,cxj9lid,t3_3v0fl3,"Brasília, DF",zanycomet,DF,t3_3v0fl3,t5_2qh9i,False,1451371015,False
"OP? i wouldn't say that, clearly players are not that motivated as they're in EU or Korea cuz they're there only for the money.",,1448989428,1,0,1,0,leagueoflegends,cxj9o7d,t3_3v0ins,,Bprior,team 00,t3_3v0ins,t5_2rfxx,False,1451371050,False
Health care and education is not everywhere free in eu is like 1 or 2 countrys...,,1448989503,-5,0,-5,0,leagueoflegends,cxj9pxd,t3_3uzisr,,Mrfatmanjunior,team 19,t1_cxj86ih,t5_2rfxx,False,1451371072,False
Korea is trash but EU isn't ? Nice reasoning after losing to the two korean teams you met dude,,1448989633,1,0,1,0,leagueoflegends,cxj9t1h,t3_3v0dc3,,Eaglooo,,t1_cxj7d9y,t5_2rfxx,False,1451371114,False
"Any news on when we'll get it in Europe, too? I'm anxious to get Flipnote.",,1448989848,1,0,1,0,3DS,cxj9y57,t3_3uytkv,my favourite game will never be the same :(,whizzer0,iw,t1_cxiwzl5,t5_2ruhy,False,1451371181,False
