controversiality,parent_id,edited,author,score,retrieved_on,body,distinguished,downs,archived,author_flair_text,subreddit,id,removal_reason,gilded,ups,subreddit_id,link_id,name,score_hidden,author_flair_css_class,created_utc
0,t3_34f9rh,False,m4011972,84,1432703112,"Constant shouting of EU! EU! EU! EU! at sporting events, or any large gathering basically. Choreographed performances of Ode to Joy with flypasts and troops from EU battlegroups before sporting events or any large gathering basically. Unusual veneration of the founding fathers; Schuman, Gasperi, Monnet, Spaak, Spinelli.

I may have confused some stereotypes here.",,0,False,,AskReddit,cqugbkh,,0,84,t5_2qh1i,t3_34f9rh,t1_cqugbkh,False,,1430438525
0,t1_cqu6u6t,False,alextoria,7,1432703115,"no no, the Nile is in Egypt, not Europe. silly",,0,False,,AskReddit,cqugbti,,0,7,t5_2qh1i,t3_34f9rh,t1_cqugbti,False,,1430438537
0,t1_cqu80x6,False,jpowell180,9,1432703136,There are some in the U.K. who don't believe they should be considered to be a part of Europe due to the separation from the continent.,,0,False,,AskReddit,cqugdeg,,0,9,t5_2qh1i,t3_34ffo5,t1_cqugdeg,False,,1430438612
0,t1_cquerxp,False,aspeenat,11,1432703149,"or that Asian-Americans do better statistically in education, jobs and follow social rules  (no crime, no divorce) at a higher rate but European-Americans still have more control and power then maybe our merit society is not as influenced by merit as it is by white privilege :0",,0,False,,asianamerican,cqugefl,,0,11,t5_2rfyw,t3_34gc2f,t1_cqugefl,False,,1430438664
0,t1_cqu6iqi,False,SometimesIArt,3,1432703174,"I once had a Wells Fargo phone rep tell me that my bank account keeps shutting down because I keep using my card ""overseas."" I live in Canada. 

I told him so and he goes ""yeah."" I asked him where he thought Canada was an he said ""Europe."" 

=( ",,0,False,,AskReddit,cqugg8x,,0,3,t5_2qh1i,t3_34ffo5,t1_cqugg8x,False,,1430438746
0,t1_cqufwrm,1430439151,haloraptor,8,1432703200,"That's just part of the EU project though - the richest countries are able to help direct (a small in the grand scheme of Western government budgets) amounts of money to poorer areas of all the countries to raise standards in those areas.

The entire point is that the richest countries help out. If we were a net recipient of EU funding we wouldn't be having a conservation about whether the EU is right for us because we'd want to be in it so we could move to Germany.

But because countries are only wealthy in general and often include areas of much larger deprivation sometimes net contributors benefit from those kinds of programmes. It's embarrassing really that there are even areas so deprived in Britain that the EU has even needed to designate some of them as convergence zones.

http://en.wikipedia.org/wiki/Regional_policy_of_the_European_Union#/media/File:European_regional_policy_2014.svg 

(Red is bad)",,0,False,Wales,unitedkingdom,cqugian,,0,8,t5_2qhqb,t3_34edl1,t1_cqugian,False,cnty-wales,1430438844
0,t3_34esam,False,gdrmatos,2,1432703267,"No dia que as pessoas pararem de viver no ""lindo mundo da imaginação"", irão ver que por trás da dureza desse texto da Veja existem alguns pontos muito válidos. Enquanto os indicadores de educação não melhorarem, não tem governo de Luciana Genro que aumente realmente os salários dos professores. É um problema muito mais cultural do que de alocação de recursos. 

Quando comecei a estudar Química muita gente olhava horrizada para mim, uma vez que meu irmão gêmeo passou para Medicina e nós dois sempre tivemos desempenhos escolares muito similares e tiramos escores muito próximos no vestibular. Não conseguiam entender porque eu faria um curso para ""virar professor"" quando podia fazer medicina. De fato, eu mesmo não quero ser professor de Ensino Médio, quero fazer pesquisa e dar aulas em Ensino Superior, mas esse comportamento dos meus familiares e dos conhecidos apenas mostra como a própria cultura do brasileiro coloca o docente em uma categoria inferior. É um ciclo vicioso no sistema atual: a educação é ruim, o aluno mal-formado acha que é o sistema é bom o suficiente, os professores continuam a ganhar mal, os sindicatos promovem greves e, se ganham algo, conseguem aumentos pífios, a educação continua ruim e por aí vai.

Agora, quando tenta-se quebrar esse ciclo, arejar as escolas com idéias novas os primeiros a rejeitar são os próprios sindicatos! Não tem cabimento isso! Não se leva metodologias novas pq os professores são mal-pagos; os diretores de escola não podem ter cursos de formação em administração e economia escolar porque ""educação não pode ser monetarizada""; os alunos são violentos e cometem graves ameaças, mas não pode denunciá-los a secretaria de educação (ou polícia em casos extremos) porque isso traumatiza, etc. É um sistema falido! Acorda gente!",,0,False,Estados Unidos,brasil,cqugneb,,0,2,t5_2qh9i,t3_34esam,t1_cqugneb,False,world,1430439078
0,t1_cquahjh,False,hippiebanana,2,1432703318,"I think sometimes Europeans get away with this when English isn't their native language. If they grew up learning American English, watch American movies etc all the time, then their American accent is pretty natural - it's not an imitation. Just like you, it's actually the way they learned to speak English.",,0,False,,AskReddit,cqugrbd,,0,2,t5_2qh1i,t3_34f9rh,t1_cqugrbd,False,,1430439257
0,t1_cqua1b5,False,Thisis___speaking,1,1432703362,"Americans misunderstanding or not adhering to cultural norms = ignorant, rude tourists. 

Europeans misunderstanding or not adhering to cultural norms = honest mistake, not their fault. 

Math checks outs!  

Edit: not a criticism of you, just a general sentiment I see from time to time. ",,0,False,,AskReddit,cqugulp,,0,1,t5_2qh1i,t3_34f9rh,t1_cqugulp,False,,1430439407
0,t1_cqugsdn,False,Stuhl,15,1432703395,"yes. Russia is like 40% of Europe. 
And Ukraine which is afaik the second biggest Country in Europe. ",,0,False,,AskReddit,cqugwzo,,0,15,t5_2qh1i,t3_34f9rh,t1_cqugwzo,False,,1430439513
1,t1_cqugjci,False,Altfph,2,1432703446,"Finland was strongly influenced by the Soviet regime during the cold war, and was defined at a part of northern Europe. Finland in particular experienced a strong soviet pull, and was culturally influenced by the soviets. ",,0,False,,Steroidsourcetalk,cquh14u,,0,2,t5_3188j,t3_34g3ab,t1_cquh14u,False,,1430439697
0,t1_cquay26,False,Rozenwater,18,1432703475,Europe the continent is not the same as the EU though.,,0,False,,AskReddit,cquh384,,0,18,t5_2qh1i,t3_34ffo5,t1_cquh384,False,,1430439778
0,t1_cqug2v4,False,Lantisca,3,1432703517,How bad must EU be if he wants to be in trash land? :),,0,False,,leagueoflegends,cquh6go,,0,3,t5_2rfxx,t3_34ggke,t1_cquh6go,False,77 team,1430439919
0,t1_cqud2o7,False,Teft_Lesticle,31,1432703534,In Australia it's a warm greeting to a mate. Do you people see Aussies as Europeans or are we a different breed? Alot of your descriptions of European men fit the bill for Aussies as well. ,,0,False,,AskReddit,cquh7tk,,0,31,t5_2qh1i,t3_34f9rh,t1_cquh7tk,False,,1430439981
0,t1_cqudmvp,False,Drunken_Economist,4,1432703539,"Primaries aren't actually general elections though. They are just the party's way of choosing a candidate they want to run on their ticket. 

Also, there are only three countries in Europe with enforced compulsory voting (Cyprus Liechentstein, and Luxembourg) . . . and only Switzerland gives postal notifications for all voting elections.",,0,False,,SandersForPresident,cquh86q,,0,4,t5_2zbq7,t3_34ef77,t1_cquh86q,False,,1430440000
0,t1_cqueqti,False,Innalibra,11,1432703558,"Borderline racist party who sells themselves as anti-EU/immigration and parrot the usual nonsense about immigrants being literally hitler, which a lot of people lap up because they just love to blame all their problems on foreigners.",,0,False,,AskReddit,cquh9m6,,0,11,t5_2qh1i,t3_34ffo5,t1_cquh9m6,False,,1430440064
0,t3_34c1nw,1430440531,Cursance,3,1432703615,"ASOIAF pulls from a range of time periods in terms of dress. The most common influence seems to be 15th century for men and early-mid 16th for women. In general, poorer people wear what would be earlier fashions, historically, which are more shapeless and with less ornamentation. The wealthy, especially women, wear fashions much closer to Renaissance Italy.

[This is an example of a couple things.](http://www.icf.edu.in/library/history/4.jpg) The woman on the left in green is something a lady of middling nobility might wear. The guy in yellow is A) what a Bravo might be with all the elaborate detail and colour and B) an example of slashing and puffing. Slashing is mentioned many times in the series, and it is meant to show the rich fabric of your clothing's underlayer. It demonstrates possession of the wealth required for such frivolities. The three on the right demonstrate why I don't think there is much draw from late 16th century for either sexes - the clothing becomes too constricting and/or heavy to fit with anything described in the books.

[Here's another.](http://www.icf.edu.in/library/history/3.jpg) The man in green is wearing what is called a doublet (on his torso) and bases (the skirt thing). You probably recognize the word ""doublet,"" seeing as most men of nobility wear it as their typical attire. Ned has ones of varying quality, from leather up to fancy ones he wears for court occasions. This outfit would be modular - that is to say, the components could be swapped out or parti-coloured (another term that appears in the books). The bases, which would be worn longer by modest men, attach to the doublet by laces (I think Eddard actually describes this at one point). Same goes for the sleeves.

[This might be what female high nobility would wear](http://upload.wikimedia.org/wikipedia/commons/c/ca/Giovanna_Tornabuoni_full_length.jpg) It's Renaissance Italian, and you can see the level of detail in both the construction and the fabric. The books describe Myrish lace, rich damask (heavy printed material), patterned silk. This is the kind of stuff Europeans got into as technology and trade improved, and this happened especially early in Italy. You can even see slashes with tiny puffs on the sleeve of the woman in front. Dresses like this are described by their skirts and their bodice - the upper part. The woman in grey is supposed to either be a nun of some sort or simply an older, reserved woman. Still, she pulls her skirts up slightly in the front to reveal a high quality inner layer of her outfit. Septas dress like this, and cover their hair out of modesty just like in history.

SIDE NOTE: She's also doing something that you might notice in the other pictures - she's gathering her clothing in front of her belly like a baby bulge. Women did this to either liken themselves to the iconography of the Virgin Mary or to express fertility. The show actually depicts this when Walder Frey parades his daughters in front of Robb - most of the girls are doing this. At first it confused me. ""What? They don't even have a Virgin Mary!"" But it makes sense if they want to invoke the Mother of the Seven.

Dressing for war seems to be a point where GRRM pulled from any source he wanted from like 1000AD til the height of armour-making around 1500 - armour gradually started becoming obsolete after this, but the most elaborate sets were made after this, for show. The fancily adorned and coloured suits of armour in the books are inspired by this later, craftsmen period. 

But the majority of foot soldier battle attire looks a bit like [the two guys in mail here](http://www.icf.edu.in/library/history/2.jpg). The surcoat (mentioned ALL THE TIME in-books) is a topmost layer worn in battle by most knights, if not the foot soldiers, and IRL many were just a long and narrow sheet with a head hole in the centre. Many of the peasant rabble wear mail shirts like the one in the picture. At least the lucky ones, or they wear leather versions with studs or metal rings sewn onto them. Others are described wearing less substantial things made of leather, quilted doublets or jerkins (Doublets with sleeves!). 

Oh, also in that picture, the guy in red over Carolinian Europe is a great example of the type of garment the lower class would wear. Imagine it with less colour, and no trim. That's Smallfolk Chic.

I'm kind of getting tired of typing, even though I could write a Master's Thesis about fashion in Westeros (and don't get me started on beyond). But yeah, this is kind of an overview I guess.",,0,False,A kiss with a fist is better than none,asoiaf,cquhdza,,0,3,t5_2r2o9,t3_34c1nw,t1_cquhdza,False,GloverOfDeepwoodMotte,1430440259
0,t1_cqu8fqg,False,Rench27,-1,1432703693,We basically guard Europe.,,0,False,,worldnews,cquhjx3,,0,-1,t5_2qh13,t3_34eaff,t1_cquhjx3,False,,1430440521
0,t1_cqufi0y,False,topman213,1,1432703706,i came here to say this... I know someone is european when they have the side shaved and long on top that flips over to the other side. really strange look if you ask me but highly popular with europeans where i live,,0,False,,AskReddit,cquhkwe,,0,1,t5_2qh1i,t3_34f9rh,t1_cquhkwe,False,,1430440561
0,t3_34gnjk,False,WESKIMOhots,-10,1432703718,"Maticore Build &gt; Multishot &gt; hungering arrow   in general.
Hungering arrow is better for dueling a 1v1 / 2v2s.
I have a full valla guide on my website: weskimo.com if you wanted any more info that I havent provided here. hope i have helped :).
Weskimo - Rank 1 Eu",,0,False,,heroesofthestorm,cquhlvj,,0,-10,t5_2ym13,t3_34gnjk,t1_cquhlvj,False,,1430440604
0,t1_cquhjvn,False,Altfph,2,1432703746,"Jaysus. I went to a Nordic nation, and the girls were not dtf, at all. Very conservative. This nation was not in eastern Europe, but in the proximity. Happy? ",,0,False,,Steroidsourcetalk,cquho0a,,0,2,t5_3188j,t3_34g3ab,t1_cquho0a,False,,1430440702
0,t1_cquedso,False,Scuderia,1,1432703759,"[Here is Elsevier retracting the study from the Journal of Food and Chemical Toxicology.](http://www.elsevier.com/about/press-releases/research-and-journals/elsevier-announces-article-retraction-from-journal-food-and-chemical-toxicology) 
  
The retraction was over the fact that do to the small sample size of 10 rats per sex per group and 2 year duration of the study it was physically unable to draw meaning conclusion on either general toxicology or carcinogenicity. 
  
[The common protocol for sub chronic toxicity dictates 10 rats per sex per group for 13 weeks.](http://www.oecd-ilibrary.org/environment/test-no-408-repeated-dose-90-day-oral-toxicity-study-in-rodents_9789264070707-en)
  
[The common protocol for chronic toxicity dictates 20 rats per sex per group and is ran for one year.](http://www.oecd-ilibrary.org/environment/test-no-452-chronic-toxicity-studies_9789264071209-en)
  
[The common protocol for carcinogenicity is 50+ rats per sex per group for 18-24 months.](http://www.oecd-ilibrary.org/environment/test-no-451-carcinogenicity-studies_9789264071186-en)
 

[Here is a study that modeled the effect on decreasing sample size of a carcinogenicity study](http://www.ams.sunysb.edu/~hahn/psfile/papyang.pdf)
  
[Relevant section showing the decrease in power from 50 rats per group down to 30.](http://i.imgur.com/MEhC8C8.png) This is in contrast to the 10 rats per group that Seralini decided to use for his study.


Seralini ran a bastardization between a sub chronic toxicity study and a carcinogenicity study, with using only 10 rats per sex per group and running it for 2 years.  
  
Also Seralini did not run any statistical analysis on mortality or tumor prevalence. His data, due to sample size and short duration was inadequate to determine if any of his observed effects were statitically significant. 
  
[Here is a response to letters to the editors by Editor-in-Chief Wallace Hayes](http://www.elsevier.com/about/press-releases/research-and-journals/food-and-chemical-toxicology-editor-in-chief,-a.-wallace-hayes,-publishes-response-to-letters-to-the-editors)
  

The retraction was in line with COPE guidelines.  
  
  
&gt;[The COPE guidelines were consulted when making this decision. According to the COPE guidelines, “Journal editors should consider retracting a publication if… they have clear evidence that the findings are unreliable, either as a result of misconduct (e.g. data fabrication) or honest error (e.g. miscalculation or experimental error).”(COPE, 2009). The retraction statement could have been clearer, and should have referred to the relevant COPE guidelines. The data are inconclusive, therefore the claim (ie, conclusion) that Roundup Ready maize NK603 and/or the Roundup herbicide have a link to cancer is unreliable. Dr. Séralini deserves the benefit of the doubt that this unreliable conclusion was reached in honest error.)](http://www.elsevier.com/about/press-releases/research-and-journals/food-and-chemical-toxicology-editor-in-chief,-a.-wallace-hayes,-publishes-response-to-letters-to-the-editors#sthash.2el1IrEj.dpuf)
  
Here are some responses to the original 2012 Seralini study, finding short comings in both design and statistical methods used.  
  
http://www.sciencedirect.com/science/article/pii/S0278691512007843  
  
http://www.sciencedirect.com/science/article/pii/S0278691512007909  
  
http://www.sciencedirect.com/science/article/pii/S0278691512007946  
  
http://www.sciencedirect.com/science/article/pii/S0278691512007892
  
[Here is the original EFSA report that highlighted short comings and error in the 2012 Seralini study.](http://www.efsa.europa.eu/en/efsajournal/pub/2986.htm)   
  
  
&gt;EFSA finds that the study as reported by Séralini et al. is of insufficient scientific quality for safety assessments. EFSA concludes that the currently available evidence does not impact on the ongoing re-evaluation of glyphosate and does not call for the reopening of the safety evaluations of maize NK603 and its related stacks.
 
  
[Here is Health Canada's response.](http://www.hc-sc.gc.ca/fn-an/gmf-agm/seralini-eng.php)  
  
  
&gt;Based on Health Canada and CFIA’s review of this information [the Seralini study], the authors’ conclusions concerning the long term safety of NK603 corn and glyphosate are not supported
  
[Food Standards Australia/New Zealand](http://www.foodstandards.gov.au/consumer/gmfood/seralini/pages/default.aspx)  
  

  
&gt;On the basis of the many scientific deficiencies identified in the study, FSANZ does not accept the conclusions made by the authors [Seralini et al] and has therefore found no justification to reconsider the safety of NK603 corn  


[Brazil National Biosafety Technical Commission](http://www.cibiogem.gob.mx/Sala-prensa/Documents/CTNBIO-Brasil-Seralini1725.pdf)  
  
  
  
[VIB response.](http://www.vib.be/en/news/Pages/VIB-concludes-that-Seralini-study-is-not-substantiated-.aspx)  
  
[Here is BfR's response and review of the study.](http://www.bfr.bund.de/en/press_information/2012/29/a_study_of_the_university_of_caen_neither_constitutes_a_reason_for_a_re_evaluation_of_genetically_modified_nk603_maize_nor_does_it_affect_the_renewal_of_the_glyphosate_approval-131739.html)
  
[Belgian Biosafety Advisory Council report](http://www.bio-council.be/docs/BAC_2012_0898_CONSOLIDE.pdf)  
  
  
Here is a great quote on their opinion on Seralini 2012  
  
&gt;It should never have been accepted for publication in a scientific journal. The process of peer review which is usual before acceptance for publication in scientific journals has clearly failed here.

[High Council of Biotechnolgies conclusion.](http://www.efsa.europa.eu/en/efsajournal/doc/2986ax1.pdf)
  

  &gt;Consequently, the HCB Scientific Committee considers that the paper offers no information supporting the existence of a health risk associated with consumption of maize NK603, whether or not treated with a Roundup® herbicide formulation. 

[ANSES Opinion](http://www.efsa.europa.eu/en/efsajournal/doc/2986ax1.pdf)

&gt;**Conclusion on study Results**
  
&gt;[The significant results obtained before correction are not biologically coherent overall. However, biological data on the results would be needed to draw a definitive conclusion. At this point in time, in light of the information provided in the publication, the ECEAG‟s experts consider that the authors‟ interpretations are not sufficiently corroborated by the study data. 
Moreover, during the hearing, the study‟s authors admitted that this study was not conclusive by itself and that, though subject to improvement, it had the merit of opening up an interesting line of research. 
From ANSES opinion from their evaluation of the Seralini study on pathologies.](http://i.imgur.com/W0OJGIg.png)
  
[Here is the relevant chart.](http://i.imgur.com/BxD7sAb.png)  


[Monsanto's response to the study](http://www.monsanto.com/products/Documents/ProductSafety/seralini-sept-2012-monsanto-comments.pdf)  
  
  

[Here is a Nature article on the controversy.](http://www.nature.com/news/hyped-gm-maize-study-faces-growing-scrutiny-1.11566)
  
Also this was not the first long term GMO feeding study.  
  
[Sakamoto's 104 week feeding study was, it looked at GMO soybeans and failed to find harm interms of carcinogenicity in Wisker rats.](http://www.ncbi.nlm.nih.gov/pubmed/18787312)
  
[Also here is some info on who funded CRIIGEN to do this study.](http://gmopundit.blogspot.com/2012/09/auchan-and-carrefour-financed-criigen.html)



 
The study was recently republished in a relatively new journal with minor changes to wording and can be found [here.](http://www.enveurope.com/content/26/1/14)
  
[Here is the response by several scientist of the republishing of this study.](http://www.geneticliteracyproject.org/2014/06/24/scientists-react-to-republished-seralini-maize-rat-study/)

[Here is a Nature article on the republication of the Seralini et al study.](http://www.nature.com/news/paper-claiming-gm-link-with-tumours-re-published-1.15463)
  
I also like this quote I found by Tom Sanders who is a professor of nutrition and dietetics at King's College London.
  

&gt;Republishing data that was faulty in the first place in study design and analysis does not provide redemption. Furthermore, it is now possible to publish almost anything in open access journals 
  
[Also the republication was not peer reviewed.](http://retractionwatch.com/2014/06/26/republished-seralini-gmo-rat-study-was-not-peer-reviewed-says-editor/)
  
Here is a quote of Seralini admitting that the goal of the study was to ban GMOs.
  
&gt;[""What we want to achieve with this study is a moratorium""](https://www.youtube.com/watch?v=Njd0RugGjAg&amp;amp;t=10m45s)
  
**TLDR:** Seralini's 2012 study is full of elementary mistakes and follows an inadequate protocol that fails to support the conclusions it makes.",,0,False,,news,cquhp1u,,0,1,t5_2qh3l,t3_34eqh5,t1_cquhp1u,False,,1430440752
0,t1_cqu3pg3,False,Yerblok,1,1432703765,"Your argument about no one recruiting NA players is pretty pointless. CN and KR don't need NA players. They don't need EU players either. NA simply saves the EU players that have promise if a horrible fate of playing in EU games where everything is just a bloodbath with very limited strategy. And EU and NA being on the same level? Good joke man, maybe last season. One deluded EU fan boys even think EU could stand up to any other region. ",,0,False,,leagueoflegends,cquhpg9,,0,1,t5_2rfxx,t3_34dxrw,t1_cquhpg9,False,swain,1430440768
0,t1_cquer83,False,algag,2,1432703773,"Out of actual curiosity, how could the US have ""[dragged] half of Europe"" to war?",,0,False,,AskReddit,cquhq21,,0,2,t5_2qh1i,t3_34gg6q,t1_cquhq21,False,,1430440788
0,t1_cquc0k5,False,hippiebanana,9,1432703817,"That person's just fucking dumb. Europeans are well aware of how big the US is. Don't judge us by that guy.

The other issue that comes into play here is that you don't just drive the same distances in Europe - not many people would drive from, say, France to Russia because of border crossings/visas, petrol costs when planes can be so cheap, and just generally navigating. European roads are complicated. American roads are mostly long, straight or in a grid system.",,0,False,,AskReddit,cquhtfh,,0,9,t5_2qh1i,t3_34f9rh,t1_cquhtfh,False,,1430440920
0,t1_cqu80il,False,YstrdyWsMyBDayISwear,8,1432703988,European Detected,,0,False,,AskReddit,cqui6fw,,0,8,t5_2qh1i,t3_34f9rh,t1_cqui6fw,False,,1430441476
0,t3_34gp8x,False,PineMaple,52,1432704085,"I think it's important to provide a few more details beyond just the title. ESEA was planning on dropping TF2 altogether, reasoning that there was little point providing a league if there wouldn't be a LAN. However, Valve's confirmation of competitive matchmaking changed their mind, as developer support for the comp scene is obviously a plus. lpkane said that depending on the future of comp TF2, they would like to bring a LAN back, it's just not feasible at the moment.

Obviously this will have some impact on Invite, I wouldn't be surprised if Mix^ folded and I also heard some rumours that Froyo would fold without a LAN. However, the interesting part of not having a LAN is it guarantees that the top 4 teams will make a profit, as they won't have to pay for travel and the like. So while I'm sure we'll lose some top talent, it's not full-on collapse. Plus EU has been able to run a league without LAN finals for years. It's not ideal, but it won't be the death of NA comp TF2 and I don't think it'll be the death of ESEA.",,0,False,Medic- Extra Chromosome E-Sports,truetf2,cquidur,,0,52,t5_2stfn,t3_34gp8x,t1_cquidur,False,flair-medic,1430441799
0,t3_34gt9d,False,Jamezuh,1,1432704111,"Alright, since you seem to want to repost every 5 minutes, I'll repost my same response:  

""How would it be Riot's fault that EU's top team can't compete on a world-stage level?""",,0,False,,leagueoflegends,cquifv3,,0,1,t5_2rfxx,t3_34gt9d,t1_cquifv3,False,,1430441889
