downs,score,author,subreddit_id,body,name,link_id,controversiality,author_flair_css_class,author_flair_text,distinguished,ups,score_hidden,removal_reason,retrieved_on,subreddit,archived,edited,gilded,created_utc,parent_id,id
0,2,tripsick,t5_2qh4r,"this guy could be making a lot of money shorting stocks.

&gt;Hours after telling Europe he could accept most of the conditions of a bailout he previously rejected, Prime Minister Alexis Tsipras urged Greeks to vote against it.",t1_csort6t,t3_3br6es,0,,,,2,False,,1437493104,conspiracy,False,False,0,1435765271,t3_3br6es,csort6t
0,4,London_resident,t5_2u7i2,"I didn't know there were Jews in Éire...European Jews are worse than the Americans or Israelis.

Anyone know where I can purchase a Swastika shirt? Like the one Sid Vicious wore. Something nice to wear while strollikg Finchley or Stamford Hill",t1_csorvsc,t3_3bqqe3,0,UKGB,bloody racist,,4,False,,1437493161,european,False,False,0,1435765380,t3_3bqqe3,csorvsc
0,4,Futureproofed,t5_2qh1i,"Listen to people from different backgrounds. 

My father works with many immigrants, mostly from Eastern Europe, including a man who literally walked out of Ceaușescu-era Romania.  Twice. People like that have incredible stories and experiences, and can teach you a lot.",t1_csorzrj,t3_3brc5m,0,,,,4,False,,1440506914,AskReddit,False,False,0,1435765553,t3_3brc5m,csorzrj
0,1,Springrollio,t5_2u9wz,"since EU doesnt exist anymore, thank god, No. There are plenty of characters, both main and minor, to fit in the game without resorting to fan fic characters. ",t1_csos0dt,t3_3bjd4p,0,pc2,TK-421AtHisPost,,1,False,,1437493274,StarWarsBattlefront,False,False,0,1435765581,t3_3bjd4p,csos0dt
0,0,daimposter,t5_2cneq,"&gt; Then why did you make the comparison? 

If you had half a brain you would understand my argument. This is rebuttal to idiots saying that gun ownership doesn't affect suicide rates. It clearly does. Yet somehow you missed the point of the argument?? 

&gt;A society with some of the highest violent crime rates in the world,

Those countries are some of the safest in the world. They have significantly lower homicide rates than the rest of the world. **WHAT CRACK ARE YOU SMOKING?** 

&gt;a society without a bill of rights

What's the point of this?? They all have constitution with their right laid out. This is just an ignorant point. 


&gt;nd a society so drastically different than the rest of the world people have studied to figure out why their crime rates are so low

Oh, so now they have low crime rates. Or perhaps you are dumb enough to think that *reported violent crime rates* is the same as *actual violent crime rates*.  European countries and other western countries have a culture and laws that ENCOURAGE victims to come forward. Not only that, but these other wealthy countries typically have a much broader definition of what is included as a violent crime....since these countries are more interested in stopping crimes.  That's why most experts typically focus on homicide rate since it's hard to not report a homicide and it's hard to categorize it as a different kind of crime. People in poor countries usually don't report crimes because they either don't trust their police or have weak policing or don't trust the prosecutors. 
",t1_csos0m6,t3_3bmspw,0,,,,0,False,,1437493280,politics,False,False,0,1435765590,t1_csoqdyq,csos0m6
0,1,HW90,t5_2t7no,"It's a European car made for a European market, 186 miles is more than enough there for most purposes and if this thing is reasonably priced it will sell like hotcakes.",t1_csos1pa,t3_3bqnl6,0,,,,1,False,,1437493299,Futurology,False,False,0,1435765634,t1_csonba0,csos1pa
0,117,oneeighthirish,t5_2qh13,"Sorry, but I don't think anyone wants to do that, least of all the EU.",t1_csos36u,t3_3bqvhq,0,,,,117,False,,1437493340,worldnews,False,False,0,1435765693,t1_csoqq8f,csos36u
0,1,Thue,t5_2qh13,"&gt; Anyway the root cause of the problem is the Greek lust to borrow shitloads of money, not the banks' will to lend them.

The Greeks are part of the problem, certainly. But the feckless and/or corrupt (bailing out German banks at ECB's expense) EU structure/institutions is certainly also part of the problem. Krugman has a good blog post about how absurdly poorly the EU system has functioned: http://krugman.blogs.nytimes.com/2015/06/29/the-awesome-gratuitousness-of-the-greek-crisis

Try following the money. German banks made out like bandits, while the Greeks government is far poorer now than in 2008, despite a 22% cut in government expenditures. The money have flowed mostly from ECB and into the banks, who held Greek bonds which at times should have had the same value as toilet paper.",t1_csosbh5,t3_3bpw6x,0,,,,1,False,,1440506898,worldnews,False,1435766385,0,1435766034,t1_csonz0c,csosbh5
0,1,incoherentOtter,t5_311cm,"Did you communicate your intent to anyone before sunday evening?


Complx and The One Armed Bandit doing the commentary for EU races has become tradition. Well, they´ve done it a couple of times. Surely they wouldn´t have minded a third commentator. Or you could have done an alternate stream. With cussing. And blackjack. And hookers. ",t1_csosd2m,t3_3bf63p,0,NissanEU,vaffel,,1,False,,1437493532,acrl,False,1435771088,0,1435766103,t1_csopg66,csosd2m
0,-1,randomb0y,t5_2r1tc,"Haven't you been paying attention to the news lately?

http://www.bbc.com/news/world-europe-33325842",t1_csosf0r,t3_3bmeb4,0,,,,-1,False,,1437493561,itookapicture,False,False,0,1435766192,t1_csonf1h,csosf0r
0,1,Gasparatan,t5_2qh13,"Because greec will be rwequired to pay back some of his debt it can do that via austerity measures, or by hyper inflating (devaluing) their currency, all of the debt will get converted into drachme if the ""grexit"" happens as well as all savings which are located within greek. This happens because Greek doesnt have the authority to print euros to inflate their curency the only way to do it is to print drachme. Which leady to devaluing it. Example first day drachme =euro second day 2 drachme =1 euro third day 4 drachme =1 euro and so on. since state savings are already depleeted they have only one way to pay their debt via printing drachme and well this is horrific because the drachme will have less than a DDD rating which means that Greek will have to pay hefty fees on borrowed money etc. all of this will lead to pluming Living standards within the first 10-15 years after which it will get better eventually. 

While following the EU and ECB would have avoided the devaluation of all those retirement savings etc and at least save some of it.",t1_csosha3,t3_3bf15n,0,,,,1,False,,1437493580,worldnews,False,False,0,1435766291,t1_csohjjp,csosha3
0,1,pushing1,t5_2qh1i,"I remember it well 

I was at a *rock* festival about five years ago. I made my way to the main stage. I moved passed the outliers, through the mosh pits right to the front. I was two rows from the stage. It was amazing.
 
Anyway I tripped, fell down right in the dirt. It was summer, and the dirt had participated into to a fine powder. As more people. Every time i cried out for help all i got was a mouth full of suffocating dust. More and more people fell untill i started to think i might actually die. Anyway a hand finally found me and it was my **best mate** from primary school ( elementary school). HE helped me up, im not sure if he recognised me but i left, on account i thought i had just almost died. 

As i made my way through the crowd i saw my **first girlfriend** from secondary school ( high school?) holding a paper mache head, weird right? I didn't stop to say hello.  

Finally i made my way back out of the crowd and just collapsed on the ground. Where i found a man. He said he needed my help said he was seeing aliens ( he was taking a cocktail of drugs) anyway i hung out with him and he turned out to be the **lead singer** of the biggest Doors tribute band ( in the world?) in europe. HE saved me life, i think....

**I never saw any of those people again.**",t1_csosilu,t3_3bqmvj,0,,,,1,False,,1437493588,AskReddit,False,False,0,1435766349,t3_3bqmvj,csosilu
0,3,sparky662,t5_331rj,"A lot of them seem to be American themed so I guess the European theme misses out. I was hoping for some more low density euro buildings. Still, more content is never a bad thing.",t1_csosinu,t3_3brdsr,0,,,,3,False,,1437493589,CitiesSkylines,False,False,0,1435766352,t3_3brdsr,csosinu
0,1,DancingDirty7,t5_2qjbr,"the numbers are that its just:

euros donated per person | people that donated
---------:|:----------
3 | 533 mil
5 | 320m mil
6.5 | 250 mil
10 | 160 mil
16 | 100mil
20 | 80 mil
european population is 742.5 million (2013), the political left of the europe might be 250mil? so its 6.5 euros each who wants to support a fighting right wing party in Greece. If all europe wants to chime in its less than 3 euros! :D

edit: the debt in greece is not greek people fault, its the old governments doing bad things to make money for themself",t1_csosmbp,t3_3bn0vp,0,,,,1,False,,1437493622,misc,False,False,0,1435766506,t3_3bn0vp,csosmbp
0,4,Quetzalcoatls,t5_2sfmf,"I don't want to fight Russia directly. We are back to playing Cold War games.

I would like the heavy equipment we just sent to Poland to have troops permanently accompany it, not just have it be in storage. We should be prepared to fight Russian conventional units and reinforce our NATO allies in short order should that ever be needed. I also support sending weapons, intelligence, and advisors to the Ukrainians in order to ensure any further Russian push is an absolute bloodbath. It is important to make clear to Russia that further military aggression anywhere in Europe will result in hundreds if not thousands of Russian deaths. 
",t1_csosn0w,t3_3br8et,1,,,,4,False,,1437493646,PoliticalDiscussion,False,False,0,1435766534,t1_csosemm,csosn0w
0,1,gh0st31,t5_30h51,"Hi mate, did an order with blow, 3 weeks ago to central Europe. 
Very impressive stealth and amazing weed although now the ""cannatonic"" strain is not available...",t1_csosowo,t3_3bqxvn,0,,,,1,False,,1437493688,AgMarketplace,False,False,0,1435766615,t3_3bqxvn,csosowo
0,1,confuseDbirT,t5_2qh4j,"&gt;They didn't take advantage of the poor poor Greeks. They took &gt;advantage of almost all of Europe. It's just the Greeks were the &gt;ones most affected, because, well, we're the most retarded. &gt;Culturally, socially, economically, and on most days mentally too.

How can you say that they took advantage? Germany did reforms when they were considered the weak old man in Europa and now it is enjoying its benefits or let us say that the companies are enjoying the benefits of the reforms. 

In my opinion you cannot call this taking advantage. Everybody in the Euro zone KNEW what they were getting into. Everybody knew that once you are in you cannot devalued your currency to increase your competitiveness. These are all economic realities which a first semester undergrad student understands, therefore you cannot lay the blame on others. And it is not only Germany which is more competitive than South Europe. There are also several other countries that are, basically all of the Northern once.   
Are they all taking advantage?

And do you believe that if a company is not competitive enough and pushed out of business that the other, more competitive companies are to blame? 
That is just how our system works and everybody knows that. If you are not willing to deal with this do not open a company or to put it into perspective: do not join the Euro zone. 

Btw. Greece also had some really good years in regard to their economy after joining the zone and if they would have invested the loans they took better they might be more competitive right now, but instead the money was wasted on government employees and consumption. Just one bad business decision after another, all of them could have been stopped by Greece, but none were.
Greece - and other countries - did not do their homework. It all comes down do that in the end. In one market jobs will go to the most competitive country and if you cannot keep up you get left behind. It is not some kind of evil plan by the Northern countries it is just how our capitalist, globalized economy works. 
The thing is: everybody knew. It is nothing new. 

&gt;With regards to the low interest rates, you are right, they are &gt;too low. But think of this. Either you have a single &gt;currency/market &gt;and therefore should strive for the &gt;federalization of the european &gt;government and economy, or &gt;you have a loose trade treaty. This &gt;middle ground only favours &gt;countries that have their houses in &gt;order. Another reason the &gt;interest rates are low is because they &gt;can perpetuate this &gt;situation, lower the risk and the lenders &gt;actually earn money on &gt;their loans.

I am not talking about the situation right now. You totally misunderstood me. The interest rate right now is low because the ECB wants to stimulate the economy which is a good move in my opinion. 

&gt; It appears that fudging numbers is a pan-european sport and &gt;it's hypocritical of european powers to play that card.

Please give me a reliable source that states that Germany or France faked their numbers in order to get into the Euro zone, because I do not believe that for a second.

&gt;In Greece it was the opposite, the state caused the banks to &gt;collapse. You don't get to rebuild a national economy by &gt;destroying wages, making firing laws liberal, making cuts here, &gt;there, everywhere. That's catastrophic in both theory and &gt;practice. You either let the economy default or demand specific &gt;institutional change in the way the economy works. By choosing &gt;the easy way of lending money in exchange for reform, the plan &gt;was doomed from the start. Greeks managed to mess up their &gt;economy royally. What makes anyone on earth think they can &gt;set it right by themselves?

I have to disagree with your statement that you do not get to rebuild a national economy by lowering wages and liberalization of the labor market. Greeces problem is that its wages are to high for its productivity. Therefore wages need to be lowered or the productivity needs to increase, which is much more difficult. 

A more liberalized labor market also can help to make the businesses more competitive. All of that is necessary since Greece can not just devalued its currency and be done with it, unfortunately  there is NO other way to fix the problem.
You want jobs? Then become more competitive and provide a political stable framework. Do your god damn homework!

I do not think that it should have been done that fast or that Greece should have sold all its national treasures (harbors f.e.), but it needs to be done if Greece is to remain in the Euro zone. On the other hand I am not sure if it could have been done slower, because that would have required more money and maybe Greece would just have played on time again, again and again. Like the government right now is doing. ",t1_csosp6t,t3_3bhnp6,0,,,,1,False,,1437493700,europe,False,False,0,1435766628,t1_csmq8wt,csosp6t
0,10,bellend1234,t5_2qhqt,Rodgers can fuck off. High and mighty prick thinks his team is actually on the level where he can use European competition as a pisstake.,t1_csosqcr,t3_3brdw1,0,,Ramsey &gt; Cazorla,,10,False,,1440506884,Gunners,False,False,0,1435766677,t1_csor9th,csosqcr
0,2,hackguy,t5_2sokd,"OK, but Greece uses Euros. It can't just inflate the prices of goods the same way Germany used to after WW1. And even if they decide to leave the EU, nobody would want their new money and if nobody wants your money then it's worthless. What can even Greece do at this point? Sell land or something?",t1_csosxnf,t3_3bq7sp,0,,,,2,False,,1437493866,explainlikeimfive,False,False,0,1435766981,t1_csonuws,csosxnf
0,2,brooktini86,t5_2yg8b,"I would say no. Been waiting for an update for Duke Nukem 3D (EU) to make it compatible for months (not guna happen), even though the NA version received the patch!!",t1_csosy87,t3_3bqvz1,0,,,,2,False,,1437493887,VitaTV,False,False,0,1435767006,t3_3bqvz1,csosy87
0,1,Bowgentle,t5_2qh4j,"Thanks - that backs up my views. There was a case, and it was unsuccessful. The court does not appear to have said ""oh, yeah, it was illegal, but it's too late to change it"", and it had nothing to do with the government ignoring any referendum result.

What happened instead is that the appellants argued that the powers delegated to the EU were too broad and vague, and that therefore the ratification was illegal for that reason (the case is usually cited as Carlsen v Rasmussen). The court rejected their argument.

So...having started by arguing about whether the Danish government had ignored a binding referendum No to Maastricht, we find that the Danish government did not ignore the referendum that produced a No, but sought opt-outs, after which it held another referendum that produced a Yes, only after which it ratified Maastricht. Both referendums were binding, and treated as such.

Nor were the referendums challenged, nor was the ratification found to be in any sense legally dubious. Folk-memory of a disappointment, like I said.

No humble pie yet today for me, anyway. ",t1_csosztp,t3_3bq7lp,0,IREL,Ireland/EU,,1,False,,1437493919,europe,False,1435767503,0,1435767074,t1_csos7sk,csosztp
0,5,Naurgul,t5_2qh4j,"&gt; What the author forgot to mention because he is an idiot is that the EU funds developing countries through infrastructure, agriculture, business funding and other programs.
&gt; 
&gt; 
&gt; 
&gt; There is a direct flow of a great deal of money from Germany, UK, France etc into places like Romania, Greece, Poland, Bulgaria etc.

This claim is as frequently repeated as it is inaccurate. 

The current amount of federal-level spending for the EU is approximately 1% of its GDP. In the best case, this would have to more than double to play a non-negligible role in shock absorption and stabilisation.

Don't believe me? [Here what everyone's favourite central banker, Mario Draghi, had to say on the issue:](http://www.project-syndicate.org/commentary/ecb-eurozone-economic-union-by-mario-draghi-2015-1-2015-01)

&gt; In other political unions, cohesion is maintained through a strong common identity, but often also through permanent fiscal transfers between richer and poorer regions that even out incomes ex post. In the euro area, such one-way transfers between countries are not foreseen (transfers do exist as part of the EU’s cohesion policy, but are limited in size and are primarily designed to support the “catching-up” process in lower income countries or regions). This means that we need a different approach to ensure that each country is permanently better off inside the euro area.

Not convincing enough? No problem, here's what the [MacDougall report](http://ec.europa.eu/archives/emu_history/documentation/chapter8/19770401en73macdougallrepvol1.pdf), which was tasked with figuring out what the prerequisites for a workable monetary union should be, said back in 1977 on the issue:

&gt; The need for redistribution between member states arises partly because the process of economic integration, which may confer net gains in the aggregate, does not necessarily raise the economic welfare in all areas. The changing pattern of production and exchange that characterizes an integrating Community typically brings gains to some but loses to others. To make integration acceptable to all participants may thus require an explicit redistributive mechanism to divide the gains from integration in a politically acceptable way.

&gt; Failure to attend to this matter may at the least result in stagnation of the integration process, and at the worst result in secession and dissolution.

Here's another part talking about how much a bigger federal budget would be needed:

&gt; As regards the general level of economic activity, the instruments remain very. largely in national hands, but since public expenditure at the Community level might rise from the present level of 0.7 % to 2-2.5% of gross product, it might be possible for Community finance to play some part in stabilisation and growth policy.

But wait, there's more:

&gt; Ambitious plans for monetary integration have failed and have relapsed into selective club arrangements (the osnake'). Despite some divergence, rather than con- vergence, of economic performance between the most and least prosperous member states, integration is nonetheless proceeding, in an uneven and often modest way, in quite a number of public sectoral activities through financing, regulation and coordination (eog. in development aid, regional policy, environmental policy, industrial and commercial norms and con- ditions of competition). 

What is [this snake](https://en.wikipedia.org/wiki/Snake_in_the_tunnel) you ask? Just the failed precursor to the ERM. What is the ERM? The [failed precursor](https://en.wikipedia.org/wiki/Black_Wednesday) to the euro (also that failure is the reason why the UK is so adamantly opposed to the euro). 

Face it: without addressing the issue of shock absorbers / surplus recycling, any fixed exchange rate system, no matter how tight, is doomed to failure. 

This isn't some sort of secret forgotten knowledge either. Last year the European Commissioner for Employment, Social Affairs and Inclusion László Andor [made a long lecture on the issue, outlining the problem and possible solutions](http://europa.eu/rapid/press-release_SPEECH-14-455_en.htm). Even the recent [5 presidents' report](https://euobserver.com/economic/129218) hints in this direction, [albeit too cautiously to make a difference.](http://www.cer.org.uk/insights/eurozones-five-presidents-report-assesment)

In conclusion: Don't call people stupid if you don't know what you're talking about.",t1_csot151,t3_3bqzoi,0,,,,5,False,,1437493937,europe,False,1435767812,0,1435767125,t1_csonvcj,csot151
0,2,wosel,t5_2qhu8,"You're mostly going to see CSA/TVS ATR42s and A319s, and a selection of the usual Europeans - DLH, BAW, AFR, EZY, RYR, KLM, LOT, NAX, AFL...

We do get a limited amount of widebodies though - 

* CSA rents a single A330 from KAL, which flies from/to PRG 6 days a week IIRC. 
* KAL themselves fly a a332/b772/b744 ~4 times a week (winter/spring&amp;fall/summer). 
* DAL flies a b763 to/from JFK daily during the summer. 
* Air Transat flies a single charter a332 weekly to/from Toronto/Montreal - only in the summer
* UAE flies a b773 to/from DXB daily all year round, except for today when they flew the a388. 
* We also get a chinese cargo b744 roughly twice weekly. 
* And also some Iran Air a300s refueling on the way from western Europe back home, because apparently we don't have the same sanctions western Europe has on selling fuel to Iran Air... go figure",t1_csot1cw,t3_3bqfir,0,,,,2,False,,1437493947,aviation,False,False,0,1435767135,t1_csorojj,csot1cw
0,1,Maagas,t5_2rfxx,"You should have just saved up money for the EU LCS playoffs. Not taking anything from your determination and contribution to esports but while Fnatic looks like a shoo-in for first, H2k vs Origen matchup would be crazy and if Elements or Giants could sneak third place.

edit: Playoffs/Finals and spelling errors",t1_csot687,t3_3bqng6,0,00 team,[Maagas] (NA),,1,False,,1437494063,leagueoflegends,False,False,0,1435767333,t3_3bqng6,csot687
0,2,floppypick,t5_2t160,"Doesn't america spend more money healthcare while covering significantly less people relative to Canada and basically all of Europe? 

You're effectively ignoring the rest of the world which has shown socialized medicine IS BETTER. ",t1_csot8g1,t3_3bl44d,0,,,,2,False,,1437494126,Ask_Politics,False,False,0,1435767425,t1_cso814z,csot8g1
0,1,lonareas,t5_2qio8,"I'm on board with ff14 aswell, i'm just waiting until they put in EU datacenters, because my internet is quite bad.

As soon as those datacenters are in place i'll go back to that.",t1_csot8hg,t3_3brhca,0,,,,1,False,,1437494126,wow,False,False,0,1435767427,t1_csosu10,csot8hg
0,1,Boring_Tom,t5_2qh1i,"Super late to the game here, but last March I took a solo trip to Vancouver, BC. I stayed at a hostel downtown, and had a great time. I met a bunch of people from all over the world. 

Fast forward to September of last year, I'm in a hostel in Copenhagen, which was my second stop of a solo Europe trip. Well, I see a familiar face in the common area of the hostel and I think ""eh, it's just some déjà vu or some shit. There's no way anyone I know is in this hostel in Copenhagen."" Well, sure enough, I go up to the guy and ask him if he was in Vancouver in March, and he says yes. He had recognized me as well, and had been wondering the same thing.

We had met briefly in the hostel in Vancouver, and had not exchanged any contact info or anything other than introductions. He was from Germany and I am from New Mexico. Six months after being in the same hostel in Vancouver, we coincidentally end up in the same hostel in Copenhagen at the same time and happen to be in the common area at the same time. ",t1_csota1u,t3_3bqmvj,0,,,,1,False,,1440506855,AskReddit,False,False,0,1435767491,t3_3bqmvj,csota1u
0,5,O_oh,t5_2qo4s,I'm hoping some guy stashed in Europe.,t1_csotc0s,t3_3briw1,0,Spurs3,Spurs,,5,False,,1437494216,nba,False,False,0,1435767568,t1_csosjpe,csotc0s
0,1,mcboogle,t5_2u6rc,"Agreed. It should also be noted that even if Venus was at it's farthest point from us (which would be a stupid time to launch) it wouldn't even be 15 light MINUTES away, let alone years.

Which says to me one, of three, things. 1. Either the final destination wasn't Venus. 2. Europe doesn't know much about science. or 3. We're looking for meaning in a song that was basically written just for those 9 notes in the chorus. Be de bew bew! Be de Bew Bew Bew!",t1_csoteow,t3_3b6k86,0,,,,1,False,,1437494272,FanTheories,False,1435767922,0,1435767679,t1_csjf6hr,csoteow
