author_flair_text,author,ups,created_utc,subreddit_id,author_flair_css_class,edited,subreddit,score,link_id,id,distinguished,retrieved_on,controversiality,parent_id,gilded,body
#TeamXbox,MuscledRMH,1,1438521077,t5_2xbci,xbox,False,xboxone,1,t3_3fg1tn,ctotnx6,,1440235065,0,t3_3fg1tn,0,"I hope Microsoft has planned a big marketing campaign for this game across both the US and Europe! Europe really needs to get some Xbox exclusive game marketing because it's literally not present here. I hope the Gamescom Conference next week will show some new and very good gameplay of the game to build more hype around it. Not overhype, but just hype."
,NonsensicalOrange,26,1438521237,t5_2qh33,,1438521425,funny,26,t3_3fhee1,ctotppv,,1440235089,0,t1_ctos1rt,0,"&gt; I for one don't know where I stand here.

Racism is defined as prejudice due to race. All people identify with others based on what they have in common (i.e. race), everybody acts prejudice in one form or another, any person has the capacity to be racist. To claim that one race is too good to be racist, is to be racist.

The other factor people fail to consider is how absolutely narrow-minded these perspectives are. American history isn't world history, white people are a minority in most countries. When you talk about the wealth &amp; power that ""white people"" have, you generally talk about national prospects, white &amp; black people in the US get paid a lot more than white &amp; black people in Zimbabwe. 

European powers were more powerful than most other cultures, they did use this to their advantage. But look back at the wider picture, when black people were being sold into slavery by their brethren - white people were also being taken as slaves by debtors &amp; arabs, when white people fought other people - those people fought them too &amp; Europeans fought themselves more than anyone else... White people is a category that includes so many different people - there are white homosexuals, jews, disabled, many white people have faced abuses (some personal, some much bigger), many live in poverty, it is silly to stamp privilege on hundreds of millions of people. 
"
European Union,HighDagger,18,1438521377,t5_2qh4j,EURO,1438521846,europe,18,t3_3fhzml,ctotrbg,,1440235110,0,t1_ctotpdl,0,"All of it is...

you start out by marginalizing and mocking every effort people have put forward to discuss, by saying

&gt; This 'conversation' and 'discussion'

then shut down frustration with the situation we're in by saying  

&gt;  about immigration that has been 'silenced' 

then paint everyone with one brush and attack users

&gt;  **you guys** are complaining about was 

then mock a straw-man representation of the discussion, and marginalize and dismiss people further, in a way that you could hardly fit more snark into it

&gt; mostly just angry people throwing statistics around and calling the impendent doom of Europe because of ""Muh Mudslimes"".

and as if that's not enough, you tell ""you guys"", ""most [people]"" to just eat it up and leave

&gt; There's /pol/, there's /r/european, there's /r/worldnews. Just go there. This sub is about more than fear and hate.

&amp;nbsp;

Literally none of that is nuanced, constructive, civil, on point. Sure, there are some people who are rightfully included in that exceedingly broad description. But *even if* you had managed to frame it in a way that expressly and only targets these people instead of throwing everyone and everything under the bus, it would still be dismissive, derisive, and full of snide, and thus still not have a place in any civil discussion."
,rudolf_hesst,32,1438521660,t5_2qofe,,False,sweden,32,t3_3fi26f,ctotuki,,1440235152,0,t1_ctosgv7,0,"Fast hon är ju invandrare,kvinna,vänster och tycker EU är elaka mot Grekland, då kommer man väl undan med allt? Förvisso hade hon kunnat vara någon form av galaxykin med för maximal positiv behandling men det går inte att få allt"
,Pembar,1,1438521709,t5_2qhe6,,False,belgium,1,t3_3fbtoc,ctotv7v,,1440235160,0,t1_ctotlmd,0,"&gt; and indeed the military is an exceptional case), but note that in a basic income system, anything you earn gets fully added to what you already get. Compared to currently making a choice between living off the state without a job, or

I just don't agree with the motivation argument. I've been through both American and European universities. By far, my experience with American students who are in tons of debt of student loans are far more hardworking and motivated than European students who get their education free. 

&gt; Compared to currently making a choice between living off the state without a job, or having a job and not making much more money because you lose benefits from the state.

Yeah, I always found this a very strange decision to make. From where I come from, in a non-welfare state. The  question basically is, ""find a job and live"" or ""don't find a job, run out of money and die"". That's usually a much more straightforward answer."
,Scorpion1122,1,1438521742,t5_2rrlp,,False,PS4,1,t3_3fhfmj,ctotvmq,,1440235165,0,t1_cton2en,0,I found The Last of Us on amazon US for 15 dollar. But would the code work on an Europe account?
,lobwege,1,1438521768,t5_39dx3,,False,che_vs_ars_fa_cup,1,t3_3fi8t3,ctotvxn,,1440235170,0,t3_3fi8t3,0,"WATCH HERE FREE&gt;&gt;&gt; http://dmmp2p.eu/tv1.html

WATCH HERE FREE&gt;&gt;&gt; http://dmmp2p.eu/tv1.html


WATCH HERE FREE&gt;&gt;&gt; http://dmmp2p.eu/tv1.html

WATCH HERE FREE&gt;&gt;&gt; http://dmmp2p.eu/tv1.html


v

WATCH HERE FREE&gt;&gt;&gt; http://dmmp2p.eu/tv1.html

WATCH HERE FREE&gt;&gt;&gt; http://dmmp2p.eu/tv1.html"
,Daztek,1,1438521797,t5_2qio8,,False,wow,1,t3_3fi8ps,ctotw95,,1440235175,0,t3_3fi8ps,0,"US has maintenance/rolling restarts on tuesday, the EU have them on wednesday, it's normal."
,boreddude1000,2,1438521878,t5_2qgzt,,False,gadgets,2,t3_3fgwa8,ctotx76,,1440235187,1,t3_3fgwa8,0,"so this robot successfully hitchhiked across all of Europe, but once he got to the states he was vandalized within 2 weeks? That speaks volumes about the people in the US."
,notacrackheadofficer,-17,1438521886,t5_2qh13,,False,worldnews,-17,t3_3fhu07,ctotxa9,,1440235188,0,t1_ctot8o7,0,"''But the Royals bring in tourist money. The entire European system would financially crash without them. Everything would fall apart.  
Was that sarcastic enough? It's hard to be sarcastic about the English groveling to royalty, defending them with absurd pant wetting defensiveness.  
''They bring in money'' LOL Well come up with a better national business plan.  
Are they saying no one would want to come to their country if they didn't have a queen? Hilarious! Sounds like they describe their own country as a place no one would visit without a tourist trap.  
[Fu u u uck the Queen](https://www.youtube.com/watch?v=7_USpdFwaK8)  
From the criminally unknown film ''Taking Off'' by the director of ''One Flew Over the Cuckoo's Nest'', now BANNED. Never on video. Critically acclaimed.  
A Banned film. With LSD in it. And award winners and nominees.  
 BAFTA Awards 1972
Nominated
BAFTA Film Award 	Best Actress
Lynn Carlin
Best Direction
Milos Forman
Best Film
Best Film Editing
John Carter
Best Screenplay
Milos Forman
John Guare
Jean-Claude Carrière
Jon Klein
Best Supporting Actress
Georgia Engel  
.......  
 Bodil Awards 1972
**Won**
Bodil 	Best Non-European Film (Bedste ikke-europæiske film)
Milos Forman (director)

Cannes Film Festival 1971
Won
Grand Prize of the Jury 	Milos Forman
Tied with Johnny Got His Gun (1971).
Nominated
Palme d'Or 	Milos Forman    
A BANNED film you are not supposed to be looking at.  
There are others."
Legendary Eagle Master,her-1g,1,1438522192,t5_2sqho,rank legendary-eagle-master,False,GlobalOffensive,1,t3_3ffreo,ctou0vz,,1440235235,0,t3_3ffreo,0,"one of the best players in europe
"
[BAX] | Instant Action Podcast |  ̶R̶e̶a̶c̶h̶C̶a̶s̶t̶,TheDeringer,8,1438522228,t5_2s48x,nc,False,Planetside,8,t3_3fi3jm,ctou1cu,,1440235241,0,t3_3fi3jm,0,afaik ChuckNorris in the EU was the first PS4 BR100. He dinged last Tuesday I believe. 
29,aidanvu1992,1,1438522388,t5_3525u,,False,amiiboSwap,1,t3_3fi2x1,ctou3b8,,1440235266,0,t3_3fi2x1,0,EU Olimar for GM?
,helplesslurker,3,1438522421,t5_2rjli,,False,teenagers,3,t3_3fi6at,ctou3q2,,1440235271,0,t3_3fi6at,0,is busker a European term
,FWilly,1,1438522638,t5_2qnts,,False,nottheonion,1,t3_3fft6m,ctou6c9,,1440235306,0,t1_ctodqfu,0,"European law, similar to U.S. law forbids moving quantities greater than $10,000 in *undeclared* cash. They want to know the source and track large quantities of cash. The stated reason is to help prevent money laundering. They probably also want it to prevent tax dodgers.

Had he declared the money and shown it was proceeds from his concert, he would have had no issue."
Portland Timbers,leo_eris,1,1438522663,t5_2rbnb,portland-timbers,False,MLS,1,t3_3fh83c,ctou6nw,,1440235310,0,t1_ctott5z,0,"Yeah, I am not sure. You are in Europe or something?

You might try this page that gets updated daily: http://www.socceramerica.com/article/63805/soccer-on-tv.html"
,kappaprincess,22,1438522769,t5_2qh33,,False,funny,22,t3_3fhee1,ctou7yr,,1440235327,0,t3_3fhee1,0,"This logic is always funny to see being applied world wide by Americans. White people are being oppressed by other white people in Europe even today. But no, it's not racism because they're white, right? "
California,sorspaznik,2,1438522957,t5_2sih3,california,False,polandball,2,t3_3ffrqc,ctouaap,,1440235358,0,t1_ctok8dg,0,"Can confirm, rosbif is not sexy: http://www.businessinsider.com/fattest-countries-in-europe-obesity2011-9?op=1"
,n3v3rm1nd,1,1438523417,t5_2rfxx,vladimir,1438523601,leagueoflegends,1,t3_3ff1vz,ctoug3v,,1440235434,0,t1_ctodswl,0,"Either wait for season to end or warn them way in advance. Saying he could be punished, not saying what would be the punishment and whether it is 100% or not, leaves them sort of 'hanging' until the actual official message 3 days prior the event, and it takes a week to make Visas from Russia, not to mention lack of practice with the sub if they do get one from EU. It is supposed to be Forgiven who is punished, for what he did in soloqueue, not the viewers of LCS, fans of the team, LCS as a show, and his entire team while he gets to sit home for a week."
,JMEelnest,-7,1438523628,t5_2qi4s,,False,StarWars,-7,t3_3fhmnu,ctouis9,,1440235469,0,t1_ctoqy7r,0,Where are you getting this EU used to be canon thing from? It was never canon. Only the movies were. They were considered G canon which was the only true canon.
,svenhoek86,-2,1438523905,t5_2qh16,,False,technology,-2,t3_3fgypp,ctoumla,,1440235519,1,t1_ctoqusa,0,"Once it hit middle America it had a greater than 100% chance of being used as target practice for some drunk rednecks driving by in a pickup truck too. Anyone with common sense would have told you this wasn't an experiment you wanted to do here. Keep it in Europe, Canada, and Asia. 

Actually, you could probably do a West Coast trip. Start in San Diego and go to Seattle or something. "
,NoMoreFeeOught,-4,1438524284,t5_2qh13,,False,worldnews,-4,t3_3fhu07,ctourjl,,1440235584,0,t3_3fhu07,0,Quit your crying &amp; move to Europe like everyone else.
Zerosion Ferodatz on Sargatanas,Zerosion,0,1438524482,t5_2rgs7,scholar,False,ffxiv,0,t3_3fi52y,ctouu7y,,1440235619,0,t1_ctou8fv,0,"Queues work by combining Servers in their ""Data Center"" 

Lich is part of the Chaos Data Center which includes

Cerberus, Lich, Moogle, Ofin , Pheonix, Ragnarok, Shiva and Zodiark. 

Low population server can still have good queue times simply because of sharing a data center with larger servers. 

With that said, I don't think Lich is *that* small of a server. As someone mentioned below its the one of the default EU servers. So it has that going for it. 

If not mid sized yet it'll probably be their shortly. "
,SmellyIrishMan,4,1438524484,t5_2qgzy,,False,sports,4,t3_3fhf13,ctouu93,,1440235619,0,t3_3fhf13,0,"Spoiler please.

Haven't been able to watch it in Europe yet. Cheers though :S"
,Pat1f3,1,1438524527,t5_2w31t,,False,hearthstone,1,t3_3ff2j5,ctouut0,,1440235626,0,t1_ctoti2q,0,"I will make the purchase on the US appstore, but I play on the hearthstone  EU servers, is that OK?"
Auslandsösterreicher,ChakiDrH,1,1438524690,t5_2qo9i,niederoesterreich,False,Austria,1,t3_3fh4ja,ctoux4g,,1440235656,0,t3_3fh4ja,0,"If you drive between Vienna and Salzburg, make sure to visit the Stift Melk. It's directly beside the Motorway, a really gorgeous old abbey above the danube, where you can view the surrounding region.

In Vienna, there's also the Prater, which is basically a small amusement park and features some of the oldest variants of their rides in europe. A lot of them are suited for kids."
,RQK1996,-14,1438524859,t5_2qh1i,,False,AskReddit,-14,t3_3fi2j5,ctouzg3,,1440235686,0,t1_ctoutpv,0,"In Europe they usually serve only one type of beer, and same brand variations."
United Kingdom,paulusmagintie,2,1438524888,t5_2qh4j,UKGB,False,europe,2,t3_3fhleu,ctouzu2,,1440235692,0,t1_ctoup5u,0,"The make bids like everybody else, if BAE make a tank that suits the needs of the EU over a German company then all companies make the BAE tank.

If Airbus make a plane while a polish company makes one that doesn't quite suit the EU then everybody makes the Airbus one. 

Is that what France and Germany are doing right now? Combining their planes and now tank building so they will use the same ones, Britain even got involved for the Eurofighter so we already see this melding of companies working together to build something so why can't it continue?

Hell BAE tried to merge with a joint German &amp; Franco company but the 2 governments refused to give up their share in the company so BAE couldn't merge with them."
,Benthetraveler,20,1438524917,t5_2qh4j,,False,europe,20,t3_3fhzml,ctov09n,,1440235698,1,t1_ctosb4i,0,"Filtering doesn't prevent brigading, that's the problem. Why do you think reuropean and the other subreddits are raging so much? If it was just filtering they could continue pushing their agenda, censoring people etc. but with a megathread they just can't.

In an ideal world there wouldn't be a megathread but given the level of brigading there just doesn't seem to be a better way. And the admins sadly lack the spine to ban the harassing subreddits."
,pescador7,8,1438524924,t5_2qmku,,False,Brazil,8,t3_3ffo24,ctov0dl,,1440235700,0,t1_ctouob4,0,"Yes, the article says something in the lines of ""accumulated advantage"", using different words.

Still, white brazilians aren't all descendents of the european elite. It's unfair to treat them like every white person is rich. In the south, most were poor immigrants fleeing from some european war.

Instead of giving advantages to one race, the government should give subsidies for those who are poor, not those who are black.

The state where I live has a program which gives college scholarships for people who studied in public schools and whose income is within a limit. They don't ask for race or colour. If you are poor and had decent (&gt;70%) grades during school, they give you a chance. That's the right way to deal with this problem IMO."
,JarusPokemon,0,1438525063,t5_324pu,yoshi,False,amiibo,0,t3_3ficsi,ctov299,,1440235724,0,t1_ctov16y,0,Guy from Europe: I'll do all 4 for Pac-Man.
Flanders,PniboR,2,1438525086,t5_2qhe6,011,False,belgium,2,t3_3fbtoc,ctov2l4,,1440235728,0,t1_ctotv7v,0,"Well, we have a different perspective. What I have kind of learnt is that we live in an age where we don't need to work as hard as we used to. We can automate a lot of things. The brain has become much more important. So from my perspective, the hard work can and will eventually be limited to a smaller share of the population.

Don't get me wrong, I realise there are a lot of poorer and/or hard-working people in this world and I enormously respect all hard-working people. I will agree with you that indebted American students are more hardworking than European ones who are well-off. I myself am a good example, to be honest, I won't disagree when someone calls me lazy. But I *am* ambitious to make our society better.

So from my perspective, nobody in this age should have to live under the choice of ""job or die"". But there is still a fundamental difference between the Western world and the developing world. In the Western world, you are very dependent on others in your live and it's hard to be self-sufficient. If you can't find a job, it's not straightforward to just, let's say, build your house or grow your food. If you don't fit into society, you are forced to be homeless. In the developing world, it's the general population that is poor, but their society is such that most if not everyone finds a way to sustain themselves and their family, rather than ""having to apply for a job and either succeeding or failing"".

I don't really know where I am going with this comment, but there is so much in this world that can and should be better."
,Battle_Biscuits,17,1438525180,t5_2qhcv,,False,ukpolitics,17,t3_3fhrpj,ctov3ve,,1440235745,0,t3_3fhrpj,0,"He's a pretty decent comedian and I think he's right to poke fun at the irony of, having immigrated to and colonised all sorts of countries around the world, the people of those countries are coming here.- But that's all it is, irony, I don't think you can meaningfully advocate some sort of political position from this ironic point. We may have colonised other countries, stripped them of their resources and did all sorts of barbaric things in the past but it doesn't logically follow that we should let the people from those countries simply immigrate here if it suits them. This line of thought implies some sort of idea ""historical debt""- That if one country did something bad to another country, the victim country is entitled to some sort of compensation or preferential treatment today. I don't agree with that, because we don't inherit the sins of our farthers. It's also unclear how far back we can take ""historical debt"".

The slave trade goes back to the 17th century, and Europeans were committing all sorts of crimes against each other back then. Can Ireland claim compensation from the UK for crimes against humanity committed during the reign of Elizabeth I? Can Germany claim compensation from France for the slaughter of the 30 years war? Can the UK claim compensation from Denmark for what happened at Lindesfarne? What does the City of Rome owe us for the systematic massacre of British Druids and 300 years of ruthless occupation?  (Take note Osborne, this could be an idea to pay off the national debt!)

There's also a couple of rather glaring historical inaccuracies in his act, which I suspect is deliberate so to support his political agenda- and as someone who loves history this pisses me off.

1: It's misleading to say that the British actively encouraged and promoted living in Britain to their imperial subjects. There is only one point in time, during the final years of the Empire, when Britain did encourage immigration and that was just after the Second World War. But to infer that this was policy straight from day one is inaccurate. 

2: It's also wrong to say that the Indians were perfectly peaceful and happy before the British arrived. When the British started becoming involved in India in the 18th century, the ruling Mughal Dynasty was starting to collapse and it was time of civil and political strife which the East India Company exploited to its own ends. To say that the Indians were all happy with their ""spices and elephants"" paints a false and simplistic caricature of 18th century India.  


"
,OneAnimeBatman,3,1438525356,t5_2qi4s,20,1438525721,StarWars,3,t3_3fhmnu,ctov6dn,,1440235778,0,t1_ctov2za,0,"&gt; The EU was never canon.

&gt; Where are you getting this EU used to be canon thing from? It was never canon.

Your words, not mine"
WayNorthBroadSt,TeamDisrespect,86,1438525388,t5_2qh24,text,False,philadelphia,86,t3_3fhuqn,ctov6uz,,1440235785,0,t1_ctouqhx,0,Apparently this robot was able to cross North America and tour a large swath of Europe unscathed only to get raped and murdered in Philly.
15,ET817,1,1438525468,t5_3525u,,1438529334,amiiboSwap,1,t3_3fhdqz,ctov83c,,1440235801,0,t1_ctonh9h,0,Eu/Jp greninja and na meta knight
,Magilla_Godzilla,0,1438525770,t5_2vg7t,,False,pettyrevenge,0,t3_3fg8fo,ctovco1,,1440235860,0,t1_ctosa5n,0,"I remember reading about how in some countries in Europe don't have the sewage system to handle toilet paper, so they just throw it in the garbage. 

It's far less common for that to happen in the USA. "
,obimk1,1,1438525783,t5_2qh2p,,False,atheism,1,t3_3fhdob,ctovcuh,,1440235863,0,t1_ctopfvz,0,"Yeah compare it to what apparently happened in the EU say 1300 years ago, it just shows how utterly backward and retarded sharia law actually is.
"
,Firedrakez,2,1438525932,t5_2rfxx,katarina,False,leagueoflegends,2,t3_3felyk,ctovf14,,1440235891,0,t1_ctouxmh,0,Do you mean you'll be there on August 23rd or October 31st? Or both? I'm still trying to figure out who got them to stream the EU LCS playoff finals :D
,mastovacek,1,1438525992,t5_2qh13,,False,worldnews,1,t3_3fgf1b,ctovfx1,,1440235903,0,t1_ctouqrf,0,"&gt;By that logic there are two nuclear powers at war at his very moment! After all they both have large forces at their borders. They even shoot at each other regularly. 

??? Was there a mobilization that only you are privy to? what borders??

&gt; During Hamas's rule of the West Bank terror attacks STOPPED

And yet they claimed responsibility for the Kerem Shalom suicide bombing in 2008.

&gt;Israel has not stopped land grabs. The ONLY people who managed to make them stop was Hamas.

Ah yes, so terrorism *IS* the proper way! Why don't you contact the Pakistani government with this solution to their Indian problem.

&gt;stop the sale of Palestinian Agricultural products

Why don't you look up the alternate usages of ammonium nitrate.

&gt;And Hamas does spend money on healthcare

As the governing administration in Palestine I'm sure it does. It doesn't give it a free pass on financing missile launches into Israel.

&gt; they got stopped at the border.
No crap. Thats the point of border checkpoints. To check the goods. Do you think that an order from MSF cant be infiltrated and weapons can't be put under the medicine and food supplies? Especially after the cases in Europe when illicit drugs were found *inside* fruit?

&gt;IF you are paying taxes to another country that refuses to give you the necessary taxes back and instead ""holds onto it"" at whim then you can pretty much demand representation. 

Lol, those are great ideals and all but that's not how the real world works. Just as the federal district of Washington D.C., Puerto Rico, of literally any person who is on a visa in any country ever.

&gt;I fail to see how that's putting money into terrorist coffers...

Because you're isolating events to fit your myopic worldview. Wake up. Palestine and Israel have many issues that both sides of the conflict are responsible for. But being represented by an organization that willfully carries out terror attacks and then hides behind civilian populations is not only not helping their side, it's cowardly and uncivilized. Israel could certainly come to an agreement with Palestine, but why should it at this point in time, when Palestine wants, nay demands, that Israel paint itself the Great Satan and then put itself into the position of servant to a state that has not only called a coalition of countries to war multiple times, but continues to attack the very human rights that it then proclaims Israel ignores?





"
,z3des,2,1438526047,t5_2zume,,False,csgobetting,2,t3_3ficq1,ctovgoo,,1440235913,0,t3_3ficq1,0,"http://play.eslgaming.com/counterstrike/csgo/csgo/major/eslone-cologne-2015-european-qualifier2/match/31565178/ - Some info about Inshaker - Did not manage to find anything relevant about 31337 esports, only some old line-ups - I will pesonally skip so take it as you wish."
