body,distinguished,created_utc,score,gilded,ups,controversiality,subreddit,id,link_id,author_flair_text,author,author_flair_css_class,parent_id,subreddit_id,edited,retrieved_on,stickied
EU secret strats trying to win all 4 LCS splits.,,1448928135,1,0,1,0,leagueoflegends,cxiij6u,t3_3uwadl,PogChamp,He4rtl3ss,ahri,t1_cxih34j,t5_2rfxx,False,1450552131,False
"Any idea why G2 was selected over the other (probably better) Eu teams like Dig, Fnatic etc?",,1448928145,8,0,8,0,heroesofthestorm,cxiijek,t3_3ux688,,SpudSmusher,,t3_3ux688,t5_2ym13,False,1450552133,False
"From what i can see, EU to NA is due to the higher amount that NA players make.

The changes i feel to NA are due to"" Zero and ten"" at worlds.
",,1448928244,2,0,2,0,leagueoflegends,cxiilhx,t3_3uxbvv,,Jknexx,galio,t3_3uxbvv,t5_2rfxx,False,1450552161,False
"This news is more scary than any ISIS news, because this is literally the last straw if Turkey joins EU",,1448928370,2,0,2,0,european,cxiio86,t3_3uvn37,Monaco,Banished377,MONA,t3_3uvn37,t5_2u7i2,False,1450552197,False
"Foreign Affairs, ""Rome would prefer that superpowers stay out of European land.  We would ask that you relinquish your claim to us, and we will trade the beer, sheep, and other goods to you, with reduced tariffs on goods from the UJB.  It is also possible that we could come to another arrangement, just ask what you would like, as long as it is not Roman-controlled land, and the Ministry of Foreign Affairs will get back with you on your request.""",,1448928426,1,0,1,0,ImperialPowers,cxiipgh,t3_3ux63k,Caesar of Roma | Head Mod,Warhound0042,,t3_3ux63k,t5_360oo,1448930851,1450552212,False
"Greeks over all like and sympathize with the Jews, and their history of being prosecuted for so long by fellow Christians. 

Which is why places like Thessaloniki before World War 2, where Jews lived freely, were considered safe havens for Jews from Catholic prosecution in the Middle Ages.

Is the settlement issue two sided and needs an appropriate resolution? Sure. 

But both Jews and Palestinians have a right to live freely, and this is a form of persecution the Jews have come to expect after centuries of segregation and prosecution in Europe.",,1448928650,1,0,1,1,worldnews,cxiiu54,t3_3uwth3,,JimCanuck,,t3_3uwth3,t5_2qh13,False,1450552274,False
SD http://giostreams.eu/ch46.html,,1448928656,2,0,2,0,NHLStreams,cxiiu91,t3_3ux9nm,,streamitpage4me,,t3_3ux9nm,t5_33rqh,False,1450552275,False
"That's actually the rule if the team is sold. It was put in place after a European team got relegated and try to buy another team's spot.

There's a difference between buying the spot and buying the team though. If you buy the spot, you're not required to field 3/5 of the roster.

I would be shocked if they did not introduce a rule to address this directly.",,1448928684,1,0,1,0,leagueoflegends,cxiiuuv,t3_3ux8cp,,corruptacolyte,nunu,t1_cxiideu,t5_2rfxx,False,1450552283,False
Europe is not.,,1448928718,1,0,1,0,soccer,cxiivn8,t3_3uxamc,,dad2you,,t3_3uxamc,t5_2qi58,False,1450552293,False
"Did I mention anything about America? 

All I was saying is that in the European theater of the war, the USSR did most of the fighting. They lost the most men, and killed the most Germans, albeit supplied by the US, but still did most of the effort in Europe. ",,1448928763,3,0,3,0,AskReddit,cxiiwmj,t3_3uudrc,,maracay1999,,t1_cxiima7,t5_2qh1i,False,1450552307,False
"Well they are pretty fucked up, worse off than America for the most part. That's about all we know about Europe in the 2200s.",,1448928820,1,0,1,0,falloutlore,cxiixu3,t3_3uxae5,,OtakuMecha,,t3_3uxae5,t5_2udux,False,1450552322,False
[Professor Hans Rosling berättar hur flyktingar faktiskt kommer till Sverige och hur det påverkar EU](https://youtu.be/1vr6Q77lUHE) ,,1448928831,9,0,9,0,Sverige,cxiiy2n,t3_3uwpm3,,Marhiin,,t3_3uwpm3,t5_2r4le,False,1450552325,False
You ignored the important point and instead focused on irrelevant EU-Turkey relations.,,1448928923,2,0,2,0,europe,cxij031,t3_3uurqw,The Netherlands,Shamalamadindong,NETH,t1_cxi9lx0,t5_2qh4j,False,1450552352,False
Wait so steam had to add refunds on legal grounds with Europe but why don't sony?,,1448929224,1,0,1,0,pcmasterrace,cxij6hf,t3_3uvcae,Sweet gaming potato 2.4ghz 2 cores and integrated graphics,Deanodeano1,text-pcmr color-pcmr,t3_3uvcae,t5_2sgp1,False,1450552436,False
I've read and would like someone more knowledgable to confirm or not that early European explorers in Papua and Australia did not think the natives were fully human,,1448929529,4,0,4,0,AskAnthropology,cxijcz9,t3_3uvmif,,takatori,,t3_3uvmif,t5_2wl4u,False,1450552520,False
"http://www.streamsarena.eu/lsh/stream5.html 600 KBps, Medium Quality, **English Audio**

The video will be changed to game feed soon.",,1448929687,1,0,1,0,nbastreams,cxijgdv,t3_3uxcjc,,skyline1923,,t3_3uxcjc,t5_340mn,False,1450552565,False
"if this ends up to be true, im going to fly my EU flag to TSM, best part will be that NA still thinks TSM as NA team, when in reality EU just got sneaky entrance to NA LCS, TSM TSM TSM, fuck NA",,1448929806,-5,0,-5,1,leagueoflegends,cxijiww,t3_3uwadl,,SirSukkaAlot,team 11,t3_3uwadl,t5_2rfxx,False,1450552598,False
http://eu.battle.net/sc2/en/profile/522965/1/iLiZiUM/,,1448929838,3,0,3,0,starcraft,cxijjlq,t3_3uwwt1,Zerg,iLiZiUM,Z,t1_cxiimjs,t5_2qpp6,False,1450552608,False
I firmly believe that Origen is the best team in EU. I see all these posts on here and people just seem to disregard OG in general. ,,1448929877,1,0,1,0,leagueoflegends,cxijkg0,t3_3uwadl,,BigC23,team 00,t1_cxih8hi,t5_2rfxx,False,1450552618,False
"What's worse about Canada is that our domestic flights are almost the same price as international flights.

Whenever I fly out to visit family on the other side of the county, I have an internal debate about just going to Europe instead, with prices the same and all....",,1448929899,7,0,7,0,AdviceAnimals,cxijkvs,t3_3uvv8l,,cuffx,,t1_cxicnmx,t5_2s7tt,False,1450552624,False
They could field 5 monkeys and I'd still believe they would find a way to win EU...,,1448929973,4,0,4,1,leagueoflegends,cxijmfc,t3_3uxboa,,illucity,03 team,t3_3uxboa,t5_2rfxx,False,1450552644,False
"I always wanted to ask how Europe was during the reinassance 
and how Saladin looked like",,1448929992,1,0,1,0,askgaybros,cxijmtk,t3_3uvnu9,,Christiano1996,,t1_cxi6x6k,t5_2vgfw,False,1450552650,False
"I agree cultures need to be preserved. However, this article portrays Israel as the bad guy for closing the theater, when in reality the accountant working at the theater could not balance the budget (not even pay the electric). If this was the case in Any other part of the world, then that entity/business would have to close because it is not able to maintain its solvency. 

The ynet article states:

&gt;  The theater operates as an NGO and has received donations from Europe, the United States and others in the past. Khalil said donors and friends had been calling and he hoped they would pledge enough to pay off the debts.

Even with donations the electric and insurance have not been paid. But sure blame Israel.

http://www.ynetnews.com/articles/0,7340,L-4731769,00.html",,1448929996,5,0,5,0,Israel,cxijmx0,t3_3uwhtl,,GVS03,,t1_cxihhuc,t5_2qhvo,1448938267,1450552651,False
"Nao tenho sugestão, mas tinha que dizer que tens o mesmo problema que eu a andar. O calcanhar do lado de fora das tilhas some-se :)",,1448930002,1,0,1,0,portugal,cxijn2c,t3_3uww6f,,daedric,,t3_3uww6f,t5_2qmie,False,1450552653,False
TSM.EUROPE IS REAL,,1448930071,1,0,1,0,leagueoflegends,cxijoiw,t3_3uwadl,,aphexmoon,team 11,t3_3uwadl,t5_2rfxx,False,1450552672,False
"Well, for one, there is in fact a historical record here. There is a bit of wrangling on how exactly to match up the Egyptian calendar to the one we use, but we can place the construction into a reasonably tight set of dates from historical sources alone. It is not as though they were ""discovered"" by Europeans: the Egyptians talk about them, the Greeks talk about them, the Romans talk about them, the Arabs talk about them. It would be rather remarkable if the subject of the giant artificial mountains near consistently one of the most densely populated areas of the world was never discussed.

Beyond that, there are certain pieces of stylistic evidence: the Great Pyramids did not appear *ex nihilo*, there was a period of development from the even more ancient [mastaba](http://www.bbc.co.uk/staticarchive/2cb2e40bb8f5d5f2d5741f2f36e7fed73672b803.jpg) to Giza, to the [Step Pyramid of Djoser](https://en.wikipedia.org/wiki/Djoser#/media/File:Saqqara_BW_5.jpg) to the various pyramids of Sneferu, and finally to the pyramids of Giza. And funnily enough there aren't really great stonking big pyramids after Khufu and his descendants, they are fairly characteristic of the third and fourth dynasty. There are certainly [big pyramids](https://en.wikipedia.org/wiki/Pyramid_of_Neferirkare#/media/File:Abousir_Neferirkare_02.jpg) built after but not on the same titanic scale. So on this stylistic grounds we can be pretty clear on this.

But if you want something really concrete, there are the [carbon dates](http://www.aeraweb.org/projects/how-old-are-the-pyramids/) of material from the pyramids. Carbon dates are a bit more fickle than is usually appreciated, but the dates at least confirm that they were constructed within the commonly considered ""historical period"" of Egypt, and once that is conceded it requires a lot of mental gymnastics to disregard the traditional dates.",,1448930139,10,0,10,0,AskHistorians,cxijpym,t3_3uw95d,Roman Archaeology,Tiako,archaeology,t3_3uw95d,t5_2ssp3,False,1450552690,False
"oh guess why Brussels is the same

also, italian school scrapping christmas because muslims might be provoked
also http://www.telegraph.co.uk/news/worldnews/europe/italy/12023603/Italians-outraged-after-headmaster-scraps-Christmas-carol-concert-following-Paris-attacks.html

Dis needs to stop.",,1448930152,3,0,3,0,exmuslim,cxijq8t,t3_3uv0j7,Never-Moose Atheist,JelDeRebel,,t3_3uv0j7,t5_2s7k2,False,1450552694,False
"There's always been a few bottom teams. NA is still going to have 5-6 teams at the top like always, and possibly more if Immortals and Renegades surprise us. God knows what's happening with GV and TiP. EU seems kinda  screwed though, with everyone leaving.",,1448930257,1,0,1,0,leagueoflegends,cxijseq,t3_3ux36m,,HolypenguinHere,orianna,t3_3ux36m,t5_2rfxx,False,1450552722,False
"[**@SDiDuro**](https://twitter.com/SDiDuro):
&gt;[2015-11-30 22:05:53 UTC](https://twitter.com/SDiDuro/status/671450101907345408)

&gt;So @SEGA\_Europe just sent us a six\-pack of these! Thank you so much guys and Merry Christmas!! [#SolidarityInSpeed](https://twitter.com/search?q=%23SolidarityInSpeed) [*pic.twitter.com*](http://pbs.twimg.com/media/CVF4T2GWIAAUWOW.jpg) [^[Imgur]](http://i.imgur.com/J9jQmSJ.jpg)

----

[^[Mistake?]](/message/compose/?to=TweetPoster&amp;subject=Error%20Report&amp;message=/3uxhgt%0A%0APlease leave above link unaltered.)
[^[Suggestion]](/message/compose/?to=TweetPoster&amp;subject=Suggestion)
[^[FAQ]](/r/TweetPoster/comments/13relk/)
[^[Code]](https://github.com/buttscicles/TweetPoster)
[^[Issues]](https://github.com/buttscicles/TweetPoster/issues)
",,1448930320,2,0,2,0,TwoBestFriendsPlay,cxijtr2,t3_3uxhgt,,TweetPoster,,t3_3uxhgt,t5_2uzei,False,1450552740,False
"* Bjergsen: star player of his team and top 5 EU midlaner.  
* Amazing: star player of his team, two time week MVP and one of the best junglers of the 2014 EULCS Spring Split  
* Incarnation: *The* most hyped teamless player of 2014 and early 2015 in Europe up untill he got signed by Cloud 9.
* Dexter: Played for a top 2 EU team at the time he went to play for CLG.
* Krepo, Snoopeh, and Yellowpete: three players of one of the two most popular line ups in Europe throughout season 2 and season 3.

And then you've already mentioned Alex Ich and Edward.",,1448930340,4,0,4,0,leagueoflegends,cxiju5r,t3_3uwtkr,,Wastyvez,team 45,t1_cxij438,t5_2rfxx,False,1450552746,False
[SD Celtics stream](http://firstrowi.eu/basketball/first-boston-celtics-miami-heat-row650b70),,1448930448,1,0,1,0,bostonceltics,cxijwe0,t3_3uxcic,MRS. BRAD STEVENS,1337speak,banner-1,t3_3uxcic,t5_2qmkf,False,1450552775,False
"But the amount of blacks that have been killed is far more proportionate when considered alongside violent crime rates..... 

EDIT: that video about riots vs protests is an apples to oranges comparison. Comparing black Americans to white Europeans. The discrepancy vanishes (and is a far more logical comparison) if you compare white Americans to black Americans. ",,1448930524,1,0,1,0,AskReddit,cxijy0d,t3_3uuspr,,[deleted],,t1_cxi1rdy,t5_2qh1i,False,1450552796,False
"I've come back from a -90% early game war as Venice against Turks when I was also fighting Mamelukes (+allies) and Milan/Austria/Hungary. At one point I was even at +35% on losing Venice to a Mameluke force.

Milan and Mamelukes went for me while I was busy beating up the Turks, and I won by taking Milan in an assault right before my army was crushed by a doomstack (WP on Milan/Austria/Hungary) and then grinding down the combined fleets of the Turks and Mamelukes until I could finally move my fleet away from Venice without it being immediately threatened from the sea. After the sea was won, the land was merely a matter of time.

It was a grueling endeavor, but after forty some years of fighting, an unholy number of loans and the desolation of much of Europe, I got my fucking victory. ",,1448930935,2,0,2,0,paradoxplaza,cxik6tc,t3_3uuq8d,,mrtacoswildride,,t1_cxhzy64,t5_2su3h,False,1450552912,False
"See I'm too broke to afford anything but the European equivalent of Budweiser, so I can't be a ""neat beat person"". But I've probably drunk more beer than three of those fucking beer hipsters combined.",,1448931043,2,0,2,1,Showerthoughts,cxik94i,t3_3uw8od,,GilberteSwann,,t3_3uw8od,t5_2szyo,False,1450552942,False
"I can't comment on how it is for EU but T1 NA is... Well, something else.

True, the new BLs are not completely empty since every now and then we'll see people doing the PvE meta in the center of the map but most of the time, we practice taking down fortified walls and CC breaking the Lord. Sometimes we'll find guild fights if the EB queue is 30+ but for the most part, we practice our run button pushing ability since the new BLs are excellent running simulators. ",,1448931207,1,0,1,0,Guildwars2,cxikcmu,t3_3uufhc,,TheFlowChartKen,,t1_cxih97v,t5_2r9po,False,1450552987,False
"Truth be told, Beth games are absurdly imbalanced on so many levels ... 

I admit that your average gamer needs the power trip (and if we're the least bit honest about it, EU and EW are only challenging during the first few month before putting you on a victory lap that lasts for the rest of the game) but Bethesda's levelled lists made it so that enemy power did not even make sense. Some basic wildlife is scary as fuck and some evil badass dudes are pushovers. Exceedingly annoying ...",,1448931300,1,0,1,0,Xcom,cxikejt,t3_3uty55,,Vathar,Chryssalid,t1_cxibk8x,t5_2si6x,False,1450553013,False
What happened in Germany in the 1930s is happening again.  The rise of nationalism in Europe.    ,,1448931330,0,0,0,0,politics,cxikf61,t3_3uv9ta,,iamjacksprofile,,t1_cxif77z,t5_2cneq,False,1450553020,False
"Cool thanks man. That lead me to watching a video on tonearm cleaning. They guy in it recommends using a q-tip and alcohol to clean and using metal polish after. Would that be alright? I'm gonna try this before spending money on a repair.

Edit: can't buy that product you linked as I'm in Europe",,1448931681,1,0,1,0,DJs,cxikmjj,t3_3uwztw,,JoeKneeMarf,,t1_cxik2yj,t5_2rddy,False,1450553117,False
"I have to disagree with you on that last part. Germanic peoples did not see mass Christianization until Medieval times, and that was often through sword and flame. Norse mythology is a form of Germanic paganism, as is Anglo-Saxon paganism. That's why you find gods like Wuotan/Woden/Odin, Donar/Thunor/Thor, and Ziu/Tiw/Tyr. The Norse were simply North Germanic tribes.

The Germanic peoples covered a large expanse of Northern and Western Europe and included the Norse, Anglo-Saxons, and the Goths. Germanic paganism came about during the European Iron Age which started about 1200 BC. Before that were the Indo-Europeans. All Germanic tribes were pretty much Christianized between the 6th and 11th centuries, hundreds of years after the supposed life of Jesus of Nazareth.

Edit- [Germanic Paganism](https://en.m.wikipedia.org/wiki/Germanic_paganism)",,1448932071,1,0,1,0,translator,cxikv15,t3_3us1x8,,[deleted],,t1_cxijen8,t5_2ss9z,1448932598,1450553228,False
"Can't really blame them for jumping to NA. Yellowstar can't have long left at the top and if it's true US teams are paying 3x what EU teams are, he's gotta make bank before he goes.",,1448932126,1,0,1,0,leagueoflegends,cxikw5r,t3_3uwadl,,A_Bit_Of_Nonsense,,t1_cxiaajz,t5_2rfxx,False,1450553242,False
"This. I play on Fraya in EU and have encountered an increase in lvl 65s recently. Assumin its people comming back for the brawler patch(although many are first timers as well). Helping new people progress and learn is such a delight. 

Also, i agree that the community is awesome. Made a bunch of good friends to play with and relax and have fun. Something that i felt lacked in my guild in wow. Although people are oddly shy in Tera i find!",,1448932224,1,0,1,0,TeraOnline,cxiky8y,t3_3uturz,,SmacktrickZ,,t1_cxhr4jz,t5_2s527,False,1450553270,False
"Awesome that you asked.  In fact I'm impressed that you read and thought and commented.  Shows you're thinking.  Good on you.

The key is balance.  

Having a puny ego meant I didn't feel my worth, I didn't make decisions with ME in mind... I always thought everyone else's well-being and happiness was more important than mine.  It's a terrible, wasteful way to go through life.  And is not a good example to model for your child.  

(I had my dysfunctional european parents' imbalanced marriage as my role model... so I wasn't too hard on myself when I figured it out.  When you know better... you do better.  That's what life's journey is all about.)

Often if you are that person (with the puny ego), you've connected with a partner whose subconscious senses that, and in turn creates a relationship where they take advantage of that... because they have a substantial and strong ego and feel they are deserving.

It's catastrophic.  Believe me.

If you have a healthy ego... you respect yourself yet you're mindful of others and respect them too.  A strong or puny ego will not serve you in life.

Hope this answers your question... and if not... would love to discuss further.

",,1448932402,1,0,1,0,canada,cxil2a3,t3_3uudgf,,OoLaLana,,t1_cxikbia,t5_2qh68,False,1450553322,False
"Cara, o único ""mantra"" que me ajuda a passar por esses tempos de dissabor é repitir para mim mesmo que **tudo** é passageiro.

E tenha em mente uma coisa: É nesses períodos de tristeza e dificuldades que nos tornamos mais fortes. Nesses períodos que percebemos que a forma que percebemos o mundo afeta diretamente nossa felicidade.

Eu não sei se isso irá ajudar você, estou apenas compartilhando da minha experiência de estar ""no fundo do posso"".


PS: Fique tranquilo, você vai recuperar o teu streak de um mês, e se você vier a falhar, tente de novo. Não desista de você!

Se vc quiser alguma ajuda para chegar em 1 mês, só dá um aviso que eu te respondo :-)",,1448932450,6,0,6,0,NoFap,cxil3c2,t3_3uw3dy,,daelmart,,t1_cxiezkn,t5_2skrn,False,1450553337,False
"He wants to learn european football I think. Expand his horizons and aquire new skills/tactics ect. 

I think it was great for him to go abroad, prehaps it's not doing well for his career/cv but if he picks up some valuable experience it'll make him a better manager.",,1448932754,4,0,4,0,soccer,cxil9zt,t3_3uxamc,Arsenal,14Deadsouls,1,t3_3uxamc,t5_2qi58,False,1450553423,False
"I haven't played Attila, but Rome 2 is phenomenal.  I prefer it to Shogun 2 by far.  It's certainly more complex, and there's a huge amount of unit/faction diversity.  The base game also includes the Imperator Augustus expansion/update, which allows you to play one of several factions during the third triumverate (during which time the Roman Republic was effectively divided among Octavian [later Augustus], Marc Antony, and Lepidus).  Sextus Pompey also makes an appearance in control of Sicily.

And if you buy the DLC's, you get to play the Peloponnesian War, the Gallic Wars, and the Second Punic War.  Great times.

I'd hold off on Attila.  I hear great things, and the major DLC expansion so far looks fantastic (play as Justinian II's general Belisarius in reconquering the territory of the WRE), but there's a Charlemagne DLC coming out fairly soon that's basically western Europe in the late 8th century.  I wouldn't be surprised if there were some sort of bundle come Christmas.",,1448932773,2,0,2,0,GameDeals,cxilafn,t3_3uvoqg,,CaptainWigwam,,t1_cxibu6b,t5_2qwx3,False,1450553429,False
At least they made money chopping it down so Europe could feed its cows?,,1448932814,1,0,1,0,collapse,cxilbcr,t3_3uv6ck,,North-of-the-river,,t1_cxiamxv,t5_2qhw9,False,1450553441,False
Seems like a beneficial move for both sides. It's his best option if he wants to stay in Europe anyway.,,1448932936,2,0,2,0,MMA,cxile6v,t3_3ux2fq,,shrewdy,,t3_3ux2fq,t5_2qhj4,False,1450553479,False
"People consistently speak of ""using their own talent"" and simultaneously complain at the players not being LCS caliber.  Regardless of which team you root for, you want them to field the best possible lineup.  I think your anger is misplaced....it should be focused on the EU teams that are either unwilling or unable to keep up with NA salaries at this time.  Eventually, the league was going to have to run without the subsidized salaries if the league was going to survive.  NA teams have taken steps to getting that done.",,1448932962,1,0,1,0,leagueoflegends,cxiler0,t3_3uwadl,,huzbinpharten,00 team,t1_cxiftr4,t5_2rfxx,False,1450553486,False
France would be covered in dildos so would most europe,,1448933069,2,0,2,0,AskReddit,cxilh0v,t3_3uxfki,,virgil2600,,t3_3uxfki,t5_2qh1i,False,1450553516,False
"I'm the exact opposite of you, lol. I'm east NA and mostly play EU since all my friends are EU, lmao. 100 ping lyfe",,1448933236,1,0,1,0,GlobalOffensive,cxilkjx,t3_3ux78q,The Global Elite,ZeekRivera,rank global-elite,t3_3ux78q,t5_2sqho,False,1450553562,False
"Huni and Reignover both peaked in the Spring Split when they first got to Europe. Fnatic didn't make them into the monsters that they are today. They were already ""monsters"" when they came over they just weren't able to shine in the most competitive region.",,1448933365,0,0,0,0,leagueoflegends,cxilnd1,t3_3uxnjc,,BusinessCashew,shyvana,t3_3uxnjc,t5_2rfxx,False,1450553599,False
Longs better hope bad news doesn't come out....block size controversy or EU regulations or anything else.,,1448933381,0,0,0,0,BitcoinMarkets,cxilnpr,t3_3ut26t,Bearish,thecosmic1,bearish,t1_cxig5u5,t5_2wwh3,False,1450553603,False
"Did you realize that that environment you called ""much more competitive"" is the reason why Hitler was near to control all Europe at some point, right?",,1448933385,-2,0,-2,0,leagueoflegends,cxilnt4,t3_3uxfu2, (EU-W),jaykenton,reksai,t1_cxikiay,t5_2rfxx,False,1450553604,False
"Well regardless he's wrong because it's an absolutist statement. You don't need to point out ""good"" Muslims to counter that, just point out those that aren't religious at all. 

The video itself is not of dubious credibility. If you think that conference was bad then you have no idea what goes in mosques around the world, including in Europe. 

",,1448933671,1,0,1,0,atheism,cxilu9s,t3_3uvo82,,theRealDarkstar,,t1_cxilidb,t5_2qh2p,False,1450553689,False
"If you're in Europe, I love DielSport. They manufacture in Bulgaria so you get the quality of European design with the cheap labor of the Eastern Europe.  Quality gear at a much lower price point.",,1448933809,1,0,1,0,skiing,cxilxa0,t3_3uwb1q,,Kahnspiracy,,t3_3uwb1q,t5_2qig7,False,1450553728,False
"Industrialisation isn't the cause of high emissions, if it was China would far exceed that produced by the US. It's much more to do with total economic activity, which is growing considerably faster in Eastern Europe than it is in most other developed countries. ",,1448933986,0,0,0,0,MapPorn,cxim16m,t3_3uvihd,,Ewannnn,,t1_cxi9aqd,t5_2si92,False,1450553780,False
