author,subreddit_id,id,score,gilded,link_id,controversiality,edited,body,distinguished,created_utc,retrieved_on,subreddit,ups,downs,name,parent_id,archived,score_hidden,author_flair_css_class,author_flair_text,removal_reason
iluvucorgi,t5_2qhbp,c4ixige,1,0,t3_t0d00,0,False,"It's a good question. Traditionally the marriage age has been a lot younger than what we are used to today. Even today in Spain the age is 13, and I think even in one US state females can marriage at that age. If you back further in time you will see this age drop. It's just the way life was, and it's worth remembering that often life expectancy was a lot lot lower, around 30 in during the dark ages in Europe for example.

As for Aisha. The Prophet was thinking about marrying, and one of the women suggested Aisha as a wife. She was already betrothed at this point. So both points suggest that it was entirely normal. She also stayed with her family until she was considered mature enough to become a wife, at which point she moved to live with the Prophet. Traditionally, when a woman had her period, this was considered the sign of maturity. It can be difficult to relate to.  Today we live something of a pampered life, we don't have to work to survive, we have high school, university, but they had none of those 'distractions', life was simpler I suppose.  

One other thing about Aisha was her father. Her Father and the Prophet where very close indeed. He was one of the most beloved people to him, and this marriage cemented that bond. 

Aisha turned out to be exceptionally bright, and her youth and vigor meant that  the Caliphs and others could get guidance and learn from her long after the Prophet's death. 

There are so many stories about the tenderness of their relationship. Like the one where he asked here where on the cup she drank from, so that he could drink from the same place her lips had touched.

His most beloved wife though was probably Khadija. She was older than him and had been married before. So in these two examples we have different roles models. As others have said, today we have to take the norms of the society into account when we look at issues, and we should also look at the past in light of those norms too.",,1335913628,1428836658,islam,1,0,t1_c4ixige,t3_t0d00,True,False,,,
dicktharippa,t5_2qi58,c4ixkeb,2,0,t3_t1f1k,0,False,"This take that America only views things in terms of right-winged economic policy and America is right-winged economic policy is fucking stupid, and you're stupid for thinking it's true. The 900 people who upvoted you are stupid for agreeing with you. American sports aren't set up to reward failure, and keep decision making in the hands of an oligarchy of ruling elites, they exist to foster parity. The NFL has profit sharing because it fosters parity. The worst team drafts first because it fosters parity. Every team can compete. Can Fulham win the EPL next year? Of course not, they don't have the money. Can the team that finished 9th in the NFL win the super bowl next year? For sure. 

The Pirates can suck for decades because of shitty, corrupt ownership, in a shitty, corrupt league. If the MLB had parity, they would have bounced back by now. But it's based on the European system, which kills small markets. The MLB doesn't want Pittsburgh to succeed. They want big markets to stay successful. 

I love sports in general, because it doesn't needlessly interject politics into a straight meritocracy. The two different leagues just go about their meritocracy differently. Soccer isn't popular in the states because we don't have the same tradition. That's it. Your post is completely off base. ",,1335913886,1428836689,soccer,2,0,t1_c4ixkeb,t3_t1f1k,True,False,7,United States,
Jungle_Is_Massif,t5_2s7tt,c4ixkt1,1,0,t3_t1hmm,0,False,"Isn't a large part of the reasoning behind Imperialism racial superiority(e.g. 'White Man's Burden'), economic benefits and/or nonreligious ideology, not religion? The Soviet Union practiced imperialism yet was an atheistic state. The European colonial powers used the idea that the white race was simply better at running things than other races. Lebensraum wasn't based on a belief of religious ordination but the perceived need for new territory to support a growing population.",,1335913938,1435718034,AdviceAnimals,1,0,t1_c4ixkt1,t1_c4iwep2,True,False,,,
Buelldozer,t5_2qi58,c4ixmav,-2,0,t3_t1f1k,0,False,"Yes, and MY points still stand.

1) The original comment added nothing to the discussion and was merely an attempt for Karma.

2) If we are to be held to a standard then that same standard should apply for everyone.

Can't find Uruguay? Bad American! Can't find New Jersey? Bad European!",,1335914131,1428836715,soccer,-2,0,t1_c4ixmav,t1_c4ixbso,True,False,7,United States,
kuckucksnest,t5_2qh1i,c4ixmjx,1,0,t3_t1m6n,0,False,"Almost exactly two years ago I ended up spending two weeks in a mental hospital in Austria (and I don't even speak German) after a nervous breakdown/psychotic break at a festival in eastern europe. 

Today I'm in the best physical and mental shape of my life, I've got a well paying job that I actually enjoy and I've recently become friends with benefits with a girl who's way too hot for me. But really, I'm just thankful to be able to wake up with a clear head in the mornings.

Good luck on the half-marathon! I just set a personal best on a 10K this weekend myself.",,1335914165,1428836716,AskReddit,1,0,t1_c4ixmjx,t1_c4it04s,True,False,,,
Tell-Me-Fun-Facts,t5_2ssp3,c4ixn0f,3,0,t3_t1e0v,0,False,"Post in [this thread](http://www.reddit.com/r/AskHistorians/comments/q7apm/the_panel_of_historians_ii/).

For future reference, the link to that thread is on the sidebar, right below the legend for flairs. Also, you should think of a few areas of greatest strength (I also know a decent amount of prehistory and European history, but since Jewish history is by far my strongest suit, I decided to go with that instead).",,1335914228,1428836719,AskHistorians,3,0,t1_c4ixn0f,t1_c4iwrh2,True,False,,,
Aurori,t5_2rfxx,c4ixnjg,1,0,t3_t2b1g,0,False,"Are you sure that you cant chat after? Since im a EU-W player we havent got the patch yet, but im pretty sure you will still be able to type there, and if people dont want to listen to/see spamming/blaming/flaming they can just leave the ""lobby""",,1335914296,1428836724,leagueoflegends,1,0,t1_c4ixnjg,t1_c4ixmhm,True,False,volibear,[Aurori] (EU-W),
Zalachenko,t5_2soil,c4ixo8j,2,0,t3_sg6x6,0,False,"Death and Taxes had the Catholic daimyo of Yamana elected HRE because all of Catholic Europe's prestige had been laid waste by my Roman Empire.  When I Imperialism'd a member state, the Emperor came to its defense.  This meant I couldn't actually end the war - because you can't conduct diplomacy with Japan most of the time - and there was no way in hell Yamana was getting to me anyway.  I believe that's why there's now an automatic white peace after two years of nonaggression.

Yamana lost the next election to Inca.  I'm having an odd game.",,1335914382,1428836733,eu3,2,0,t1_c4ixo8j,t1_c4inu0i,True,False,,,
Psythik,t5_2rddy,c4ixqvk,-5,0,t3_t1txd,0,False,"I'm broke and can't afford any record pools ATM, so I'm limited to torrentz.eu and [Songr](http://sites.google.com/site/getsongr/) as my sources for music.",,1335914727,1428836768,DJs,-5,0,t1_c4ixqvk,t1_c4ixq09,True,False,,,
Dyrus,t5_2rfxx,c4ixr4f,110,0,t3_t29yd,0,False,"
Today, Solomid.net will be announcing our first European Tournament. It will be the first of many tournaments that we will be hosting. From now until the end of the year, we want to commit over $100,000 in Tournament Prizes and Money. The first tournament for our circuit will be an 8 teams invite only tournament on May 12th and 13th. Moving forwards, we will be expecting to host a tournament every 2 weeks and expand that to the NA servers as well. We have a lot planned and are excited to give more details as the timing gets right.

Here are the Format, Rules, and Prizing for the first tournament. Check back here as we update you with more details like streams and brackets.

Prizing

    1st - 1000 Euro
    2nd- 400 Euro
    3rd- 100 Euro


Logistics
Date &amp; Time

    Estimated Weekend of May 12th &amp; 13th
    Playtime Time at 12 PM London Time (GMT +1) or 4AM PST


Streaming will be allowed only for Upper bracket R8, R4, Lower bracket R8 &amp; R4 (all matches except for upper bracket finals and lower bracket finals on wards).
Structure

    8 Team Invited Tournament: CLG.eu, aAa, TSM, MYM, Na'Vi, Sypher, Western Wolves, and Absolute Legends
    B03, Double Elimination.
    Day 1 - Teams plays R8, R4, R2, Lr8 Lr4. Will be casting R8, R4, R2. Minimum of 6 matches and maximum of 9 matches.
    Day 2 - Teams plays Lr2, and Championship Finals (minimum of 4 Matches and Maximum of 9)


Rules

    All Teams with have a minimum of 1 players from Each Team in a Skype Chat to arrange matches. There will also be 1 Tournament Administrator at all times.
    The first match is scheduled to start at 12PM GMT+1 or 4AM PST. Players need to be in the game lobby by 11:55am GMT+1 (5 minutes before match time.
    Players have 10 minutes grace period to start the first match before penalty is assessed (either loss of a match or reduction in prize money) (12:10 PM GMT+1).
    After the first match, all players are expected to be on standby in Skype and ready for the next match.
    Matches will Proceed continuously (back2back) with a 10 minutes grace time between matches.
    Tournament official reserves the right to delay the match more than 10 minutes if circumstances calls for it.",,1335914757,1428836772,leagueoflegends,110,0,t1_c4ixr4f,t3_t29yd,True,False,singed,,
witchcarls,t5_2qhbp,c4ixtbu,2,0,t3_t20qv,0,True,"All his numbers are incredibly inaccurate. 20 million Australian aboriginals? 

&gt;It has been estimated that at the time of first European contact, the absolute minimum pre-1788 population was 315,000, while recent archaeological finds suggest that a population of 750,000 could have been sustained,  with some academics estimating a population of a million people was possible

http://en.wikipedia.org/wiki/Indigenous_Australians#Population

Concerning native Americans:

http://en.wikipedia.org/wiki/Population_history_of_American_indigenous_peoples

And the slave trade? 9-12 million Africans were brought over. 4 million died during the passage. And Muslims did have a huge part to play in it.

Where is he getting these numbers from?",,1335915048,1428836799,islam,2,0,t1_c4ixtbu,t3_t20qv,True,False,,,
krattr,t5_2qh0u,c4ixtf8,2,0,t3_t0tnw,0,False,"&gt; Swiss here. Not even European

Did Switzerland move next to Tasmania?",,1335915061,1428836801,pics,2,0,t1_c4ixtf8,t1_c4ipix9,True,False,,,
[deleted],t5_2qh33,c4ixu3z,0,0,t3_t08r0,0,False,Would you care to elaborate on what nicking his busking money means to us non-europeans is all I meant. But thanks for the useless response.,,1335915150,1428836810,funny,0,0,t1_c4ixu3z,t1_c4ixl2c,True,False,,,
SilentOneEye,t5_2qh33,c4ixusx,2,0,t3_t1l94,0,False,Pretty sure this is how it will be for most of our blockbusters this year.  So as an American avoid European spoilers.  ,,1335915248,1428836819,funny,2,0,t1_c4ixusx,t1_c4iw817,True,False,,,
EthicalReasoning,t5_2qh13,c4ixuwg,1,0,t3_t0f1p,0,False,what are they going to do with a seized cruise ship? unleash a bunch of overweight angry floridians on europe?,,1335915263,1428836821,worldnews,1,0,t1_c4ixuwg,t3_t0f1p,True,False,,,
NonAmerican,t5_2qh4j,c4ixvg2,0,0,t3_t0m04,0,False,"The media had nothing to do with it. The People knew the Europeans were above our heads like hawks waiting for ""Greece to do the right thing"" and they knew a referendum would mean reluctancy to do it.

i.e. greeks cry and moan but they are very aware if they go against EU they're fucked. In majority.",,1335915335,1428836828,europe,0,0,t1_c4ixvg2,t1_c4iw2f0,True,False,,,
eoin2017,t5_2qhb9,c4ixvw0,1,0,t3_t1dho,0,False,"Testing the waters, so to speak. Always dip your toe in before diving. Also, *because China*. I'm not going pretend that I understand their government, political attitudes or social norms. Who really knows? Maybe restaurateur Ken So is a card-carrying member of the communist party, sent on a mission to Ireland to scope out a potential European base of commercial operations. Or maybe he's a bullshit artist. There are many ways of interpreting the whole thing, depending on how much you believe to begin with.",,1335915391,1428836838,ireland,1,0,t1_c4ixvw0,t1_c4ixq40,True,False,,,
[deleted],t5_2qh1i,c4ixwzh,3,0,t3_t16y8,0,False,"What happened over 150 years in the past should not mean future generations get reparations, or special treatment. I'm white and my ancestors came in the 1920's from Europe; I'm not responsible nor are my ancestors for slavery. ",,1335915540,1428836849,AskReddit,3,0,t1_c4ixwzh,t1_c4inuj9,True,False,,,
DimlightHero,t5_2rfxx,c4ixy2n,-5,0,t3_t29yd,0,False,"An EU invitational without M5, organised by Solomid. This feels awkward. ",,1335915683,1428836863,leagueoflegends,-5,0,t1_c4ixy2n,t3_t29yd,True,False,18 team,,
Opili,t5_2qh1i,c4ixz34,1,0,t3_t19we,0,False,I can watch a topless woman on most European beaches,,1335915818,1428836876,AskReddit,1,0,t1_c4ixz34,t3_t19we,True,False,,,
gundy8,t5_2qhc8,c4ixzi2,8,0,t3_t2bwi,0,False,"I'd say the ""but guns are dangerous"" groupthink of Europeans is on par with the ""but drugs are dangerous"" groupthink of Americans/westerners.",,1335915874,1428836882,guns,8,0,t1_c4ixzi2,t1_c4ixv1n,True,False,,,
Mespirit,t5_2rfxx,c4ixzpo,3,0,t3_t29yd,0,False,"Their pings to EU-W servers are very decent, around 100, same ping as to NA servers for them actually.",,1335915899,1428836886,leagueoflegends,3,0,t1_c4ixzpo,t1_c4ixw6g,True,False,00 team, (EU-W),
Roflnor,t5_2qh1e,c4iy0og,3,0,t3_t22js,0,False,"This is what you call softcore porn?

In europe this is the dress code on the most popular bars.

Would you also please elaborate on your job watching a door?",,1335916027,1428836896,videos,3,0,t1_c4iy0og,t1_c4ixwmd,True,False,,,
SeanStock,t5_2qh1i,c4iy0tr,1,0,t3_t1cxm,0,False,"What do you mean it's not common. We all do it. Shit, we lost a bunch of spies in Europe in WWII to that.

It is silly. But it's how essentially all of us eat. Unfortunately, for most Americans, myself included, cutting steak with my left hand is about equally comfortable with writing with my left hand.

Edit: Apparently, you hold the knife in your right hand the whole time. That seems marginally easier, but I'd definitely have to concentrate.",,1335916045,1428836899,AskReddit,1,0,t1_c4iy0tr,t1_c4iuig2,True,False,,,
[deleted],t5_2qh68,c4iy2h2,4,0,t3_t1okd,0,True,"They got rid of that policy years ago when they couldn't find anyone qualified enough to run the company for their maximum wage.  I don't think most (if any) EU countries have maximum wages either so they tolerate the disparity as much as anyone else, it just doesn't seem to be as widespread there and even that is changing:

&gt; How excessive is bosses' pay in Europe? It has certainly risen sharply in the past ten years, as European firms have had to compete globally for talent. Foreign bosses now run seven of the firms in France's CAC 40 index and five of Germany's DAX 30. American-style bonuses and long-term incentive plans are now the norm.

They're opening their hiring pool to the rest of the world and finding many of the most qualified people are Americans with larger salary demands, which they're paying in order to help them compete globally.",,1335916258,1428836920,canada,4,0,t1_c4iy2h2,t1_c4iv8hd,True,False,,,
comrade_leviathan,t5_2qh3s,c4iy2za,2,0,t3_t1kd1,0,False,"Am I the only one confused by what the fuck ""Avengers Assemble"" is?  Is it some kind of European title or something?  Because I'm pretty sure the movie coming out this week is called ""The Avengers"".",,1335916324,1428836926,movies,2,0,t1_c4iy2za,t3_t1kd1,True,False,,,
ordinarypsycho,t5_2qh1i,c4iy3ju,3,0,t3_t1cxm,0,False,"Typically, Americans hold the knife in the right hand and the fork in the left, sometimes in a closed fist with the useful end of it sticking out on the pinkie side. They cut a piece (or pieces), then put the knife down and switch the fork to the right hand to consume the food.

The English/Europeans hold the fork in the left hand, typically in the fingers with the tines turned inward (that is, the concave side faces the  person holding the fork); and the knife in the right hand. They cut a piece and stab it, eating it while always keeping the tines curved inward.

Me (American), I don't switch hands because that's fucking stupid, but I'm uncomfortable with the full-on English/European method of fork-use. Instead I use my fork much like I would a spoon in my right hand; I cut with the tines curved inward, but then bring the food up so that the concave side is facing upward.

And now you all know my knife and fork habits. We're *that much* closer.",,1335916395,1428836934,AskReddit,3,0,t1_c4iy3ju,t1_c4isvih,True,False,,,
thinkforyourself,t5_2qh13,c4iy3q3,1,0,t3_t0f1p,0,False,I think that some folks in Europe may take offense to that assertion.,,1335916416,1428836944,worldnews,1,0,t1_c4iy3q3,t1_c4iq9dj,True,False,,,
rcsAlex,t5_2rfxx,c4iy4ps,1,0,t3_t1wy4,0,False,"CLG.NA, TSM, Dig from NA


CLG.EU, Moscow 5, SK from EU

MIG.Frost, Xenics Storm from KR

World Elite , CG  from China

I don't know enough from the Singapore region to make any predictions",,1335916549,1428836952,leagueoflegends,1,0,t1_c4iy4ps,t1_c4ivawc,True,False,01 team,,
[deleted],t5_2qm4e,c4iy4tc,3,0,t3_t1i3x,0,False,"One question though: Isn't body temperature also regulated completely autonomously? How come then there are people that are exceptionally good at wilfully regulating their own body temperature so that they can actually stay outside in freezing temperatures without clothes? For example tibetan monks meditating just in a robe or [this guy?](http://www.telegraph.co.uk/news/worldnews/europe/netherlands/3684102/Dutchman-aims-to-break-record-in-freezing-bath.html)

I'm genuinely curious, because if this part can at least in part be consciously directed couldn't adrenaline production as well?",,1335916561,1428836951,askscience,3,0,t1_c4iy4tc,t1_c4ist53,True,False,,,
ohgr4213,t5_2qzb6,c4iy6cc,11,0,t3_t1ygb,0,True,"Being an academic economist is very different in viewpoint than a person that specializes in actual trading advice. Krugman is an economist therefore very aware of large swathes of the academic literature and must be respected for that knowledge. 

That said Schiff focus' on investment, if I had to have one or the other put together my portfolio I would listen to Schiff. He may not be very aware of academic scholarship compared to Krugman but he is interacting with the market on a long term basis, this first hand experience provides him a different context, he see's things down to the level of actual investments rather than as and in terms of various aggregates. There are academic side Austrian economists who publish often and are active in the academic sphere, I think the context of their predictions would be more in line with where Krugman is approaching things. 

The money manager actually is a part of the market and has an intuitive sense of the market psychology that can only come by directly interacting with the market. The academic economist if you ask him the question ""what should I invest in to make money"" will just give you an icy stare, they get that all the time and usually it's a stupid question because that isn't what an academic economist focus' on. 

So an academic's forecast and a market managers forecast I see as very different in terms of what they are actually ""looking at things in terms of"" and what contextualizes their argument. 

We are by no means ""out of the woods"" as far as the downturn is concerned, therefore we have to wait to see what the next 5 years look like in terms of how to contextualize the current situation. If we or Europe are at the beginning of something like japan's ""lost decade,"" that will only be visible with time. There is no doubt that debt levels are at dangerous levels around the world creating a lot of hardship to be distributed in the years ahead, or we default or we hyper inflate to pay. Just 3 options. Even without hyperinflation, the dollar is steadily being undercut and will eventually be replaced by another currency which will cause the dollar overhang held by foreign investors currently to come home. ",,1335916761,1428836971,IAmA,11,0,t1_c4iy6cc,t1_c4ivy3h,True,False,,,
Dreissig,t5_2qh1i,c4iy6t7,2,0,t3_t2cf9,0,False,"No, they shouldn't be thankful. Being a spanish american with lots of friends from Latin America (who are mostly more amerindian than european), many of what you would call christians still at least believe in some type of pagan god. For example, I have a salvadorean friend that still believes(I think) the wind god for the weather, and a mexican friend who will say thank Huitzil or something like that in the way that christians say « thank God ».",,1335916817,1428836976,AskReddit,2,0,t1_c4iy6t7,t3_t2cf9,True,False,,,
lurkeringg,t5_2qhwp,c4iy782,1,0,t3_t1nv6,0,False,"No. Ladder games are hosted on battle.net. If you're lagging extremely hard, as in if you are disconnecting or missing tons of packages, then the game might be paused, but in that case the game times out pretty fast. Back in the WC3 days, swedes had a huge advantage playing ladder because they essentially played without lag(eu bnet servers where in sweden+their advanced infrastructure), while others had to deal with pretty bad delay.",,1335916871,1428836981,Games,1,0,t1_c4iy782,t1_c4iu54m,True,False,,,
gingerkid1234,t5_2qi67,c4iy7dx,2,0,t3_t1tv1,0,False,"Exactly.  The situation we're at is that when someone thinks of Jews, the first two things they think of are ""holocaust"" and ""Israel-Palestine conflict"".  Though those two things are important in Jewish history, it's like having the only takaway from America being ""civil war"" and ""cold war"".  Yes, those two things shaped America, but it's really not what America is about.

Similarly, though the holocaust profoundly affected Jewish history by completing the shift of Jewish culture out of Eastern Europe (emigration started at the end of the 1800's) by destroying things like Yiddish, and the Palestinian conflict has greatly affected Israeli culture (and, in turn, Jewish culture as a whole), those events alone don't speak to very much of what it means to be Jewish.",,1335916893,1428836983,Judaism,2,0,t1_c4iy7dx,t1_c4ixpwt,True,False,Blue,Traditional שומר מסורת,
NoMoreNicksLeft,t5_2qh1i,c4iy7qo,1,0,t3_t0829,0,False,"&gt; I am not going agree with the poor imitation statement because I have seen the amount of research people put into stuff like this.

Yes. We're well aware of the obsessive nerd effect. This is reddit after all.

&gt; Also there are so many pagan religions that its hard to make a blanket statement like that. 

There are many pagan religions that have never become extinct, if that's what you want me to concede. I am not trying to convince people that only the monotheist religions still exist in any ""true"" form or anything like that. The African Diasporic religions, every one of the 10 zillion religions throughout the Indian subcontinent, and even some bizarre ones in the Middle East still exist in their recognizably original forms, or at most they have evolved into something that shares continuity with the original. 

What I am saying is that the European pagan religions are all dead. The Norse pantheon, the Celtic pantheon, the Greek/Roman pantheon... and even some of the lesser-knowns (Etruscan, Slavic, etc). The Egyptian pantheon is dead... even if it wasn't thoroughly co-opted by the Ptolemies (is that spelled right?), Islam in the Nile delta would have wiped out any remnants centuries ago (No, Aleister Crowley doesn't count). 

These religions are dead. And if those who ""practice"" them want respect, I can give it to them as if they were dramatic re-enactors... but little else than that.

&gt; And obviously they stopped sacrificing because animals die. That's enlightened thinking.

I have no problem with animal sacrifice. If we can eat them to satisfy our need for hunger, then ritually slaughtering them to satisfy our need for superstition seems little different to me. If the worshippers of Odin had really survived and their religion had *evolved* into that, I wouldn't call it extinct. But you can't claim to revive a religion at the same time you're changing everything about it.

At best, it's a new religion ""inspired"" by the old. Any resemblance to traditional deities is purely coincidental, yadda yadda yadda.
",,1335916945,1428836989,AskReddit,1,0,t1_c4iy7qo,t1_c4ixyyx,True,False,,,
Hazardhunter,t5_2qh03,c4iy7tx,1,0,t3_t1lr3,0,False,"I played that game with a friend of mine. We would meet up every day after our school and play until we had to leave or he had to go for some lessons or training. After that, we meet in the evening again, and continued playing. It was really fun time.

We even managed to finish the game, meaning beating the Egg digimon that comes after Machinedramon. Well, we had the PAL (european) version tho', and there was a bug, that you could NEVER pass through that Agumon to Ogremon place. It just would never disappear - Sad day :x",,1335916957,1428836989,gaming,1,0,t1_c4iy7tx,t1_c4iszpy,True,False,,,
