archived,id,parent_id,created_utc,body,link_id,edited,subreddit,gilded,retrieved_on,author_flair_css_class,distinguished,score,controversiality,ups,author,name,score_hidden,author_flair_text,subreddit_id,downs,removal_reason
True,c587lzg,t3_vvzu0,1341188183,"Much of the earliest translation work in China was done by missionaries like Matteo Ricci. Obviously, it wasn't from Chinese to English, but used a range of intermediary languages. The Chinese had knowledge of Persian and a variety of Indian languages, and so did the Europeans, so they met somewhere in the middle and basically worked out the equivalents in Latin, from which they furthered translations to Portuguese, Italian, and later, English. However, English translations of Chinese words didn't really come into play in a big way until after Macartney in 1793, who wasn't even able to find someone to explain to him how important kow-towing is to the Chinese, in English.

As for your specific imperator/rex designation, it was because rex = 王, or sometimes translated as hegemon, because 皇帝 denoted the coming of a unified China in the Qin dynasty, instead of the more local hegemons and smaller states of the Spring/Autumn and Warring Nations periods. In fact Qin Shi Huang specifically made his title greater than the standard 王. So it's comparable. Yaoguai, if you break it down, 妖怪, they both carry the definition of evil and strange, so it's also analogous. I think for two very disparate language systems, there are a surprising amount of words that match up fairly well. Normally it's the very specific things that are region-specific that you'd have a harder time translating.

A lot of the more modern concepts also gets in from Japanese, everything from she hui 社会 for society to dian hua 电话 for telephones. I don't speak Japanese so I can't say for how they get their loan words, except their titles of nobility after the Meiji era were named in correspondance to British titles (Baron/Viscount/Earl/Marquess/Duke) and derives from some very, very ancient Chinese words that meant similar ranks (the __爵 construction) 

edit: Autocorrect blargh",t3_vvzu0,False,AskHistorians,0,1429275312,,,11,0,11,snackburros,t1_c587lzg,False,,t5_2ssp3,0,
True,c587n9i,t3_vvqxr,1341188374,"On July 1st 2012, the Finnish newspaper Karjalainen reported an incident involving Mekhissi-Benabbad at the European Athletics Championships in Helsinki. After the 3000 meter steeplechase final, Mekhissi-Benabbad pushed the games mascot who was trying to give him a small trophy. Inside the mascot was a 14-15 year old girl. His behavior was caught on camera and can be seen on Youtube. Another Finnish newspaper Iltalehti published pictures of the incident. He knocked the gift out of the girl's hands and pushed her. She had the wind knocked out of her but suffered no other injuries.

The incident on July 1st 2012 follows another incident involving Mekhissi-Benabbad, in which he fought with a teammate following a race. For his involvement in this confrontation, Mekhissi-Benabbad was suspended for 10 months.",t3_vvqxr,False,videos,0,1429275328,,,2,0,2,Hobbes86,t1_c587n9i,False,,t5_2qh1e,0,
True,c587ndu,t1_c585vlw,1341188392,Nonsense. Germany loves Europe so much it tried to ~~conquer~~ marry it twice.,t3_vw4gb,False,AskReddit,0,1429275330,,,47,0,47,TMWNN,t1_c587ndu,False,,t5_2qh1i,0,
True,c587nix,t1_c581fex,1341188413,"Civ 4+5 is $20 on Amazon atm.  Steamable and everything, though if you're in Europe, you'll need to make an account with a US address.  Doesn't come with the new DLC though.",t3_vvmxk,False,Steam,0,1429275333,,,1,0,1,Eldryce,t1_c587nix,False,,t5_2qwis,0,
True,c587ocr,t1_c585dgs,1341188530,Time to go to Europe! ,t3_vvpoo,False,IAmA,0,1429275343,,,1,0,1,AL_CaPWN422,t1_c587ocr,False,,t5_2qzb6,0,
True,c587pn1,t3_vweys,1341188722,"I guess you weren't here a few days back when thats all they did.

the way I see it, athiests are a lot more common in places with good education systems. These days, those places are usually ethnically christian (because the industrial revolution started in christian europe) so athiests are more likely to encounter christians and get in arguments with them. 

TL;DR athiests don't hate you more, you just happen to speak the same language.
",t3_vweys,False,atheism,0,1429275359,,,3,0,3,darwinatrix,t1_c587pn1,False,,t5_2qh2p,0,
True,c587qai,t3_vw84f,1341188814,"Got an old pax sivir skin used on EU-W, should work on EU-NE/NA
X?P?Y?6?G?M?P?2?W?M?3?A
",t3_vw84f,False,leagueoflegends,0,1429275368,,,1,0,1,eidarN,t1_c587qai,False,,t5_2rfxx,0,
True,c587r8g,t1_c587oms,1341188946,"You again, spouting more unreferenced bullshit. Our technology and expertise is not in any way ""lightyears"" ahead of Europe, whatever that even means.

And then there's this:

&gt; Thus we only give the productive members of society healthcare as you need a job to recieve it. This way the productive members of society dont have to pay for the non productive people.

This is false, not truthful at all. We have laws for getting healthcare to the poor and elderly. I suppose we could save a lot of money if we just let them die, as you suggest.",t3_vwepq,False,politics,0,1429275380,,,6,0,6,mutatron,t1_c587r8g,False,,t5_2cneq,0,
True,c587s62,t1_c587oms,1341189078,"Yeah, I get you, Poor people deserve to die because they are poor, and that is all you need to justify it.

You are so FREEDOM!

&gt; Our healthcare technology and expertise is lightyears ahead of europe , thus more expensive. Taxes alone could never pay for a euro system of healthcare in the united states.

You know that this is totally false? Watch anything other than Fox News",t3_vwepq,False,politics,0,1429275392,,,4,0,4,Velenor,t1_c587s62,False,,t5_2cneq,0,
True,c587t0q,t3_vw123,1341189203,"Hardcore is the best mode for me, not to slag it off but normal feels like it should be called easy mode due to the health regeneration and ability to survive half a mag of rounds. Add me, I play European servers mostly.",t3_vw123,False,ps3bf3,0,1429275403,Europe,,2,0,2,StevieG93,t1_c587t0q,False,PSN/Battlelog:StevieGrand93,t5_2sbem,0,
True,c587tn0,t1_c56v5to,1341189294,"no. success comes long term. Remember how people complain about our government being one of the most corrupt in the world? we may be back to those days. Besides the drug war, Mexico is growing in other areas like economy. You haven't heard about Mexico being in crisis these years despite the world economic situation. We're better now than most of Europe and Latin America. there's no chaos, just misinformation.

Sadly people get desperate, success comes in the long term. Our country was too fucked up? of course it takes time to get everything in order and peace.

If only americans stopped being so addicted or its government put an ending to marijuana criminalization.",t3_vr1uk,False,worldnews,0,1429275411,,,1,0,1,Muchoblue,t1_c587tn0,False,,t5_2qh13,0,
True,c587wez,t1_c587s5l,1341189684,"there was no asia market when they created the na / eu Servers and for korea where the internet connections are very good, their ping to na is more than 200 ... so no real reason",t3_vw84f,False,leagueoflegends,0,1429275447,,,1,0,1,SL_sTyX,t1_c587wez,False,,t5_2rfxx,0,
True,c587wl6,t1_c587oms,1341189711,"&gt; The united states is a country , with more people than any single euro country.

Yeah, the US is bigger than any given Euro country. I've never understood the argument that because the US is big, it cant apply similar polices to a smaller country. Have you never heard of [economies of scale ](https://en.wikipedia.org/wiki/Economy_of_scale), which is something fragmented European militaries dont benefit from, but a large unitary US military benefits from.

&gt; Our healthcare technology and expertise is lightyears ahead of europe

That's not been my experience. I've flown to Romania and India to receive treatments which are more advanced, cheaper, faster and with better skills and service that I could receive in the US.

&gt; Taxes alone could never pay for a euro system of healthcare in the united states.

Why not?

&gt; Thus we only give the productive members of society healthcare as you need a job to recieve it. This way the productive members of society dont have to pay for the non productive people.

This is the key isn't it? The sneaking feeling that there are freeloaders out there who might gain something at your expense.

&gt; its a superior system in function , the only reason its an issue now is employment is so low. 

And most of those unemployed would dearly love to be employed; their unemployment is a result of forces outside of their control. And if they should fall ill while unproductive, meh, they should die.

What if I told you that it is the policy of all western governments to not allow unemployment to fall below a certain level, because full employment creates inflation. That's not the problem in the US today, because unemployment is too high, but eventually, unemployment will fall, and which it falls too much, actions will be taken to keep it above a certain level.

So, given that the government ensures that there will always be unemployed people, shouldn't it take some some responsibility for the consequences of those polices?",t3_vwepq,False,politics,0,1429275450,,,3,0,3,apackofwankers,t1_c587wl6,False,,t5_2cneq,0,
True,c587wy9,t3_vw68c,1341189761,"[My EU HC 60 WD](http://i.imgur.com/0vC7g.png)

72k HP.",t3_vw68c,False,diablo3,0,1429275455,,,1,0,1,arex1337,t1_c587wy9,False,,t5_2qjhk,0,
True,c587xoh,t1_c587xc1,1341189860,21 sec - gone on eu w,t3_vw84f,False,leagueoflegends,0,1429275463,01 team,,1,0,1,Torchi12,t1_c587xoh,False,,t5_2rfxx,0,
True,c587xvf,t3_vvltc,1341189883,"Good information, though I can't agree with number 14.)  I find that threatening to call your embassy is usually enough to freak out any sketchy, Eastern European cop.  Bribe is last resort.  ",t3_vvltc,False,travel,0,1429275467,,,2,0,2,unclejones666,t1_c587xvf,False,,t5_2qh41,0,
True,c587y0a,t3_vwbh4,1341189903,"I also liked this photo from that series: http://www.gazzetta.it/gallery/Europei2012/06-2012/partite-italia/variabili-911703343690.shtml#1
Shows that it's all about the spirit of competition.",t3_vwbh4,False,soccer,0,1429275469,,,22,0,22,nakedlarissa,t1_c587y0a,False,,t5_2qi58,0,
True,c587ysb,t3_vwd0b,1341190009,"I think a lot of the Islamist activities that are considered terrorist or violation of human rights and gender equality are because the politics of nations that are predominantly Islam are not as liberal or democratic as Christian nations. Countries that are democratic, such as those of Western Europe, the US, and Canada, make it seem like Christianity is better than Islam just because their government grants people more rights and is not as corrupt. Predominantly Islamic countries are headed by dictators or officials 'elected' under questionable circumstances and wrongful acts that are associated with the Islamic religion are more associated with the religion rather than the horrible state of government.",t3_vwd0b,False,TrueAtheism,0,1429275479,,,6,0,6,opus666,t1_c587ysb,False,,t5_2soy6,0,
True,c5880zd,t3_vvoso,1341190319,"Ganking may see a resurgence in dota2 in the next months because there are only 2 pushers yet to be ported to a bajillion popular gankers and carries.

Morphling and Leshrac being so much stronger in dota2 are two large components to the metagame getting stale, but that can also be attributed to europeans and americans being the predominant force in terms of numbers.

I am sure that as we see a spectre once every couple months we might see a Medusa pick aswell, however don't expect her to be a common pick.",t3_vvoso,False,DotA2,0,1429275507,teameg,,1,0,1,reekhadol,t1_c5880zd,False,,t5_2s580,0,
True,c58817b,t1_c58716v,1341190349,"California here, too. Southern California, to be a little more specific since my state is the size of several European countries. XD",t3_vw2t4,False,mindcrack,0,1429275511,specialmoderator,,3,0,3,JustVan,t1_c58817b,False,Ubiquitous,t5_2to85,0,
True,c58831r,t1_c586hf1,1341190607,"WTF? Water boils at 100. How can the weather hit 110 in Knoxville? Is it in some big pressure cooker?

Look - you're living in Europe now! We don't like to boil over here.",t3_vvupp,False,atheism,0,1429275534,,,2,0,2,Macb3th,t1_c58831r,False,,t5_2qh2p,0,
True,c5883qr,t1_c583q73,1341190708,"Ahhh, foreigners in overwhelming Europe with their backwards ways, all sounds rather familiar.",t3_vvtdv,False,Israel,0,1429275543,,,-1,0,-1,iluvucorgi,t1_c5883qr,False,,t5_2qhvo,0,
True,c5883zi,t3_vw5jq,1341190740,"In the US they keep cats, in Europe we keep kids.",t3_vw5jq,False,gifs,0,1429275546,,,0,0,0,ShortersGonnaShort,t1_c5883zi,False,,t5_2qt55,0,
True,c588479,t3_vwfzi,1341190770,"I would say a lot of us are European,maybe not though.
Never tried it actually,i have been frequently annoyed at good youths begin blocked by that draft thing,how does that work?

I may try it out,im looking for a new team to take over atm",t3_vwfzi,False,footballmanagergames,0,1429275550,,,1,0,1,Dave1711,t1_c588479,False,Hyde,t5_2s0w5,0,
True,c5884yt,t1_c582apn,1341190873,"Wikipedia disagrees with you, but maybe you have more recent information.

https://en.wikipedia.org/wiki/Triclosan#Resistance_concerns

&gt;An article coauthored by Dr. Stuart Levy in the August 6, 1998 issue of Nature[19] warned that triclosan's overuse could cause resistant strains of bacteria to develop, in much the same way that antibiotic-resistant bacterial strains are emerging. In 2003, the Scottish Sunday Herald newspaper reported that some UK supermarkets and other retailers were considering phasing out products containing triclosan.[20]

&gt;It has since been shown that the laboratory method used by Dr. Levy was not effective in predicting bacterial resistance for biocides like triclosan.[21] At least seven peer-reviewed and published studies have been conducted demonstrating that triclosan is not significantly associated with bacterial resistance over the short term, including one study coauthored by Dr. Levy.[22]

&gt;Some level of triclosan resistance can occur in some microorganisms, but the larger concern is with the potential for cross-resistance or co-resistance to other antimicrobials. Studies investigating this possibility have been limited.[23] The European Commission Scientific Committee on Consumer Safety (SCCS) concludes that to date, there is no evidence that using triclosan leads to an increase in antibiotic resistance. However it is too early to say that triclosan exposure never leads to microbial resistance, as there is not yet enough information to make a full risk analysis.[24]


http://online.liebertpub.com/doi/abs/10.1089/mdr.2006.12.83   
http://www.ncbi.nlm.nih.gov/pmc/articles/PMC478530/?tool=pmcentrez",t3_vv8bt,False,askscience,0,1429275559,,,1,0,1,[deleted],t1_c5884yt,False,,t5_2qm4e,0,
True,c58858c,t1_c5883qb,1341190914,"Yeah it's kind of hard to do that.  It was just as surreal in the Old South Meeting House knowing that I was standing in the same room that many of the heroes of our history books stood.  

I've been in churches that were hundreds of years old in Europe but its a pretty rare thing in this country. ",t3_vwgki,False,pics,0,1429275562,,,2,0,2,yoinkmasta107,t1_c58858c,False,,t5_2qh0u,0,
True,c5887rh,t3_vw7t1,1341191271,"After watching the duplicity of the EU in the fall of Libya and the haggling for oil contracts and access there as NATO effected regime change, I can only hope Iran hangs tough and in the end screws as many of its old EU customers as possible.",t3_vw7t1,False,worldnews,0,1429275596,,,1,0,1,windynights,t1_c5887rh,False,,t5_2qh13,0,
True,c588acg,t3_vug3o,1341191635,"Was it intentional that the photo was taken at a intersection with route 123 in VA?

I've thought about buying one for a while. I think it'd make a more enjoyable ""rolling restoration"" than most 1970s cars. I'd want to find a European model with the smaller bumpers and glass headlights.",t3_vug3o,False,Autos,0,1429275631,flair-default,,1,0,1,AKADriver,t1_c588acg,False,Mazda2,t5_2qhr3,0,
True,c588c4l,t1_c5885hj,1341191885,"&gt; A dhimmī is a historical[1] term referring to non-Muslim subjects of a Muslim state.[1]
Dhimma allows rights of residence in return for taxes.[2] According to some scholars, dhimmis would have the same social responsibilities and rights as Muslims.[3][4] They were excused or excluded from specific duties assigned to Muslims, and otherwise equal under the laws of property, contract and obligation.[5] http://en.wikipedia.org/wiki/Dhimmi

http://en.wikipedia.org/wiki/Arab_Christians#Arab_Christians_today

despite the Muslim Mughal empire ruling in most of India for 250 years the vast majority of India is still Hindu majority http://www.mapsofindia.com/maps/india/religionsinindia.htm

&gt;The golden age of Jewish culture in Spain coincided with the Middle Ages in Europe, a period of Muslim rule throughout much of the Iberian Peninsula. During that time, Jews were generally accepted in society and Jewish religious, cultural, and economic life blossomed. http://en.wikipedia.org/wiki/Golden_age_of_Jewish_culture_in_Spain

This in in direct contrast to what the Christian rulers did when they controlled Spain, notably the the expulsion or forced conversion of all Jews (and Muslims for that matter)",t3_vvrrq,False,DebateReligion,0,1429275654,,,1,0,1,TheOneFreeEngineer,t1_c588c4l,False,Panentheist Muslim,t5_2snuc,0,
True,c588cxs,t1_c587f65,1341192005,"it's way better than ""Ai Se Eu Te Pego""",t3_vw531,False,soccer,0,1429275664,72,,1,0,1,Fredigundo,t1_c588cxs,False,Brasil,t5_2qi58,0,
True,c588da0,t1_c5884vj,1341192055,"and who do you think perpetuated the dark ages? plus, Turkey and India were stagnating, and china was still ahead, with printing presses, fireworks, and all that shit. They kept developing while europe got the runoff until they stagnated.",t3_vvv0b,False,todayilearned,0,1429275669,,,0,0,0,spartaninspace,t1_c588da0,False,,t5_2qqjc,0,
True,c588de7,t1_c587y5q,1341192070,"I'd say it's amazing how they seem to have no special regard for the First Amendment. You'd think one or two of them would have realized, during their planning for this raid, that they were setting the grounds for a major, major lawsuit. But then it's the taxpayer's money, so perhaps it never crossed their minds. 

Boggles the mind, the more I think about it. ""Let me get this straight. Unemployment is rather frightful at the moment, and it's an election year when incumbents actually have to worry about their cushy jobs; Western Europe is undergoing some of the worst stress it has seen in a century, and China is rather hungry for the resources we all share at the moment; in the midst of all of this, we have an American police force, American like 'Home of the Brave, Land of the Free,' with so much free time and largess on its hands, that it can afford to go for joyrides with the SWAT team, deeming a teenager, who is exercising one of his many enumerated and protected rights, as a threat to our way of life. An angsty teenager (everyone during those years, don't lie), having an emotional outburst on an online forum, necessitates planning and executing an invasion of his home and property, because some of the things he said got to a few of the adult, and supposedly wiser, officers charged with upholding the public trust and assessing real threats. They do not find him in the basement putting together an improvised explosive device, blueprints covering the walls; they find him, like most college students, watching TV.""    ",t3_vvme3,False,Bad_Cop_No_Donut,0,1429275670,,,4,0,4,rossryan,t1_c588de7,False,,t5_2qqdb,0,
True,c588eme,t3_vw7xf,1341192235,"very common question that seems to stump a lot of people.

someone may have already, but let me explain;

before the number 0, people really didn't give any 'fuck' as we tend to accept the act of open 'fuck giving' in today's world. this is due to the culture of 'pre-fuck-giving' humanoids. their culture rarely called for a fuck to be given, for example:
Atlantis sinking? that shit's gone. not a fuck to count, so no numerical value was needed to express this fact, it was simply known.

now, the Mayan's had an interesting interaction; when the Europeans came on their ships and horses, the Mayan's had never seen this before, and fell into old customs; not giving a fuck. but they got pretty freaked out, and some started giving fucks, so to dusting those who simply didn't give any fucks, and those who did, the Mayan's came up with the concept of zero.",t3_vw7xf,False,shittyaskscience,0,1429275686,,,1,0,1,relaxrecaprelapse,t1_c588eme,False,,t5_2sw51,0,
True,c588et8,t1_c587ny6,1341192256,"Well, the gems would cost 500k or 140k to make so that seems like something i would rather do!

The EU market wasn't quite as high, there was a 833 weapon for 100k buyout, i'll check over the next couple of days more closely to see if there is any good deals popping up!",t3_vwbqj,False,Diablo3Strategy,0,1429275688,,,1,0,1,magojo,t1_c588et8,False,,t5_2u5co,0,
True,c588frb,t1_c587mez,1341192387,"Tianjin Mandarin, Sichuan Mandarin, these are regional dialects.
The state of cantonese, like Min Nan, Wu, Gan, and a few other varieties, is much more complex.  The most basic way to sum it up is that these forms are separate spoken languages, that share a unified written form.

To say that they are ""regional dialects"" is to be ignorant of the linguistic history of China.  To be ignorant of the amazing accomplishment the singularly unique chinese script had in keeping China unified for the last two thousand years.  The linguistic variety of China, as any international linguist would tell you, is similar to the linguistic variety of the Romance languages - and you know how Europe turned out: while China has remained a single nation, Europe never stopped warring with themselves.

I love how you supposed ""China-lovers"" never seem to know anything about your own history before 1949.",t3_vvynl,False,worldnews,0,1429275701,,,25,0,25,contrapunctus9,t1_c588frb,False,,t5_2qh13,0,
True,c588gdd,t1_c588av6,1341192479,"&gt;If I'm willing to hunt through every last pair of jeans in a shop I can find the one pair that fits me it seems.

Consider yourself lucky. Closest I've ever found was 30W36L. And those will still fall off of me eventually without a belt.

&gt;I like the rolled sleeve look, which is wonderful since that's my only option if I don't want to spring the obscene amount of money for a French-cuff shirt.

I'm in the same boat, there. I just go for the rolled back sleeves look, as well. Still difficult to find ones that fit my frame, even still. Apparently I should start looking into European cuts.",t3_vvv7p,False,tall,0,1429275709,blue,,1,0,1,Owy2001,t1_c588gdd,False,"6'4"" | 193 cm",t5_2qv8g,0,
True,c588io9,t1_c585nmx,1341192802,Can you see the Eastern Europeans going on sprees round B &amp; Q?,t3_vvdnm,False,unitedkingdom,0,1429275739,,,1,0,1,Vomitdog,t1_c588io9,False,,t5_2qhqb,0,
True,c588lb3,t3_vvqxr,1341193174,"Take the 14 year old girl part out of the title, he had no clue it was a 14 year old girl. It should read ,
""Runner wins 3000m EU championship race - proceeds to slap gift bag out of  mascot's hand and pushes him away - [0:15] ",t3_vvqxr,False,videos,0,1429275774,,,5,0,5,[deleted],t1_c588lb3,False,,t5_2qh1e,0,
True,c588mdw,t1_c584lj9,1341193331,"Actually, I don't like being called white either, as that is no part of my personal identity, and I regard it as a fictional entity.  I'm (mostly) Caucasian or perhaps European, or perhaps more specifically NW European, or even more specifically by my known antecedents, though that gets cumbersome.  Even culturally speaking, and just about the U.S., there isn't any such thing as 'white' culture.  There are a lot of different cultures that 'white' people might belong to (including 'black' culture, ironically), a number of which are somewhat mutually exclusive.  For this reason, I also dislike the 'of color' moniker as it sets an artificial divide between European descendants and everyone else, when there is coherent feature about the people on either side of that dividing line.",t3_vw07r,False,lgbt,0,1429275789,,,1,0,1,iongantas,t1_c588mdw,False,,t5_2qhh7,0,
True,c588myh,t1_c588hkn,1341193415,"I've never ""mooched"" a thing, don't desire to do so, and I'm not quite sure where you acquired that assumption.

A hardworking ""blue-collar"" person need not be a small-government turtle in a shell grasping a bible.

You want to talk recession, see; WARS/DEFENSE and NATIONAL LEVEL GAMBLING WITH OUR ASSETS.

I'd rather take care of my neighbors than have pissing contests with other nations, or placing bets on risky/illegal interests.

Even with money/debt as potential fallout, I'm glad to see some of those old archaic ideals DIE once in awhile.

If we had it your way, we'd all remain at a standstill, while other developed nations make actual progress. Look to the Northwest parts of Europe. Proof is there.

Colonial days are over, time to move on.



",t3_vvon3,1341194308,politics,0,1429275795,,,3,0,3,xhosSTylex,t1_c588myh,False,,t5_2cneq,0,
