score_hidden,gilded,id,subreddit,created_utc,removal_reason,body,name,subreddit_id,author_flair_text,score,ups,controversiality,retrieved_on,edited,downs,author_flair_css_class,archived,distinguished,link_id,parent_id,author
False,0,cjdig91,h1z1,1406851252,,What do you mean? An African or European swallow?,t1_cjdig91,t5_31a08,,10,10,0,1435007348,False,0,,True,,t3_2c9zyv,t1_cjdg0o7,RomuRaf
False,0,cjdigtr,PuzzleAndDragons,1406851290,,"This post has the answers to your question, from whoever controls the EU Pad FB account:
https://www.facebook.com/PuzzleAndDragonsEurope/photos/a.441707025933609.1073741828.441177295986582/551249041646073/?type=1&amp;relevant_count=1

A lot of people asked the same question (this was for the previous godfest) and they answered them all, but this probably the most concise and clear:
http://puu.sh/azvTw/98ca1a46f7.png
",t1_cjdigtr,t5_2w23a,"372,325,302",1,1,0,1435007361,False,0,2,True,,t3_2c9wwx,t3_2c9wwx,Puzzles_and_Pooky
False,0,cjdih92,ukpolitics,1406851318,,"So what, Cameron also said he would hold a referendum on the EU.",t1_cjdih92,t5_2qhcv,,0,0,0,1435007373,False,0,,True,,t3_2c8aqz,t3_2c8aqz,MrHaHaHaaaa
False,0,cjdiht4,MURICA,1406851354,,"Spent last summer vacationing through Europe with a couple of Belgians.  Some Belgians we're complete dicks, emulating our accent and screaming ""Murica!!!"" every time they saw us.  Otherwise Belgians were very cordial.  The Germans ignored us and the Belgians.  British and French people were nice to us (though we did see some Parisians throw eggs at tourists of unknown nationality.) I think it helps to dress similar to the people of the country and to act as modest as possible to avoid problems.
",t1_cjdiht4,t5_2u28p,,6,6,0,1435007388,False,0,,True,,t3_2c9eli,t1_cjdhpfn,frostfromfire
False,0,cjdiibg,exmuslim,1406851388,,"Europe in general needs tougher laws on immigration I feel, as much as I hate Islam as an ideology and how monolithic Muslim societies can get, it is outright bigotry to make things harder for a person because of where he comes from.

That Muslim doctor they turned away for being from Saudi Arabia could have been the one that saved your life.

The Dutch have a huge problem with racism especially their right wing politicians. To them it's more about no more dirty maroc turk paki rapist savages and ""saving the white race"" than protecting society from extremism. 

Hell imagine if you were a non-muslim trying to escape from a warzone, nope sorry gotta wait so we can do a thorough background check because you're coming outta Syria and that's one of them Muslim countries.

Now don't get me wrong if the Dutch want less ethnic people because they want to 'preserve' their race then power to them I'm all for cultural preservation, heck I wouldn't marry a non-Arab and I believe everyone has the right to that principal but when running a first world country you shouldn't be impacting some one elses freedoms for your own personal belief. Are Muslims entitled to immigration in the west? Fuck no. Are people who could potentially be in danger but not in a situation to get asylum liable for a helping hand? Hell to the fucking yes, as a government you should help those poor people out of there.",t1_cjdiibg,t5_2s7k2,,6,6,0,1435007386,1406851847,0,bold,True,,t3_2c9ajz,t3_2c9ajz,Akkadi_Namsaru
False,0,cjdiirj,Israel,1406851416,,"With the antisemitism and islamphobia creeping into the politics of Europe and the anti-immigration zeal that America exerts, I'm losing faith in the existence of multiculturalism in the west.",t1_cjdiirj,t5_2qhvo,,2,2,0,1435007396,False,0,,True,,t3_2caddv,t3_2caddv,qmechan
False,0,cjdiiuw,MH17,1406851423,,"&gt; You are accusing Russia so the burden of proof is on you

I've not accused Russia of anything. In fact, I said specifically we don't know if Russia provided the BUK and crew. 

&gt;there is no hard evidence that Russia gave arms to the separatists

Reuters reported on [compelling evidence that shows exactly that](http://www.reuters.com/article/2014/07/29/us-ukraine-crisis-arms-specialreport-idUSKBN0FY0UA20140729) today. 

&gt;your assumption that the separatists even had Buks is flawed.

As pointed out earlier, the Rebels themselves admitted having operational Buks in response to the July 14th shoot downs bragging they [ 'downed plane from SAM ""9K37M1"" (better known as the ""Book"")'](http://www.vz.ru/news/2014/7/17/696045.html). 

How about the [DNR's own tweet](http://blog.storyful.com/wp-content/uploads/sites/5/2014/07/Screen-shot-2014-07-19-at-12.56.15-PM.png)?

Multiple images of the Rebel Buk geolocated to Torez   
([Image one](https://pbs.twimg.com/media/Bs2XzV6CIAA3MxQ.jpg:large) is [geolocated here] (https://www.google.com/maps/place/48%C2%B001'28.9%22N+38%C2%B036'56.1%22E/@48.0244266,38.6163938,307m/data=!3m1!1e3!4m2!3m1!1s0x0:0x0?hl=en),
[Image two](http://i.dailymail.co.uk/i/pix/2014/07/18/article-2696847-1FC15FB600000578-889_962x638.jpg) is [geolocated here](https://www.google.com/maps/@48.0154419,38.7634964,597m/data=!3m1!1e3?hl=en-US))
were seen before July 17th.

On July 17th [the AP reported Rebels moving a Buk through Snizhne](http://www.huffingtonpost.com/2014/07/25/ukraine-buk-missiles-ap-journalists_n_5622111.html?utm_hp_ref=mostpopular) in the hours before MH17 was downed.

&gt;If you cant prove Buks you have no proof

So given we **can** prove Buks from multiple independent sources?

&gt;for the Snezhne launch there is zero evidence

You're almost right, if by zero you mean 'a lot more than zero'.

All the evidence listed above shows Rebel Buk in and around Snizhne.

There's this [Torez local](https://twitter.com/WowihaY/status/490181213890830336/photo/1) who used eyewitnesses who saw the launch to locate the actual launch site.

Then this guy [who geolocated the picture released by SBU](http://ukraineatwar.blogspot.com/2014/07/launch-location-detected-of-missile.html)

And the journalist who visited the site and [found burn marks consistent with a Buk launch site](http://www.telegraph.co.uk/news/worldnews/europe/ukraine/10984530/MH17-the-clues-which-may-lead-to-missile-launch-site.html) according to Russian Military expert Igor Sutyagin.

&gt;it is pure speculation by the Americans

US State departments or government agencies provided zero of the above pieces of evidence.

&gt;another post here on Reddit tell that soldiers on the ground are drinking beer from bottles

But that's from an unverified speculative claim that the reason US hasn't released [satellite pictures because they show drunk Ukrainians operating the Snizhne launch Buk](https://www.google.com/webhp?sourceid=chrome-instant&amp;ion=1&amp;espv=2&amp;ie=UTF-8#q=us+satellite+ukrainian+uniforms+drunk).

Surprising that with such stringent requirements for evidence you would state as fact a claim that is pure conjecture. Hopefully I've been able to expose its origins and unreliability.",t1_cjdiiuw,t5_32luw,,5,5,0,1435007407,False,0,,True,,t3_2c8h70,t1_cjdfyxk,WalkingHumble
False,0,cjdijvy,AskReddit,1406851493,,I'm going to Europe very soon! ,t1_cjdijvy,t5_2qh1i,,4,4,0,1435007430,False,0,,True,,t3_2cab4b,t3_2cab4b,Zoo12
False,0,cjdik5s,DotA2,1406851510,,"""for us"" you mean for you.. no problem with douyu in central eu",t1_cjdik5s,t5_2s580,gg go next,4,4,0,1435007432,False,0,jakiro,True,,t3_2c957h,t1_cjd9g2j,Nolfator
False,0,cjdim77,funny,1406851641,,"Poor title.  Should be ""Europeans Stuck in Playground Equipment.""  First dude looks American however.",t1_cjdim77,t5_2qh33,,0,0,0,1435007471,False,0,,True,,t3_2c7g2g,t3_2c7g2g,arschfrissthosen
False,0,cjdims0,europe,1406851677,,"Remember that whole NSA spying on Germany thing? The whole EU was pissed off and ready to challenge America back then. 

Now everyone is kinda glad the US is spying on the Germans and only Germany still cares. ",t1_cjdims0,t5_2qh4j,Ỏ̷͖͈̞̩͎̻̫̫̜͉̠̫͕̭̭̫̫̹̗̹͈̼̠̖͍͚̥͈̮̼͕̠̤̯̻̥̬̗̼̳̤̳̬̪̹͚̞̼̠͕̼̠̦͚̫͔̯̹͉͉̘͎,1,1,0,1435007483,False,0,UKGB,True,,t3_2c6hid,t1_cjcikcg,hmunkey
False,0,cjdimw0,worldnews,1406851684,,"Relocating all these settlements before a peace agreement is reached is not possible in the current climate any more than expecting the Palestinians to denounce their right to return to Israel. Both things will likely happen when peace talks will eventually happen, but both sides are refusing to take any significant steps as they could (and probably would) be used against them during the negotiations.

Your right, many Israelis don't believe a peace agreement is going to happen in our life time. They have extremely bad experience from previous one sided withdrawals (Gaza/Lebanon) and don't particularly trust the Hamas (which is recognised as a terror organisation by the US/EU). 

Tell you what though, lets start by a small step, do you think we can get Hamas to recognise Israel right to exist as a Jewish state before we demand Israel to evict all these settlements? ",t1_cjdimw0,t5_2qh13,,1,1,0,1435007497,False,0,,True,,t3_2c8i8w,t1_cjdiejq,digiphoenix
False,0,cjdine1,AskReddit,1406851717,,"AVS (address verification) is only done in the US/CA and one or two European countries. 

&gt;  almost every single site in the world compares billing with credit card address.

The banks themselves don't support this feature, so even if the website is a US website, they can't verify with your international bank that your billing zip is correct, not to mention that zip codes and postal codes don't exist in every single place in the world.",t1_cjdine1,t5_2qh1i,,1,1,0,1435007505,False,0,,True,,t3_2byrpj,t1_cjagrfq,weclock
False,0,cjdioyl,leagueoflegends,1406851816,,"Man, it's so weird that Annie, Fiddlesticks, Janna, Jayce, Karma, Kennen, Lissandra, Pantheon, Shen, Sivir, Soraka, Wukong, and Xin Zhao didn't even get picked once this split despite having presence for at least most of one split in the past year or so (although, I guess Fiddlesticks and Soraka were more popular internationally than in EU by a decent amount, but Liss was definitely a more EU-centric pick.",t1_cjdioyl,t5_2rfxx,,2,2,0,1435007527,False,0,team 07,True,,t3_2ca5rf,t3_2ca5rf,zanotam
False,0,cjdiqbw,TumblrInAction,1406851903,,"Christianity has had an overall positive effect on the West, so in the end it kind of worked out well for them, so I can't see why of all the other things invading Europe at this moment he would choose Christianity. But then again he is a black metal musician who kills people so...",t1_cjdiqbw,t5_2vizz,(TM),1,1,0,1435007566,False,0,,True,,t3_2c9p1m,t1_cjdicol,RedditReddiRedd
False,0,cjdir0y,AskReddit,1406851951,,The danger of experiencing war first hand in once lifetime. Even if you live in North America or Western Europe.,t1_cjdir0y,t5_2qh1i,,1,1,0,1435007582,False,0,,True,,t3_2ca9rn,t3_2ca9rn,treehopper
False,0,cjdir2l,australia,1406851954,,"Do you expect a huge employment loss in Germany now that they're increasing their minimum wage from 0 to $11.37? Looking at what happened when they introduced minimum wages in other countries, I think you will be disappointed. The connection between employment and minimum wage isn't nearly as clear cut as people like you like to suggest. The countries with the lowest unemployment in Europe without a national minimum wage also basically have de facto minimum wages through sector wide union wages for almost all jobs.",t1_cjdir2l,t5_2qh8e,,1,1,0,1435007578,False,0,,True,,t3_2c4rom,t1_cjdh9ow,metadinex
False,0,cjditno,leagueoflegends,1406852126,,I wish the NA/EU scene had more show matches like they have in OGN with the masters/legends matches,t1_cjditno,t5_2rfxx,,2,2,0,1435007631,False,0,velkoz,True,,t3_2c9txc,t1_cjdcjl4,2ndComingOfAugustus
False,0,cjdiu0h,letsplay,1406852149,,"Went from 150 meg fiber (only 12 upload tho) to 3 down 1 up, stopped twitch streaming after I moved, however twitch in my experiences has always been awful whenever I watch a stream it skips frames I can never understand a full sentence because it skips, I used to watch my twitch streams on my phone as I streamed and for me it wouldn't stream, but viewers reassured me it was fine on there end, Across multiple computers and multiple internet connections never can get twitch to stream but apparently I was able to stream to it fine

, I watch the co optional podcast when that's on, after about 30 mins it starts to stabilize and become watchable,  to watch E3 I tried twitch, unwatchably choppy, tried IGN, HD 1080p no problem (this was back when I had 150 meg) some say twitch has terrible EU servers, but I have other UK friends who have no issues, so i dunno what it is. ",t1_cjdiu0h,t5_2qss1,YouTube.com/gobbybobby2,2,2,0,1435007630,False,0,,True,,t3_2c8vw8,t3_2c8vw8,gobbybobby
False,0,cjdiu47,worldnews,1406852156,,"And as Europe, Japan, South Korea and Israel are thriving, how many Latin American countries were put down because of dictatorships promoted by the USA?

How many African countries are fighting wars promoted by its military?

How many terrorists in the Middle East were trained by their secret services?

What is good for some may not be good for others.

Of course its a lot better than, say... the Western Roman Empire. But it has its flaws. We can't know for sure if the benefits for some countries outweigh the cons for the rest. The only thing we can do at this point is... deal with it. For better or worse.",t1_cjdiu47,t5_2qh13,,0,0,0,1435007632,False,0,,True,,t3_2c7qxm,t1_cjdfuzs,8ace40
False,0,cjdiu77,podemos,1406852162,,"En este tema hay que ser categórico y estricto. Lo importante no son la cantidad de Km2, sino cómo, quién, dónde y en base a qué interés o intereses se toman las decisiciones que afectan al uso, gestión y rendimiento de esos km, y de lo que es más importante, los servicios, obligaciones y derechos de las personas que en ellos habitan. Puedo asegurar que organizar una simple y pequeña comunidad de vecinos, de escasos 1000 m2 en horizontal, no la hace ni más ni menos ""hermosa"" que otra de 2000 m2 con el doble de vecinos, o con la mitad. La ""hermosura"" se mide en otras cosas como la educación, el respeto, o la convivencia armónica, por citar algunas, y eso no se consigue sólo cambiando los estatutos (léase constitución) o determinando de una manera más justa el pago de las cuotas comunitarias (léase esfuerzo fiscal, por ejemplo). Hay quien pretenderá irse a vivir al campo y pasar de sus vecinos, pero eso es caro..... diría que muy caro y sólo al alcance de quien pueda permitírselo. Es España sola, sin Europa y ya no puede.... pensar en una bonita independencia, a día de hoy, es soñar, o estar dispuesto a pasarlas francamente mal a la hora de pagar las facturas de todos los gastos corrientes, energia, seguridad, comunicaciones..... Por contra hay quien dice que la unión hace la fuerza y es una gran verdad, pero ¿cuales son los limites de esa unión? ¿Nos vamos a tener que casar tod@s con tod@s y hasta hacer cama redonda, hablando en bonito arameo? Establecer y organizar la unión de los pueblos que la componen como un sólo país es el reto que tiene Europa por delante, con su denostada y olvidada Constitución Europea, y España también, pues el sistema autonómico (qué invento más salomónico, la famosa LOAPA) que surge en la transición está caducado, y es inviable económicamente, pues sólo servía para poder hacer la transición de la dictadura a la partitocracia. Ahora nos toca pasar a la democracia de una vez, sin miedos ni ataduras, con la resistencia de los políticos de la casta, herederos de los privilegios que en otro tiempo detentaban los militares que ejercían el poder en España. Poco importa la nomenclatura, Estado Federal, República Indiochinisa, Unión de Reinos Ruinosos, Imperio del Burbón o Casa Lumys SA, que es a lo que más nos asemejamos actualmente. Lo importante y básico es ++++++ y + Democracia pura y dura, dicho así, a lo bruto.Salud.",t1_cjdiu77,t5_31h78,,2,2,0,1435007633,False,0,,True,,t3_2c7ymy,t3_2c7ymy,Chorro
False,0,cjdiv0i,worldnews,1406852217,,"Hamas is a terrible organization. But if you read their demands, each one is reasonable. They want freedom for an oppressed people. They go about it in an awful way, but that does not absolve Israel of the crime of oppression. And yes there are more Arabs states. That's probably because unlike the people of Israel, the Arab states have populations that are native to the land, not transplanted from Europe and North America (I debated if I was going to respond to that point because it is completely irrelevant). Go on google maps and compare Gaza is Israel and tell me who the bully is.  Look at all that land farm land Israel has near the border and realize that those farms used to be how the people of Gaza feed themselves.  Justify the settlements. Justify the famous land grab map ( http://www.kadaitcha.com/wp-content/uploads/2009/01/palestineshrinks.jpg). The people of Israel need to be safe, but that won't happen as long as they are occupying, blockading, and settling  Gaza and the West Bank. No people on earth would not fight back against that. ",t1_cjdiv0i,t5_2qh13,,1,1,0,1435007649,False,0,,True,,t3_2c8i8w,t1_cjdifh7,ryan924
False,0,cjdiv3x,DotA2,1406852224,,so just europe? no news on NA at all?,t1_cjdiv3x,t5_2s580,,2,2,0,1435007650,False,0,,True,,t3_2c9sse,t1_cjddjtq,[deleted]
False,0,cjdivi2,europe,1406852249,,"I agree with the last part, I did oversimplify things and in a biased manner nonetheless. This was deliberate, as a counterpoint to a comment that did it in an opposite fashion. 

And likewise your version also appears to be way oversimplified. Firstly he was going for a deal with the EU precisely after talks with [Russia turned sour](http://www.bloomberg.com/news/2011-05-25/yanukovych-drives-ukraine-toward-eu-as-russian-gas-deal-looms.html), and secondly because whether the backing out was abrupt is up to debate. Here is the full [timeline](https://en.wikipedia.org/wiki/2014_Crimean_crisis). Yushchenko kept playing both sides, using them as leverage to obtain better deals. As he should I would say. 

Also his party didn't abandon him because of his political direction. He never had a ""only pro-Europe"" mandate. From the beginning he always stated his goal was to work to improve relations with both sides, EU and Russia. He was abandoned by his party when he became politically doomed.   ",t1_cjdivi2,t5_2qh4j,European Union,1,1,0,1435007662,False,0,EURO,True,,t3_2c6hid,t1_cjdi2wy,maefuckingeri
False,0,cjdivn2,countrychallenge,1406852257,,TIL Moldova is the poorest country in Europe,t1_cjdivn2,t5_320z9,,2,2,0,1435007670,False,0,,True,,t3_2cagcr,t3_2cagcr,bobobsam
False,0,cjdiwej,whatsthisbug,1406852309,,"You are required to indicate the geographic location.  I take it this was found in Europe as this looks like the male of an old favourite, [*Ctenophora*](https://www.google.com/search?safe=off&amp;site=&amp;tbm=isch&amp;source=hp&amp;biw=1920&amp;bih=955&amp;q=Ctenophora+Diptera&amp;oq=Ctenophora+Diptera&amp;gs_l=img.3...933.933.0.1201.1.1.0.0.0.0.52.52.1.1.0....0...1ac.1.51.img..1.0.0.EPtEeLXrR-0&amp;gws_rd=ssl), and perhaps of [*C. festiva*](https://www.google.com/search?safe=off&amp;site=&amp;tbm=isch&amp;source=hp&amp;biw=1920&amp;bih=955&amp;q=%22Ctenophora+festiva%22&amp;oq=%22Ctenophora+festiva%22&amp;gs_l=img.3...941.1467.0.1648.3.3.0.0.0.0.55.113.3.3.0....0...1ac.1.51.img..2.1.55.u0og67rZ4SY&amp;gws_rd=ssl) fame.",t1_cjdiwej,t5_2s3bw,FORGET GEOGRAPHIC LOCATION AND I WILL PUT FIRE ANTS IN UR PANTS,2,2,0,1435007678,False,0,,True,,t3_2caej5,t3_2caej5,Joseph_P_Brenner
False,0,cjdiwfw,pics,1406852311,,"I often think of comparing this conflict to the wars in Europe. Europe was the most war torn continent less than 60-100 years ago, the most shocking and horrific things happened, so many civilians killed indiscriminately. Heck even nations armed forces were being bombed by their own on the field. But they've moved on so far since then, people mingle freely and in trust, mostly. 

Imagine that happening in the Middle East.",t1_cjdiwfw,t5_2qh0u,,1,1,0,1435007678,False,0,,True,,t3_2c9p5e,t1_cjdi7ay,abbAtheist
False,0,cjdiz1z,AskReddit,1406852483,,"He really was only a shitty guy to those who resisted him. He was actually really reasonable to those who surrendered, and his conquest resulted in the Pax Mongolia in which a man could walk from Eastern Europe to China without being assaulted because Khan's Asia was so safe.",t1_cjdiz1z,t5_2qh1i,,183,183,0,1435007738,False,0,,True,,t3_2c9eby,t1_cjdhoq7,casey0315
False,0,cjdiz7j,pics,1406852493,,"Because it's committed by Israel, supported by the US and tolerated by the EU governments so they can totally get away with it.",t1_cjdiz7j,t5_2qh0u,,1137,1137,0,1435007731,False,0,,True,,t3_2c9p5e,t1_cjdiow7,hatesairheads
False,0,cjdizvl,AskReddit,1406852537,,"I dont fly often but Ive always flown out of Seattle. Even when Im first class there is usually an east coast hub because its never a non stop flight, always 2 stops. Even so, it must be Washington state law because ive taken the arctic route to Europe  stopping in Paris and Amsterdam for my 2nd hub and it has always been that way for me. 

Also I must say, Ive seen a lot of complaints in this thread from flight attendants, but I'll tell you what. I pay $7k rather than $2k so I can have the best experience possible. Drop 5,000 of your own cash and then you will understand complaining about minor discrepancies. To the person I responded to complaining that I want my drink right away, well fuck yea I want my drink right away. Do you think I just dropped 5 grand for a little bit of leg room? Seriously, have a little perspective and put yourself in my shoes. ",t1_cjdizvl,t5_2qh1i,,2,2,0,1435007750,False,0,,True,,t3_2c60u9,t1_cjcrbe7,Encouragedissent
False,0,cjdj0kl,Whatcouldgowrong,1406852585,,"I'm a white guy.  

There are thousands of organizations that preach ""gay pride"", ""Jewish pride"", ""black pride"".  I am truly proud of my heritage, but there are no groups for me.

I wish there was a group that preached white pride that wasn't racist or intolerant.  Europeans (and their descendants) have done a lot of neat things, and those things are worth celebrating.

I'm an immigration supporter, I'm pro marriage equality, and I'm for religious freedom.  I'd be happy to marry a woman of a different background than myself.  And I'd be happy to teach my children to be proud of both their white and non-white heritages.

I just wish there was a white-pride group that wasn't for bigots.

Everyone else is allowed to be proud of themselves.  Why not me?",t1_cjdj0kl,t5_2x2oy,,11,11,0,1435007756,False,0,,True,,t3_2ca5oc,t3_2ca5oc,DAL82
False,0,cjdj1m3,PS4,1406852653,,Anyone else from Europe that can help me out with the license issue when trying to start the game?,t1_cjdj1m3,t5_2rrlp,,1,1,0,1435007763,False,0,,True,,t3_2ca9ug,t3_2ca9ug,midiis
False,0,cjdj28h,worldnews,1406852694,,"Adolf Hitler, Chancellor of Nazi Germany (1933-45)

Home &gt; Genocide Research &gt; Statements on Record Relating to the Armenian Genocide

""Who, after all, speaks today of the annihilation of the Armenians?""
[August 22, 1939]

My decision to attack Poland was arrived at last spring. Originally, I feared that the political constellation would compel me to strike simultaneously at England, Russia, France, and Poland. Even this risk would have had to be taken.

Ever since the autumn of 1938, and because I realized that Japan would not join us unconditionally and that Mussolini is threatened by that nit-wit of a king and the treasonable scoundrel of a crown prince, I decided to go with Stalin.

In the last analysis, there are only three great statesmen in the world, Stalin, I, and Mussolini. Mussolini is the weakest, for he has been unable to break the power of either the crown or the church. Stalin and I are the only ones who envisage the future and nothing but the future. Accordingly, I shall in a few weeks stretch out my hand to Stalin at the common German-Russian frontier and undertake the redistribution of the world with him.

Our strength consists in our speed and in our brutality. Genghis Khan led millions of women and children to slaughter — with premeditation and a happy heart. History sees in him solely the founder of a state. It's a matter of indifference to me what a weak western European civilization will say about me.

I have issued the command — and I'll have anybody who utters but one word of criticism executed by a firing squad — that our war aim does not consist in reaching certain lines, but in the physical destruction of the enemy. Accordingly, I have placed my death-head formations in readiness — for the present only in the East — with orders to them to send to death mercilessly and without compassion, men, women, and children of Polish derivation and language. Only thus shall we gain the living space (Lebensraum) which we need. Who, after all, speaks today of the annihilation of the Armenians?

Kevork B. Bardakjian, Hitler and the Armenian Genocide (Cambridge, Massachusetts: The Zoryan Institute, 1985). 

The text above is the English version of the German document handed to Louis P. Lochner in Berlin. It first appeared in Lochner's What About Germany? (New York: Dodd, Mead &amp; Co., 1942), pp. 1-4. The Nuremberg Tribunal later identified the document as L-3 or Exhibit USA-28. Two other versions of the same document appear in Appendices II and III. For the German original cf. Akten zur Deutschen Auswartigen Politik 1918-1945, Serie D, Band VII, (Baden-Baden, 1956), pp. 171-172.",t1_cjdj28h,t5_2qh13,,-1,-1,0,1435007768,False,0,,True,,t3_2c8i8w,t3_2c8i8w,MarxisTX
False,0,cjdj3bm,TumblrInAction,1406852764,,nazism and (some modern) paganism are very closely related ideoligies ? paganism being a very early european religion. and he follows the viking religion afaik.,t1_cjdj3bm,t5_2vizz,,2,2,0,1435007777,False,0,,True,,t3_2c9p1m,t1_cjdhkfa,dregofdeath
