score_hidden,gilded,id,subreddit,created_utc,removal_reason,body,name,subreddit_id,author_flair_text,score,ups,controversiality,retrieved_on,edited,downs,author_flair_css_class,archived,distinguished,link_id,parent_id,author
False,0,cjdntez,politics,1406863774,,"What is ""shitty"". Maybe if you live in Mexico or the southern U.S., it'll be ""shitty"", but the overall weather for more northern latitudes may actually improve drastically. Improved crop yields, improved comfort for the humans that live there, etc. There are huge swaths of land in the northern hemisphere that are currently useless tundra and virtually uninhabitable because the current climate there is far too cold and miserable.

I'm not arguing that global climate change isn't real. The evidence is pretty clear. I'm just not convinced that global climate change is necessarily going to be extreme or necessarily a *bad* thing. Who's to say that the current climate of today is *good*. I mean, hypothetically speaking, let's pretend for a second that our current civilization is living back to 22000 years ago, during the peak of the last ice age. Would we be sitting around in the tropics discussing how the current climate is warming and that we cannot afford to lose our Canadian/european/Russian ice sheet, and if we don't stop the melting, the climate is going to get really ""shitty""? Just something to think about.",t1_cjdntez,t5_2cneq,,-5,-5,0,1435010288,False,0,,True,,t3_2c8h8h,t1_cjdl7wd,myhipsi
False,0,cjdnu9c,DotA2,1406863831,,"I wouldn't even mind playing on EU servers with a bunch of Russians, as I can speak it fluently myself. From my few experiences with them once you have a chat in their own language people are much more willing to cooperate.",t1_cjdnu9c,t5_2s580,,1,1,0,1435010302,False,0,,True,,t3_2cav4v,t1_cjdnprb,x256
False,0,cjdnwdg,leagueoflegends,1406863975,,"They just added a european one (alpha), so it looks like they'll get there eventually.",t1_cjdnwdg,t5_2rfxx,,2,2,0,1435010350,False,0,03 team,True,,t3_2c8p9o,t1_cjdlnan,solopath
False,0,cjdnxxy,circlebroke,1406864079,,"Its not that he just killed lots of people, A LOT of nations and peoples did that.

He brought a level of human caused death and destruction not seen before OR SINCE. During his reign its estimated the Mongols killed TEN PERCENT OF WORLD POPULATION.

At the time, world population was roughly 400,000,000. Meaning the Mongols under Khan slaughtered 40,000,000 people. There were literally entire nations put to the sword by him. The population of Iran didn't recover to pre Mongol invasion levels until the 1950's.

To put that 10% into perspective, WW1 and the Spanish Flu that occurred at the same time put together killed 2% of world population. WW2 and the holocaust combined killed only 3.6%.

The amount of sheer brutality and violence the Mongols brought to Asia, Eastern Europe, and the Middle East is absolutely unparalleled. Khan used genocide not as a last resort, but a main weapon to scare other nations and tribes into surrendering to him without putting up a fight.

That isn't what makes him badass. He is a monster because of it. Literally the closest thing to blood god to ever walk the Earth.


You know what makes him badass? The fact he was kicked out of his clan at age 9 with nothing but the clothes on his back and his mother and brothers for company, and 5 years later he was already a self made leader of men.

He had a level of charisma and and aura of confidence and power that drew people to him like moths to flame even when he was barely a teenager. 

He did what no other Mongol leader had ever done in the entire history of the people. He united the steppe under one banner. Not only that, he brought the mongols out of being a socially and technologically primitive people to being a organized, efficient force unlike any the world had ever seen in only a few years. He is one of the very few if any leaders in history who made fascism work on a grand scale.

He then took this force, and he brought the strongest nation on Earth at the time, the nation that had manipulated and bullied the Mongols for generations (the Chinese Jin Empire) to its knees in just four years.

And he wasn't just some rampaging brute. Everything he did was a calculated move, and he never attacked an opponent without giving them at least one out for surrender first.

He was an unparalleled tactical genius who employed macro tactics reminiscent of WW2, not medieval ones. And he was an unparalleled reader of people too. He always knew exactly who to use for what position, and he could tell just from a short encounter if you would be a worthy subordinate. His use of meritocracy (something Napoleon would use later) was one of the biggest reasons for his success. Subutai was an excellent example of this. The guy was the son of a blacksmith who joined up with Genghis at age 17, and within 10 years had risen under Khan to the rank of general, of which he was himself one of the greatest of all time (this is the dude who trashed Georgia, Russia, and literally all of Eastern Europe with literally no supply train).

He established Yassa in his empire, which was a surprisingly progressive code of laws that was a big reason for the Mongolian Empire surviving his death. This set of laws and philosophy he wrote would guide Mongol leaders for generations, and only when they began to abandon it did the empire begin to crumble. It established very strict guidelines for succession, protections for women against domestic abuse, established complete freedom of religion across the empire, made religious leaders and doctors tax exempt, established punishments for stealing, assault, and murder, set foreign policy and military doctrine, established the greatest postal system in human history until the 1800's, etc... Yassa showed that Khan was not only the greatest conqueror who ever lived, but an extremely adept and able statesman.

Another badass thing about Khan was that unlike many commanders, he constantly fought at the front with his men. Even into his old age he still led from the front. Its believed he died from an infection after he was shot in the knee by an arrow (for the second time in his life) and thrown from his horse while fighting the Xia at age 65.

Oh, and durability. The guy was a fucking tank. Throughout his life he was shot by arrows, stabbed, slashed, and pretty much every other manner of wounded and always pulled through somehow.


When it comes down to it, Genghis Khan was a man who wanted it all. You can hate him for his method's of trying to get achieve that goal, the fact he walked a dark path. But you have to respect the fact he actually walked, and didn't just talk. In his climb to the top, he elevated his people to a position they would never have dreamed of a generation earlier, and a place far higher than where they are now. He didn't drive them into a hole like Hitler did, he didn't fall from he mountain top like Napoleon did, and unlike Alexander, his empire survived his death and actually thrived. He started with nothing, and arguably achieved more than and other leader in history, not to mention his exploits were the biggest catalyst the link between Europe and the far east, among other things. 

He was Khan, and thats all there is to it.",t1_cjdnxxy,t5_2tnz9,,3,3,0,1435010384,1406950850,0,,True,,t3_2c84dd,t3_2c84dd,Defengar
False,0,cjdnyni,asoiaf,1406864124,,"Losing the important wars? Which ones? Yes, they were quickly conquered in WWI and WWII, but still prevailed in the end. Only 100 years prior Napoleon was conquering Europe. And a little bit before that they were helping the colonists in America rebel against England. 

So if you mean ""also famous losing the important wars"" as in needing help in the last two major wars during these past 100 years then sure, you are right. But otherwise, read a real history book or stick with ASOIAF fantasy history. ",t1_cjdnyni,t5_2r2o9,,2,2,0,1435010396,False,0,,True,,t3_2c8xkt,t1_cjdm2yc,SpinoC666
False,0,cjdnyw9,coins,1406864142,,"I know he was following the Scottish way since he was a hitting himself and very proud of it.  He was big into it in Europe when he lived there but once he got back to the states he wasn't as active.  It may have to deal with the different styles you mentioned.  

I very well maybe confused.  I didn't know much of the masons besides the tv stuff and the conspiracy theories before two weeks ago.   What I thought was that there was 33 levels and 32/33 were considered the Shriners.  I heard that recently (~30 years) they changed it so that you didn't need to be those levels to be a Shriner.   Apparently my grandfather was not happy with that.  That guy that came by wasn't too helpful when it came to explaining things.  

Maybe I can find another Scottish chapter closer to home.  Going all the way back there isn't very feasible at the moment.   I find the whole organization really interesting so I would love to know more.  

",t1_cjdnyw9,t5_2qhuq,,1,1,0,1435010403,False,0,,True,,t3_2c97u8,t1_cjdngmj,fritzly
False,0,cjdo0ud,worldnews,1406864274,,"Actually, they were never conquered.  Europeans either kinda just wandered in and started living here, or signed treaties giving the land to the Crown.  That's why those recent big Supreme Court cases keep happening.",t1_cjdo0ud,t5_2qh13,,11,11,0,1435010428,False,0,,True,,t3_2caeh7,t1_cjdkxd1,FlisLister
False,0,cjdo2sy,vita,1406864409,,"The general consensus has been that the EU PS+ has had a far better line-up in the past, but lately both NA and EU have practically the same line-up. So it's kinda hard to say which is better since they're becoming more and more identical as time goes on. I'd recommend using the PS store that is for your country though, I see in this sub that some people sometimes have issues using credit cards and other payment options if the regions conflict.",t1_cjdo2sy,t5_2sjmv,,1,1,0,1435010466,False,0,game-estival-versus,True,,t3_2calxf,t1_cjdn8nd,ChaoticPride
False,0,cjdo4o8,worldnews,1406864536,,"&gt; Look at how fast the U.S. and their European lackeys blamed it on Russia.

No one blamed that on Russia they blamed it on the guy who it turns out did do it, Assad. Russia justifiably caught grief for defending Assad and for trying to claim the rebels attacked themselves.
",t1_cjdo4o8,t5_2qh13,,2,2,0,1435010487,False,0,,True,,t3_2cacsg,t1_cjdmv5l,justanotherwtf
False,0,cjdo8m7,news,1406864806,,"It is always a wonder to me when Germans criticize American foreign policy in Israel. Admittedly, often in general as well. It's like, you do know we have been cleaning up all the messes you left us for over half a century right? If not for Germany who knows if America would still be World Police. 

Edit

ITT downvoters who have not really sat down and thought about Germany's long term impact on American foreign policy. Israel-Palestine. Cold War. Communism. Protecting Europe from it. East and West Germany. Ringing any bells? Not saying Germans can't make legitimate criticisms of American policy but if they're going to be so morally disgusted by America, it shouldn't be in regards to a problem Germany had a huge hand in creating.
",t1_cjdo8m7,t5_2qh3l,,4,4,0,1435010547,1406865319,0,,True,,t3_2c9n0f,t1_cjdnv63,aquaponibro
False,0,cjdo8rc,Seattle,1406864815,,"&gt;So all the transplants and non-northern European people who have moved to Seattle in the last half century have been usurped by the social attitudes of its very first settlers? The social attitude has remained static, with all of the demographic shifts, ever since northern-Europeans settled in the area?

Yes, combined with the typical western ""to each his own"" quiet stoicism that is found throughout the region, further influenced by an influx of east asians. Isn't the lack of demographic shift one of the things you frequently complain about? 

I am in agreement with the link between depression, alcoholism, Caffeine and with low Vitamin D BTW. It has been quite well studied in the medical world. Hence in the past people typically took cod liver oil and today should also take Vitamin D supplements. ",t1_cjdo8rc,t5_2qhad,Rat City,2,2,0,1435010549,False,0,flair,True,,t3_2ca09e,t1_cjdniq2,hamburger666
False,0,cjdo9wb,AskReddit,1406864893,,"No different to my thoughts on youth in Europe, youth in Africa, youth in America etc",t1_cjdo9wb,t5_2qh1i,,1,1,0,1435010567,False,0,,True,,t3_2caz1e,t3_2caz1e,stinx2001
False,0,cjdoczu,Steam,1406865103,,Is anyone going to acknowledge the fact that the American version isn't $85?  This has always been a thing for Europeans/Australians on Steam.  Nothing new.,t1_cjdoczu,t5_2qwis,,2,2,0,1435010618,False,0,057,True,,t3_2c81bi,t3_2c81bi,Excalibur457
False,0,cjdodsy,PS3,1406865159,,"There was a spiritual successor for the PSP which was never released in the west and was remade for the 3DS. There is currently a petition nearing 50k signatures asking for Bamco to localise the 3DS version and the Vita game that is being developed.

http://www.change.org/petitions/bandai-namco-games-europe-america-localize-digimon-games-again-e-g-digimon-world-re-digitize-decode-for-3ds-digimon-story-cyber-sleuth-for-psvita

I expect the only chance we will ever see a Digimon World game in the west again is if this game sells well enough.",t1_cjdodsy,t5_2qhhw,,2,2,0,1435010630,False,0,,True,,t3_2c8pj8,t1_cjdgmwh,adamr999
False,0,cjdoe5j,europe,1406865181,,"When you find yourself agreeing with Nazis and neo-Nazis on some point of policy, you might want to rethink that point. 

And unfortunately, this is what Nazis and Zionists had in common, this belief that the European Jews are not really European, the British Jews are not really British, the German Jews are not really German, and so on. 

Historically, the Jews in Germany, and Britain, and America were extremely thoroughly assimilated. ",t1_cjdoe5j,t5_2qh4j,Scotland,-1,-1,0,1435010634,False,0,SCOT,True,,t3_2c8z90,t1_cjdn3ik,michaelnoir
False,0,cjdofm9,OpTicGaming,1406865281,,Now we know how the Europeans feel for every event! It stinks! Lol. And 1 AM? Better get to bed early that night!,t1_cjdofm9,t5_2xpuo,,3,3,0,1435010653,False,0,killa2,True,,t3_2caz75,t1_cjdodbb,Poncho_TheGreat
False,0,cjdog8i,GlobalOffensive,1406865324,,"Uhh, I wouldn't say I'm expert but, it was because of money. Not only CS, in all categories, US and Canada lost out in gaming scene. During early 2000's, esports scene barely existed in NA. It was basically grassroots starts, very embryonic status. However, other places like South Korea and EU already had gaming/esports scene. When I was in Korea, they already had half million prize tournaments and dedicated gaming channel. Companies would hire gamers and give them housing. Basically, other countries already had gaming scene of 2014 NA, during early 2000's. Honestly, NA is barely catching up. I couldn't imagine being a pro gamer in NA during early 2000's. It must had been tough or they lost interest. Well, that is my take on it. Money. 

Edit: A ""Word.""",t1_cjdog8i,t5_2sqho,LGB eSports Fan,3,3,0,1435010669,1406883113,0,fan lgb,True,,t3_2caxjh,t3_2caxjh,Light128
False,0,cjdoiik,AskReddit,1406865477,,"Err.. Canada is not the US, you silly Europeans :0)

Seriously dude, there are no French signs in the US.

Unless it's New Orleans. They do have a French quarter I believe.",t1_cjdoiik,t5_2qh1i,,1,1,0,1435010712,False,0,,True,,t3_2cb0jn,t3_2cb0jn,Habari
False,0,cjdok2m,vegan,1406865584,,"I don't know if it's available in the UK but there's a brand of plant-based cheeses called VioLife that is unbelieveable.  It's a Greek brand sold in EU, I just happened to get some samples here in the states.  Far and away the best I've had.",t1_cjdok2m,t5_2qhpm,,2,2,0,1435010735,False,0,,True,,t3_2c95qb,t3_2c95qb,BigHeadAsian
False,0,cjdok85,wargames,1406865595,,"As a wargames enthusiast, we all tend to get wrapped up in the miniature games. There are a lot of them, and it's a helluva lot of fun to get into. But there are other options out there. Many board games have stepped up and provide very good alternatives. Be it [large fantasy armies](http://www.fantasyflightgames.com/edge_minisite.asp?eidm=15) or more [squad-based](http://boardgamegeek.com/boardgame/21050/combat-commander-europe) games with a [WW2 theme](http://boardgamegeek.com/boardgame/28181/combat-commander-pacific). There's a lot of [fun](http://www.devil-pig-games.com/en) games [out there](http://arcadiaquest.com/en/).",t1_cjdok85,t5_2rcjh,,1,1,0,1435010736,False,0,,True,,t3_2c954c,t1_cjdnm9o,Geekken
False,0,cjdoko5,leagueoflegends,1406865627,,Alliance because they carry the spirit of CLG.EU.,t1_cjdoko5,t5_2rfxx,,3,3,0,1435010748,False,0,01 team,True,,t3_2cb0er,t3_2cb0er,DeRagnus
False,0,cjdoni4,worldnews,1406865823,,[I'm afraid the far right does support Israel.](http://uk.reuters.com/article/2010/12/20/uk-europe-islam-far-right-idUKTRE6BJ34Q20101220?pageNumber=1),t1_cjdoni4,t5_2qh13,,0,0,0,1435010802,False,0,,True,,t3_2caw4u,t1_cjdo09v,wntroll
False,0,cjdoomr,leagueoflegends,1406865901,,"**Server:** EU West

**Type of Bug:** In Game Bug

**Description:** Sightstone bug when upgraded to Ruby sightstone then refunded. 

**Video / Screenshot:** Not available (was at a lan cafe sadly)

**Steps to reproduce:** Buy sightstone then upgrade it to ruby sighstone then refund it, the result was sightstone was bugged until you upgraded it again.

**Expected result:** Sightstone should work fine.

**Observed result:** Can't use wards at all from sightstone.

**Reproduction rate:** 10/10

**EDIT:** Formatting.

**EDIT:** Seems like it has already been reported, nvm then.",t1_cjdoomr,t5_2rfxx,,1,1,0,1435010821,1406866793,0,,True,,t3_2c4c1w,t3_2c4c1w,PkxGeezus
False,0,cjdooy3,cars,1406865922,,"I view you as an equal. I don't hold you with higher or lower regard. I don't expect you to take the higher or lower ground. When you look at shit americans say, they clearly care a lot about what Americans say. Our words are very powerful. You as a non America do not have any effect on me. I'll talk to you, but I do not care what you have to say as much as you care what I have to say. It won't offend me if you say ""leurope is greatest"". If I say ""merica is greatest"" then many threads will be formed about how I'm a horrible disgusting human being.  Why do foreigners care so much about what we have to say?  Why are they so emotionally invested into the words of Americans?  I don't care too much about what foreigners have to say. It's not that you're less than me, it's just that you're just some guy; however, you're not from here. ",t1_cjdooy3,t5_2qhl2,,0,0,0,1435010822,False,0,,True,,t3_2c97he,t1_cjdofd7,RalphWaldoNeverson
False,0,cjdopun,leagueoflegends,1406865986,,Salty EU fanboy mad when Faker praises NA player? Not surprised at all.,t1_cjdopun,t5_2rfxx,,-7,-7,0,1435010829,False,0,85 team,True,,t3_2c9tvw,t1_cjdnbr5,Tank_Kassadin
False,0,cjdoq6v,hearthstone,1406866008,,Happens. I remember Kolento losing to a rank 24 or 25 on Asia right after he got #1 on both NA and EU. Was pretty funny. ,t1_cjdoq6v,t5_2w31t,,23,23,0,1435010840,False,0,legend,True,,t3_2ca3t8,t3_2ca3t8,PesterThePatient
False,0,cjdosku,leagueoflegends,1406866174,,If I have OGN stats like the EU ones above I'd be down to do it ,t1_cjdosku,t5_2rfxx,,1,1,0,1435010869,False,0,khazix,True,,t3_2ca5rf,t1_cjdon7j,megavolt1123
False,0,cjdowi7,wow,1406866452,,http://wow.realmpop.com/eu.html,t1_cjdowi7,t5_2qio8,,0,0,0,1435010934,False,0,mage,True,,t3_2carba,t3_2carba,WhimsicalPythons
False,0,cjdowkj,Dota2Trade,1406866456,,"Free shipping, guaranteed to have the codes, and shipping from a EU location so you don't have to worry about VAC taxes?",t1_cjdowkj,t5_2t22d,http://steamcommunity.com/profiles/76561197993284378,1,1,0,1435010934,False,0,,True,,t3_2caq9y,t1_cjdonuo,TheTVDB
False,0,cjdowpw,whowouldwin,1406866466,,"&gt;You fail to account for a Jedi Knight and Master's precognition.

Precognition doesn't mean they will be able to predict exactly what move they will be able to use. They may sense that they will be about to attack and get their lightsaber ready to deflect a spell when the de cast a fiendfyre. 

&gt;Also, death eaters wouldn't know what the most efficient spells to cast were before they were dead. 

Avada Kedevara kills instantly and would be the first choice of spell for every death eater.

&gt;Most spells could be deflected just as blaster bolts are and the jedi would be moving at superhuman speed.

It is extrememly out of character for a jedi to speed blitz and even then, discounting the EU, I don't remember them moving FTE. If jedi are allowed to use their speed to end the battle as fast as possible, then the wizards are allowed to teleport behind them before they can do anything and avada kedavra them.",t1_cjdowpw,t5_2s599,,4,4,0,1435010943,False,0,Good4,True,,t3_2cak4k,t1_cjdot57,emboarrocks
True,0,cjdoz37,duolingo,1406866637,,"Eu fui quando tenha 8 anos (há mais que 10 anos :*( ), e eu quero voltar para aprender o idioma",t1_cjdoz37,t5_2t6ze,espt,1,1,0,1435010989,False,0,,True,,t3_2ca44z,t1_cjdhyxe,CapslockEngaged123
False,0,cjdp21t,leagueoflegends,1406866844,,MVP best jungler in all of Europe! &lt;3,t1_cjdp21t,t5_2rfxx,,1,1,0,1435011053,False,0,07 team,True,,t3_2c9tvw,t1_cjddab0,FUZZB0X
False,0,cjdp86x,SkincareAddiction,1406867298,,I actually just found the European version on a website on sale and bought it! very exciting! Thank you so so so much! :)))),t1_cjdp86x,t5_2tbbg,,1,1,0,1435011145,False,0,,True,,t3_2c4acx,t1_cjdorn0,octopop
False,0,cjdp87r,TumblrInAction,1406867300,,"&gt;And I'm certain it's entirely just to not hurt peoples feelings.

Of course it is.  Other nations that are not so terrified of the outcomes of these possibly politically incorrect findings are in fact researching it.  [Take Russia for example.](http://i.imgur.com/Q9KSdfL.jpg)  
And if someone has to call the entirety of Russia racist to combat this finding and call it biased then I think we know who the racist is.  

Lets be real.  Would it seem outlandish to say that Africans have a greater propensity for athletics than Europeans?  I mean look at our sports teams.  Look at classrooms of advanced STEM students and you'll find a lot of Asians.  Its not about supremacy and dominion.  Its about acknowledging that we are different, like you said, with strengths and weaknesses.",t1_cjdp87r,t5_2vizz,,0,0,1,1435011145,False,0,,True,,t3_2c9p1m,t1_cjdoyxt,TungstenDuck
False,0,cjdp9kv,politics,1406867397,,then youre gonna love europe or canada ,t1_cjdp9kv,t5_2cneq,,1,1,0,1435011162,False,0,,True,,t3_2c6hwy,t1_cjd6x4l,Rutawitz
False,0,cjdp9t8,explainlikeimfive,1406867415,,"Ok, so you'd admit that Jews can be any race then (the majority falling into the Caucasian/White/European/ whatever is politically correct category)? Which would rule out ""Jewish"" being an ethnicity. So then what does it mean to be Jewish? Certainly its not is own race, since it would include many other ""races"" into it. So... a culture then? ",t1_cjdp9t8,t5_2sokd,,2,2,0,1435011164,False,0,,True,,t3_2carfp,t1_cjdp41f,MisoRoll7474
False,0,cjdpdvq,conspiracy,1406867709,,"People know this, but the problem is the organic food industry is pushing for this for their own profits. If GMOs are labelled organic food stands to benefit financially, big-time. The organic food industry already ran into problems with numerous scientific studies showing no health benefits over non-certified organic foods despite a significant increase in cost. Just go through some of the recent GMO labeling law's list of supporters, you'll find most of them are funded by the organic food lobby. They try to paint GMO labeling campaigns as being good for ""consumer choice,"" but their real goal is to destory consumer choice and force people into paying more for organic food. (similar labeling laws in Europe, which also claimed to be good for consumer choice, resulted in most GM foods being pulled from store shelves due to anticipated poor sales). 

The organic food lobby are the real shills here. ",t1_cjdpdvq,t5_2qh4r,,1,1,0,1435011233,False,0,,True,,t3_2c98kq,t1_cjdi5ju,FriendlessComputer
False,0,cjdpfkr,motorcycles,1406867834,,"Germany is a transit country between the west of Europe and east of Europe.

English is a common language, while German isn't.",t1_cjdpfkr,t5_2qi6d,,20,20,0,1435011260,False,0,,True,,t3_2c9yfd,t1_cjdp3fx,[deleted]
False,0,cjdpfyv,worldnews,1406867866,,"Actually, looking at the EU as a singular military entity, which it is not, unveils a dysfunctional military with an extreme amount of redundancy on cheaper elements, such as infantry, while lacking in the more expensive logistical elements such as heavy airlift, air to air refueling, and naval assets. Those elements, Russia kept during their drawdown, instead cannibalizing their more manpower heavy assets, which can be more easily rebuilt on short notice if needed. You can train an infantryman in a few months, a procurement contract for a wing of C-17s will take a few years.

Furthermore, a dollar spent on Russia's military will go farther than a dollar spent on a European military. Troops get paid more in first world militaries and equipment costs more. So looking at a straight dollar to dollar comparison is misleading.

In addition, the EU is not a singular entity in the same way the US or Russia are. If new York is attacked, troops at fort hood in Texas mobilize immediately. If Finland gets into a scuffle with Russia, do you think Spain will go all in immediately, or are they going to dither about getting dragged into a fight that they have no stake in?

While western Europe has been cutting their military spending significantly in the recent years, Russia's spending is exploding, they've tripled their military spending since 2007, and show no signs of slowing down any time soon. ",t1_cjdpfyv,t5_2qh13,,4,4,0,1435011265,False,0,,True,,t3_2c8sdw,t1_cjdba83,DragonFireKai
