archived,id,parent_id,created_utc,body,link_id,edited,subreddit,gilded,retrieved_on,author_flair_css_class,distinguished,score,controversiality,ups,author,name,score_hidden,author_flair_text,subreddit_id,downs,removal_reason
True,c583e5x,t1_c581jp9,1341167422,"As a American taking German - I'd say he meant something along the lines of, ""A few/some of them have a family at at very young age (for Europeans), and being in the army can be a stepping stone for their further lives.""",t3_vvlui,False,IAmA,0,1429273315,,,2,0,2,kschwag,t1_c583e5x,False,,t5_2qzb6,0,
True,c583e9g,t3_vvwi7,1341167436,"HEY EVERYONE REMEMBER THE EUROPEAN FINANCIAL CRISIS?! BECAUSE THE COMMENTATORS SURE DO!!

Wine drunk and ready--Forza Italia!",t3_vvwi7,False,soccer,0,1429273315,,,2,0,2,[deleted],t1_c583e9g,False,,t5_2qi58,0,
True,c583exc,t3_vvvvk,1341167524,"General OddOne

First and foremost he is a jungler, that allows the viewer to see all parts of the map, not just some farm fest in lane.  Additionally as he is running around ganking, he checks on other lanes to see how they are doing.  Secondly, The OddOne is absolutely hilarious.  He is constantly cursing, and just has his little catchphrases ""Well pardon me for livin"".  THirdly, as he is streaming, he always explains why he is doing or not doing something, during the match, ""Oh I'm not ganking there because I saw ...., or I'm heading here because I know ..."".   Lastly he takes the time to answer questions, while in queue, as well as he is one of the most often streamers in LoL.

EU-W",t3_vvvvk,False,leagueoflegends,0,1429273332,00 team,,1,0,1,DmanDaBeast,t1_c583exc,False,,t5_2rfxx,0,
True,c583f7l,t3_vvvvk,1341167561,propably aphromoo cause hes reallly really funny and you still can learn stuff while watching. EU-NE :D,t3_vvvvk,False,leagueoflegends,0,1429273334,19 team,,-1,0,-1,Aegnoth,t1_c583f7l,False,,t5_2rfxx,0,
True,c583fse,t3_vvos2,1341167637,"I even wanted to order the magazine that gave the code from US, but then they said the code wouldn't work on EU-W :( bah...",t3_vvos2,False,leagueoflegends,0,1429273345,singed,,1,0,1,Xuma,t1_c583fse,False,,t5_2rfxx,0,
True,c583gxq,t3_vvwi7,1341167789,Glad to see that extra-match festivities are as bad in European sporting events as they are in the US.,t3_vvwi7,False,soccer,0,1429273355,15,,5,0,5,ransom00,t1_c583gxq,False,Everton,t5_2qi58,0,
True,c583hwl,t1_c583bhq,1341167921,relatively irrelevant? hmmm with the decomissioning of Space Shuttle Sojoez bacame quite important. I would call the Russian space effort irrelevant. Neither the Chinese or European. I wonder if the US will remain their leading position in space exploration.,t3_vvv0b,False,todayilearned,0,1429273375,,,5,0,5,Chris8201,t1_c583hwl,False,,t5_2qqjc,0,
True,c583i4x,t1_c57rom6,1341167951,"I used hostels when I lived in Europe, isnt there a age limit?",t3_vufyc,False,sandiego,0,1429273370,,,1,0,1,charliemikepro,t1_c583i4x,False,,t5_2qq2q,0,
True,c583i56,t1_c5825xp,1341167952,There are also no such problems in Europe. Especially in Sweden.,t3_vvhrl,False,circlebroke,0,1429273370,,,4,0,4,Halofit,t1_c583i56,False,,t5_2tnz9,0,
True,c583ija,t3_vvvvk,1341168003,"Phantoml0rd! Why? Well because of [this](http://www.youtube.com/watch?v=YSDUxNTN_Zs#t=148s). Simply fabulous!

My server is EU-West",t3_vvvvk,False,leagueoflegends,0,1429273377,ezreal,,-1,0,-1,eizei,t1_c583ija,False,,t5_2rfxx,0,
True,c583ivt,t3_vvos2,1341168050,"I'm from Finland, so the arctic theme fits my country. 
My server is EU-NE if it matters :)",t3_vvos2,1341168393,leagueoflegends,0,1429273385,00 team,,1,0,1,Veikkaa,t1_c583ivt,False,,t5_2rfxx,0,
True,c583j0l,t3_vvvvk,1341168065,"My favourite streamer is Ocelote because he is entertaining a lot by singing and doing other funny stuff.

EU-W",t3_vvvvk,False,leagueoflegends,0,1429273389,vayne,,-1,0,-1,Feurius,t1_c583j0l,False,,t5_2rfxx,0,
True,c583k6g,t1_c582fwy,1341168210,"If you call yourself a USian instead of an American, you have a very different perspective than most US Residents, period.

For what it's worth, while American isn't exactly correct (y'know, North/South Americans), the term USian is so irredeemably clumsy that it just sounds like you're either a hipster or trying way too damn hard to make Europeans happy. ",t3_vvlui,False,IAmA,0,1429273401,,,3,0,3,Arlieth,t1_c583k6g,False,,t5_2qzb6,0,
True,c583le6,t3_vvxou,1341168369,http://eu.battle.net/d3/en/item/screaming-chain and the other ring in the set with MF on them will beat two magic/rare rings that have 18% MF. ,t3_vvxou,False,Diablo,0,1429273414,monk-europe,,3,0,3,Lurkoxe,t1_c583le6,False,,t5_2qore,0,
True,c583lr5,t3_vvvvk,1341168417,"My favourite streamer would be Saintvicious. Easygoing attitude towards the game. Knows how to have a laugh and how be informative in a very helpful way. Sits back, relaxes with some beers and just enjoys the game (I believe that's the way it should be). Easy to watch. :)
Server: EU West",t3_vvvvk,False,leagueoflegends,0,1429273418,01 team,,0,0,0,Ballerinja,t1_c583lr5,False,,t5_2rfxx,0,
True,c583lrh,t3_vvvvk,1341168418,"My favourite streamer is Doublelift, because he's a good ad carry and  I like him because he is a good guy.
This guy helped me to get out of ""elo hell"" thanks to his s tream, I watched it whenever I could and even if it was late here in europe I was still awake watching his stream. Unfortunately he doesn't stream very often like before..
(better nerf DoubleLift)..
I'm a Eu-West player :D",t3_vvvvk,1341171984,leagueoflegends,0,1429273418,,,0,0,0,wLepic,t1_c583lrh,False,,t5_2rfxx,0,
True,c583mp5,t1_c581yyq,1341168545,"He specifically said he does not want a ""European"" health care system, so I don't think he'd be on the side of single payer you might want.",t3_vvon3,False,politics,0,1429273426,,,7,0,7,[deleted],t1_c583mp5,False,,t5_2cneq,0,
True,c583ms6,t3_vv5hq,1341168556,"Well.. Okay. I was trying to not be on reddit during my vacation, but whatever.

I've met Neil deGrasse Tyson, Brian Schidmt (the Physics Nobel prize winner), and am planning on studying Astronomy/Physics in college.

I was born in South America, Chile to be exact. I've traveled to Europe several times, numerous South American and a few Central American countries, and to about a dozen US states.

Lastly; I'm 16.",t3_vv5hq,False,MLPLounge,0,1429273428,twilight,,1,0,1,Ubahootah,t1_c583ms6,False,Twilight Sparkle,t5_2t403,0,
True,c583n6q,t3_vvvvk,1341168610,Scarra because he's very informative and cute :D EU-W,t3_vvvvk,False,leagueoflegends,0,1429273433,zac,,0,0,0,Polemus,t1_c583n6q,False,,t5_2rfxx,0,
True,c583naf,t3_vvptp,1341168623,"The big shopping centers/malls in europe will normally have a gym in them. 
If not just google the city your in and type 'fitness/gym'. You'll find loads. they should all let you jut drop in, no membership.
If you go for 1 time you might be asked to leave a 20 or maybe your ID at the reception for security. 
",t3_vvptp,False,Fitness,0,1429273434,,,1,0,1,fapertron,t1_c583naf,False,,t5_2qhx4,0,
True,c583nlh,t3_vvvvk,1341168666,"My favorite streamer is PhantomL0rd.He's just so goddamn entertaining, and his music isn't vomit inducing like most streamers are, and it's also 1080p!

EU-West.",t3_vvvvk,False,leagueoflegends,0,1435704487,leona,,0,0,0,Xandemar,t1_c583nlh,False,,t5_2rfxx,0,
True,c583o3q,t3_vvvvk,1341168731,"Froggen cause he's emo and listens to beastly music and plays a bird .. nuff said.

EU-W",t3_vvvvk,False,leagueoflegends,0,1429273445,udyr,,1,0,1,Sijic,t1_c583o3q,False,,t5_2rfxx,0,
True,c583oeb,t1_c5804eo,1341168769,"I don't know about assault, but I do know that violent crimes in general and property crime is the lowest it's been in the US since the 50s.

And of course, across the pond in Europe, the crime rates are even lower.

Things are far from perfect now, but go back even just a few decades and things were far far worse. The Western World, as a society, has been becoming less and less violent over time.",t3_vvaec,False,AskReddit,0,1429273449,,,1,0,1,iwishiwasrelevant,t1_c583oeb,False,,t5_2qh1i,0,
True,c583ohe,t3_vvvvk,1341168782,"phantol0rd. Epic beard-glass combo

eu-w",t3_vvvvk,False,leagueoflegends,0,1429273450,zed,,0,0,0,Manicial,t1_c583ohe,False,,t5_2rfxx,0,
True,c583owp,t3_vvvvk,1341168843,"Snoopeh , bout time we learn how to jungle , EU-NE
",t3_vvvvk,False,leagueoflegends,0,1429273455,,,0,0,0,nefertitechrs,t1_c583owp,False,,t5_2rfxx,0,
True,c583pbn,t3_vvrp8,1341168903,"I'm not a scientist. 

I am an undergraduate student who has been studying about obesity and the effects of it on Cardiovascular risks/disease for some time.

Once you lose weight and go back to normal weight levels, your cardiovascular risk is still the same because your plaque levels in your arteries will still be the same even if you are back in normal weight levels. HOWEVER, because you are back at normal weight, there is less oxidative stress and less blood triglyceride levels. This means that the rate of plaque formation in your arteries is less at normal weight levels than at obese levels. This is if you are looking at heart attacks, COPD, and stoke. cardiovascular risks will be higher at normal weight if you have hypertension, higher triglyceride blood levels, blood glucose levels.
Funny fact: normal weight but obese people have a higher cardiovascular disease risk than metabolically healthy but obese weight people evidence: 

Lentzas, I., Gamiri, V., Katsanaki, A., Tsiros, G., Matzouranis, G., Panagopoulos, P., Chatzopoulou, E. (2009) Metabolically obese patients with normal weight have greater degree of cardiovascular risks than metabolically healthy but obese patients. Atherosclerosis (supplements) (Component). 

Answer reference:

P. Andersson; R.L. Sjoberg; J. Ohrvik; J. Leppert. (2006) Knowledge about cardiovascular risk factors among obese individuals. European Journal of Cardiovascular Nursing. vol. 5 (4), pg. 275-279


TL;DR: risk will be the same, but the rate of the risk will be less when at normal weight than to continue to be obese. ",t3_vvrp8,1341169126,askscience,0,1429273462,,,43,0,43,aznsin12,t1_c583pbn,False,,t5_2qm4e,0,
True,c583pc8,t1_c579vzp,1341168906,"TSM 2:1 CLG.EU, M5 2:0 TSM, M5&gt;TSM&gt;CLG.EU&gt;M5..",t3_vqziz,False,leagueoflegends,0,1429273462,12 team,,1,0,1,DwUT,t1_c583pc8,False,,t5_2rfxx,0,
True,c583pj4,t1_c57za4d,1341168933,"LOL Africans are in the stone age? Really? Come on man, you're just making yourself sound even worse. 

And why is it stupid to compare depression era Americans and Africans? The point is that every modern industrialized society went through demographic transition -- it wasn't something that happened instantly just due to some sort of fiscal shock. People had a dozen kids in the USA and Europe even though they couldn't afford it. 

As far as farming I can guarantee I know more about agriculture in the west as well as African agriculture than you learned from your (obviously) shitty ""African Anthropology 100"" course. Stone age? Bronze age? LOL wtf is that garbage?  ",t3_vuuet,False,AskReddit,0,1429273464,,,3,0,3,[deleted],t1_c583pj4,False,,t5_2qh1i,0,
True,c583pra,t1_c582tti,1341168965,"Dutch girls aren't that loose. But yeah, Scandinavians and Eastern Europeans are easy.",t3_vvjuh,False,seduction,0,1429273466,,,1,0,1,alepov,t1_c583pra,False,,t5_2qhrv,0,
True,c583q6l,t1_c583q2j,1341169028,Oh and eu-w,t3_vvvvk,False,leagueoflegends,0,1429273473,jinx,,1,0,1,Veloxas,t1_c583q6l,False,,t5_2rfxx,0,
True,c583q73,t1_c583iu1,1341169029,"Sorry to disappoint you, but I'm hardly Baruch Goldstein. I don't think Jews are superior (those one has to wonder about our over-representation in academics), and I definitely don't think Judaism (or any religion, for that matter) is superior. 

I *do* believe Muslims (and specifically Arab-Muslims), as a group, are culturally backwards and have a set of ideals that is inherently incompatible with western liberal ideals (e.g. lack of women's rights, honor killings, extensive fundamentalism, etc'). 

I believe that the large Muslim immigration waves into western countries, mostly Europe, will eventually bring calamity on those countries and will force them to choose whether they want to stick to their liberal ideals, or regress back into the dark ages of religious fundamentalism and intolerance.

If that's too shocking for your delicate (American?) ears to hear, then perhaps you shouldn't visit Israel.",t3_vvtdv,False,Israel,0,1429273473,,,5,0,5,OrenYarok,t1_c583q73,False,,t5_2qhvo,0,
True,c583qsb,t1_c5838gr,1341169108,"Well these are simply third party development tools. I don't see what would be illegal about that.  There is no copyrighted material used in their design. Except maybe the DSP-1 chips but they are not cloned they are original chip taken form original Snes games. It think the UK put a ban on the R4DS but I think it was specially on the R4DS and not all flashcart-like device ever created. Anyway check your local laws to be sure. The PowerPak is sold by its developer directly and is based in the USA. The other two are developed in europe and are assembled in the USA by StoneAgeGamer which is one of the main re-seller.

Naturally getting copyrighted roms randomly on the internet is clearly illegal but there is legitimate way to backup the games you own in order to play them on these devices. Like the [Retrode 2](http://stoneagegamer.com/retrode.aspx).",t3_vvqrt,1341172360,snes,0,1429273479,,,1,0,1,zaffo256,t1_c583qsb,False,,t5_2rany,0,
True,c583r1s,t1_c583qlp,1341169146,i took first one on EU-NE ;),t3_vvizp,False,leagueoflegends,0,1429273483,00 team,,0,0,0,Doofenshmitz,t1_c583r1s,False,,t5_2rfxx,0,
True,c583ra5,t1_c57zv4d,1341169180,"Yeah you are right, I was thinking to visit as much cities as possible since I don't know when I will return to Europe, but as THR mentioned, it would be better to lower the amount of places to visit and get to know them better. 
It's going to be funny been a McLaren fan in Monza haha, I might have to go incognito hahaha.",t3_vv9ze,False,travel,0,1429273486,ctr,,1,0,1,idloco,t1_c583ra5,False,Costa Rica,t5_2qh41,0,
True,c583re5,t1_c582i44,1341169194,"I think a lot of Turks would disagree that Western = Better by default.

After the Young Turks split between the Muslims &amp; the Secularists, and after they were properly motivated by **Auguste Comte**, they started committing terrorism against their own citizens. I'm sure they had some legitimate grievances (Abdul Hamid wasn't sticking to the new Constitution), but their methods were treacherous.

Interestingly here is part of Comte's letter to Moustafa Reshid Pasha (among the last remaining great diplomats), indirectly asking him to help Europe against the Ottomans:


&gt;*Since you have been removed from the office you held so successfully, the free time you now have on hand gives rise to my hope that you will invest time into considering my positivist philosophy, which I present to you in general terms, and the universal positivist political system it will create… For many hundreds of years the West as well as the East have searched for a universal, unifying religion. Faith in one religion engages the human emotions and gets a hold on them, whereas experience and reason prove that such hope is unfounded. While progressing from Islam to Positivism, without any need for a metaphysical transformation period, Muslims will soon understand the real maintainers of such elevated thoughts as peculiar to their great Prophet who will systematize religious faith and humanitarian understanding with universal victory*.

&gt;**If the Muslims could be distanced from such an unnecessary sense of political unity, they won't feel sad about the Ottoman Empire's inevitable collapse. On the contrary, they will see that their temporary rule actually limited their society's social development**. *As for the Ottoman chiefs still engaged with the occupation of their lands by lesser nations and the like - once the inevitable takes place, their imaginary fears will disappear and the people will be freed. The political implication of accepting humanitarianism instead of a universally believed God will bring a sense of unity among the people, which Islam's core philosophy so desires. Once the Ottomans replace their faith in God with Humanism, this goal will quickly be attained.*


I believe Reshid lost his position after their friendship &amp; co-operation was discovered.
",t3_vvnap,1341170410,worldnews,0,1429273488,,,4,0,4,AndTheEgyptianSmiled,t1_c583re5,False,,t5_2qh13,0,
True,c583rxa,t3_vvvvk,1341169263,"Oddone because he commentates on the game while at the same time being funny
EU NE",t3_vvvvk,False,leagueoflegends,0,1429273496,00 team,,1,0,1,DestroChis,t1_c583rxa,False,,t5_2rfxx,0,
True,c583ryp,t3_vvvvk,1341169268,"TheOddOne definitely ! He's fun to watch, doesn't hate on people(like some streamers do), explains everything very good. He's just a great guy. EU Nordic &amp; East",t3_vvvvk,False,leagueoflegends,0,1429273496,nocturne,,1,0,1,dodo_ns,t1_c583ryp,False,,t5_2rfxx,0,
True,c583sab,t3_vvvvk,1341169308,"My favorite streamer is Scarra, its a shame he does it so rarely. He is always calm and tries to present constructive critisism instead of getting upset. If you saw his interview with carmack you also know he is agreat funny guy. I am EU-W.",t3_vvvvk,False,leagueoflegends,0,1429273502,anivia,,1,0,1,X52,t1_c583sab,False,,t5_2rfxx,0,
True,c583sbk,t1_c582y05,1341169312,i could really use some help with him (EU) Banorac#2804,t3_vvvm9,False,Diablo,0,1429273500,barb-europe,,1,0,1,Banorac,t1_c583sbk,False,Banorac#2804,t5_2qore,0,
True,c583sls,t1_c583ilp,1341169351,You ever seen a European talk about a Roma? Hooooo boy,t3_vvpad,False,worldnews,0,1429273504,,,4,0,4,getaloadofme,t1_c583sls,False,,t5_2qh13,0,
True,c583sv2,t3_vvvvk,1341169385,"I like General TheOddOne the most, you can learn a lot from him and he's funny at the same time. He has pretty much everything a good stream needs :D

EU-West",t3_vvvvk,False,leagueoflegends,0,1429273508,vayne,,1,0,1,Lolzork,t1_c583sv2,False,,t5_2rfxx,0,
True,c583t8y,t1_c583b5o,1341169438,"Yeesh, straight to the insults. Anyway, people call attention to Israel because of its unique place in the world; Jewish culture and the Jewish people are tied to Europe and to the Middle East. Israel is located in an unstable area where many other nations have a vested interest. It is also easier for many nations to critique Israeli policy than to confront their own mistakes.

I responded the way I did because ""why are you criticizing Israel rather than other people?"" is a common response to any criticism of Israel, and it's almost second nature to phrase my response that way. I'm sorry it hurt your butt.",t3_vvsxm,False,PoliticalDiscussion,0,1429273513,,,3,0,3,SetMeOnFireKerosene,t1_c583t8y,False,,t5_2sfmf,0,
True,c583u1c,t3_vvzof,1341169547,"Ive pax jax na, need pax jax eu-w or riot singed eu-w, pm me if interested",t3_vvzof,False,LoLCodeTrade,0,1429273523,,,0,0,0,joaomaria,t1_c583u1c,False,,t5_2supu,0,
True,c583u56,t3_vvujb,1341169562,"[EU]  or  [NA]  or  [Asia]

",t3_vvujb,False,Diablo,0,1429273524,,,8,0,8,Supajin,t1_c583u56,False,,t5_2qore,0,
True,c583uvx,t3_vvvvk,1341169661,"Scarra or Voyboy..
Good personalities, small egos, never whine or blame, always point out their own mistakes instead of teammates and they are really good ""tutors"". Their behavior itself makes me laugh, especially Voyboy's and both of them are between the best of their lanes (Top/Middle) and they both play in teams i cheer for in competitive LoL scene.

EU West server!",t3_vvvvk,False,leagueoflegends,0,1429273534,zilean,,1,0,1,TvrtketzZz,t1_c583uvx,False,[TvrtketzZz] (EU-W),t5_2rfxx,0,
True,c583uzy,t1_c5806t6,1341169676,I smell another angry European thread coming....,t3_vvkmk,False,AskReddit,0,1429273535,,,4,0,4,dmun,t1_c583uzy,False,,t5_2qh1i,0,
True,c583v5v,t1_c583no8,1341169697,"Aha, great question. four major caveats to this whole crazy thing. 

First, dual criminality is a typical requirement written into extradition treaties and considered an element of the jurisdictional analyses.It is in the UK/US treaty very explicitly. The act needs to be considered a crime in both countries, or else the other country will just say no and move on. 

A second, and related element, is that if the criminal act is constitutionally protected in one nation they will just ignore extradition requests, this also applies to civil claims and is much more distinguishable from the dual criminality idea in that regard. The US will quite frequently ignore requests by other nations for crimes committed in its territory against foreign states and citizens (crimes according to the foreign laws) because of the 1st amendment (free speech). It is easier to understand from the civil side, say a US journalist commits defamation against an Australian (this is a real case), the Australian sues and basically wins his case because the American refuses to show up in Australia (in real life he sued Dow Jones, parent company of The Wall Street Journal). The US will just ignore the judgment (extradition for civil suits is not an option but recognition of foreign judgments is the civil equivalent) and refuse to coerce the American to pay out the damages. 

Third, if a nation considers that human rights will be violated if they extradite to another jurisdiction they will not do it and their is precedent to support this. Most of Europe does not like the death penalty and refuses to extradite murderers in the US unless the prosecutor agrees not to seek the death penalty. 

Finally, a country can consider if the other nation has appropriate due process protections before recognizing foreign jurisdiction over a criminal act. Does the accused get a trial? Is he free from coercion? Does he get counsel? Does he have the right to remain silent? Justice systems vary a great deal and they find differing ways to achieve the same result of due process, but if the requesting nation is not up to snuff legally the nation holding the accused might just say, 'no dice'. 

Oh, and for Assange he was posting classified US information. All States take diplomatic secrecy really really seriously and consider stealing/receiving/transmitting secret information a crime. Now, Assange has made human rights appeals and that is how he has managed to evade US hands. He is hiding out in the Ecuadorian embassy and says that as a journalist he should be protected from unreasonable prosecution for legitimate activities. I believe Ecuador is concerned over the possibility of a death penalty and they are reviewing asylum applications for Assange, but the whole thing is monstrously political and not a lot of sense can be applied to it. ",t3_vvhj5,1341170378,technology,0,1429273537,,,1,0,1,SingularityCentral,t1_c583v5v,False,,t5_2qh16,0,
True,c583vaa,t3_vvvvk,1341169715,"Although I enjoy many streamers, such as oddone, guardsman bob and scarra, my favorite in the end is Dyrus.  He was the first streamer i started watching, and although he may not be the most informative or the most mechanically impressive, but I've always found his personality, weird stories and dry humor to be amusing.

Also his stream is great for when I don't feel like focusing and trying to learn a lot from the stream I'm watching and just want to chill. It feels kinda like hanging out with a friend in skype and playing some normals, with nice music, except it requires less effort and I can do other stuff at the same time.

I'm on EU-west and my account name is Hijakk.
",t3_vvvvk,False,leagueoflegends,0,1429273539,volibear,,1,0,1,trains_smell_juice,t1_c583vaa,False,,t5_2rfxx,0,
True,c583w24,t3_vvwi7,1341169816,ESPN going down is obviously a conspiracy by the US government. They want Italy to win so we can brag about how we beat Italy back in February and how much better we are than the European champions. ,t3_vvwi7,False,soccer,0,1429273557,28,,2,0,2,el_fuego91,t1_c583w24,False,LA Galaxy,t5_2qi58,0,
