score_hidden,gilded,id,subreddit,created_utc,removal_reason,body,name,subreddit_id,author_flair_text,score,ups,controversiality,retrieved_on,edited,downs,author_flair_css_class,archived,distinguished,link_id,parent_id,author
False,0,cjdt0da,tifu,1406880232,,"Where I come from and in all of the EU it's very customary to ask for a monetary settlement in such cases. If the case did go to the court and you won, you would probably be awarded damages and in addition they would be forced to pay legal fees, perhaps for both sides depending on which country you are in. So I would say yes I think it's very reasonable to ask for a monetary settlement.

The size of the settlement varies very much from country to country. Looking at similar cases might help you figure out the amount, if you can figure out the national courts database in your country. (This is usually fairly easy with a bit of googling). In my country (Iceland) the damages awarded are usually quite small - for a case like this I might guess $1.000 - $15.000 depending on the scale of the publication.

As with all court cases your win (if you went to court) is not guaranteed and as such any settlements would probably be less than the courts would award you.

Anyway I would always request a settlement in exchange for dropping a potential lawsuit because the worst thing that could happen is they reject it. Best is they accept and if not they may make a counter offer.
At the least they should pay any legal fees that you've incurred.
Then there's also the question of whether you want them to publish an apology. That is very common in some similar cases but there's always the question of 'do you want the attention?'

Bottom line: Always a good idea to ask for compensation since court cases usually end with damages being awarded in case of your win.",t1_cjdt0da,t5_2to41,,1,1,0,1435012614,False,0,,True,,t3_2c94fe,t1_cjdsbbc,baldurkm
False,0,cjdt1iu,ireland,1406880381,,"1. they're as eastern as poland.

2. i said that because i see lots of eastern europeans, from different countries as they as all speak english to each other, hanging out together at the gym. i never said irish lads didnt hang out with them too. now fuck away off from me you asshole.",t1_cjdt1iu,t5_2qhb9,,0,0,0,1435012631,False,0,,True,,t3_2c7w4q,t1_cjdn7f5,rapmachinenodiggidy
False,0,cjdt1ss,news,1406880416,,"Gee, I wonder why. Did you ever think of looking at their behavior and thinking that might have some responsibility for something? Ever heard of a gang? That's what judaism is. They're an exclusionary, racial and religious-supremacy based gang like the Aryan Brotherhood with a religious component(a lot like the Aryan Brotherhood) to which you must prove your racial purity to join.

Finally the European nobility decided to put them out in the desert in the middle of nowhere and *still* they find a way to piss off all their neighbors and murder everybody while acting in a contemptuous and morally abhorrent manner(denying their own behavior or any responsibility for anything). Gee, I wonder why they were persecuted before they arrived in a region where they could be the persecutors.

We persecute the Aryan Brotherhood because they are an exclusionary racial/religious supremacy group committed to being divisive and violent. Who else's behavior is like that?",t1_cjdt1ss,t5_2qh3l,,-2,-2,0,1435012627,1406881063,0,,True,,t3_2c9n0f,t1_cjdnv63,[deleted]
False,0,cjdt2g2,leagueoflegends,1406880502,,"Firstly Alex has a family, wife and kid. That said, Gambit is a Russian org, so they can't get a gaming house in Europe, and visas are complicated.  He wanted to spend more time with his family while retaining a league career.  I suppose a good challenger team was a good solution for this. 

Lastly, and big reason he mentioned was that the team(Gmb) no longer felt like a group of friends, but  more of a business. And he mentioned the specific attitude of certain players, adding that Edward was the only person on the team that he was really friends with. So I suppose it was a  really stressful environment during the last split with them, considering gambits reputation.",t1_cjdt2g2,t5_2rfxx,,2,2,0,1435012633,False,0,14 team,True,,t3_2ca1l2,t1_cjdqtp1,JabbaMangoFish
False,0,cjdt2nx,MonsterHunter,1406880533,,Let's prepare for the insane amount of lag between EU and NA!,t1_cjdt2nx,t5_2rron,,1,1,0,1435012644,False,0,CA4,True,,t3_2c9ryf,t3_2c9ryf,lovethecomm
False,0,cjdt3cf,AskUK,1406880620,,"Hi, no, no American history at all (and I have a BA in History). What you've got to understand, I guess, is that the UK does have a lot of history itself (England has had at least two of its own civil wars for example - 1135-54 &amp; 1642-51) and then that its history has been influenced mostly by other cultures that we also study - so, for instance, most of Europe (we've has centuries worth of wars with different European countries), the Romans, Vikings, all those countries we conquered and occupied... the list goes on. The USA itself is a fairly recent thing and as a result you've only recently been having an impact. 
On the other hand I suspect the UK's impact on the US has been proportionately higher. 
 Hope that answers your question.
",t1_cjdt3cf,t5_2t4s3,,27,27,0,1435012645,1406880924,0,,True,,t3_2cb7oh,t3_2cb7oh,dilont
False,0,cjdt3fv,creepyPMs,1406880633,,"As a dual citizen, both American and European, I require a whole lot more than that in a dating partner. Not being a bigot is one of them.

Fucking red pillers. Why they think a woman with exotic background would tolerate them more than an American is beyond me. I find it incredibly insulting. I believe part of it stems from the idea that outside societies are more patriarchal, more repressed, and therefore the women may be less likely to resist being mistreated. In fact, I find male sexuality in America highly restrictive. Everytime I date a guy he acts like I'm giving him some kind of sexual revolution. They need to educate themselves. Badly. ",t1_cjdt3fv,t5_2ug83,,11,11,0,1435012646,False,0,,True,,t3_2c98iy,t1_cjdry95,Prinsessa
False,0,cjdt454,navy,1406880723,,"For TV, you can get an AFN decoder box (Armed Forces Network), which gets hooked up to a satellite dish (I'll be paying an installer to come out and put up a dish). We get internet and cell through Movistar -one of the big Spanish telecomms. We also got a home phone with a Texas area code through MagicJack, so the family in the states don't pay a mint to call us.

You're allowed to ship one car. If you have a motorcycle, you can ship that with your household goods, though it counts against your total HHG weight. We're buying a second car next week (found a VW Golf the wife likes). I would HIGHLY recommend looking into a diesel car, as diesel is easier to find out here (I brought my '10 Jetta TDI over, and she's getting a Golf TDI). Also, European streets typically don't handle large vehicles well. I've seen folks who brought over F250s and Ram 2500s, and they have a helluva time driving and finding parking off base.

The wife and I are trying to learn Spanish, but it's not easy (for me, anyway). Also, folks out here have an odd accent (example: they pronounce Jerez as ""Hu-reth"" instead of ""Hu-rez"", and ""Gracias"" is ""Gra-the-ath""). I've talked to other Spanish speakers, and they agree it's a bit odd. Long story short: if you know a small bit of Spanish (""how much ..."", ""where is ..."", ""how do you say ..."") you can generally pidgin your way through a conversation. The locals understand not everyone speaks Spanish, and this area's a big tourist spot, so they're typically accommodating.",t1_cjdt454,t5_2rg06,,1,1,0,1435012653,False,0,FC,True,,t3_2b51ea,t1_cjdi710,crunchy_peanutbutter
False,0,cjdt5c0,worldnews,1406880877,,"basic hygeine has existed a lot longer than teh 1800s.  Maybe in Europe, it just recently became popular, but it's existed in other cultures a lot longer.  Maybe not to the current extent we've developed basic hygeinic practices, but it's been around in plenty of civilizations longer than a couple centuries.",t1_cjdt5c0,t5_2qh13,,1,1,0,1435012660,False,0,,True,,t3_2c9158,t1_cjdsaj8,NeiltheGrasse
False,0,cjdt64i,funny,1406880983,,"""In two separate papers, published in the journal Science and in the Journal of Clinical Investigation (JCI), researchers describe new genetic factors that could explain weight gain in some people. In the Science study, researchers at Boston Children’s Hospital studying mice found a rare genetic mutation that prevented the animals from burning off fat calories. They also found the same gene was mutated in a group of obese people. And a team based at University College London reported in JCI that a specific form of a gene previously linked to obesity, FTO, can increase craving for high-fat foods.

The discoveries add to the growing body of knowledge about the biology behind weight, and the results confirm that while it’s represented by a single number, weight is the complex combination of a multitude of different metabolic processes, from brain systems that regulate appetite to enzymes that control how efficiently calories are turned from food into energy that the body needs. Making matters even more confusing, these factors are also likely influenced by environmental contributors such as diet and lifestyle.

In the mouse study, the research team determined that mutations in the Mrap2 gene led the animals to eat less initially but still gain about twice as much weight as they normally would. While their appetites returned, these mice continued to gain weight despite being fed the same number of calories as a group of control animals. That led the scientists to figure out that the mice with the mutated gene were simply sequestering fat rather than breaking it down for energy. The mice, like people, possessed two copies of the gene, and mice with even one defective copy experienced significant weight gain, although not as much as those who had two mutated versions of Mrap2.

The scientists found a similar pattern among a group of 500 obese people; they detected four mutations in the human version of Mrap2, and each of the obese individuals possessed only one bad version of the gene.


In the British study, the researchers divided a group of 359 healthy men of normal weight by their FTO gene status. The majority of the men had low-risk versions of the gene, while 45 of the participants had mutations that have been linked to greater appetite and caloric consumption. To figure out how the altered genes were affecting appetite, the team measured levels of the hunger hormone ghrelin both before and after meals that the participants ate; the men with the mutated form of FTO did not show the same drop in ghrelin levels, signifying that they were full, as the men with the low-risk form of FTO.

Genome wide association studies, which compare genetic makeups of obese individuals to those of normal weight, are making it easier to flesh out important genetic factors contributing to weight, and researchers at the Harvard School of Public Health say that to date, these studies have identified over 30 candidate genes on 12 chromosomes associated with body mass index.

“Thus far mutations in about eight genes are known to cause obesity in humans. But these mutations account for under five percent of the obesity in our society, and certainly are not, by themselves, responsible for the current obesity epidemic, since the mutation rate in these genes could not have changed dramatically during the past twenty years,” says Dr. Joseph Majzoub, the chief of the division of endocrinology at Boston Children’s Hospital and an author on the Science paper. “However, mutations in these genes have led to the discovery of pathways that are important in energy balance in humans, giving us hope that drugs can be developed that affect these pathways to prevent excessive weight gain, either by curbing appetite or increased burning of calories.”


Here is a round-up of some recent genes, and their products, that have been linked to obesity :

Leptin: Often referred to as the “obesity hormone,” leptin is made by fat cells and acts as a thermostat for the body’s energy needs. Each individual has his own leptin threshold; if leptin levels fall below that amount, the brain understands that the body is starving, and needs more calories. If leptin levels are maintained or surge above that amount, the brain knows that it doesn’t need to take in more food. Unfortunately, while mouse studies showed that overweight mice had lower levels of leptin, the same wasn’t true of obese people, who generally show higher levels of leptin in their blood. Somehow, researchers how believe, these people are not getting the signal to stop eating, which is referred to as leptin-resistance.

Ghrelin: This gene makes an appetite hormone that can make foods look more desirable–especially high-calorie ones — by influencing the brain’s reward system. Some studies have found that  people who are sleep-deprived have increased ghrelin levels, which may explain why lack of sleep can contribute to weight gain.

Neuropeptide Y: One of the brain’s many chemicals, neuropeptide Y may trigger eating by manipulating appetite, possibly resulting from changes in mood and stress levels. It may also contribute to an increased deposition of fat from food calories.""

Source: http://healthland.time.com/2013/07/19/news-genes-idd-in-obesity-how-much-of-weight-is-genetic/",t1_cjdt64i,t5_2qh33,,1,1,0,1435012668,False,0,,True,,t3_29k7zu,t1_cjdslxh,kick_his_ass_sebas
False,0,cjdt7nn,lfg,1406881187,,"What timezone are you in? I'm in EU, if that's good I might be interested enough to read through for 4e and DM for you (I usually DM 3.5e).",t1_cjdt7nn,t5_2rcvr,,1,1,0,1435012690,False,0,,True,,t3_2caid6,t3_2caid6,TheDreadfulSagittary
False,0,cjdt7tr,avfc,1406881210,,"Actually, we have a pretty good scouting network. Houllier's work, mostly. We have strong networks in Holland and Belgium in particular, actually. There are lots of technically sound players in both leagues who could make the transition.

As for the reason these players aren't getting the chances they might have gotten elsewhere... I covered this somewhere else. It's the same reason we have one of the best academies in Europe but don't seem to promote many players to senior level. We don't have the luxury of taking time, and bringing them through alongside top players where they can develop in a relatively safe environment. We don't have a danger room, we throw them straight into fights with sentinels. This is the real reason Lambert is bringing in experience. Not because he honestly thinks the young players he has brought in aren't good enough (with a few exceptions, like Bowery).

So yeah... I still think you're being overly harsh. Things really aren't as bad as you're making them out to be. We're still in a pretty decent position. Let's put it another way... how many young players from other teams in the bottom half of the Premier League would you take over existing options at Villa? I doubt there's many. And even if it does take them a few years to be ""good enough"" so what? Players typically hit their prime in their late 20s. That's kind of how it's *supposed* to go.

So yeah. We have the foundation, it will just take time. We'll ride this out and come back stronger. It has happened before.",t1_cjdt7tr,t5_2s569,Joe le Tactics,1,1,0,1435012695,False,0,,True,,t3_2c9l71,t1_cjdixbj,chamber37
False,0,cjdt7xc,GlobalOffensive,1406881226,,"Yeah, sure, but SK is pretty much the gold standard of 1.6 play. To compare the NA teams to coL, coL went undefeated in their first season in invite. Nobody was on the level that 3D or coL were, and they were the only two teams playing at the same level as their european counterparts.",t1_cjdt7xc,t5_2sqho,,1,1,0,1435012693,False,0,,True,,t3_2caxjh,t1_cjdt6bz,[deleted]
False,0,cjdt7ys,bicycling,1406881230,,"Actually, in Europe, we discuss that it exemplifies everything that's wrong with the US concerning elected officials.

Starting with a red SL ... those are driven by hairdressers ... lol",t1_cjdt7ys,t5_2qi0s,,51,51,0,1435012693,False,0,,True,,t3_2cax8k,t3_2cax8k,[deleted]
False,0,cjdt99x,leagueoflegends,1406881404,,"I´m unfortunately from europe, and on NA servers have around 110 ping, which is not really viable for playing riven, you need low ping and quick fingers for that.",t1_cjdt99x,t5_2rfxx,,1,1,0,1435012711,False,0,01 team,True,,t3_2cafwa,t1_cjdpuyy,I_Love_HotshotGG
False,0,cjdt9k3,russia,1406881446,,"&gt; And it's not like there were promises not to expand eastward given when Gorbachev pulled the Soviet military from Germany. And it's not like the leaders in question were American puppets, often as obviously as having dual citizenship, having their spouses from Langley, etc.

I don't give a shit what Americans promised you, it was OUR choice to join Nato, it was OUR choice to join the EU. Deal with it! 

Edit: I mean no disrespect, but why do Russians think it was an American plot that made the Eastern/Northern European countries so Russophobic and made them join the Nato and EU as quickly as humanly possible? It was because for the last 25 years we've been under a policy of indescribable fear and a lot of hatred for what happened and what is happening. ",t1_cjdt9k3,t5_2qh75,Latvija,3,3,1,1435012717,1406881804,0,latvia,True,,t3_2catpe,t1_cjds2v7,Paravin
False,0,cjdtakd,todayilearned,1406881585,,"I don't remember the article (or other sources) mentioning that they have a disproportionate amount of Neandertal DNA.  The proportion is probably about the same as other europeans because their populations diverged well after the extinction of Neandertals.  Also, apparently Middle Easterners have the greatest proportion of Neandertal DNA (don't remember the source).",t1_cjdtakd,t5_2qqjc,,1,1,0,1435012738,False,0,,True,,t3_2c8eag,t1_cjcxr71,NotATroll71106
False,0,cjdtb52,funny,1406881659,,"No, but the local government does. Do you think you could install a rocket launcher on top of a hospital or a school in US or any EU country and fire it for days without any repercussions?",t1_cjdtb52,t5_2qh33,,-6,-6,1,1435012734,False,0,,True,,t3_2cap0c,t1_cjdta5q,MadWombat
False,0,cjdtbay,worldnews,1406881681,,"There might not be an American or European politician but Brazil has recognised Palestine as a state and Bolivia even labelled Israel as a terrorist state.
Look up Israel's childish response to Brazil. They not only called Brazil an economic dwarf but also rubbed in their 7-1 soccer loss against Germany. Unfortunately I'm on phone so it's a bit difficult to link atm.

Edit: sorry, typo. *diplomatic dwarf",t1_cjdtbay,t5_2qh13,,91,91,0,1435012738,1406908130,0,,True,,t3_2cb446,t1_cjds9oz,ButterChickenNao
False,0,cjdtc4c,DotA2,1406881792,,"Well.. they seem to add quite a markup if the batrider T-Shirt for 34€ is anything to go by.

And I guess shipping and handling wont be free so I'm not holding my breath yet. 

Although it probably beats valves shipping costs to europe so lets see how it all works out...",t1_cjdtc4c,t5_2s580,Herder of squids,1,1,0,1435012748,False,0,dark,True,,t3_2cbhe0,t3_2cbhe0,mallobike
False,0,cjdtcli,worldnews,1406881861,,"Israel is basically a European country or an American territory, but situated in the Middle East. They are a watchdog, in my opinion.  American military gurus are always very nervous with what is going on in hostile regions in the Middle East, and for very good reason.  It's nice to have a well-trained, well-equipped army only a few hundred miles away.

I don't like Israel's land grabbing tactics, but those are some basic reasons why the US supports them.  They are an extension of our military, and keeping other nations in-check, and not letting them even imagine doing something too crazy.  
",t1_cjdtcli,t5_2qh13,,1,1,0,1435012754,False,0,,True,,t3_2cb446,t1_cjdqc3f,einperson
False,0,cjdtd4m,ireland,1406881928,,"They're not being commemorated as heroes, they're being commemorated for fighting in World War I, a war that is (finally) being seen more and more as a sad sorry and pointless affair in the history of Europe.

These men didn't have jobs, opportunities or often even a decent education and took a position in the British army to feed themselves, their families or take care of loved ones at home. 

They fought and died in places as far flung as Gallipoli, Gaza and the Somme all to feed their families or get away from a land broken by a cycle of poverty and no hope.

It's about time that they're recognised not for fighting for King or Kaiser or whatever other bullshit term dissidents want to adopt for their own political purposes but for being ordinary men (and women) caught up in a sad sad part of history.

This lot would be better off vexing their opposition to issues that actually effect Irish people today but that doesn't give you a nice day out screaming your head off about the terrible Brits.",t1_cjdtd4m,t5_2qhb9,,12,12,0,1435012760,False,0,,True,,t3_2cacwr,t1_cjdlf61,stakey
False,0,cjdteah,AskReddit,1406882085,,"Germany had only been out of power for a little under 20 years.  That's not an insane turnaround from a historical perspective, and ""nearly conquering europe"" isn't a huge accomplishment either, since he failed miserably at the end.  War isn't a game of horseshoes, and you don't get points for close.

I think there are a multitude of factors that lead to demonizing Hitler as opposed to glorifying him, though, and time is only a very small one.  But mostly it's that Hitler and Stalin are notorious for their *domestic* atrocities, and not their conquests in war.  They're well known for killing their own citizens.  And we can't hold Genghis Khan to that standard, because regularly killing your own citizens was a well-accepted way of maintaining order in most large scale societies at that time. 

And on top of that, Hitler's domestic genocide was the thing he did that stood out the most.  He certainly didn't accomplish anything in warfare that was as memorable as his mechanized attempt to wipe out an entire race.  Noted in the fact that your references are entirely to their domestic killings.",t1_cjdteah,t5_2qh1i,,3,3,0,1435012776,False,0,,True,,t3_2c9eby,t1_cjdt0w7,SteakAndNihilism
False,0,cjdteat,pics,1406882086,,"Hamas has agreed to the US-EU demands to a unified government and Israel refuses to negotiate. Israel is the party that ended negotiations once Hamas and Fatah united. Israel will always concoct another excuse or pretext to delay negotiations because of the illegal settlements. Every international law says that Israel's settlements are illegal. 
see: http://www.khilafah.com/index.php/concepts/political-concepts/18621-hamas-fatah-unity-deal
*edited: link added
",t1_cjdteat,t5_2qh0u,,1,1,0,1435012776,False,0,,True,,t3_2c9p5e,t1_cjdiq4x,kenjen18
False,0,cjdteho,hearthstone,1406882115,,"What i think actually happened is that when Blizzard had their legal notice and rules Romania was not in the European Union, this has only happened in 2007 and i don`t think Blizzard reviewed the legal notice regarding allowed countries.",t1_cjdteho,t5_2w31t,,2,2,0,1435012778,1406883665,0,,True,,t3_2c8vdy,t3_2c8vdy,dragoman703
False,0,cjdtenp,Buttcoin,1406882137,,"One of the problems with Bitcoiners is that a lot of them see everything from the US point of view. The US payments system is currently lagging innovation in other parts of the world and they assume that it represents the world. In Europe, because of the Sepa system I can transfer payments almost instantaneously across European countries, and be confident they will be processed and confirmed. In the UK banks now have the capability to allow customers to send money via text messages INSTANTANEOUSLY. In Kenya m-pesa is more popular than any banking deposit system. There is no reason why US banks can't follow in the same direction, and from what I understand that is eventually the plan. For them to do so. Problem is it takes political will to set up a system like sepa across the world. But America's anti-collaborative factions (who view any coordinated system like sepa as a socialist monstrosity) get in the way of such a system being developed in the US or on a US cross border connected way. So you US citizens all get penalized with crappy payment networks because of your fear of a little bit of socialistic grand project work on the payments side (yes it takes evil government infringing on the payments industry to create a system like sepa). The funniest thing about the bitcoiners is they don't even notice that their solution to the problem depends on a much more communist-like collective model than sepa could ever hope to be. With bitcoin the system clearly obliges each according to his hashing ability to provide to each according to his transfer need. All based around a much more powerful manifesto and cult system than Marx's and Lenin's ever was. Funnier still, there's an equal reluctance by the bitcoin collective to acknowledge that the system is flawed and prone to corruption and exploitation of the bitcoin worker bees just the same way the communist system was. But the brainwashing has been that good I guess. 
",t1_cjdtenp,t5_2sngy,,9,9,0,1435012781,False,0,,True,,t3_2cbg5u,t3_2cbg5u,Bitcoincrassus
False,0,cjdtfpz,MURICA,1406882284,,I am not American I am Australian and know many people from Eastern Europe that live here and they always bash America whenever they have the chance... Fuck knows why.. It's like this petty hatred or jealousy. I reckon America is pretty cool.,t1_cjdtfpz,t5_2u28p,,5,5,0,1435012795,False,0,,True,,t3_2c9eli,t3_2c9eli,thegrrbrr
