subreddit_id,distinguished,body,author_flair_css_class,ups,name,author_flair_text,gilded,created_utc,archived,link_id,retrieved_on,author,id,score_hidden,controversiality,score,edited,downs,parent_id,subreddit
t5_2qpp6,,"Oh, you were talking about that, well, that Europe has the biggest Starcraft scene is quite well know, if you check http://nios.kr/ , you can quickly see that America, which makes up most reddit users only makes up for about 35% of ranked starcraft players, with Europe making up for over 40. 

I always thought Dota was very popular in America, so if a majority of Dota players would be from America (which I no know is totally wrong) Dota reddit having much more viewers on reddit would be only logical.

Edit: as I side note, I know that those are only ranked stats (So you have to take into consideration that many people play on multiple servers), but the fact that Starcraft is more popular in Europe than America can also be seen at Tournament views, sheer amount of players etc.",T,1,t1_cbzktuz,Terran,0,1378042364,True,t3_1li8rz,1429627365,Bohnenbrot,cbzktuz,False,0,1,False,0,t1_cbzkpqf,starcraft
t5_2qpp6,,"No. He is (likely) European. They have the the commas and decimals the other way around.

899,904$ is the same as $900.904 (but since we don't have hundredths of a dollar, $900.90)",Z,14,t1_cbzku1f,Zerg,0,1378042392,True,t3_1liia3,1429627363,Sevion,cbzku1f,False,0,14,False,0,t1_cbzkrjp,starcraft
t5_2qh7i,,"I think this is the same show as my ""live in Europe"" set. It has the same track list. Great concert.",,1,t1_cbzku4d,,0,1378042403,True,t3_1lhz4y,1429627362,beerice41,cbzku4d,False,0,1,False,0,t1_cbzg3pb,vinyl
t5_2qpp6,,"Nono, he should stay with English! HE should be a European Terran, not just a small time German community guy.",,10,t1_cbzkwg6,,0,1378042734,True,t3_1lihlc,1429627332,GermanIdiot,cbzkwg6,False,0,10,False,0,t3_1lihlc,starcraft
t5_2rgs7,,"I was getting a greyed out start button followed by 2002.  Now I'm getting a 1017 when trying to log in, followed by a 5006 to crash the game.  I also got a 90000 earlier.  Haven't managed to see the NA/EU servers all morning...

Gotta catch 'em all!",,1,t1_cbzkww8,,0,1378042795,True,t3_1lihy6,1429627326,AniDanny,cbzkww8,False,0,1,False,0,t3_1lihy6,ffxiv
t5_2qzb6,,that's the problem. EU wants something to happen but won't do anything about it the US will go in and  try to help and be hated for it.,,1,t1_cbzkx0n,,0,1378042812,True,t3_1lhtlx,1429627325,usrevenge,cbzkx0n,False,0,1,False,0,t1_cbzi6ke,IAmA
t5_2qpcz,,"Sadly I'm not gonna be backpacking, I have a really bad back so walking already bothers me. This is why I'm trying to do as much traveling as possible while I can, but I this is the main reason I gotta stay at hotels to leave my stuff there. 
Who knows we might end up being in Europe around the same time, my trip is not completely planned out yet, it really is much easier, entertaining, and safer being with someone else at least part of the trip.",,1,t1_cbzkxsv,,0,1378042917,True,t3_1l5sxh,1429627314,Fiasko21,cbzkxsv,False,0,1,False,0,t1_cbzkjyc,backpacking
t5_2qh16,,"I agree with you on the third, and have no idea on the first, however, your second point: in Europe (at least in the jurisdictions I know) you don't get to sue the government/someone because their actions got you caught by the police. I mean, technically you get to sue them, but you'll be laughed out of court.

 I am not as familiar with the US, but I suspect it'd be the same. Can a criminal actually sue the government because he was unable to reach his car's peak speed performance while speeding away from the cops due to the bad road conditions? Or sue a person because their truck forced him to stop and get caught?

 If they can... That's a very silly justice system you've got there.",,1,t1_cbzkycj,,0,1378042988,True,t3_1liix2,1429627307,Krystilen,cbzkycj,False,0,1,False,0,t1_cbzkfh8,technology
t5_2rfxx,,doublelift needs to come to eu and join clg.eu (EG). ,10 team,1,t1_cbzkyq7,,0,1378043043,True,t3_1lhwfz,1429627302,PremadeTakeDown,cbzkyq7,False,0,1,False,0,t3_1lhwfz,leagueoflegends
t5_2ssp3,,"It's no really a case of decline but more a case of being surpassed in economic growth. This had a number of reasons: 
 
- Mercantilism/Colbertisme (other country's protecting their own trade) Example: Act of Navigation (1651) Banned foreign ships from trading in English ports.  

- high wages/ low productivity 

- Costly wars and disastrous wars. In 1672 an alliance of France, England, Sweden, Munster and Cologne Invaded the Netherlands and almost conquered it. This year is dubbed rampjaar (""disaster year"") in Dutch. 

- Political Corruptness/Laziness the Netherlands where a republic and governed by a group of people called 'regenten' they where members of rich and influenced families, the most important regent was the *raadpensionaris van het gewest Holland* of *Landsadvocaat* the most important military role was *de Stadhouder* *de facto* was this a hereditary position hold by a member of the House of Orange. 

 There was always a power struggle between the *Staatsgezinden* ( people who supported the Landsadvocaat ) and the *Prinsgezinden* ( people who supported the Stadhouders ) in times of peace and prosperity the *landsadvocaat* held the most power, between 1650 and 1672 there was no *stadhouders*. when in 1672 the french invaded the people blamed the regents for the state of the army and demanded a *stadhouder*. William III was made *stadhouder* and defended the republic. William had ambitions to become king! and in 1689 he became king of England, this meant safety for the Nederlands but the Bill of Rights prevented that William revoked bills like The Acts of Navigation. But it also meant that The Netherlands needed support England in some large wars, with peace deals that clearly favored British interests. (I'am looking a you Peace of Utrecht (1713)) 

 In the same period ( early to late 18th centenary) the ruling class became corrupted and lazy they where more busy protecting their interests than protection the Dutch interest, they where becoming also more of a aristocracy/Plutocracy. They where appointing important jobs to each other, it was increasingly harder to join their class.

- Political stability in the rest of Europe
  One of the most important factors in the decline of the republic is the growth of other countries. The Netherlands is a small country ( DUH ) and can't produce the same amount of goods than the economic power house France, the same is with manpower and military strength. The Dutch Republic most successful years where in the period that England, France and The Holy Roman Empire where weak. 
 
 England had to deal with their civil wars (1639-1651) and the political aftermath. From 1688 there was a fast economic growth.  

 France became a powerhouse under the rule of Louis XIV (1643-1715) he gave France the largest army in the world, this forced the Dutch to invest in their army what raided the tax burden in the Netherlands.

 between 1618-1648 their was the 30 year war in the HRE which devastated much of what is now Germany. The Netherlands where involved in this war, but the war didn't affect the Netherlands that much. After the war the HRE could rebuild them self.

**TL;DR: The rest of Europe gets their shit together and simply out growth the Dutch. While the Dutch lost their edge they didn't had an answer**",,73,t1_cbzkz15,,0,1378043084,True,t3_1licts,1429627298,PietjepukNL,cbzkz15,False,0,73,False,0,t3_1licts,AskHistorians
t5_2qqjc,,"""Aryan"" probably does, it literally just means 'Iranian'. ""Nordic"" on the other hand, as denoted by the name, originates from *Northern* Europe.",,10,t1_cbzkzbo,,0,1378043127,True,t3_1liej0,1429627295,anglis,cbzkzbo,False,0,10,False,0,t1_cbzkx7a,todayilearned
t5_2rgs7,,"Getting ""unable to update the group NA/EU list"" once I can even get into the lobby. Stop blaming afk players for all your problems. ",,0,t1_cbzkznm,,0,1378043171,True,t3_1likwu,1429627290,[deleted],cbzkznm,False,0,0,False,0,t3_1likwu,ffxiv
t5_2rgs7,,"If you get ""Unable to load NA/EU worlds,"" I think you're better off restarting the client.",bard,3,t1_cbzl041,Markus Brightsky on Hyperion,0,1378043227,True,t3_1likk9,1429627284,gaygeekdad,cbzl041,False,0,3,False,0,t1_cbzkyaa,ffxiv
t5_2cneq,,"This is completely untrue. European here... Many of us are sick and tired of the world's policeman, The USA.... believe me. We do think your country is a policeman desperately trying to create a worldwide police state with a massive defense system. ",,1,t1_cbzl2p3,,0,1378043573,True,t3_1lhfoc,1429627251,[deleted],cbzl2p3,False,0,1,False,0,t1_cbzcs1r,politics
t5_2qh1i,,Because the US by by far the largest consumer of oil.  We consume 50% more oil than ALL of Europe combined.,,1,t1_cbzl3g4,,0,1378043674,True,t3_1li6co,1429627241,brock_lee,cbzl3g4,False,0,1,False,0,t1_cbzgyi0,AskReddit
t5_2qh4j,,"It would be of great benefit to not only the local population of Brighton, but also a great demonstration to the rest of the area (county/nation/EU) that such programmes work to help everyone in the community.

A classic example of such community care for addicts can be seen in the magnificent work performed by [Insite](http://en.wikipedia.org/wiki/Insite) in Vancouver.",MALT,3,t1_cbzl3z9,Malta G.C.,0,1378043742,True,t3_1li63v,1429627234,grabberfish,cbzl3z9,False,0,3,False,0,t1_cbzjqlm,europe
t5_2rfxx,,"EG aka CLG.EU Came 3rd last worlds, so yeah.. they are",,1,t1_cbzl47z,,0,1378043779,True,t3_1lidru,1429627231,GoSuAmazing,cbzl47z,False,0,1,False,0,t1_cbzksry,leagueoflegends
t5_2rfxx,,CLG.EU vs M5 at Dreamhack ;),,1,t1_cbzl4dh,,0,1378043797,True,t3_1lhhll,1429627229,Elandui,cbzl4dh,False,0,1,False,0,t1_cbzl1kv,leagueoflegends
t5_2qh8e,,"I'm not sure why you're wanting fiscal conservatism in Australia, considering that *it went so well in the European countries most hit by the GFC* (/s). Labor's policy of injecting money into the economy ensured that we rode out the GFC in the best situation we could be in. Frankly, at this point fiscal conservatism is only going to hurt us.",,1,t1_cbzl5aw,,0,1378043920,True,t3_1lid70,1429627217,darth_static,cbzl5aw,False,0,1,False,0,t1_cbzkxb4,australia
t5_2qqjc,,I seem to remember Hitler claiming that the curse of tobacco in Europe was revenge from Native Americans because Europeans introduced alcohol to their land.,,10,t1_cbzl647,,0,1378044026,True,t3_1liej0,1429627207,roughmusic,cbzl647,False,0,10,False,0,t3_1liej0,todayilearned
t5_2tb4r,,"Good luck, hopefully you'll find someone who can help you.  I am not in EU so unfortunately I can not.  :(",spotlight,1,t1_cbzl6dh,Community Spotlight | Frequent Gifter | Grabbed,0,1378044059,True,t3_1lifis,1429627203,MaximumDan,cbzl6dh,False,0,1,False,0,t1_cbzl2um,GiftofGames
t5_2qh13,,"America spends more on its military than the EU, and china, and russia, and Australia combined. In terms of ability to intervene, America is more able than any other nation on the planet.

",,2,t1_cbzl6ty,,0,1378044119,True,t3_1lgzwp,1429627197,[deleted],cbzl6ty,False,0,2,False,0,t1_cbz6kt1,worldnews
t5_2s527,,"This prevents patching in my case (eu). If I dont have the movie files correctly named and rw on the .inis it wont patch for me. 

Remember this might also differ between the regions, not only patches. ",,1,t1_cbzl6v4,,0,1378044124,True,t3_1bdx65,1429627197,Dunyan,cbzl6v4,False,0,1,False,0,t1_c969w3m,TeraOnline
t5_2qqjc,,"Actually, Native Americans could be closely related to the Scandinavians and other Northern European folk: 

http://www.sciencedaily.com/releases/2012/11/121130151606.htm",,3,t1_cbzl7is,,0,1378044210,True,t3_1liej0,1429627188,simon-gould,cbzl7is,False,0,3,False,0,t3_1liej0,todayilearned
t5_2qh4j,,"Yes, I'll wait for a non-British source. It's commonplace from them to lie about European policies, the EU even has a blog to correct them. ",FRAN,7,t1_cbzl87o,best side of the channel,0,1378044293,True,t3_1liinn,1429627179,quiditvinditpotdevin,cbzl87o,False,0,7,1378045378,0,t1_cbzkwuy,europe
t5_2qh1i,,europe sounds awesome for this. lots of parents seemt o let there kids watch a gorey bloodbath (at least more then any nudity) while europes much more happy with nudity and the likes.,,-2,t1_cbzl8br,,0,1378044309,True,t3_1lieic,1429627178,midnightmealtime,cbzl8br,False,0,-2,False,0,t1_cbzko2i,AskReddit
t5_2s580,,"LoL was a relatively new game when the koreans entered, so they could develop their own style on the game and perfect it.

That's what china have been doing since 2008 or something. Yet they lost quite handily this year. They got complacent, thought they where better than everyone else. But in EU we had loads of tournaments all the time, that's what is needed to get good at Dota, play tournaments.

The Chinese was practicing all the time, much like the Koreans are, but that gave no results since they had 4(?) tournaments. 

Koreans need loads of tournaments and can't close themselvese off. If they do that, nothing will happen.
They need to get out of korea and play the chinese and westerners.

We will gain nothing by competing the koreans, they will gain tons.

",oracle,31,t1_cbzl8ri,,0,1378044363,True,t3_1liirz,1429627172,Ortekk,cbzl8ri,False,0,31,False,0,t1_cbzko29,DotA2
t5_2uqat,,"Used the vassal-core-convert-thingie to spend my adm points elsewhere. Used my vassals as anti-CB shield versus Europe at game start and focused mostly on eastern conquest.

It's pointless to continue after 1650 because you lose the holy-war cb. So, I stopped after 1647.

I had 2 massive bad luck:

* Mamluks got a PU with Timurids in early game (their sultan died fast and PU got broken.)
* My 76 year old Sultan died and his 60 year old Heir got the throne, then he died 2 years later. I had to suffer a bad regency for between ~1572-86 while I was at max power.

**note: try this link if you can't see the animated image** --&gt; https://dl.dropboxusercontent.com/u/106409304/Reddit/output_nAbQ1W.gif",,10,t1_cbzl902,,0,1378044395,True,t3_1liltj,1429627169,Qahlel,cbzl902,False,0,10,1378044950,0,t3_1liltj,eu4
t5_2rfxx,,"If Riot wanted to keep LCS having only smaller number of teams, as well as rare international tournaments, they would benefit so much by making the world championships a huge event that would last a whole month (long-ish big event like World Cup in football/soccer instead of 2-week tournament like Grand Slam in tennis). 



24 teams might sound a lot, but if we break it down to 4x NA, EU, Korea, and China, then 2x Taiwan and SEA, Wildcard A (Brazil, Oceania, etc), 1 All-Star winner, and 1 Wildcard B (fifth in NA, EU, Korea, China, third in SEA/TW minus the All-Star winner), then it would make a lot of sense.


Group stage to be Bo3 each:


Group A: NA1, EU2, Korea3, China4, SEA1, WildcardA1


Group B: NA2, EU3, Korea4, China1, SEA2, WildcardA2


Group C: NA3, EU4, Korea1, China2, Taiwan1, All-Star


Group D: NA4, EU1, Korea2, China3, Taiwan2, WildcardB


Top 2 of each group qualified to knock-out stage with Bo5 for quarter finals and semi finals, while Bo7 on the grand final match. Last game blind pick for the knock-out stage matches too. That would be a great huge international event.",11 team,2,t1_cbzl91u,,0,1378044401,True,t3_1lidru,1429627169,Shozo,cbzl91u,False,0,2,False,0,t3_1lidru,leagueoflegends
t5_2qqjc,,"Yes, kind of though not so much in WW2 as in WW1. WW1 was actually more shaming for German-Americans since the propaganda painted Germans themselves to be evil ""huns"" who went about bayoneting children and raping women at every opportunity they could get etc. It was really quite stupid. Here some examples:

http://en.wikipedia.org/wiki/Anti-German_sentiment

Many people of German descent actually changed their last name and tried to erase everything ""German"" about themselves to try and be patriotic. In WW2 however, the Germans were seen more or less as innocents who were under the boot of evil fascist regimes, though the Japanese were popularly seen much, much less sympathetically. For instance, no one saw any problem with Dwight Eisenhower becoming the supreme commander of the allied forces in europe, but most people were eager to round up all Japanese-Americans since they obviously couldn't be trusted. ",,5,t1_cbzl927,,0,1378044402,True,t3_1liej0,1429627168,NH4NO3,cbzl927,False,0,5,False,0,t1_cbzl0w6,todayilearned
t5_2qh13,,"Hezbollah is world wide already. They've killed people in Europe/Asia and South America. 
",,0,t1_cbzl972,,0,1378044420,True,t3_1lh0d2,1429627167,[deleted],cbzl972,False,0,0,False,0,t1_cbzl3mr,worldnews
t5_2qqjc,,"This is what fascism does.  It bends whatever ""rules"" it sets up to fit its own political and ideological pursuits.  

The ""aryan"" ideal was nothing but a ploy to gain the trust of fair-skinned, light-haired Western Europeans looking for unity.  The idea of Jewish people, many of whom were fair-skinned and light-haired themselves, not fitting in as aryans was just an attempt to make a scapegoat out of a religious minority that had been shat upon since the Roman Catholic Church tried to stamp them out.",,1,t1_cbzlajs,,0,1378044592,True,t3_1liej0,1429627149,EatBooks,cbzlajs,False,0,1,False,0,t3_1liej0,todayilearned
t5_2t82m,,"Don't buy sets.  Figure out the minimum that you need and buy higher quality pieces individually.  For me, this would be:

* Saute Pan
* Cast Iron Skillet
* 2 Different Size Sauce Pans (one smaller one larger)
* Stock Pot for Soups/Pasta
* Cast Iron Dutch Oven
* Non Stick Skillet for eggs only

For the cast iron, I went with the 12"" Lodge as it was only $20 and they have a good reputation.  I actually bought it in the US and carried it back to Europe with me in my luggage.  For the sauce pans and saute pan, I just looked for stainless steel with a have bottom with conducts heat well.  For the cast iron Dutch oven, I actually went with the one Ikea sells (technically not a Dutch oven I think) because it was only €50.

Your minimum list might be different, but the point is that you should not over buy.  Once you start cooking with your minimum cookware set, you will see what you are missing, and then you can add just what you need.  This has been my experience.

I'm just some guy, so I hope others will add to this or debunk something I am saying if they disagree.",,5,t1_cbzlb28,,0,1378044657,True,t3_1lijpt,1429627143,classactdynamo,cbzlb28,False,0,5,1378044931,0,t3_1lijpt,AskCulinary
t5_2tb4r,,The game key *is* region dependent.  You need a EU version.  See [this thread](http://eu.battle.net/wow/en/forum/topic/5494101059),spotlight,1,t1_cbzlbhs,Community Spotlight | Frequent Gifter | Grabbed,0,1378044711,True,t3_1lifis,1429627137,MaximumDan,cbzlbhs,False,0,1,False,0,t1_cbzl9di,GiftofGames
t5_2qhwp,,"I just realised this Kickstarter is probably one of few that has almost the whole world's attention, the amount of asians pledging to this is as much as america/europe. 

This benefits everyone.",,2,t1_cbzlc85,,0,1378044805,True,t3_1lhoon,1429627127,funkymonkeyinheaven,cbzlc85,False,0,2,False,0,t1_cbzhvb7,Games
t5_2qh1i,,Europeans are losing badly. Take for example Nederlands. My friend there is telling me they are getting invaded by Moroccans (kind of like Nederlands' gypsies). Same with France.,,0,t1_cbzlchx,,0,1378044843,True,t3_1li6co,1429627124,Mihaiqc,cbzlchx,False,0,0,False,0,t1_cbzh5ou,AskReddit
t5_2rfxx,,"[NA Regionals](http://www.reddit.com/r/LoLeventVoDs/comments/1lcwqy/s3_lcs_na_regionals/)

[EU Regionals]
(http://www.reddit.com/r/LoLeventVoDs/comments/1kxaxw/s3_eu_lcs_regional_qualifiers_gamescom/)",01 team,1,t1_cbzld86,,0,1378044935,True,t3_1lil1p,1429627115,BipolarRooster,cbzld86,False,0,1,False,0,t3_1lil1p,leagueoflegends
t5_2v5x9,,"11% bonus on SW is pretty good. I have no idea what the Inna's helm market is like on the EU realm, though. :-(",userflair,2,t1_cbzldv7,Fist of the West (periklean#1534),0,1378045012,True,t3_1liclz,1429627106,perimason,cbzldv7,False,0,2,False,0,t3_1liclz,Diablo3Monks
t5_2qh41,,"Vegas, really? 

From a European perspective, it looks like a bunch of hotels and casinos in the desert, packed with unimaginative tourists and obnoxious fraternity college students. 

So I guess I'm wrong, but can you explain a bit? ",,5,t1_cbzlf24,,0,1378045159,True,t3_1liei4,1429627091,quiditvinditpotdevin,cbzlf24,False,0,5,False,0,t1_cbzjgpi,travel
t5_2qh13,,"look at tax rates in Europe, their astronomical compared to the US.
But people don't complain there, because they receive government services which are worth paying a little extra.",,1,t1_cbzlfv3,,0,1378045258,True,t3_1lhr5r,1429627080,Cortical,cbzlfv3,False,0,1,False,0,t1_cbzkt5k,worldnews
t5_2qqjc,,"They also ""liked"" Japanese and some Arabian people.... those races also conveniently offered a basis for military alliance. 

I wouldn't pay much heed to it though. Hitlers real goal was long thought to be a reunification of ""the Reich"", which points back to a new Rome or HRE. And it was Hitler's belief that other nations (non-European such as e.g China) would one day be a huge threat to a divided Europe. Now days wars are usually fought politically and through trade. So that notion is kinda bust. And at the same time, the E.U was a more peaceful attempt to create some form of unity between Europe. So he wasn't alone in thinking Europe needed unity. But ultimately the eugenics side of Nazism was not really set in stone, and it was a still very much developing area of exploration. ",points ,7,t1_cbzlgun,1,0,1378045373,True,t3_1liej0,1429627068,Emperor_Mao,cbzlgun,False,0,7,1378045861,0,t3_1liej0,todayilearned
t5_2qqjc,,"&gt;However, demographers regard this as an undercount because the index of inconsistency is high and many, if not most, people from English, Scottish, Scotch-Irish and Welsh stock tend to identify themselves simply as Americans or, if of mixed European ancestry, to nominate a more recent and differentiated ethnic group.

Well its not as clear cut as you say",,11,t1_cbzlh2y,,0,1378045403,True,t3_1liej0,1429627065,GourangaPlusPlus,cbzlh2y,False,0,11,False,0,t1_cbzkmye,todayilearned
t5_2qk72,,Just that European and non-European techno are equal on the bristol scale ;),ie,2,t1_cbzlh6e,,0,1378045415,True,t3_1lie63,1429627063,many_cakes,cbzlh6e,False,0,2,False,0,t1_cbzkbd5,climbing
t5_2qh4j,,The EU has a blog? Link please?,EURO,2,t1_cbzlieh,German,0,1378045553,True,t3_1liinn,1429627047,BaiersmannBaiersdorf,cbzlieh,False,0,2,False,0,t1_cbzl87o,europe
t5_2qh0u,,"Believe it or not, there are times when insubordination is logically what you MUST do. Most European countries have learned this from World War 2 and the Nazis, however the Americans continue to show how backwards they are in these ideas.

I believe it is outlawed by Germany for it's soldiers to do anything that's against basic human rights despite what their commanders say, just as it is outlawed to do hate speech despite freedom of speech. These kinds of things would never have a chance at existence in American law, and it shows how behind Americans are. I guess the reason is because America wasn't affected much by the Nazis.",,1,t1_cbzliez,,0,1378045555,True,t3_1lhuex,1429627047,Khab00m,cbzliez,False,0,1,False,0,t1_cbzl5ov,pics
t5_2qh0u,,As a european walmart fascinates me compared to telco,,4,t1_cbzlius,,0,1378045604,True,t3_1lii3a,1429627042,j-the-magnificent,cbzlius,False,0,4,False,0,t3_1lii3a,pics
t5_2qi58,,I don't think we did take football everywhere. It kind of spread organically into Europe. The sports that tended to spread in the empire were the middle class ones like Cricket and Rugby. Nearly all the colonies in that era play Cricket and Rugby. Few of them have a great tradition of football.,2,1,t1_cbzljf8,Manchester United,0,1378045669,True,t3_1li4rg,1429627034,G_Morgan,cbzljf8,False,0,1,False,0,t3_1li4rg,soccer
t5_2qi58,,"yeah if you were in a country where football is not is not developed at all you'd be lucky to hear about a team like Copenhagen.
but then I guess it's my fault I'm not lucky enough to live in a big European country",195 s4,-4,t1_cbzlkef,Kosovo,0,1378045779,True,t3_1liht0,1429627022,egzon27,cbzlkef,False,0,-4,False,0,t1_cbzkudc,soccer
t5_2ss9z,,"I think it's supposed to be a name. It would be read まりえ (Ma-ri-eh) and romanized as Marie. 

The pronunciation doesn't match, but the spelling does with the English (or whatever European language it's from) name Marie, which is probably what whoever came up with it was going for. My guess is that they just put it through a machine translator and ended up with something that seemed right.

Also, the word ""Oriental"", while also being inaccurate (it means East, and if you're from the US, Asia is to the West), is not really politically correct. Just ""Asian"" would be more appropriate.",fukidashi,-14,t1_cbzlkwd,Japanese,0,1378045833,True,t3_1lilj3,1429627018,hakujin214,cbzlkwd,False,0,-14,False,0,t3_1lilj3,translator
t5_2ti4h,,"Quick, someone alert the European Commission! ",,5,t1_cbzlkwj,,0,1378045834,True,t3_1lifhw,1429627018,lilythekitten,cbzlkwj,False,0,5,False,0,t3_1lifhw,mildlyinteresting
t5_2rgs7,,Confirmed this is either a troll for NA chat or they're speaking about EU.,,1,t1_cbzlli8,,0,1378045897,True,t3_1lim9l,1429627007,ludoknight,cbzlli8,False,0,1,False,0,t3_1lim9l,ffxiv
t5_2rfxx,,"Froggen is barely a top 3 eu midlaner, get real. There isn't a single european/na laner that could go vs faker.",,1,t1_cbzlm5l,,0,1378045972,True,t3_1lglq0,1429626999,[deleted],cbzlm5l,False,0,1,False,0,t1_cbz3c11,leagueoflegends
