author,subreddit_id,id,score,gilded,link_id,controversiality,edited,body,distinguished,created_utc,retrieved_on,subreddit,ups,downs,name,parent_id,archived,score_hidden,author_flair_css_class,author_flair_text,removal_reason
[deleted],t5_2qqjc,c4ij0d6,1,0,t3_t04xm,0,False,"The First Crusade, which was arguably the bloodiest of Crusades, was actually devoid of any English presence. King William II didn't want to lose his entire warrior class and banned them from attending. It was primarily a French expedition. The English didn't really become overtly involved until Henry II and Richard the Lionheart. And I find that the 'colonial' stamp is often used excessively towards the English. Almost every single European country, from Portugal to Belgium was guilty of committing atrocities under the guise of colonialism.

I'm not saying that my country doesn't have things it should be ashamed of, but I do object to such broad labels.",,1335830927,1428829688,todayilearned,1,0,t1_c4ij0d6,t1_c4ii4zr,True,False,,,
GuntherDog,t5_2cneq,c4ij1a8,2,0,t3_t0efl,0,False,"individual states could do basically the same thing. In fact, when he was governor of MA, Romney actually put in a state wide plan very similar to Obamas.  The problem with that if one state manages to get cheap, affordable care, people, especially sick people, will have an incentive to go there for treatment, and you still have a form of government with power.

To be honest, this is one area where the government should be helping out.  If you think basic healthcare is something everyone should be able to have, and not have it cost outrageous amounts, well, any example of that (i.e. canada, EU states) have a large government presence.

Furthermore, right now, the government doesn't have that much power, but the big drug companies, hospitals, and insurers sure do, and they (unlike even a non-perfect government) are interested in profits, not actually helping people.",,1335831052,1428829699,politics,2,0,t1_c4ij1a8,t1_c4iiuj3,True,False,,,
Hash47,t5_2s8fe,c4ij1y6,1,0,t3_t07j4,0,False,"Basically they did a competition where you had to register 3 certain games on the Nintendo website to be entered into the competition.

I found this on a website but can't seem to find the official Nintendo release info.

&gt;Nintendo of Europe is also preparing a competition involving 3,000 limited edition 3DS systems. If you’ve registered two 3DS titles and are over the age of 18, you can enter the drawing to win one of the prizes (1,000 Mario, 1,000 Princess Peach and 1,000 Toad systems). You can enter up to five times by registering ten games in total.",,1335831141,1428829710,gamecollecting,1,0,t1_c4ij1y6,t1_c4iivdg,True,False,,,
poptart2nd,t5_2rq9c,c4ij2ej,4,0,t3_t0j31,0,False,"in RTW, that might work; the heavy infantry in that game are pretty OP compared to cavalry, but in M2:TW, heavy cavalry can actually take on entrenched swiss pikemen in a headlong charge. most battles between european armies started with a huge cavalry charge unless the opposing player had a lot of spearmen, at least in my experience. straight-on cavalry charges were much more effective in M2:TW than in R:TW.",,1335831200,1428829714,totalwar,4,0,t1_c4ij2ej,t1_c4iim1c,True,False,romeg,,
Peglow25,t5_2re6a,c4ij470,6,0,t3_t0m46,0,False,Did it. Thank you AP European History for helping me with those questions,,1335831438,1428829737,Favors,6,0,t1_c4ij470,t3_t0m46,True,False,,,
Bete-Noire,t5_2qh1e,c4ij4ua,5,0,t3_t03oi,0,False,I'm in Europe and have never heard this stereotype before :S,,1335831523,1428829745,videos,5,0,t1_c4ij4ua,t1_c4igp0m,True,False,,,
ohstrangeone,t5_2r5hw,c4ij7mw,2,0,t3_szwtz,0,False,"Honestly, it doesn't matter as long as it's EU due to the Shengen Treaty.  If you ultimately wanted to live in France then frankly German or Dutch citizenship would be just fine because with that you get an EU passport and can simply move to, work in, and live in France for as long as you like without ever having to get French citizenship.",,1335831871,1428829781,IWantOut,2,0,t1_c4ij7mw,t1_c4ihe0d,True,False,,,
Cindiquil,t5_2rfxx,c4ij82q,10,0,t3_t0gia,0,False,"For a little while they had a Bo3 scrim every Tuesday and Thursday, if I remember correctly. However CLG.eu always had problems with pings so it wasn't quite fair.",,1335831935,1428829787,leagueoflegends,10,0,t1_c4ij82q,t1_c4ij0n3,True,False,01 team,[Cindiquil] (NA),
Stealthypoo,t5_2qpp6,c4ij8q9,1,0,t3_t0d58,0,False,"Grats to ESC and Daisy. Definitely an awesome player, he should do pretty well in the EU scene. 

",,1335832027,1428829795,starcraft,1,0,t1_c4ij8q9,t3_t0d58,True,False,ComplexityGaming,Complexity Gaming,
llamatastic,t5_2qh1s,c4ij8xm,6,0,t3_t0fco,0,False,"uhh no. The destruction caused by WWII collapsed global demand, which hurt the US's ability to export goods. Plus Europe and Japan rebounded very quickly after the war, partly due to vast amounts of aid provided by the US.",,1335832054,1428829798,Economics,6,0,t1_c4ij8xm,t1_c4ij248,True,False,,,
[deleted],t5_2qh33,c4ijafb,1,0,t3_sxjyb,0,False,"Where would you prefer to live?

EU or USA?

Most likely EU.",,1335832250,1428829821,funny,1,0,t1_c4ijafb,t3_sxjyb,True,False,,,
auandi,t5_2si92,c4ijamw,3,0,t3_svp90,0,False,"Yes, that is one of many reasons that most surface light rail was dismantled. While that is a real reason, it was far from the only reason. 

* Most cities still required rail companies to pay for the maintenance of their own system despite having to now share it with cars, giving cars free roads while increasing the need for maintenance on the part of tram companies as ware increases from car usage.
* The popularity and convenience of 5 cent ridership had placed many tram companies in poor financial positions as inflation eat into their profits even prior to the Depression.
* From the start of the Great Depression till the end of the war, virtually no updating or maintenance was done on any system, leaving them all outdated, expensive, antiquated and in bad need up major repairs.
* The post war prosperity allowed for millions of new car buyers in a matter of years leading to plummeting ridership.
* With millions more cars on the road, leaving two lanes reserved for street cars was deemed an expensive use of limited road space. Once cars shared the road with trams they began to get stuck in the same traffic jams as the cars, leading to exceedingly slow service. It made them no faster than buses would be and made cars faster than either of them because drivers didn't have to adhere to timetables or wait to transfer between lines.
* Changes in diesel technology from the 20s to the 40s meant that buses were much more economical to a degree they weren't prior to the Great Depression.
* Increased oil production, originally for the war, lead to very low fuel costs after the war and throughout most of the 50s and 60s. In the same time the price of electricity that trams relied on stayed level or increased.
* Culturally, street cars were seen as the past, part of the Depression and the war, while cars and highways being the future.
* City planners of the time thought the way to a good city was an ordered city with single use neighborhoods rather than the clutter of ""traditional"" multi-use neighborhoods. This lead to almost all new construction of the post-war boom to be built as single use land requiring long trips between homes, commercial centers and industry, something the tram network wasn't built to accommodate and something it would be slower at doing than cars on a highway would be.
* Unlike Europe, the US did not have the same shortages of land that Europe had, allowing for the new housing of the post war boom to be built at much lower density making the building of new tram lines uneconomical.

So hate on GM and Firestone all you like, but if they never lifted a finger all the other economic realities and cultural preferences of the time would mean that most surface rail would have been torn up anyways, and that includes LA. They probably only sped it up by a few years at worst.",,1335832281,1428829823,MapPorn,3,0,t1_c4ijamw,t1_c4idecp,True,False,,,
AssholeDeluxe,t5_2qh7l,c4ijaxo,15,0,t3_szz9s,0,False,"Copypasta from a comment I made a few days ago:

The private prison industry, though sick, only holds around 8-9% of the prison population in the U.S. [Sauce](http://www.thedailybeast.com/newsweek/2010/06/30/how-the-recession-hurts-private-prisons.html)

Corporations certainly benefit (think who supplies food, toiletries, etc. for all these prisons), but blaming the corporations is oversimplification.
 
Prison, depending on who you believe, is intended for a few different purposes. First, the incarceration rate of minorities is inexcusable. The incarceration rate of the U.S. for whites alone is 3 times higher than most Western European nations [Source 1](http://www.prisonpolicy.org/graphs/raceinc.html) and [Source 2](http://www.prisonstudies.org/publications/list/40-world-prison-population-list-8th-edition.html), but black men are incarcerated at a rate 7 times that of white men [Source](http://www.bjs.gov/content/pub/pdf/p10.pdf).

Michel Foucault believes the reason for this is establishing a delinquency model. We have no interest in rehabilitation, but we make minorities delinquents in order to control. We incarcerate them to incapacitate them. Our government redefined crime through the War on Drugs to control a potentially dangerous minority population. We put them in prison to keep them in government control, we parole and put them on probation to keep an eye on their activities, we take away felons votes to keep them from influencing decisions in government, we slash prison education funding, and we make them likely to return by keeping a public record of their criminal activities so they can't get a decent job [Source](http://www.storesonlinepro.com/files/3483016/uploaded/3088944-TheImpactofIncarcerationonWageMobilityandInequality.pdf). The War on Drugs exists to manipulate minorities. The crack vs. cocaine sentencing laws (the former a drug for poor blacks and the latter for rich whites) were 100-1 in length of mandatory minimum sentence until just a few months ago. They are now 18-1. [Source](http://articles.cnn.com/2011-11-01/justice/justice_crack-cocaine-sentencing_1_powder-cocaine-fair-sentencing-act-crack-penalties?_s=PM:JUSTICE)

I could go on about the effects of mandatory minimums and the three strike laws and their racist effects, plus prison labor, plus the horrible recidivism rate, *ad nauseum*, but corporations are a side-beneficiary of the prison system. Control is the primary motivation.

Also, as a note, if one reads [Discipline and Punish](http://en.wikipedia.org/wiki/Discipline_and_Punish), Foucault doesn't talk about minorities but of the prison system as a normalizing force in general. However, I think it's a pretty clear connection to the normalization and control of minorities.

",,1335832324,1428829835,Drugs,15,0,t1_c4ijaxo,t3_szz9s,True,False,,,
D3_release_countdown,t5_2qh03,c4ijb7l,1,0,t3_t0ow7,0,True,"US: **11D 21h 50m 1s**

EU: **11D 12h 50m 1s**

[&amp;#91;Join the conversation in /r/diablo&amp;#93;](http://www.reddit.com/r/diablo)[&amp;#91;FAQ&amp;#93;](http://redd.it/r2ey8)[&amp;#91;Hide all posts by this bot&amp;#93;](http://www.reddit.com/r/Diablo/comments/r2ey8/d3_release_countdown_bot_modifications_based_on/c4381qn)",,1335832358,1428829830,gaming,1,0,t1_c4ijb7l,t3_t0ow7,True,False,,,
yaharon,t5_2qh1e,c4ijeiw,6,0,t3_t06zy,0,False,eastern europe is awesome.,,1335832787,1428829873,videos,6,0,t1_c4ijeiw,t3_t06zy,True,False,,,
DisregardMyPants,t5_2cneq,c4ijenl,18,0,t3_t0fb7,1,False,"&gt;edit : already at the up/down vote war here.. Seriously, if you think I am wrong with my assessment, please.. try to point out where I am at fault and why, its a little annoying how ron paul fans never seem to be able to defend against these claims with anything of substance.

Alright.

&gt;(In my opinion) he doesn't have any arguments for any of the things he does. He simply goes by whatever the ""libertarian"" playbook says..

He believes in Austrian economics. He goes by the ""Austrian"" playbook, and Krugman goes by the ""Keynesian"" playbook. That's not much of a critique.

&gt; destroying the epa under the guise that ""property rights"" will keep huge corporations from polluting is just irresponsible and demonstrates a huge inability to think critically. 

The States are legally capable of making their own EPAs. So Alaska is in charge of Alaska, Virginia is in control of Virginia, and California is in charge of California.

I know a lot of people dismiss that, but the fact is it's also quite similar to how the European Union operates. The countries involved(analogous to US states) are responsible for their own testing and determine their own rate of use for their own resources.

If you just eliminated the EPA and made no attempt to fill that gap, yes, that would probably be a bad thing in many cases. But that's not *generally* what people advocate for.

Now, feel free to disagree with that if you'd like. But wanting things to be done differently from how they presently are(and similar to how they're done successfully elsewhere) is not ""an inability to think critically"".",,1335832805,1435718183,politics,18,0,t1_c4ijenl,t1_c4ij6u8,True,False,,,
mandano,t5_2s5ni,c4ijezv,2,0,t3_syysn,0,False,"She may have just wanted to have a fling in Europe.  If you want to date her, ask her out.  Don't be too surprised or disappointed if she says no",,1335832851,1435718181,OneY,2,0,t1_c4ijezv,t3_syysn,True,False,,,
Rainieri,t5_2qh13,c4ijh9b,5,0,t3_szhjk,0,False,"China is fucking smart, you gotta give them that. They are buying out Africa for pennies on the dollar. Europe tried to take Africa by force and failed miserably and now the African nations are rolling over for a little money and aid. 

",,1335833139,1428829908,worldnews,5,0,t1_c4ijh9b,t3_szhjk,True,False,,,
nectarbeam,t5_2qzb6,c4ijimn,2,0,t3_szuqu,0,False,"Hahaha this could be true. 

But yes, a drug called SCENESSE has been approved for use in Australia and certain countries in Eastern Europe and is currently in the approval process with the FDA. I actually participated in the first testing study of the drug two summers ago and my life was dramatically changed for those 6 months. 

The drug is administered as an implant in the fat above the left hip and slowly dissolves and works its way into the blood stream over a 8 week period. It made me pretty tan, and while at some point this tan looked a little uneven in spots, I was able to be out in the sun like everyone else for hours at a time (this heavily outweighed the potential aesthetic drawbacks). I nearly cried the first time I was out in the sun for more than an hour without sustaining symptoms - I had never experienced it before. 

Unfortunately that test has been over for about a year and a half now, and I'm back to my old ways of avoiding the sun as much as possible. Hopefully it will be approved and I can live the rest of my life without having to worry about EPP!",,1335833314,1428829929,IAmA,2,0,t1_c4ijimn,t1_c4ijgcd,True,False,,,
pedrito77,t5_2qh61,c4ijkaf,7,0,t3_t07nv,0,False,"That was for political reasons.
Correbous (flaming bull) is worse and they are legal in Catalonia, but Correbous are tradition there, and Bullfighting is associated with Spain; that is the reason one is banned and the other not:
http://www.youtube.com/watch?v=uVSuf97OAjk
http://www.youtube.com/watch?v=u_wlpzaoZWg&amp;feature=related
http://en.wikipedia.org/wiki/Correbous#Polemics_about_the_cruelty
http://www.telegraph.co.uk/news/worldnews/europe/spain/8020479/Flaming-bull-festivals-backed-by-Spanish-lawmakers.html


",,1335833534,1428829953,WTF,7,0,t1_c4ijkaf,t1_c4iir9l,True,False,,,
Roo695,t5_2qig3,c4ijkth,2,0,t3_t0gw1,0,False,"I'm unsure if it was ever released in the US but Patrik Wallner filmed and released a DVD called **'10,000 kilometres'** that involved a group of skateboarders (many of them in the Holy Cow video) taking the Trans-siberian train across Europe and Asia, from Moscow to Beijing. It is one of my favourite skate videos that combines interesting cultures and skateboarding. I'm sure you would be able to stream it online but if you're able to find somewhere selling it (it cost me about $7) it is really worth it!",,1335833599,1428829955,skateboarding,2,0,t1_c4ijkth,t3_t0gw1,True,False,,,
kgilr7,t5_2r5rp,c4ijnh2,9,0,t3_t0d2d,0,False,"So only things more recent are worth apologizing for? 

In regards to this: 
&gt;it was Africans that initially sold African slaves to the Europeans.

If someone offers to sell you something, you're not obligated to buy it. ",,1335833943,1428829989,facepalm,9,0,t1_c4ijnh2,t1_c4ij52m,True,False,,,
Paradoxou,t5_2rnve,c4ijnoq,1,0,t3_szf0r,0,False,"Vois-tu le problème c'est que c'était le premier ordi que je montais moi-même et si je l'ai pas payer trop cher pour la performance, j'ai eu un tas de problème avec. Le power supply qui a eu une sous-tension, la carte-mère qui se ""groundait"" sans raison, mes interrupteurs du boitier qui était mal branché, le nouveau power supply que j'ai eu s'est mis à bruler dans le boitier (il a fallu que je coupe des fils) et là, quand je crois pouvoir relaxer enfin et profiter un peu de mon achat ... j'ai ce connard de HDD qui me meurt dans la face .. Pire, dans une game de battlefield 3 où la tension était à son comble... Alors j'ai juste eu [cette face](http://alltheragefaces.com/img/faces/large/happy-smile-l.png), je suis sortit dehors avec une masse ... et j'ai déboîter le tout. Et devine quoi ? Ça m'a VACHEMENT fait du bien. 

Maintenant je pense acheter un SSD neuf.",,1335833969,1428829992,buildapc,1,0,t1_c4ijnoq,t1_c4ijhlr,True,False,,,
killa22,t5_2qi58,c4ijph5,2,0,t3_szvmf,0,False,"2001 and 2012 League Cup finals.
2005 European Cup final.
2006 FA Cup final.

Liverpool always win shootouts on the big stage. England have only ever won one shootout. 

Liverpool ≠ England.",,1335834202,1428830019,soccer,2,0,t1_c4ijph5,t1_c4iheun,True,False,136,Coventry City,
wfb0002,t5_2qh63,c4ijpz7,1,0,t3_t0138,0,False,"&gt;Umm... last I heard european gas prices are quite high.

My point exactly...

&gt;Think your employer will let you peg your salary to it?


If we used a gold standard what other choice would my employer have?",,1335834267,1428830023,Libertarian,1,0,t1_c4ijpz7,t1_c4ihxj9,True,False,,Jeffersonian,
CondomMan,t5_2qxih,c4ijtsj,4,0,t3_t00x7,0,False,Damn Europeans with their fancy colognes and wines and inconvenient holidays!!! &gt;:O,,1335834748,1428830074,swtor,4,0,t1_c4ijtsj,t1_c4if5b2,True,False,ac-vanguard,,
ToxynDx,t5_2szs2,c4ijuuk,3,0,t3_szqr4,0,False,"Serious mode: Plm eu am 4 proiecte de facut urgent si toti sau dat disparuti de 1 mai ca gandacii cand aprinzi becu  

  :(",,1335834882,1428830086,RoCirclejerk,3,0,t1_c4ijuuk,t3_szqr4,True,False,,,
sickofthisshit,t5_2cneq,c4ijxt8,27,0,t3_t0fb7,0,False,"&gt; The Austrian playbook believes that if you try to ""guide"" the economy, you will have a litany of unforeseen consequences that run a high chance of undoing any good you attempt.

Yeah, I know what they *believe.* There's just no factual basis for that belief. It's a quasi-religious statement.

There's the very real alternative possibility that more government action could have made us better off over the past few years of recession, with relatively little cost even far out into the future.

If you are Krugman, you aren't satisfied with a mystical belief, you take an analytical approach, and do things like compare the various policies of European countries over the past few years, and you find, that the more austerity a government practices, the worse they have performed in GDP growth and employment. 

&gt; Modern macroeconomics brought about one of the worst economic catastrophies in modern history,

You can't blame modern macroeconomics for the financial crisis. That's like blaming your doctor because you have a heart attack. Lehman blew up because of their own actions and bad luck.

Basically, the entire private sector went through an convulsion around the Lehman collapse. It was only quasi-predictable, like a heart attack. Yeah, you can say the property bubble was not good, but there was never a clear way  to have prevented or fixed it. (Neglecting the fantasy-land of the Austrians where you just never have speculative bubbles ever because you take their snake oil prescription.)

So you have a case where the patient comes into the hospital after a heart attack. Austrians say ""that heart attack is what happens when you have a high-fat diet. Told you so. Now starve yourself for years to balance that out."" Modern Keynesian medicine says ""let's give you some blood thinning medication, maybe a bypass, then work on fixing your diet and exercise when you are out of the ICU.""",,1335835254,1428830124,politics,27,0,t1_c4ijxt8,t1_c4ijqep,True,False,,,
olgcschools,t5_2qo4s,c4ik1l2,1,0,t3_szpri,0,False,Europeans are god dam crazy and thats why we love em,,1335835723,1428830173,nba,1,0,t1_c4ik1l2,t3_szpri,True,False,,,
hivemind6,t5_2qh13,c4ik4ih,1,0,t3_szo7c,0,False,"Do you think any other country in WWII wouldn't have used nuclear weapons if they were the only ones to have them? 

The US only used nukes because it was in a context in which their use actually lowered the risk of casualties on both sides, and because it wouldn't destabilize the entire world. If the British, Germans, Chinese, or Soviets found themselves in the favorable situation the US found itself in, being the only nation on earth to possess nuclear weapons, they probably would have used them with FAR less restraint than the US did.

If the Soviets attained nuclear weapons before the US, there would be no US today. There would be no independent nations in Europe either.",,1335836076,1428830213,worldnews,1,0,t1_c4ik4ih,t1_c4idi1k,True,False,,,
