subreddit_id,distinguished,body,author_flair_css_class,ups,name,author_flair_text,gilded,created_utc,archived,link_id,retrieved_on,author,id,score_hidden,controversiality,score,edited,downs,parent_id,subreddit
t5_2qwrb,,"And ""we"" are complaining about communist-monoplist-capitalistic-part-state-owned companies that is to powerful and control to much of the market (TINE MEIERIENE) and that the only choice is Q-Meierine, and not some imported (shit) from the EU.

Im ok as long as i can get good, cold and fresh Norwegian milk. (and brunost for breakfast, luch and evening food)",,0,t1_cbzpx4l,,0,1378060036,True,t3_1liih7,1429624920,leitzer,cbzpx4l,False,0,0,False,0,t1_cbzktsl,Norway
t5_2tsnh,,"Crusader kings 2 seems really popular. I've also heard that Europe Universalis IV hailed as the best iteration of the genre. Although, mind you, I've never played them (maybe for only like 2hrs, just couldn't get into it), so take this for what it's worth, OP, and do some more research, maybe.",,3,t1_cbzpyf7,,0,1378060142,True,t3_1lim5g,1429624904,lanzelloth,cbzpyf7,False,0,3,False,0,t1_cbzlzs0,AskGames
t5_2fwo,,"Where are you where you are still in a recession? Europe? From what I can see, it's been ""recession's over, time for a new job"" for nearly a year.  I know many people from varied geographical locations (and not just in development) that are on their third cycle of getting fed up with recruiters harassing them.",,1,t1_cbzpymv,,0,1378060160,True,t3_1lidkb,1429624901,NancyGracesTesticles,cbzpymv,False,0,1,False,0,t1_cbznhvd,programming
t5_2rgs7,,Same :/ (I'm in Europe). I didn't play at all today :(,,1,t1_cbzpynz,,0,1378060162,True,t3_1lizwy,1429624900,little_monshter,cbzpynz,False,0,1,False,0,t1_cbzpw1p,ffxiv
t5_2sljg,,(WWE12) Have a European heel stable.,ajlee,1,t1_cbzpzaz,:(,0,1378060216,True,t3_1lix6i,1429624892,WeedWackHerHedge,cbzpzaz,False,0,1,False,0,t3_1lix6i,SquaredCircle
t5_2uie9,,"I hate people like you. You Europeans are the elitists of the entire world. You think you're better than other countries just because you live in Europe and you think everyone in Europe is better just because they're European. Europeans are not friendlier than Americans, I can't even mention that I'm from America on the internet without getting told that we are stupid and fat. As a matter of fact, I'd say that Europeans are probably the least friendly people in the world and that you are completely wrong.",pc,-3,t1_cbzq08m,MASTR_CHOPSTIK,0,1378060293,True,t3_1lhktv,1429624880,Seanctk10001,cbzq08m,False,0,-3,False,0,t1_cbzmohc,battlefield_4
t5_2rfxx,,"what the fuck are u talking about?

CLG.EU/EG - 2nd place OGN 2012. 3-4 place at S2 WC

Gambit - won all IEMs they attended exept last hannover. 3-4 place at S2 WC. Never placed belove 4 in any tournament

Fnatic - S1 WC champions. 2nd at IPL 5 beating TPA right after S2 WC
",vi,19,t1_cbzq0dc,,0,1378060303,True,t3_1lidru,1429624878,MadEgzek,cbzq0dc,False,0,19,False,0,t1_cbzmyed,leagueoflegends
t5_2qzb6,,"Yes the US has been doing that because they claim that the Syrian people don't support Assad and that Assad is hurting those people. (This is true to an extent as there are no good guys, but the rebels are worse as they are affiliated with Al Qaeda... [Also, the majority of Syrians are pro-Assad and anti-rebels](http://www.worldtribune.com/2013/05/31/nato-data-assad-winning-the-war-for-syrians-hearts-and-minds/)). 

So why do all these countries want to get rid of Assad and replace it with terrorists?

The story that is going around is that Qatar, Saudi Arabia, and Turkey wants to build a pipeline for liquefied natural gas (LNG) from Qatar to European countries via Saudi Arabia, Jordan, Syria, and Turkey (look at a map if needed). 

However, there is no sure way of knowing this is their sole intention but seems to play a major role. [US General Wesley Clark claims that there is a plan by the US to attack 7 countries in 5 years](http://www.youtube.com/watch?v=9RC1Mepk_Sw). 

The US will go into this war for sure. They would have to, in order to continue with what they are doing. So we will see what happens. Perhaps Congress itself will betray us because that won't be surprising. 

Anything I have stated can be searched on google for more information. If you want me to source anything specific, let me know. ",,0,t1_cbzq1ed,,0,1378060388,True,t3_1lhtlx,1429624865,lastresort09,cbzq1ed,False,0,0,False,0,t1_cbzpazz,IAmA
t5_2uie9,,Can't agree more. Europeans are usually the first to insult and the last to apologize. They're pretty much the equivalent of PC elitists.,pc,1,t1_cbzq25d,MASTR_CHOPSTIK,0,1378060450,True,t3_1lhktv,1429624855,Seanctk10001,cbzq25d,False,0,1,False,0,t1_cbznq1v,battlefield_4
t5_2qh1i,,"Comparatively though, the UK isn't particularly worse than anywhere else like the rest of Europe or the US. The OP of this tale had a bad experience with one over reactive mother. It's not a basis to say that the UK is riddled with kiddyfiddlers.

At least, not now that Savills dead...",,3,t1_cbzq31l,,0,1378060525,True,t3_1lieic,1429624844,Elly_Smelly_Rat,cbzq31l,False,0,3,False,0,t1_cbzpjoo,AskReddit
t5_2qh1i,,"I think it's a bit of a misconception that we've come a long way. Sure when you consider the Victorian era etc things are a lot different now, but there are plenty of examples that predate that time period when loincloths, togas or complete nudity were perfectly acceptable. Especially when you take non-European cultures into account. ",,2,t1_cbzq36a,,0,1378060535,True,t3_1lieic,1429624842,cavalierau,cbzq36a,False,0,2,False,0,t1_cbzjjqg,AskReddit
t5_2qhqt,,"Does anybody even realise how much of a coup this would be? He's easily the best CAM in Europe. World, even.",,1,t1_cbzq3rz,,0,1378060583,True,t3_1lj05l,1429624834,[deleted],cbzq3rz,False,0,1,False,0,t3_1lj05l,Gunners
t5_2rfxx,,"There is also the guy who will listen to 10 hours of a certain song if at least team from EU/NA makes it to the semifinals of Worlds. Don't know which one, I am not on the computer where I tagged him.",zyra,1,t1_cbzq4gf,,0,1378060639,True,t3_1lil38,1429624825,MetzgerWilli,cbzq4gf,False,0,1,False,0,t1_cbzlijc,leagueoflegends
t5_2qhu2,,"I watched paramedics try and fail to resuscitate a man who had overdosed at Les Transmusicales electronic festival in France, which draws people from all over Europe. They covered his body in a sheet while they waited for the ambulance to arrive. Completely surreal scene amidst impossibly loud bass at 3am. It's not just America. I saw more people completely out cold in piles of vomit at that festival than I've seen at any other.",,71,t1_cbzq4lf,Bushwick,0,1378060652,True,t3_1likcf,1429624824,macNchz,cbzq4lf,False,0,71,False,0,t1_cbzm2d9,nyc
t5_2r9vp,,"you guys would hate uk/europe smoking tradition, cos we usually put a bit of tobacco in our zoots. we of course still like bongs though :P",,1,t1_cbzq5t5,,0,1378060752,True,t3_1lisk6,1429624809,Scrotty_McCheek,cbzq5t5,False,0,1,False,0,t3_1lisk6,trees
t5_2rjli,,"Hmm well either buy a Subaru WRX Sti or a Mitsubishi Evo, or cross Europe trip starting in London where I would purchase a 1994 Nissan Skyline to be my traveling vehicle.",,1,t1_cbzq5yf,18,0,1378060765,True,t3_1lit05,1429624806,doughboypanzo,cbzq5yf,False,0,1,False,0,t3_1lit05,teenagers
t5_2rgs7,,"Cactuar as well. Pretty much have gotten every login error they could throw at me for almost an hour now. Started with 1017, then switched to no na/eu servers available. Then I would get to the loading screen, only to get a connection error after about 10 secs of loading. Directly after that, start button being grey, then kicked out of lobby. THEN unable to load the launcher login info. Rinse, repeat random scenarios already mentioned....sweet jesus, did someone over there fall asleep and faceroll over all the server disconnect buttons?",monk,2,t1_cbzq6f6,Honi Slate on Cactuar,0,1378060806,True,t3_1lizje,1429624801,Smallz38,cbzq6f6,False,0,2,False,0,t1_cbzpfsy,ffxiv
t5_2fwo,,"Denmark, Europe. 

While its not quite a recession anymore, and companies are hiring. Plenty  are very unemployed. ",,1,t1_cbzq9gk,,0,1378061054,True,t3_1lidkb,1429624761,n35,cbzq9gk,False,0,1,False,0,t1_cbzpymv,programming
t5_2qh6p,,"How?  No other country is willing to go to war over Syria.  Besides, I would argue that the ""War on Terror"" is WWIII because it includes 4 continents (North America, Europe, Asia, and Africa).  ",,2,t1_cbzqc8r,Moderate Conservative,0,1378061284,True,t3_1liuv8,1429624724,pumadude321,cbzqc8r,False,0,2,False,0,t3_1liuv8,Conservative
t5_2w31t,,"Okay. I understand that. My point is that people in Europe (not necessarily you, although that's how I interpreted your post) are acting like they can't opt in to the beta, when that is completely false. I have 7 bnet accounts opted in to the beta, 1 of them is an EU account and I don't live in Europe.

I still haven't personally received an invite, but I'm lucky enough to have a friend that got an invite last Tuesday that is willing to share their account with me.",,-2,t1_cbzqd6n,,0,1378061359,True,t3_1lin4m,1429624712,Baby_giraffes,cbzqd6n,False,0,-2,False,0,t1_cbzogu0,hearthstone
t5_2sg7u,,"Other questions:

AoF is supposed to include new campaigns. Did they introduce new menu screens for this, or do you load them through Custom Scenario (ew)?

How does Treaty mode work, how do they stop you from spamming Castles all over your opponent's base?

Is there still a launcher?

[Did they edit the artwork?](http://www.forgottenempires.net/wp-content/uploads/2012/05/Incas_preview.png) The AoFE fanmod artwork has some jarring graphical quirks: noticeable pixellation, lack of detail on units, a devotion to perfectly vertical lines on buildings (which plays really badly with AoK's isometric viewpoint), and a tendency to repeat art on roofs and walls. Vanilla building art doesn't repeat itself that much - the dark shingles on Western European buildings all differ, for instance, and the vertical walls of every culture's castles change shade from top to bottom - and this variation is actually really important for visual clarity! This is to be expected with fan-contributed art, of course, but SkyBox Labs has designers and artists)",,2,t1_cbzqe1y,,0,1378061429,True,t3_1lhflw,1429624701,threesls,cbzqe1y,False,0,2,1378061740,0,t3_1lhflw,aoe2
t5_2qhwp,,"I wonder how the next gen consoles will sell in places with bad or expensive and capped internet like Canada, middle east, some of Europe etc. Ps3 was popular in those places, but a lot just played offline and/or bought disks instead of download ",,1,t1_cbzqe83,,0,1378061445,True,t3_1lin7s,1429624699,hover888,cbzqe83,False,0,1,False,0,t1_cbznf8g,Games
t5_2qh03,,This was leaked from the PS3 pre-loads in Europe. This guy doesn't work for Rockstar. ,,6,t1_cbzqeai,,0,1378061451,True,t3_1liw3c,1429624698,BeyondTheDepth,cbzqeai,False,0,6,False,0,t3_1liw3c,gaming
t5_2w31t,,"You can opt in to the beta if you live in Europe. 

* Make a new bnet account(s) 
* Set country to US
* Verify the email address, 
* Opt in 
* Don't get an invite like 99% of the other people that have opted in. 
* Continue to find another excuse to whine. (Not trying to be a dick here, I was whining pretty hard too until a friend got in last week and has let me play a bit).",,10,t1_cbzqgbt,,0,1378061626,True,t3_1lin4m,1429624672,Baby_giraffes,cbzqgbt,False,0,10,False,0,t1_cbzmy5j,hearthstone
t5_2r0gj,,"Finding a DNA connection to any Israelis in a native population that dates before the first known European contact (approx 999~1001 A.D) would be huge news.

Such a find would not justify the Book of Mormon but it would lead us to start better examining the possibility's of lost merchant or military vessels surviving an unintended Atlantic voyage.

The book of Mormon populations simply can not exist in the America's, The civilizations where far to large and far to advanced to have gone unnoticed, We are talking about nations that rival Rome in size and had technology's (Ex: steel) around 1000 years before they existed anywhere else.

On that note, Around two years ago there was some buzz about phenacetin (or Roman) ships in Some south America bay. I can't locate any updates on that, Does anyone know how that turned out? was it eventually shown to be a hoax or ships from a latter date?

*edit*

Robert Marx seems to be the guy that says he found the ships. I've had LDS apologist amateurs reference this find a few times.",,17,t1_cbzqh8t,,0,1378061701,True,t3_1lj1rd,1429624660,sleepygeeks,cbzqh8t,False,0,17,1378061995,0,t3_1lj1rd,exmormon
t5_2rgs7,,NA/EU servers are based in Canada.,scholar,3,t1_cbzqhku,Astalder Meridius on Leviathan,0,1378061729,True,t3_1lipas,1429624655,Aeos,cbzqhku,False,0,3,False,0,t1_cbzpyaz,ffxiv
t5_2qm7u,,"Back in the 1990's my band played a club in Dallas, and the fucktard manager tried to get out of paying us so we had to find the owner at his other club, which was a strip bar.  

I don't want to mention names because I'm pretty sure the players I saw were going to fuck those strippers.  

They were cool guys and all.  Just a little sleezy at least on that night.  From what I've always heard ""sleazy"" would be an appropriate description of a lot of ball players.

I met Vincente Padilla at Lamborghini of Dallas once.  He was much friendlier than I expected.  I've ran into CJ Wilson a couple times at local tracks.  He's a nice guy but it's true he doesn't shut up and he seems to think he knows everything about driving.  I saw CJ with a friend of mine who raced GT cars in Europe and he said Wilson was full of shit.  I drive for fun and wouldn't have known the difference.

When I was in college Boog Powell was in town and came into the place I worked.  He was an awesome old guy.

I've seen others out and about at clubs around the country I think, but it's sometimes hard to be sure. ",tex-1,1,t1_cbzqi55,Texas Rangers,0,1378061779,True,t3_1lih5x,1429624648,Colonel_Rhombus,cbzqi55,False,0,1,False,0,t3_1lih5x,baseball
t5_2sxwp,,"I would love to do that...whomever would like to send me a couple of million dollars to do this is very welcome to.  :-p

Seriously though, I would love to get out of here and live in a quiet European countryside or something.  It would be like heaven.
It's not gonna happen, however.  So I try not to daydream like that too much.  It becomes painful.",,15,t1_cbzqi87,,0,1378061785,True,t3_1liuut,1429624647,iDown,cbzqi87,False,0,15,False,0,t1_cbzqd5x,casualiama
t5_2qhbp,,"&gt; Can you imagine Europeans dressing like they did in the middle ages?

This conjures a pretty hilarious picture in my head.",,0,t1_cbzqjjq,,0,1378061899,True,t3_1lijc9,1429624630,stares_at_screens,cbzqjjq,False,0,0,False,0,t1_cbzolmt,islam
t5_2s113,,"Obviously. It's just this time, we'll see less of them since it's an EU only, and we've only had a short while for this event to be up, so it's not that abnormal for someone to have not seen it yet. Then again, there's the sidebar, and if someone gets a ridiculous amount of money for an event, they should know to go read the news.",RDDT,0,t1_cbzqjtq,[RDDT] alumni,0,1378061922,True,t3_1lj07r,1429624626,zaery,cbzqjtq,False,0,0,False,0,t1_cbzqfzr,WorldofTanks
t5_2qlqh,,"Its an infrastructure issue. Each cell tower has a limited amount of bandwidth (usually a few hundred mbit) that has to be spread out over all the connecting users. If everyone had unlimited data and was constantly streaming the data rates would drop down to nothing. 

The obvious solution is more cell towers, but when you're a large, sparsely populated country like the US (or even worse, Canada) it becomes a serious challenge to provide both high bandwidth and adequate coverage. If I wanted I could get unlimited talk, text, and data for $30/month on Wind Mobile in Canada, but it would be limited to a few major cities.

Densely populated regions like the UK, and Europe in general, don't really have to worry about the coverage aspect, since there are enough subscribers/km^2 to make building cell towers economically feasible anywhere.",userBlack,1,t1_cbzqkuo,Nexus 5,0,1378062009,True,t3_1lhj80,1429624613,nathris,cbzqkuo,False,0,1,False,0,t1_cbzcmak,Android
t5_2rfxx,,"All hope for what? I personally am glad some of these teams didn't make it. CLG would have gotten smashed at worlds, EG would have done well but I think it's reasonable to assume the other EU teams are going to do better. It's a shame that Frost and Blaze probably won't make worlds but that just means the teams that qualify are stronger. ",37 team,1,t1_cbzql1z,,0,1378062025,True,t3_1lidru,1429624610,CaptainCoque,cbzql1z,False,0,1,False,0,t1_cbzjmev,leagueoflegends
t5_2rfxx,,"assuming ur talking about LCS etc and not soloq:

EU: funnels their money into the midlaner who then ''carries'' the game (does most damage but is just as important as anyone else)

NA: focuses on objectives and taking turrets fast. known to stall hour long games because of both teams unable to make decisions.

Asia: focused on personal play making. grouping up happens late here because people keep trying to get kills by hitting your skillshots and dodging theirs.

which is best? we'll see. i'll be rooting for fnatic either way",,-1,t1_cbzqlzl,,0,1378062107,True,t3_1lj257,1429624598,[deleted],cbzqlzl,False,0,-1,False,0,t3_1lj257,leagueoflegends
t5_2rfxx,,I'm from Europe ;),thresh,12,t1_cbzqm01,,0,1378062109,True,t3_1lislh,1429624598,iareziga,cbzqm01,False,0,12,False,0,t1_cbzplnk,leagueoflegends
t5_2rgs7,,What I was trying to meant is that EU servers aren't actually in EU and that is kind of frustrating. I know there is a lot worse. ,,2,t1_cbzqmdg,,0,1378062139,True,t3_1lipas,1429624593,Leetina,cbzqmdg,False,0,2,False,0,t1_cbzp8v7,ffxiv
t5_2qh87,,"I think so too. In fact, as a European I hope so.",,3,t1_cbzqn0a,,0,1378062194,True,t3_1lifdm,1429624585,MONDARIZ,cbzqn0a,False,0,3,False,0,t1_cbzpnq5,space
t5_2qh4j,,"Been following them in the satellite images and Google Earth layers.  
http://www.nasa.gov/content/goddard/fires-plague-portugal/#.UiOHjqya8Vk  
http://www.fire.uni-freiburg.de/GFMCnew/2013/08/22/20130822_po.htm

For those interested here's [the European Forest Fire Information System](http://forest.jrc.ec.europa.eu/effis/).

Looks like some serious shit. Best of luck and sisu fighting those fires, and you hang in there guys.
",FINL,2,t1_cbzqn3f,Finland,0,1378062202,True,t3_1lidi5,1429624584,spin0,cbzqn3f,False,0,2,False,0,t1_cbznq4r,europe
t5_2rfxx,,"People exaggerate EG's problems in all honesty. Sure they've had their struggles and such, but look at the final results: spring split 4th regular season / 3rd playoffs, summer split 3rd season (after tiebreakers) / 4th playoffs.

While it's a shame they didn't make it to the worlds, the competition in EU scene is just ridiculously close. Any of the top 6 could have very well made it to the worlds with bit better superweek / playoffs performance.",14 team,1,t1_cbzqnff,,0,1378062229,True,t3_1lidru,1429624579,Jushak,cbzqnff,False,0,1,False,0,t1_cbzmncm,leagueoflegends
t5_2rfxx,,"Sucks for their fans, no matter which way you look at it.

As a fan of EG, as a fan of WE, as a fan of TPA this sucks. 

**Take this for example:**

&gt;I am a fan of EG, I am not looking at what is better for E-Sports, I'm looking for what is best for my team, the team I love and want to see win worlds each year. If that means EG 2nd and GMB 1st each year in EU LCS then I'll take it.

I'm not saying this is my own POV but I just want people to understand that the more E-Sports progresses the more likely you are to start having fans that care for the Teams and not the sport itself. 

I mean I have a friend who loves, breathes and sleeps(?) TSM, he doesn't even know the names of half the other teams in NA, it's just TSM vs another team to him. If [SPOLER] TSM hadn't made it to worlds [/SPOILER] he would not have watched it. 

*TL;DR: I'm saying it sucks because lots of teams with big fanbases are out, which sucks for e-sports*

***PS: We need more teams in worlds***",14 team,2,t1_cbzqnjf,[Slyvanna] (EU-NE),0,1378062240,True,t3_1lieb8,1429624578,Slyvanna,cbzqnjf,False,0,2,False,0,t1_cbzqfxt,leagueoflegends
t5_2ssp3,,"Just to add on:

The reason why Flanders was substantially poorer at this time had very much to do with the Industrial Revolution. Along with England, Wallonia was one of the earliest regions in the world to industrialize - specifically in coal production and iron smelting. This made the region, comparative to its size and population, incredibly rich. Along with the fact that French was the language of the courts for most of the 18th and 19th centuries, this led to both the aristocratic and bourgeois elites in Belgium speaking french, not dutch. Economically, Flanders had also been on a decline even prior to the 80's year war. Antwerp's ports were blockaded for decades, and the cloth manufacturing industries in the old staple ports of Flanders wasn't worth nearly as much as it was in the medieval and early Renaissance periods. It was only after WWII that Flanders slowly became the economic center of Belgium, as traditional blue collar industries faltered.

Another item to remember is that when we speak of Belgian colonies, we are pretty much only speaking of the one colony Belgium had - Congo. Yes, after WWI Rwanda was added from the German colonial possessions, and Belgium did have a tiny concession in China too (like every European colonial power), but ultimately when we speak of Belgian colonial history, we are exclusively speaking of Congo. Now, the Congo, as a colonial possession, was exclusively under control of Leopold II for the first 30 years of its colonial history. By exclusively, I mean that all of the Congo was private property of the King of Belgium. The King spoke french, and so did his court. It was only natural that the administrators of his private possessions would be able to use the same language in its administration.

I think a just asinteresting question however would be why french is actually the spoken language of the Congo at all. Even compared to its colonial neighbors, the education and administration of the Belgian Congo was absolutely abysmal. I cannot remember the source directly (if anyone can help me out here, please do!) but I do remember a figure being quoted that after independence from Belgium, Congo has less than half a a dozen registered doctors - primarily because Belgium has spent so little in educating the people of its colony. Why then, would its people adopt a language no one spoke?

",,11,t1_cbzqq2e,,0,1378062452,True,t3_1lisgj,1429624545,[deleted],cbzqq2e,False,0,11,False,0,t1_cbzp6af,AskHistorians
t5_2qqjc,,"Since the end of ww2 I think that USA has probably been involved with roughly as many wars as Britain and France and definitely more wars than Germany, the Netherlands, Spain, Italy and so forth.

If you're counting border skirmishes, bombing campaigns and so forth, then the USA probably exceeds every other country by a goodly amount.

Of course given that the US has only existed for ~350 years, only has two close (and weaker) neighbours it is going to have had less wars throughout history than thousand year old european nation states who are roughly equally pitted.",,0,t1_cbzqq46,,0,1378062456,True,t3_1lihzb,1429624545,ngony,cbzqq46,False,0,0,False,0,t1_cbzpswf,todayilearned
t5_2rfxx,,"A slap in the face?  Can we please stop treating it as a personal insult whenever a tournament in another reason isn't at a good time in our time zone?  EU finals were at a terrible time in NA (worse than this, in fact), NA finals are at a bad time in EU.  This is because games are scheduled to be best for the time zone and venue they are held in, and in this case both were held at conventions further restricting things.

It's one thing to be frustrated by tournaments held at inconvenient times for you, it's another thing to act insulted.  That's just unreasonable and childish.",,8,t1_cbzqrso,,0,1378062599,True,t3_1lj06r,1429624523,Quazifuji,cbzqrso,False,0,8,False,0,t1_cbzpzul,leagueoflegends
t5_2qqjc,,I also majored in history and I was looking for the /s at the end of that. USA had nothing to with with European tensions? Race was just thrown in? Yeah. Alright. ,,2,t1_cbzqu4e,,0,1378062800,True,t3_1liej0,1429624493,CrazyBoxLady,cbzqu4e,False,0,2,False,0,t1_cbzli4s,todayilearned
t5_2qi58,,"it's closer to a fact than a ""bullshit argument"". some clubs manage to hang at the top seemingly forever but top teams come and go all the time, case in point with internazionale, an all-time great, being in a rather deplorable mid-table situation at the moment (or motherfucking juventus being relegated and returning to the top in less than a decade).

when anyone thinks of current english top teams, only man utd and chelsea are undisputed candidates, then (imo, in spite poor european performances) citeh and rounding it up comes arsenal. tottenham is a very strong club and they could break into that list at the end of this season if their signings mesh quickly, but as of now, they're not a true top team. at least not any better than plenty of second through fourth place clubs in other competitive leagues.",9,2,t1_cbzqx7x,Real Madrid,0,1378063074,True,t3_1lizh4,1429624453,ioannsukhariev,cbzqx7x,False,0,2,False,0,t1_cbzqmem,soccer
t5_2qh1i,,"This. And I'm guessing this is distinctively American. I could be wrong. Do they have shows comparable to ""To Catch a Predator"" in Europe?",,1,t1_cbzqxoc,,0,1378063114,True,t3_1lieic,1429624447,Syrupdipidy,cbzqxoc,False,0,1,False,0,t1_cbzld36,AskReddit
t5_2rfxx,,Because he's not that great (he's not bad either) and Europe has a ton of good mid laners he can't really compete with.,jax,1,t1_cbzqxz6,,0,1378063141,True,t3_1lidru,1429624443,Duder_DBro,cbzqxz6,False,0,1,False,0,t1_cbzqqs4,leagueoflegends
t5_2rgs7,,just got in. Phoenix EU,uldah,1,t1_cbzqyfj,[First] [Last] on [Server],0,1378063182,True,t3_1lizje,1429624437,hydroUNIT,cbzqyfj,False,0,1,False,0,t3_1lizje,ffxiv
