score_hidden,gilded,id,subreddit,created_utc,removal_reason,body,name,subreddit_id,author_flair_text,score,ups,controversiality,retrieved_on,edited,downs,author_flair_css_class,archived,distinguished,link_id,parent_id,author
False,0,cjdw1i7,AskEngineers,1406895157,,"All the time. Constantly.  I act on them, too and my business is to make concept demonstrations and functional prototypes for other people who can't.  Sometimes, patents are involved.  Creativity is a constant theme in what I do, both in tech and in art.   Mostly, I solve problems of one sort or another and aim to do it within economic constraints and schedules.  

I have done a pile of off-the-clock work. 

A few things I am working on now merit patent protection. The vast majority of what I've done is not patented, though not all.  It's expensive to my target client base.   The stuff I am working on now involves superior analysis of the needs I am addressing, and the tech is simple, but not obvious unless you are confronting a specific problem set, which is what invention does.  It's the search for ""hey, that's a feature, not a bug"".  (This talent was responsible for my most successful invention, completely unpatented, but which spawned a company that would be able to patent everything it did from there on out. )  Patents are over-rated.   Marketing is underrated.  The former usually has nothing to do with commercial success, and the latter always does, in my experience. 

I used to say ""It doesn't matter what you design, but design. Solve a problem.""  My father in law had a dozen US patents and at the time, scores of international patents (many they same as the US but at least in the old days, you had to apply in different countries, too.  Before the EU.)    I hung around him for 30+ years.  Rubs off.


",t1_cjdw1i7,t5_2sebk,,1,1,0,1435014027,False,0,,True,,t3_2c8p7e,t3_2c8p7e,fauxscot
False,0,cjdw2am,Planetside,1406895243,,"Now this is something ""new"". I never thought about checking that.

But then again, I'm in Europe, I can't really talk for US residents.",t1_cjdw2am,t5_2s48x,[1FR] Woodmill,1,1,0,1435014051,False,0,mlgvs,True,,t3_2cacfl,t1_cjdo1bt,Awilen
False,0,cjdw2ql,AskReddit,1406895290,,"Are Americans really almost unable to write in cursive? It's kinda normal &amp; standard in Europe, at least here in Eastern Europe.",t1_cjdw2ql,t5_2qh1i,,1,1,0,1435014064,False,0,,True,,t3_2caswk,t1_cjdna05,[deleted]
False,0,cjdw2uo,worldnews,1406895301,,"There are so many prisoners in Israeli prisons. We just hate this. We pay taxes, and they study for pHD! You need to understand that the middle east is so much different from Europe. Yes, there are some prisoners that change their agenda in prison, but there are prisoners that still think they must kill more Israelis. You talked about capturing individuals. We don't do it mostly because it's a big danger for every any to enter Gaza and capture someone. Killing them from above prevent any risk to Israelis and satisfy the Israeli citizens.",t1_cjdw2uo,t5_2qh13,,2,2,0,1435461739,False,0,,True,,t3_2cb446,t1_cjdvjff,nir255
False,0,cjdw2z6,teslamotors,1406895313,,TIL: Spain &amp; Portugal are not in Europe. ,t1_cjdw2z6,t5_2s3j5,,1,1,0,1435014064,False,0,,True,,t3_2cacwq,t3_2cacwq,b0ltzmann138e-23
False,0,cjdw67d,leagueoflegends,1406895639,,"CLG sub me in, I'm in EU but I can totally make it dw",t1_cjdw67d,t5_2rfxx,,1,1,0,1435014125,False,0,30 team,True,,t3_2cbd3k,t3_2cbd3k,Valexexe
False,0,cjdw6f3,ffxiv,1406895659,,"Everyone always offers websites that sell EU cards, but where can one order a NA gametime card key via email? :(",t1_cjdw6f3,t5_2rgs7,,1,1,0,1435014126,False,0,,True,,t3_28pnhh,t1_cid7u2x,Megneous
False,0,cjdw7ht,mcservers,1406895768,,"Hi. Please check out the MCPublic PvE server at p.nerd.nu. We are the oldest, free public Minecraft servers.

Our server is mostly vanilla. We do run plugins for protection, grief prevention, and server stability. We do not, however, have things like /home, /tp, /warps, ranks, pay-to-win, role-playing, economy plugins, etc. Play is strictly in survival mode (the only thing not built in survival mode is our spawn building), and staff are strictly prohibited from abusing their powers and spawning items for themselves or other players. Our server version is 1.7.9, but you can connect with at least versions 1.7.2 (which I'm running because of old plugins that haven't updated) through 1.7.10 (which I ran briefly just to see if I could).

Our subreddit is /r/mcpublic. There you can find lively discussion, as well as sidebar links to our rules, wiki, outside forums, live map, carto, old maps, and more. Our current map is 5k x 5k blocks, and is our 13th different map since we started. At 5 months old, our current map is well-developed, but there is still plenty of free space and resources for new players to get started. Ages of our players range from teens to old folks, and we have players from Europe, North America, and Australia, with a few others from various countries scattered about the globe.

Good luck in your search for a server.",t1_cjdw7ht,t5_2s3kg,,1,1,0,1435014138,False,0,,True,,t3_2cbhll,t3_2cbhll,SansaPants
False,0,cjdw7ov,Suomi,1406895789,,"Hopping in on this late, and posting in English because I don't have the patience to translate this comment since it's a topic of passion for me.

I've posted about my experience with 'Finland and alcohol' before on [comment thread #1](http://www.reddit.com/r/europe/comments/2aesi3/how_do_breweries_wineyards_in_sweden_deal_with/ciucm7x) and [comment thread #2](http://www.reddit.com/r/europe/comments/280hss/question_for_scandinavians_of_this_subreddit_what/ci6e0g8?context=3) in /r/Europe.

I've seen a number of news pieces on the government 'wanting to change the alcohol culture in Finland to be more like European alcohol culture'. I think structural changes to how alcohol is accessed is key to the way to achieve these desired ends. 

I was born and raised in Portland, OR, USA, the 'unofficial beer capital of the USA', where there are more small micro-breweries per-capita than anywhere else in the U.S. (at least when I left for Finland). You could go into the microbrewery, after 9 pm, and take home a [growler, commonly around 1.8L](http://en.wikipedia.org/wiki/Beer_bottle#Growler) of beer home without question. You can go into supermarkets after 9pm to buy beer. There are no restrictions on the percentage of alcohol of beer sold in stores! For example, on my 21st birthday (date of legal drinking age in US), I went to the supermarket at 2 am and picked up a 6 pack of microbrewed beers!

The issue of alcohol taxation is relevant, but in my opinion, a separate matter than how Finns fundamentally access alcohol and thus alcohol culture. 

Maybe start by doing reforms (like many US states have) on the basis of the volume of alcohol brewed/sold each year, to support the small microbreweries, and maybe then policy makers would get their desired 'European drinking culture'.

/end rant

",t1_cjdw7ov,t5_2qlq3,Kaksoiskansalainen Stadissa,3,3,0,1435014139,1406896081,0,flair-uusimaa,True,,t3_2c90wo,t3_2c90wo,americ
False,0,cjdw8sn,Showerthoughts,1406895896,,"And I'm a post grad doing research into the relation of the human brain size to IQ. I have a UK degree which means I just studied psych, not as a small course. Most publishing Phds's will tell you that IQ has a significant heritable portion, which in adults is about 70%. If you want I can direct you to a very famous letter signed by a few dozen phd's that states this.

I can tell you that using wiki as a reference in college will get you laughed at. Feel free to use it to locate links to the papers in the reference section, but any old muppet can and does mess with the main page and you can't trust it.

&gt; The reaso heritabilty goes up with age is due to how you were raised and heritability fluctuates as age moves up.

Yes... once you leave your childhood environment your genetics takes over.
I'm not sure what point you are trying to make. Kids from a crapy environment show more environmental effect ( as I'm well aware as I had a truly crappy chilhood and didn't do well at school). But once adults they spring back as they get control of their environment. However, the crapy childhood will have a major effect on life outcome as it will botch you education up a treat. I went to college in my forties as a result of mine.

I think one of the main issue is that people who don't specialise in the field assume environment mainly means things like'did you go to a good school' or did 'daddy take you to museums'. The real factors that will really depress IQ are much harsher. IN utero environment is a key factor (twins IQ's are about 5 points lower on average). Thing like did your mother drink when pregnant, smoke, take illegal drugs, was she malnourished? Then thing like childhood nutrition to make sure the brain develops correctly, and exposure to social interaction and mental stimulation. Did you have a head injury or major illness that affected your growth?

Most of us don't have any serious long term effect from environmental factors. At least not in Europe where our medical, social and education is much better at providing a level start.

However, IQ is not educational level. I measured high at eighteen when I'd left school as a qualification free teen, and it's not diffferent as a post grad. My kids who have a poor but stable home, are both high scorers and the girl is in the top decile at her grammar school. This is genetics in action.",t1_cjdw8sn,t5_2szyo,,1,1,0,1435014161,False,0,,True,,t3_2c5036,t1_cjcam6d,jackrabbitfat
False,0,cjdw8xc,Thailand,1406895908,,"I actually think the CDC might be mistaken on that. After all, they aren't in the country. You could easily be bitten by a soi dog drinking in central Bangkok, it doesn't require trekking in remote areas. That was exactly the scenario that happened to my friend who I had to take to hospital. 


I'd say most times I have been at risk of being bitten it happened in an urban setting, not a rural one (I've almost been nipped a handful of times and actually nipped once where it didn't break the skin.) And I spend plenty of time in rural settings, I've cycled tens of thousands of km across Europe and Asia. 

From reading it and what they are saying about children it seems they are taking it as ""if you are bitten you can go get post exposure prophylaxis"" which I guess is reasonable, after all 400,000 are treated for it every year but only a handful actually die from it (about 20/year IIRC).",t1_cjdw8xc,t5_2qjw5,,1,1,0,1435014162,False,0,,True,,t3_2bzwd8,t1_cjdvw0j,blorg
False,0,cjdw9bi,AskReddit,1406895947,,"... Huh. I've been lied to. Recently moved to NI from the main land of EUrope, so I had no clue. Thank you.",t1_cjdw9bi,t5_2qh1i,,3,3,0,1435014168,False,0,,True,,t3_2cak2r,t1_cjdvkrf,Aganiel
False,0,cjdw9dl,portugal,1406895952,,"Nao conhecia o autosapo, vou ver. Ja vi no standvirtual e os stands melhores (para Hiluxes) que la anunciam parecem ser todos no Norte, dai esta pergunta. Eu posso deslocar-me 1 ou 2 horas para fora de Lisboa mas preferia nao ir muito mais longe.",t1_cjdw9dl,t5_2qmie,,1,1,0,1435014168,False,0,,True,,t3_2cbioj,t1_cjdu9zj,gybemeister
False,0,cjdw9wt,dotamasterrace,1406896005,,"1. Servers weren't always shit. I mean the Europe ones have been shit forever but the North american servers were fine until recently when the east coast went down the shitter.

2. It's free to play but riot wants money. If every hero was easily / managebly unlocked than people wouldn't spend as much money on their game

3. What your talking about here is server issues preventing the games from starting not the client. But the client is bad.",t1_cjdw9wt,t5_2z18c,,1,1,0,1435014178,False,0,,True,,t3_2c9r82,t3_2c9r82,lnvoker
False,0,cjdwa6y,worldnews,1406896032,,"http://en.wikipedia.org/wiki/International_response_to_the_Second_Chechen_War

Or, to summarize, a lot of sharply formulated letters as well as some threats (as well as an investigation in a European court, which sadly has no real power in that situation). And yes, I do believe that that was not enough, however, the situation differs in the sense that Russia has immunity from UN sanctions due to having their own veto right amongst other circumstances that strongly complicated the situation. With that said, even if it was just basicaly politicians essentially yelling and beating on their chests at least they took a very clear stance opposing Russias actions, which is more than either ignoring the issue or giving Israel money while giving them immunity from the UN.

The reason that a lot of people are protesting is because their governments are either doing nothing or are actively helping Israel. If similar steps were taken against Israel as were against Russia you would not see nearly as many protests.",t1_cjdwa6y,t5_2qh13,,0,0,0,1435014177,False,0,,True,,t3_2cb22o,t1_cjdvb9x,iTomes
False,0,cjdwaku,europe,1406896069,,"France cant really be taken serious with that kind of candidate.

That guy has failed at everything he has ever tried to do, and now wants to get to screw up the whole EU instead of only france.",t1_cjdwaku,t5_2qh4j,European Union,1,1,0,1435014180,False,0,EURO,True,,t3_2cbl2l,t1_cjdvt8g,eGoSiGns
False,0,cjdwapk,videos,1406896082,,"So the music that the ""halo theme"" is based on is essentially some of the oldest music ever recorded. If it sounds like monks chanting in a church, thats because thats exactly what it should sound like. The music is called [Gregorian Chant](http://en.wikipedia.org/wiki/Gregorian_chant). 

It was originally sung in the huge cathedrals of Europe. It started out as just everyone singing one line in unison (kind of like the halo theme) as a way to make church better. Then they figured out that multiple lines being sung together sounded even better. We can trace all of modern music back to this Gregorian Chant.

I think its super cool that something would be written in this old style (presumably to add some old ancient feeling to halo) and then would be sung in places that had lots of reverberation because it sounds cool - when that kind of music started off in those high reverb places because it sounded cool.",t1_cjdwapk,t5_2qh1e,,1,1,0,1435014184,False,0,,True,,t3_2catsx,t3_2catsx,ghrey_ink
False,0,cjdwbhp,motorcycles,1406896155,,"Ah; didn't see the flair.

The FZ6R is a rebadged version of the Diversion for the American market. I think. The European FZ6 is a different bike.

Do Kiwis get bikes on American import?",t1_cjdwbhp,t5_2qi6d,'06 Yamaha FZ6 / '82 Kawa KZ-550,2,2,0,1435014193,False,0,gb,True,,t3_2cbi82,t1_cjdvz7d,the_breadlord
False,0,cjdwbnl,Smite,1406896170,,"Hey,

I study law in germany and I came to similiar conclusions on the topics, but one question that I am not really sure about is this:

Does EU-Law even apply here? Couldn't the contract just be interpreted as an agreement that every conflict that arises from it should be treated under US-Law? And we all know that US-Law is extremly underdeveloped when it comes to the protection of the customer who signed a contract.

Their logic is ""you signed it, deal with it"", which makes it really hard to do anything under US-Law.

That is why I am asking (and I don't know the answer myself):

Does Eu-Law even apply here?

Greetings",t1_cjdwbnl,t5_2stl8,Sobek,1,1,0,1435014206,False,0,sobek,True,,t3_2cbuav,t3_2cbuav,Pyrashark
False,0,cjdwbps,hearthstone,1406896176,,"Depends on the series; he disenchanting everything in mage and zoolock editions, but he kept all the decent+ cards in the Shaman run, since that was going to be his main EU account. In the rogue one, he declined from disenchanting certain cards, but also disenchanted a Cabal for some reason. I guess he doesn't plan on doing priest.",t1_cjdwbps,t5_2w31t,,1,1,0,1435014197,False,0,coin,True,,t3_2cbv3i,t1_cjdw4sg,flyingjam
False,0,cjdwcyj,polandball,1406896294,,"Well I guess Germanys influence is huge and we profit immensly from free trade and the currency union, but when we look at the structure of the EU, Germany is underrepresented. We get less sets in the parliament compared to all other countries, because seats are weighted in favor of the smaller states (12.8% seats compared to 15.96% of EU population) and all the other institutions are equally shared between all members.   
But whichever democratic system you choose, Germany would be always first unless you completly equalize it, but making 450.000 Maltese as important as 82 million Germans or 64 million Brits wouldn't make sense. (Also in Theory would encourage countries to split)",t1_cjdwcyj,t5_2sih3,Königlich Bayerisch Weiß und Blau,11,11,0,1435014215,1406896492,0,bavaria,True,,t3_2cbl8u,t1_cjdw7w0,Shadrol
False,0,cjdwd47,Romania,1406896309,,"Nu trebuie să te iert eu și nu e vorba de cine are dreptate, ci de modul cum pui problema față de cineva care e: 

1) necunoscut

2) evident indiferent sau chiar rău-voitor

N-ai să ajungi niciunde cu „hai că îți dau eu bani să te te descurci, că tu ești prea prost și sărac etc”",t1_cjdwd47,t5_2qm35,,3,3,0,1435014213,False,0,,True,,t3_2c94fd,t1_cjdvp6t,trubadurul
False,0,cjdwdej,worldnews,1406896337,,"It's not as if it's only Sweden who doesn't mention race, many countries in Europe don't do this. The only thing you usually her mentioned is nationality. ",t1_cjdwdej,t5_2qh13,,3,3,0,1435014217,False,0,,True,,t3_2cb7ka,t3_2cb7ka,InitiumNovum
False,0,cjdwdzc,Smite,1406896391,,Don't companies usually have a separate EULA for EU players? At least in GW2 they do.,t1_cjdwdzc,t5_2stl8,"Hecate, Goddess of Witchcraft",0,0,0,1435014220,False,0,dread-queen,True,,t3_2cbuav,t1_cjdwbnl,jhengski
False,0,cjdwehi,hearthstone,1406896435,,He went out last week in the EU qualifiers,t1_cjdwehi,t5_2w31t,,2,2,0,1435014224,False,0,targetdummy,True,,t3_2cbkdg,t1_cjdwb0b,_Fry
False,0,cjdwesa,Smite,1406896463,,"I am not sure about common practice for US-companies, which is the main problem.

All I know is european law and practices, therefore I am fairly uninformed when it comes to american stuff. I had some lectures about the basics of US-Law, but that's not enough to make that statement.

Greetings",t1_cjdwesa,t5_2stl8,Sobek,1,1,0,1435014229,False,0,sobek,True,,t3_2cbuav,t1_cjdwdzc,Pyrashark
False,0,cjdwett,AskHistorians,1406896467,,"&gt; The standard of living declined, but it was gradual and it was only significant in Western Europe

I'm not sure this is a very accurate statement. The formal ties that kept the western Roman territories together as an empire dissolved, thence creating local polities, and perhaps the wealthy aristocracies were less numerous, and major cities' populations dropped. But I'm not sure 'standard of living' for the populations dropped. I'd like to hear more about the details of this if you have them.",t1_cjdwett,t5_2ssp3,Medieval West Europe | Heresy &amp; Witchcraft | Occitania,7,7,0,1435014230,False,0,europe,True,,t3_2cbbp9,t1_cjdugnv,idjet
False,0,cjdwfg1,TopGear,1406896523,,"No it completely counts Europe might has well of been completely ""liberated"" by Russia and then they would of turned all of Europe into a socialist state, America helped a lot especially even before we officially entered. ",t1_cjdwfg1,t5_2r9n6,,1,1,0,1435014234,False,0,jeep ,True,,t3_2c7uwq,t1_cjdsidr,Harbinger147
False,0,cjdwfof,EDC,1406896544,,"My EDC pack.

European (Hungary), so no handguns/ammo :D

But I spend a lot of time outdoors/hiking/near machinery, so....:




- Evolveo Strongphone Q4 (which I chose because dual SIM + water/shockproof, but has a shitty GPS and camera [compared to its predecessor, a Galaxy Note II], not recommended).

- Mido Multifort Special Edition II, which I love, and would recommend but is discontinued.

- Böker Leopard Damast I, a really unique blade: http://www.boker.de/en/taschenmesser/boeker/damastmesser/110084DAM.html

- Windmill Delta stormproof lighter

- Leatherman OHT: http://www.leatherman.com/49.html

- Oakley Half Jacket 2.0, with Blue Iridium lenses

- Huawei HSDPA-&gt;WLAN mobile Wifi router, which I need almost every day for my IT jobs

- Keys, plus 64 GB waterproof USB memory stick

- (and also a tattered wallet, not pictured :) )",t1_cjdwfof,t5_2reni,,2,2,0,1435014237,1406897782,0,,True,,t3_2cbwoh,t3_2cbwoh,CarnivoreX
False,0,cjdwfpr,europe,1406896548,,"It's not necessarily easy to find a job - And yes, while you can get capital to start small businesses fairly easily, and protect your assets through LLCs, if you lose your job you may face difficulty paying that mortgage without sufficient savings, you may have trouble paying for healthcare if you become sick.  Basically, that social safety makes taking some risks less risky.  This is largely in reference to the US, where the social safety net is often fairly weak compared to most of Europe.",t1_cjdwfpr,t5_2qh4j,,-3,-3,0,1435014237,False,0,,True,,t3_2cbb12,t1_cjdw5ok,Vestrati
False,0,cjdwg2m,GreatApes,1406896579,,"I live in Europe, we don't even have rednecks here :( ",t1_cjdwg2m,t5_2xw1w,,7,7,0,1435014241,False,0,,True,,t3_2cb9s7,t1_cjdsqmg,Princess-cumbucket
False,0,cjdwgl4,GlobalOffensive,1406896626,,"The CGS league, with franchises &amp; stuff like we all know it was was only on CSS. No one of the old pro 1.6 teams played in CGS on 1.6. There was only a show match played on 1.6 before the whole tv shows etc.. but all the ladder was played on CSS (and this is why europeans hated it)

Btw the CPL never died cause of CGS, CPL died before that (the last event was on 2006 if i remenber correctly) cause of owner &amp; staff members leaving. ",t1_cjdwgl4,t5_2sqho,Gold Nova III,2,2,0,1435014248,False,0,rank gold-nova-3,True,,t3_2caxjh,t1_cjdvo5b,ritchh
False,0,cjdwgsr,worldnews,1406896644,,"USA is different than Sweden. Sweden belongs to Swedes, which is it's own group/ethnicity.

USA is nation of immigrants and there is no ""white american"" ethnicity like in most of Europe.",t1_cjdwgsr,t5_2qh13,,-3,-3,1,1435014247,False,0,,True,,t3_2cb7ka,t1_cjdwc78,tehzeroFIN
False,0,cjdwgtm,worldnews,1406896646,,"And pretty soon gender will be abolished in 'rape capital of Europe'  Sweden too since that too is a social construct

Sweden is so lost up it's own arse it's not even funny anymore",t1_cjdwgtm,t5_2qh13,,6,6,1,1435014249,False,0,,True,,t3_2cb7ka,t3_2cb7ka,We_Are_All_Fucked
False,0,cjdwhbu,worldnews,1406896692,,"False equivalence. There is no such thing as an American ethnicity in the first place. Whereas 'German' like other European demonyms has two senses being ethnic German (Aryan) determined by blood, and civically German determined by the whims of the law. ",t1_cjdwhbu,t5_2qh13,,-7,-7,1,1435014251,False,0,,True,,t3_2cb22o,t1_cjdvwyf,EastIndiaComp
False,0,cjdwhd3,polandball,1406896695,,"Absolutely amazing!

Of course the ironic bit is that German pacifism remains strong, and is the primary obstacle to a EU with a credible defense policy.  More like the Flower Reich than the Fourth Reich.
",t1_cjdwhd3,t5_2sih3,Best York,39,39,0,1435014253,False,0,new-york,True,,t3_2cbl8u,t1_cjdtvgv,shoryukenist
False,0,cjdwidc,polandball,1406896787,,"&gt; We get less sets in the parliament compared to all other countries

Of course, if the European Parliament actually had any power at all, this would be important. But since they don't, it isn't.

Plus you're ignoring the fact that Germany can massively influence the smaller states into voting in favor of them, kinda like big countries do at the UN. But you would ignore that, wouldn't you?",t1_cjdwidc,t5_2sih3,New England,1,1,0,1435014274,False,0,new-england,True,,t3_2cbl8u,t1_cjdwcyj,13104598210
False,0,cjdwiml,worldnews,1406896810,,"Because, as the Republicans say, government shouldn't pick winners and losers in the market. It's socialism. And communism. And fascism. And like Russia. Or Europe. Or China. /s",t1_cjdwiml,t5_2qh13,,1,1,0,1435014270,False,0,,True,,t3_2cb446,t1_cjdtjgf,Neovalis
