subreddit_id,distinguished,body,author_flair_css_class,ups,name,author_flair_text,gilded,created_utc,archived,link_id,retrieved_on,author,id,score_hidden,controversiality,score,edited,downs,parent_id,subreddit
t5_2vizz,,"True that.  Funny thing, though...many JRPG characters appear westernized, but the models sometimes retain Asian features, unless the character's specifically modeled on a real-life person.  A lot of the Final Fantasy characters look European, while some of them seem to have Asian eyes...

Pale skin is actually somewhat common among the Japanese and other races in the far east.  In fact, whereas many places in the world find a tan or a ""healthy glow"" to be an ideal beauty standard, highly pale skin is considered to be the ideal for Japan, kinda like how it was across many places in the world until the later half of the 20th century.",,2,t1_cbzazkc,,0,1377993611,True,t3_1lgw5v,1429631994,MissArchades,cbzazkc,False,0,2,False,0,t1_cbz8xp6,TumblrInAction
t5_2s7tt,,"Settlers are people who come, don't join the indigenous people and maintain their own ways. While I accept your frustration, I see the people you describe as settlers on their new land. Europeans arrived as settlers in North America and it can feel at times like it's happening again, although missing the nastier details like extermination.",,1,t1_cbzazpd,,0,1377993625,True,t3_1lhmat,1429631992,[deleted],cbzazpd,False,0,1,False,0,t3_1lhmat,AdviceAnimals
t5_2cneq,,"Burying my head in the sand? I don't give a fuck about Middle Easterners?

What the fuck are you talking about, you shitposter? I don't give a fuck about them because I don't support destroying their last secular government? You imbecilic fuck, YOU don't care about Alawites, Christians, Druze, Kurds, or any other minorities that will be slaughtered and raped just like they have been in places where Assad has lost control.

Still not seeing any proof. Your own article admits that the US and Europe have released absolutely nothing to back up their claims. But no dude, keep ranting, I'm sure ""Middle Easterners"" totally want you to advocate bombing their country from the comfort of your seat.

BTW, love it how you instantly assume you know everything about me and what I think- and also somehow believe that my support or lack of will lead to thousands dying. I was actually advocating a NATO+UN intervention while tens of thousands were being murdered and the rebels weren't so desperate as yet to enlist fundamentalists from Chechnya, Africa, Afghanistan, etc. But I guess slaughter by convention arms is somehow less important than by chemical weapons to sensationalist fucks like you??",,1,t1_cbzaztt,,0,1377993637,True,t3_1lglbo,1429631991,a_hundred_boners,cbzaztt,False,0,1,False,0,t1_cbzahk3,politics
t5_2qh1i,,"Last night.

I have an interview for a PhD in a couple days that I have to fly across Europe for. I should have given preparation so much time. I need to do much more reading about the Profs and their work than there is time available.

Fuck.",,1,t1_cbzb144,,0,1377993768,True,t3_1lh7fi,1429631975,theskymoves,cbzb144,False,0,1,False,0,t3_1lh7fi,AskReddit
t5_2qh1i,,"I still pronounce the word secant as ""say-cant"" instead of ""see-cant"" b/c of a European professor I had in undergrad. Now that I'm a high school math teacher I DO say it correctly most of the time, but still hear ""say-cant"" every time in my head.",,3,t1_cbzb1ug,,0,1377993838,True,t3_1lh7fi,1429631965,Aperture_Lab,cbzb1ug,False,0,3,False,0,t1_cbz7dc8,AskReddit
t5_2qh33,,"Aye. Scottish, which is European.",,1,t1_cbzb2ph,,0,1377993920,True,t3_1lh0jd,1429631953,yoloswagbrapbrap,cbzb2ph,False,0,1,False,0,t1_cbzac5m,funny
t5_2qpp6,,i believe goodie would rise to fame and become a super star in europe,MBCHero,-3,t1_cbzb2x0,MBC Hero,0,1377993942,True,t3_1lhm2r,1429631951,kingston8thhardball,cbzb2x0,False,0,-3,False,0,t1_cbzb1ze,starcraft
t5_2r7qs,,http://firstrowus1.eu/sport/american-football.html,nebraska,1,t1_cbzb3ts,Nebraska,0,1377994031,True,t3_1lgrpk,1429631939,curtains,cbzb3ts,False,0,1,False,0,t1_cbzb2uc,Huskers
t5_2qm9d,,"Working stream:

http://www.vipboxonline.eu/american-football/171850/1/new-mexico-st.-at-%2815%29-texas-live-stream-online.html",texas2,8,t1_cbzb52g,Texas Longhorns,0,1377994155,True,t3_1lhngr,1429631923,tobydanger,cbzb52g,False,0,8,False,0,t3_1lhngr,CFB
t5_2r65t,,"Are you getting a whole wardrobe, just a suit? Both?

In any case, no way I'd spend a grand on my senior year wardrobe. 

* Spend $150 on Levi's and Alphas/D1
* find a few pairs of comfortable shoes but don't spend a fortune (you're still growing) $200 unless you hit jackpot at thrift store.
* haunt the thrift stores (or maybe hm/target/uniqlo) for the rest: tees, polos, ocdbs, navy sport coat, suit.
* get it all tailored.

Put the rest toward a summer backpacking in Europe or something equivalent.
",,1,t1_cbzb5hg,,0,1377994197,True,t3_1lhklz,1429631917,ZombieSushi,cbzb5hg,False,0,1,False,0,t3_1lhklz,malefashionadvice
t5_2s7tt,,"I use the metric system for some things. I tend to think about temperature in Celcius. But I learned that in Europe, so yeah. ",,1,t1_cbzb5ji,,0,1377994202,True,t3_1lf7si,1429631917,another30yovirgin,cbzb5ji,False,0,1,False,0,t3_1lf7si,AdviceAnimals
t5_2qm9d,,Stream - http://www.viplivebox.eu/american-football/171848/1/georgia-(5)-at-(8)-clemson-live-stream-online.html,southwest-sheet7-row18-col21-cotton-2shtl-2rw09-2cl04,3,t1_cbzb5ll,Southwest / Cotton Bowl,0,1377994208,True,t3_1lhju4,1429631916,smiles_and_cries,cbzb5ll,False,0,3,False,0,t3_1lhju4,CFB
t5_2su3h,,"All of them are so much fun. It's really hard to choose from the three I've played. Those games being Magicka, CK 2 and EU 4.",,1,t1_cbzb8ch,,0,1377994479,True,t3_1lhdli,1429631880,Carnith,cbzb8ch,False,0,1,False,0,t3_1lhdli,paradoxplaza
t5_2qhqt,,More like the ~~Carling~~ Capital One Cup of Europe,5,16,t1_cbzb8of,,0,1377994511,True,t3_1lhlzy,1429631876,phasE89,cbzb8of,False,0,16,False,0,t1_cbzauop,Gunners
t5_2qhhq,,"Yes, unless it is a European option, which is highly unlikely.
",,1,t1_cbzb989,,0,1377994569,True,t3_1lhj97,1429631869,ahminus,cbzb989,False,0,1,False,0,t1_cbzb3be,investing
t5_2qh3l,,"You can't fully understand why this is happening without understanding that in 2011 Assad signed a deal with Iran and Iraq to build a natural gas pipeline from Iran to the med; that Israel just recently discovered a large gas field of its own in the east med (it's called Leviathan and its the first energy resource they've ever had); that Qatar supplies liquid natural gas to Europe in cooperation with an English company; and that Turkey is the middleman for energy distribution between Europe and the middle east. Also, it's common knowledge that the chemical weapons in Syria were brought in by mercenaries supported by the US and UK and that it's now coming to light that the US had prior knowledge of a chemical weapons attack. That debacle is a false flag event, my friend.

*edited for clarity*",,2,t1_cbzba2u,,0,1377994652,True,t3_1lh0cf,1429631858,CitizenOlympic,cbzba2u,False,0,2,1378015256,0,t1_cbz520r,news
t5_2qio8,,"Sadly I play on EU, but will upvote so other may see it!

Best of luck!",horde-warrior,5,t1_cbzbaas,,0,1377994672,True,t3_1lhk6g,1429631856,A_white_kid,cbzbaas,False,0,5,False,0,t3_1lhk6g,wow
t5_2qy08,,"what i found, http://www.vipboxonline.eu/american-football/171850/1/new-mexico-st.-at-%2815%29-texas-live-stream-online.html


its Not hd though, any one got an HD stream?",,3,t1_cbzbble,,0,1377994798,True,t3_1lho36,1429631838,DrippingWithSarcasm,cbzbble,False,0,3,False,0,t3_1lho36,UTAustin
t5_2qh33,,Certain parts of Europe are still skeptical of those upstart American inventions such as air travel.,,1,t1_cbzbcat,,0,1377994865,True,t3_1lho2g,1429631829,253IsHome,cbzbcat,False,0,1,False,0,t3_1lho2g,funny
t5_2qh41,,"I wish I'd travelled more at 18, great age for it.  Young and open-minded going-on-naive enough to stumble potentially beyond your comfortable limits, but nimble and smart enough (hopefully) to get away with it smelling of roses and with some good stories.

Eastern europe in winter will be bastard cold, but otherwise go for it. ",,2,t1_cbzbcym,,0,1377994930,True,t3_1lhmmo,1429631821,[deleted],cbzbcym,False,0,2,False,0,t3_1lhmmo,travel
t5_2s8kf,,"With slight variation, the sizing is consistent across brands.  It's just that the measuring system is wrong.  

I did a [post](http://www.reddit.com/r/ABraThatFits/comments/1l5zbc/some_history_behind_4underarm_measurement/) earlier this week with some information on the history of +4.  Basically, you used to just order a bra by your bust measurement, like other garments (dresses, shirts, etc).  So, your bust would measure 36"", you'd order a 36 bra.  Then they added cup sizes which were basically estimates of projection, but still the number correlated to your *bust* size (36A was 36 bust with small ""boob"" amount 36B was medium boob-age, etc).  Some point in the 60/70s they switched it to underband measurement (the European regulating body actually passed a regulation saying it had to be this way), and women wanted to keep ordering their same sizes, so then the measuring system agapted to that.  Now it just makes no sense but no one (except for ABTF and a few shops) has bothered to correct it.",,10,t1_cbzbez2,Avocado 60G; Comexim 60HH,0,1377995122,True,t3_1lhjh1,1429631794,luftballoons,cbzbez2,False,0,10,False,0,t3_1lhjh1,ABraThatFits
t5_2qhvo,,"Maybe in the US. In Europe the first intifada did indeed bring into everyone's living room the story of an oppressed native people at the hands of a callous colonial occupier. If anything, 911 in conjunction with the second intifada diminished that support, but the tide reversed soon, and not because of the Iraq war, which was seen as an imperial US enterprise, unrelated to Palestine's conflict. Europeans just dislike occupation. You can call it post-colonial guilt, or simply learning the lessons of your own past, but that's the way it is.",,-1,t1_cbzbg20,,0,1377995219,True,t3_1lf7sj,1429631781,Johnlongsilver,cbzbg20,False,0,-1,False,0,t1_cbz2hnj,Israel
t5_2s3qj,,"Remember though, just because YOU can't pull money out of MtGox doesn't mean that lots of other people can't.

There seems to be an ongoing movement to make the MtGox price irrelevant, but European &amp; Japanease withdrawals are still going through from what I understand.  And honestly, if you had THAT much money tied up in Gox, you could always just pay the 5% fee to have it removed. ",,8,t1_cbzbimq,,0,1377995441,True,t3_1lgxub,1429631747,Ninsha,cbzbimq,False,0,8,False,0,t1_cbz99z5,Bitcoin
t5_2qh41,,If you are European: http://www.easyjet.com/en/InspireMe,gbr,1,t1_cbzbis8,United Kingdom,0,1377995456,True,t3_1lgnzm,1429631745,PiratePegLeg,cbzbis8,False,0,1,False,0,t3_1lgnzm,travel
t5_2s7tt,,"&gt; Mostly developing or third world countries

...

&gt;Nazi concentration camps or Soviet gulags

You realize that Europe and Western Russia ~~seriously qualify as the first world~~ *(NB: I am an idiot)* are very wealthy and have been for literally *centuries*, right? They're not exactly starving third-world hellholes.",,2,t1_cbzbjg9,,0,1377995515,True,t3_1lh7e6,1429631736,SunbathingJackdaw,cbzbjg9,False,0,2,1377996691,0,t1_cbzbe6d,AdviceAnimals
t5_2rgs7,,"Listen, we all know what NA and EU have in common... a shared love for Nutella.
Slather your screens, folks! The servers will follow!",,1,t1_cbzbkpa,,0,1377995625,True,t3_1lh8sl,1429631720,STAFFinfection,cbzbkpa,False,0,1,False,0,t3_1lh8sl,ffxiv
t5_2qhwp,,You'll probably have a bit of trouble getting online with it after installing to be honest. I personally wish I'd waited a week or so to pick it up. There's a super high volume of players online and most na/eu worlds are most likely going to be full up for a few hours yet. I'm having a blast with the game when I can actually play it though ,,2,t1_cbzbku4,,0,1377995635,True,t3_1lgu38,1429631718,seannykun,cbzbku4,False,0,2,False,0,t1_cbzbd9f,Games
t5_2rfxx,,I really understand you becuse in eu if top and mid lane swap they change it.,11 team,19,t1_cbzbna3,,0,1377995850,True,t3_1lhmxm,1429631687,JOJMAN1337,cbzbna3,False,0,19,False,0,t3_1lhmxm,leagueoflegends
t5_2rfxx,,"nope. M5 wasnt a team at S1 i think, and CLG.eu either, wickd was on SK gaming, not sure about the other players.",01 team,7,t1_cbzbnv9,[arcynn] (NA),0,1377995905,True,t3_1lhonf,1429631679,mx3552,cbzbnv9,False,0,7,False,0,t1_cbzbkya,leagueoflegends
t5_2rfxx,,"What they said, if TSM wins tomorrow they receive the bye to the quarterfinals, if they lose they take the #2 seed into the group stage.

I'd assume they'll split up the Asian and Western 2s, I guess something like NA #2 and China #2, and Eu #2 in one bracket, and Korea #2, Eu #1, NA #3, EU #3 in another. 

Either way the group stages are going to be brutal; you want that bye. Especially since in my opinion Korea's weakest team gets their bye (Najin Black Sword) and you'll have MVP Ozone, and one of SKT1/KTB/CJ Frost/CJ Blaze in the group stage.",,3,t1_cbzbodi,,0,1377995949,True,t3_1lh0np,1429631673,Tyrandis,cbzbodi,False,0,3,False,0,t1_cbzbkuj,leagueoflegends
t5_2xbci,,I want one game to come with it now that EU gets FIFA.  It's not fair if we don't get a game too.,,5,t1_cbzbolh,,0,1377995970,True,t3_1lh5af,1429631670,[deleted],cbzbolh,False,0,5,False,0,t3_1lh5af,xboxone
t5_2rel9,,I'm in Europe wish I could have had those toes in my mouth ;) so sexy ,,0,t1_cbzbp8r,,0,1377996031,True,t3_1lhgn8,1429631661,Irhavediabetes,cbzbp8r,False,0,0,False,0,t3_1lhgn8,feet
t5_2qhek,,"Which is a part f the reason we hate being called British, apart from the fact that we're not, people don't bother making a destinction between us and GB, which to us isn't fair as we are our own country, we have our own government and we are totally independent from them, yet we're labeled British because there once was a time when they took over, but that time has passed and the only thing that we even relate to now is sports, and even that's only to an extent

Sorry if I'm ranting its just annoying that this happens so much, I can't imagine what would happen if Europeans said Canada was just another part of america, I'd imagine they'd be as annoyed as we are
",,5,t1_cbzbpdv,,0,1377996044,True,t3_1lgno5,1429631660,Oismush,cbzbpdv,False,0,5,False,0,t1_cbzbf3u,doctorwho
t5_2rfxx,,"Sea 

* Mineski

Taiwan

* Gamania Bears

Europe

* Fnatic
* Lemondog
* Gambit Gaming

Wildcard

* GamingGear.EU

Korea 

* Najin Black Sword
* MVP Ozone

North America

* TSM",,1,t1_cbzbri7,,0,1377996249,True,t3_1lhpmy,1429631632,cjesh,cbzbri7,False,0,1,False,0,t3_1lhpmy,leagueoflegends
t5_2rfxx,,"You can not be impressed or not, I really don't give a rip.  NA is still better than EU, deal with it.  

Edward coming here and struggling only serves to prove that statement.",00 team,2,t1_cbzbspc,,0,1377996361,True,t3_1lh0np,1429631617,ajkeence99,cbzbspc,False,0,2,False,0,t1_cbzbpvl,leagueoflegends
t5_2sokd,,"Another part of the answer that I don't see in the other comments here yet, is that many black people in the USA grow up with what is effectively a different language that uses almost all of the same vocabulary as English.

Huge numbers of slaves were brought from portions of Africa that spoke languages from the Niger-Congo language family.  When they were all mixed up and mushed together in the US with other black slaves who spoke other languages, they didn't have a common vocabulary, but they *did* have a common grammar.  So, they picked up the vocabulary of English to communicate with each other, but in many ways kept their Niger-Congo based grammar rather than fully adopting English's Germanic (Indo-European family) grammar.

Even after slavery, segregation continued for generations, and there's still a lot of segregation today, so this way of speaking has continued to develop as a linguistically separate entity, and still retains many elements Niger-Congo languages, even though they're using English vocabulary.

Many black people essentially grow up bilingual - they learn how to speak ""black English"" growing up at home, and then separately have to learn how to speak ""white English"" in order to be taken seriously by the dominant society around them.  I think much of what you think of as ""an accent"" is actually this somewhat different grammar, which systematically alters the sounds of certain words as well as the order in which they're sometimes used.",,2,t1_cbzbsrr,,0,1377996368,True,t3_1lhiag,1429631616,cos,cbzbsrr,False,0,2,False,0,t3_1lhiag,explainlikeimfive
t5_2qm9d,,"http://firstrowus1.eu/watch/204737/3/watch-kentucky-vs-western-kentucky.html

Click Link 3. ",kentucky,2,t1_cbzbsy3,Kentucky Wildcats,0,1377996385,True,t3_1lhigu,1429631613,vinvo7,cbzbsy3,False,0,2,False,0,t1_cbzbr90,CFB
t5_2xbci,,they don't need to. They know people will buy it in the US. Europe leans more toward Sony most of the time so Microsoft wanted to create an incentive for them to switch to XBox. ,xbox,2,t1_cbzbteo,falconbox,0,1377996424,True,t3_1lhmey,1429631607,falconbox,cbzbteo,False,0,2,False,0,t1_cbzas66,xboxone
t5_2u8bb,,"This is srsly just sad. We pay the same amount of money and we don't even get games half as good as Europe does. What we get though is pretty good games on sale, which makes us pay even more money. But I think what takes the cake is ICO this month without SotC. Just ridiculous and sad at the same time. And we still get PSP games! W T F!",,0,t1_cbzbtnp,,0,1377996446,True,t3_1ldrac,1429631605,yinei,cbzbtnp,False,0,0,False,0,t3_1ldrac,PlayStationPlus
t5_2qi58,,"He always plays well during the honeymoon period but eventually causes trouble for every European club he has been with. Ferguson was hardly a soft touch himself, Tevez is just a selfish prick.

Maybe he has matured and will be a model professional for Juventus, but it would hardly be surprising if he wasn't.",,13,t1_cbzbvh7,,0,1377996619,True,t3_1lhcqs,1429631581,[deleted],cbzbvh7,False,0,13,False,0,t1_cbzagax,soccer
t5_2rfxx,,"Players on CLG.EU either didn't go pro yet or on other teams. (most on SK I think)

The original M5 formed like beginning of S2 to qualify for IEM Kiev.",,2,t1_cbzbw42,,0,1377996681,True,t3_1lhonf,1429631572,skumbag_steve,cbzbw42,False,0,2,False,0,t1_cbzbkya,leagueoflegends
t5_2s113,,"I could imagine communication is a lot harder here in the eu that  what you are used too. Also, most polish and german players refuse or can't use english so the chat can sometimes end up being full of polish/german people chatting (mostly poles though) I have no clue as to wether actual gameplay is any different in the eu as opposed to the us other than non-communicating teams.",euplayer,2,t1_cbzbw48,-C-C-,0,1377996681,True,t3_1lh48b,1429631572,snucker,cbzbw48,False,0,2,False,0,t3_1lh48b,WorldofTanks
t5_2qhwp,,"Like I said, I understand and I agree. It took me 2 days to actually be able to make a character on the world my friends are playing on, and I'm sure there are other people who bought it and still haven't been able to get on once. They should have made more servers for na/eu, especially with the problems they were having in the betas and early access. ",,1,t1_cbzbwrf,,0,1377996745,True,t3_1lgu38,1429631564,seannykun,cbzbwrf,False,0,1,False,0,t1_cbzbqxg,Games
t5_2rfxx,,"I can give you a list here :
Mineski (SEA), GamingGear.EU (Wildcard), Fnatic (EU), Lemondogs (EU), Gambit Gaming (EU), Najin Black Sword (KOR), MVP Ozone (KOR), Team Solomid (NA), Cloud 9 (NA), Gamania Bears (TW)",00 team,1,t1_cbzby60,,0,1377996879,True,t3_1lglwo,1429631546,ClawViper7,cbzby60,False,0,1,1378002451,0,t1_cbzbqrl,leagueoflegends
t5_2rfxx,,"The Problem is, C9 wasn't even in Spring Split, you all complain but C9 basically loses half the points they could've won if they did decide to do the circuit point system. Korea is able to do this NLB OGN system because they have the teams to do it. Is there a Sub LCS league other than MCS which was only recently implimented? no. MLG Dallas/Anaheim doesn't even count because it wasn't a tournament system and was just pretty much LCS but in a lan format like EU's been doing.\

Promotions might count but did C9 do that well in spring? No.",teemo,1,t1_cbzbyi0,,0,1377996915,True,t3_1lglwo,1429631541,Tokibolt,cbzbyi0,False,0,1,False,0,t1_cbz24ii,leagueoflegends
t5_2qh1i,,Are you in Europe?,,2,t1_cbzbynz,,0,1377996930,True,t3_1lgyay,1429631539,[deleted],cbzbynz,False,0,2,False,0,t1_cbz4bt3,AskReddit
t5_2rfxx,,"Jonkoping, Sweden.  

It was pretty big by that stage, albiet mainly in EU and NA.",karma,1,t1_cbzbzjb,,0,1377997008,True,t3_1lhonf,1429631528,ajsadler,cbzbzjb,False,0,1,False,0,t1_cbzbujl,leagueoflegends
t5_2rgs7,,"Copy paste:

""We were experiencing technical difficulties wherein players are being disconnected from instances on the North American and European data center Worlds. As a result, customers who were disconnected from said content are unable to log in.

We are pleased to announce that the issue has been addressed. We apologize for any inconvenience this may have caused.

[Date &amp; Time]
From Aug. 31, 2013 12:53 a.m. to 4:15 p.m. (PDT)

[Details]
- Disconnected from certain instances.
- Unable to log in after being disconnected from certain instances.

[Cause]
-Congestion to certain instances

[Affected Worlds]
North American and European Data Center Worlds""

Source: XIV official twitter",,1,t1_cbzc22x,,0,1377997253,True,t3_1lh8sl,1429631495,lexxynichelle,cbzc22x,False,0,1,False,0,t3_1lh8sl,ffxiv
t5_2xcmc,,"No, I didn't get it because I live in Europe. I'll have four vanities because I have four accounts, of course I'll trade!

I'm not sure whether the Full moon vanity is Europe only, though. I could have worded it better...",pear,1,t1_cbzc2dg,"[NL] 2895-6409-3717 (Michel/Michelle/Michael/Michela, Rainbow)",0,1377997284,True,t3_1lhq75,1429631491,RainbowSupporter,cbzc2dg,False,0,1,False,0,t1_cbzc0pm,ACTrade
t5_2qi58,,"You want reactionary, I'll give you reactionary:

1 - Sturridge will score 25+ in the prem, 40+ in all competition.

2 - He and Lambert are Englands best forwards.

3 - Chelsea are selling Mata and are the new thugs of Europe.

4 - Arsenal will fight for relegation and Wenger needs to step down immediately.

5 - Tottenham are favourites for the Premier League title and are a shoe-in for champions league.

/s


*edit - forgot to add obligatory '/s' for those that couldn't tell I was being sarcastic.",,24,t1_cbzc2ks,,0,1377997303,True,t3_1lhi3y,1429631489,halfpastlate,cbzc2ks,False,0,24,1377998817,0,t1_cbzbqtp,soccer
t5_2t403,,"[](/AJinterrobang) We have a fellow Brit amongst our ranks? Or...western European, anyway, possibly.",karma,1,t1_cbzc2t8,Karma,0,1377997325,True,t3_1lhm1u,1429631486,IndigoMichigan,cbzc2t8,False,0,1,False,0,t3_1lhm1u,MLPLounge
t5_2qh13,,"I thought it was hilarious when people, usually Canadians and Europeans and smug Americans, were being high and mighty at Siria trending like Americans were being ignorant.",,-1,t1_cbzc3gz,,0,1377997391,True,t3_1lgzwp,1429631477,Hawkeyepiercemd,cbzc3gz,False,0,-1,False,0,t1_cbz4zwu,worldnews
t5_2cneq,,"There's more than enough doubt that Assad used chemical weapons (the latest reports have them coming from Saudi Arabia), but even if he did, it's a civil war with multiple sides none of which are ""good guys"". Who would we be supporting? Or, are just going to bomb the shit out of somebody because that's what we do?

If the UN, NATO, the EU, etc. aren't willing to get involved, we should probably get a clue and stay out as well.",,3,t1_cbzc3kt,,0,1377997400,True,t3_1lhq50,1429631476,MarcoVincenzo,cbzc3kt,False,0,3,False,0,t3_1lhq50,politics
t5_2qh1e,,"I really hope the google voice recognition will be strong enough for foreign langauges (or English accent of foreigners)
Else it's another thing that Europe misses out on.",,1,t1_cbzc4jv,,0,1377997493,True,t3_1lfs3n,1429631463,TheApatheist,cbzc4jv,False,0,1,False,0,t3_1lfs3n,videos
t5_2qh33,,Why the hell would you waste your money like this ... THIS is the reason I only date modest central European girls,,-13,t1_cbzc4px,,0,1377997510,True,t3_1lh9hs,1429631461,ThreadEnhancer,cbzc4px,False,0,-13,1377997723,0,t1_cbzablc,funny
t5_2qh33,,I was speaking more to his idiotic attacks against everyone in Europe.,,1,t1_cbzc6av,,0,1377997669,True,t3_1lellp,1429631440,[deleted],cbzc6av,False,0,1,False,0,t1_cbz96vu,funny
t5_2qh33,,"Ah. Yes you are right. At this point we'd need to be invaded by Aliens in order to smugly turn to the world and say ""See!? Worth it!"". 

 With a slight caveat...the world's shipping lanes are basically piracy free for the only time in human history and that's almost exclusively on American tax dollars and our Navy. If America was to retreat inward, European tax payers would need to increase spending in a few areas to maintain the status quo.",,1,t1_cbzc7jf,,0,1377997794,True,t3_1lfshh,1429631424,Dojodog,cbzc7jf,False,0,1,False,0,t1_cbzby9n,funny
t5_2rbnb,,http://firstrowus1.eu/watch/204800/1/watch-kansas-city-vs-colorado-rapids.html,colorado-rapids,2,t1_cbzc8bp,Colorado Rapids,0,1377997867,True,t3_1lhnll,1429631414,CarlettoTheSmoove,cbzc8bp,False,0,2,False,0,t1_cbzc7k4,MLS
t5_2qh1i,,"People in Europe consider football to be soccer, so I was making it clear.",,1,t1_cbzc8dd,,0,1377997872,True,t3_1lhoq5,1429631413,bigdogtruman,cbzc8dd,False,0,1,False,0,t1_cbzbju1,AskReddit
t5_2qh1i,,"After Pearl Harbor was bombed, we declared war on Japan and Germany. Germany actually declared war on the United States, ensuring that the US would open a front in Europe, which may not have actually happened if Hitler had not done that. Its only specualtion but the implications of this decision were huge on the European front.",,0,t1_cbzc8kq,,0,1377997891,True,t3_1lhg6g,1429631411,seangt12345,cbzc8kq,False,0,0,False,0,t3_1lhg6g,AskReddit
