archived,id,parent_id,created_utc,body,link_id,edited,subreddit,gilded,retrieved_on,author_flair_css_class,distinguished,score,controversiality,ups,author,name,score_hidden,author_flair_text,subreddit_id,downs,removal_reason
True,c5804l1,t3_vvjnh,1341147897,"First off you resistances are kinda low. Try getting at least 100 more (even glass cannons get hit once in a while and you want that to be low)

As for build, this my build I have used for solo play in ACT3/4 Inferno:
http://eu.battle.net/d3/en/calculator/wizard#blXROQ!dfb!bbabYY

It isn't huge dps but for solo play you don't need more.

Tips about the build:
- use Blizzard to create a patch between you and mobs
- recast Hydra if the previous one is out of range
- each time you are getting hit for more than 15% you will have teleport ready (good for some pesky champion/elite packs)
- diamond skin each time you can't avoid dmg

When you feel more comfortable with this build you might want to switch some defensive abilities for more dps (ditch diamond skin and teleport for Force Weapon and 12% dmg Familar - this will make Illusionist and Evocation useless and you can use Paralisis and Blur there/). I've tested this build today farming ACT1 Inferno - it eats thru everything :) 

Tested the offensive build in ACT2 Inferno as well, but either I need to get used to it more or my gear isn't enough for some affix combos (waller+vortex, jailer+fast, invulnerable minions+fast - dunno how to do that without Teleport :P )",t3_vvjnh,1341163326,Diablo,0,1429271778,wizard-europe,,4,0,4,Lilija,t1_c5804l1,False,Lilija#2192,t5_2qore,0,
True,c5804nk,t3_vv2qk,1341147919,"I don't think spain are one of the best internaitonal sides ever despite their trophy record, I just think they're playing in an era where international football is less important, while big european sides are in a rebuilding phase (mainly italy and france). They're use of the ball isn't effective its safe, their style is what sets them apart from other sides not their quality as a team for me.",t3_vv2qk,False,soccer,0,1429271776,3,,2,0,2,B0M85H311,t1_c5804nk,False,Liverpool,t5_2qi58,0,
True,c5804rx,t3_vvksx,1341147954,"You don't need a VPN to play in the BWEs. Up until now the region locking hasn't been in place and I don't think they will add it for BWE3 either. As far as ping goes, I had a friend from NA play on the EU servers and he was alright, although the ability delay can be somewhat annoying. FPS is entirely dependent on your computer specs and has nothing to do with your internet connection.",t3_vvksx,1341148441,Guildwars2,0,1429271778,HumanW,,11,0,11,megera23,t1_c5804rx,False,Gandara,t5_2r9po,0,
True,c5804tz,t3_vvhrg,1341147969,"I think it was specially clear when CLG.EU started dominating with Froggenivia, then you start seeing people playing Anivia in both Solo Queue and Normals while not knowing how does the champion work.",t3_vvhrg,False,leagueoflegends,0,1429271779,74 team,,2,0,2,Aoyos,t1_c5804tz,False,,t5_2rfxx,0,
True,c5804w9,t1_c5800ua,1341147985,"My family grew up in Afghanistan and before a specific religious sect which invaded came in it was a beautiful country. My mom was a doctor and often went out in dresses and skirts. She drove and was as independent and liberal as could be. People from Europe would come to Kabul to ski and vacation , so please tell me more about my religion and country as you reading a couple of articles on CNN and buying into western media clearly has made you much more educated than I must be in regards to the nation of Islam. ",t3_vuo0a,False,atheism,0,1429271779,,,1,0,1,blind_snipa,t1_c5804w9,False,,t5_2qh2p,0,
True,c580535,t3_vvksx,1341148034,"Uhm... how about just playing the game in America? I don't think that there's any need for a VPN tunnel.

But yes, you'll have a higher ping and some lags when you connect to the European servers from America.",t3_vvksx,False,Guildwars2,0,1429271782,AsuraE,,1,0,1,BauerA,t1_c580535,False,,t5_2r9po,0,
True,c5806xf,t1_c57u41g,1341148494,"ah yes, sorry - FDA rules. Watch this space though!

EDIT - we do have the CE mark though, meaning 500,000,000 Europeans can buy and use us. Good excuse for a vacation :-)",t3_vs03v,False,skeptic,0,1429271806,,,1,0,1,joetheyfit,t1_c5806xf,False,,t5_2qj8f,0,
True,c5807wq,t1_c57zajx,1341148752,"lol aiight brah, surely you can't see how fucked up it is to claim that the rich country that pollutes the most per capita, the one with the strongest economy in the G20, shouldn't be taking any action until the developing countries with millions in poverty take action.

The European Union has a price on carbon. We're not alone. At any rate, if you really think this mild carbon price is going to kill our economy, you're a dumb fuck.",t3_vue1s,False,australia,0,1429271818,,,2,0,2,passa91,t1_c5807wq,False,¯\_(ツ)_/¯,t5_2qh8e,0,
True,c58084o,t1_c57pk4d,1341148814,"Iffy. I mean 20-30 years ago you certainly could, but I'm not sure on the current status of that. I think the UK changed its laws a little when it entered the EU. That said getting a working visa isn't hard, once you are a commonwealth citizen. And you get less queues at airports.",t3_vtotu,False,AskReddit,0,1429271821,,,1,0,1,endochrom,t1_c58084o,False,,t5_2qh1i,0,
True,c5808zh,t1_c57zmih,1341149033,"Segregation was a U.S. thing, but there was plenty of racism going on in the European colonial empires.  The difference between the U.S. and Europe is that the U.S. treated our own people like garbage, while Europe treated someone else's people like garbage.",t3_vv5e1,False,todayilearned,0,1429271833,,,39,0,39,Legend_of_El_Barto,t1_c5808zh,False,,t5_2qqjc,0,
True,c5809zx,t1_c57ztk6,1341149295,"How about, *""The EU will soon inherit the kakistocracy of the Cypriot government""*",t3_vvjwy,False,logophilia,0,1429271847,,,3,0,3,OrestesM,t1_c5809zx,False,,t5_2rt1y,0,
True,c580a30,t3_vvm4c,1341149315,"http://en.wikipedia.org/wiki/Diomede_Islands

First European explorer didn't arrive until 1648, and its hardly mainland Russia, not to mention the climate is not ideal for civilization in the pre-modern age. ",t3_vvm4c,False,AskHistorians,0,1429271848,northamerica,,3,0,3,Irishfafnir,t1_c580a30,False,U.S. Politics Revolution through Civil War,t5_2ssp3,0,
True,c580b2f,t1_c57ylv7,1341149560,"all condoms are tested to the same standards (something called ISO testing), before being cleared for sale in developed countries like the US/EU.",t3_vv618,False,sex,0,1429271860,,,2,0,2,joetheyfit,t1_c580b2f,False,,t5_2qh3p,0,
True,c580bce,t1_c57zjmc,1341149631,"&gt;Beckham is close to quitting

Exactly he's close to quitting a low level league having long ago quit high level football, he simply isn't good enough.

&gt;To me Beckham is THE English football player

Everybody knows he's very famous, doesn't mean he's still that good a player. When I grew up Bryan Robson was probably ""THE English football player"" does that mean he should get picked? How about Kevin Keegan? He used to be the star of the England team as well. 

Bobby Charlton surely has far more of a claim to be 'the English football player', captained the first English club side to win the European Cup, perhaps the best player in the only England team to ever win anything, does this mean he should get a place in the squad?",t3_vt0xm,False,soccer,0,1429271864,,,0,0,0,Zenigata,t1_c580bce,False,,t5_2qi58,0,
True,c580bfi,t3_vuelh,1341149650,"I'm a bit late to this party, but whatever.  I'm a white looking person living in Cameroon, but I'm not the descendant of a colonist.  None of the non-blacks I know here are.  

I get met with extremes.  Either people love me because I'm a ""white man"" and others hate me.  Once I got spat on.  People just really want to talk to me about how different we are all the time and how there are no problems in the Western world.  Also, most people I encounter don't differentiate between people who aren't black.  Everyone else is ""white man"".  Sometimes ""Chinese.""  People ask me all the time what stuff is like in Europe even when they know I'm not from Europe.  

Sometimes I encounter people who think that ""white men"" are a problem  and slowing development in their country.  More often than not, people want me to solve their problems for them.  Also, everyone thinks I'm rich.  I work at a local job, live an a local salary, and have student loans.  I'm still expected to give them money. (Which I do not do.)

Most Cameroonians have positive views of their German colonial overlords, but (especially the Anglophone Cameroonians) hate the French colonists.  I don't really know why.  ",t3_vuelh,False,AskReddit,0,1429271865,,,1,0,1,Ratling,t1_c580bfi,False,,t5_2qh1i,0,
True,c580bgy,t1_c5804rx,1341149660,"There's a difference between world selection and region locking. Region locking means you can only log in to the game from a set location of the world. Server world locking is just an in-game mechanic to stop you jumping servers for WvW benefits and according to them to help build community. Not sure if you meant your friend was logging in from the EU or he changes his world to an EU server, but the later was what I understood.",t3_vvksx,False,Guildwars2,0,1429271867,Evon,,1,0,1,mutandis,t1_c580bgy,False,,t5_2r9po,0,
True,c580cq2,t3_qdbfc,1341149970,"[Cold Fusion] also has a few west-coast and europeans, so late night/very early mornings we have a few on, if you can catch me my toon's name is ""A'starte""",t3_qdbfc,False,Canderousordo,0,1429271882,,,1,0,1,Solara-BH,t1_c580cq2,False,,t5_2tnct,0,
True,c580d5g,t3_vvkg9,1341150073,I personally can't see the point in playing in a different region (ie EU players playing on US) no matter how good the tech is you will still have to contend with ridiculous latency.,t3_vvkg9,False,Planetside,0,1429271887,tr,,3,0,3,Bluenosedcoop,t1_c580d5g,False,INI Elite,t5_2s48x,0,
True,c580dfz,t3_vvl8x,1341150138,"**How come its there:**

* Its all to do with surface pressure. If we imagine a ball on a plank of wood, if you lift one side of the plank the ball moves down the slope towards the lower side of the plank. The same can be said of pressure, if we take the plank to be the surface pressure, as we raise it in one place the wind (the ball) tries to move to the lower pressure.

* On the surface of the earth, the sun is working like your hands holding the plank. As the sun hits the surface which causes air to warm up and rise, in doing so the surface pressure becomes lower (as you are taking air away and moving it higher into the atmosphere). You can imagine this like you are lowering one hand on the plank, the ball will roll towards you, in the same sense, once the pressure drops the wind blows towards you. 

* So: Sun -&gt; Temperature change -&gt; Air rising or falling -&gt; Pressure -&gt; Different pressure in different areas = Wind

* Please note: I haven't mentioned the ""Coriolis effect"", this isn't vital (I'm my opinion) to understanding what makes wind. If you want I can try answer it later.

**How come it is sometimes there, and sometimes isn't?**

* Usually, its always there. If you happen to be in an area where the sun is making the air rise, then you don't feel wind as the air is only rising, not blowing sideways. (This used to be a big problem for sailors trying to navigate the equator, as the air rises a lot there, they are known as [Doldrums](http://en.wikipedia.org/wiki/Doldrums) )

* Its usually less windy at night because there is no sun to cause temperature changes, thus changing pressure and causing wind.

**How come it is more windy in some places compared to others?**

This depends on where you live. In my case, I live on the coast in the windiest nation in Europe (Scotland). Why is it so windy here? 

* Well, on the surface of the globe we can imagine two main regions: warm areas, and cold areas (lets not complicate things with too much temperature variation). Now, where the warm air(areas close to the equator) and the cold air (areas close to the poles) come together, there is more of a difference in pressure, and it just so happens that these two temperatures meet at *about* 60°N/S of the equator (right where I live). Causing larger variation in temperature, thus more wind, and shitty weather.

* I also live on the coast, which causes more variation in wind. This is because land and sea warm up at different rates, and are usually known as ""sea breezes"". They occur when the sun shines on the coastal region, hitting both the land and the sea, but the sea tends to warm up far slower than the land. Again, causing there to be a large variation in temperature across a small region. As the land warms the air rises and causes the pressure to lower... But as the pressure at the surface wants to remain in balance it tries to pull the air from the sea, causing wind.

**tl:dr:** Sun → Temperature Rising → Air Rising → Pressure Changing → Pressure wanting to equalise → Pulling air from different regions →→→→ WIND!",t3_vvl8x,False,explainlikeimfive,0,1429271892,,,3,0,3,originalprankster1,t1_c580dfz,False,,t5_2sokd,0,
True,c580doi,t1_c57uuwv,1341150191,"I found [this](http://www.thestudentroom.co.uk/showthread.php?t=1918693) thread on studentroom.co.uk. As you can read in the first post regarding the chances of finding accommodation through the uni as a PG from within the EU:
&gt;This is extremely unlikely. Postgraduate housing stock is very limited and it is advisable to find alternative accommodation if you are an EU applicant.

You can find useful info in the thread and in studentroom in general. Give it a look. Hope it helps..",t3_vmy1w,False,Edinburgh,0,1429271904,,,1,0,1,stefaras,t1_c580doi,False,,t5_2rffi,0,
True,c580efb,t1_c57xx8b,1341150362,I have a rooted Kindle Fire and I just open the browser and go to www.firstrowsports.eu they stream all sports.  ,t3_vu4w1,False,AskReddit,0,1429271909,,,3,0,3,JR_Saperstein,t1_c580efb,False,,t5_2qh1i,0,
True,c580eib,t1_c580c42,1341150381,"They don't get it, they're just ignorant human beings looking to talk shit on  the US. It's the way of life in Europe. Down syndrome, and being ignorant ",t3_vvhj5,False,technology,0,1429271910,,,0,0,0,PeaveyWG,t1_c580eib,False,,t5_2qh16,0,
True,c580elk,t1_c5806us,1341150404,"I follow you. What you are saying is that a lot of times English as a second language is perfectly passable for the work that needs to be done. This is true. But at the same time there are situations where native-level English is needed.



All of my coworkers are non-natives and operate at a very high level of proficiency. However when we are writing to a specific client, or want to include subtle undertones in a message, I often get an email in my inbox ""Hey quick_thinkfast, could you read through this really quick and give me your feedback""?



I would think the need for natives would be more common in Asia where you are than in Europe because of the relatively good understanding of English most European business professionals have, but this is just a guess as I have never worked in Asia.


Sending my messages from an iPad on a train to Vienna - I know all too well the need to go back and edit.
",t3_vvfbg,False,IWantOut,0,1429271910,,,3,0,3,quick_thinkfast,t1_c580elk,False,,t5_2r5hw,0,
True,c580f47,t3_vvkg9,1341150511,We've had Aus and EU playing with NA on our NA server a lot,t3_vvkg9,False,Planetside,0,1429271914,nc,,2,0,2,ghstmarauder,t1_c580f47,False,[OO]xGhstmarauder - Connery | twitch.tv/ghstmarauder,t5_2s48x,0,
True,c580fnu,t3_vvizp,1341150639,"Riot Singed: M6DOP8AGQ0I3 
EU-NE",t3_vvizp,False,leagueoflegends,0,1429271920,01 team,,-16,0,-16,UltimateProdigy,t1_c580fnu,False,,t5_2rfxx,0,
True,c580g0c,t1_c580fo5,1341150722,"Invalid on EU-NE

(GK75PRQ93YKT)

EDIT: Oh NA Only. Would be nice to know it sooner so you don't flip out...",t3_vvizp,1341150970,leagueoflegends,0,1429271924,,,-1,0,-1,[deleted],t1_c580g0c,False,,t5_2rfxx,0,
True,c580g1o,t1_c57t2gq,1341150729,"I don't understand why you get upvotes...
American and Europe economy are in the crapper it makes total sense that the rich still pile up money..",t3_vue3j,False,worldnews,0,1429271925,,,0,0,0,Quenadian,t1_c580g1o,False,,t5_2qh13,0,
True,c580gko,t3_vungz,1341150848,I don't remember who said that (it was a pro player) but he said that asian teams focus on ganking the bottom lane when eu/na are focusing on the toplane.,t3_vungz,False,lolesports,0,1429271932,,,1,0,1,NeurOnuS,t1_c580gko,False,,t5_2tz9m,0,
True,c580hi5,t1_c580ep7,1341151050,"&gt;They're not sharing it and you can remove it at any time. 

From your phone. Not from the google servers. If you've been paying attention there has been a number of legal shitstorms in the EU over every big US internet company trampling over EU privacy laws over that. 

Simply put, once you put something on the could you can never delete it. You can just hide it from yourself and pretend that does something.",t3_vvjha,False,Android,0,1429271945,,,-3,0,-3,monochr,t1_c580hi5,False,,t5_2qlqh,0,
True,c580hib,t1_c580d5g,1341151051,"I'm in the EU, but my outfit that I've been with for almost ten years (not just in PS) is US based, so I won't have a choice. 
If the latency is really that bad, I'll just have to do more support-based roles.",t3_vvkg9,False,Planetside,0,1429271945,nc,,3,0,3,FreddyFiveFingers,t1_c580hib,False,[SG] Mattherson,t5_2s48x,0,
True,c580hk6,t1_c57yqqq,1341151064,"[Check out this pic]( http://www.flickr.com/photos/mrsbluff/4687112487/in/set-72157625768517969) --it was my setup on my two-month Europe trip. 

All of my other trips have been considerably shorter/have involved fewer cities, so I just use [my normal camera bag]( http://www.amazon.com/gp/product/B004C50VTE?ie=UTF8&amp;ref=aw_bottom_links&amp;force-full-site=1), which is also awesome. 

On all of my trip bags/packs, I have keyrings run through the zipper pulls, and I have them clipped together and to the backpack with carabiners for added security. One of the reasons I like the Domke insert and the Kata is that neither one looks like a camera bag. Less risk that way, IMO. ",t3_vumdf,False,travel,0,1429271946,usa,,1,0,1,wildly_curious_1,t1_c580hk6,False,"20 countries, 3 continents",t5_2qh41,0,
True,c580kp0,t3_vura2,1341151744,"Orbea make lovely bikes, they don't sell too much outside of europe because they're all handmade in Spain. I wouldn't worry about them as a brand at all. ",t3_vura2,False,bicycling,0,1429271986,,,1,0,1,[deleted],t1_c580kp0,False,,t5_2qi0s,0,
True,c580mab,t1_c57x48g,1341152084,They are making a statement.  Martin Luther could have just packed up his stuff and left Europe but he wanted to make a point.,t3_vv30b,False,news,0,1429272008,,,6,0,6,equus007,t1_c580mab,False,,t5_2qh3l,0,
True,c580miu,t1_c580eib,1341152134,"&gt; they don't get it, they're just ignorant human beings looking to talk shit on the US. it's the way of life in europe. down syndrome, and being ignorant.

you're just an ignorant human being looking to talk shit on europe. it's the way of life in the US. trigger-happy and fat.",t3_vvhj5,False,technology,0,1435704518,,,-1,0,-1,feeblemuffin,t1_c580miu,False,,t5_2qh16,0,
True,c580mu7,t1_c580itd,1341152201,"I picked up BC2 about a month back, and I never have any hassle finding a server (in Europe anyway, don't know about the US). It's a bloody fun game, and absolutely worth it at that price, I've been playing it nearly every day since I got it. Avoid the single player though, it's rubbish.",t3_vvg1g,False,Games,0,1429272024,,,3,0,3,OutrightVillainy,t1_c580mu7,False,,t5_2qhwp,0,
True,c580ns3,t3_vvfzx,1341152408,I'm sure the European sysadmins have a quite different story to tell.,t3_vvfzx,False,gifs,0,1429272041,,,2,0,2,[deleted],t1_c580ns3,False,,t5_2qt55,0,
True,c580nu0,t3_vvizn,1341152419,"This is probably the feminist group [FEMEN](http://femen.org/) (NSFW). 

Turn up to big event, take top off, fight whoever jumps in to stop them.

Ninja edit: [Here's an interview](http://www.bbc.co.uk/news/world-europe-18447765) with one of them about their planned protests for Euro 2012 (SFW)",t3_vvizn,False,pics,0,1435704510,,,3,0,3,humvee_here,t1_c580nu0,False,,t5_2qh0u,0,
True,c580osh,t3_vvnem,1341152623,firstrowsports.eu,t3_vvnem,1341235818,nfl,0,1429272055,saints,,28,0,28,blueboybob,t1_c580osh,False,Saints,t5_2qmg3,0,
True,c580ouq,t1_c57zlgc,1341152636,"I've been wondering that myself, and I think what's going on is that they may be trying to adjust laws for the 21st century.

*Caveat: massive amount of baseless speculation follows. I'm probably talking out of my ass but that's never stopped me before...*

Historically you had to go into a country's territory to commit a crime. If you could flee across the border, you were safe. To combat this, they came up with the concept of extradition. ""Hey, if you return accused criminals to us, we'll do the same for you."" And that worked well for a long time. Without that concept, any border town would be crazy-dangerous to live in since crooks would know they just needed to dash across the border and they could flaunt their crimes.

But in the 21st century you don't have to be physically present in order to commit a crime. If you're in country X and break into a bank's servers in country Y, it makes sense that country Y will try to extradite. Otherwise it's just anarchy: as the world gets increasingly computerized, you could engage in lucrative crime with absolute impunity.

Now, *I'm not defending US intellectual property laws or the prosecution of Mr. O'Dwyer in this post*, but I can certainly see him falling into this category of being accused of committing a crime against US assets via foreign computer.

Without speaking to O'Dwyer's case specifically, I actually hope that the international extradition agreements in this realm get much much tougher. I like the idea of someone who breaks into my Paypal/bank/credit card/whatever account being picked up by his local authorities to face prosecution even though his crime wasn't against a server inside his own country. It's a new world of technology and we need our laws to reflect that.

Because this case is likely bullshit, it's easy to get outraged and just rage against the entire concept of extradition for computer crimes. But I think the concept is not only valid, it should be strengthened. There's also longstanding case law that a nation will refuse to extradite for something that they deem should be legal. So what the petition should be about is to encourage the UK and EU not to extradite for copyright infringement, while still agreeing to extradite for other intellectual property crimes like identity theft, password theft, etc.",t3_vvhj5,1341153030,technology,0,1435704508,,,26,0,26,acog,t1_c580ouq,False,,t5_2qh16,0,
True,c580p2f,t1_c580e6n,1341152679,"Can't have a Reddit post with praise for Europe without a cheap, retarded jab against the US as well. 

1) Praise Europe

2) Bash US

3) ????

4) Profit!

The fact that your post got upvoted is all the proof anyone needs to see that Reddit is crippled by idiotic, gratuitous US-bashing. Any post that belittles the US gets upvoted, no matter how irrelevant and uncalled for.",t3_vvjye,1341153770,AdviceAnimals,0,1429272059,,,-11,0,-11,hivemind6,t1_c580p2f,False,,t5_2s7tt,0,
True,c580p96,t1_c57yng4,1341152717,"A well-written response ... Although you're not accounting for the fact that things ARE different now.  We now incarcerate more than [1 in 100 people](http://en.wikipedia.org/wiki/Incarceration_in_the_United_States#Prison_population).  [We're 25th in math](http://www.usatoday.com/news/education/2010-12-07-us-students-international-ranking_N.htm), and the [dropout rate is increasing](http://www.washingtonpost.com/local/education/us-falls-in-global-ranking-of-young-adults-who-finish-college/2011/08/22/gIQAAsU3OK_story.html).  I'm not about to slide into Jeff Daniels' rant from ""The Newsroom"" about why ""America is not the greatest country in the world, but it can be"" -- I feel I have to say that there are attributes of this society and this generation that we've truly never seen before.  

Our egos and personal spaces have grown exponentially, and now something as innocent as paying a woman a compliment can be construed as 'creepy'.  My Dad, an Eastern European, tells a story about coming back from visiting us in the US.  He doesn't speak English, but knows ""thank you"" and ""excuse me"".  A female flight attendant had her back turned to him as he was going up the hallway, so to get past her in the narrow hallway of the airplane he said ""eks-kooze me"", smiled, and gently tapped her on shoulders with both hands.  She fucking FLIPPED, ""DON'T TOUCH ME YOU HEAR???? DON'T TOUCH ME!!!""  I was sitting right there, going WTF.  The look of genuine confusion and semi-terror on my father's face was amplified by his lack of language skill, and I had to jump in to diffuse the situation.  Between this incident, and some lady yelling at us at the beach to put swim trunks on our toddler ON TOP of his swim diaper, let's just say my parents had their idealized version of America pretty much shattered.

So yes, you have a point when you say that there were dicks in every generation, but you can't ignore that when it comes to many key societal attributes involving education, ethics, morality, we're in uncharted waters.",t3_vvaec,False,AskReddit,0,1429272063,,,1,0,1,mogifax,t1_c580p96,False,,t5_2qh1i,0,
True,c580pez,t3_vvjye,1341152750,"I live in Europe and would have probably slept it through, but I pulled an all-nighter to restore my sleeping circle. I saw Reddit burning in flames before my eyes.",t3_vvjye,False,AdviceAnimals,0,1435704508,,,2,0,2,Major_Butthurt,t1_c580pez,False,,t5_2s7tt,0,
