author,subreddit_id,id,score,gilded,link_id,controversiality,edited,body,distinguished,created_utc,retrieved_on,subreddit,ups,downs,name,parent_id,archived,score_hidden,author_flair_css_class,author_flair_text,removal_reason
beard-maketh-the-man,t5_2qhqb,c4ip2ka,5,0,t3_szr1d,0,False,"Indeed there is:

The recent debate over copyright laws like SOPA in the United States and the ACTA agreement in Europe has been very emotional. And I think some dispassionate, quantitative reasoning could really bring a great deal to the debate. I'd therefore like to propose that we employ, we enlist, the cutting edge field of copyright math whenever we approach this subject.

For instance, just recently the Motion Picture Association revealed that our economy loses 58 billion dollars a year to copyright theft. Now rather than just argue about this number, a copyright mathematician will analyze it and he'll soon discover that this money could stretch from this auditorium all the way across Ocean Boulevard to the Westin, and then to Mars ... (Laughter) ... if we use pennies.

Now this is obviously a powerful, some might say dangerously powerful, insight. But it's also a morally important one. Because this isn't just the hypothetical retail value of some pirated movies that we're talking about, but this is actual economic losses. This is the equivalent to the entire American corn crop failing along with all of our fruit crops, as well as wheat, tobacco, rice, sorghum -- whatever sorghum is -- losing sorghum.

But identifying the actual losses to the economy is almost impossible to do unless we use copyright math. Now music revenues are down by about eight billion dollars a year since Napster first came on the scene. So that's a chunk of what we're looking for. But total movie revenues across theaters, home video and pay-per-view are up. And TV, satellite and cable revenues are way up. Other content markets like book publishing and radio are also up. So this small missing chunk here is puzzling.

(Laughter)

(Applause)

Since the big content markets have grown in line with historic norms, it's not additional growth that piracy has prevented, but copyright math tells us it must therefore be foregone growth in a market that has no historic norms -- one that didn't exist in the 90's. What we're looking at here is the insidious cost of ringtone piracy. (Laughter) 50 billion dollars of it a year, which is enough, at 30 seconds a ringtone, that could stretch from here to Neanderthal times. (Laughter) It's true. (Applause) I have Excel.

(Laughter)

The movie folks also tell us that our economy loses over 370,000 jobs to content theft, which is quite a lot when you consider that, back in '98, the Bureau of Labor Statistics indicated that the motion picture and video industries were employing 270,000 people. Other data has the music industry at about 45,000 people. And so the job losses that came with the Internet and all that content theft, have therefore left us with negative employment in our content industries. And this is just one of the many mind-blowing statistics that copyright mathematicians have to deal with every day. And some people think that string theory is tough.

(Laughter)

Now this is a key number from the copyright mathematicians' toolkit. It's the precise amount of harm that comes to media companies whenever a single copyrighted song or movie gets pirated. Hollywood and Congress derived this number mathematically back when they last sat down to improve copyright damages and made this law. Some people think this number's a little bit large, but copyright mathematicians who are media lobby experts are merely surprised that it doesn't get compounded for inflation every year.

Now when this law first passed, the world's hottest MP3 player could hold just 10 songs. And it was a big Christmas hit. Because what little hoodlum wouldn't want a million and a half bucks-worth of stolen goods in his pocket.

(Laughter)

(Applause)

These days an iPod Classic can hold 40,000 songs, which is to say eight billion dollars-worth of stolen media. (Applause) Or about 75,000 jobs.

(Laughter)

(Applause)

Now you might find copyright math strange, but that's because it's a field that's best left to experts. So that's it for now. I hope you'll join me next time when I will be making an equally scientific and fact-based inquiry into the cost of alien music piracy to he American economy.

Thank you very much.

(Applause)

Thank you.

(Applause)",,1335867826,1428832612,unitedkingdom,5,0,t1_c4ip2ka,t1_c4ip0p9,True,False,eng-yorkshire,Yorkshire,
mainsworth,t5_2qh0u,c4ip2w0,-8,0,t3_t0tnw,0,False,"The backwards, science-hating Americans spend 3 times as much on their space program as us forward-thinking, science-loving Europeans.

I'd say they're doing alright for themselves.",,1335867955,1428832615,pics,-8,0,t1_c4ip2w0,t1_c4ioz1b,True,False,,,
10b-5,t5_2qhu2,c4ip4ve,9,0,t3_t0zmq,0,False,"When I first moved to America from Europe, the one thing that struck me was that Americans never displayed the hatred and jealously towards the people that had more than them, that was really rampant in Europe...

Seems like for some reason, America has caught up to this.",,1335868678,1435718157,nyc,9,0,t1_c4ip4ve,t3_t0zmq,True,False,,Midtown,
[deleted],t5_2qh3l,c4ip5cp,2,0,t3_t0ukd,0,False,Nice try. What part of Eastern Europe are you from? I'm guessing Estonia. ,,1335868856,1428832648,news,2,0,t1_c4ip5cp,t1_c4inm5t,True,False,,,
mainsworth,t5_2qh0u,c4ip6cb,-3,0,t3_t0tnw,0,False,You're right. America is a technological and scientific desert compared to the EU. Bastion of progressive thought and warm inclusion. ,,1335869221,1428832668,pics,-3,0,t1_c4ip6cb,t1_c4ip44o,True,False,,,
glhflololo,t5_2qh0u,c4ip6sn,1,0,t3_t0tnw,0,False,"We, Europeans, have a lot to learn. Do you have any idea how much cheaper it is to rent a vehicle to move in the US? And even with the lower fuel efficiency in the US, paying for gas to move is still going to be cheaper since gas prices here are 2-2.5x more expensive per liter. And then the price of houses and cost of living in general... I can tell you that living in the US would be so much cheaper (for me, anyway) overall.",,1335869377,1428832670,pics,1,0,t1_c4ip6sn,t1_c4iosox,True,False,,,
papajohn56,t5_2qh0u,c4ip6wd,2,0,t3_t0tnw,0,False,"Funny, it costs the same to fill some little 4 cylinder in europe.  ",,1335869412,1428832671,pics,2,0,t1_c4ip6wd,t1_c4io43d,True,False,,,
arachnophilia,t5_2qh7i,c4ip7f4,1,0,t3_syh27,0,False,"it was incredibly hard to track down, when i bought it about 10 years ago. there's like one pressing, from somewhere in the EU.",,1335869590,1428832679,vinyl,1,0,t1_c4ip7f4,t1_c4ifbs3,True,False,,Technics,
LRonPaul2012,t5_2cneq,c4ip83n,0,0,t3_t0r10,0,True,"Debating you is like debating a creationist who refuses to acknowledge any fossil evidence on the origins of life because it doesn't fit in with his view of how life is supposed to be.  You want to believe that money needs intrinsic value the way a Creationist needs to believe that God created man in his own image, and man has always existed in his current form.  You might now like the idea that all money arose from debt and credit systems and politics, just like a creationist doesn't want to accept that man arose from primordial ooze.  Sadly, your want does not override reality.  Once again, David Graeber:

&gt; If someone makes an inadequate return you will merely mock him as a cheapskate. If you do so when he is drunk and he responds by poking your eye out, you are much more likely to demand exact compensation. And that is, again, exactly what we find. Anthropology is full of examples of societies without markets or money, but with elaborate systems of penalties for various forms of injuries or slights. And it is when someone has killed your brother, or severed your finger, that one is most likely to stickle, and say, “The law says 27 heifers of the finest quality and if they’re not of the finest quality, this means war!” It’s also the situation where there is most likely to be a need to establish proportional values: if the culprit does not have heifers, but wishes to substitute silver plates, the victim is very likely to insist that the equivalent be exact. (There is a reason the word ‘pay’ comes from a root that means ‘to pacify’.)

&gt; Again, unlike the economists’ version, this is not hypothetical. This is a description of what actually happens—and not only in the ethnographic record, but the historical one as well. The numismatist Phillip Grierson long ago pointed to the existence of such elaborate systems of equivalents in the Barbarian Law Codes of early Medieval Europe. [7]For example, Welsh and Irish codes contain extremely detailed price schedules where in the Welsh case, the exact value of every object likely to be found in someone’s house were worked out in painstaking detail, from cooking utensils to floorboards—despite the fact that there appear to have been, at the time, no markets where any such items could be bought and sold. The pricing system existed solely for the payment of damages and compensation—partly material, but particularly for insults to people’s honor, since the precise value of each man’s personal dignity could also be precisely quantified in monetary terms. One can’t help but wonder how classical economic theory would account for such a situation. Did the ancient Welsh and Irish invent money through barter at some point in the distant past, and then, having invented it, kept the money, but stopped buying and selling things to one another entirely?

When all parties are in peaceful agreement, they have no need for money, because they value social relationships over personal gain.  The only time you need money is to resolve a conflict or dispute between parties who are unable to resolve the dispute on their own, in other words, a legal system.  And all legal systems are inherently political.",,1335869832,1428832686,politics,0,0,t1_c4ip83n,t1_c4iorfy,True,False,,,
Btk89,t5_2rfxx,c4ip8ev,1,0,t3_t0x6o,0,False,i have pax jax code that will still work on eu servers only been used on NA,,1335869947,1428832689,leagueoflegends,1,0,t1_c4ip8ev,t3_t0x6o,True,False,renekton,,
sje46,t5_2qh0u,c4ip8nb,1,0,t3_t0tnw,0,False,"I don't know where you live, but I actually kinda doubt that.  From what I understand, the US really is spread out.  Not all parts, of course.  Maybe not most of it.  But for large parts of it, certainly  Of course it's not coast to coast, but within towns they're not as cramp as Europe.  I grew up in a town of 4000 people which is 3/4 the size of Manhattan Island (pop. 1.5 million), but in total had a total of 2 corner stores and not a single traffic light.  It would have taken me around an hour to walk to the closest one, and that was in my same neighborhood.  For people in the more remote parts of town, it would have taken them more like 3 hours.

There are plenty of places like that in America...and plenty of places where my town would be considered positively urban.",,1335870028,1428832691,pics,1,0,t1_c4ip8nb,t1_c4ip12u,True,False,,,
StupidQuestioner,t5_2qh68,c4ip95h,1,0,t3_sztu7,0,False,"People say the same time about space programs.  Why spend money on space when there are so many things here on Earth that needs attention.  While I do agree that many of these do-gooders are clueless and are primarily motivated by how cool it will look on facebook, it does broaden their horizons.  When you go out to these projects, you are going off the ""touristy"" beaten path, and that give them a chance to see the world for the way it is.  For many it might just end as a cool profile picture, but for a few it might change them, making them more dedicated to understanding and making a difference.   One of the problem I see with Americans is that they don't travel, even when they travel, it is to resorts that ensures that they never leave their comfort zones.   Maybe the reason that Europeans and Canadians are different is because more of us tend to travel and explore strange new places.  ",,1335870195,1428832697,canada,1,0,t1_c4ip95h,t1_c4iitc3,True,False,,,
Btk89,t5_2rfxx,c4ipa5i,1,0,t3_t0x6o,0,False,i dont have a eu account hence not using the skin lol,,1335870547,1428832711,leagueoflegends,1,0,t1_c4ipa5i,t3_t0x6o,True,False,renekton,,
Malusbaolt,t5_2qi58,c4ipaal,1,0,t3_t0f9z,0,False,"Ah, us, stupideuropeans...",,1335870591,1428832713,soccer,1,0,t1_c4ipaal,t3_t0f9z,True,False,,,
XasbestosX,t5_2qh13,c4ipai3,0,0,t3_t0htv,0,False,"Maybe you don't understand what the Protocols of the Elders of Zion was. It was book written anonymously (originating in Russia i think) implying that the jews were planning world domination and attempting to establish a jewish hierarchy over europe. This book caused massive amounts of anti-sematism and race-hate and claimed to be an ACTUAL transcript. The Previous poster goes on to imply that the jewish state was formed by an organised movement of terrorism in order to enforce a submission of western powers.

I'm confused why taking land is such an issue. Every nation is born out of the ashes of a previous land. America grew out of the ashes of the great plain indians, the saxons and franks expelled the celtic tribes inhabiting the area and the Arabs expelled the phenocenian people previously occupying Isreal.",,1335870660,1428832716,worldnews,0,0,t1_c4ipai3,t1_c4ioqs1,True,False,,,
GeoAtreides,t5_2qm35,c4ipb14,3,0,t3_t04at,0,False,"Eu am incercat sa fiu prietenul tau, dar mi-ai zis ca nu seaman destul cu tatal tau, si m-ai respins. 

De atunci n-am mai iubit pe nimeni. Noroc cu chatul astora din Timisoara, sunt ca methadona pentru heroina mea. ",,1335870833,1428832729,Romania,3,0,t1_c4ipb14,t1_c4ih148,True,False,,,
rtaibah,t5_2qi58,c4ipc6t,5,0,t3_t19w1,0,True,"Every country basically have the following competitions:

1-League: every team plays every other team once at home and once away with a grand total of (2n-2 where n is the number of teams in the league.) A win gives a team 3points, a draw 1 point, a loss you get nothing. The team with most points win. The teams with the least points (usually 3-4) get relegated, and the top from the lower league gets promoted.

2-Cup: Knockout competition usually with a home-away format. Teams from the top flight and lower tiers participate. Kinda like March Madness.

3-Super Cup: the winner of the league plays the winner of the cup at the end of the season. If a team wins both the league and the cup, then I think that team plays the second in the league.

International competitions:

1-Champions League: the top teams of each European country compete for the ultimate prize. An intricate coefficient system is set in place that dictate the number of teams that can participate from each country. Its too complicated, but what you need to know is that Germany, England, and Spain have 4 spots, Italy 3. Lesser leagues don't even have automatic spots, and have to battle it out with other teams in a playoff that usually starts before local competitions. Once the 32 teams are known after the playoffs, the team are put in 8 groups of 4 and battle it out in a hone-away system. The top 2 teams from each group qualify, the 3rd goes to Europa League (see 2.) Now we have 16 teams who continue on to a home-away knockout stage. Note that the winner of each group get home field advantage by having the second game at home (can massively tip the scale) The final venue is always pre chosen and is only one game (not home and away.)

2- Europa League: The same coefficients system used in CL dictates who gets into the EL. Generally its lesser teams in each local league (5th &amp; 6th in Spain, England, and Germany for example.) Teams here play in a mixture of groups and knockout stages. EL is considered less prestigious than CL.

3-Super Cup: Winner from CL &amp; EL battle it out in one game before the beginning of the next season.(Meh)

4-World Club Cup: continental winners gather in Japan and compete for a cup. (Meh)

Thats it I  think. Anything else guys?

Edit:grammer &amp; spelling
",,1335871225,1428832739,soccer,5,0,t1_c4ipc6t,t3_t19w1,True,False,17,Juventus,
wievid,t5_2qstm,c4ipcqg,2,0,t3_t1bqc,0,False,"It depends on where you'll be in Europe. There are a number of different banking groups all around Europe. Since you say you'll be dealing with different currencies, I'm going to go out on a limb and say you'll be traveling through CEE a lot. To that end, you might look at Raiffeisen. They have a large network in CEE with a number of subsidiaries (Zuno is one of these and is in Slovakia and Czech Republic and likely other locations in CEE). 

At the end of the day you'll likely want to deal with some kind of Internet-only bank. I imagine you'll also want to set up some kind of post office box somewhere if you have a hub of some kind. 

Perhaps you might look into running two separate accounts? Set up one with a bank more designed for personal investment that lets you do a lot over the net and then another standard account for your day-to-day business.",,1335871406,1428832745,personalfinance,2,0,t1_c4ipcqg,t3_t1bqc,True,False,,,
theyllknow,t5_2qh1i,c4ipdn8,35,0,t3_t0ynr,0,False,"So much it's not even funny. I cannot bare to watch it now.

My sister and my best friend know, and I know there are rumours around town about me but I could care less.

I was 20 and spilt with my BF, dropped out of school and started working in a cocktail bar. One of our regulars owned a brothel (legal in my town) and was very wealthy and sophisticated. So were the whores he'd bring in. We, the bar staff, would go drink at the brothel's bar with him and various workers and clients at 3am when we knocked off and nothing else was open. It was all in-clubby and cool and I felt accepted and slightly naughty.

After two years of making friends and having a ball my best mate and I decided to go OS together and start saving to do so. He had $30k saved as the date was looming, and I didn't. T he pimp gave me the option to quickly make up the cash before I went so I didn't miss out/disappoint my friends etc etc

So young and so dumb.

After I'd been at the brothel about a month 'their highest paying regular' phoned. Apparently they were saving me for him. So yes, I went in knowing that he used whores. You wont believe me, but the truth from him and the whores and the madam and the pimp, was that he was a 'talker'. They're rare, but they exist. He would call girls for his mates and for parties, and even himself, but he never fucked them. I did my own digging and found this to be the case. So yes, Mr Prince Charming.

I saw him about 3 times while I was working, on the first night I knew there was something there. We exchanged numbers and my real name and the second date we made serious plans.

We ended up travelling to Europe together twice, buying a house, starting a a business and being in every facet of each others lives. I cannot stress how normal our relationship was and how far away it was from  where we were when we met.

He comes from a very poor background a suffered abuse (horrific, horrific abuse) as a child and we bonded over that. He has worked his arse of to get where he is and is so generous and helpful to people in need it is no surprise to me we ended up together. But last week he told me he didn't wanted kids...and here we are.",,1335871691,1428832757,AskReddit,35,0,t1_c4ipdn8,t1_c4ip6f2,True,False,,,
JonnyBhoy,t5_2qi58,c4ipem5,1,0,t3_t19w1,0,False,"There are no playoffs as such

The teams who finish at the top of their respective leagues win the league and are champions. They also qualify to play in European competitions through finishing high in their league, which run in parallel with the following season's Domestic games. So for example, Man Utd will qualify to play in the Champions League by finishing in the top two this season, so next season they will play in that tournament as well as all the English tournaments they currently play in (European competitions take place mid-week with domestic league games usually on the weekend)

There are two European competitions, The Champions League for the best placed finishers and the Europa League for the next group of higher placed finishers. The amount of teams each league can put into these tournaments depends on how strong the leagues are, so for example the strongest leagues like England and Spain can potentially have four teams each in the Champions League, whereas weaker leagues like the Scottish league, where my team Celtic play, have only one or two who can qualify for the Champions League. The ranking of the league depends largely on that country's standing in world football (a points system based on clubs euro performances over a rolling 5 year period)

There are sometimes qualifying games for these tournaments, so for example 1st and 2nd in England might go straight into the competition, the third placed team might have one qualifying tie against another team from a different league and the 4th placed team might have two qualifying ties.

This all sound ridiculously complicated, but it's not actually all that hard in practice. As for knowing what the big games are, it takes a bit of understanding of the different leagues.

Some games are generically big, so the Champions League final will always be a big game, no matter who is playing and you can find out the date of that months in advance. The UEFA website might be a good place for European competitions. 

last night's game and the recent Barca vs Real game were especially big because of how the teams were placed in the league, so keeping an eye on domestic tables is useful. These games are often only scheduled nearer the time. Then you have other games that are not in big leagues, but are big games. For example Celtic vs Rangers was on Saturday, not the best league in the world but a very famous game because of the rivalry of both teams.

tl/dr - no playoffs. european competitions depend on where you finish in the league. I also agree that listening to some podcasts, like the Guardian Football Weekly podcast is a god way to keep up with world football. They do two a week so it keeps you nice and up to date.",,1335871995,1428832769,soccer,1,0,t1_c4ipem5,t3_t19w1,True,False,18,Celtic,
danman11,t5_2qh0u,c4ipf1o,-2,0,t3_t0tnw,0,True,Do trailers not exist in Europe?,,1335872144,1428832775,pics,-2,0,t1_c4ipf1o,t1_c4iojcx,True,False,,,
Aspid92,t5_2re6a,c4ipf1r,2,0,t3_t14st,0,False,"I have a friend who use Nasus who I'm sure would like it, we are in EU west. PM if you didn't gve it away yet.

(I've PM this mesage because I read it later)",,1335872145,1428832775,Favors,2,0,t1_c4ipf1r,t3_t14st,True,False,,,
Sarge-Pepper,t5_2cneq,c4ipfjs,0,0,t3_szswf,0,False,"I'm specifically stating the rules about slavery that god put down. Slavery back then wasn't the capture people system that we think of today in reference to the blacks or even European slavery.

It was a barter type of system, where and man could pay off his debts by serving, he could ensure the livelihood of his daughter by giving her to a rich family, or a prisoner of war would be used to make public works. The old system was filled with abuse, and since it was the accepted way, the lord set down rules to make it better on the slave.

Even the slaves had it good, they were considered part of the family many times. They lived in the house, were taken care of by the master, in fact, abusing your slave was seen as a foul act in society.

There was even and instance in the bible where Paul grew close as a friend to his slave, and almost called him a brother in Christ. He stopped because he was aware that to give that status to a slave might label Christians as radical and put alot of Christian in danger.

Nobody agrees on weather this was the right move or not, but Paul was just a man. He made mistakes too.",,1335872310,1435718156,politics,0,0,t1_c4ipfjs,t1_c4imq9e,True,False,,,
anticapitalist,t5_2qxt5,c4ipg3n,2,0,t3_t19be,0,True,"Abortions, ideally, should be done before the brain starts to form.  In other words, ASAP.  If our society was serious about this, like by giving 
out 
free pregnancy 
tests &amp; funding free early abortions, then it could be done.    


Only a truly creepy 
person could 
consider 
3rd-term abortions, without 
a physical medical 
reason, completely fine.  

These people (late term abortion advocates) make the left 
look immoral to the 
point of silliness.  
Generally, even Europeans don't allow chicks to get a 3rd term abortion without medical reasons:  

 - ""Although nearly every European country makes abortion available on demand during the first trimester, when it comes to later-term abortions, there are very few with laws as liberal as those of the United States.[17] ""  

  -- wiki   


",,1335872475,1428832794,Liberal,2,0,t1_c4ipg3n,t3_t19be,True,False,,,
Antares42,t5_2qqjc,c4ipg4k,2,0,t3_t1e6t,0,False,"I mean, I knew about Dönitz being Hitler's successor for the week between his suicide and the end of the war in Europe, but I didn't know that the British forces left them in power for two full weeks after that.",,1335872484,1428832794,todayilearned,2,0,t1_c4ipg4k,t3_t1e6t,True,False,,,
JustDADE,t5_2rfxx,c4ipg7e,0,0,t3_t1dqk,0,False,Not for EU :/,,1335872511,1428832801,leagueoflegends,0,0,t1_c4ipg7e,t3_t1dqk,True,False,udyr,,
coffeeaddictedjunkie,t5_2qm35,c4ipgah,2,0,t3_t09xu,0,False,eu am gasit doar ca se cheama cevapcici http://simple.wikipedia.org/wiki/%C4%86evap%C4%8Di%C4%87i si sfaraie biiiiiiiiiiiineeeeee. doar ca ploua acum :(,,1335872541,1428832794,Romania,2,0,t1_c4ipgah,t3_t09xu,True,False,,,
