archived,id,parent_id,created_utc,body,link_id,edited,subreddit,gilded,retrieved_on,author_flair_css_class,distinguished,score,controversiality,ups,author,name,score_hidden,author_flair_text,subreddit_id,downs,removal_reason
True,c57v3l9,t3_vsp73,1341100865,I'm curious as to what happened to the stock.  I found out the new price of the company yesterday and was so surprised.  Low EU earnings cost the share ~$5?  That just seems crazy to me.  Ford is still the strongest American car company out there for the foreseeable future.,t3_vsp73,False,finance,0,1429269342,,,1,0,1,PowerTaxRelief,t1_c57v3l9,False,,t5_2qhfj,0,
True,c57v3lr,t1_c57njyw,1341100867,"I got into a ridiculous argument with my History teacher in HS over this movie because he thought it was necessary to tell everyone the movie was stupid because the only ""true"" thing that happened in that movie were the first 15 minutes, and the rest was all BS. I countered his argument by stating that, granted the rest of the movie was a dramatized story and wasn't historically accurate, but there were tons of stories *like* that throughout the European campaign. It was truly one of the best ways to summarize the early part of the invasion with out diluting it with historical figures casted by the Hollywood elite. (His argument was that the movie The Longest Day was better.) Up until that point World War II movies were always featuring galant scores and great acts of heroism. Saving Private Ryan had the honesty of a post-vietnam era war movie with the complex characters that felt like they were plucked right from history and thrown into a movie, and not the other way around. ",t3_vu4w1,False,AskReddit,0,1429269342,,,1,0,1,Jon_Fuckin_Snow,t1_c57v3lr,False,,t5_2qh1i,0,
True,c57v43i,t1_c57uzea,1341101013,"Probably not, but I'm sure there are groups for women, for blacks, for asians, for americans, for europeans, etc. People like to form groups, it's just part of human nature.

And it must be nice to play with people who aren't going to use ""faggot"", ""gay"", etc. as insults.",t3_vutou,False,gaming,0,1429269346,,,1,0,1,adawdsdaw,t1_c57v43i,False,,t5_2qh03,0,
True,c57v4cy,t1_c57sbpo,1341101104,"See, I don't know if that's exactly right. While those countries aren't very religious, I'm not sure you could say they're atheist either. Most people generally don't care about religion in those countries, so the need for atheism is mostly gone. Some polls also show that a majority of people in those countries believe in a spirit or life force [like this poll of Europeans in 2005.](http://en.wikipedia.org/wiki/Religion_in_Europe)

Other polls, which give people a range of options instead of a binary ""Do you believe in God? yes/no"" show that the only place that could be considered majority atheist is the former GDR, like you said. These polls have options like ""I believe in God and have no doubts about it"", ""I have doubts, but do believe in God."", ""I don't believe in God, but do believe in a higher spiritual power."", ""I'm not sure if God exists and there is no way to find out."", as well as ""I don't believe in God"" or ""No god exists.""",t3_vueqc,False,Christianity,0,1429269351,,,2,0,2,inyouraeroplane,t1_c57v4cy,False,,t5_2qh6c,0,
True,c57v6z8,t1_c57v4or,1341102152,"used on eu-w :(
thx anyway !",t3_vuvea,False,leagueoflegends,0,1429269384,11 team,,1,0,1,Mattouf,t1_c57v6z8,False,,t5_2rfxx,0,
True,c57v8lk,t1_c57uo10,1341102941,"Some stuff is just a rubber band effect I imagine.

Racism was (is depending on where you are and who you ask) is a real problem, so in response I feel they went too far the other way (keep in mind, the civil rights movement was only 50 years ago). They wanted to over compensate for negative racism through celebration of differences. Hopefully it dampens out. 

Some people feel you can never truly ""ignore your eyes"" so to speak, and therefore we have to have things to celebrate differing cultures (at this point, I would largely classify ""black"" American culture as differing greatly from ""white"" middle class American culture. It has its own subset of language, foods, and family rituals) to deflate negative feelings. I don't hold to this, but I'll be curious if Europe ends up going through race troubles if immigrants end up mostly assimilating, or if they can ""ignore their eyes"". ",t3_vtx8k,False,videos,0,1429269406,,,2,0,2,I_Should_Study,t1_c57v8lk,False,,t5_2qh1e,0,
True,c57v8vh,t3_vuvcw,1341103084,"When I was level 10, BF Sword costed 1850
When I was level 10, my friends said only play Garen, you will be the tank.
When I was level 10, servers were stabil.
When I was level 10, there was no EUW and EUNE only EU and everybody hated the french and the russian guys.
When I was level 10, Hextech stacked.",t3_vuvcw,False,leagueoflegends,0,1429269409,,,1,0,1,highithink,t1_c57v8vh,False,,t5_2rfxx,0,
True,c57v905,t1_c57tm4m,1341103141,"I don't think this has anything to do with culture but more with tradition. As tradition deals with beliefs, then what you're referring to is a Japanese tradition, not culture. Loyalty is not a culture, but a tradition.

Loyalty was great in the 60's - 80's when the economy was booming and the people's long hours were paying off. Families were rewarded with great prosperity. However, those long hours took a toll on Japanese families and created the present familial culture: wife stays home and focuses all her energy on the children while the husband puts all his energy into work to provide for them. You now have a group of amai people who no longer want to work full-time and a growing number who don't even want to get married. It's also created a rise in divorce amongst the retired generation as women who never saw their husbands are suddenly faced with having to spend an entire day with them. Japanese culture is changing, but the traditions aren't which is leading to problems.

Japanese business traditions have taken their toll on the country. Suicide rates have escalated as well as mental health and stress related diseases. Lifetime employment is no longer the norm, high salaries aren't the norm and companies are faced with trying compete against an increasing pool of global competition. Doing the same thing over and over expecting better results isn't tradition, it's insanity.

Japanese economy has been stagnant for almost 20 years and is quickly getting passed by China and possibly India. The population is aging faster than it is being replaced. The fact that they have [a clock](http://mega.econ.tohoku.ac.jp/Children/) that basically counts down the days until the culture because extinct would tell anyone that something has to change. Strenuous work circumstances may have helped the country for the first 20 - 30 years, but it no longer seems to be working for Japan. 

It has nothing to do with whether or not they're better off than China or the US, and everything to do with whether or not they are doing what it takes to adequately care for their own people. I love living in this country and it would be devastating to see it go the way of the US or Europe for the sheer fact that people in charge stubbornly cling to traditions that no longer serve their purpose and the rest of the population can do no more than say,""shoganai."" Cultural or not, something's got to give and maybe this case, however small, is the first step.",t3_vu5z0,False,worldnews,0,1429269412,,,3,0,3,Keeperofthesecrets,t1_c57v905,False,,t5_2qh13,0,
True,c57v91z,t3_vuebe,1341103160,"Okay, I actually just took a trip to Kenya with a 12 hour layover in Amsterdam, and this is what you should do: 
Take the train, then, once in the city, find the red light district. It is seriously cool. I have never seen anything remotely similar. Have sex with a guaranteed clean prostitute. If you are interested, also go see the lesser known blue light district. 
The coffeeshops are a must. I went to Barney's and Abraxas. Barney's SUCKED. We had just gotten off of the plane, so no lighter, and they charged us 3 euros for one. Anyway, we bought a gram for 16 bucks, then they had no pieces to smoke out of. Bring your own cheap dollar store type pipe if you cannot roll (like myself). Plus if you are mediocre, the europeans laugh at you. They never visited the table, not even once. Also, NO PICTURES ALLOWED. (Which you would think they would post somewhere considering the tourist traffic there.) We got yelled at by the owner.
Abraxas was AMAZING. I bought three pre rolled joints, and a hot chocolate (which I did not know had weed in it). I went upstairs and chilled for about an hour. Someone checked my table every fifteen minutes to see if I needed anything. Then on my way out I bought 2 space cakes and was on my way.
I did the canal tour, skip it. Boring as fuck. Hit up the Anne Frank house instead. Something I wish I would have done. 
Get a bike, and ride everywhere. Don't forget how cold it will be there. I was wearing shorts (on a trip from Florida to Kenya) and I froze my ass off at the beginning of May. It was 50F outside. 

PM me if you want to know any other experiences I had, because there are plenty more, I don't feel like typing out.",t3_vuebe,False,travel,0,1429269412,,,1,0,1,TheScarlettPimpernel,t1_c57v91z,False,,t5_2qh41,0,
True,c57v9uc,t1_c57usjg,1341110410,"&gt;And with the European Union, they have made so that tax is about the same in all countries.

The VAT rate in the EU varies from between 15% and 27%, which is a 12% variance.  In the US, sales tax varies from 0% to 13%, so the variance is only slightly larger than the EU.

But more importantly, in the EU, VAT varies only by country (correct me if I'm wrong about that), whereas sales tax in the US is generally a combination of state and local taxes, so there are about as many different tax rates as there are *cities* in the US.

But in the end, I think this all comes down to tradition.  US culture is such that we tend to want to know exactly how much we're being taxed by the government.  This is made more obvious by having sales tax listed separately from prices.",t3_vugmq,False,explainlikeimfive,0,1429269422,,,5,0,5,AnteChronos,t1_c57v9uc,False,,t5_2sokd,0,
True,c57vaac,t3_vv25s,1341110539,[Happy Canada Day from Europe](http://www.reddit.com/r/canada/comments/vuvod/happy_canada_day_from_europe/),t3_vv25s,1341155671,metacanada,0,1429269428,Glenn,,5,0,5,barosa,t1_c57vaac,False,Prime Dictator,t5_2sh5g,0,
True,c57vfqv,t3_vv11p,1341111585,Depends..... am I a Jew in Europe or am I safely in America?,t3_vv11p,False,AskReddit,0,1429269499,,,1,0,1,NorbertDupner,t1_c57vfqv,False,,t5_2qh1i,0,
True,c57vga2,t1_c57u3qx,1341111679,"I'd like to have seen a poll on how many people in the country actually understood how AV worked and the pros/cons of it.

Regardless, I think referendums are silly. We essentially hold one for everything every 4 years. If the AV vote is anything to go by, it's basically a way to pass the blame of any doomed to fail decision on to people not qualified to make the decision. 

Hold a referendum on being part of the EU right now and I'm worried that the people would actually vote us out, even though right now it's legislation the only thing trying to save our asses from the Orwellian state we're quickly becoming. We could potentially cause another British recession due to reworking our relationship with the Eurozone.  Not to mention the costs of actually reworking our foreign diplomacy to compensate for the lack of EU membership.

If Cameron actually goes through with this I'll lose all doubt and be sure he's trying to sabotage the country so his party can look good in comparison to the poor bastards who have sweep up the pieces next election.",t3_vut0b,False,unitedkingdom,0,1429269506,eu,,1,0,1,MrBushido2318,t1_c57vga2,False,European Union,t5_2qhqb,0,
True,c57vgrj,t1_c57tda2,1341111760,Neither were the people of Eastern Europe. Britain was the bad guy. Just saying,t3_vue43,False,AskHistorians,0,1429269512,,,-5,0,-5,Woadspin,t1_c57vgrj,False,,t5_2ssp3,0,
True,c57vhk2,t3_vuvod,1341111891,Happy Dominion Day to our European brothers!,t3_vuvod,False,canada,0,1429269523,,,6,0,6,watchman_wen,t1_c57vhk2,False,,t5_2qh68,0,
True,c57vhto,t1_c57pryl,1341111935,"Yeah, seriously. I was baffled when the game didn't want to start up due to the mHz (50/60 pictures in the minute) settings. I checked the settings on the xbox, then on the TV and tried again. Since I couldn't change it ingame (because it wouldn't even boot) I had to google, and found this was the issue. Can't remember if this was on the PAL (european) version only though.

Very strange in deed.",t3_vti6p,False,xbox360,0,1429269527,,,1,0,1,Twinkling82,t1_c57vhto,False,,t5_2qhk2,0,
True,c57vhvo,t1_c57tu34,1341111944,"Do you live in Europe? If not the cost of the flight completely overshadows the cost of living expenses, especially if you go to Prague or somewhere in Eastern Europe. A hostel in Amsterdam might cost you 50 US per night, but you can get the same quality in Prague or Budapest for 10.",t3_vusxk,False,travel,0,1429269528,,,1,0,1,geej,t1_c57vhvo,False,,t5_2qh41,0,
True,c57vic2,t3_vurzi,1341112020,i know this is late but how about asking him about how the native american indians aztecs etc... Died of contagious diseases from the europeans and how quran says Allah made diff tribes so they may know each other,t3_vurzi,False,exmuslim,0,1429269536,twitter,,1,0,1,ONE_deedat,t1_c57vic2,False,Modeximius,t5_2s7k2,0,
True,c57vjdr,t3_vuhe9,1341112188,But... but... the EU matters. :'(,t3_vuhe9,False,StarWars,0,1429269550,18,,2,0,2,Kalvinator20,t1_c57vjdr,False,,t5_2qi4s,0,
True,c57vmhh,t3_vuuzt,1341112668,"I seriously love those pictures. I'm completely envious of you. I saw plenty of boob in Latin America, but they were saggy and certainly not fun to look at. Those sculptures are breathtakingly beautiful. I want another European excursion now. ",t3_vuuzt,False,exmormon,0,1429269589,,,3,0,3,migrantpaper,t1_c57vmhh,False,Apostate,t5_2r0gj,0,
True,c57vnyz,t3_vu1xx,1341112887,"I had one that told me he was falling in love with me...he was absolutely not boyfriend material, so I ended it right then, and he was really sad. I had another that wanted to date me on and off, but I wasn't interested in that...I wanted sex or nothing. Ended that. 

Finally I met a guy that I hooked up with right off the bat because I didn't care about having a relationship and we knew each other from a class...we fell for each other really hard right away. We'd 'crushed' on each other on class (graduate school, sounds funny saying that). We got into a bit of a fling, but he had to move back to Europe in two weeks. We packed as much fun as we could into those two weeks and both cried when he left. That would have turned into something really awesome. ",t3_vu1xx,False,AskWomen,0,1429269608,female,,1,0,1,dogandcatinlove,t1_c57vnyz,False,♀,t5_2rxrw,0,
True,c57vpbp,t1_c57ud81,1341113083,"I think he is meaning me, as a Russian Military official or government decision maker... :D

He's using the WW2 era name ""Köningsberg"", it is known as Kaliningrad for 50 years.

http://en.wikipedia.org/wiki/Kaliningrad

That's the last Russian (USSR) military/navy base after they left DDR, Poland, Lithuania etc.
There is a Naval infantry Brigade and some Navy stuff, AA-missiles, Tank platoon, artillery and elint stuff. And airforce stuff, transport planes, fighters etc.

http://news.bbc.co.uk/2/hi/europe/country_profiles/6177003.stm

&gt;The Russian exclave of Kaliningrad on the Baltic Sea is sandwiched between Poland to the south and Lithuania to the north and east.

&gt;Annexed from Germany in 1945, the territory was a closed military zone throughout the Soviet period.

&gt;In 2008, Russia threatened to deploy short-range missiles there if the United States went ahead with its plan to build controversial missile defence bases in Poland and the Czech Republic.

http://edition.presstv.ir/detail/236496.html

&gt;In Poland, 57 percent of people are against the US deployment; And in the Czech Republic, 67 percent are against the planned missile shields radar base. 
",t3_vtdqg,False,worldnews,0,1429269624,,,2,0,2,[deleted],t1_c57vpbp,False,,t5_2qh13,0,
True,c57vrg8,t3_vv45g,1341113405,"Contrary to popular belief cannabis isnt legal in Jamaica. There have been reports of undercover police selling to oblivious tourists then busting them. I wouldn't travel to a place solely for the purpose of smoke cannabis, as it's illegal pretty much everywhere (Holland included). Travel to a place you're interested in visiting and if you really want smoke weed hit up a bar or club. That being said, Europe has some niiiice cannabis and is relatively plentyful / relaxed / if you do get caught they'd probably accept a bribe.",t3_vv45g,False,trees,0,1429269656,,,1,0,1,Tihkal_forever,t1_c57vrg8,False,,t5_2r9vp,0,
True,c57vrgw,t3_vuzxb,1341113408,"Hey, I can't really help you but your build looks good to me, i'm not very experienced in this whole building pcs thing so I can't really give you a real opinion.

Anyway, I found the same card that you have in another website for 202€ for the overclocked version, I don't think they ship to the whole of Europe though, I think only france and belgium (I don't know where you live), here have a look at it yourself: http://www.cdiscount.com/informatique/cartes-graphiques/sapphire-amd-hd7850-2go-gddr5-oc/f-107670509-112000120g.html

edit: actually I read their FAQ thing and they only ship to France, sorry if you don't live here :p",t3_vuzxb,1341113828,buildapc,0,1429269656,,,1,0,1,1ns4n3p41n,t1_c57vrgw,False,,t5_2rnve,0,
True,c57vrzt,t1_c57lspp,1341113482,"As the server is located in Sydney, Australia, it's not that surprising, Europe is closer to you guys geographically. It will be 50/50 for west coast users and a huge amount better for Australian/Asia players. 

I'm quite happy to setup a server in the US however and I'll see if I can get something up and going for you guys this weekend. ",t3_vty9r,False,roguelikes,0,1429269660,,,1,0,1,phunkti0n,t1_c57vrzt,False,,t5_2rhpi,0,
True,c57vsai,t3_vupk7,1341113524,WIll there be similar thing for us in EU?,t3_vupk7,False,TeraOnline,0,1429269664,l2,,1,0,1,DarkRvR,t1_c57vsai,False,,t5_2s527,0,
True,c57vsz3,t3_vuz5i,1341113618,"If the North Atlantic ocean had been a few degrees warmer from the 10th-15th centuries, causing (ok, some of these are speculative):
* Increased, ongoing contact and trade between north americans and vikings
* Transfer of technology, horses, crops and earlier introduction of european disease to Americas
* European colonization of Americas would probably have failed
* No slave trade from Africa to Americas
* ???",t3_vuz5i,False,AskReddit,0,1429269673,,,1,0,1,carl_888,t1_c57vsz3,False,,t5_2qh1i,0,
True,c57vtmv,t1_c57hmm5,1341113711,"In Russian the bishop piece is called a ""slon"" which is the Russian word for elephant, so I'm not sure that the name change was that early in the history of European chess adoption.",t3_vtfgt,False,AskHistorians,0,1429269681,,,2,0,2,StringLiteral,t1_c57vtmv,False,,t5_2ssp3,0,
True,c57vtua,t3_vv2n4,1341113741,"People have lives and other things to do, but one suggestion I would make is to set a solid practice regiment and stick to it.  There was a thread recently from someone who was datamining EU stats and found that on average masters players took ~1500 games to get there.  People were even discussing that one of the terran heroes, Kas, had won over 1k games last season alone.  I think that kind of dedication to self improvement is what really divides top tier players from the rest of us regardless of natural talent.  

I wish you the best of luck on sticking it through, keep us updated ~&lt;3",t3_vv2n4,False,AllThingsTerran,0,1429269684,icon-rank-platinum,,3,0,3,morphoray,t1_c57vtua,False,,t5_2tfht,0,
True,c57vu8p,t1_c57p05k,1341113801,"When I was little, my Grampa was the same way. For a long time all I knew about military service was that he was in Europe in WWII and he served in an anti-aircraft unit. This one time later on when I was a bit older (maybe 10 or 11), he was REALLY drunk and opened up to me and talked about the war. He showed me this awesome trunk that he had stowed in the basement that was filled with memorabilia from the War; German money, unit patches, and tons and tons of black and white photos. Apparently he had had a camera with him the entire time.  

He told me about his time in England and how we served out a lot of his time in France and showed me some photos of his AA gun emplacement right near the Eiffel Tower and another with it placed on some bridge over the Seine. Pretty cool stuff for a kid.

Fastforward many more years and i had a chance to talk to him again about the war at a wedding (we were both REALLY drunk this time). It took some balls, but after a while I finally asked him if he had seen Saving Private Ryan, as it had come out a year or two before. He got really quiet, the color kind of ran out of his face and he sat back in his chair. After a moment or two, he leaned back in to me and said that he had went to go see it with one of my uncles and that a few minutes into that opening beach landing scene, he got up and without saying a word, walked out. He said he walked out to the lobby of the theater looking for a chair or something to rest on. When he rounded the corner to the lobby, he spotted an elderly gentleman sitting all alone on chair by some video games. They locked eyes and both immediately knew why they were there. My grandfather walked over, grabbed the chair next to this stranger, and they cried. God damn. 

He passed away a few years after that, outliving his wife of 50 years and two of his sons, one being my father. Truly an amazing man and I miss and envy him, very much.

**TL, DR; Grampa served in WWII. Walked out of the movie during the beach landing scene, ran into another veteran in the lobby. And they cried.** ",t3_vu4w1,False,AskReddit,0,1429269689,,,123,0,123,Jerkdog,t1_c57vu8p,False,,t5_2qh1i,0,
True,c57vv7f,t1_c57ag9e,1341113938,[watchseries.eu](http://watchseries.eu) great great great site,t3_vslea,False,exmormon,0,1429269703,wtf,,1,0,1,baub888,t1_c57vv7f,False,,t5_2r0gj,0,
True,c57vvdi,t1_c57j4th,1341113962,"I remember the times when Germany was being called. Being labelled the ""sick man of Europe"". Hell at that time Sarkozy got elected to turn the French economy into one that is more like the US/UK. But even then Germany had power but rarely choose to use it.

For example before the financial crisis when oil prices where high and the growth of the EU was slower than the US. Sarkozy tried to pressure the ECB to focus more on growth rather than inflation. The Germans immediately shot him down. At the same time Sarkozy (oh god how I hated him) tried to create a Mediterranean Union that uses EU money and facilities but would only have members that border the mediterranean. That way France would have it's own little club of nations that it could influence and using money from the UK and Germany without having them part of it. Germany shot him down again. They forced him to make sure that all EU members regardless of their location would be in the MedUnion. Thanks to Germanys action Sarkozy quitely killed it off. That was good use of German power.

Then there are cases where Germany remained silent. I'm not even talking about the budgets and the poor economic policies of the Southerns. I'm talking about Eastern European countries like Poland being run by idiots like the Kaczyńskis who take EU money and then proceed to insult other EU countries especially Germany.

The population of Germany is falling and the UK thanks to the idiots in charge has a good chance of leaving or being a useless member. It means that the ability to combat some of the idiotic policies by Southern and Eastern nations will diminish as time goes by. Now is Germanys chance to reform the EU totally. Lets hope they take it before it's to late. Nothing motivates a country like the risk of economic trouble.",t3_vsl0x,False,worldnews,0,1429269705,,,2,0,2,aldhelm,t1_c57vvdi,False,,t5_2qh13,0,
True,c57vxj7,t3_vu4i6,1341114266,Get the fuck to an embassy. Tell them your story and request asylum. Somewhere European or Canadian.,t3_vu4i6,False,atheism,0,1429269734,no-knight,,2,0,2,aggie1391,t1_c57vxj7,False,Agnostic Atheist,t5_2qh2p,0,
True,c57vy0m,t1_c57vd4k,1341114338,"&gt;N'a pas d'importance; eu des rapports sexuels

FTFY",t3_vuuin,False,AskReddit,0,1429269738,,,1217,0,1217,ChimpanAToChimpanzee,t1_c57vy0m,False,,t5_2qh1i,0,
True,c57w01g,t1_c57vz5b,1341114635,"Hipmunk probably won't do too well for these short flights in Europe. Check the site I posted.  Gotta understand too that flights are short and easy, you have some awful train rides there.",t3_vv3kb,False,travel,0,1429269766,,,2,0,2,CharlieKillsRats,t1_c57w01g,False,,t5_2qh41,0,
True,c57w0nr,t1_c55u4ob,1341114720,"Get to Europe ASAP, that's probably the best place to be if there was a major disproving of every religion.",t3_vm1zt,False,UFOs,0,1429269773,,,0,0,0,DarkStar5758,t1_c57w0nr,False,,t5_2qhds,0,
