subreddit_id,distinguished,body,author_flair_css_class,ups,name,author_flair_text,gilded,created_utc,archived,link_id,retrieved_on,author,id,score_hidden,controversiality,score,edited,downs,parent_id,subreddit
t5_2qh1i,,"The reason Europe isn't speaking German right now is pretty much solely due to the fact that America could simply out-produce every other country (mostly because the war was never fought on American soil {thanks to geographical reasons} thus their infrastructure was was unharmed/unhindered to grow as well as its vast size/diversity/ plethora of natural resources). However it should not go unnoticed that Russia provided the manpower (sacrifice in human lives) that depleted Axis manpower. This combination of Russian lives and American resources defeated Axis powers. One or two, however you view it, Europe would be speaking German if it wasn't for the United States of America. ",,1,t1_cbzh86d,,0,1378016403,True,t3_1lhg6g,1429629083,whompdonkey,cbzh86d,False,0,1,False,0,t1_cbzceg4,AskReddit
t5_2rfxx,,"I don't know, the group stage looks very tough. First off, you're going to have Gamania Bears or Mineski from SEA directly in the quarterfinals, teams that many people think are a step below the EU powerhouses of Gambit, Lemondogs and Fnatic. The strongest Korean teams as of late, MVP Ozone and most likely SK Telecom will also be in the group stage. China will also have their 2nd best team in the group stages. We haven't seen NA done well against other international teams in a long time, but I would say Cloud 9 would have a tough time getting out of the the group stage if we're going to automatically assume a Korean team is going to win each one.",,8,t1_cbzh8c7,,0,1378016427,True,t3_1lhvml,1429629081,[deleted],cbzh8c7,False,0,8,False,0,t1_cbzh152,leagueoflegends
t5_2qrpc,,"PS3!! , en Colombia sale el mismo día que en EU?",,1,t1_cbzh8fg,,0,1378016441,True,t3_1lhmsd,1429629080,jbolivar07,cbzh8fg,False,0,1,False,0,t3_1lhmsd,Colombia
t5_2rgs7,,"i dunno if you're actually satisfied with SE's promises to fix their hardware but they're working on it so...

if you come out with the proposition that ""SE should fix the problems"" you're just preaching to the choir. the only thing i sorta have a problem is when you blame the failing servers on SE choosing to take a risk with X number of servers over the entire NA/EU playerbase. sure, they could have delayed their launch and prepared more servers, but then we'd still be whining(complaining) except this time about the delayed launch.

SE is offering recompensation in the form of [free playtime](http://forum.square-enix.com/ffxiv/threads/73400), and they already said they're working on the problem. 

&gt;Same thing as saying you can hardly see the complaints of hungry African children because you have 3 square meals a day. Learn to empathise.

seriously? you have a computer. we both exist in the same situation, with a computer and game client trying to connect to the internet, and yet I find it impossible to reproduce on my end a 5-hour wait time to log in. you're asking me to blame SE for your problems but i can't help but draw the conclusion that you're just doing something wrong on your end. or you don't have a fast enough internet connection. or you have the game servers firewalled. or your ISP is actively trying to screw you out of your bandwidth. 

&gt;But it seems as long as YOU'RE happy SE shouldn't do anything.

it's not about me, it's about overloaded servers. i know that the last 2 paragraphs of my last post make me sound like a selfish prick but i'm just trying to let you know that no redditor can just go fix the problem so your complaints are pointless.

besides, why should i invest myself emotionally in your troubles anyways?

tldr: just what do you expect them to do? what do you expect me to do?",limsa,1,t1_cbzh8in,,0,1378016453,True,t3_1lgxr0,1429629079,shadofx,cbzh8in,False,0,1,False,0,t1_cbzfdi9,ffxiv
t5_2qh1i,,"I am possibly descended from Charlemagne. Oh wait, so is everyone else from Europe.",,1,t1_cbzh9lg,,0,1378016612,True,t3_1lgyay,1429629065,TheOne1716,cbzh9lg,False,0,1,False,0,t3_1lgyay,AskReddit
t5_2qh13,,"China LITERALLY has a national army of hackers.. 

http://www.nytimes.com/2013/02/19/technology/chinas-army-is-seen-as-tied-to-hacking-against-us.html?pagewanted=all

231 attacks is nothing! It would be great to know the number of attacks China alone directs against the US / Europe daily...

And its ironic actually that Snowden ""whistle blows"" about a few American attacks while he is in Russia...  !
 ( although understandably, it's not like he has the option to talk about Russia now )",,2,t1_cbzhaky,,0,1378016746,True,t3_1lgkzf,1429629052,Dr-Maximum,cbzhaky,False,0,2,1378017102,0,t3_1lgkzf,worldnews
t5_2wo26,,"Hey at least the top-voted comment is correct. That's good, right? Right?

&gt;Feelz32 73 points 7 hours ago (91|18)
[Columbus proved the world was round
No, everyone knew the world was round. Even the ancient Greeks knew the world was round. Why would people think the earth was flat when they knew that the moon and other planets were all round](http://www.reddit.com/r/AskReddit/comments/1lhg6g/what_are_the_biggest_misconceptions_about_history/cbz9ii4)

Then the next comment kills my faith, because hey the Europeans practiced methodical genocidal germ warfare on the Americas. Apparently they were so smart that they could cause entire nations to vanish ahead of them, making it nice and easy for them to come in and conquer.

Yeah, tens of millions (maybe hundreds of millions) of native peoples died due to European illnesses, but it sure as hell wasn't methodical, much less intentional. 

The comment on Ben Franklin tried to get it right in saying that he didn't discover electricity, but then it went astray in talking about an experiment that Franklin probably never actually did. 

Ooh we've got a Canada burned down the White House in the war of 1812!",,14,t1_cbzhb4t,You know who's buried in Grant's Tomb? Not the fraud Grant. ,0,1378016826,True,t3_1li0fw,1429629045,smileyman,cbzhb4t,False,0,14,1378017702,0,t3_1li0fw,badhistory
t5_2qmeb,,"3ds is the way to go, fold design is amazing.  Anywayyy, unless you're in Europe the only things you can get are either a crummy little poster/map from Gamestop or these little pins from Target. ",9,5,t1_cbzhbyv,,0,1378016943,True,t3_1lhh3p,1429629034,BusinessmanBlastoise,cbzhbyv,False,0,5,False,0,t3_1lhh3p,pokemon
t5_2qh1i,,"Took two Eastern European Lit classes a semester ago and the professor had some pretty powerful stuff.

**4 Months, 3 Weeks and 2 Days** - Romanian film set during the 80's and the the struggle of one woman to help her friend have an illegal abortion. 

**Before the Rain** - A commentary on the circular nature of violence in Macedonia and how its spread around the world.",,1,t1_cbzhchu,,0,1378017025,True,t3_1lh6rp,1429629027,masonzero9,cbzhchu,False,0,1,False,0,t3_1lh6rp,AskReddit
t5_2r81c,,"PureBulk and New Star both USA companies ship internationally....and I love both companies....

But be warned....some European countries allow NO racetams across their borders...(I think Germany is one....)

So do your due diligence

I'm complimenting these two companies all over the place...but I'm not a shill...just a happy customer trying to help....from my experience...

What goes around....

Tarasco",,1,t1_cbzhcyg,,0,1378017091,True,t3_1l2u3w,1429629021,Tarasco,cbzhcyg,False,0,1,False,0,t3_1l2u3w,Nootropics
t5_2t5mo,,"I would like Europe Universalis 3 Complete. The game looks fun and strategic, which I would love to play. I have also heard that the game was good and fun from many people from reviews and videos. Thanks.",,1,t1_cbzhe3i,,0,1378017248,True,t3_1li3er,1429629006,SmurfUnivurf,cbzhe3i,False,0,1,False,0,t3_1li3er,RandomActsOfGaming
t5_2qzb6,,"Believers, the right ones, contra unbelievers and words like democratic elected government.. In Europa and other country's, it means a majority pull the strings of law. In believers country,s it works different. A book dictate. It is the guide for poor and rich believers. More or less the reason for many wars. Europa is on the moment overrun with the poorest of the poorest immigrant true believers. With as result a changing culture. What leave many Europeans unhappy. The daily news is dominated with believers world problems. Remember Boston? Not to mention the gory tale of butcher bombers in other religion dominated country,s. Syria was not part of that. Now is. Why?
",,-1,t1_cbzhedw,,0,1378017290,True,t3_1lhtlx,1429629003,Katwijk,cbzhedw,False,0,-1,1378017970,0,t3_1lhtlx,IAmA
t5_2qjl3,,Europeans are weird though.  You can get codeine over the counter there too.,,0,t1_cbzhev4,CPhT,0,1378017364,True,t3_1lhfd0,1429628997,Megmca,cbzhev4,False,0,0,False,0,t1_cbzh7bs,pharmacy
t5_2qh61,,"""This term refers to hairstyle, or a medical condition. It also relates to the system of beliefs in European folklore, and healing practices in traditional medicine in Poland.""

I need a more interesting haircut",,1,t1_cbzhezq,,0,1378017383,True,t3_1lhxe6,1429628995,darknsf,cbzhezq,False,0,1,False,0,t3_1lhxe6,WTF
t5_2cneq,,"&gt; were not in the best interests of society.

I truly believe 95+% of what Washington does is in the best interests of society (at least in their minds).  I don't think that the results even resemble this.  BTW, a perfect example is regulations on milk.  If the requirements regarding pasteurization are in the best interests of society, then why isn't this required anywhere in Europe or most of the rest of the world?  Someone thought it was best for us, but it's not.",,1,t1_cbzhjpv,,0,1378018071,True,t3_1lhcc6,1429628934,yoda133113,cbzhjpv,False,0,1,False,0,t1_cbzhici,politics
t5_2rfxx,,"http://na.lolesports.com/season3/split2/schedule

Same idea for other splits or for EU, it has Youtube VODs of all the LCS games this year.

Korean VODs are impossible to get without a subscription to OGN.

Garena doesn't keep VODs, but they are scattered throughout youtube (just disorganized).

LPL (the Chinese league) can probably be found scattered over the internet. (For example- https://www.youtube.com/watch?v=fQWj-LfDVr0)

Hope that helps.

EDIT: For LCS games, click on the game you would like to watch for extra details where you will find a button called ""Watch Game"" and it will bring up a youtube mirror, which might take a few seconds to load. You can switch regions by changing the ""na"" in the url to ""eu"" and you can change splits through the drop down menu next to the menu.",14 team,3,t1_cbzhlj2,,0,1378018339,True,t3_1li8j1,1429628910,Axonalt,cbzhlj2,False,0,3,1378018549,0,t3_1li8j1,leagueoflegends
t5_2qh16,,"The most recent event involves [France](http://www.france24.com/en/20130124-french-court-twitter-identify-authors-racist-anti-semitic). In 2007 France sentenced a guy to jail for publicly questioning some Holocaust figures. While I find the speech in both of these events to be deplorable and outrageously offensive, they are convicting people of having unpopular opinions.

Of course it's against the law in the EU to hold an opinion that might offend others if it's based on race or religion.",,5,t1_cbzhma0,,0,1378018455,True,t3_1lh6dl,1429628900,Taft-the-raft,cbzhma0,False,0,5,False,0,t1_cbzh2qq,technology
t5_2qh13,,"and it's not too hard to make the argument that had (a) European power(s) intervened in the American Civil War it is likely that the United States as we know it also would not exist but slavery might. 

",,1,t1_cbzhoii,,0,1378018810,True,t3_1lhzot,1429628871,didsome1saypizza,cbzhoii,False,0,1,False,0,t1_cbzfvf8,worldnews
t5_2vizz,,"One problem is America is physically separated from most of the world. Europeans have a better understanding of one another because *they're right next to one another.* Americans mainly live next to other Americans, with a few that live near Mexico or Canada. Also, another problem is that Americans can function incredibly well in life without not knowing much about the world. This is not true in places like the UK, where you are constantly rubbing shoulders with people from Turkey, Russia, Poland, etc. ",,7,t1_cbzhq6o,,0,1378019086,True,t3_1lgw5v,1429628850,jhuang29,cbzhq6o,False,0,7,False,0,t1_cbz9aq4,TumblrInAction
t5_2qh2p,,I think it's called Europe.,no-knight,23,t1_cbzhqw4,Agnostic Atheist,0,1378019205,True,t3_1lhr7p,1429628841,Demonweed,cbzhqw4,False,0,23,False,0,t1_cbzhk59,atheism
t5_2qh41,,"Agreed! I went to Kraków for this last new years. It was my first time in Eastern Europe and it was fantastic.

I'm more interesting in meeting people and exploring the city than attractions like Wawel Castle and the Wieliczka Salt Mine, but those were interesting too. There's a lot of history there!

It wasn't nearly as cold as I expected and people kept homes and businesses warm. A wool coat, gloves, a scarf, and a hat worked great. Waterproof shoes were nice in the snow.

OP, as for being 18 — that's a great age to travel. Don't overthink it too much, don't commit to too many things, and be willing to try new things and push yourself a bit.",,1,t1_cbzhrof,,0,1378019337,True,t3_1lhmmo,1429628830,renegadeduck,cbzhrof,False,0,1,False,0,t1_cbzbk90,travel
t5_2rfxx,,I know there's both I assumed its like Canadian French and France French. Didnt mean to offend you at all. Thought you could target both Portugese communities in the Brazilian part and in the Portugal part I'm sorry again my friend! Feel free to add me on Eu-West ScumbagCanadian is my name,01 team,1,t1_cbzhsjm,,0,1378019480,True,t3_1lhaue,1429628819,afrocanadian,cbzhsjm,False,0,1,False,0,t1_cbz9d2x,leagueoflegends
t5_2qh1i,,he conquered most of europe with little to no trouble.  Something bismark cant claim,,-1,t1_cbzhta3,,0,1378019606,True,t3_1lhg6g,1429628810,badgerfan666,cbzhta3,False,0,-1,False,0,t1_cbzgghx,AskReddit
t5_2cneq,,"I fucking hate Gazbot, funny I should run into you again in comments, but Gazbot is 100% correct here.

It's been proven over and over again throughout history that the better prepared, better equipped and better led armys can easily beat 2 to 1 odds, hell... 5 to 1 or even 10 to 1 can happen.

China's army would be demolished by European or American coalition forces in a ground war.

The technology gap was smaller during the Korean conflict and coalition forces continually beat the snot out out of both north Korean and Chinese military. The only reason there was a back and forth was because of China's attrition rates.

With today's military technology in Europe and the US, China would get their asses handed to them.

Even Germany proved (WW2) that better equipment and strategies can kick the snot out of the largest of army's. They proved that by kicking the crap out of an entire continent for 6 years with a comparably small army.

Size means nothing when it comes to an army if they don't have the equipment , strategies or experience (China).",,0,t1_cbzhtml,,0,1378019665,True,t3_1lgmh6,1429628805,nicholsml,cbzhtml,False,0,0,1378019872,0,t1_cbzeguh,politics
t5_2cneq,,"I don't see why only a single Prince would want the fall of the Shiia led regime, the whole of the House of Saud, are Sunni and would want this. 

The big oil fields in Saudi are under Shiia tribal land

[Oil fields of Saudi](http://www.southampton.ac.uk/~imw/jpg-Qatar/12QTR-General-Map-Middle-Oil.jpg)

[Shiia area of Saudi](http://nealrauhauser.files.wordpress.com/2013/06/saudi-peninsula-shia-areas.png?w=625&amp;h=482)

Should a Shiia crescent form, Iran, Iraq, Syria, Shiia Saudi, it would be a massive blow to US hegemonic power in the world and put something like 40% of the worlds oil fall under shiia hand.
It would mean the fall of the house of Saud. He who controls the valve of oil controls the windpipe of Europe and Asia  It would change the world. 

It's been speculated that they could lose this immense source of strategic power and wealth with a few sound systems mounted on the backs of truck and 20 Shiia Imans. This is why the Sauds are give a free hand to do what they want to crush Shiia dissent in Barhain, which is the opposite of Syria, A Sunni majority led by Shiia, but a Shiia majority led by a Sunni, ( put in place by the Sauds. 

It would also led to the loss of the petrodollar. The use of the petro$ means that the US can print dollars to pay for price increases in oil. Industrialized countries without oil, such as Japan EU or China, have to export to the US in order to obtain dollars to exchange for Opec oil; for example, cars in the case of Japan. So America gets oil and services and goods (eg cars) in exchange for pieces of paper. Not only that but Opec's excess dollars were then reinvested in the US and other industrialized countries, thus funding the US budget deficit and reducing US interest rates.

It would be a massive blow to lose the petrodollar. If no one bought US$ anymore I wonder how far it would drop in value.




",,2,t1_cbzhu0u,,0,1378019738,True,t3_1lhk9c,1429628800,Lard_Baron,cbzhu0u,False,0,2,1378028617,0,t3_1lhk9c,politics
t5_2qmjp,,"Doesn't capture the history of the board game evolution. Also some european style games have become 'thematic', see Mage Knight, Archipelago, etc.",android,1,t1_cbzhvf3,Android,0,1378019965,True,t3_1lhrna,1429628782,sigma83,cbzhvf3,False,0,1,False,0,t1_cbzhtic,boardgames
t5_2qhn3,,"&gt;circumcision is still mostly a white thing

You have that the other way around.  Compare black vs. whites for instance.  Whites are *much* less likely to be circumcised.

Part of this is due to the post 1900 European immigration waves.

You have to remember that Kellog was aiming to reduce the population of the undesirables (particularly in the south) through sterilization and other eugenic practices.  Circumcision was thought to lesson the desire for sex. They were also big on burning the clitorises off of girls with carbolic acid.   See the 'race betterment foundation' and other examples of the 'health' fads and where they were practised in the US.

This is also the same period that brought us planned parenthood with its pro-eugenics roots as well, if you are interested in history.  Or modern breakfast cereal (pressed grains were thought to lower your libido.)

If anything, the race part is incidental.  It was a north vs. south thing.
",,5,t1_cbzhvyn,,0,1378020052,True,t3_1lhvdk,1429628776,AngMoKio,cbzhvyn,False,0,5,False,0,t1_cbzh2id,Parenting
t5_2qi58,,"La liga is a two horse race, but 3rd and beyond is way higher quality than what people give it credit for. Year after year these spanish teams defeat big European names and are still written off. It's incredibly irritating, and the reason it's a two horse race is because the two best teams in the world run it. ",14,7,t1_cbzhwcx,Seattle Sounders,0,1378020117,True,t3_1li1ir,1429628770,MilesOfEvergreens,cbzhwcx,False,0,7,False,0,t1_cbzg1l5,soccer
t5_2qhn3,,"Foreskin is there with purpose. Like a fingernails: to protect. I am, like major part of men here (Europe) uncut. When I retract my foreskin and let it stand like that in my pants, very soon I feel discomfort because of the sensitive glans rubbing on the material around it. There's absolutely no need for that!
Maybe 2000 years ago, when there was practically no hygiene, soap, water was scarse and Bible was written there was a good reason to do it - but now there isn't any. 
Just like muslims were forbidden to eat pork - no reason now. Back then, no refrigerating, and the pork meat was the first to go bad and cause diseases. Not anymore. We've evolved a bit, hygiene is much better, and there's absolutely no reason to cut baby's parts ""just because"".
Yes, it happens that skin won't retract so the medical procedure is necessary, but it's the minority of cases. Just like it happens that the tear canal(s) are clugged and unopened, so there's the need to stick a needle in it to open it: but you do it only when needed, and not just ""because it's custom"". I'd be very pissed off if somebody had cut a piece of my body without me having anything to say about it. Very pissed off. 
When my son is of legal age, if he wants to tie a node on his foreskin and transplant his balls above his cock - he can do it. But there ain't no way I'm gonna let anyone cut any of his body for no reason. No way!",,4,t1_cbzhwf3,,0,1378020124,True,t3_1lhvdk,1429628769,bluedevil_zg,cbzhwf3,False,0,4,False,0,t3_1lhvdk,Parenting
t5_2qhvw,,"Swedish military intelligence already has the rights to snoop every bit of data that goes in, out or through the country and they most likely share.  So better forget them.

My money is on Switzerland. They have a good track record of keeping banking secrets and they are not member of EU or NATO.",,2,t1_cbzhx00,,0,1378020225,True,t3_1lhaky,1429628761,Mikey06,cbzhx00,False,0,2,False,0,t1_cbzatv4,security
t5_2qi6d,,"Because typically bikes are tuned for pretty high outputs, so the displacement at least hints at the power.  In cars, forced induction is more prevalent, plus there's petrol vs diesel, both of which have large impacts on the specific output.  

In Europe we do tend to discuss cars by engine size, however, perhaps as a byproduct of us running engines in a higger state of tune as a rule, meaning there's a direct correlation between displacement and power that isn't as obvious is US motors.

More than that though, I think bikers tend to know their subject.  Many car drivers do not.

",gb,3,t1_cbzhxae,"R6, XS250",0,1378020278,True,t3_1lh977,1429628758,ScaredOfAPotato,cbzhxae,False,0,3,False,0,t1_cbzb65u,motorcycles
t5_2s7tt,,"Even if Britain had agreed to go in (Which to me was a no-brainer for the reasons stated above, a third WW would almost certainly end up with some sort of nuclear warfare going down unless it was entirely a proxy war which is unlikely) it wouldn't make it any less dumb, TWO members of the UN security council are against it, a single veto is supposed to stop a war, making it unsanctioned by the UN. Both China and Russia left the UN in anger when the US talked about striking Syria, which Russia is supporting. At the very least it would turn into a proxy war where Russia and likely China fueled Syria and it's allies against Israel and the rebel forces, with the US supplying Israel and the rebels. At worst it'd turn into a full scale war in the middle east with Russia, China, Iran ,Syria and the majority of the middle east fighting against the US, Israel and any of their allies such as Britain who'd get involved, in the case of a US vs Russia/China war likely the majority of the EU would be involved due simply to the inability of the US to handle China and Russia on its own with the EU depending on the US. ",,2,t1_cbzhxei,,0,1378020299,True,t3_1lcdlp,1429628756,Autodidact420,cbzhxei,False,0,2,False,0,t1_cbzg74b,AdviceAnimals
t5_2qh13,,"Bad stuff happens everywhere, all the time. Should we intervene to prevent that all? Can we judge from a distance who is right? The region has been very unstable for a long time, since the colonies with it's drawn up borders were set free by its colonists. They need time to figure things out, external meddling makes things only worse. Al Quaida exists because of western interference in the middle east.

Next to that, Europeans dont have that arrogant world-police attitude that Amerikans have.",,0,t1_cbzhxrh,,0,1378020363,True,t3_1lgzwp,1429628752,Jigggg,cbzhxrh,False,0,0,False,0,t1_cbz6kt1,worldnews
t5_2rfxx,,3rd place in the EU LCS is irrelevant?,,-6,t1_cbzhyn1,,0,1378020516,True,t3_1lhmxm,1429628740,InvalidZod,cbzhyn1,False,0,-6,False,0,t1_cbzhqgz,leagueoflegends
t5_2sljg,,"He's also only been on the main roster for just over a year, they're acting like he debuted in the attitude era and never got his rewards. HHH held the European title first before he climbed up the ladder to the top. I can see Cesaro maineventing Wrestlemania 32 and beyond",,5,t1_cbzi0bq,,0,1378020798,True,t3_1lhovw,1429628718,[deleted],cbzi0bq,False,0,5,False,0,t1_cbzebrb,SquaredCircle
t5_2qh13,,"Less people in EU? EU has more than 700 million people and USA has about 320 million, and if you consider each EU country separately you have to do the same for the USA and split the population in 50. I don't think that 320 are more than 700 but maybe it's only my opinion :)",,12,t1_cbzi0rz,,0,1378020882,True,t3_1lhr5r,1429628713,MightyPelanda,cbzi0rz,False,0,12,False,0,t1_cbzhvj6,worldnews
t5_2rgs7,,"Report spam button/ ignore player button upon right click of there name would be awsome

Also the EU servers could do with bieng in EU rather than canada! minimum ping i get is 500 it sometimes goes as high as 18k, if your paying for a game on a monthly basis the least you expect is a decent ping (not a rage post) just stating that it would be nice to have a normal ping for when i start raiding :) ",,2,t1_cbzi185,,0,1378020963,True,t3_1lhilk,1429628707,Bainsy,cbzi185,False,0,2,False,0,t3_1lhilk,ffxiv
t5_2qh13,,"As a European from a neutral EU-state, fuck you too!",,0,t1_cbzi380,,0,1378021326,True,t3_1lgxdf,1429628681,whtml,cbzi380,False,0,0,False,0,t3_1lgxdf,worldnews
t5_2qq5c,,Where in Europe? We'll miss you!,,1,t1_cbzi4tf,,0,1378021625,True,t3_1liad4,1429628660,malabainne,cbzi4tf,False,0,1,False,0,t3_1liad4,gonewild
t5_2qh16,,"Well, what they also did was to use FRAND patents (patents that went into the 3G standard under the condition that anyone could license them fairly) which is kind of shitty. http://arstechnica.com/tech-policy/2012/01/eu-launches-official-investigation-into-samsungs-3g-frand-patent-lawsuits/",,0,t1_cbzi5gu,,0,1378021745,True,t3_1lfpt8,1429628615,flurg123,cbzi5gu,False,0,0,False,0,t1_cbz3low,technology
