author,ups,subreddit,downs,gilded,score_hidden,author_flair_css_class,distinguished,author_flair_text,body,archived,parent_id,score,id,retrieved_on,created_utc,name,controversiality,edited,link_id,subreddit_id
[deleted],-1,worldnews,0,0,False,,,,"+ http://pqasb.pqarchiver.com/latimes/access/521670312.html?dids=521670312:521670312&amp;FMT=CITE&amp;FMTS=CITE:AI&amp;date=May+20%2C+1967&amp;author=&amp;pub=Los+Angeles+Times&amp;desc=Israel+Warns+on+U.N.+Pullout&amp;pqatl=google
+ http://select.nytimes.com/gst/abstract.html?res=F00A11FE345C177B93C0A8178AD85F4D8485F9
+ http://select.nytimes.com/gst/abstract.html?res=F60F13FE355D13728DDDAC0894D0405B8889F1D3
+ http://pqasb.pqarchiver.com/chicagotribune/access/508111992.html?dids=508111992:508111992&amp;FMT=CITE&amp;FMTS=CITE:AI&amp;date=Apr+07%2C+1955&amp;author=&amp;pub=Chicago+Tribune&amp;desc=ISRAEL+WARNS+U.+N.+ARMISTICE+MAY+BE+BROKEN&amp;pqatl=google
+ http://select.nytimes.com/gst/abstract.html?res=FB0E11FE345F177B93CBA91789D95F4D8485F9
+ http://pqasb.pqarchiver.com/latimes/access/642440142.html?dids=642440142:642440142&amp;FMT=CITE&amp;FMTS=CITE:AI&amp;date=Dec+08%2C+1976&amp;author=&amp;pub=Los+Angeles+Times&amp;desc=Israel+Warns+It+Could+Withdraw+U.+N.+Resolution&amp;pqatl=google
+ http://www.independent.co.uk/news/world/middle-east/israel-warns-britain-over-un-barrier-resolution-554028.html
+ http://select.nytimes.com/gst/abstract.html?res=F10B11FD395F167B93C4A8178DD85F4C8485F9
+ http://select.nytimes.com/gst/abstract.html?res=FA0611FE3859107B93C3A91789D95F468785F9
+ http://news.google.com/newspapers?id=WuUNAAAAIBAJ&amp;sjid=i20DAAAAIBAJ&amp;pg=7175,543153&amp;dq=israel-warns
+ http://pqasb.pqarchiver.com/chicagotribune/access/506693062.html?dids=506693062:506693062&amp;FMT=CITE&amp;FMTS=CITE:AI&amp;date=Sep+30%2C+1955&amp;author=&amp;pub=Chicago+Tribune&amp;desc=ISRAEL+WARNS+RUSS+OF+ARMS+DEAL+DANGERS&amp;pqatl=google
+ http://pqasb.pqarchiver.com/jpost/access/937550511.html?dids=937550511:937550511&amp;FMT=ABS&amp;FMTS=ABS:FT&amp;date=Nov+27%2C+2005&amp;author=TOVAH+LAZAROFF&amp;pub=Jerusalem+Post&amp;desc=Israel+warns+EU+report+may+damage+relations.+%3B+Draft+policy+statement+calls+post-%2767+neighborhoods%3B+illegal+settlements%27&amp;pqatl=google
+ http://www.accessmylibrary.com/coms2/summary_0286-25291956_ITM",True,t1_c098hr3,-1,c098njp,1425962687,1241136001,t1_c098njp,0,False,t3_8guzj,t5_2qh13
glengyron,0,worldnews,0,0,False,,,,"Or Russian ones.

Since far more seriously [Russia has recently warned the EU about the consequences of protests against the sovereignty of Moldova](http://www.straitstimes.com/Breaking%2BNews/World/Story/STIStory_361672.html).

Countries warn each other all the time, it's part of the wonderful world of diplomacy.

- [Britain among 5 nations warned by EU to cut budget deficits](http://www.smartbrief.com/news/cfa/storyDetails.jsp?issueid=A2F6A68E-F177-42F8-9BF5-2CB7E98B115A&amp;copyid=E476B3A7-33D8-4921-AAD9-634645B61BF6)

- [EU warns UK over Internet Privacy - Phorm.](http://www.ukcheapbroadband.com/broadband-blog/17234/eu-warns-uk-over-internet-privacy-phorm/)

- [EU warns China over increasing steel exports](http://www.telegraph.co.uk/finance/newsbysector/industry/5127401/EU-warns-China-over-increasing-steel-exports.html)

- [EU warns Germany over transparency](http://www.europeanvoice.com/article/2009/04/eu-warns-germany-over-transparency/64708.aspx)

Reddit just loves to freak out.",True,t1_c098lt9,0,c098nwb,1425962691,1241136891,t1_c098nwb,0,False,t3_8guzj,t5_2qh13
infosnax,2,sports,0,0,False,NHLBruins,,,"&gt;2nd tier sports FTL

Yeah, besides the U.S., hockey's only popular in loser places like Canada, Eastern Europe, and Scandinavia. Places that don't know about gooder first tier sports like American Football.",True,t1_c0984fz,2,c098oc5,1425962697,1241137972,t1_c098oc5,0,False,t3_8gj13,t5_2qgzy
moriya,1,motorcycles,0,0,False,,,,"Well, even though its legal here, with the high number of people moving in and out of the bay there are those that don't realize its legal.

That doesn't count the assholes with road rage - I've had several cars (all of them coincidentally european sedans being driven by 30-somethings in power ties) try to box me out while splitting.

I'm not sure what's going through their heads, but at least one of them lost a side view mirror for his troubles.",True,t1_c098m06,1,c098oi2,1425962699,1241138377,t1_c098oi2,0,False,t3_8gl6d,t5_2qi6d
inerte,7,AskReddit,0,0,False,,,,"I love and hate the cops.

Got slapped in the face once by them, on a routine street check. Have been asked to give money another time.

But still, they stormed into a bar being robbed while me and ~15 were being held captives in the back, killing one robber, injuring another. One of the police men took a bullet on his thigh.

I'm from Brazil, btw. Our police looks like is way more corrupt than ""1st world"" countries, like USA, Canada or some parts of Europe. Every day there're news about bad things they're doing, way, way much worse and common than people from these mentioned countries are used to see.

But still, would call the police for help, no doubt, no second thoughts.",True,t3_8guyn,7,c098omw,1425962702,1241138753,t1_c098omw,0,False,t3_8guyn,t5_2qh1i
[deleted],1,AskReddit,0,0,False,,,,"There are whole careers built on the reinterpretation of classical music in terms of gender and sexuality issues (there is a field of study called ""queer musicology"" for example). 

&gt;Review
""This superb collection of 12 essays offers much new research and makes a fine addition to queer musicology. The volume focuses on the intersection between music and queerness in Europe and the US from 1870 to 1950, a time of particular importance and change for formulations of queer identity and musical style. Many of the contributors explore subject matter previously overlooked, veiled, or suppressed, presenting significant new research that draws on primary documents."" -- Choice

From [this](http://www.amazon.com/Queer-Episodes-Music-Modern-Identity/dp/025202740X) book on Amazon, as an example.",True,t1_c098oqt,1,c098p1o,1425962707,1241139829,t1_c098p1o,0,True,t3_8gwtk,t5_2qh1i
Caluen,3,Economics,0,0,False,,,,"In europe we got laws against that kind of discrimination (you are not even allowed to ask if the person is planning on having kids)

Also, significantly more men are taking their fair share of the maternity leave.",True,t1_c098dip,3,c098pdv,1425962711,1241140684,t1_c098pdv,0,False,t3_8gs18,t5_2qh1s
sanhedrin,7,news,0,0,False,,,,"&gt; Iran also seems to have a more open media as well.

Not according to the [Reporters Without Borders Press Freedom Index](http://www.rsf.org/article.php3?id_article=29031). Iran is ranked 166th out of 173 countries in the latest index; only China, Vietnam, Cuba, Burma, Turkmenistan, North Korea, and Eritrea have less media freedom.

By comparison, Israel is ranked 46th within its own territory. It does have a problem in the Occupied Territories, where it ranks 149th, but even that's better than Iran. I think it really speaks poorly of Iran that in spite of all the repression involved in Israel's occupation of the Palestinians, Israel still does a better job respecting press freedom in the Palestinian Territories than Iran does in its own territory.

From the [Reporters Without Borders 2008 Iran Annual Report](http://www.rsf.org/article.php3?id_article=25431):

&gt; Iran’s leaders still accuse the independent media of being in the pay of the United States or the European Union, which has resulted in long prison terms for journalists from a cowed and complicit judiciary. Reporters based in Teheran and Kurdistan were targeted in 2007, with dozens of arrests, convictions and closures of newspapers.

&gt; ...

&gt; More than 50 journalists were prosecuted in 2007 and the independent and opposition media were targets of the usual financial and bureaucratic harassment. The ministry of culture and Islamic guidance, which is responsible for the media, ordered at least four publications to shut down permanently. A dozen papers, including the well-known Shargh and Madaresseh, were temporarily closed pending a court decision and news websites were also targeted. Iran has the biggest number of threatened cyber-dissidents in the Middle East and dozens of websites are shut down each year.

From the [Reporters Without Borders 2008 Israel Annual Report](http://www.rsf.org/article.php3?id_article=25434):

&gt; Israeli journalists continue to show their independence of the government, something quite rare in the region.

&gt; The Israeli authorities are capable of the worst and the best when it comes to press freedom. Despite military censorship, the media continues to enjoy genuine freedom. However, while getting the best marks in the region (44th in the world) in the Reporters Without Borders worldwide press freedom index, its record is badly marred by Israeli army violence against media workers in the occupied Palestinian Territories.",True,t1_c09880j,7,c098pgb,1425962719,1241140846,t1_c098pgb,0,False,t3_8grln,t5_2qh3l
[deleted],1,funny,0,0,False,,,,"I think what we have is definitely corporatism but that fascism is a fairly fuzzy label, and I'm not sure if our government fulfills enough of the traits associated with it to really qualify as outright fascist:

&gt;political ideology and mass movement that dominated many parts of central, southern, and eastern Europe between 1919 and 1945 and that also had adherents in western Europe, the United States, South Africa, Japan, Latin America, and the Middle East... Although fascist parties and movements differed significantly from each other, they had many characteristics in common, including extreme militaristic nationalism, contempt for electoral democracy and political and cultural liberalism, a belief in natural social hierarchy and the rule of elites, and the desire to create a Volksgemeinschaft (German: “people’s community”), in which individual interests would be subordinated to the good of the nation. [[1]](http://www.britannica.com/EBchecked/topic/202210/fascism)

(Not that America isn't a giant evil empire that has killed more people than I can even comprehend, mind you)",True,t1_c098prd,1,c098pvu,1425962719,1241142029,t1_c098pvu,0,True,t3_8gtkq,t5_2qh33
mexicodoug,2,worldpolitics,0,0,False,,,,"Yes, and most of us think that European civilization would be a really good idea.",True,t1_c098oyv,2,c098q8k,1425962722,1241143067,t1_c098q8k,0,True,t3_8grlj,t5_2qh9a
sblinn,1,business,0,0,False,,,,"&gt; Should employers also be able to ""strike,""

I've heard of weird ""you cannot fire people, ever"" laws in Europe, but in the USA by and large my employer could fire me tomorrow if I refused a 90% pay cut.",True,t1_c098l7d,1,c098qcn,1425962724,1241143384,t1_c098qcn,0,False,t3_8geea,t5_2qgzg
[deleted],0,worldpolitics,0,0,False,,,,"Oh really.  Is that what they think in North Africa, Southeast Asia, the ""New World"", Australia, New Zealand, South Africa etc.?

Maybe a lot of people in those places think highly of European civilization now but they sure as hell didn't back in the colonial days when the British, Spanish, French, Dutch and Portugese raped, killed and seized their way around the world.

My point, is yes, America is a fucked up place.  The native American genocide, slavery and institutional racism are some the big negative standouts in the history of the US.  And yes, the American government has done all kinds of evil shit in the past century right on up to the wars in Iraq and Afghanistan, but I can't let the Europeans off scott free.  They started all this shit, when they finally crawled out of the Middle Ages and decided to take over the world.  The good old US of A is just one of the results of their efforts/crimes.

And yeah who the fuck doesn't like sitting in street cafes, riding around on Vespas (or bicycles or trams or gondolas), enjoying wonderful food and recycling and feeling smug.  I sure do.

",True,t1_c098q8k,0,c098rw2,1425962743,1241147588,t1_c098rw2,0,True,t3_8grlj,t5_2qh9a
MeenXo,5,worldnews,0,0,False,,,,"""Islamist""
Do you want me to call your CORRUPTED U.S. Government, the ""Christian Government"" ? 

Government Government Governments are the issue not religion. Capitalism, Money, Greed... Corporate Europe, America... Stop blaming religion..

I am a Muslim and I think it is not fair for these farmers to lose that much money for something that is not necessary.

I am getting sick and tired of people putting ""Islam"" in everything, seriously, stop it! 

Peace to everyone!",True,t3_8gtbx,5,c098sx2,1425962755,1241150479,t1_c098sx2,0,True,t3_8gtbx,t5_2qh13
heystoopid,1,worldnews,0,0,False,,,,"LOL , send in the Zombie Smithfield Swine Flu army to steal all the resources ?

http://bouncewith.me.uk/europe/8027043.htm",True,t3_8gxtq,1,c098t6c,1425962760,1241151142,t1_c098t6c,0,False,t3_8gxtq,t5_2qh13
jessegberg,5,funny,0,0,False,,,,crazy europeans.  think they can just reach out and touch the faces of powerful men.,True,t1_c098q0n,5,c098tb8,1425962760,1241151505,t1_c098tb8,0,False,t3_8gtkq,t5_2qh33
heystoopid,1,worldnews,0,0,False,,,,"O'really ?

Or  , is this a rather sad case of ""Bibi"" trying to pass much wind and rhetoric in the direction of Turkey and Europe but   some smart ass just stuck a cork in it and it is all blocked up and constipated now !",True,t3_8guzj,1,c098tpa,1425962766,1241152637,t1_c098tpa,0,False,t3_8guzj,t5_2qh13
heystoopid,1,worldnews,0,0,False,,,,"JUst give them a dose of the Smithfield Zombie Flu , that will permanently fix the that problem .

http://bouncewith.me.uk/europe/8027043.htm",True,t3_8gy4m,1,c098ueb,1425962775,1241154877,t1_c098ueb,0,False,t3_8gy4m,t5_2qh13
silence_hr,3,worldnews,0,0,False,,,,"Just compere these people to Gypsies in any European country. Then ask people from that European country what they think of Gypsies. 

""Ancient culture"" sometimes needs to die. Same people who are now all up over this would be writing how Egypt oppresses these people by not giving them access to modern sanitation or giving them modern tools or something like that. 

Zabaleem collect garbage to feed pigs. They sort that garbage manually. **How many western ""protectors"" would want these same Zabaleen in their neighborhood?** ",True,t1_c098mck,3,c098w0s,1425962805,1241160199,t1_c098w0s,0,False,t3_8gtbx,t5_2qh13
endtime,1,offbeat,0,0,False,,,,"Came here to post that...this was entertaining, but it's not like only Europeans do this sort of thing.",True,t1_c098l7k,1,c098w5s,1425962798,1241160749,t1_c098w5s,0,False,t3_8guq4,t5_2qh11
huxtiblejones,2,science,0,0,False,,,,"From Wikipedia article for H1N1

&gt;The swine influenza virus isolated from patients in the United States **was found to be made up of genetic elements from four different flu viruses – North American Mexican influenza, North American avian influenza, human influenza, and swine influenza virus** typically found in Asia and Europe – ""an unusually mongrelised mix of genetic sequences.""

So it's actually ManBirdManPig.",True,t1_c098utt,2,c098xe8,1425962818,1241166795,t1_c098xe8,0,False,t3_8gvva,t5_mouw
huxtiblejones,2,science,0,0,False,,,,"No, god damn it, it's simple viral biology. You see, variations of the flu exist in different types of animals like pigs and birds, but it doesn't affect them. The genes in viruses can mutate or undergo antigenic shift and take on forms that transmit to humans. This happened in 1890, 1918, 1957, 1968, and 2009. The simple fact is that the flu has a tendency to reform itself into a new virus that humans have never been exposed to (like the current H1N1 flu).

This isn't just based on an assumption of probability, it's based on the fact that history shows case after case of serious flu pandemics ever couple decades.

From Wikipedia on H1N1

&gt;The swine influenza virus isolated from patients in the United States was found to be made up of genetic elements from four different flu viruses – North American Mexican influenza, North American avian influenza, human influenza, and swine influenza virus typically found in Asia and Europe – ""an unusually mongrelised mix of genetic sequences.""

The fact of the matter is that even flu virology experts do not know the ins and outs of influenza. We don't know how or why seasonal flu comes about, we don't truly know how effective our methods of _not_ spreading viruses are, among other things.",True,t1_c098x7b,2,c098xi2,1425962818,1241167526,t1_c098xi2,0,False,t3_8grc2,t5_mouw
OWellain,0,atheism,0,0,False,,,,"reland is getting Sharia Law and it starts now. Our EU partners need to know what Ireland is doing. European values of liberty and freedom are being trampled on by the Irish Government in an unholy alliance between the old catholic right wing (they haven't gone away you know) and our servile attempts to suck up t Islamic regimes. I hope it was worth it. I hope Irelands Enterprise &amp; Trade Minister Mary Coughlan managed to wrangle plenty of money out of the Saudis for selling our right to free speech down the river. As everyone knows Saudi Arabia are perennial sponsors of the annual UN effort to enforce blasphemy laws on the Western World. Well is it any coincidence that Irelands minister of justice announced these laws while Irelands Enterprise &amp; Trade Minister Mary Coughlan was in Saudi Arabia passing around the old Irish begging bowl? Read this and weep: http://www.entemp.ie/press/2009/20090430.htm Tanaiste Concludes Successful Enterprise Ireland Mission to Saudi Arabia and Qatar Tanaiste and Minister for Enterprise, Trade and Employment, Mary Coughlan TD, today (Thursday 30th April 2009), concluded the Enterprise Ireland Trade Mission to Saudi Arabia and Qatar by opening the new Qatar Head Office of the Kentz Group and holding a series of high level meetings at the Qatari Science and Technology Park, the Ministry of Municipalities (Public Works), and Qatari Diar Real Estate and Investment Company. The week long Mission visited Riyadh and Jeddah in Saudi Arabia and Doha in Qatar. The 64 companies on the Enterprise Ireland Trade Mission participated in c. 1,500 one-to-one and sectoral group meetings with existing and potential customers. The majority of these were first time introductions particularly in the engineering, project management and environmental services sectors related to the construction industry and many of the Irish companies were called back for follow-on meetings. A number of companies and organisations made announcements of agreements reached during the mission including the PM Group, Tetco-Voxpilot, Norkom Technologies and the Institutes of Technology in Athlone, Galway-Mayo, and Waterford. Speaking at the end of the Trade Mission the Tanaiste said: ""The Gulf region is a vibrant part of the world with substantial opportunities for our internationally traded services companies. The Governments of Saudi Arabia and Qatar are investing heavily in future proofing their economies in areas like physical infrastructure, the environment and communications. And they are open to working with overseas companies and consortia that can contribute to the realisation of their ambitious plans. The proposition put forward by our companies is value added expertise, products and services, with built-in flexibility and, above all, value for money. The clear message to global markets is Ireland is open for business and Irish companies are coming to talk to you about how they can contribute to your success"". According to Frank Ryan, Chief Executive Officer, Enterprise Ireland: ""Our client companies continue to demonstrate an unstinting commitment to the development of new market opportunities for their international growth while consolidating and deepening their relationships with existing customers in their more established markets. For many of the companies on this Trade Mission it is a first step and a major milestone in what will be a long term investment in their future success here. They all realise that true, lasting success is not an overnight phenomenon. It requires determination, stamina and, above all patience. I have every confidence that our companies have all the attributes required for major success in the Gulf Region"".",True,t3_8gdos,0,c098xuw,1425962821,1241169825,t1_c098xuw,0,False,t3_8gdos,t5_2qh2p
CaspianX2,2,worldnews,0,0,False,,,,"I see this article's author hasn't used America (The Book): A Citizen's Guide to Democracy Inaction's handy Media Newsworthiness Body Count Conversion Rate:

&gt; 2,000 Massacred Congolese = 500 Drowned Bangladeshis = 45 Fire-bombed Iraqis = 12 Car-bombed Europeans = 1 Snipered American.

To get the same news coverage as that one American infant killed by the swine flu, you'd need 2,000 Congolese women raped and killed. 126 just doesn't cut it.",True,t3_8gs3n,2,c098yja,1425962829,1241174428,t1_c098yja,0,False,t3_8gs3n,t5_2qh13
ReligionOfPeace,2,offbeat,0,0,False,,,,"Absolutely correct. Maggots are widely used in UK and Europe and increasingly in the US. They are extremely effective in promoting the healing of ulcerated sores common to diabetics.

The use in frostbite cases and gangrene is also common.",True,t1_c098yos,2,c098yqo,1425962832,1241175653,t1_c098yqo,0,False,t3_8h00r,t5_2qh11
[deleted],-1,business,0,0,False,,,,"We already use cap and trade to deal with SO2 and NOx.  It works pretty well.

Europe does it on CO2 and once they worked out some initial kinks (due mostly to them not having accurate initial production figures), it's worked well there too.

This article is worse than useless.  Reading it will actually make you dumber.",True,t3_8gxn5,-1,c099073,1425962852,1241182286,t1_c099073,0,False,t3_8gxn5,t5_2qgzg
Lewsut,3,gaming,0,0,False,,,,"While I was in South America I don't think I saw one legal piece of software, yet it's always the US and Europe's fault that these CEOs can't make more on top of their already bloated wages.

Go to online distribution, fire unneeded wastes of cash, charge $5, sorted.
",True,t3_8gtou,3,c09909u,1425962853,1241182533,t1_c09909u,0,True,t3_8gtou,t5_2qh03
artied,-4,geek,0,0,False,,,,"Where have you been for the last ten years - hiding in the ghetto commonly called the USA??

This gear has been standard issue to the French firefighters and other on the continent of Europe (that the one on the right as you look at a globe)

Wake up - the internet has gone global if you haven't!",True,t3_8h0rt,-4,c0990uo,1425962860,1241184192,t1_c0990uo,0,True,t3_8h0rt,t5_2qh17
BrianBoyko,51,politics,0,0,False,,,,"The downfall of the Republicans wasn't their arrogance.  In fact, I think the arrogance is all they have left.  

What was really their downfall was that they couldn't hid the results of Republican policies anymore - things got so bad that they couldn't be explained away or distracted from. 

Conservatism is based on a facade that the poor and middle class do better when the rich do better; that the ""American lifestyle"" is measured by the most ostentatious of us and not by the most meek of us, that a society with 100 billionaires, 10000 Millionaires, and 10,000,000 homeless is better than a society with 10 billionaires, 100 Millionaires, and 10,000 homeless.  

They just couldn't hide that anymore - couldn't distract, couldn't confuse, couldn't make everything seem okay.  

And a great deal of that is due to the Internet; otherwise, you'd get your news from TV, where they did a very good job hiding the problems.  It's not just news, either, but how many of us are jealous of the lives our fellow European Redditors lead?  Would we even know how good they have it if it wasn't for the Internet, or would we just ignore anything in the world not located on the North American continent?  

The downfall of the Republicans was that they put bad policies in place and tried to sell them as good policies, and they didn't work, and we knew it.  

",True,t3_8h11l,51,c0991j2,1425962881,1241185997,t1_c0991j2,0,False,t3_8h11l,t5_2cneq
miasma66,-2,worldnews,0,0,False,,,,"Yeah my rant was more in general terms; this EU subsidy isn't particularly what I was on about.

There is the Civil List yes, but they sneak a hell of a lot else in as well - flights in RAF aircraft to go and play golf, for one example. Or the fact that the (taxpayer funded) armed forces act as free security - that's also not included in the list. On a slight side note I love the way monarchists say 'it's only 70p a year each' or whatever the figure is in an attempt to justify it, but there's 60m+ of us! 70 pence x 60 million is a fuck of a lot of money, even if it's not that much per person.

Agreed there's a lot of other injustices in British society (I can rant about those as well if you want :D), but this has always been a particular bugbear of mine. I think the abolition of the monarchy is an essential step forward into modernity. Tourism is NOT an acceptable reason to maintain the status quo.

Oh, and re. your last point - she knows how to crouch down next to one when there's a photo opportunity, not quite the same thing... I'll eat my hat if you can prove she has changed a single tyre in her life.",True,t1_c0991ij,-2,c0991ut,1425962882,1241186806,t1_c0991ut,0,False,t3_8h081,t5_2qh13
