author,ups,subreddit,downs,gilded,score_hidden,author_flair_css_class,distinguished,author_flair_text,body,archived,parent_id,score,id,retrieved_on,created_utc,name,controversiality,edited,link_id,subreddit_id
[deleted],8,obama,0,0,False,,,,"German efficiency is how we know the Holocaust was real.  They kept some pretty accurate records (using IBM equipment) of the horrible things they did.  I never understood the whole Holocaust denial thing, all those people didn't immigrate from Europe after the war for the fun of it.    

If your still not a believer you could take a walk down to your local place where the vets hang out.  Here it's called the Royal Canadian Legion, but whatever country you have live you will have something similar.  They will point you to someone who can give an eye witness account.",True,t3_8hrxq,8,c09bs89,1425964496,1241469750,t1_c09bs89,0,False,t3_8hrxq,t5_1a8ah
rue,1,AskReddit,0,0,False,,,,"A double Economics major here (don't ask) 
First one in ""Political Economy"" and second in ""European Studies in Economics"". 
I said, don't ask.",True,t1_c09bn8w,1,c09bsp9,1425964498,1241470455,t1_c09bsp9,0,False,t3_8hrse,t5_2qh1i
outsider,2,Christianity,0,0,False,oca,,Orthodox Church in America,"&gt;Putting people in a job that they're incapable of, due to being a member of a group (religion, race, gender, whatever) is very much political correctness. I believe Americans call it affirmative action?

Affirmative action and political correctness aren't the same thing. Political correctness is why people say African-American instead of black, shouldn't refer to the 9-11 hijackers as Arab or Muslim, [why some Christians have been ordered to remove crosses from their necks or be fired](http://www.dailymail.co.uk/news/article-410299/Christian-BA-employee-legal-action-suspension-wearing-cross.html), it's happy holidays instead of merry Christmas, it's why thought can be a crime particularly in Europe, why people actually suggest calling illegal aliens in America ""undocumented workers"" as an example. It's essentially a self-segregating behavior when certain groups are removed from the whole lest they offend 10 people. It was political correctness that terminated her from the program for taking her supervisors advice in refeerring the student.

It also isn't affirmative action as affirmative action is the doctrine that minorities must fill some sort of a quota. It is designed to specifically improve women and minority economic status.

&gt;Her assigned texts didn't excuse her from dealing with people because of their sexuality. They just said in extreme circumstances referral could be a last resort. It was her first resort.

Her first resort was to consult with her instructor, as per the guidelines she is expected to follow and as the book states. Refer to 235-236 of Knowing Your Values a attached to the PDF towards the end. It's a specific addressing of why this student was expelled from her program verifying that in fact nearly half of councilors have to make referrals when it comes to sexuality. In fact referrals are taught and suggested as an option for irreconcilable differences in general. In fact this is from the ACA code itself:

&gt;A.11.b. Inability to Assist Clients
If counselors determine an inability
to be of professional assistance to
clients, they avoid entering or con-
tinuing counseling relationships.
Counselors are knowledgeable about
culturally and clinically appropriate
referral resources and suggest these
alternatives. If clients decline the sug-
gested referrals, counselors should
discontinue the relationship

Available [here](http://209.85.173.132/search?q=cache:4ugIjtl38bUJ:www.counseling.org/Files/FD.ashx%3Fguid%3Dab7c1272-71c4-46cf-848c-f98489937dda+ACA,+2005,+A.11.b&amp;cd=2&amp;hl=en&amp;ct=clnk&amp;gl=us&amp;client=firefox-a)

&gt;It would be a shame if someone like her could get a qualification from a normal university. I could see her getting one from some Christian uni, and advertising herself that way. That would be fair enough. But advertising herself as a proper councellor when she stands firmly against the available science in the field, is just false advertising. It makes the degree worthless. I can see why the university doesn't like it.

So you are suggesting a Christian with traditional Christian values shouldn't be allowed to achieve certain degrees? There are laws protecting that. There are state and federal laws protecting that as well and to say she shouldn't be allowed to practice seems to imply that at least 40% of counselors shouldn't be allowed to be counselors since that is a statistic cited in the book specifically for this issue. The ACA code does go into further detail on these types of things. See section D2A, A9B as well as earlier noted references that relate to referrals. And no counseling isn't a science and really neither is psychology in the sit down and talk sense of the word as opposed to psychology which studies human behavior.

Those instructors need to go through remediation and have their belief systems changed to better fit their position inn a publicly funded institution so that they can recognize when they are or are not discriminating. In this instance they are explicitly discriminating against someone who is legally protected from discrimination.",True,t1_c09bcxe,2,c09bt0t,1425964501,1241470938,t1_c09bt0t,0,False,t3_8gxns,t5_2qh6c
mutatron,1,worldnews,0,0,False,,,,"The 500 harks back to post-war Italy when all the Europeans were making tiny cars. They brought it back when the Mini got popular.

But what about [Croma, Linea, Grande Punto, Bravo, Sedici, Panda](http://www.fiat.com/cgi-bin/pbrand.dll/FIAT_COM/showroom/selectModel.jsp?BV_SessionID=@@@@1044431576.1241471355@@@@&amp;BV_EngineID=cccdadehegmmelkcefecejgdfkhdfjj.0&amp;categoryOID=-1073761346)? I like their lineup, but I guess it'll be a while before we know what's coming over here. ",True,t1_c09bryi,1,c09bti5,1425964509,1241471805,t1_c09bti5,0,False,t3_8hqpk,t5_2qh13
happyjuggler0,2,business,0,0,False,,,,"That link is about overall tax revenues from all sources. This debate is about corporate tax rates.

If you look at my link from above you'll see that those countries have lower corporate tax rates than the US (why do they do that?), while they have significantly higher tax rates in personal income, social security, sales taxes, and some of them even actually even have a wealth tax.

Personally I think that European countries that are trying to raise as much tax revenue as they can, but which at the same time have lower corporate tax rates, are telling us something very important. Namely that high corporate tax rates are a bad way to raise tax revenue since they hurt the economy by reducing competition for workers.",True,t1_c09bufc,2,c09buro,1425964526,1241474056,t1_c09buro,0,False,t3_8hov5,t5_2qgzg
basilisk,2,reddit.com,0,0,False,,,,"I thought this was the widely-accepted view. For example, Gordon Brown is currently trying to copy some parts of this particular aspect of US culture for the UK, though my bet is it won't work.

France and UK are excellent examples how *not* to handle immigration. In Europe, we don't really know how to do that (never had to learn). In recent years, though, the US example hasn't been as stellar as before, so who knows what will happen next.",True,t1_c09bt3z,2,c09bv71,1425964529,1241474814,t1_c09bv71,0,False,t3_8hpen,t5_6
kopkaas2000,5,reddit.com,0,0,False,,,,"&gt; Maybe an affirmation of shared values is important for a nation as diverse as ours.

I can see that. There's also relatively very littie history to fall back on. It absolutely makes sense that those factors inspire a much more active idea of patriotism and its symbols than what you'll get out of the average European. 

&gt; Is it indoctrination? I don't really think so. Unfortunately, I don't think most kids understand what it's about.

I think you're contradicting yourself here, though. Can't you see how, whether it is voluntary or not, for someone not growing up on it, this whole pledge thing looks not just creepy, but [IBM company song](http://www.youtube.com/watch?v=L9oh3gqOEKU) creepy? 

Little kids doing the Gettysburg address: cute. The same kids saluting a flag: spooky echoes of nazis and communists. That's my mental association. Of course my perspective is colored by growing up in a Europe that, to be honest, never really got over World War 2. It left us with a feeling that nationalism is not something one should overindulge in.",True,t1_c09buxg,5,c09bvsq,1425964538,1241475874,t1_c09bvsq,0,False,t3_8hpen,t5_6
[deleted],2,politics,0,0,False,,,,"Jesus was NOT a jew- this term jew does not exist as far as we are concerned. The Quran talks about the children of israel- israel being the other name of Jacob. They were a select tribe that descended from him. Now you have kazars and other european half-breeds that call themselves jews but follow a deviant religion and ideology. It is outrageous that they believe the prophets of Allah, including Jesus and Moses, are anything like them.

Unfortunately, these so called jews have been commiting their same transgressions long before their was ever a state of israel. Therefore it is clear that it is not the ""israelis"" who are to blame, but the jews themselves, who believe they are the superior ""chosen"" people of Allah and have a license to do whatever they want to others, who are simply cattle. I could post the relevent Talmud verses but then youd probably dismiss it as more antisemetism.

It isnt about race- its about what the so called jews believe. Their beliefs and mentality is what gives them the license to kill any of the gentiles without any morals. As well as to practise all manners of transgressions that are forbidden to other religions. Obama has allready prostrated himself before AIPAC and the israeli lobby, he has made it clear that he is nothing more then a new face workign for the same old powers behind the scene.

Muhammad himself intially had good relations with the jews. But the jews behaved treacherously again and again; they tried to sew sedition, they gave assistance to the enemies of Islam during war time, they tried to assassinate him on multiple occasion, they lied and slandered jews who converted to Islam, and transgressed repeatedly until there was no choice to expell them from the Arabian peninsula. This is the nature of the jews due to their beliefs.. no one can live with them.. they are destructive to every society they engage in, and the end result is always their expulsion, whereupon they move to a new society to repeat the process. It is a simple matter of history. I think a people who wage war against God Allmight Himself certainly wont be looking to make peace with any human beings around.",True,t1_c09bvvd,2,c09bxf2,1425964558,1241478778,t1_c09bxf2,0,False,t3_8hsbm,t5_2cneq
[deleted],6,AskReddit,0,0,False,,,,"I live in Greeley, so I actually ride a cow to work.

Also, to any confused Europeans, just because the Grand Canyon might be called the Colorado Canyon in your language does not mean that it is actually in Colorado. ",True,t1_c09burl,6,c09by45,1425964567,1241480144,t1_c09by45,0,True,t3_8htrf,t5_2qh1i
[deleted],0,Economics,0,0,False,,,,"Most Americans are educated from a inferior school system for the last 35 years where you can't fire a teacher due to the dominance of unions, school standards are continully being dumbed down so more can pass and diplomas are handed out thoughtlessly. Kids in Japan and Europe are far more capable.",True,t3_8hpxu,0,c09by6t,1425964569,1241480307,t1_c09by6t,0,True,t3_8hpxu,t5_2qh1s
oconostota,1,worldnews,0,0,False,,,,"I meant it was eugenics if you were going to require intelligence testing before breeding.

And actually that sterilizing stuff is being talked about in Europe now. It hasn't gone away by any means.

Controlling reproduction is a vital part of controlling a society. A key point of controlling reproduction is having the power to snatch children from parents. I do not think the government has a right to behave this way under any circumstances.",True,t1_c09bmra,1,c09bydw,1425964572,1241480693,t1_c09bydw,0,False,t3_8how0,t5_2qh13
SuperConfused,2,Economics,0,0,False,,,,"What they are implying is not that you we are stupid. What they are trying to illustrate is that the one word does not work.  It conveys a number, but not a meaningful number.  I am sure you knew that a trillion is a thousand billions, but what does a $1 billion dollars buy? $1 billion is so far removed from most peoples perspectives from the numbers they deal with on a regular basis that it does not make any actual sense to them, and we see ""BIG NUMBER""

The average high school grad makes about $1.2 million in their whole lives, while the average MBA can expect to earn $4.4 million. That is their entire lives. That means the average high school graduate would have to work 833 years and 4 months to make a $1 Billion while the average MBA would have to work 227 years and 3 months to make $1 Billion dollars.  

Sort of like how the EU shows fuel efficiency: They show it as GP 1000 M as opposed to MPG. 

The way they show a 30 MPG car would be  33.3 gallons / 1000 miles (except they use kilometers) 
at just $2.00 that comes to $66.60 to drive 1000 miles where as a 12 MPG car would be 83.3 gallons / 1000 miles and at $2.00 that comes to $166.60 to drive 1000 miles.  

This shows the cost in a way you can more easily see.  Just showing the raw numbers means nothing if you have no point of reference to tell you what the number means.  

Doesn't mean you are stupid; it just means you have no point of reference. ",True,t1_c09bjrw,2,c09bys5,1425964576,1241481414,t1_c09bys5,0,False,t3_8hpxu,t5_2qh1s
[deleted],3,AskReddit,0,0,False,,,,"As a volunteer with non-profits that deal with the antiquities trade, I further this sentiment.

You may not know this, but it's likely you helped trafficked in the trade of stolen coins. Coin sellers on the internet are the most recent technological manifestation of archaeological looting.

Often, coins are mixed with other less valuable coins, some even modern fakes. They can also be mislabeled as far as the hoard (cache) they may have been found in. They may have obtained the coins in a grey market such as Bulgaria or as part of a drug trade. The selling of stolen antiquities purchased with dirty money is a profitable side-business for gangs, notably in Miami with its networks to South America and Europe.",True,t1_c09by8w,3,c09bywz,1425964579,1241481697,t1_c09bywz,0,True,t3_8htmq,t5_2qh1i
mredd,0,worldnews,0,0,False,,,,"It's not a dishonest argument and when I changed something I did it for obvious reasons. The South-Africans wanted a white-only country. You want a Jewish-only country.

Yes part of Israel's citizens are non-Jewish but they don't have the same rights as Jews, for example in owning land and marriage and in the job market.

Western European countries don't have different laws for their citizens depending on their religion or ethnic origin. Israel has that.

South Africa moved black people out from South Africa to ""home lands"" to make sure that they couldn't be South African citizens. When they lived there they were controlled by the South Africans and worked in South Africa they just didn't have any rights. This is how Israel treats the Palestinians they occupy in the West Bank, Gaza and the Golan Heights.

So you are a racist and a Jewish supremacist.",True,t1_c09bscz,0,c09bzbc,1425964584,1241482541,t1_c09bzbc,0,True,t3_8hhv8,t5_2qh13
mexicodoug,3,reddit.com,0,0,False,,,,Somebody figured out most of them (us) are more Red Injun than European.,True,t1_c09bqw2,3,c09bzbf,1425964584,1241482542,t1_c09bzbf,0,False,t3_8hn3l,t5_6
Ortus,3,science,0,0,False,,,,"And that's how we show the market does not have a magical solution for everything.

For our next lesson, we are going to study Scandinavian Social Democracies and the European Social Model.

Stay tunned folks!",True,t1_c09bya8,3,c09bzxh,1425964591,1241483774,t1_c09bzxh,0,True,t3_8hsgz,t5_mouw
[deleted],1,atheism,0,0,False,,,,"Not really. In most wealthy families, the oldest son used to inherit his Lordship's fortune. The younger one(s) had the option of living out his life in penury or as his brother's hanger on, in the hope that the brother would die soon enough, so that he could take over. Considering the high mortality rate of the day, not an option without merit.
Other ""spares"" elected to join the church hierarchy. Like the useless, unmariageable daughters who entered a convent, a substantial membership fee to join was required. The benefits of sinecure made it worthwhile.

Europe thru the Middle Ages was seriously underpopulated with mostly pagans. If the new cult was to succeed, its wandering proselytizers had to be made spouseless to survive the ""roads"" full of highwaymen in the business of get-rich-quick. Most travel was done on foot. Neither of the aforementioned is conducive to family life.",True,t3_8hlpu,1,c09c1sg,1425964616,1241487996,t1_c09c1sg,0,True,t3_8hlpu,t5_2qh2p
sarahfailin,-5,funny,0,0,False,,,,"i can't believe someone would say something so stupid and ignorant and get voted up. wtf is ""eastern european curse?"" did you just make that up? are you jealous because you live in a country whose women were beaten with the ugly stick like england and the us? eastern european women are fucking gorgeous. they are truly the most beautiful and smartest in the world.
as far as the ""babushkas"" go, they are, as the name says, grandmothers-- women in their 60's and 70's. what the fuck do you expect women that old to look like?",True,t1_c09beri,-5,c09c2jq,1425964627,1241489783,t1_c09c2jq,0,True,t3_8hnef,t5_2qh33
defrost,6,Equality,0,0,False,,,,"Giant dicks can be a real problem for guys.  

(disclaimer: no, not me .. :-) )

They end up being defined by them, they have issues even finding condoms, etc.  

I get a lot of interesting stories from an old buddy of mine, he graduated through from being an airforce (RAAF) silver service batman and 'fixer' through to being butler for European royalty, to working in the Dutch coffee shop scene as ""responsible guy"" to now coming back home and owning one of the larger (upmarket) sex shops in the city.   

He's more your BAM! slightly above average penis guy (as far as I know &lt;shrug&gt;) but he has backed up the Stones article by way of tales about the ""special order"" guys that have to drive miles to get condoms, and the women that pursue them.  

All genders have issues, if it (or they) aren't to big then it's (or they're) to small.  ",True,t3_8htzn,6,c09c3om,1425964640,1241492341,t1_c09c3om,0,False,t3_8htzn,t5_2qtp5
sisyphus,1,guns,0,0,False,,,,"I bought a CZ82 recently and I'm very happy with it so far.  9x18 is common and pretty cheap and still fires relatively hot.  If you want quality, look to the Europeans.",True,t3_8hhfv,1,c09c4ql,1425964653,1241494809,t1_c09c4ql,0,False,t3_8hhfv,t5_2qhc8
portmanteau,3,WeAreTheMusicMakers,0,0,False,,,,"Can't tell if you're joking or not.  In case you're not, outside of Europe, the note a half tone below C is called B, not H, and the note a whole tone below C is called B-flat, not B.
",True,t1_c09c4jc,3,c09c5ie,1425964663,1241496772,t1_c09c5ie,0,False,t3_8husf,t5_2qmah
breakneckridge,8,WeAreTheMusicMakers,0,0,False,,,,"I threw in the ""goes to 11"" to show I was joking, because winky emoticons tend to get downmodded on reddit for some reason.

EDIT: wait are you saying that in Europe they have an H chord?!  I think you jest.

EDIT 2: Holy cow, you weren't kidding!

http://www.guitarsite.com/newsletters/010122/12.shtml
",True,t1_c09c5ie,8,c09c5n0,1425964665,1241497087,t1_c09c5n0,0,True,t3_8husf,t5_2qmah
synthespian,9,WTF,0,0,False,,,,"That's what you think. Religious people will see girls in bikinis and say it's sexual.

Let me tell you a story: I live in Brazil, the land where bikinis are tiny *for all ages*. A nice thing on a young women - a vision of horror in a fat old lady. American bikinis are considered ridiculous by Brazilian women - too big, too puritan, too stupid-looking. ""Why the hell would you wanna cover your whole boobs and butt? You'll look ridiculous after you get a tan"", the argument goes. I see the logic. I think some European chicks get what I'm saying, too...Heh.

So, anyways, one day me and the wife have this foreign friend over, we show him family pictures. One of them is our niece, with 3 years old and a mini-skirt. The guy says Brazilian girls are ""sensual"" from a very young age. We went ""say what?"" all over him. ""No, dude, she's just 3. She's not sensual.""

Moral: some peoples can't really see the human body without having their brains explode. Now, US Americans are proud of their  puritan heritage. Puritanism bred the religious right-wing and Playboy magazine. When a puritan sees some flesh, his brain explodes. There are a lot of those so-called ""good, Christian folk"" in your government. It's like the old communist party infiltration in all aspects of life, but in reverse. The majority of Americans think religious people are alright. But they are not. They hate this life. They send grandmas to jail.",True,t1_c09bn6j,9,c09c6zy,1425964685,1241500621,t1_c09c6zy,0,True,t3_8hqkp,t5_2qh61
synthespian,0,WTF,0,0,False,,,,"So, then, where does the human mind start to function in a situation like this? The thing was company policy, that just reported to the police, who also followed policy and began to move their chopsticks to get Donna in jail. So: policy --&gt; policy ---&gt; policy ---&gt; jail.
WTF? What do people have brains and emotions for?
One good thing about America is that Donna's gonna probably become a millionaire and will probably put it all in her will so the little 3 year-old can start a brand new life in Europe or Canada.
",True,t1_c09bjzr,0,c09c7h5,1425964690,1241501905,t1_c09c7h5,0,True,t3_8hqkp,t5_2qh61
eleitl,1,apple,0,0,False,,,,"&gt; The market penetration for the Android platform is pretty low at the moment

Sure, but I can always hack root on the handset, pick up an SDK and work in a familiar environment.

&gt; I can't help but feel that the G1's poor hardware

G1 wasn't really available in Europe, so the second-gen hardware (HTC Magic and soon Samsung) is the only hardware people have seen so far.",True,t1_c09c6pj,1,c09c8s1,1425964706,1241505975,t1_c09c8s1,0,False,t3_8hq6l,t5_2qh1f
[deleted],2,funny,0,0,False,,,,"""a man with a thick, Eastern-European accident""

Why do proofreaders not exist on the Internet?",True,t3_8htxv,2,c09c8sg,1425964707,1241506029,t1_c09c8sg,0,False,t3_8htxv,t5_2qh33
sysstemlord,4,WTF,0,0,False,,,,"It's 9 minutes past midnight, he lives in Europe, we found him",True,t1_c09c88r,4,c09c9f3,1425964714,1241508468,t1_c09c9f3,0,False,t3_8hvvd,t5_2qh61
summernot,1,business,0,0,False,,,,European corporate tax rates are lower than rates in the US. The US has the 2nd or 3rd highest corporate tax rate in the developed world.,True,t1_c09bgh9,1,c09c9nh,1425964717,1241509374,t1_c09c9nh,0,False,t3_8hov5,t5_2qgzg
LordVoldemort,2,funny,0,0,False,,,,"&gt; wtf is ""eastern european curse?""

Firstly, I think it was a joke. Secondly, The Iron Curtain was perhaps a heavy burden on the women of that era?",True,t1_c09c2jq,2,c09ca1u,1425964722,1241511162,t1_c09ca1u,0,False,t3_8hnef,t5_2qh33
yottskry,2,worldnews,0,0,False,,,,"I never thought I'd see the day when the EU would be acting in favour of the common citizen.

I'm actually starting to like the EU a bit more now.

It's really sad that lately in Britain it's been unelected assemblies (the EU and the House of Lords) that have had to keep the elected Government in check with regards to human rights issues.

Time to jump, Gordon. You won't be missed.",True,t3_8huju,2,c09camh,1425964730,1241513919,t1_c09camh,0,True,t3_8huju,t5_2qh13
G_Morgan,1,worldnews,0,0,False,,,,Slavery was banned pretty much as soon as the trade took off. It wasn't a thousand years of slavery before it was banned. For most of that time the European nations were content to kill each other and launch crusades. The slave trade didn't take off until much later and thus there was no reason to ban it.,True,t1_c09ca0e,1,c09ccmg,1425964756,1241524638,t1_c09ccmg,0,False,t3_8hrgl,t5_2qh13
schnuck,2,pics,0,0,False,,,,it's a bit sad that the country who spies on its citizens on the streets and on the intertubes is in the EU.,True,t1_c09cat9,2,c09ccup,1425964759,1241525603,t1_c09ccup,0,False,t3_8htsw,t5_2qh0u
