author,ups,subreddit,downs,gilded,score_hidden,author_flair_css_class,distinguished,author_flair_text,body,archived,parent_id,score,id,retrieved_on,created_utc,name,controversiality,edited,link_id,subreddit_id
silence_hr,0,worldnews,0,0,False,,,,"I really don't see a problem with more unification. Europe had too many wars in the past and we really don't need to slaughter each other every decade or two.

I lived through breakup of Yugoslavia, lost my best years during the war for what? Friends dying? People running from their homes? Cities leveled to the ground?

Yes to unification, yes to common currency, yes to EU. Why shouldn't we all live better lives? 

""Global elite"" ... people with means and ideas thought that less war and more progress is good? Damn them, we should burn them on a stick and slaughter few thousend people in neighbouring country to jumpstart a war or two.
War is good, fuck peace. It's really fucking great to be waken up by fucking cluster bombs or some shit like that.",True,t3_8j1oj,0,c09g011,1425966954,1241851263,t1_c09g011,0,False,t3_8j1oj,t5_2qh13
[deleted],3,science,0,0,False,,,,"&gt; Irish head is one of the largest in Europe

I knew it!",True,t3_8j1ee,3,c09g0hx,1425966960,1241853689,t1_c09g0hx,0,False,t3_8j1ee,t5_mouw
seltaeb4,6,worldnews,0,0,False,,,,"Of course they did, you idiot.

Discussions about a European Union began in 1951, and the Treaty of Rome was signed in 1957.

Even so, your point is... ?",True,t3_8j1oj,6,c09g0p4,1425966963,1241854753,t1_c09g0p4,0,False,t3_8j1oj,t5_2qh13
LeChuck,1,news,0,0,False,,,,"It's a sad day for democracy when an unelected body like the European commission has been 
granted such enormous powers. I really hope Obama will give them the finger, he probably
won't but I can only hope.

P.s. I am European not American.",True,t3_8iyqh,1,c09g141,1425966972,1241857266,t1_c09g141,0,False,t3_8iyqh,t5_2qh3l
mac71,1,worldnews,0,0,False,,,,"Same shit here in Austria. Austrian politicians always take a look at Germany and make the same decisions a few months later. The ""change"" in the EU goes directly opposed as in America. ",True,t1_c09g0l5,1,c09g1bx,1425966975,1241858670,t1_c09g1bx,0,False,t3_8iz2c,t5_2qh13
brunt2,-1,AskReddit,0,0,False,,,,"you seem confused that your own stupid little state goes for other states and even the rest of the world (don't worry such a trait is common to idiots). what ive written are facts. you have nothing other than a cultural prejudice/hangup with a hard line on teen-adult that means nothing in reality.

the only thing creepy here is your attachment to a social construct, that some other  states and many nations disagree with. age of consent in europe is 14-15, sometimes less......You are such a freaking dumbass  though (and just as ignorant) that you wouldn't know any of this, you only spread your ignorance as derived from the little bubble world you live in (and btw, there is no 'upper end'  age of consent, you retards simply like to make that up as extra rules and guidelines for your grossly narrow, deficient understanding of people and the world around you) ",True,t1_c09cix4,-1,c09g23x,1425966984,1241863551,t1_c09g23x,0,True,t3_8hovj,t5_2qh1i
unsee,4,worldnews,0,0,False,,,,US = EU + 8 stones,True,t1_c09fzqp,4,c09g2na,1425966990,1241867518,t1_c09g2na,0,True,t3_8iz2c,t5_2qh13
[deleted],1,socialism,0,0,False,,,,"It would be interesting to talk about specific Socialist movements in countries.

For example, www.joehiggins.eu",True,t3_8j3c1,1,c09g2ny,1425966991,1241867652,t1_c09g2ny,0,False,t3_8j3c1,t5_2qjii
[deleted],1,WTF,0,0,False,,,,"Switzerland isn't in the EU. 

As for Austria, it was Hitler's birthplace so it's understandable and the guy was more than an Holocaust denier. 

All I'm saying is that these cases are very rare and the very few people who are condemned are nutjobs anyway. If I go to my local supermarket and say ""the holocaust never happened"" nothing's gonna happen except maybe a slap in my face, which could happen in the U.S. as well.",True,t1_c09fv3y,1,c09g2sg,1425966991,1241868483,t1_c09g2sg,0,False,t3_8izdg,t5_2qh61
[deleted],10,worldnews,0,0,False,,,,"No, it's not like China. It's more like most of Europe. This is 1 link being suppressed incompetently, not a Wall of China-like firewall. Labour's internet filter idea has been abandoned.

It's not good, by any means. But it's not China.

And as an Aussie I vote Green, which is the only party clearly against this nonsense, so my conscience is clear.

As other people have pointed out, our problem in Australia is that we don't have a bill of rights that clearly protects freedom of speech. We need to get that sorted out and _then_ take on this bullshit.",True,t1_c09g0pc,10,c09g44t,1425967007,1241876139,t1_c09g44t,0,True,t3_8j2v9,t5_2qh13
[deleted],2,reddit.com,0,0,False,,,,"Not where I live. At least not according to every server I have EVER spoken to. Including my girlfriend, the servers I worked with, the servers I go to school with. etc etc etc. So maybe you live in the United States, and maybe I live in a small capital city in Canada. Some things are not constant everywhere.

As people here have said, in Europe (Italy, Croatia, Slovenia especially in my experience) the tip is included in the bill and it is not expected. So this 20% standard isn't exactly a standard.",True,t1_c09g5c2,2,c09g5h1,1425967028,1241881033,t1_c09g5h1,0,False,t3_8j27x,t5_6
aenea,4,SuicideWatch,0,0,False,,,,"Is there any chance that you could relocate for a period of time to a place where you could access in-patient treatment?  Do you have family or friends who could help you with that in North America or Europe?  I realize how difficult a move like that might be, but if it can be arranged at all it might help. 

I know how difficult it is when you're on a mix of different medications, especially when they're designed to do different things.  I think that one of the problems may be that no one really understands how more than 2 or 3 medications interact with each other- there aren't even studies done when you get up to a combination of 3 of them. 

I know that there are therapists who do therapy over the phone- it's obviously not ideal, but it might be better than not having anyone at all. I can help you look into that if you'd like.  

What kind of baby steps have you been taking?  I'm not trying to pry, but we may be able to come up with some other suggestions if we know what you've already tried. 

I'm so sorry that you're going through this, and I admire your courage in posting.  Please always feel free to talk to us.  You're not out of options yet, and maybe we can help you find them.









",True,t1_c09g42t,4,c09g5ht,1425967028,1241881095,t1_c09g5ht,0,False,t3_8j4vc,t5_2qpzs
Stormflux,1,politics,0,0,False,,,,"Got it.  From a European point of view, the US is too conservative; so obviously the solution is to listen to the conservative think tank known as the Hoover Institution!",True,t1_c09fy3d,1,c09g5re,1425967034,1241881955,t1_c09g5re,0,True,t3_8iyeu,t5_2cneq
c6222,1,reddit.com,0,0,False,,,,European central bank gets with the program,True,t3_8j5nt,1,c09g5yo,1425967037,1241882600,t1_c09g5yo,0,False,t3_8j5nt,t5_6
nyere,3,science,0,0,False,,,,"""Irish head is one of the largest in Europe""  :D",True,t3_8j1ee,3,c09g6lc,1425967040,1241884629,t1_c09g6lc,0,False,t3_8j1ee,t5_mouw
linkedlist,1,Israel,0,0,False,,,,"&gt;You do know that not all Palestinians live in Israel, right?

Oh I'm sorry, clearly they're not advocating genocide, just like Hitler they're advocating killing people of a certain race only in a certain part of the world. So these poor brainwashed Jewish kids aren't the least bit genocidal, they're not calling for the killing of all Arabs, just a few of them.

Yessum!

&gt;No, you don't. You are standing up for attacking one group for their speech and forgiving Holocaust deniers on free speech grounds. That was why you stepped into this discussion.

..

&gt;Denying something happened.. and calling for the death of all people of a certain ethnicity.


&gt;I can see how that works...

..

&gt;What in the world are you taking about? Are you now saying that Holocaust denial is an acceptable position because some people (I have no idea who, but it is your strawman) have turned it into a "" a one size fits all rebuttal for all arguments""?


Pretty much, it's used as justification for the creation of Israel, is often referred to as what happens when anti-semetism becomes popular, etc, etc. Sorry for the straw man argument but honestly the argument that holocaust denial is the same thing as calling for genocide is quite ridiculous.


&gt;That is utter nonsense. The countries of Europe did not make Holocaust denial illegal to protect Israel. They passed those laws when there was no Israel.

Oh that's right, I forgot, holocaust denial is a crime in Europe. I wonder if denying any other genocides is illegal in Europe? I can deny the darfur genocide that is presently ongoing, I can deny Armenian genocide but I cannot deny Hitlers genocide. How very emotionally created and politically kept.


&gt;Bullshit. This is like creationism, not flat Earth. **There has been plenty of ""open discussion"" of the topic**, the evidence is in and clear.

No there hasn't, especially in Europe, you know why? Because Holocaust denial is a crime in Europe.


&gt;There is no valid historical issue here. But since you have political sympathy with the deniers you will help them.

It is not about validity, it's about free speech and hypocrisy, it's about the political nature of history and how the holocaust is no longer a factual reality but rather an emotional one.

And for the record I don't have political sympathy for skinheads and I'm not a fan of trying to prove I'm right using raw emotion, in fact I condemn it. Holocaust deniers don't help my agenda at all (in fact they hurt it) but I'd rather see them freely deny the holocaust than be thrown in jail for it. Holocaust deniers cannot forever be cast aside as lunatics, in the end people will start warming up to their views in the ways I've detailed in my previous comments and it won't be a pretty day because of its implications.

&gt;So that you Nazis can continue to push you agenda?

Given if the Nazis had their way I'd probably never have been born I find that to be quite hilarious.


&gt;But censoring anti-Arab ideas, that is fine by you. It is a good thing you are not agenda driven, right?

If someone got up and said 'Saudi Arabia oppresses women and its government should be over thrown' I wouldn't have a single problem with that (for a variety of reasons), if someone said 'kill the Arabs' well, that's suspect to say the least, I'm as against kill the Arabs as I am kill the Jews 'free speech'.",True,t1_c09g45g,1,c09g6p6,1425967042,1241884948,t1_c09g6p6,0,True,t3_8ivyb,t5_2qhvo
aim2free,12,entertainment,0,0,False,,,,"As I've said in other places, the media industry is starting to get dangerous for the society.

It's one thing that they can't be taken seriously, but the serious thing is that they have enforced completely ridiculous laws like the DMCA which can actually put you in jail, for just doing something with material you have bought.

[DMCA](http://www.anti-dmca.org/), [DRM](http://drm.info/), and the new dangerous IPRED law here in Europe should all be banned. The new [IPRED](http://www.ipred.org/) law has already been considered dangerous as it encourages anonymity and crimes on the net.

It has also been shown that DMCA as well as DRM [has been inefficient](http://www.eff.org/issues/dmca) in reaching the goals that were intended.

There are dark forces in the society that want to strangle us slowly, and now they are also attacking our internet here in Europe. The EU commission seems to be completely corrupt regarding issues like internet and human rights, software patents, as well gene modified food (Monsanto).  Fortunately the parliament has said no to software patents and has said no to closing our infrastructure the internet.

Regarding the music and media industry, one idea I got would be to encourage everyone to stop buying new music and to stop buying new movies, from the big companies. Only watching old movies and listen to old music.

And of course, vote for the Pirate parties for EU now. The Pirate parties focuses on our human rights on the internet and to shorten copyright as well as abolishing the patent system which is obviously not working.
The patent system is only an obstacle for innovation as well as makes you a target for patent trolls. ",True,t3_8j4by,12,c09g7e2,1425967048,1241886899,t1_c09g7e2,0,True,t3_8j4by,t5_2qh0f
[deleted],2,AskReddit,0,0,False,,,,"Also, another option:

4. Restart your life somewhere else. Fly to a country that you've always wanted to go to, or move to a different state, or SOMETHING. Just sell everything you have, take all your cash and buy a plane ticket to Europe or Asia or ANYWHERE. Be sure to call your kids though -- they will appreciate it SO MUCH MORE THAN YOU CAN EVER IMAGINE. Send them postcards from around the world. Get a job doing something satisfying, something you love. Maybe even meet someone ;)

The thing is, by actually TRYING SOMETHING, you'll be no worse off than you are now.

**EDIT:** aargh can't make it #4. Just use your imagination.",True,t1_c09fxl8,2,c09g7m8,1425967052,1241887518,t1_c09g7m8,0,True,t3_8j2eg,t5_2qh1i
acowno,1,WTF,0,0,False,,,,"I did not say EU, I said Europe. As to the EU, any country in the EU can punish anyone up to three years in prison and a fine for denying the holocaust. 

In France, this guy got 3 months and a fine just for questioning the law:

Bruno Gollnisch, was fined and jailed for three months for accusing the French authorities of restricting freedom of speech in the country. 

http://english.pravda.ru/world/europe/29-04-2009/107472-holocaust-0
",True,t1_c09g2sg,1,c09g8ru,1425967067,1241890880,t1_c09g8ru,0,False,t3_8izdg,t5_2qh61
rmbarnes,-1,worldnews,0,0,False,,,,"Here here. We seem to be happy to let people from all over Europe and Muslims that seem to hate the UK flood in, but not people that fought for us?",True,t1_c09g4q2,-1,c09g8z0,1425967070,1241891473,t1_c09g8z0,0,False,t3_8j48e,t5_2qh13
Lard_Baron,1,worldnews,0,0,False,,,,"They where an asset as they held land the Egyptians wanted back. To get that back the USSR connection meant nothing, they had to speak to the US.

For Gods sake, you really think the $3B pa is down to lobbying? the &amp;1.3pa to Egypt down to lobbying? And I suppose the Iraq war down to lobbying? the US attitude to Iran down to lobbying? the overthrow of Irans democray in 53? was down to lobbying? What happened in Suez 56? the lobby took a holiday?

The IDF is a threat to every arab nation. It can be used against any target, nuclear, oil, navy, airforce, any target that will hurt them the most. But make no mistake, the IDF will not undertake any mission without the nod and material assistance from the US.  


Regarding Iran, the EU and or US will offer Iran something to abandon its search for an independent nuclear technology, talks might stall. The US will try to get the UN to agree to sanctions, a media campaign against Iran will start, Israel could then be used, a strike at one of the nuclear facilities, the US admin can say publicly ""it was Israel"" but it won't be, it will part of an over all American strategy. More pressure will be added. Maybe another strike. Perhaps poor little Israel will need to be defended and eventually the US will directly enter the fray..Israel will be used as a tool to add pressure. 

Iran has to factor this into its thoughts, What will give us the maximum benefit? Do we want to face down these strikes or settle for the EU bulding nuclear station and fueling them free? 


  

Destroy Irans nuclear infrastructure? Way not  its far vunerable more oil infrastructure?    ",True,t1_c09g8al,1,c09g93c,1425967073,1241891829,t1_c09g93c,0,False,t3_8itcm,t5_2qh13
bornfromblue,-5,science,0,0,False,,,,"Metric all the way. Being someone that moved from europe to america... it's odd to not consider things in the logical way, rather in strange fractions.",True,t3_8j6g7,-5,c09g9nv,1425967080,1241893607,t1_c09g9nv,0,False,t3_8j6g7,t5_mouw
calantus,8,technology,0,0,False,,,,I despise the EU,True,t3_8j6u4,8,c09ga94,1425967090,1241895246,t1_c09ga94,0,False,t3_8j6u4,t5_2qh16
fozzymandias,4,AskReddit,0,0,False,,,,The Dark Ages just means the era between the Fall of the Roman Empire until Europe become about as advanced as Rome had been.  It's Dark because there wasn't as much progress as a good society should have.  There's plenty of discussion about it in History Classes.,True,t3_8j6yp,4,c09gb3a,1425967101,1241897645,t1_c09gb3a,0,True,t3_8j6yp,t5_2qh1i
fatmike85,3,reddit.com,0,0,False,,,,The problem with the tipping culture is that servers want to get you in and out asap to get more tips from more parties. So you get the bill the moment you put the last piece of food in your mouth. In Europe this is seen as rude. You never feel rushed out of a restaurant and won't be given the bill until you ask for it or unless the restaurant is extremely busy. It's prefectly acceptable to sit and finish drinks and chat for a while. In America I never feel as though I can really do this. As soon as the money exchanges hands they want you out.,True,t3_8j27x,3,c09gbuy,1425967107,1241899958,t1_c09gbuy,0,False,t3_8j27x,t5_6
Shambles,0,science,0,0,False,,,,"If it were retarded, the guy who invented it would be remembered as a retard instead of a genius. And I'm saying that from the point of view of a European who's never used it for anything.",True,t3_8j6g7,0,c09gc3g,1425967109,1241900589,t1_c09gc3g,0,True,t3_8j6g7,t5_mouw
Oster,5,AskReddit,0,0,False,,,,"This is never really mentioned, but people completely rejected all things Roman, including technology.  Roman works like forts, colonial embassies, baths and aqueducts were largely destroyed.  A lot of Roman science was rejected and forgotten.  It's considered regression, but to them it was freedom.

Not long after Ming China was about to go through a renaissance.  But the monarchy realized that the merchant class would destroy royal rule, so they had entire fleets of ships beached and burned.  If that hadn't happened, China might have colonized the New World, not Europe.

Edit: This is a problem with scholarly thinking.  Marx predicted a continuous 'positive' evolution of society.  The reality is that societies break down all the time.  Most do.  Zimbabwe used to have cities of stone and technology in the 11th c, but now it lies in shambles.",True,t1_c09gbtt,5,c09gcjx,1425967116,1241901959,t1_c09gcjx,0,True,t3_8j6yp,t5_2qh1i
Jozer99,2,science,0,0,False,,,,"My understanding is that it is actually a money problem.  US companies dealing with mechanical and thermal systems are heavily invested in the ANSI system, both physically (machines that measure in inches, nuts and bolts inch sizings), and mentally (Engineers trained in ANSI system).  


Switching to metric would make these companies have to immediately replace all their machines, and retrain or replace their engineers.  I recently graduated with a degree in Engineering, and I can tell you that every new engineer has a great contempt for the ANSI system, but there is not much we can do to avoid using it except move to Canada.  


Why do I call it the ANSI system?  Well believe it or not, our units are slightly different from the British system, which is slightly different from the old European system.  For instance, the 1 American horsepower is not equal to a British horsepower, which is not quite equal to a German horsepower.  Its horrible.  SANE countries measure power in kilowatts.  


The reason these units are so messed up is that the ""Imperial"" system was designed to be used for trade, the units are intended to be easy to estimate.  For instance, a foot is about the size of a foot with a shoe on (for the average male).  A pound is a hunk of meat that is enough to feed a couple of people one meal, and so on.  But in modern, mechanized society, they are no longer useful.  ",True,t1_c09ga28,2,c09gcov,1425967118,1241902440,t1_c09gcov,0,False,t3_8j6g7,t5_mouw
[deleted],1,WTF,0,0,False,,,,"&gt; Bruno Gollnisch, was fined and jailed for three months for accusing the French authorities of restricting freedom of speech in the country.
http://english.pravda.ru/world/europe/29-04-2009/107472-holocaust-0

As I was saying, nutjobs only. [This fat fuck](http://fr.wikipedia.org/wiki/Bruno_Gollnisch) is from the far right in other a fascist-sympathetic.",True,t1_c09g8ru,1,c09gd7f,1425967124,1241904028,t1_c09gd7f,0,True,t3_8izdg,t5_2qh61
ichthis,1,skeptic,0,0,False,,,,"He can appeal, but traditionally unlikely an appeals court will disagree with what the judge originally ruled. 

Long term, if he wants to go all the way to the European Court, he will have to exhaust the UK processes first, so an appeal could be on the cards, even if everyone expects it to fail. ",True,t1_c09g5hi,1,c09gdue,1425967140,1241906096,t1_c09gdue,0,False,t3_8iwxw,t5_2qj8f
Boye,-2,science,0,0,False,,,,erhm because noone in Europe uses Fahrenheit?,True,t1_c09gbic,-2,c09ge3p,1425967142,1241906879,t1_c09ge3p,0,False,t3_8j6g7,t5_mouw
cucurigu,33,politics,0,0,False,,,,"coming from Europe, I never really understood arguments for permitting normal people to carry guns - here's my reasoning and please correct me if I'm wrong:

a) you want to use a weapon for hunting - this means you almost never carry it with you and usually it is not adapted to shootouts (no repetition, slow reload etc); this is already possible in all western countries

b) you want to use the gun for protection - this isn't a good idea because most of the time the attacker will not have a gun, but only a knife or no weapon so if you lose your cool you'll end in jail; plus most people aren't cold hearted enough to deal with a similar situation without causing a great deal of harm for a simple robbery 

c) if an attacker pulls a gun on you he will almost surely be prepared to shoot you, so now the defense theory transforms into a contest of who is a better shot even if at the beginning the gun was to be used for intimidation only; again, this will not help the average Joe as the attacker WILL be a better shot and he will now fight for his life


adding to all this the fact that most people never really learn to use their guns and more importantly, from the beginning they don't have the psychological profile to deal with tense situations no gun control laws seem to add a lot of danger to almost any situation

any thoughts ?",True,t3_8j71e,33,c09gf1i,1425967159,1241909757,t1_c09gf1i,0,True,t3_8j71e,t5_2cneq
benologist,1,business,0,0,False,,,,"The EU can be so lame.  I don't see anyone forcing any other business to bundle their competitors' stuff with their products, least of all non-MS operating systems.  

Windows users have had 20 years of immense selections of freeware, shareware and open source software, and most of them will install anything as long as you have to punch a monkey to get it.  

On top of that consider the many people who have chosen to install Firefox, Opera or Chrome, and that every iTunes user has installed Safari at least once accidentally.

Honestly it's time for browser vendors to stop blaming Microsoft and start looking at other reasons why users don't give a fuck about switching - they're competing to be the #1 piece of software that nobody really cares about - all they want is an address bar and a big space underneath that shows them the internet.  Who designed the 100 pixels above that address bar is increasingly less relevant and more boring as their featuresets merge and we're reduced to comparisons that show one is *milliseconds* faster if you're bashing refresh on some test suite.

Maybe after the EU lines their pocket with their imminent ruling that it's ""unfair"" that Microsoft isn't distributing their competitor's software they can tackle the ""problem"" of Google not redirecting 1/3 of their traffic to Yahoo! and 1/3 to Live, and then they can go after Apple for not routing 1/2 of their music sales through Amazon.com.  

Then instead of working their boards of directors can just stand around hugging each other all day, maybe making out a little, because that's obviously the way real business should be done.",True,t3_8j7ib,1,c09gf9p,1425967156,1241910563,t1_c09gf9p,0,True,t3_8j7ib,t5_2qgzg
eramos,1,pics,0,0,False,,,,"You said, verbatim: ""The fact is that no matter what the cause, the problem of pollution is always lessened when there are fewer people.""

How does it not logically follow that the problem of pollution is to exterminate the human population?

I love how the pro-human extinction people are always the first to blame every problem on overpopulation. I guess it's true that if the only tool you have is a hammer, you tend to see every problem as a nail.

There's no way pollution could be fixed through non-population culling methods, unfortunately. I mean, look at Europe - it's FILTHY! Garbage everywhere because of it's high density... oh wait, they just have proper sanitation practices.",True,t1_c09gfb9,1,c09gh8u,1425967177,1241916846,t1_c09gh8u,0,False,t3_8j6hq,t5_2qh0u
mediahater,2,reddit.com,0,0,False,,,,"Exactly.

And I'm not ready to watch my granddaughters grow up wearing a Burkha and getting lashes for looking at a boy.

If the moderate muslims don't start standing up against the radical Islamists NOW, they will be just as guilty as those leading the Jihad.

I think they will be surprised at just how cruel and violent the ""tolerant"" Europeans will be when they late in the game realize that they will need to fight, die or convert. It won't be pretty.",True,t1_c09gfoc,2,c09ghk2,1425967183,1241917686,t1_c09ghk2,0,False,t3_8j85z,t5_6
