id,subreddit,author_flair_text,ups,archived,body,link_id,parent_id,score_hidden,created_utc,subreddit_id,name,edited,score,author,downs,controversiality,gilded,distinguished,author_flair_css_class,retrieved_on
c0fapra,worldnews,,3,True,"My town? Province? No, that's not how Sweden works. Decisions are made on the level that they influence. For instance, national matters are dealt with on a national level, and local on a local level. We have representatives, but there is considerable freedom both on a ""regional"" and ""county"" level (trying do match the expressions to the americans equivalents).

While I will agree that every citizen has more power over the the decision-making process the smaller a country is, this only applies when the power structure is centralised. I think you're confusing the concept of influence and the concept of freedom. They don't necessarily mean the same thing.

How would EU have no power? Please elaborate.",t3_a0im7,t1_c0fap5u,False,1257283801,t5_2qh13,t1_c0fapra,False,3,xmnstr,0,0,0,,,1426088383
c0faqfw,worldnews,,3,True,"I was talking about the Council of Ministers, not the European Council. Yes, the European Council is still the major actor. I was saying that the co-decision process will now be standard in legislative functions.",t3_a0im7,t1_c0fafrp,False,1257284425,t5_2qh13,t1_c0faqfw,False,3,soulhammer4,0,0,0,,,1426088390
c0faqtm,IAmA,,1,True,kind of... we started a site but quickly realized that the internetz are hard to find in rural parts of Europe... so uploading photos was a nightmare. You can see what we have though here http://sacmk.primr.net/ ,t3_a0lz1,t1_c0fao3t,False,1257284762,t5_2qzb6,t1_c0faqtm,False,1,hieroglot,0,0,0,,,1426088394
c0far0m,AskReddit,,2,True,"hmmm.... i've been to about 35 countries in the last 5 years. many of them multiple times.  i've never encountered a single restriction or obstruction along the way, besides a few petty (and optional) bribes to jump some visa queues in certain countries.  oftentimes, i've crossed borders in asia and europe and nobody has even asked for my passport. i think your experience may be unique. ",t3_a0k1r,t3_a0k1r,False,1257284930,t5_2qh1i,t1_c0far0m,True,2,[deleted],0,0,0,,,1426088395
c0fascz,reddit.com,,2,True,"&gt; what the fuck else does he need, blond hair and blue eyes?

No, tawny skin, dark eyes, and straight black hair.

Blond and blue eyed people come from Europe, not America.",t3_a0igt,t3_a0igt,False,1257286198,t5_6,t1_c0fascz,False,2,aig_ma,0,0,0,,,1426088415
c0fasd8,reddit.com,,1,True,Marouane Chamakh has impressed with Bordeaux and attracted the attention of many a European giant. Arsenal came close to bagging him in the summer and he could yet end up at the Emirates.,t3_a0n98,t3_a0n98,False,1257286200,t5_6,t1_c0fasd8,False,1,winniewoo,0,0,0,,,1426088415
c0fasnw,atheism,,1,True,"This is not [EU](http://en.wikipedia.org/wiki/European_Union), this is [ECHR](http://en.wikipedia.org/wiki/European_Court_of_Human_Rights), which has little (if any) to do with EU, and much with [COE](http://en.wikipedia.org/wiki/Council_of_Europe) (wich, also, is not EU).

Unlike, say, [ECJ](http://en.wikipedia.org/wiki/European_Court_of_Justice), which is part of EU.",t3_a0hyn,t1_c0fa6c8,False,1257286483,t5_2qh2p,t1_c0fasnw,False,1,[deleted],0,0,0,,,1426088418
c0fasq8,worldnews,,0,True,"&gt;Only when talking fiscal policy.

This is why I used the word ""usually"" and not ""always"".  And when people speak of the ""fed"" as separate from the government they are likely talking about the Federal Reserve which is (again) not a part of the U.S. government.

&gt;Brussels in located in the EU, not the EU located in Brussels.

The EU is located in Brussels.  Why are Europeans so bad at simple geography!?

Edit: here is some important reading  :  http://en.wikipedia.org/wiki/Brussels",t3_a0im7,t1_c0farn3,False,1257286539,t5_2qh13,t1_c0fasq8,True,0,sbrown123,0,0,0,,,1426088420
c0fatll,worldnews,,6,True,"War is a part of the human condition. But frankly I take pride in the fact that a fractious group of nations who had spent the better part of their history fighting each other have taken yet another step toward integration. I applaud the European Union, for its mission and for the ideals in which it was conceived.",t3_a0im7,t1_c0fam5r,False,1257287376,t5_2qh13,t1_c0fatll,False,6,BravelyBraveSirRobin,0,0,0,,,1426088431
c0fatzz,AskReddit,,1,True,I live in socialist Europe. University is free. ,t3_a0k3c,t3_a0k3c,False,1257287781,t5_2qh1i,t1_c0fatzz,False,1,lukasmach,0,0,0,,,1426088437
c0fau1q,AskReddit,,0,True,"If you're American, I can safely testify 1/4 of a fast food menu is perfectly healthy. We have much smaller portions in Europe, and usually consider a McDonalds menu to be about half a day's worth of food.",t3_a0m6d,t1_c0falys,False,1257287823,t5_2qh1i,t1_c0fau1q,False,0,rogueman999,0,0,0,,,1426088437
c0faubl,worldnews,,-1,True,"&gt;I applaud the European Union, for its mission and for the ideals in which it was conceived.

I'm sure you will be a loyal follower to them.
",t3_a0im7,t1_c0fatll,False,1257288065,t5_2qh13,t1_c0faubl,False,-1,sbrown123,0,0,0,,,1426088440
c0faudf,funny,,0,True,"I just realised it was GlobalHyperColour I knew I missed something out.  I lived in Hong Kong when they were all the rage, not great for sweaty europeans...",t3_a0mjz,t1_c0fau3v,False,1257288114,t5_2qh33,t1_c0faudf,False,0,ajehals,0,0,0,,,1426088441
c0faug9,AskReddit,,35,True,"Awww, where have you been?

Still traveling Europe?",t3_a0kcl,t1_c0fasl5,False,1257288204,t5_2qh1i,t1_c0faug9,False,35,P-Dub,0,0,0,,,1426088442
c0fauif,worldnews,,3,True,"No, that is not right. I'm from Greece and I would not say that the EU ""exploited"" Greece in any way (though not precisely what you are referring to). We are members since the 80s and we have received tremendous help, both financial and organisational.

Yes, there is obviously something for everyone to gain but it is by no means exploitation.",t3_a0im7,t1_c0faswp,False,1257288256,t5_2qh13,t1_c0fauif,False,3,racergr,0,0,0,,,1426088443
c0faukf,funny,,1,True,If I could have I would have gone to europe for a year. I think it would be exciting. Like an adventure! Actually I'm goin for an adventure today! Shopping!! :) :) :) haha but seriously you should really consider it. It's beautiful here but it's not like all bush. I had someone ask me if roos walked the streets! They don't thank god!! :):),t3_9zaag,t1_c0faqmx,False,1257288308,t5_2qh33,t1_c0faukf,False,1,PrincessLozza,0,0,0,,,1426088443
c0fauzc,travel,,1,True,"I've done the rail travel around Europe. You need a backpack, as you will often need both hands free to be able to make the necessary gestures to be understood. If you carried a great big suitcase around, you would grow to hate it within a week. A backpack just gives you so much more mobility as you will often find yourself getting slightly lost and having to do a bit of walking to find the hostel or the place you're looking for. In all of the dozens of hostels I stayed in, I saw no one with a suitcase. Not one person. You would look weird being the guy with the suitcase.",t3_a0nje,t3_a0nje,False,1257288662,t5_2qh41,t1_c0fauzc,False,1,Sealbhach,0,0,0,,,1426088449
c0favy7,AskReddit,,2,True,"While backpacking around Europe for 2 months I traded *The Rum Diary* for *Angles and Demons*. Worst mistake of my life. Fucking priests parachuting from fucking helicopters. With all the hype over The Da Vinci Code I thought ""it can't possibly suck as bad as the first one"". It did. I took my girlfriend to see the movie because she thought it was great, but her idea of a literary masterpiece can be purchased in the check-out line at Food Lion.",t3_a0d3l,t1_c0fasyq,False,1257289545,t5_2qh1i,t1_c0favy7,False,2,mer-mer-mer-mer-mer,0,0,0,,,1426088460
c0fawoy,AskReddit,,1,True,Same as. Massively subsidised University education. I think it cost me and my parents &lt;£15000 in total. Europe for the win!,t3_a0k3c,t1_c0fakrn,False,1257290268,t5_2qh1i,t1_c0fawoy,False,1,MrSnoobs,0,0,0,,,1426088470
c0faxe9,AskReddit,,1,True,"28K a semester? WTF! This is what you get for doing it in the US? I did mine in europe and it cost me about $1,500 per year. Five years at 56K per year will be 280K for a 5 year course. In UK, for Example, a typical university costs about 5K per year (10 times less). Other countries in Europe are cheaper. If you are willing to spend 280K (170,000 pounds), get a student visa,  move to a foreigner country and live there as a king while you do your course. It will be much cheaper!!!! There are great opportunities out there in Europe, Australia, etc.

Pack your stuff and go do your course overseas. Cambridge, Sorbonne, Oxford, etc... much cheaper. 

And for your informations almost all these foreigner universities accept international students. Go check this, for example...

[Oxford International Students Program](http://www.ox.ac.uk/admissions/undergraduate_courses/international_students/index.html)

or this

[Cambridge University](http://www.cam.ac.uk/admissions/undergraduate/international/)",t3_a0k3c,t3_a0k3c,False,1257290942,t5_2qh1i,t1_c0faxe9,True,1,lunarbase,0,0,0,,,1426088479
c0faxie,worldnews,,1,True,"&gt; Also. With a collapsed America, China has nowhere to export its low value production

The EU became China's [largest trading partner](http://english.people.com.cn/200703/14/eng20070314_357522.html) as of [2006](http://english.people.com.cn/200703/14/eng20070314_357522.html).

WRT to financing, I hear the middle east has some loose change. ",t3_a0jhx,t1_c0faj0y,False,1257291053,t5_2qh13,t1_c0faxie,False,1,BraveSirRobin,0,0,0,,,1426088481
c0faxmt,atheism,,1,True,"&gt; Do the EU even have any real power to enforce? 

Not really.  Only where it affects economy (e.g. label your food irregularly and you cannot export them anymore).

&gt; I'm even more against unelected bodies having power over (formerly) sovereign states.

American or German federal states have nowhere near the autonomy of European states.  They are sovereign.  Also, the European Parliament _is_ elected, and in most European countries even the national judges are not elected (so this decision of a European court does not make any difference in that respect; there was even one Italian judge in the panel).",t3_a0hyn,t1_c0fajqp,False,1257291166,t5_2qh2p,t1_c0faxmt,False,1,bonzinip,0,0,0,,,1426088482
c0fayd9,beer,,1,True,"It is an entirely different story for beers like Beck's and Heineken when you are getting them close to the source, by all accounts there is huge difference from what we get in the US.  

Beer drinkers in Europe seem to be even more territorial and protectionist than those in the US, so my advice would be to try as many different styles in as many different places as you can while in Germany.  There are a ton of great beers over there that us Americans barely get to see, so I don't dare claim any expertise.

I would want to take advantage of the access to Belgian beers that are not widely available in the US. I feel that the best beers in the world come from Belgium, especially the [Trappist Ales](http://en.wikipedia.org/wiki/Trappist_beer).  Chimay and Orval are pretty easy to find in the US, but the others are pretty difficult, especially the Westvleteren (which is widely regarded by many as the best in the world. period.)  which is EXTREMELY difficult to get.  That would be my focus if I were over there.",t3_a09nz,t1_c0faxn7,False,1257291903,t5_2qhg1,t1_c0fayd9,True,1,night_owl,0,0,0,,growler,1426088492
c0fayyw,worldnews,,4,True,weaker russia means a safer europe? are you fucking kidding me? did you learn your history in alabama or something?,t3_a0jhx,t1_c0fankn,False,1257292518,t5_2qh13,t1_c0fayyw,False,4,sarahfailin,0,0,0,,,1426088501
c0fazbl,atheism,,1,True,The ECHR is not connected to the EU.,t3_a0hyn,t1_c0fajqp,False,1257292940,t5_2qh2p,t1_c0fazbl,False,1,bobappleyard,0,0,0,,,1426088526
c0fazzl,technology,,4,True,"TIL: That ""Verizon Wireless [is] a venture of Verizon Communications Inc and Vodafone Group Plc...""

I did not know that Vodafone of Europe and Verizon Wireless had relations with each other... Is this why the UK is getting CDMA towers installed? Get someone reference the story I am referring to?",t3_a0nqe,t3_a0nqe,False,1257293642,t5_2qh16,t1_c0fazzl,False,4,[deleted],0,0,0,,,1426088534
c0fb08u,AskReddit,,3,True,"Even through something like that, it would cost me nearly AUD$2000 to get from Melbourne to Rome.

Being so very far away makes me die a little inside whenever I hear of something like a $200 ticket. Australia is a great place to live, but it is still incredibly costly to travel to the States, UK or Europe.",t3_a0k1r,t1_c0faydu,False,1257293927,t5_2qh1i,t1_c0fb08u,True,3,Sickly404,0,0,0,,,1426088537
c0fb096,netsec,,0,True,"&gt; Show me a case in the US or EU, where someone had intellectual property that was infringed on, and where the judge sided with the infringer. I'm not talking about individuals, I'm talking about companies/warez groups.

Show us a case where someone had ""intellectual property"" infringed upon that wasn't a copyright case. Patent and trademark lawsuits see judges side with the defendant all the time. Perhaps you should give up the mind altering drugs for a while, let the crack fumes clear out.

Go before any judge and start waffling about intellectual property and you'll be told to specify whether you're talking about a copyright, a patent, or a trademark. Depending on your answer very different laws will then be brought to bear. To speak of intellectual property is to demonstrate either confusion or mendacity.
",t3_a09r1,t1_c0fam81,False,1257293935,t5_1rqwi,t1_c0fb096,True,0,spiceweasel,0,0,0,,,1426088537
c0fb148,AskReddit,,2,True,"Not sure, but flights in the European region are quite inexpensive. I once flew Hamburg-Stockholm for 8.02 €. Yes, you read eight euros and two cents. The airports tend to be a bit away from the city but hell with it if it can be that cheap.",t3_a0k1r,t1_c0fau3p,False,1257294930,t5_2qh1i,t1_c0fb148,False,2,alvaai,0,0,0,,,1426088548
c0fb1nt,worldnews,,3,True,"By that if you mean representatives in from member states deciding what laws can and cannot be passed in the EU...then yes, you are correct.

Member states pass the laws, not ""Brussels"" The European Commission is in Brussels, but it only drafts laws. It has no power to pass them. The Parliament and Council (Strasbourg and Brussels), made up of democratically elected representatives from member states vote to pass the laws.

I'll rephrase your original statement : Representative of member states pass laws while in Brussels and Strasbourg. 
Better.",t3_a0im7,t1_c0fabno,False,1257295590,t5_2qh13,t1_c0fb1nt,False,3,jkil,0,0,0,,,1426088579
c0fb1on,politics,,1,True,"Moral high ground is an illusive (appearing yet disappearing) attribute of man.

Destroying the American Indian was for greed of land &amp; for refusing to bend their knee.

American Slavery was racism &amp; greed for wealth &amp; luxury, vanquished at a terrible price.

Hiroshima &amp; Nagasaki, these were evil vengances for causing and 

furthering war, that would not be inflicted upon Europe, but Asia OK.

""We the people"" of the United States of America are by and large an isolationistic people having Freedom &amp; Liberty from caesars OWO.

WW I ""forced"" America onto the world stage separating age old rivals bound in the grips of each others demise. America has spent ALL of a nations blood &amp; treasure holding back the evil deeds of generations only to be engulfed by it.

",t3_a0kew,t3_a0kew,False,1257295611,t5_2cneq,t1_c0fb1on,True,1,pitofdoom,0,0,0,,,1426088572
c0fb25l,AskReddit,,-1,True,"Is that a trick question ? 

**‘Poisoning attempt’** charges filed against French ""swine flu"" mass vaccination campaign (fleshandstone.net)
Jean-Pierre Joseph, the plaintiffs’ lawyer, describes the vaccination campaign as “A veritable attempt to poison.” He confirmed that the charges were filed at the High Court in Grenoble before the court’s senior examining magistrate. He said other court cases involving other plaintiffs would begin soon

The various charges filed included one of “Attempting to administer substances…of a nature which could result in death.”

[http://www.fleshandstone.net/healthandsciencenews/1662.html](http://www.fleshandstone.net/healthandsciencenews/1662.html)

Criminal charges have been filed in France against the French Health Minister Roselyne Bachelot-Narquin, the Interior Minister Brice Hortefeux and the Minister of Justice Madame Michèle Alliot-Marie for their role in preparing, in secret, a forced „swine flu“ mass vaccination campaign starting in September 2009, and also for depriving the people of France of their fundamental civic rights by imposing martial law under the pretext of a pandemic emergency level 6 declaration issued by WHO.

The charges specifically allege that the group have
- violated laws against the fundamental interests of the nation (Article 412-1 of the penal code) by declaring a pandemic level emergency without adequate justification in order to trigger provisions in the national pandemic plan that give WHO and the UN extraordinary powers over the French law enforcement and health services.

- violated laws on a conspiracy against the fundamental interests of the nation (Article 412-2) by conspiring in secret to put in place legislationt that will allow for the forced vaccination of the people of France with a toxic and untested substance.

- violated laws on medical experiments on people without their consent (Article 223-8) by planning to adminster an untested substance to the people of France by force in special vaccine centers.

- violated laws on treason by handing over all or part of the national territoriy to belligerent powers (Article 411-2) by activating pandemic level 6 laws that have resulted in key functions in the French government to have been handed over to a special „crisis committee“ set up in April on the authority of WHO’s International Health Regulations 2005 and which answers to WHO.

- violated laws on the crime of preparing to commit mass murder in an association of conspirators (Article 450-1) by planning to administer toxic „swine flu“ jabs which leading expert Dr Marc Girard has said could kill 60,000 people in the country.


The criminal charges were filed in Creteil, a suburb of Paris, and also in Paris at the State Prosecutor’s office.

The legal procedure in France – and much of Europe, also Austria – is that a state prosecutor reviews criminal charges, and if he or she decides there is enough evidence to indicate a violation of criminal laws, he or she orders a police investigation, as happened in Austria when I filed charges in April against Baxter for contaminating 72 kilos of vaccine material with the live bird flu virus, supplied by WHO. www.theflucase.com


Infringements
     1. Attempted administration of substances harmful to health such as to cause death (Art. 221-3 and 221-5 of the Penal Code).

We are witnessing a series of maneuvers whose objective is to sell as quickly possible for the largest share of the population of toxic products.

These maneuvers consist of the following facts.
       • File a patent for the production of vaccines against H1N1 influenza before the appearance thereof.
       • Prepare the manufacture of the vaccine and ensure the exclusivity of the sale, even before the first cases of disease appear.
       • Reveal the disease intentionally spreading the virus in the population.
       • Pressure the media to believe that illness is ""Appeared"".
       • Selling finally a highly toxic product that will sicken thousands of people, including a certain number of deaths.
Because the symptoms of this disease are those of the flu, it will be easy to announce that the pandemic does occur and must continue to vaccinate.

It will be necessary, of course, continue to put pressure on the media so that omits to say that patients are being vaccinated, which will not be difficult when we see the full pages of advertising purchased by some laboratories pharmaceutical newspaper.
These maneuvers are attempted administration of substances harmful to health suffered by any citizen subject for several months to one year
misleading promotional communication of influenza vaccines. 
We are directly involved in the offense, since, if our attention had not been alerted by the above events, we would have made vaccine being misled about the intrinsic qualities of a product that is being actually very dangerous for human health.

The plaintiffs in this complaint are parents of school children eat The most serious concerns about safeguarding the physical integrity of children, where they fear some form of forced vaccination implemented without their free and informed consent based on sound information provided by their doctor.
                                            
2. Endangering the person (Article 223-1 et seq of the Criminal Code) 

The vaccine marketed contains highly toxic adjuvants:
       • thimerosal (or thiomersal) is derived from mercury, highly toxic;
       • squalene, product involved in complaints in the U.S. who have been in vaccines administered to soldiers of the 1st Gulf War, and which would have made thousands of sick soldiers to life.
       • formaldehyde or formalin.
The risk / benefit ratio of this campaign is shamelessly skewed. Influenza A has, during the winter season in Argentina (comparable to France) 4 times more people than seasonal influenza. Thus, allegedly to protect us from what some scientists call a ""Grippette, it could trigger thousands of cases of serious side effects. These victims, instead of having suffered more than 99% of cases, a ""bad cold"" for 8 days will be very sick for life.",t3_a0ogu,t3_a0ogu,False,1257296141,t5_2qh1i,t1_c0fb25l,False,-1,necromanser,0,0,0,,,1426088579
c0fb2j9,worldpolitics,,4,True,"European Military - Probally a good idea, at the moment we are relying on the yanks for protection.

European Police - In theory a good idea, it would be good to know about a rapist from Poland who comes to work in the UK, and vice versa, but I admit this needs to be very carefully considered, some form of European FBI style operation might be useful however.

Forced Military Service - Bad idea, but national service of some kind might be useful. In principle, I am not against this idea.

Execution of people who stand in the way of the European state - Mindless bullshit you wrote down because you couldn't think of anything constructive to say.",t3_a0ili,t1_c0fao52,False,1257296560,t5_2qh9a,t1_c0fb2j9,False,4,Ivashkin,0,0,0,,,1426088585
c0fb36s,worldnews,,-1,True,"Oh don't worry, there'll be war and suffering in the end, the EU will presumably eventually need to be overthrown, and I don't see it happening peacefully anymore. Sigh.





",t3_a0im7,t1_c0fakye,False,1257297419,t5_2qh13,t1_c0fb36s,False,-1,DGolden,0,0,0,,,1426088591
c0fb3op,business,,2,True,"hence *horatio alger*. However,  i do not know why you are being downmodded. as any mindless group bashing is unwelcome on reddit.

i don't give out personal details but when i look at my life and where my luck has taken me i do not put too much on where i came from and conclude i am privileged . every day of health [ and ill health ] is a gift in the west. 

of course in your mind  you probably think i beneifted through affirmative action. but that is not true either as i live in europe these days.

my experiences and opportunities is at odds with the personal circumstances in my lfe.

i am lucky to  have travelled and seen things.",t3_a0ih1,t1_c0fb3a7,False,1257298051,t5_2qgzg,t1_c0fb3op,False,2,kaiise,0,0,0,,,1426088598
c0fb47q,funny,,7,True,*sigh* You need to call the European Fecal Standards and Measurements office in Zurich. Their number is listed on their website.,t3_a0mjz,t1_c0fb02t,False,1257298713,t5_2qh33,t1_c0fb47q,False,7,boothinator,0,0,0,,,1426088604
c0fb53x,AskReddit,,1,True,"Yeah, it actually is incredibly obnoxious. I had a friend call Thierry Henry African-American. They didn't understand why it mattered that he's French. Also, no one refers to us white folk as European-Americans.",t3_a0bhh,t1_c0fb4ep,False,1257299889,t5_2qh1i,t1_c0fb53x,False,1,biggs_darklighter,0,0,0,,,1426088616
c0fb5s1,worldnews,,0,True,"&gt; like this guy who state ""Brussels is in the EU"". WTF?!

To state the bleeding obvious: the guy you link to is speaking geographically.  Brussels is in Belgium, Belgium is part of the EU, therefore Brussels is, geographically, inside the EU.  Just like saying ""Chicago is in the USA"".",t3_a0im7,t1_c0favzw,False,1257300641,t5_2qh13,t1_c0fb5s1,False,0,SEMW,0,0,0,,,1426088625
c0fb5ug,AskReddit,,1,True,"I would like to have done the European back-packing thing with my other friends straight outta university. Now I'll have to wait until my own boys are grown before I get to go party with those 20-something horny foreign girls looking for a good time.

I can wait.",t3_a0op0,t3_a0op0,False,1257300739,t5_2qh1i,t1_c0fb5ug,False,1,simianfarmer,0,0,0,,,1426088628
c0fb778,pics,,1,True,"If I'm not mistaken, the EU has a larger economy now, in part due to it expansions eastward.",t3_a0nlj,t3_a0nlj,False,1257302378,t5_2qh0u,t1_c0fb778,False,1,flobin,0,0,0,,,1426088643
c0fb7s6,AskReddit,,1,True,People make this mistake a lot. Everyone still needs a visa. It's just that people from the EU or Norway are automatically granted a visa upon entry into the USA (and visa versa usually),t3_a0k1r,t1_c0faoaq,False,1257303054,t5_2qh1i,t1_c0fb7s6,False,1,BuboTitan,0,0,0,,,1426088651
