id,subreddit,author_flair_text,ups,archived,body,link_id,parent_id,score_hidden,created_utc,subreddit_id,name,edited,score,author,downs,controversiality,gilded,distinguished,author_flair_css_class,retrieved_on
c0fgwr7,politics,,1,True,"Not to defend Stalin (pretty much un-defendable), but considering the losses of the USSR in WWII, wouldn't it seem semi-reasonable to want to keep control of the pre-WWI Russian province of Poland and as much of eastern Europe as possible, just to try to stop a potential 3rd German invasion of Russia from the west?

And considering that the UK proposed that the US and UK ally with the Nazis at the end of WWII to reinvade the USSR ([Operation Unthinkable](http://www.google.com/search?hl=en&amp;ie=UTF-8&amp;oe=UTF-8&amp;q=operation unthinkable)), along with the USSR's complaints about the US/UK refusing to follow the wartime agreement to de-Nazify Germany, one could imagine how the USSR might be justifiably paranoid.",t3_a1xh1,t1_c0fgru9,False,1257612979,t5_2cneq,t1_c0fgwr7,False,1,Sleesslow,0,0,0,,,1426091571
c0fgxv7,politics,,1,True,"I thought the EU was driven by an economic, not political agenda.  The fact that no wars are on the table likely has more to do with countries agreeing that their borders are just fine, no need to take over another country's land or sovereignty.  Economics seem to be driving everything, pretty much as it always has throughout history.",t3_a1y7n,t3_a1y7n,False,1257614715,t5_2cneq,t1_c0fgxv7,False,1,[deleted],0,0,0,,,1426091585
c0fgxvd,politics,,2,True,"Nope.  That's the problem with these discussions.  You never know if the person talking is refering to Socialism or Social Democracy, and just don't know they are wildly different things.  This goes for the American and European poster, and the pro and anti. ",t3_a1xh1,t1_c0fgvee,False,1257614724,t5_2cneq,t1_c0fgxvd,False,2,myname,0,0,0,,,1426091585
c0fgyh8,AskReddit,,1,True,"You can vote and run for office, travel is easier and more job opportunities become available.  From the Swedish Migration board:

*The most tangible evidence of citizenship is the possession of a Swedish passport and the citizen’s absolute right to stay in Sweden. There is however little difference between Swedish citizens and foreign citizens domiciled in Sweden.*

*In principle, foreign citizens possessing a permanent residence permit (PUT) and registred as residents have the same rights and obligations as Swedish citizens. There are certain exceptions, however. Only Swedish citizens have the absolute right to live and work in the country and only Swedish citizens are entitled to vote at parliamentary elections. Nor may foreign citizens be elected to the Riksdag (Parliament). Also, certain professions such as the police, the military and the national safety service are only open to Swedish citizens. Another practical advantage of being a Swedish citizen is the opportunity to work in other EU countries.*

This having been said, I'm Canadian so you may want to ask a native Swede if you want to better gauge the zeitgeist of the country.",t3_a1z64,t1_c0fgxq9,False,1257615671,t5_2qh1i,t1_c0fgyh8,False,1,iamanogoodliar,0,0,0,,,1426091593
c0fgyqw,worldnews,,6,True,"It's particularly hard to disprove the smear of ""you're a racist"" when you lead a party that in it's own words is ""wholly opposed to any form of racial
integration between British and non-European peoples"" and is committed to removing non-whites from the UK.",t3_a1v46,t1_c0fgwye,False,1257616122,t5_2qh13,t1_c0fgyqw,False,6,prof_hobart,0,0,0,,,1426091597
c0fgyvh,politics,,2,True,"...and the EU should follow the same path?  If anything, learn from history.  Skepticism is healthy.  Cynicism is not.",t3_a1y7n,t1_c0fgyd5,False,1257616307,t5_2cneq,t1_c0fgyvh,False,2,[deleted],0,0,0,,,1426091598
c0fgzqr,politics,,1,True,"You're conflating communism and socialism. Socialism isn't about letting the governement handle all of your money... It is about acknowledging that we live in a society, and as such we can lead better lives by making sure we as a society are having a good life. 

So socialism societies(like canada, and most of western europe) try to level the playing field for people starting out, by making sure that young people have the ressources to make it into the world and be a productive member, and that they remain that way. This mean offering cheap schooling(through university), making sure people are healthy (physicly, mentally), ensuring the physical safety (police, regulations on environement, food quality, ...) etc... So, even someone from a modest family(like me) can easily afford a good university, and pursue graduate studies.

Take a look at statistics, people in socialist countries happen to lead happier lives, and a lot less crime ridden. My wife that came from the states, mentionned once, that she never felt 'free-eer' than after coming here, where you don't have to worry about being assaulted while walking in the streets after dark.",t3_a1xh1,t1_c0fgxc4,False,1257617594,t5_2cneq,t1_c0fgzqr,False,1,sammyf,0,0,0,,,1426091609
c0fgzx6,worldnews,,0,True,"""Racist"" is a smear than sticks particularly well to *any* person of european descent, or with pale skin. It's been set up that way. 

Thus, we can infer nothing from the fact that the smear sticks well to him. (Unless we wish to argue that all people of his racial group are racists. Some people do that. Somehow they do not get called out of their own bigotry.)

Until the term racism comes to mean something other than ""a white person expressing any opinion whatsoever of issues of race"", it's not really a charge that I'm going to give much weight to. ",t3_a1v46,t1_c0fgzpq,False,1257617835,t5_2qh13,t1_c0fgzx6,False,0,Whisper,0,0,0,,,1426091612
c0fh0i1,politics,,0,True,"Why do you need references?  Aside form Pearl Harbor, the US was never directly attacked during WWII.  Europe was ravaged.",t3_a1xh1,t1_c0fgrhz,False,1257618657,t5_2cneq,t1_c0fh0i1,False,0,macabee,0,0,0,,,1426091620
c0fh12t,reddit.com,,2,True,"Companies in other areas (not the US) own the rights to distribute that material in those areas (like where you live).  If the BBC has licensed a show from ABC, for example, ABC cannot allow it to be shown online in the UK.  They're not preventing you from seeing it merely to be dicks. (They are dicks, but that's not why they block  these things, it's legal licensing issues.)

The ""foreign"" (to the US) channels are the ones requiring exclusivity in their contracts from US producers of content.

Were the US companies to decide to not license their content to other distribution channels, the number of people in other territories who would see it would be greatly diminished, since most people still get their TV entertainment from TV and not on the computer. So they are making the best of the situation, more or less.

I'm not sure what the solution to this would be, other than having ONE company take over programming for multiple countries, which is unlikely to happen.  For example, if Warner Brothers and NBC and ABC were to buy up all the channels in the Europe and Australia, etc.  Which seems like an impossibility.",t3_a1z5d,t3_a1z5d,False,1257619554,t5_6,t1_c0fh12t,False,2,[deleted],0,0,0,,,1426091627
c0fh1ct,worldnews,,1,True,"the minority fundamentalists do.
most of them are moderate muslims and used to go to the USA or vacations. Now they either go to Europe (Paris mostly) or to other destinations like Malaysia.

People living on the Eastern border with no political influence usually go to Bahrain or Dubai to party.

Granted the religious police are a nuisance, people still live their lives normally. Ive been caught by them twice now. I havent been tortured/whipped or beheaded.

Back on the topic of women driving, right now only the princesses can drive without getting into trouble. to explain why, here's my two cents.
The country has a population of Muslims, liberal, moderate and extreme. The extremists are the loudest ones and therefore are in power of the 'council' or whatever. Since they are loud, people listen to them when they make sense.

Islam, from its earliest of days has promoted, a form of democracy. There is no King, there is no royal bloodline. Its whomever the people chose to lead.

Contrary to that, Saudi Arabia is not a democracy, The leader is the king, the next in line is his son and so on.

If the 'council' decides the king is no longer serving their agenda, they can just claim that the Kingdom is prohibited in Islam and that we need a democracy. This is gonna rile people up into revolt.

So to avoid that, the king is powerless to just say that driving for women is legal.

One of the keypoints of the activists trying to legalize it is that in the olden days when the mode of transport were horses and camels, the Prophet always made sure that his wife be given preference to travel on the camel/horse while he used to walk beside. 
(This is the only way to make the fundamentalists listen by giving examples from within Islam's history etc.)

Ive got a family too, i love my mother and my sister and wouldn't live in a society that oppresses them. Ive been lucky enough to have the ability and resources to travel the world and i have the decency to accept other cultures as they are.

Aaaanyways, the previous king was leaving things as they were. This king however is trying to bring changes for the better but unfortunately its taking too long because those in power are still corrupt and think about their own benefit before the people.

If you have any specific points as to how i may be oppressing women, please do enlighten me",t3_a1v35,t1_c0fh09a,False,1257619998,t5_2qh13,t1_c0fh1ct,False,1,thastig,0,0,0,,,1426091631
c0fh260,IAmA,,-1,True,"yeah but in how many countries do you think she could've gotten that level of care to begin with?  2-bone marrow transplants?

In Europe, as soon as the docs said she was hopeless, it would've been over.  They still let lets of old people die over there, just because they don't want to put out the effort and expense to give gramps a few more years (this has happened to my family members).",t3_a1w2o,t1_c0fgrh1,False,1257621274,t5_2qzb6,t1_c0fh260,False,-1,klarnax,0,0,0,,,1426091641
c0fh2gf,reddit.com,,1,True,eu,t3_7b9x8,t3_7b9x8,False,1257621760,t5_6,t1_c0fh2gf,False,1,denisebeserra,0,0,0,,,1426091645
c0fh2ni,IAmA,,23,True,"To be honest, i'm not convinced the US is fully ready! I drove/backpacked across the US, east to west and north to south, saw a lot.

You have hostels on the coast, especially california (which is pratically like Europe in the US), and they were awesome, San Francisco had possibly the best hostel i've stayed in.

But else where, we found the US so ""scared"" and judging of us, the idea of strangers getting together from around the world...they just didn't seem to want us in ""their"" state.

We stayed in a motel near chicago, 4 lads all backpackers, weird accents (one guy had a thick geordie accent :D ) staying in 1 room (its cheap!).

We were thrown out as the owner said ""the locals won't like it"", basically, 4 guys sharing a room....not in the US, had to drive down at about 12-1am looking for another motel where we asked for 2 rooms...not taking any more risks that night.

EDIT - Also, we stayed in many hostels, and to be honest, most seemed to be just like a ""cheap"" motel, you get a room and not much else. But not just that, they take little to no care of the building and maintenance and there are no communial areas (except for the *broken* shower and toilets). A lot of hostels seem to see that because they are a hostel for backpackers, that means they get to pay less on running the business than if it was a motel. Not all hostels, but we saw this FAR more than any European hostels, which try to encourage the 'social' aspect far more, and the first step in doing this, is to make it a nice place to recommend.",t3_a1y0v,t1_c0fgzn8,False,1257622093,t5_2qzb6,t1_c0fh2ni,True,23,[deleted],0,0,0,,,1426091647
c0fh2sm,Libertarian,,7,True,""" liberal economies like the United States.""

government spends 45% of gdp - similar to Europe.

That's not market liberal.",t3_a1yjh,t1_c0fh1l1,False,1257622328,t5_2qh63,t1_c0fh2sm,False,7,newliberty,0,0,0,,,1426091650
c0fh35w,worldnews,,5,True,Do you seriously think there will ever be sharia law in a European country?,t3_a20m3,t1_c0fh2tu,False,1257622881,t5_2qh13,t1_c0fh35w,False,5,beero,0,0,0,,,1426091653
c0fh3vp,DoesAnybodyElse,,2,True,Canada is mostly likely where I would go if I left the USA.  I'm an EU citizen but it's just a technicality - I would feel extremely alien moving to Europe.  ,t3_a20od,t1_c0fh3qm,False,1257623948,t5_2r5vt,t1_c0fh3vp,False,2,blabla3,0,0,0,,,1426091664
c0fh4sz,videos,,10,True,"It's ""Neighbours"".

Also: ""However, the version of Neighbours that ultimately won an Oscar was not the version McLaren had originally created. In order to make the film palatable for American and European audiences, McLaren was required to remove a scene in which the two men, fighting over the flower, murdered the other's wife and children.[3]""

http://en.wikipedia.org/wiki/Neighbours_%28film%29",t3_a1zds,t3_a1zds,False,1257625366,t5_2qh1e,t1_c0fh4sz,False,10,Achalemoipas,0,0,0,,,1426091676
c0fh5dd,worldnews,,2,True,Damn the authoritarian EU for trampling on the rights of the UK to control its citizens!,t3_a1vfi,t3_a1vfi,False,1257626294,t5_2qh13,t1_c0fh5dd,False,2,[deleted],0,0,0,,,1426091682
c0fh5lf,politics,,1,True,Bullshit.  Europe's systems are far more government-controlled.  ,t3_a1urv,t1_c0fh2xp,False,1257626625,t5_2cneq,t1_c0fh5lf,False,1,Sunupu,0,0,0,,,1426091687
c0fh62r,IAmA,,4,True,"Most native-born Israelis wouldn't have anywhere else to go.  As for the ones that came here since the early 1900s, well, they would have to up and go back to places like Morocco, Yemen, Syria, Lebanon, Iraq, Iran, Russia, every ""stan"" you can think of, Ukraine, the United States, all of Europe, Ethiopia, etc.  That would be a lot harder and a lot less acceptable than just leaving two states for two people.  

I'm all about practicality at this point.  If it isn't practical, it isn't a good idea.  Eliminating the Pals?  Not a chance.  Leaving the West Bank under Israeli control?  Awful.  Letting back in all the refugees?  Also unacceptable.  Practically speaking, we're fucked for a while.",t3_a1zek,t1_c0fh3vj,False,1257627348,t5_2qzb6,t1_c0fh62r,False,4,Neil_young_freak,0,0,0,,,1426091692
c0fh7h5,worldnews,,3,True,"I don't think the Taliban are going to take over europe or any other place for that matter with their rusty old Ak's. These guys are semi-literate farmers who just want to be left alone after decades of invasions and war. The Taliban would have probably given up OBL if the U.S. would have used diplomacy instead of bombing the hell out of the place, but Bush figured taking over afghanistan would be better for business",t3_a20m3,t3_a20m3,False,1257629510,t5_2qh13,t1_c0fh7h5,False,3,pilotinspector85,0,0,0,,,1426091714
c0fh7ro,atheism,,0,True,"&gt; ""Bragging on Darwin being an asshole"" is simply not testable, especially using the metric ""being interested in the topic"", and you incorrectly use the word hypothesis.

Fine.  I didn't present my results as scientific in any way.  I just made some samples.  Regarding ""evolutionism"" and ""creationism"" however there are no synonyms I think though.

If you want I can go on: ""evolutionism wrong"", 36 million; ""evoluzionismo errato"" 231.000 + ""evoluzionismo sbagliato"" 300.000.  In English,  9 of the top 10 results are about ""Proof evolutionism is wrong"".  In Italian, the first article is about creation of Earth by extraterrestrials (nothing Christian it it)! And a few of them are about ""common mistakes made _about_ evolutionism"" (for example that ""chimps are ancestors of man).

Nothing definitive, I concur.  But pretty much everything points in the same direction.  Which is what I _know_ about because unlike you I live in Europe, I was just making examples.

&gt; If anything, because the poll allows for the non-religious to answer (and the non-religious are generally not creationists), the numbers for those in the religious community would be higher.

What I'm saying is that people with a lower education would probably say ""what the fuck are you speaking about"", which counts as ""no"" or ""don't know"".  Independent of their religion.  At the very least, the poll should have included four results: ""yes"", ""no"", ""I don't know"", ""I don't care"".

You're using the graph to classify the world in two, stupid religious people and intelligent atheists.  Fine by me, but you're introducing a variable (religion) that does not exist in the poll, and that's a much bigger fallacy than turning to Google to get a quick data sample.",t3_a1w2p,t1_c0fh6ra,False,1257629971,t5_2qh2p,t1_c0fh7ro,True,0,bonzinip,0,0,0,,,1426091718
c0fh8hb,AskReddit,,1,True,"I have a few more specific questions for you: how old were you when your parents told you about sex? I too was a lot curious around 13/14, but no one to tell me about it.. 

What sort of questions would you ask your parents? I'm trying to gauge the level of intimacy here... As for the sex film, was it animated or was it a porno like something from wikipedia?

Also, did you grow up in Europe or US, what about peer pressure? Sometimes when kids get to know that Santa is not real, parents freak out - so what would happen if you knew everything and your friends didn't or their parents wouldn't want anything to do with it... 

When's the right time to start, by the way... 

Lot of questions, sorry couldn't resist...",t3_a1swy,t1_c0fgav7,False,1257630953,t5_2qh1i,t1_c0fh8hb,False,1,blancacasa,0,0,0,,,1426091722
c0fh8m8,worldnews,,12,True,"If you want a more comprehensive view of human rights in Israel and the occupied territories from the perspective of the US government, here is the [2008 Human Rights Report on the Occupied Territories from the State Department](http://www.state.gov/g/drl/rls/hrrpt/2008/nea/119117.htm).  It's noticeably less severe that any reports you would find from Human Rights Watch or Amnesty, but still worth a read.

Two noteworthy items about this report

1) The US state department calls Palestine the ""Occupied Territories"" meaning they recognize Israel does not own it, but is occupying it. This means even Israel's biggest ally recognizes Israel it is stealing what is not technically Israel's (everything beyond the pre-June 1967 borders).

2) The US government quotes B'Tselem, one of the most respected authorities on human rights abuses of Israel.  Israeli apologists like Alan Dershowitz try to attack their work.  This is because apologists for Israel's state crimes would prefer to bury the facts they don't like.  I've even heard supposedly liberal Jews at my university call them ""extreme leftists"".  For many Israeli's and supporters of Israel's current way of dealing with Palestinians, what B'Tselem has to say is controversial.
     
The value of the US state department quoting their work though, is that it legitimates B'Tselem's work, and makes it hard to deny the things they are saying.  Also, B'Tselem is run by Israelis, and receives funding from member countries of the EU, which isn't exactly descriptive of ""extreme leftists.""",t3_a20u2,t3_a20u2,False,1257631138,t5_2qh13,t1_c0fh8m8,True,12,TweakTastic,0,0,0,,,1426091724
c0fh8vu,worldnews,,1,True,"Arguably it's still serving it's aims of keeping ze Germans down, Russia out, and the US in western Europe.",t3_a1x1m,t1_c0fh7vp,False,1257631494,t5_2qh13,t1_c0fh8vu,False,1,InspectorJavert,0,0,0,,,1426091729
c0fh9du,AskReddit,,1,True,"How old? I don't recall. We talked about body parts and how they worked, genitals and arms and legs and eyeballs and everything. It was age appropriate so it didn't get too complex before we could handle that.

What did we ask? I recall a discussion when I was less than 8. We talked about how males and females have similar body parts (gonads) that make the parts (egg and sperm) that go together and make babies. I recall understanding that and saying ""Hey! that's how you made us!"" Much hilarity followed.

We always had these conversations at home openly. We were raised to know these conversations were for our family and not everyone else wanted to hear it. Mom and Dad said ""This is how we talk in our family about this. Other families are going to be different so leave them be.""

The Psychology sex film was arty. I recall it was called ""Forever Raspberry."" LAME 70's fantasy shit and sex on a car hood.  

I grew up in both the US and Europe, about 3/4 US and 1/4 Europe and English is still a second language at the parent's house. Peer pressure? I recall feeling odd that some kids were so scared or embarrassed about sex. They had some freaking ideas about evil and sin and things that NEVER were heard of at home. We thought it was just cool that OUR parents shared with us so we'd be ready and responsible as adults. BTW, it was always said that adults had sex -- kids and teenagers did not. 

The right time to start? Why should any topic be off limits, ever? You raise a child and teach it to know what you want it to know. Why promote shame and fear and misunderstandings?

For example -- When some parents teach kids the names of their body parts, how many specify genitals? To a kids, if you leave that off, over and over, but stress arms and legs and nose, is there something ""bad"" about that part? Kids are smart -- they pick up on what you do and what you don't do.",t3_a1swy,t1_c0fh8hb,False,1257632187,t5_2qh1i,t1_c0fh9du,False,1,KaylaChinga,0,0,0,,,1426091736
c0fhaod,IAmA,,1,True,"I heard something about this too. AFAIK, Europeans and those of European descent are better able to metabolise Alcohol than those of Asian descent, and it was something to do with making alcoholic drinks (weak beers) in order to have clean liquids to drink. Or something along those lines.",t3_a1tqn,t1_c0fgnsu,False,1257633994,t5_2qzb6,t1_c0fhaod,False,1,andrewlinn,0,0,0,,,1426091752
c0fhawv,IAmA,,1,True,Link please? I'm planning on backpacking through Europe ....and am on the fence on using a hostel or crashing at ex-colleagues' places.,t3_a1y0v,t1_c0fgvnv,False,1257634321,t5_2qzb6,t1_c0fhawv,False,1,[deleted],0,0,0,,,1426091756
c0fhaxj,todayilearned,,1,True,"Right, because Europe being thrown in that much turmoil would have ZERO effect on the rest of the world.  You cannot possibly be seriously arguing that the events of WWI would have no effect on the United States.   Oh wait, it did have a direct effect on the United States when our ships started being attacked.. Crap I GUESS WE FORGOT ABOUT THAT. 

Isolationism is a coward's tactic and the US isn't waiting around any longer while bad shit goes down any longer. 

With the exception of Africa, who is apparently absolutely unwilling to even consider moving into a civilized era.  They can just go machete themselves to kingdom come. 

Here's another one for you since the importance of helping others seems to be lost on you.  (Fairly depressing for a guy running around claiming he wants a Ph.D. in Philosophy from Oxford)

“The worst places in hell are reserved for those who in times of great moral crises maintain their neutrality”


",t3_a1xiu,t1_c0fgx9i,False,1257634346,t5_2qqjc,t1_c0fhaxj,False,1,sleepinglucid,0,0,0,,,1426091756
c0fhbhg,politics,,1,True,"Yep.

public schoo... shit.  Even Europe learned long ago to simulate a market economy while we're still sending our kids to poorly managed schools because it's all tied to the area we live in.  In Europe they actually allocate money to each student, and the schools have to perform well to get that money.  That is LESS socialist than in the USA!

public roa... shit.  Our infrastructure is complete and utter crap, rife with boondoggle projects and cost overruns that don't accomplish anything.

Department of... shit.  When was the last time the DoD actually *defended* US soil? Oh, yeah, Pearl Harbor - but they still take a good chunk of our GDP and justify it with their Orwellian name.",t3_a1xh1,t1_c0fgue3,False,1257635103,t5_2cneq,t1_c0fhbhg,True,1,[deleted],0,0,0,,,1426091768
c0fhbkj,politics,,1,True,"The most fascinating tidbit of American-socialist history you should know:

May Day. Celebrated every year, the first day of May.

It's the International Workers Day. Socialists and labor movements go out on that day and have rallies in support for workers. Usually large bonfires are made. In socialist countries it's a public holiday. It units socialists all over the world. 

You know how that holiday started? Haymarket Massacre in Chicago in 1886. You know why they have huge bonfires? Because there was shitloads of fire that day.

Americans, basically, started the global holiday for celebrating socialism.

Yet, no single American thinks about this every single time May 1st comes around. We don't even celebrate May Day like many other countries. We've got Labor Day - but that's as close to ""socialism"" we can get.

Interesting, isn't it?

Regarding why America has a troubled past with socialism - it started earlier than the McCarthy-era and the Cold War. Pretty much every single industrial country in the world around the 1910-1920s or so got their own socialist party because of labor movements. However, the United States was (if the only one) country where it did not materialize to the same large extent as elsewhere. I remember reading an analysis on this from a Swedish author who speculated it might have to do with America's early democratization. A lot of European countries, for example, actually have to thank the socialist movements for help bringing forth a lot of democratic and electoral reforms. This just wasn't the case in the United States.",t3_a1xh1,t3_a1xh1,False,1257635228,t5_2cneq,t1_c0fhbkj,False,1,drl33t,0,0,0,,,1426091764
