id,subreddit,author_flair_text,ups,archived,body,link_id,parent_id,score_hidden,created_utc,subreddit_id,name,edited,score,author,downs,controversiality,gilded,distinguished,author_flair_css_class,retrieved_on
c0fdjh1,politics,,1,True,"Well than the country should be put in jail once it enters Europe, lol",t3_a0ya8,t1_c0fc8o4,False,1257429376,t5_2cneq,t1_c0fdjh1,False,1,framy,0,0,0,,,1426089859
c0fdjsg,gaming,,1,True,"people in europe earn a lot more and things are more expensive

go check out gas prices if you don't believe me...",t3_a16cb,t1_c0fdjco,False,1257429888,t5_2qh03,t1_c0fdjsg,False,1,salesTaxYouIdiot,0,0,0,,,1426089864
c0fdk44,conspiracy,,2,True,"&gt; Many questions remain to be answered. The outbreak in Ukraine may be indicative of how the virus can behave in the northern hemisphere during the winter season, particularly in health care settings typically found in Eastern Europe.

I wonder what they specifically mean by ""particularly in health care settings typically found in Eastern Europe.""

&gt; WHO continues to recommend no closing of borders and no restrictions on international travel, including to Ukraine. Experience shows that such measures will not stop further spread of the virus.

Interesting..",t3_a0pzi,t1_c0fbhfp,False,1257430385,t5_2qh4r,t1_c0fdk44,False,2,[deleted],0,0,0,,,1426089868
c0fdk7y,gaming,,0,True,"The worst is for software and music you download off the Internet. Nothing makes me more mad than to buy software in Europe for double the price than if I had an IP adress in the USA. The issue is not VAT or TVA, because when I factor in the VAT it still doesnt add up. The problem is that the dollar is losing its worth very quickly. Plus the fools that have distribution contracts in individual countries in Europe are too greedy. I told a marketing tool at Deutsche Grammophon I was going back to illegally downloading their music rather than be charged prices where Euro and Dollars are equal. These companies had better pay attention to this issue before charging people much more money in Europe for the exact same thing the offer people in the US.",t3_a16cb,t3_a16cb,False,1257430519,t5_2qh03,t1_c0fdk7y,False,0,rebildtv,0,0,0,,,1426089869
c0fdkhw,worldnews,,1,True,"You'd prefer it was a totalitarian nightmare like China, then? Certainly, the transition was not ideal, but things are finally beginning to improve; standards of living and life expectancies in most former Warsaw Pact states are now above those in the 80s, and the EU Eastern European states in particular are coming on quickly.

Meanwhile, China shows no real signs of ever giving up its current totalitarian system.

In ways it's a shame that Gorbachev's planned stable transition to democracy while retaining some semblance of the old economic system didn't work out; it could have been a smoother path and could have prevented the terrible hardship suffered by some Eastern Bloc nations in the 90s.",t3_a0vkr,t1_c0fcona,False,1257430921,t5_2qh13,t1_c0fdkhw,True,1,rsynnott,0,0,0,,,1426089873
c0fdkx0,gaming,,1,True,"It's more than just VAT and exchange rates, they're an American company so they also have to pay more for shipping to Europe, import taxes, they probably have to pay a commission to get the money converted back into dollars, etc. There are a lot more costs involved, it wouldn't make sense.",t3_a16cb,t1_c0fdfdn,False,1257431583,t5_2qh03,t1_c0fdkx0,False,1,lewiji,0,0,0,,,1426089878
c0fdl3d,offbeat,,2,True,It looks to me like a long-haired European man keeps appearing on his truck window.,t3_a190b,t3_a190b,False,1257431852,t5_2qh11,t1_c0fdl3d,False,2,WarmTaffy,0,0,0,,,1426089879
c0fdl5j,Marijuana,,1,True,"Spice is bunch of herbs mixed together to provide the smoking base and then [JWH-018](http://en.wikipedia.org/wiki/JWH-018) , [JWH-073](http://en.wikipedia.org/wiki/JWH-073) , and or [HU-210](http://en.wikipedia.org/wiki/HU-210) are sprayed onto it. JWH-018, JWH-073, and HU-210 are synthetic cannabinoids that are not well researched and are slowly being made illegal in some European countries and Canada, although not in the US yet. 

In case anyone here doesn't know, weed has both THC and cannabinoids in it. So the addition of one or more potent cannabinoids to spice will give you a similar but different effect.",t3_a1882,t3_a1882,False,1257431950,t5_2qhhn,t1_c0fdl5j,False,1,lspetry53,0,0,0,,,1426089880
c0fdlcj,reddit.com,,22,True,"Don't you hate it when news reports omit the source? Here is a link to country data:
http://www.emcdda.europa.eu/publications/country-overviews/nl/data-sheet

* Lifetime (2005) (15-64): 22.6 %
* Last year: 5.4 %

(and Portugal where they decriminalized drug use :

* Lifetime 11.7%
* Last year 3.6%
)
",t3_a17z0,t3_a17z0,False,1257432208,t5_6,t1_c0fdlcj,False,22,ronaldvr,0,0,0,,,1426089883
c0fdlev,gaming,,0,True,"I really don't see what the big problem is.  I have done a lot of travel between the United States and Europe.  Basically, 1 unit of currency will get you the same amount wherever you are.  Pay $3 for a hotdog in America, 3 pounds for a hotdog in Britain, or 3 euro for a hotdog in Germany.   Salaries are just about the same anywhere:  a person who makes $40,000 in America will make 40.000 euro in Spain.  

If anything, it should be the Americans who are complaining.  We get approximately the same salary for the same job, but in a currency that is worth less, and we get none of the awesome benefits of European countries, like health care, 5 weeks of vacation, or 35 hour work weeks.",t3_a16cb,t3_a16cb,False,1257432297,t5_2qh03,t1_c0fdlev,False,0,cottccid,0,0,0,,,1426089884
c0fdlnp,AskReddit,,16,True,"&gt;Is there anyone on this website that doesn't that wouldn't mind coming out and saying so/or explaining why they feel that way?

I have said several times that I oppose gay marriage. Not strictly because of religious reasons (e.g. I do not approve of any laws that govern the sexual intimacy of grownups, so I would be against sodomy laws, etc.)

To **me** the very expression ""marriage"" means a specific (but variable in scope) arrangement between a man and a woman. Just as a tenis match of ""mixed doubles"" means that each team has a man and a woman, and I would find it ridiculous for two men or two women to shout ""discrimination!"" if not allowed to play as a team.

By the way, I don't agree that marriage is a religious thing. Marriage is a cultural thing, the product of specific civilisation, that also aquires religious overtones because of the constant feedback between religion and the overall cultural framework that exists. In a way religion is yet another cultural component. In any event throughout European history marriage has always been perceived as the union of a man and a woman to constitute a new family (and yes, there were exceptions sometimes, but insignificant in terms of describing the common practice).

As such I oppose the changing of this definition because it goes against the very meaning of it. Which is why the objection about ""blacks couldn't marry whites years ago"" doesn't work for me, since it was an extra condition imposed on top of something which didn't contain that prohibition in its very meaning. 

I am not opposed, however, to civil unions that guarantee the same rights (in terms of inheritance, taxes, hospital visits, etc.)

One of the problems here is that, from reading some comments, it being legal is only part of the problem: it seams that I should be *forced* to think that it is the same, even on a *personal* level, since failure to do so is some sort of a hate crime.

&gt;I also ask that if people do come forward that we don't down vote them into oblivion. That is a good way to scare people off.

Right, right...",t3_a14to,t3_a14to,False,1257432611,t5_2qh1i,t1_c0fdlnp,True,16,finisterra,0,0,0,,,1426089887
c0fdloj,gaming,,-4,True,"it doesn't matter, what it matter instead if the fact that it is an excuse for  US sellers to have their products with terrible high prices to make profit and to ignore the current exchange market system, which exists for a reason. The Euro is stronger then the US dollar, us Europeans should pay American stuff less than the current price in $US.",t3_a16cb,t1_c0fdghw,False,1257432644,t5_2qh03,t1_c0fdloj,False,-4,Splatterh0use,0,0,0,,,1426089887
c0fdlqj,technology,,2,True,"And here we consider [this](http://www.yorkblog.com/faith/palin.jpg) hot shit for a politician.

Goddamn, what is the easiest European language to learn?",t3_a14u4,t1_c0fd7tq,False,1257432722,t5_2qh16,t1_c0fdlqj,False,2,P-Dub,0,0,0,,,1426089888
c0fdlrd,gaming,,1,True,"Electronics and games are more expensive in shops in Europe, all else is just adjusting to the competition to keep the sales at an acceptable level.

It's the same with everything. If you buy clothes from china, you won't pay the local price, so why would it be different with other things?

There is no such thing as fairness in capitalism. There are legal rules and as long as you follow them you can do what you want, and what you want is to make as much money as possible.

I wonder if anyone here would handle their pricing differently. If it works, why change it?

I stopped buying overpriced games at steam a long time ago. But that only shows that I don't value these games as much as other Europeans do.",t3_a16cb,t1_c0fdkev,False,1257432760,t5_2qh03,t1_c0fdlrd,False,1,smallfried,0,0,0,,,1426089888
c0fdmr5,reddit.com,,1,True,not many non-european cities maybe,t3_a17er,t3_a17er,False,1257434069,t5_6,t1_c0fdmr5,False,1,Mulsanne,0,0,0,,,1426089901
c0fdmth,politics,,1,True,"&gt;What? Are you even aware of how much the US spends on its military compared to other countries? Again, the US spends about as much on the Pentagon as THE REST OF THE WORLD COMBINED (and that's not including the off-budget wars).

Are you aware of how that is completely irrlevant? Are you aware on how much MORE Russia has been spending in the past 10 years? Do you understadn the types of systems involved and the military capabilites of the two? No you don't all you can do is parrot stupid shit you read here.

&gt;Russia's not trying to catch up, they simply can't.

Aside from the massive buildup yeah.

&gt;Actually, some ex-Soviet states (e.g. Belarus) want to rejoin Russia. Others have significant Russian minorities that want to do so

Some? Some? 1, one led by the last dictator in Europe, you're either a troll or a far gone conspiracy nut.

&gt;But you ignored the point about the US breaking its pledge not to expand NATO eastward.

But you ignored that these states can do as they please, Russia isn't thier master.

.Again, it's the US that is the aggressor here. The US invaded Russia in 1917, stayed years past the end of WWI trying to overthrow the Bolshevik gov't, and has never stopped trying to destabilize and break up Russia

Ok definately trolling, this is by far the most asinine thing ever posted on reddit and that's saying a lot. 

&gt;It is widely reported that the US was involved in supporting Chechnyans in their bid to gain independence. The US has talked about breaking Russia up in a Balkanization strategy since at least the 1950s.

That was a close runner up.

You're clearly trolling the idiots here, have fun.",t3_a18h8,t1_c0fdmdf,False,1257434152,t5_2cneq,t1_c0fdmth,False,1,[deleted],0,0,0,,,1426089903
c0fdmzt,pics,,10,True,"not sure why you got downvoted. We know the cemetary, but not the precise location.

http://europeanhistory.about.com/od/famouspeople/a/dyk11.htm

",t3_a148f,t1_c0fdhv4,False,1257434402,t5_2qh0u,t1_c0fdmzt,False,10,[deleted],0,0,0,,,1426089905
c0fdnee,reddit.com,,1,True,"&gt;I think you're oversimplifying things. I don't think any white communities (be they white Irish that were fucked over by the English or any other oppressed white societies) were enslaved in the same way as black people. So, I don't see it as a fair comparison.

I'm sorry, that's just entirely incorrect.  [Here,](http://researchnews.osu.edu/archive/whtslav.htm) [here,](http://en.wikipedia.org/wiki/Slavery_in_medieval_Europe) [and here.](http://en.wikipedia.org/wiki/Slavery)  It's not like we just ""invented"" slavery once we got to Africa.  In fact, the word ""slave"" comes from the word for ""Slav"", as in a Slavic person.  

As for the rest of your points... it looks like you've agreed that what's holding people back is all in their heads.  I just don't think they need an extra helping hand.  What they do need is parents that care about their education.  From an anecdotal standpoint, I see this improving all the time.",t3_a0tmv,t1_c0fdgu1,False,1257434888,t5_6,t1_c0fdnee,False,1,macha1313,0,0,0,,,1426089911
c0fdnwe,IAmA,,6,True,Do Australians of European and Asian ancestry not qualify for free counsel if they are accused of a crime and cannot afford a lawyer/advocate?,t3_a18je,t1_c0fdnij,False,1257435500,t5_2qzb6,t1_c0fdnwe,False,6,scarrister,0,0,0,,,1426089918
c0fdnxq,funny,,-1,True,"Yeah, I'll forgive culture differences. In european countries, it's still acceptable to share a house. I attribute that to leftover ideals from previous eras. In europe, generation after generation of family would share the same house. Be born, grow up, live and work, and die in the same house as parents and children alike. 

In the US, our past era involved getting the hell out of your house and staking a claim to your own place. The stigma here is, the older you are and still at home, the lazier and less socially mature you are.",t3_a0zvj,t1_c0fdlvd,False,1257435531,t5_2qh33,t1_c0fdnxq,False,-1,monkeiboi,0,0,0,,,1426089918
c0fdq3b,worldnews,,3,True,"Christian lands such as what? 

Western Europe used to worship Belenus, Toutatis and Cernunnos and pals; or Odin/Wotan, Loki, Thor and that lot. If you're going down that road, you can send Christianity back to the middle east too. But that's all nutty racism.",t3_a1a1u,t3_a1a1u,False,1257438123,t5_2qh13,t1_c0fdq3b,False,3,Worker_Bee,0,0,0,,,1426089967
c0fdqau,worldnews,,5,True,"Remember, the 'president of the European Union' isn't an executive position. It's effectively ceremonial. No-one will bow down before the president, whoever it may be, any more than they bow down before the Irish president or the UN High Commissioner for agriculture.",t3_a13ms,t1_c0fda9m,False,1257438355,t5_2qh13,t1_c0fdqau,False,5,rsynnott,0,0,0,,,1426089970
c0fdqty,reddit.com,,0,True,eu quero muito abrir uma comta aqui,t3_a1axa,t3_a1axa,False,1257438954,t5_6,t1_c0fdqty,False,0,alebria,0,0,0,,,1426089977
c0fdrv6,AskReddit,,32,True,"I've had a terrible run in with an ex.

I was once with this girl, and we were pretty serious. We talked about getting married and all that jazz. One day out of the blue she breaks up with me saying she wasn't sure she was in love with me (at this point we were living together and I was ring shopping). A week or so later she flies off to Germany and France for the summer.

I was singing in a college choir that traveled, and that summer we traveled to Austria, Czech Republic, and Hungry to sing in cathedrals. I was pretty excited about the chance to be away from home and the memories and to relax a bit without her tormenting me.

I was walking on the streets of Vienna (of all places) with my choir when all of a sudden, my friend turns around and says, ""Uh, dude. I think I just saw your ex."" I was in disbelief, but he assured me he saw her. I quit thinking he was joking when basically everyone in the choir came to me telling me my ex was here. Obviously she thought it was more important that everyone other than me see her.

Finally after an hour of me walking around during our free time looking for her, she just happens to bump into me. Apparently she dropped $600 on a train ticket so she could see me. I later find out she came simply because she thought it would be one of the last times we'd see each other and everything be somewhat ""normal."" 

I was still crazy for her at the time, so I didn't know how to take everything. My head was spinning, and it basically ruined the rest of my Europe trip. Spent the remainder of my time there consuming alcohol.",t3_a1ap2,t3_a1ap2,False,1257440036,t5_2qh1i,t1_c0fdrv6,False,32,rasinbrahms,0,0,0,,,1426089994
c0fds65,worldnews,,0,True,"How about the E.U.? Would you consider them an unbiased, factual source of information on Israel's conduct towards Gaza?

**European Union Report:** The report said that Palestinian farmers had land confiscated, crops damaged and were “plagued” by problems in getting goods to market. MPs condemned the Israeli government for preventing the free export of goods from the West Bank and Gaza, and urged the EU to suspend Israel’s preferential tariff rates until they allow Palestinians free access to European markets. They said: ""It is hard to avoid the conclusion that there is a deliberate Israeli strategy of putting the lives of ordinary Palestinians under stress as part of a strategy to bring the population under heel"". The report said movement restrictions on the Palestinians were justified by Israel as security measures, but warned that “in reality they have been a mechanism to put pressure on the Palestinians by crippling the economy”

Or a USAid report? Would you consider them an unbiased, factual source of information on Israel's conduct?

**USAid Report:** The report, by the US Agency for International Development, showed more than one-fifth of young Palestinian children are malnourished. This is more than a threefold increase since the last study two years ago. The plight of children under 5 years of age was particularly alarming. Twenty-two percent of Palestinian children under age 5 were malnourished, up from seven percent in an agency survey two years ago. Of that number, nine percent suffered from acute malnutrition—resulting from poor nutrition over the short term—and 13 percent suffered from chronic malnutrition—longer-term deficiencies that can result in stunted growth. About 20 percent of children under 5 had some form of anaemia.


Or a The Red Cross Report? Would you consider them an unbiased, factual source of information on Israel's conduct?

**The Red Cross Report:** The Israeli blockade of Gaza has led to a steady rise in chronic malnutrition among the 1.5 million people living in the strip, according to a leaked report from the Red Cross. It chronicles the ""devastating"" effect of the siege that Israel imposed after Hamas seized control in June 2007 and notes that the dramatic fall in living standards has triggered a shift in diet that will damage the long-term health of those living in Gaza and has led to alarming deficiencies in iron, vitamin A and vitamin D.


What independent international institution would you consider an unbiased, factual source of information on Israel's conduct? I'll see what I can dig up.",t3_a17f1,t1_c0fdoox,False,1257440378,t5_2qh13,t1_c0fds65,False,0,Lard_Baron,0,0,0,,,1426090019
c0fdtha,videos,,16,True,"In most of Europe and Asia, intent isn't enough.  You have to have serious connections in order to get a handgun.  

There's a great scene in City on Fire from Hong Kong (which Tarantino ripped off for Reservoir dogs) where a bunch of career criminals hook up this big secret deal with a mob boss to get guns to rob the jewelry store.",t3_a18g8,t1_c0fdsj5,False,1257441711,t5_2qh1e,t1_c0fdtha,False,16,DirtyBinLV,0,0,0,,,1426090030
c0fdtl1,writing,,1,True,"&gt; In that sentence alone, ""it"" can refer to the word ""it"", as you indicated, the word ""pronoun"", or the strategy of using pronouns to cut down on verbosity.

You are incorrect. ""It"" only refers to the word ""It"" in the first sentence, because that word is the subject of the first sentence. The second sentence is not talking about the use of pronouns in general, only the pronoun ""it"". Perhaps another example to illustrate this.

Norway is a country in Europe. It is known for its fjords.

Norway is the subject of the first sentence. The ""it"" in the second sentence refers to ""Norway"". No reader is going to be confused here. No reader is going to think that the first sentence refers to ""Europe"" or ""country"". ",t3_a12ah,t1_c0fd77g,False,1257441823,t5_2qh2n,t1_c0fdtl1,False,1,whiteskwirl2,0,0,0,,,1426090032
c0fdtzj,technology,,10,True,she can have a seat on my european parliament,t3_a14u4,t1_c0fdexz,False,1257442217,t5_2qh16,t1_c0fdtzj,False,10,melp,0,0,0,,,1426090037
c0fdvo8,politics,,5,True,"You realize the total tax burden of the Netherlands is not much more than the total tax burden in the U.S.

http://www.nytimes.com/2009/05/03/magazine/03european-t.html",t3_a1ay3,t1_c0fdv0h,False,1257443797,t5_2cneq,t1_c0fdvo8,False,5,officemonkey,0,0,0,,,1426090060
c0fdw3k,AskReddit,,1,True,European pig goes to Asia.  Asian pig goes to Mexico.  It's really that simple.,t3_a1bbh,t1_c0fdu8r,False,1257444202,t5_2qh1i,t1_c0fdw3k,False,1,notcaptainkirk,0,0,0,,,1426090065
c0fdxym,AskReddit,,1,True,"If you book in advance with www.bahn.de, you can get Europe-wide specials as cheap as 19€ - 39€, depending on the regions. I've gotten plenty of cheap deals from them, usually at fractions of the ""full price"".",t3_a1ap2,t1_c0fdtqr,False,1257445830,t5_2qh1i,t1_c0fdxym,True,1,zachv,0,0,0,,,1426090088
c0fdyxp,AskReddit,,2,True,"and even fewer of us

&lt;-- European Black Metal",t3_a11ng,t1_c0fdc7m,False,1257446696,t5_2qh1i,t1_c0fdyxp,False,2,[deleted],0,0,0,,,1426090100
c0fdz54,AskReddit,,-1,True,move to Europe or Canada,t3_a1bso,t3_a1bso,False,1257446878,t5_2qh1i,t1_c0fdz54,False,-1,misimiki,0,0,0,,,1426090104
c0fdzfd,sex,,1,True,"just keep quiet.  What is the worst that could happen?  You loose your girlfriend.  If it was a wife, how much would it cost?

I say this as someone who is married and has a lover.  My wife knows about my lover but just doesn't want to know so I don't tell her.

BTW I live in Europe.",t3_a16h3,t3_a16h3,False,1257447120,t5_2qh3p,t1_c0fdzfd,False,1,misimiki,0,0,0,,,1426090107
c0fdzo1,AskReddit,,1,True,Technically Asian but culturally European.,t3_a168n,t3_a168n,False,1257447324,t5_2qh1i,t1_c0fdzo1,False,1,PhilxBefore,0,0,0,,,1426090110
c0fdzov,comics,,7,True,"I can't tell if you are an earnest European or a parodic American.

Upvote for staying in character nonetheless.",t3_a1bd9,t1_c0fdyqt,False,1257447337,t5_2qh0s,t1_c0fdzov,False,7,rawkeye,0,0,0,,,1426090110
c0fe077,WTF,,1,True,"Has anyone managed to track down the actual report that this article is based on?  I haven't been able to find any other references.

*edit* tracked it down if anyone is interested. http://www2.mst.dk/udgiv/publications/2009/978-87-92548-81-8/pdf/SAMLET%20Rapport.pdf

From a quick read-through of the major sections, it appears that the reporter did indeed grossly misrepresent the findings of the report.

&gt;Endocrine disruptors are thought to be the reason for a 3:

&gt;Sperm quality below the level set as normal by WHO in one in five
Danish men between the ages of 18 and 20.

&gt; Large increase in testicular cancer over the last 60 years in Denmark,
and a higher incidence than any other country in Europe. Almost 1%
of Danish men are at risk of developing testicular cancer.

&gt;9% incidence of cryptorchidism (testicles not fully descended into the
scrotum) in Danish boys. This is significantly higher than in the
1960s. Cryptorchidism is associated with an increased risk of low
sperm quality and testicular cancer.

&gt;Decrease in the testosterone levels in the blood of Danish men. Men
born after the 1930s-1940s have lower testosterone levels than their
fathers and grandfathers had at the same age. A 30-40 year-old man
today has the same level as a 70 year-old did at that time.

&gt;There is, however, no conclusive proof that the above symptoms can be
attributed to endocrine disruptors in our environment. There may be many
other causes, such as lifestyle, including changes in diet, smoking habits and alcohol intake.",t3_a1ay5,t3_a1ay5,False,1257447765,t5_2qh61,t1_c0fe077,True,1,kormgar,0,0,0,,,1426090117
c0fe10x,reddit.com,,1,True,"""As a European I cannot fathom to have to put my hands on the steering wheel or announce where I'm going to search for my papers.""

You probably can't fathom the 2nd Amendment either.

The regularly exercised right ""to keep and bear arms"" has the corollary that if you get pulled over by law enforcement, you need to show him/her that you're not actually BEARING said arms at that moment.

There's no LAW that says you have to put your hands on the steering wheel, or announce that you're searching for your papers (or put your interior light on if it's night time), it's just a way of showing the cop that you're a law abiding citizen and respect his/her safety, which is the sort of cooperation that occasionally results in a warning instead of a ticket.",t3_a1483,t1_c0fdk0z,False,1257448501,t5_6,t1_c0fe10x,True,1,[deleted],0,0,0,,,1426090129
c0fe1gu,science,,1,True,"Dear New Scientist,

You wouldn't say ""Giant Crack in North America"" if it formed in the States or ""Giant Crack in Europe"" if it formed in France. People know where Ethiopia is. Show some respect by using the country name in the headline.

Yours,

Leo",t3_a19wv,t3_a19wv,False,1257448876,t5_mouw,t1_c0fe1gu,False,1,lpetrazickis,0,0,0,,,1426090137
c0fe2ly,AskReddit,,2,True,"same here - 2 of my exes flew to Europe for my wedding. They crashed at my father in laws house for the weekend.

My wife is maid of honor at one of MY exes weddings in the summer.

It is kinda weird sitting at home with some friends over and seeing my wife laughing and talking with 2 chicks I used to bang.

I do have a few who were just bat shit crazy, but luckily I havent seen them since soon after the breakups",t3_a1ap2,t1_c0fe0s9,False,1257449778,t5_2qh1i,t1_c0fe2ly,False,2,bink821,0,0,0,,,1426090149
