id,subreddit,author_flair_text,ups,archived,body,link_id,parent_id,score_hidden,created_utc,subreddit_id,name,edited,score,author,downs,controversiality,gilded,distinguished,author_flair_css_class,retrieved_on
c0f6p81,reddit.com,,1,True,"Depends on where.  Some states in the US include rehabilitation in the practical application of ""justice"" and some don't, but none really deal with rehab the way most northern European countries do.",t3_9znqu,t1_c0f6ne4,False,1257036122,t5_6,t1_c0f6p81,False,1,mexicodoug,0,0,0,,,1426086306
c0f6pma,WTF,,1,True,"I'm aware of what Third World meant then.  I'm not aware it's modern definition Third World.  From it's usage, it more or less seems to imply that any country that isn't in Eastern Europe or North America is Third World.

But I agree that the term is antiquated. ",t3_9zk9z,t1_c0f6l98,False,1257036799,t5_2qh61,t1_c0f6pma,False,1,SnowdensOfYesteryear,0,0,0,,,1426086302
c0f6qvj,politics,,8,True,Actually already done ... i wish i could find the report. But genetically a lot of those Palestinians are more Jewish than the European Jews.,t3_9zp71,t1_c0f6l9h,False,1257039098,t5_2cneq,t1_c0f6qvj,False,8,MrErr,0,0,0,,,1426086324
c0f6rft,politics,,5,True,"""All nationalists have the power of not seeing resemblances between
similar sets of facts.
A British Tory will defend self-determination in Europe and oppose it in
India with no feeling of inconsistency. Actions are held to be good or
bad, not on their own merits, but according to who does them, and there
is almost no kind of outrage -- torture, the use of hostages, forced
labour, mass deportations, imprisonment without trial, forgery,
assassination, the bombing of civilians -- which does not change its
moral colour when it is committed by 'our' side ... The nationalist not
only does not disapprove of atrocities committed by his own side, but he
has a remarkable capacity for not even hearing about them"" -- George
Orwell
",t3_9zp71,t3_9zp71,False,1257040196,t5_2cneq,t1_c0f6rft,False,5,rtb,0,0,0,,,1426086329
c0f6sw5,IAmA,,1,True,"Heh sorry to be so disagreeable, but what you said is incorrect.  I can use my passports interchangeably and be represented by the country of my choosing in any international affairs.  I've been spending half of the year in Thailand in recent years and travel quite a bit in that region of the world.  For my personal safety, I like to use my EU passport when going through certain countries' customs as to not get picked out as a US citizen and be targeted for theft/robbery or be discriminated against (ie. i am traveling as a european citizen and represented by that country of which passport I use).  When it's to my advantage, I use my U.S. passport.  As stupid as it sounds, I was taken to a thai jail in Phuket before for having expired plates on a rented scooter and refused to pay off to officer to let me go.  In this case, I used my U.S. passport, called the U.S. consultate and was represented by the U.S., even though on that trip I entered the country as a Polish citizen.  The point is that I am a DUAL CITIZEN, represented by both Poland and the United States, and I choose which one I want to represent me in whatever matter I am involved in.",t3_9zhdb,t1_c0f5ps3,False,1257043101,t5_2qzb6,t1_c0f6sw5,False,1,pl303,0,0,0,,,1426086343
c0f6taq,Christianity,Roman Catholic,1,True,"Not really, no. While around here ""Halloween"" (as in trick r treat, etc.) is a very, very recent introduction (via American movies, etc.) which isn't even very popular I don't agree with the general concept of attacking a practice because it is somewhat tied to a pagan festivity. Most of the ""traditional"" catholic festivites around here also have in some order a connection with pre-Christian practices, and in broader terms the Church itself is also the result of the absorption of several European characteristics (even philosophically).

I can agree more with a criticism concerning the morality of the whole thing in terms of ""if you don't do what I want I will hurt you in some way"", but that's a different issue.",t3_9zp61,t3_9zp61,False,1257043950,t5_2qh6c,t1_c0f6taq,False,1,finisterra,0,0,0,,roca,1426086349
c0f6vb5,politics,,2,True,"*""it's probably because that's not what I said.""*

Oh, I thought that's what you were saying.  I think we agree, then.

I don't think there's a general refusal to admit what was done in the past is wrong, though.  Everyone pretty much agrees to that, in my experience.  The problem is what to do about it.  We can't really just give the continental US back to the native Americans and everyone else go back to Europe.

At least in the US, (now, not at the time the land was settled) native people are part of the general population.  They can vote, have access to the legal system, etc.  The interviewer's point at the end of part 2 was that the Palestinians aren't getting even that.",t3_9zp71,t1_c0f6tor,False,1257048223,t5_2cneq,t1_c0f6vb5,False,2,[deleted],0,0,0,,,1426086379
c0f6vnl,AskReddit,,3,True,"In reality we are just a frigid, less fun version of Australia, but we try to hide that by pretending we are better than you due to your distance from Europe and your lack of quality maple syrup.",t3_9zsz1,t1_c0f6vku,False,1257048935,t5_2qh1i,t1_c0f6vnl,False,3,CanadianRedditor,0,0,0,,,1426086384
c0f6w3m,socialism,,1,True,"I was going to try getting a Master's in Canada or Europe (Sweden), but I'm quite dependent on financial aid, which Canada and Sweden don't provide to non-citizens. Sweden will pay for tuition, but won't cover living expenses. I could get a part-time job to help cover living expenses, which I do now, but that's a really precise budget I would need to configure and I haven't done that yet. That's something that's already difficult to do when considering a new city, let alone a new country or continent. 

Toronto would be better than Vancouver for me because of the living expenses. How would you pay for living expenses when getting your PhD? Do you have a big financial cushion? ",t3_9zkhb,t1_c0f6pjy,False,1257049900,t5_2qjii,t1_c0f6w3m,False,1,[deleted],0,0,0,,,1426086389
c0f6xtr,IAmA,,2,True,Try Western Europe.  Just because you found some place that was a lot worse than the U.S. does NOT mean that there are not places which are a lot BETTER than the U.S. (note: I'm an American living in Texas),t3_9zpl5,t1_c0f6pvm,False,1257053780,t5_2qzb6,t1_c0f6xtr,False,2,ohstrangeone,0,0,0,,,1426086408
c0f6zbs,politics,,-8,True,"Anti-Semitic shit.

That video successfully demonstrated that the Jews have as valid a historical claim to that land as the Arabs do.  And that we (in Europe and the Americas) decided the Jews should have that land from 1917 onwards... until we changed our mind in the past few decades and decided they shouldn't.

The bottom line is that we created this mess a little under a century ago by sticking our noses where they didn't belong (Balfour Declaration, followed by the UN creation of the modern state of Israel), and we cannot undo the harm we did back then by reversing course now and blaming everything on the Jews.",t3_9zp71,t3_9zp71,False,1257057377,t5_2cneq,t1_c0f6zbs,False,-8,CitizenCain,0,0,0,,,1426086429
c0f71mi,politics,,0,True,"It's a real shame it has come to this...

The Nazi did kill a lot of people, not just jews, but they targeted specifically the Jews, killing ~70% of jewish population in europe-
http://en.wikipedia.org/wiki/The_Holocaust#By_country

This doesn't mean that other minority groups were butchered in the holocaust, but they weren't the main target.

If you look at history - Jews were chased, attacked and fought against for centuries, and the climax was the Holocaust.

The UN declared Israel as a country to be a safe-house for Jews from all around the world, denouncing the declaration of Israel, is the same as denouncing the declaration of any other country.

The 6 Million Jews that were killed were killed out of being Jews, not out of being activists, academics or homosexuals.

Please read a bit on the holocaust, Hitler killed a lot of people, but no ethnic group was such of a target like the Jews.",t3_9zp71,t1_c0f6wut,False,1257064040,t5_2cneq,t1_c0f71mi,False,0,adamfbs,0,0,0,,,1426086457
c0f71vf,IAmA,,1,True,"&gt; about 20 grand between them

That's a boatload of money. You can get to Asia from pretty much anywhere in the world and back for under 1000USD. From Europe I never pay more than 700 euro.

Once you are there it's all up to you. Three meals a day and budget accommodation can be as little as 15 - 20USD / day. That's living. Anything else is your choice.",t3_9zmxj,t1_c0f6lv7,False,1257064922,t5_2qzb6,t1_c0f71vf,True,1,octave1,0,0,0,,,1426086460
c0f72io,politics,,11,True,"&gt;**It's a real shame it has come to this...The Nazi did kill a lot of people, not just jews, but they targeted specifically the Jews, killing ~70% of jewish population in europe-** http://en.wikipedia.org/wiki/The_Holocaust#By_country


It's a real shame it has come to this...

They targeted a lot of specific people.  The International Organization for Migration (the IOM), a body designated to locate and compensate surviving Romani Holocaust victims, stated that “recent research indicates that up to 1.5 million Roma perished during the Nazi era.” Other reports show that after the war approximately only 500,000 Romani people remained in Europe. [Dr Sybil Milton, former senior historian at the U.S. Holocaust Memorial Research Institute in Washington put the number of Romani lives lost by 1945 at “between a half and one and a half million”.](http://www.ushmm.org/wlc/article.php?ModuleId=10005219)  That's a figure representing a possible 75% of the Romani population in Europe.

&gt;**This doesn't mean that other minority groups were butchered in the holocaust, but they weren't the main target.**

It is a real shame when talking about genocide you want to get into a who has the biggest willy competition.  It's not about groups.  People lost their own lives; 1 for 1, 1 person, 1 life.  Until there was 11 million of them lost in total.  Don't try to make it any less terrible than that to garner some political leverage - *which is exactly what you're doing*.

&gt;**If you look at history - Jews were chased, attacked and fought against for centuries, and the climax was the [&lt;Nazi Genocide&gt;](http://en.wikipedia.org/wiki/Holocaust).**

If you look at history - Gypsies were chased, attacked and fought against for centuries,[ even enslaved right up until the 19th century,](http://en.wikipedia.org/wiki/Romani_people#Persecutions)  and the climax was the [&lt;Nazi Genocide&gt;](http://en.wikipedia.org/wiki/Porajmos).

&gt;**The UN declared Israel as a country to be a safe-house for Jews from all around the world, denouncing the declaration of Israel, is the same as denouncing the declaration of any other country.**

See, I've not disregarded the declaration of Israel.  Israel declared its independence from an independent Palestine as recognised by the League of Nations covenant.  I don't think it was fair how it was done but it is very much legal just as any other secession.  The UN did not form Israel however, you need a SECURITY COUNCIL resolution for that.  Israel never got one.  There was only a non-binding General Assembly resolution on partition.  However the League of Nations DID establish a country as a safe house for Jewish people on the condition that the people already living there accepted a mandate and that all measures were taken to ensure the consideration the people who were already living there were accommodated.  They didn't call it Israel though.  They called it Palestine.  It was in this context that massive European migration began.  It was this immigrant population that allowed a declaration of independence for a 20th century Israeli state.

&gt;**The 6 Million Jews that were killed were killed out of being Jews, not out of being activists, academics or homosexuals.**

5 million were killed for being activists, gypsies, academics, political prisoners, homosexuals, artists and disabled.  Some of the 6 million others were also migrants, academics, political prisoners, homosexuals, artists and disabled.

&gt;**Please read a bit on the holocaust, Hitler killed a lot of people, but no ethnic group was such of a target like the Jews.**

You back to crying the biggest victim.  There doesn't need to be a biggest victim, or a smallest.  75% compared to 70% , 6 million Jews compared to 1.5 million Gypsies compared to 5 million non Jews compared to *24 million* Russians.  Look at Poland, we talk about Jews being targeted but if you were Polish they didn't even have to bother with going through the rigmarole of taking them to one side before killing them.  The same with the Romani gypsies - SS groups often had shoot on site policy for them.  240,000 Polish soldiers/combatants were amongst the 6 million Poles killed.  Think about that.  They just didn't bother using gas chambers on the Polish.  They probably felt why bother when you have artillery, a village, a need for target practice and there's nobody who can say anything to stop it.  I'm sorry but what happened to the Jewish people was terrible but don't think you can justify singling them out.  You can't.     

PLEASE READ a lot more on other aspects of other things because you seem obsessed with justifying a persecution complex and not just a tad egocentric neither.  What you're empowering is people profiteering on suffering. Guilt manipulation by orchestrating biggest victim status whilst detracting from the price others had to pay.

You don't need to break it down, martyring yourself in a who's the biggest victim competition.  Genocide.  11 million.  Very bad.  Shouldn't happen again.  Certainly shouldn't allow ourselves in being guilt tripped into looking the other way when illegal land seizures and ethnic cleansing is being carried out. 

- I'm seeing everything in terms of individuals.  Gay.  Communist.  Traveler.  Jew.  Handicapped.  Politician.  Democrat.  Whatever.  All equal.  All equally and wrongly punished.  Equally punished in that you can only kill each individual once.  ONE GENOCIDE - 11 MILLION PEOPLE

- You're continuing to see things in terms of race, partition, selection and grouping: A racist point of view.  ONE HOLOCAUST -  6 MILLION JEWS with 5 million other guys.

*Why would you be encouraging people to still see arguments in terms of race if not other than you want to capitalize on your own racism, prejudice and the suffering of others?*",t3_9zp71,t1_c0f71mi,False,1257067381,t5_2cneq,t1_c0f72io,True,11,PartyMember275549,0,0,0,,,1426086469
c0f72p6,politics,,0,True,"Dude Europe as a whole towards itself acts the same way as the US does in terms of nationalism. This is why the US gets pissed of at Europeans, they act like smug douchebags.",t3_9zsc2,t1_c0f6ri4,False,1257068097,t5_2cneq,t1_c0f72p6,False,0,truco,0,0,0,,,1426086471
c0f73j4,IAmA,,3,True,"Everything you see in eastern europe will be tame compared to central asia from what ive heard. Riga is Amazing but its a fucking tourist hotspot now that you can get there from england for 20 pounds. Its cheap and cheerful though. Belarus was so depressing. So very very soviet looking. Just grey everywhere. The people are really friendly but really poor. Theres a really really sweet military memorial in brest (from memory). It has to be seen to be believed its massive. Ukraine is like russia from what ive been told. They were friendly and reasonably modern. The black sea is nice. I went to my families ancestral home there so it was amazing for me. I didnt go to transnistria. I wasnt allowed in and i havent heard great things about it. At the time it was recommended that australians not go there, so i skirted it. Chisinau is depressing visually but i had so much fun there. Moldovan girls are amazingly good looking and they dont even realise it. Moldova is very poor. Romania is nice enough, pretty country. Bulgaria wasnt for me. People werent very nice and the place wasnt pretty or interesting to me. Then i went to greece after that and then worked my way up through Macedonia, Serbia, Bosnia and flew back to england from croatia. In pretty much everyplace id find a local bar and have no problems talking to someone. I went to this guys farm in Latvia and we shot AK-47 at bottles, i played cards with old men on the train. Ukraine was by far my favourite, but my great great great grandfather is a very famous painter from the region so when they found out why i was there, to visit his house and museum they treated me like a prodigal son.I had a great time. If you have any specific questions hit me up but really it sounds like you know what you're doing. Oh belarus, moldova and bulgaria are still very much on the bribe system as well. I didnt run into any problems though. ",t3_9zmxj,t1_c0f739k,False,1257071612,t5_2qzb6,t1_c0f73j4,False,3,big80smullet,0,0,0,,,1426086481
c0f73ja,politics,,4,True,"The UK uses proportional representation in european elections.

Also, something to watch is constituencies. Thanks to proportional representation and the way constituencies are drawn, votes in less populated constituencies in Spain have up to 10 times more value than votes in the highest population constituencies (such as Madrid). Still, I think proportional representation is a lot better.",t3_9zu9j,t1_c0f73du,False,1257071635,t5_2cneq,t1_c0f73ja,False,4,charlienovember,0,0,0,,,1426086481
c0f750s,worldnews,,-1,True,"&gt; any major news media outlet reporting this?

By 'major' you mean english speaking?

Checks, Russians and Poles are reporting it...

And as of a moment ago [NYT](http://www.nytimes.com/2009/11/01/world/europe/01ukraine.html?_r=1&amp;scp=2&amp;sq=ukraine&amp;st=cse) is reporting it too, though they are downplaying it... Slovaks and Poles are on the verge of closing the borders down after sending aid.

The Above top secret is particuarily good thread with updates coming in minute by minute.",t3_9zugj,t1_c0f73sd,False,1257078390,t5_2qh13,t1_c0f750s,True,-1,apparatchik,0,0,0,,,1426086502
c0f754p,worldnews,,11,True,"Yes good question, how reliable is it. I remember when the swine flu just broke out in Mexico. We were having wiiiild stories go around. Wait, let me dig it up. [Here:](http://news.bbc.co.uk/2/hi/talking_point/8018428.stm)
&gt;I work as a resident doctor in one of the biggest hospitals in Mexico City and sadly, the situation is far from ""under control"". As a doctor, I realise that the media does not report the truth. Authorities distributed vaccines among all the medical personnel with no results, because two of my partners who worked in this hospital (interns) were killed by this new virus in less than six days even though they were vaccinated as all of us were. The official number of deaths is 20, nevertheless, the true number of victims are more than 200. I understand that we must avoid to panic, but telling the truth it might be better now to prevent and avoid more deaths.

So yeah, I have no idea what to believe, when even the BBC has been spreading rumors that turned out to be bull during the last sudden outbreak. In my country, the media isn't saying a word about what's going on in Ukraine by the way, and it really sucks. Ukraine is seen as completely foreign in Western Europe so they're not bothering to report on it it seems.",t3_9zugj,t1_c0f7514,False,1257078827,t5_2qh13,t1_c0f754p,False,11,accountt1234,0,0,0,,,1426086503
c0f755y,guns,,2,True,Yes it is a service pistol. I have one in 9mm from Germany. It is the best pistol I owe and I am looking to buy another one. It is a bit hard to conceal because it has a big frame. I think the .40 is an American model. Also the 9mm saw a lot of military service in the European armies. Oh look it is laying on my desk right now. I fondle it often.,t3_9zrbv,t1_c0f6l7q,False,1257078969,t5_2qhc8,t1_c0f755y,False,2,[deleted],0,0,0,,,1426086504
c0f76mn,reddit.com,,7,True,"I am not a specialist in U.S. law by far, but in (most of) Europe, everyone must be able to identify themselves when requested to do so by the police or supervisory officials. Anyway, what are you gaining by refusing to state your name? They'll learn it sooner or later, and they sure as hell won't give up before they do.  
edit: Just found [this Supreme Court ruling](http://www.chat11.com/Larry_Hiibel_Required_To_Provide_Name_To_Cops) stating that *""anyone stopped by the police, upon the police having any suspicion of a crime having been committed, or about to be committed, to have to provide their name to police*"", which is applicable in 21 states.",t3_9zth0,t1_c0f75lw,False,1257084254,t5_6,t1_c0f76mn,True,7,glinsvad,0,0,0,,,1426086521
c0f777z,worldnews,,4,True,"&gt; I am sure you people in Europe would be glad to drop thermonuclear bomb on us here.

DO YOU KNOW HOW MUCH THOSE COST?",t3_9zugj,t1_c0f74jk,False,1257085936,t5_2qh13,t1_c0f777z,False,4,rsynnott,0,0,0,,,1426086529
c0f77gh,politics,,4,True,"&gt;*The UK uses proportional representation in european elections*

And got two BNP MEPs this year. Something to look out for.",t3_9zu9j,t1_c0f73ja,False,1257086505,t5_2cneq,t1_c0f77gh,False,4,umbama,0,0,0,,,1426086533
c0f77w3,politics,,1,True,"American ""parties"" are more like loose coalitions of various factions than singular monolithic parties in the western European sense.  For example, the Republican party includes NeoCons, right libertarians, values voters, etc.  The Democratic party includes social democrats, left libertarians, greens, etc.  There are no set party manifestos - it's all determined with the ballot in primaries.

If idiots like OP would stop calling for a multiparty system that will realistically never happen (see Duverger's law and the US Constitution), and start voting in the primaries of the party they most generally align with, there is no problem.

self.politics needs more people with a political science background.  Badly.",t3_9zu9j,t3_9zu9j,False,1257087663,t5_2cneq,t1_c0f77w3,False,1,riboflavor,0,0,0,,,1426086538
c0f791w,worldnews,,1,True,"You're completely wrong.

""In relations with the Christian society, they were protected by kings, princes and bishops, because of the crucial services they provided in three areas: financial, administrative and as doctors."" 

""The Crusaders routinely attacked Jewish communities, and increasingly harsh laws restricted Jews from most economic activity and land ownership, leaving open only money-lending and a few other trades. Jews were subject to expulsions from England, France, and the Holy Roman Empire after 1300, with most of the population moving to Eastern Europe and especially Poland, which was uniquely tolerant of the Jews through the 1700s. By 1764, there were about 750,000 Jews in the Polish–Lithuanian Commonwealth. The worldwide Jewish population was estimated at 1.2 million.""

http://en.wikipedia.org/wiki/Jews#Middle_Ages:_Europe

&gt; If they truly had ""been a boon"" there would not have been tensions obviously.

Like I said, religious persecution and racism. People aren't always the most logical creatures.

&gt; Unless you are suggesting that any conflict is always the non-Jewish community's fault, and the Jewish community is always in the right?

I never even came close to suggesting this. Jews have done their fair share of terrible things, especially in the last ~60 years, but that doesn't mean they're always in the wrong either.

&gt; That sounds like a religious belief.

I don't know what this is supposed to mean, but to be clear I'm not in any way Jewish, not religious (atheist), and generally don't approve of anything the country of Israel has done since its inception.",t3_9z86m,t1_c0f67us,False,1257090330,t5_2qh13,t1_c0f791w,True,1,antimatter3009,0,0,0,,,1426086564
c0f7a4m,politics,,1,True,"What then would you say gives someone the right to live anywhere?  Your argument that Americans should give back land to Native Americans is faulty.  In a moral world, would it not be just to give back the land that someone lived on until a group of murderous Europeans came to rape and conquer their way through?  You imply that since modern Americans live on the land, they deserve it.  Because they paid someone for it who stole it from the people who lived there before.  You either need to decided that land conquered belongs to those who conquered or those who lived there before.  In both cases Israelis have a right to at least coexist with Palestinians in Israel.  IMO, modern Israelis have the right to live in Israel because of the fact that they have clear history there and the country was given to them by an international consensus.  The Arabs living in the region declared war upon Israel the last time they heard that there would be a two state solution.  If you believe that land conquered in war does not belong to the victor, then perhaps the U.S. should give Texas back to Mexico.

Also, the video was painful to watch.  It was like seeing Glenn Beck win an argument with Dan Quayle.",t3_9z69j,t1_c0f6dxl,False,1257092331,t5_2cneq,t1_c0f7a4m,False,1,ayton,0,0,0,,,1426086568
c0f7abn,food,,0,True,A lot of Europeans simply don't drink tap water.,t3_9zs0p,t1_c0f77dl,False,1257092682,t5_2qh55,t1_c0f7abn,False,0,londonzoo,0,0,0,,,1426086571
