author,ups,subreddit,downs,gilded,score_hidden,author_flair_css_class,distinguished,author_flair_text,body,archived,parent_id,score,id,retrieved_on,created_utc,name,controversiality,edited,link_id,subreddit_id
poco,1,technology,0,0,False,,,,"Please provide an example.

Yes, the philosophy is a bit on the extreme, but it is difficult to find a real monopoly that wasn't assisted by the government to get there.  Intel doesn't really have a monopoly any more than Apply has a monopoly on iPods or Microsoft has a monopoly on Windows or I have a monopoly on my urine.  We all have a monopoly on what we produce, the EU only goes after those that are successful.
",True,t1_c09jn29,1,c09k1nx,1425969495,1242265461,t1_c09k1nx,0,True,t3_8k3ht,t5_2qh16
[deleted],1,AskReddit,0,0,False,,,,"Thats a good idea. From what I've found, there are no ferries directly to Beirut. Only Syria. And the yeah, I would need to get to Cyprus first.

Visas should be ok. According to this website,
http://europa.eu/abc/travel/doc/index_en.htm , I won't need a visa for Europe. I'll probably have to pay @ Cyrpus and Syria. I can cross into Lebanon pretty easily, so no payment there.
",True,t1_c09jnan,1,c09k2vy,1425969516,1242268529,t1_c09k2vy,0,False,t3_8k68w,t5_2qh1i
xhanjian,-2,programming,0,0,False,,,,EU believe Wintel is the best ATM on the earth.,True,t3_8k3ji,-2,c09k3ho,1425969516,1242270175,t1_c09k3ho,0,False,t3_8k3ji,t5_2fwo
missdingdong,3,worldnews,0,0,False,,,,"To be fair, the door swings both ways.  Here is a list of demands made upon the Pope by Jews:

Jews have pointed out that the children left with Catholic churches throughout Europe during the reign of the Nazis should be told their true ethnic/religious history so they can decide for themselves what religion to follow.  According to these Jews, this should happen through the guidance of the Pope encouraging the Catholic Church to convey this information.

Jews have demanded that the Society of Saint Pius X has to change their views before relations between Catholics and Jews improve.  They have also demanded that Bishop Williamson's excommunication not be nullified, which clearly shows either their ignorance or disinterest about what is an excommunicable offense.  Michael Ben Ari , a member of the Knesset parliament from the right-wing National Union party has demanded the Pope apologize for antisemitism by the Catholic Church throughout the centuries.  Jews have demanded that the Church return relics in its possession that they claim belong to them.

There are undoubtedly more, but that's all the time I'm putting into investigating what's available that relates to this.",True,t1_c09jsxk,3,c09k3vf,1425969520,1242271088,t1_c09k3vf,0,False,t3_8k4kd,t5_2qh13
MarkByers,0,technology,0,0,False,,,,"Why only give it to AMD customers? The ones who lost out most are those that *couldn't* become AMD customers because AMD were unable to meet their requirements, so they were forced to choose Intel. All this money that the EU receive was originally Intel's customers' money. The money was stolen from people who ended up being forced to buy Intel because of their illegal business practices. In my opinion it deserves to be given back to the people it was stolen from, so they can choose to respend it on something actually worth paying for. If you have to name someone second in line for the money, I'd pick AMD shareholders, not their customers. AMD shareholders also lost a lot from this. AMD customers also lost something, but it pales into insignificance when you consider the other parties that have lost much more.",True,t1_c09jmlm,0,c09k6vy,1425969561,1242279004,t1_c09k6vy,0,True,t3_8k3ht,t5_2qh16
fforw,3,programming,0,0,False,,,,"What is wrong with you Americans? When a dope dealer gets life you're all ""do the crime, do the time"" but when the EU expects lawful behavior of your companies it's a total outrage.

We're talking about an illegally sustained 80% majority of a 150 billion EUR market for the years in question here. They could have been fined 4 or 5 billion if the normal rules ( [German article](http://www.spiegel.de/wirtschaft/0,1518,624575,00.html) ) applied.

As it is now they only had to pay 4 to 5% of the ""deed-related turnover"". For price fixing, the fine is normally around 20%.

You should be outraged that the US government is *not* applying anti-trust laws.",True,t1_c09k3ho,3,c09ka6b,1425969602,1242291042,t1_c09ka6b,0,True,t3_8k3ji,t5_2fwo
fforw,-1,programming,0,0,False,,,,"Then get the fuck out! No one needs you brits sabotaging everything. if you don't like the EU, leave it.",True,t1_c09jldp,-1,c09kadz,1425969605,1242292004,t1_c09kadz,0,False,t3_8k3ji,t5_2fwo
[deleted],1,reddit.com,0,0,False,,,,"When I was 19 I got thrown out of my parents house and told to survive.  Have to say it worked out pretty well though.  I ended up getting a good job which lead to me becoming a systems engineer and then moving to Europe.  Today I'm 24, make €55k a year, and really enjoy life.  Start living for today and don't think to far in the future, I'm living proof that you never really know where or how it (life) will go.  ",True,t3_8kcxe,1,c09kben,1425969618,1242297035,t1_c09kben,0,False,t3_8kcxe,t5_6
miasma66,1,AskReddit,0,0,False,,,,"Definitely. Emergency care is what the NHS does best.

I came rather closer than I'd prefer to dying (like if I hadn't gone to hospital when I did I'd have snuffed it in a couple of hours, ended up in ICU &amp; everything) a couple of years ago, and the care I received was outstanding.

Fuck knows what would have happened if someone needed to confirm my medical insurance details before they'd treated me!

As I've posted before, the NHS is the largest employer in Western Europe, so something of a bureaucratic nightmare can fairly be expected.

There is a whole other argument about what NuLab (aka Thatcher 2.0) have done to fuck the NHS up, with their amazing target driven culture resulting in the apparent employment of more pencil pushers than frontline healthcare workers, but as it stands it's still a better system than that over the pond.

Aneurin Bevan is one of my heroes.",True,t1_c09kba7,1,c09kbgc,1425969619,1242297278,t1_c09kbgc,0,False,t3_8kbh1,t5_2qh1i
officemonkey,2,AskReddit,0,0,False,,,,"The reason why coins are less maligned in Canada is because the Looney and the Tooney are actually worth money. Same thing in Europe. The 2 Euro Coin is worth 2.70 USD. You start to respect change when you look in your pocket and realize you've got 20 bucks in there.

But pennies pretty much are a problem everywhere. In the EU, they have 1 and 2 Euro cent coins. They're little, they're both copper-colored, and unless you're careful, you end up with a boat-load of them every day. By the time I had figured out how to make change quickly, I had amassed such a collection that I couldn't get rid of them.",True,t1_c09k6uc,2,c09kbmf,1425969624,1242298121,t1_c09kbmf,0,False,t3_8k9t4,t5_2qh1i
somefool,2,WTF,0,0,False,,,,"My mother once had me call the cops because, while she was at work, a band of kids and teenagers started harassing my kid brother and me, by throwing rocks at our house (breaking one of our plastic gutters but thankfully no windows). I asked if there wasn't a cop around to drive by and scare them away, but they ended up sending me officers working with risks of immediate bodily harm. They inspected the damage, but informed me that it wasn't their job to deal with those issues, really, and they left. 
A few weeks after that, we learnt through one of the involved teenagers that the cops still took the time to drive around the block to track the band of kids and to give them a proper lengthy dressing down (cause vandalism ain't ok, all that). 

I know it's minor, not recent, and in Europe, but I'm still grateful for the time they took :) ",True,t1_c09k21m,2,c09kcgp,1425969634,1242301716,t1_c09kcgp,0,False,t3_8k839,t5_2qh61
heeb,-1,programming,0,0,False,,,,"&gt; It's quite possible not because the EU but because of the Schengen that you can be with your wife. A lot of people mix these to together with EU.

You don't have the foggiest idea what you are talking about, do you? We don't even *live* in a Schengen country: the UK is *not* Schengen area.

You think, after *years* of research into possibilities of how we could be together, I wouldn't know the difference?!?

It's because of *EU LAW* that we can be together. Nothing more, nothing less.

It has nothing to do with Schengen.

&gt; De facto the EU doesn't even exist yet but that's another story.

I repeat: You don't have the foggiest idea what you are talking about, do you? How can the EU ""not exist"", yet have the laws in place that allow my wife and I to be together? Laws that member countries MUST adhere to (thank goodness)?

&gt; Besides there's not much democracy left in the EU. If you get to know the legislative process you will know what I'm talking about.

Countries can only become EU members if they are stable democracies.

&gt; As for stability - the EU has spent the western economies into debt so stability is just a mirage (similar to the US growth 2001-2009). Prepare to see your dreams go bust in the coming years. The governments have grown so they are now an even greater burden on the people.

You don't have the foggiest idea, don't you? You think companies don't like the free movement of capital, people, etc., the possibilities to invest in other parts of the EU? I, as an EU citizen, could start a business in any EU country, no problem. I can (and have, multiple times in multiple EU countries!) take up employment anywhere within the EU, without any unnecessary paperwork to be done, or working permits, and all that rubbish.

It's more the *banks* and other commercial financial institutions that have put us in trouble, not the EU.

&gt; P.S. I'm not whining - my country got a lot of money from richer ones so I personally benefited.

I think in the end, everybody benefits from that. I am Dutch, so my country probably contributed much to other, poorer, EU member states. I am *glad* we did. I am *happy* that at least part of the tax I paid in Holland (and now in the UK) goes to poorer countries that need it. Why? Not only because I wish well on other people (I do), but also because it actually creates opportunities for ""us"". Companies from richer countries start investing in poorer countries, creating jobs, bringing wealth and well-being. *Everybody* benefits in the end.

&gt; The issue though is it was robbery for the other countries,

See above. I, as a citizen of such an ""other country"", disagree. I do not feel robbed.

&gt; also undemocratic because nobody asked the nations (Actually they asked in the beginning but since they said ""no"" now they do it without asking, lol). So much for democracy.

Well, there are parliaments in place... you're free to vote differently in the next European Elections! How is that *not* democracy?

&gt; My personal opinion is that it is a Soviet Union in the making

Don't make me laugh... Free trade? Free movement of people and capital? Freedom to start your business in Belgium, France, Germany, Poland, where ever? You compare that to what happened in the Soviet Union? You don't have the foggiest, do you?

The more I hear rubbish like this about the EU, the more I like it (the EU, that is, not the rubbish)!

Oh, the ignorance of people...

&gt; and it will fall

That would be a black day in history all right...",True,t1_c09joe7,-1,c09kdgi,1425969646,1242305338,t1_c09kdgi,0,True,t3_8k3ji,t5_2fwo
psykotic,3,gaming,0,0,False,,,,"Yes, NVIDIA's industry-standard marketing practices are extraordinarily evil, and Intel's OEM ""marketing"" practices, for which they were just fined in the EU, are perfectly alright.",True,t1_c09kd65,3,c09kdhu,1425969646,1242305478,t1_c09kdhu,0,True,t3_8kd7z,t5_2qh03
tempreddit,1,programming,0,0,False,,,,"Check your documents (Passport or drivers license, Check who gave you the document it should be in the footer). This should tell you the EU doesn't exist in legal sense. Maastricht means nothing if the EU isn't a body from the point of view of law.

Why undemocratic? Legislative process. Who cares about voting if our democratically elected representatives aren't the most important force in the process. Check who makes most of the laws.

Not to mention that the president of the EU will not be elected democratically. With the Lisbon treaty the EU will come into place ergo all member countries lose soveregnity.

As for free-trade. Free-trade? With a regulation what is the correct curvature of the banana (true story)? Don't joke. Or maybe it is a free market which makes a 60% fee for Chinese candles to protect european business. 

**The truth is that you've been so brainwashed by the propaganda** (the EU spends billions of Euros per year for commercials, billboards, propaganda programs) that you can't see what it has become over the years. The image of the flag with stars has been ingrained in your brain as a symbol of success for so long that you didn't notice how much the once **great concept** has been corrupted into a creeping total socialist state. (By the way **Schumann must be rolling in his grave**)

Oh well, but maybe you need to learn the hard way because **you never lived in socialism** while me and my family did so I know when I see one.

It's funny that you should talk of ignorance by the way.",True,t1_c09kdgi,1,c09kgiu,1425969688,1242312711,t1_c09kgiu,0,True,t3_8k3ji,t5_2fwo
hs4x,1,reddit.com,0,0,False,,,,"Near the end, the outside of the machine can be seen to say ""2,5""; in EU, ""2,5"" is how we'd write ""2.5"" -- I'd wager that is minutes, not hours.

&gt; for the most part to mix and rise that dough would take a couple of hours

I thought the same thing.  Except that the dough is probably simply unrisen.  not a very appealing pie, but edible.",True,t1_c09kgej,1,c09kgql,1425969691,1242313115,t1_c09kgql,0,False,t3_8kfcj,t5_6
dreadsword,1,politics,0,0,False,,,,"Excerpts from the post: 

The whole thing is awkward. The three-strikes concept loses all of its credibility without judicial weight behind the assertion of guilt; but, to involve the courts in every case places far too much weight on the judicial system. There isn’t any way around it in our traditional legal framework, which is why everyone’s commenting on the legislation without offering any alternatives.

...

In many ways, the two legal situations compare very well. Where I live, red light cameras confer a fine - but no legal penalty. This is a nod to the fact that anyone could be driving a vehicle captured by camera, but that ultimately its the vehicle owner’s responsibility to choose who they give access to the vehicle, what they do with it, and who pays a fine. Should someone receiving a camera ticket wish to dispute it, they can do so via the traditional court system. An internet equivalent would acknowledge the responsibility of the owner of an IP address (the account holder), without assuming that they are the individual actually doing the downloading (driving).

The key difference is that France’s internet law involves disconnection - akin to the police seizing your car after three camera tickets even though its your kid driving it. That’s the part that bother’s the EU too - disconnection without judicial process denies people the right to communicate for what may be arbitrary reasons. So - what about switching France’s law from disconnection to fines, and backing it with a legal framework similar to that used around camera tickets? Three strikes, then fines, graded to encourage account holders to proactively manage their network, supported by education (’Network Security for Residential Internet Customers”), with the option to plead “not guilty” at any point and engage the judicial process? Disconnection could follow unpaid fines - but in response to an account holder being guilty of not settling fines (by either paying or taking the case through due process) - not because they’ve been accused of file sharing.",True,t3_8kgj7,1,c09kh4o,1425969695,1242313818,t1_c09kh4o,0,False,t3_8kgj7,t5_2cneq
piderman,2,programming,0,0,False,,,,"This makes me curious if it will show Metric results by default if you live in Europe. I'm assuming yes, but I really can't wait to try it out myself.",True,t3_8kdhn,2,c09kizx,1425969716,1242316940,t1_c09kizx,0,False,t3_8kdhn,t5_2fwo
heeb,1,programming,0,0,False,,,,"&gt; Check your documents (Passport or drivers license, Check who gave you the document it should be in the footer). This should tell you the EU doesn't exist in legal sense.

What utter rubbish... My passport wasn't, for instance, made by the council of the town where I now live. Nor was it made by the Queen of the Netherlands. Does that mean they all do not exist, in a legal sense?

The EU has laws in place, which *must* be followed by its member states. One of those laws *enables my wife to live with me*.

Quite a feat for a non-existing entity!

&gt; Maastricht means nothing if the EU isn't a body from the point of view of law.

Get some education. Your ignorance is nauseating.

&gt; Why undemocratic? Legislative process. Who cares about voting...

I do.

&gt; ...if our democratically elected representatives aren't the most important force in the process. Check who makes most of the laws.

I'm sure you're gonna tell me.

I just know that some of the most fundamental laws of the EU have enabled me (and are still enabling me) to:

a) exercise my fundamental right to live with my family; and

b) work and live, without any need for any work or resident permit I might add, in any EU country of my choosing.

&gt; Not to mention that the president of the EU will not be elected democratically. With the Lisbon treaty the EU will come into place

Erm, the EU *has* been in existence for quite some years now...

&gt; ergo all member countries lose soveregnity.

The sad fact that I can't live with my family in my *own* country (the Netherlands) is exactly because EU law doesn't apply *there for me as a national*. That's national law, ""sovereignty"", for you. I'm sure this is hard to understand for simpletons like yourself, but basically, for any EU citizen who is in *another* EU country, EU law (thank goodness) applies. If a EU citizen is in their *own* country, *national* law applies. So, in my (somewhat xenophobic) home country, I can't live with my family, because of friggin' national, ""sovereign"", laws. I can, however, live and work in *every other EU country of my choosing*, because then, thank goodness, EU law rules.

&gt; As for free-trade. Free-trade? With a regulation what is the correct curvature of the banana (true story)? Don't joke. Or maybe it is a free market which makes a 60% fee for Chinese candles to protect european business.

I'm sure there are many things that are weird, bad, awkward about the EU. I'm sure there are equally many weird, bad, awkward things to be found in national law (of whatever country) as well.

For me, the EU made my family possible. It made living and working in other EU countries possible. And not only possible: *a breeze*.

&gt; The truth is that you've been so brainwashed by the propaganda (the EU spends billions of Euros per year for commercials, billboards, propaganda programs) that you can't see what it has become over the years.

I'm sorry, I have never ever seen any commercial, billboard, nor propaganda programs about the EU, so I can't help you there...

&gt; The image of the flag with stars has been ingrained in your brain as a symbol of success for so long that you didn't notice how much the once great concept has been corrupted into a creeping total socialist state.

Do I need to repeat myself? How do free trade, freedom of movement of people and capital, freedom to start your business anywhere within the EU, go together with ""a creeping total socialist state""? Sounds more like *capitalism* to me...

&gt; (By the way Schumann must be rolling in his grave)

The composer? The politician has only one ""n""...

&gt; Oh well, but maybe you need to learn the hard way because you never lived in socialism

And all the while you have been telling me I do, right now...

&gt; while me and my family did so I know when I see one.

Please elaborate.

&gt; It's funny that you should talk of ignorance by the way.

Only because you display it so dramatically...",True,t1_c09kgiu,1,c09kk32,1425969732,1242318680,t1_c09kk32,0,False,t3_8k3ji,t5_2fwo
omegian,1,AskReddit,0,0,False,,,,"&gt; Money taken out of my check today is going to retired people today.

Not entirely true -- payroll tax surplus today is being flipped over to the general budget to narrow the budget deficit. Sadly, we're still $1 trillion in the hole.

&gt; It's a reasonable assumption that if birthrates continue to fall 1 generation is going to pay SS for their working life, and receive nothing in retirement.

Thanks to abortions and other birth control, birth rates are already below replacement rates (~ 1.9 children / women) on aggregate in the united states. If it weren't for immigration over the past 40 years, that pyramid would have already collapsed.

Note that many European nations without net immigration and even larger social programs have collapsing / declining demographics.
",True,t1_c09kk0g,1,c09kls8,1425969758,1242321455,t1_c09kls8,0,False,t3_8kgjj,t5_2qh1i
[deleted],20,AskReddit,0,0,False,,,,"The Northern Europeans seem so happy compared to Americans.  Iceland, Sweden, Norway, Finland, Denmark, Netherlands, etc..",True,t3_8khs4,20,c09korw,1425969791,1242326194,t1_c09korw,0,False,t3_8khs4,t5_2qh1i
[deleted],1,politics,0,0,False,,,,"Great points.  Costs are relative, and it's pretty unfair to judge them without taking wages and cost of living into account.  Looking at costs solely for expatriates is even more pigeon-holed, as it would factor in costs of exchange rates and consumer confidence.

A question for argoff:  How can Norway be ranked as one of the most expensive cities in Europe,  when it is - in fact - not a city at all?  Your comments lead me to believe your statistics are entirely made up.",True,t1_c09kobv,1,c09kp98,1425969799,1242326997,t1_c09kp98,0,False,t3_8kekh,t5_2cneq
